BEGIN:VCALENDAR
VERSION:2.0
PRODID:ics.py - http://git.io/lLljaA
BEGIN:VEVENT
BEGIN:VALARM
ACTION:DISPLAY
DESCRIPTION:
TRIGGER:-P1D
END:VALARM
CATEGORIES:VRATAM
DESCRIPTION:Astronomical duration of Sashti (Shukla).
DTEND:20260422T172004Z
DTSTART:20260421T195020Z
SUMMARY:⏳ Sashti (Shukla)
UID:india-te-202604220120-Sashti(Shukla)@vratam
END:VEVENT
BEGIN:VEVENT
DTSTART;VALUE=DATE:20260509
CATEGORIES:PANCHANGAM
DESCRIPTION:Vaishakhamu Krishna Paksham Saptami  (09.05.2026)\n\nSamvatsaram: Parabhava Samvatsaram\nAyanam: Uttarayanam\nRuthuvu: Vasantha Ruthuvu\nMasam: Vaishakhamu\nPaksham: Krishna Paksham\nTithi: upto 2.03 PM Saptami\, thereafter Ashtami\nVaram: Shanivaram\nNakshatram: upto 12.07 AM Shravana (2 Padam)\, and then Dhanishta\nYogam: Shukla\nKaranam: Bavai\nRahu Kalam: 8.59 AM to 10.36 AM\nYamagandam: 1.49 PM to 3.25 PM\nDurmuhurtham: 5.46 AM to 6.37 AM\nAbhijit Muhurtham: 11.46 AM to 12.38 PM\nSuryodayam: 5.46 AM\nSuryastamayam: 6.38 PM\nChandrodayam: 12.14 AM\nChandrashtamam: Mithunam\nTaddinam Tithi: Ashtami\nPradesham: Hyderabad (Telugu Style)
SUMMARY:Vaishakhamu Krishna Paksham Saptami  (09.05.2026)
UID:india-te-2026-05-09@panchangam
END:VEVENT
BEGIN:VEVENT
DTSTART;VALUE=DATE:20260619
CATEGORIES:PANCHANGAM
DESCRIPTION:Jyeshthamu Shukla Paksham Panchami  (19.06.2026)\n\nSamvatsaram: Parabhava Samvatsaram\nAyanam: Uttarayanam\nRuthuvu: Grishma Ruthuvu\nMasam: Jyeshthamu\nPaksham: Shukla Paksham\nTithi: upto 5.00 PM Panchami\, thereafter Shashti\nVaram: Shukravaram\nNakshatram: upto 10.45 AM Ashlesha (4 Padam)\, and then Makha\nYogam: Harshana\nKaranam: Bavai\nRahu Kalam: 10.38 AM to 12.17 PM\nYamagandam: 3.34 PM to 5.13 PM\nDurmuhurtham: 8.20 AM to 9.13 AM\, 12.43 PM to 1.36 PM\nAbhijit Muhurtham: 11.51 AM to 12.43 PM\nSuryodayam: 5.42 AM\nSuryastamayam: 6.52 PM\nChandrodayam: 9.56 AM\nChandrashtamam: Dhanu\nTaddinam Tithi: Panchami\nPradesham: Hyderabad (Telugu Style)
SUMMARY:Jyeshthamu Shukla Paksham Panchami  (19.06.2026)
UID:india-te-2026-06-19@panchangam
END:VEVENT
BEGIN:VEVENT
DTSTART;VALUE=DATE:20260729
CATEGORIES:PANCHANGAM
DESCRIPTION:Ashadhamu Shukla Paksham Pournami 🌕 (29.07.2026)\n\nSamvatsaram: Parabhava Samvatsaram\nAyanam: Dakshinayanam\nRuthuvu: Grishma Ruthuvu\nMasam: Ashadhamu\nPaksham: Shukla Paksham\nTithi: upto 8.05 PM Pournami\, thereafter Padyami\nVaram: Budhavaram\nNakshatram: upto 4.21 PM Uttarashada (3 Padam)\, and then Shravana\nYogam: Preethi\nKaranam: Vishti\nRahu Kalam: 12.22 PM to 1.59 PM\nYamagandam: 7.31 AM to 9.08 AM\nDurmuhurtham: 10.13 AM to 11.04 AM\nAbhijit Muhurtham: 11.56 AM to 12.48 PM\nSuryodayam: 5.54 AM\nSuryastamayam: 6.50 PM\nChandrodayam: 6.51 PM\nChandrashtamam: Mithunam\nTaddinam Tithi: Pournami\nPradesham: Hyderabad (Telugu Style)
SUMMARY:Ashadhamu Shukla Paksham Pournami 🌕 (29.07.2026)
UID:india-te-2026-07-29@panchangam
END:VEVENT
BEGIN:VEVENT
DTSTART;VALUE=DATE:20261103
CATEGORIES:PANCHANGAM
DESCRIPTION:Ashwayujamu Krishna Paksham Navami  (03.11.2026)\n\nSamvatsaram: Parabhava Samvatsaram\nAyanam: Dakshinayanam\nRuthuvu: Sarad Ruthuvu\nMasam: Ashwayujamu\nPaksham: Krishna Paksham\nTithi: upto 11.55 AM Navami\, thereafter Dashami\nVaram: Mangalavaram\nNakshatram: upto 4.06 AM Makha (1 Padam)\, and then Pubba\nYogam: Shukla\nKaranam: Garajai\nRahu Kalam: 2.51 PM to 4.17 PM\nYamagandam: 9.07 AM to 10.33 AM\nDurmuhurtham: 7.47 AM to 8.32 AM\, 10.50 AM to 11.36 AM\nAbhijit Muhurtham: 11.36 AM to 12.22 PM\nSuryodayam: 6.15 AM\nSuryastamayam: 5.43 PM\nChandrodayam: 12.51 AM\nChandrashtamam: Makaram\nTaddinam Tithi: Dashami\nPradesham: Hyderabad (Telugu Style)
SUMMARY:Ashwayujamu Krishna Paksham Navami  (03.11.2026)
UID:india-te-2026-11-03@panchangam
END:VEVENT
BEGIN:VEVENT
DTSTART;VALUE=DATE:20261213
CATEGORIES:PANCHANGAM
DESCRIPTION:Margashiramu Shukla Paksham Chavithi  (13.12.2026)\n\nSamvatsaram: Parabhava Samvatsaram\nAyanam: Dakshinayanam\nRuthuvu: Hemantha Ruthuvu\nMasam: Margashiramu\nPaksham: Shukla Paksham\nTithi: upto 4.48 PM Chavithi\, thereafter Panchami\nVaram: Bhanuvaram\nNakshatram: upto 6.58 AM Uttarashada (4 Padam)\, and then Shravana\nYogam: Dhruva\nKaranam: Vishti\nRahu Kalam: 4.19 PM to 5.43 PM\nYamagandam: 12.10 PM to 1.33 PM\nDurmuhurtham: 4.14 PM to 4.58 PM\nAbhijit Muhurtham: 11.47 AM to 12.32 PM\nSuryodayam: 6.36 AM\nSuryastamayam: 5.43 PM\nChandrodayam: 9.51 AM\nChandrashtamam: Mithunam\nTaddinam Tithi: Chavithi\nPradesham: Hyderabad (Telugu Style)
SUMMARY:Margashiramu Shukla Paksham Chavithi  (13.12.2026)
UID:india-te-2026-12-13@panchangam
END:VEVENT
BEGIN:VEVENT
DTSTART;VALUE=DATE:20260307
CATEGORIES:PANCHANGAM
DESCRIPTION:Phalgunamu Krishna Paksham Chavithi  (07.03.2026)\n\nSamvatsaram: Vishvavasu Samvatsaram\nAyanam: Uttarayanam\nRuthuvu: Shishira Ruthuvu\nMasam: Phalgunamu\nPaksham: Krishna Paksham\nTithi: upto 7.17 PM Chavithi\, thereafter Panchami\nVaram: Shanivaram\nNakshatram: upto 11.58 AM Chitta (4 Padam)\, and then Swathi\nYogam: Vriddhi\nKaranam: Bavai\nRahu Kalam: 9.28 AM to 10.57 AM\nYamagandam: 1.56 PM to 3.25 PM\nDurmuhurtham: 6.30 AM to 7.17 AM\nAbhijit Muhurtham: 12.03 PM to 12.50 PM\nSuryodayam: 6.30 AM\nSuryastamayam: 6.24 PM\nChandrodayam: 9.48 PM\nChandrashtamam: Meenam\nTaddinam Tithi: Chavithi\nPradesham: Hyderabad (Telugu Style)
SUMMARY:Phalgunamu Krishna Paksham Chavithi  (07.03.2026)
UID:india-te-2026-03-07@panchangam
END:VEVENT
BEGIN:VEVENT
DTSTART;VALUE=DATE:20260417
CATEGORIES:PANCHANGAM
DESCRIPTION:Vaishakhamu Krishna Paksham Amavasya 🌑 (17.04.2026)\n\nSamvatsaram: Parabhava Samvatsaram\nAyanam: Uttarayanam\nRuthuvu: Vasantha Ruthuvu\nMasam: Vaishakhamu\nPaksham: Krishna Paksham\nTithi: upto 5.21 PM Amavasya\, thereafter Padyami\nVaram: Shukravaram\nNakshatram: upto 12.38 PM Revathi (3 Padam)\, and then Aswini\nYogam: Vaidhriti\nKaranam: Chatushpada\nRahu Kalam: 10.41 AM to 12.15 PM\nYamagandam: 3.24 PM to 4.58 PM\nDurmuhurtham: 8.29 AM to 9.19 AM\, 12.40 PM to 1.31 PM\nAbhijit Muhurtham: 11.50 AM to 12.40 PM\nSuryodayam: 5.58 AM\nSuryastamayam: 6.32 PM\nChandrodayam: 5.32 AM\nChandrashtamam: Simham\nTaddinam Tithi: Amavasya\nPradesham: Hyderabad (Telugu Style)
SUMMARY:Vaishakhamu Krishna Paksham Amavasya 🌑 (17.04.2026)
UID:india-te-2026-04-17@panchangam
END:VEVENT
BEGIN:VEVENT
DTSTART;VALUE=DATE:20260527
CATEGORIES:PANCHANGAM
DESCRIPTION:Jyeshthamu Shukla Paksham Ekadashi  (27.05.2026)\n\n🎉 SPECIAL: Ekadashi (Shukla)\nSamvatsaram: Parabhava Samvatsaram\nAyanam: Uttarayanam\nRuthuvu: Grishma Ruthuvu\nMasam: Jyeshthamu\nPaksham: Shukla Paksham\nTithi: upto 6.22 AM Ekadashi\, thereafter Dwadashi\nVaram: Budhavaram\nNakshatram: upto 6.40 AM Hasta (4 Padam)\, and then Chitta\nYogam: Vyatipata\nKaranam: Vishti\nRahu Kalam: 12.13 PM to 1.51 PM\nYamagandam: 7.19 AM to 8.57 AM\nDurmuhurtham: 10.02 AM to 10.54 AM\nAbhijit Muhurtham: 11.47 AM to 12.39 PM\nSuryodayam: 5.41 AM\nSuryastamayam: 6.45 PM\nChandrodayam: 3.30 PM\nChandrashtamam: Kumbham\nTaddinam Tithi: Dwadashi\nPradesham: Hyderabad (Telugu Style)
SUMMARY:Jyeshthamu Shukla Paksham Ekadashi  (27.05.2026)
UID:india-te-2026-05-27@panchangam
END:VEVENT
BEGIN:VEVENT
BEGIN:VALARM
ACTION:DISPLAY
DESCRIPTION:
TRIGGER:-P1D
END:VALARM
CATEGORIES:VRATAM
DESCRIPTION:Astronomical duration of Ekadashi (Shukla).
DTEND:20260227T170319Z
DTSTART:20260226T190356Z
SUMMARY:⏳ Ekadashi (Shukla)
UID:india-te-202602270033-Ekadashi(Shukla)@vratam
END:VEVENT
BEGIN:VEVENT
BEGIN:VALARM
ACTION:DISPLAY
DESCRIPTION:
TRIGGER:-P1D
END:VALARM
CATEGORIES:VRATAM
DESCRIPTION:Astronomical duration of Pradosham (Krishna).
DTEND:20260909T070119Z
DTSTART:20260908T091329Z
SUMMARY:⏳ Pradosham (Krishna)
UID:india-te-202609081443-Pradosham(Krishna)@vratam
END:VEVENT
BEGIN:VEVENT
DTSTART;VALUE=DATE:20260806
CATEGORIES:PANCHANGAM
DESCRIPTION:Ashadhamu Krishna Paksham Ashtami  (06.08.2026)\n\nSamvatsaram: Parabhava Samvatsaram\nAyanam: Dakshinayanam\nRuthuvu: Grishma Ruthuvu\nMasam: Ashadhamu\nPaksham: Krishna Paksham\nTithi: upto 6.53 PM Ashtami\, thereafter Navami\nVaram: Guruvaram\nNakshatram: upto 8.51 PM Bharani (2 Padam)\, and then Kruthika\nYogam: Ganda\nKaranam: Balavai\nRahu Kalam: 1.58 PM to 3.34 PM\nYamagandam: 5.56 AM to 7.33 AM\nDurmuhurtham: 1.38 PM to 2.30 PM\nAbhijit Muhurtham: 11.56 AM to 12.47 PM\nSuryodayam: 5.56 AM\nSuryastamayam: 6.47 PM\nChandrodayam: N/A\nChandrashtamam: Kanya\nTaddinam Tithi: Ashtami\nPradesham: Hyderabad (Telugu Style)
SUMMARY:Ashadhamu Krishna Paksham Ashtami  (06.08.2026)
UID:india-te-2026-08-06@panchangam
END:VEVENT
BEGIN:VEVENT
DTSTART;VALUE=DATE:20260916
CATEGORIES:PANCHANGAM
DESCRIPTION:Bhadrapadamu Shukla Paksham Panchami  (16.09.2026)\n\nSamvatsaram: Parabhava Samvatsaram\nAyanam: Dakshinayanam\nRuthuvu: Varsha Ruthuvu\nMasam: Bhadrapadamu\nPaksham: Shukla Paksham\nTithi: upto 8.59 AM Panchami\, thereafter Shashti\nVaram: Budhavaram\nNakshatram: upto 6.06 PM Vishakha (3 Padam)\, and then Anuradha\nYogam: Vaidhriti\nKaranam: Balavai\nRahu Kalam: 12.10 PM to 1.42 PM\nYamagandam: 7.35 AM to 9.07 AM\nDurmuhurtham: 10.08 AM to 10.57 AM\nAbhijit Muhurtham: 11.46 AM to 12.35 PM\nSuryodayam: 6.04 AM\nSuryastamayam: 6.17 PM\nChandrodayam: 10.29 AM\nChandrashtamam: Meenam\nTaddinam Tithi: Shashti\nPradesham: Hyderabad (Telugu Style)
SUMMARY:Bhadrapadamu Shukla Paksham Panchami  (16.09.2026)
UID:india-te-2026-09-16@panchangam
END:VEVENT
BEGIN:VEVENT
BEGIN:VALARM
ACTION:DISPLAY
DESCRIPTION:
TRIGGER:-P1D
END:VALARM
CATEGORIES:VRATAM
DESCRIPTION:Astronomical duration of Ekadashi (Shukla).
DTEND:20261121T010200Z
DTSTART:20261120T014609Z
SUMMARY:⏳ Ekadashi (Shukla)
UID:india-te-202611200716-Ekadashi(Shukla)@vratam
END:VEVENT
BEGIN:VEVENT
DTSTART;VALUE=DATE:20261011
CATEGORIES:PANCHANGAM
DESCRIPTION:Ashwayujamu Shukla Paksham Padyami  (11.10.2026)\n\nSamvatsaram: Parabhava Samvatsaram\nAyanam: Dakshinayanam\nRuthuvu: Sarad Ruthuvu\nMasam: Ashwayujamu\nPaksham: Shukla Paksham\nTithi: upto 9.31 PM Padyami\, thereafter Vidiya\nVaram: Bhanuvaram\nNakshatram: upto 11.14 PM Chitta (2 Padam)\, and then Swathi\nYogam: Vaidhriti\nKaranam: Kimstughna\nRahu Kalam: 4.28 PM to 5.57 PM\nYamagandam: 12.02 PM to 1.31 PM\nDurmuhurtham: 4.22 PM to 5.10 PM\nAbhijit Muhurtham: 11.39 AM to 12.26 PM\nSuryodayam: 6.08 AM\nSuryastamayam: 5.57 PM\nChandrodayam: 6.31 AM\nChandrashtamam: Kumbham\nTaddinam Tithi: Padyami\nPradesham: Hyderabad (Telugu Style)
SUMMARY:Ashwayujamu Shukla Paksham Padyami  (11.10.2026)
UID:india-te-2026-10-11@panchangam
END:VEVENT
BEGIN:VEVENT
DTSTART;VALUE=DATE:20261121
CATEGORIES:PANCHANGAM
DESCRIPTION:Karthikamu Shukla Paksham Ekadashi  (21.11.2026)\n\n🎉 SPECIAL: Ekadashi (Shukla)\nSamvatsaram: Parabhava Samvatsaram\nAyanam: Dakshinayanam\nRuthuvu: Sarad Ruthuvu\nMasam: Karthikamu\nPaksham: Shukla Paksham\nTithi: upto 6.32 AM Ekadashi\, upto 4.56 AM Dwadashi\, thereafter Trayodashi\nVaram: Shanivaram\nNakshatram: upto 7.30 AM Uttarabhadra (4 Padam)\, and then Revathi\nYogam: Siddhi\nKaranam: Vishti\nRahu Kalam: 9.12 AM to 10.37 AM\nYamagandam: 1.26 PM to 2.50 PM\nDurmuhurtham: 6.24 AM to 7.09 AM\nAbhijit Muhurtham: 11.39 AM to 12.24 PM\nSuryodayam: 6.24 AM\nSuryastamayam: 5.39 PM\nChandrodayam: 2.55 PM\nChandrashtamam: Simham\nTaddinam Tithi: Dwadashi\nPradesham: Hyderabad (Telugu Style)
SUMMARY:Karthikamu Shukla Paksham Ekadashi  (21.11.2026)
UID:india-te-2026-11-21@panchangam
END:VEVENT
BEGIN:VEVENT
DTSTART;VALUE=DATE:20260105
CATEGORIES:PANCHANGAM
DESCRIPTION:Pushyamu Krishna Paksham Vidiya  (05.01.2026)\n\nSamvatsaram: Vishvavasu Samvatsaram\nAyanam: Uttarayanam\nRuthuvu: Hemantha Ruthuvu\nMasam: Pushyamu\nPaksham: Krishna Paksham\nTithi: upto 9.57 AM Vidiya\, thereafter Thadiya\nVaram: Somavaram\nNakshatram: upto 2.01 PM Pushyami (3 Padam)\, and then Ashlesha\nYogam: Vishkambha\nKaranam: Garajai\nRahu Kalam: 8.10 AM to 9.34 AM\nYamagandam: 10.57 AM to 12.21 PM\nDurmuhurtham: 12.43 PM to 1.28 PM\nAbhijit Muhurtham: 11.59 AM to 12.43 PM\nSuryodayam: 6.47 AM\nSuryastamayam: 5.55 PM\nChandrodayam: 8.04 PM\nChandrashtamam: Dhanu\nTaddinam Tithi: Thadiya\nPradesham: Hyderabad (Telugu Style)
SUMMARY:Pushyamu Krishna Paksham Vidiya  (05.01.2026)
UID:india-te-2026-01-05@panchangam
END:VEVENT
BEGIN:VEVENT
DTSTART;VALUE=DATE:20260215
CATEGORIES:PANCHANGAM
DESCRIPTION:Maghamu Krishna Paksham Trayodashi  (15.02.2026)\n\nSamvatsaram: Vishvavasu Samvatsaram\nAyanam: Uttarayanam\nRuthuvu: Shishira Ruthuvu\nMasam: Maghamu\nPaksham: Krishna Paksham\nTithi: upto 5.05 PM Trayodashi\, thereafter Chaturdashi\nVaram: Bhanuvaram\nNakshatram: upto 8.29 PM Uttarashada (2 Padam)\, and then Shravana\nYogam: Vyatipata\nKaranam: Vanijai\nRahu Kalam: 4.50 PM to 6.17 PM\nYamagandam: 12.30 PM to 1.57 PM\nDurmuhurtham: 4.45 PM to 5.31 PM\nAbhijit Muhurtham: 12.07 PM to 12.53 PM\nSuryodayam: 6.42 AM\nSuryastamayam: 6.17 PM\nChandrodayam: 5.07 AM\nChandrashtamam: Mithunam\nTaddinam Tithi: Trayodashi\nPradesham: Hyderabad (Telugu Style)
SUMMARY:Maghamu Krishna Paksham Trayodashi  (15.02.2026)
UID:india-te-2026-02-15@panchangam
END:VEVENT
BEGIN:VEVENT
BEGIN:VALARM
ACTION:DISPLAY
DESCRIPTION:
TRIGGER:-P1D
END:VALARM
CATEGORIES:VRATAM
DESCRIPTION:Astronomical duration of Ekadashi (Shukla).
DTEND:20260427T124627Z
DTSTART:20260426T123728Z
SUMMARY:⏳ Ekadashi (Shukla)
UID:india-te-202604261807-Ekadashi(Shukla)@vratam
END:VEVENT
BEGIN:VEVENT
DTSTART;VALUE=DATE:20260325
CATEGORIES:PANCHANGAM
DESCRIPTION:Chaitramu Shukla Paksham Saptami  (25.03.2026)\n\nSamvatsaram: Vishvavasu Samvatsaram\nAyanam: Uttarayanam\nRuthuvu: Vasantha Ruthuvu\nMasam: Chaitramu\nPaksham: Shukla Paksham\nTithi: upto 1.50 PM Saptami\, thereafter Ashtami\nVaram: Budhavaram\nNakshatram: upto 6.10 PM Mrigashira (2 Padam)\, and then Arudra\nYogam: Aayushman\nKaranam: Vanijai\nRahu Kalam: 12.22 PM to 1.53 PM\nYamagandam: 7.47 AM to 9.19 AM\nDurmuhurtham: 10.20 AM to 11.09 AM\nAbhijit Muhurtham: 11.57 AM to 12.46 PM\nSuryodayam: 6.16 AM\nSuryastamayam: 6.27 PM\nChandrodayam: 11.15 AM\nChandrashtamam: Thula\nTaddinam Tithi: Ashtami\nPradesham: Hyderabad (Telugu Style)
SUMMARY:Chaitramu Shukla Paksham Saptami  (25.03.2026)
UID:india-te-2026-03-25@panchangam
END:VEVENT
BEGIN:VEVENT
DTSTART;VALUE=DATE:20260604
CATEGORIES:PANCHANGAM
DESCRIPTION:Jyeshthamu Krishna Paksham Chavithi  (04.06.2026)\n\n🎉 SPECIAL: Sankatahara Chathurthi\nSamvatsaram: Parabhava Samvatsaram\nAyanam: Uttarayanam\nRuthuvu: Grishma Ruthuvu\nMasam: Jyeshthamu\nPaksham: Krishna Paksham\nTithi: upto 11.30 PM Chavithi\, thereafter Panchami\nVaram: Guruvaram\nNakshatram: upto 4.25 AM Uttarashada (1 Padam)\, and then Shravana\nYogam: Shukla\nKaranam: Bavai\nRahu Kalam: 1.52 PM to 3.31 PM\nYamagandam: 5.40 AM to 7.19 AM\nDurmuhurtham: 1.33 PM to 2.25 PM\nAbhijit Muhurtham: 11.48 AM to 12.40 PM\nSuryodayam: 5.40 AM\nSuryastamayam: 6.47 PM\nChandrodayam: 10.12 PM\nChandrashtamam: Vrushabham\nTaddinam Tithi: Chavithi\nPradesham: Hyderabad (Telugu Style)
SUMMARY:Jyeshthamu Krishna Paksham Chavithi  (04.06.2026)
UID:india-te-2026-06-04@panchangam
END:VEVENT
BEGIN:VEVENT
DTSTART;VALUE=DATE:20260714
CATEGORIES:PANCHANGAM
DESCRIPTION:Ashadhamu Krishna Paksham Amavasya 🌑 (14.07.2026)\n\nSamvatsaram: Parabhava Samvatsaram\nAyanam: Dakshinayanam\nRuthuvu: Grishma Ruthuvu\nMasam: Ashadhamu\nPaksham: Krishna Paksham\nTithi: upto 3.13 PM Amavasya\, thereafter Padyami\nVaram: Mangalavaram\nNakshatram: upto 12.45 AM Punarvasu (1 Padam)\, and then Pushyami\nYogam: Vyaghata\nKaranam: Nagava\nRahu Kalam: 3.38 PM to 5.16 PM\nYamagandam: 9.05 AM to 10.43 AM\nDurmuhurtham: 7.34 AM to 8.26 AM\, 11.03 AM to 11.55 AM\nAbhijit Muhurtham: 11.55 AM to 12.48 PM\nSuryodayam: 5.49 AM\nSuryastamayam: 6.54 PM\nChandrodayam: 5.26 AM\nChandrashtamam: Vrushchikam\nTaddinam Tithi: Amavasya\nPradesham: Hyderabad (Telugu Style)
SUMMARY:Ashadhamu Krishna Paksham Amavasya 🌑 (14.07.2026)
UID:india-te-2026-07-14@panchangam
END:VEVENT
BEGIN:VEVENT
DTSTART;VALUE=DATE:20260824
CATEGORIES:PANCHANGAM
DESCRIPTION:Sravanamu Shukla Paksham Dwadashi  (24.08.2026)\n\nSamvatsaram: Parabhava Samvatsaram\nAyanam: Dakshinayanam\nRuthuvu: Varsha Ruthuvu\nMasam: Sravanamu\nPaksham: Shukla Paksham\nTithi: Dwadashi\nVaram: Somavaram\nNakshatram: upto 9.12 PM Poorvashada (2 Padam)\, and then Uttarashada\nYogam: Preethi\nKaranam: Bavai\nRahu Kalam: 7.35 AM to 9.09 AM\nYamagandam: 10.43 AM to 12.18 PM\nDurmuhurtham: 12.43 PM to 1.33 PM\nAbhijit Muhurtham: 11.53 AM to 12.43 PM\nSuryodayam: 6.00 AM\nSuryastamayam: 6.35 PM\nChandrodayam: 4.04 PM\nChandrashtamam: Vrushabham\nTaddinam Tithi: Dwadashi\nPradesham: Hyderabad (Telugu Style)
SUMMARY:Sravanamu Shukla Paksham Dwadashi  (24.08.2026)
UID:india-te-2026-08-24@panchangam
END:VEVENT
BEGIN:VEVENT
BEGIN:VALARM
ACTION:DISPLAY
DESCRIPTION:
TRIGGER:-P1D
END:VALARM
CATEGORIES:VRATAM
DESCRIPTION:Astronomical duration of Sankatahara Chathurthi.
DTEND:20260901T021224Z
DTSTART:20260831T032135Z
SUMMARY:⏳ Sankatahara Chathurthi
UID:india-te-202608310851-SankataharaChathurthi@vratam
END:VEVENT
BEGIN:VEVENT
DTSTART;VALUE=DATE:20261018
CATEGORIES:PANCHANGAM
DESCRIPTION:Ashwayujamu Shukla Paksham Saptami  (18.10.2026)\n\nSamvatsaram: Parabhava Samvatsaram\nAyanam: Dakshinayanam\nRuthuvu: Sarad Ruthuvu\nMasam: Ashwayujamu\nPaksham: Shukla Paksham\nTithi: upto 8.28 AM Saptami\, thereafter Ashtami\nVaram: Bhanuvaram\nNakshatram: upto 1.34 PM Poorvashada (3 Padam)\, and then Uttarashada\nYogam: Sukarman\nKaranam: Vanijai\nRahu Kalam: 4.24 PM to 5.52 PM\nYamagandam: 12.01 PM to 1.28 PM\nDurmuhurtham: 4.18 PM to 5.05 PM\nAbhijit Muhurtham: 11.37 AM to 12.24 PM\nSuryodayam: 6.09 AM\nSuryastamayam: 5.52 PM\nChandrodayam: 12.35 PM\nChandrashtamam: Vrushabham\nTaddinam Tithi: Ashtami\nPradesham: Hyderabad (Telugu Style)
SUMMARY:Ashwayujamu Shukla Paksham Saptami  (18.10.2026)
UID:india-te-2026-10-18@panchangam
END:VEVENT
BEGIN:VEVENT
DTSTART;VALUE=DATE:20261128
CATEGORIES:PANCHANGAM
DESCRIPTION:Karthikamu Krishna Paksham Chavithi  (28.11.2026)\n\nSamvatsaram: Parabhava Samvatsaram\nAyanam: Dakshinayanam\nRuthuvu: Sarad Ruthuvu\nMasam: Karthikamu\nPaksham: Krishna Paksham\nTithi: upto 6.40 AM Chavithi\, upto 3.57 AM Panchami\, thereafter Shashti\nVaram: Shanivaram\nNakshatram: upto 1.27 PM Punarvasu (3 Padam)\, and then Pushyami\nYogam: Shukla\nKaranam: Balavai\nRahu Kalam: 9.15 AM to 10.39 AM\nYamagandam: 1.27 PM to 2.51 PM\nDurmuhurtham: 6.28 AM to 7.12 AM\nAbhijit Muhurtham: 11.41 AM to 12.26 PM\nSuryodayam: 6.28 AM\nSuryastamayam: 5.39 PM\nChandrodayam: 9.42 PM\nChandrashtamam: Vrushchikam\nTaddinam Tithi: Panchami\nPradesham: Hyderabad (Telugu Style)
SUMMARY:Karthikamu Krishna Paksham Chavithi  (28.11.2026)
UID:india-te-2026-11-28@panchangam
END:VEVENT
BEGIN:VEVENT
DTSTART;VALUE=DATE:20260123
CATEGORIES:PANCHANGAM
DESCRIPTION:Maghamu Shukla Paksham Panchami  (23.01.2026)\n\nSamvatsaram: Vishvavasu Samvatsaram\nAyanam: Uttarayanam\nRuthuvu: Shishira Ruthuvu\nMasam: Maghamu\nPaksham: Shukla Paksham\nTithi: upto 1.46 AM Panchami\, thereafter Shashti\nVaram: Shukravaram\nNakshatram: upto 3.12 PM Poorvabhadra (3 Padam)\, and then Uttarabhadra\nYogam: Parigha\nKaranam: Bavai\nRahu Kalam: 11.03 AM to 12.27 PM\nYamagandam: 3.17 PM to 4.41 PM\nDurmuhurtham: 9.04 AM to 9.49 AM\, 12.50 PM to 1.35 PM\nAbhijit Muhurtham: 12.05 PM to 12.50 PM\nSuryodayam: 6.49 AM\nSuryastamayam: 6.06 PM\nChandrodayam: 9.47 AM\nChandrashtamam: Karkatakam\nTaddinam Tithi: Panchami\nPradesham: Hyderabad (Telugu Style)
SUMMARY:Maghamu Shukla Paksham Panchami  (23.01.2026)
UID:india-te-2026-01-23@panchangam
END:VEVENT
BEGIN:VEVENT
DTSTART;VALUE=DATE:20260402
CATEGORIES:PANCHANGAM
DESCRIPTION:Chaitramu Shukla Paksham Pournami 🌕 (02.04.2026)\n\nSamvatsaram: Parabhava Samvatsaram\nAyanam: Uttarayanam\nRuthuvu: Vasantha Ruthuvu\nMasam: Chaitramu\nPaksham: Shukla Paksham\nTithi: upto 7.41 AM Pournami\, thereafter Padyami\nVaram: Guruvaram\nNakshatram: upto 6.21 PM Hasta (3 Padam)\, and then Chitta\nYogam: Dhruva\nKaranam: Bavai\nRahu Kalam: 1.52 PM to 3.24 PM\nYamagandam: 6.10 AM to 7.42 AM\nDurmuhurtham: 1.33 PM to 2.22 PM\nAbhijit Muhurtham: 11.55 AM to 12.44 PM\nSuryodayam: 6.10 AM\nSuryastamayam: 6.29 PM\nChandrodayam: 6.48 PM\nChandrashtamam: Kumbham\nTaddinam Tithi: Padyami\nPradesham: Hyderabad (Telugu Style)
SUMMARY:Chaitramu Shukla Paksham Pournami 🌕 (02.04.2026)
UID:india-te-2026-04-02@panchangam
END:VEVENT
BEGIN:VEVENT
DTSTART;VALUE=DATE:20260512
CATEGORIES:PANCHANGAM
DESCRIPTION:Vaishakhamu Krishna Paksham Dashami  (12.05.2026)\n\nSamvatsaram: Parabhava Samvatsaram\nAyanam: Uttarayanam\nRuthuvu: Vasantha Ruthuvu\nMasam: Vaishakhamu\nPaksham: Krishna Paksham\nTithi: upto 2.52 PM Dashami\, thereafter Ekadashi\nVaram: Mangalavaram\nNakshatram: upto 1.56 AM Poorvabhadra (1 Padam)\, and then Uttarabhadra\nYogam: Vaidhriti\nKaranam: Vishti\nRahu Kalam: 3.26 PM to 5.02 PM\nYamagandam: 8.58 AM to 10.35 AM\nDurmuhurtham: 7.28 AM to 8.20 AM\, 10.55 AM to 11.46 AM\nAbhijit Muhurtham: 11.46 AM to 12.38 PM\nSuryodayam: 5.45 AM\nSuryastamayam: 6.39 PM\nChandrodayam: 2.07 AM\nChandrashtamam: Karkatakam\nTaddinam Tithi: Dashami\nPradesham: Hyderabad (Telugu Style)
SUMMARY:Vaishakhamu Krishna Paksham Dashami  (12.05.2026)
UID:india-te-2026-05-12@panchangam
END:VEVENT
BEGIN:VEVENT
DTSTART;VALUE=DATE:20260622
CATEGORIES:PANCHANGAM
DESCRIPTION:Jyeshthamu Shukla Paksham Ashtami  (22.06.2026)\n\nSamvatsaram: Parabhava Samvatsaram\nAyanam: Dakshinayanam\nRuthuvu: Grishma Ruthuvu\nMasam: Jyeshthamu\nPaksham: Shukla Paksham\nTithi: upto 3.40 PM Ashtami\, thereafter Navami\nVaram: Somavaram\nNakshatram: upto 11.04 AM Uttara (4 Padam)\, and then Hasta\nYogam: Vyatipata\nKaranam: Bavai\nRahu Kalam: 7.21 AM to 9.00 AM\nYamagandam: 10.39 AM to 12.18 PM\nDurmuhurtham: 12.44 PM to 1.37 PM\nAbhijit Muhurtham: 11.51 AM to 12.44 PM\nSuryodayam: 5.42 AM\nSuryastamayam: 6.53 PM\nChandrodayam: 12.37 PM\nChandrashtamam: Kumbham\nTaddinam Tithi: Ashtami\nPradesham: Hyderabad (Telugu Style)
SUMMARY:Jyeshthamu Shukla Paksham Ashtami  (22.06.2026)
UID:india-te-2026-06-22@panchangam
END:VEVENT
BEGIN:VEVENT
DTSTART;VALUE=DATE:20260901
CATEGORIES:PANCHANGAM
DESCRIPTION:Sravanamu Krishna Paksham Chavithi  (01.09.2026)\n\nSamvatsaram: Parabhava Samvatsaram\nAyanam: Dakshinayanam\nRuthuvu: Varsha Ruthuvu\nMasam: Sravanamu\nPaksham: Krishna Paksham\nTithi: upto 7.42 AM Chavithi\, thereafter Panchami\nVaram: Mangalavaram\nNakshatram: upto 3.21 AM Aswini (1 Padam)\, and then Bharani\nYogam: Vriddhi\nKaranam: Balavai\nRahu Kalam: 3.22 PM to 4.56 PM\nYamagandam: 9.09 AM to 10.42 AM\nDurmuhurtham: 7.41 AM to 8.31 AM\, 11.01 AM to 11.51 AM\nAbhijit Muhurtham: 11.51 AM to 12.40 PM\nSuryodayam: 6.02 AM\nSuryastamayam: 6.29 PM\nChandrodayam: 9.13 PM\nChandrashtamam: Kanya\nTaddinam Tithi: Panchami\nPradesham: Hyderabad (Telugu Style)
SUMMARY:Sravanamu Krishna Paksham Chavithi  (01.09.2026)
UID:india-te-2026-09-01@panchangam
END:VEVENT
BEGIN:VEVENT
BEGIN:VALARM
ACTION:DISPLAY
DESCRIPTION:
TRIGGER:-P1D
END:VALARM
CATEGORIES:VRATAM
DESCRIPTION:Astronomical duration of Ekadashi (Krishna).
DTEND:20260114T122314Z
DTSTART:20260113T094824Z
SUMMARY:⏳ Ekadashi (Krishna)
UID:india-te-202601131518-Ekadashi(Krishna)@vratam
END:VEVENT
BEGIN:VEVENT
DTSTART;VALUE=DATE:20251228
CATEGORIES:PANCHANGAM
DESCRIPTION:Pushyamu Shukla Paksham Ashtami  (28.12.2025)\n\nSamvatsaram: Vishvavasu Samvatsaram\nAyanam: Uttarayanam\nRuthuvu: Hemantha Ruthuvu\nMasam: Pushyamu\nPaksham: Shukla Paksham\nTithi: upto 12 Noon Ashtami\, thereafter Navami\nVaram: Bhanuvaram\nNakshatram: upto 9.21 AM Uttarabhadra (4 Padam)\, and then Revathi\nYogam: Variyana\nKaranam: Bavai\nRahu Kalam: 4.27 PM to 5.50 PM\nYamagandam: 12.17 PM to 1.40 PM\nDurmuhurtham: 4.21 PM to 5.06 PM\nAbhijit Muhurtham: 11.55 AM to 12.39 PM\nSuryodayam: 6.44 AM\nSuryastamayam: 5.50 PM\nChandrodayam: 12.23 PM\nChandrashtamam: Simham\nTaddinam Tithi: Navami\nPradesham: Hyderabad (Telugu Style)
SUMMARY:Pushyamu Shukla Paksham Ashtami  (28.12.2025)
UID:india-te-2025-12-28@panchangam
END:VEVENT
BEGIN:VEVENT
BEGIN:VALARM
ACTION:DISPLAY
DESCRIPTION:
TRIGGER:-P1D
END:VALARM
CATEGORIES:VRATAM
DESCRIPTION:Astronomical duration of Pradosham (Krishna).
DTEND:20261008T164628Z
DTSTART:20261007T174704Z
SUMMARY:⏳ Pradosham (Krishna)
UID:india-te-202610072317-Pradosham(Krishna)@vratam
END:VEVENT
BEGIN:VEVENT
DTSTART;VALUE=DATE:20261205
CATEGORIES:PANCHANGAM
DESCRIPTION:Karthikamu Krishna Paksham Dwadashi  (05.12.2026)\n\nSamvatsaram: Parabhava Samvatsaram\nAyanam: Dakshinayanam\nRuthuvu: Sarad Ruthuvu\nMasam: Karthikamu\nPaksham: Krishna Paksham\nTithi: upto 12.52 AM Dwadashi\, thereafter Trayodashi\nVaram: Shanivaram\nNakshatram: upto 12.32 PM Chitta (4 Padam)\, and then Swathi\nYogam: Saubhagya\nKaranam: Kaulavai\nRahu Kalam: 9.19 AM to 10.42 AM\nYamagandam: 1.30 PM to 2.53 PM\nDurmuhurtham: 6.32 AM to 7.16 AM\nAbhijit Muhurtham: 11.44 AM to 12.28 PM\nSuryodayam: 6.32 AM\nSuryastamayam: 5.40 PM\nChandrodayam: 3.12 AM\nChandrashtamam: Meenam\nTaddinam Tithi: Dwadashi\nPradesham: Hyderabad (Telugu Style)
SUMMARY:Karthikamu Krishna Paksham Dwadashi  (05.12.2026)
UID:india-te-2026-12-05@panchangam
END:VEVENT
BEGIN:VEVENT
BEGIN:VALARM
ACTION:DISPLAY
DESCRIPTION:
TRIGGER:-P1D
END:VALARM
CATEGORIES:VRATAM
DESCRIPTION:Astronomical duration of Pradosham (Shukla).
DTEND:20260924T174855Z
DTSTART:20260923T172100Z
SUMMARY:⏳ Pradosham (Shukla)
UID:india-te-202609232251-Pradosham(Shukla)@vratam
END:VEVENT
BEGIN:VEVENT
DTSTART;VALUE=DATE:20260310
CATEGORIES:PANCHANGAM
DESCRIPTION:Phalgunamu Krishna Paksham Saptami  (10.03.2026)\n\nSamvatsaram: Vishvavasu Samvatsaram\nAyanam: Uttarayanam\nRuthuvu: Shishira Ruthuvu\nMasam: Phalgunamu\nPaksham: Krishna Paksham\nTithi: upto 1.54 AM Saptami\, thereafter Ashtami\nVaram: Mangalavaram\nNakshatram: upto 7.49 PM Anuradha (3 Padam)\, and then Jyeshta\nYogam: Harshana\nKaranam: Vishti\nRahu Kalam: 3.25 PM to 4.55 PM\nYamagandam: 9.27 AM to 10.56 AM\nDurmuhurtham: 8.03 AM to 8.51 AM\, 11.14 AM to 12.02 PM\nAbhijit Muhurtham: 12.02 PM to 12.50 PM\nSuryodayam: 6.28 AM\nSuryastamayam: 6.24 PM\nChandrodayam: N/A\nChandrashtamam: Mesham\nTaddinam Tithi: Saptami\nPradesham: Hyderabad (Telugu Style)
SUMMARY:Phalgunamu Krishna Paksham Saptami  (10.03.2026)
UID:india-te-2026-03-10@panchangam
END:VEVENT
BEGIN:VEVENT
DTSTART;VALUE=DATE:20260420
CATEGORIES:PANCHANGAM
DESCRIPTION:Vaishakhamu Shukla Paksham Thadiya  (20.04.2026)\n\nSamvatsaram: Parabhava Samvatsaram\nAyanam: Uttarayanam\nRuthuvu: Vasantha Ruthuvu\nMasam: Vaishakhamu\nPaksham: Shukla Paksham\nTithi: upto 7.27 AM Thadiya\, upto 4.15 AM Chavithi\, thereafter Panchami\nVaram: Somavaram\nNakshatram: upto 2.44 AM Rohini (1 Padam)\, and then Mrigashira\nYogam: Saubhagya\nKaranam: Garajai\nRahu Kalam: 7.31 AM to 9.06 AM\nYamagandam: 10.40 AM to 12.15 PM\nDurmuhurtham: 12.40 PM to 1.30 PM\nAbhijit Muhurtham: 11.49 AM to 12.40 PM\nSuryodayam: 5.56 AM\nSuryastamayam: 6.33 PM\nChandrodayam: 8.03 AM\nChandrashtamam: Thula\nTaddinam Tithi: Chavithi\nPradesham: Hyderabad (Telugu Style)
SUMMARY:Vaishakhamu Shukla Paksham Thadiya  (20.04.2026)
UID:india-te-2026-04-20@panchangam
END:VEVENT
BEGIN:VEVENT
DTSTART;VALUE=DATE:20260530
CATEGORIES:PANCHANGAM
DESCRIPTION:Jyeshthamu Shukla Paksham Chaturdashi  (30.05.2026)\n\nSamvatsaram: Parabhava Samvatsaram\nAyanam: Uttarayanam\nRuthuvu: Grishma Ruthuvu\nMasam: Jyeshthamu\nPaksham: Shukla Paksham\nTithi: upto 11.58 AM Chaturdashi\, thereafter Pournami\nVaram: Shanivaram\nNakshatram: upto 2.05 PM Vishakha (3 Padam)\, and then Anuradha\nYogam: Parigha\nKaranam: Vanijai\nRahu Kalam: 8.57 AM to 10.35 AM\nYamagandam: 1.51 PM to 3.29 PM\nDurmuhurtham: 5.41 AM to 6.33 AM\nAbhijit Muhurtham: 11.47 AM to 12.39 PM\nSuryodayam: 5.41 AM\nSuryastamayam: 6.46 PM\nChandrodayam: 6.05 PM\nChandrashtamam: Meenam\nTaddinam Tithi: Pournami\nPradesham: Hyderabad (Telugu Style)
SUMMARY:Jyeshthamu Shukla Paksham Chaturdashi  (30.05.2026)
UID:india-te-2026-05-30@panchangam
END:VEVENT
BEGIN:VEVENT
DTSTART;VALUE=DATE:20260409
CATEGORIES:PANCHANGAM
DESCRIPTION:Chaitramu Krishna Paksham Saptami  (09.04.2026)\n\nSamvatsaram: Parabhava Samvatsaram\nAyanam: Uttarayanam\nRuthuvu: Vasantha Ruthuvu\nMasam: Chaitramu\nPaksham: Krishna Paksham\nTithi: upto 9.20 PM Saptami\, thereafter Ashtami\nVaram: Guruvaram\nNakshatram: upto 9.32 AM Moola (4 Padam)\, and then Poorvashada\nYogam: Parigha\nKaranam: Vishti\nRahu Kalam: 1.51 PM to 3.24 PM\nYamagandam: 6.04 AM to 7.38 AM\nDurmuhurtham: 1.32 PM to 2.22 PM\nAbhijit Muhurtham: 11.52 AM to 12.42 PM\nSuryodayam: 6.04 AM\nSuryastamayam: 6.30 PM\nChandrodayam: 12.02 AM\nChandrashtamam: Vrushabham\nTaddinam Tithi: Saptami\nPradesham: Hyderabad (Telugu Style)
SUMMARY:Chaitramu Krishna Paksham Saptami  (09.04.2026)
UID:india-te-2026-04-09@panchangam
END:VEVENT
BEGIN:VEVENT
DTSTART;VALUE=DATE:20260519
CATEGORIES:PANCHANGAM
DESCRIPTION:Jyeshthamu Shukla Paksham Thadiya  (19.05.2026)\n\nSamvatsaram: Parabhava Samvatsaram\nAyanam: Uttarayanam\nRuthuvu: Grishma Ruthuvu\nMasam: Jyeshthamu\nPaksham: Shukla Paksham\nTithi: upto 2.18 PM Thadiya\, thereafter Chavithi\nVaram: Mangalavaram\nNakshatram: upto 9.17 AM Mrigashira (4 Padam)\, and then Arudra\nYogam: Dhruthi\nKaranam: Garajai\nRahu Kalam: 3.27 PM to 5.04 PM\nYamagandam: 8.57 AM to 10.35 AM\nDurmuhurtham: 7.26 AM to 8.18 AM\, 10.54 AM to 11.46 AM\nAbhijit Muhurtham: 11.46 AM to 12.38 PM\nSuryodayam: 5.42 AM\nSuryastamayam: 6.42 PM\nChandrodayam: 7.54 AM\nChandrashtamam: Vrushchikam\nTaddinam Tithi: Chavithi\nPradesham: Hyderabad (Telugu Style)
SUMMARY:Jyeshthamu Shukla Paksham Thadiya  (19.05.2026)
UID:india-te-2026-05-19@panchangam
END:VEVENT
BEGIN:VEVENT
DTSTART;VALUE=DATE:20260629
CATEGORIES:PANCHANGAM
DESCRIPTION:Jyeshthamu Shukla Paksham Pournami 🌕 (29.06.2026)\n\nSamvatsaram: Parabhava Samvatsaram\nAyanam: Dakshinayanam\nRuthuvu: Grishma Ruthuvu\nMasam: Jyeshthamu\nPaksham: Shukla Paksham\nTithi: upto 5.26 AM Pournami\, thereafter Padyami\nVaram: Somavaram\nNakshatram: upto 4.48 AM Moola (1 Padam)\, and then Poorvashada\nYogam: Shukla\nKaranam: Vishti\nRahu Kalam: 7.23 AM to 9.02 AM\nYamagandam: 10.40 AM to 12.19 PM\nDurmuhurtham: 12.45 PM to 1.38 PM\nAbhijit Muhurtham: 11.53 AM to 12.45 PM\nSuryodayam: 5.44 AM\nSuryastamayam: 6.54 PM\nChandrodayam: 6.38 PM\nChandrashtamam: Vrushabham\nTaddinam Tithi: Pournami\nPradesham: Hyderabad (Telugu Style)
SUMMARY:Jyeshthamu Shukla Paksham Pournami 🌕 (29.06.2026)
UID:india-te-2026-06-29@panchangam
END:VEVENT
BEGIN:VEVENT
DTSTART;VALUE=DATE:20260908
CATEGORIES:PANCHANGAM
DESCRIPTION:Sravanamu Krishna Paksham Dwadashi  (08.09.2026)\n\n🎉 SPECIAL: Pradosham (Krishna)\nSamvatsaram: Parabhava Samvatsaram\nAyanam: Dakshinayanam\nRuthuvu: Varsha Ruthuvu\nMasam: Sravanamu\nPaksham: Krishna Paksham\nTithi: upto 2.43 PM Dwadashi\, thereafter Trayodashi\nVaram: Mangalavaram\nNakshatram: upto 5.17 PM Pushyami (2 Padam)\, and then Ashlesha\nYogam: Parigha\nKaranam: Thaitilai\nRahu Kalam: 3.18 PM to 4.51 PM\nYamagandam: 9.08 AM to 10.41 AM\nDurmuhurtham: 7.41 AM to 8.31 AM\, 10.59 AM to 11.48 AM\nAbhijit Muhurtham: 11.48 AM to 12.38 PM\nSuryodayam: 6.03 AM\nSuryastamayam: 6.24 PM\nChandrodayam: 3.04 AM\nChandrashtamam: Dhanu\nTaddinam Tithi: Dwadashi\nPradesham: Hyderabad (Telugu Style)
SUMMARY:Sravanamu Krishna Paksham Dwadashi  (08.09.2026)
UID:india-te-2026-09-08@panchangam
END:VEVENT
BEGIN:VEVENT
DTSTART;VALUE=DATE:20261003
CATEGORIES:PANCHANGAM
DESCRIPTION:Bhadrapadamu Krishna Paksham Saptami  (03.10.2026)\n\nSamvatsaram: Parabhava Samvatsaram\nAyanam: Dakshinayanam\nRuthuvu: Varsha Ruthuvu\nMasam: Bhadrapadamu\nPaksham: Krishna Paksham\nTithi: upto 8.00 AM Saptami\, upto 5.52 AM Ashtami\, thereafter Navami\nVaram: Shanivaram\nNakshatram: upto 2.07 AM Arudra (1 Padam)\, and then Punarvasu\nYogam: Variyana\nKaranam: Bavai\nRahu Kalam: 9.05 AM to 10.35 AM\nYamagandam: 1.34 PM to 3.04 PM\nDurmuhurtham: 6.06 AM to 6.54 AM\nAbhijit Muhurtham: 11.41 AM to 12.28 PM\nSuryodayam: 6.06 AM\nSuryastamayam: 6.03 PM\nChandrodayam: 11.51 PM\nChandrashtamam: Vrushchikam\nTaddinam Tithi: Ashtami\nPradesham: Hyderabad (Telugu Style)
SUMMARY:Bhadrapadamu Krishna Paksham Saptami  (03.10.2026)
UID:india-te-2026-10-03@panchangam
END:VEVENT
BEGIN:VEVENT
DTSTART;VALUE=DATE:20261113
CATEGORIES:PANCHANGAM
DESCRIPTION:Karthikamu Shukla Paksham Chavithi  (13.11.2026)\n\nSamvatsaram: Parabhava Samvatsaram\nAyanam: Dakshinayanam\nRuthuvu: Sarad Ruthuvu\nMasam: Karthikamu\nPaksham: Shukla Paksham\nTithi: upto 8.43 PM Chavithi\, thereafter Panchami\nVaram: Shukravaram\nNakshatram: upto 6.03 PM Moola (3 Padam)\, and then Poorvashada\nYogam: Dhruthi\nKaranam: Vanijai\nRahu Kalam: 10.35 AM to 12 Noon\nYamagandam: 2.50 PM to 4.15 PM\nDurmuhurtham: 8.35 AM to 9.21 AM\, 12.22 PM to 1.08 PM\nAbhijit Muhurtham: 11.37 AM to 12.22 PM\nSuryodayam: 6.19 AM\nSuryastamayam: 5.40 PM\nChandrodayam: 9.42 AM\nChandrashtamam: Vrushabham\nTaddinam Tithi: Chavithi\nPradesham: Hyderabad (Telugu Style)
SUMMARY:Karthikamu Shukla Paksham Chavithi  (13.11.2026)
UID:india-te-2026-11-13@panchangam
END:VEVENT
BEGIN:VEVENT
DTSTART;VALUE=DATE:20261223
CATEGORIES:PANCHANGAM
DESCRIPTION:Margashiramu Shukla Paksham Chaturdashi  (23.12.2026)\n\nSamvatsaram: Parabhava Samvatsaram\nAyanam: Uttarayanam\nRuthuvu: Hemantha Ruthuvu\nMasam: Margashiramu\nPaksham: Shukla Paksham\nTithi: upto 10.47 AM Chaturdashi\, thereafter Pournami\nVaram: Budhavaram\nNakshatram: upto 8.32 AM Rohini (4 Padam)\, upto 5.28 AM Mrigashira\, and then Arudra\nYogam: Shubha\nKaranam: Vanijai\nRahu Kalam: 12.15 PM to 1.38 PM\nYamagandam: 8.05 AM to 9.28 AM\nDurmuhurtham: 10.24 AM to 11.08 AM\nAbhijit Muhurtham: 11.52 AM to 12.37 PM\nSuryodayam: 6.42 AM\nSuryastamayam: 5.47 PM\nChandrodayam: 5.02 PM\nChandrashtamam: Thula\nTaddinam Tithi: Pournami\nPradesham: Hyderabad (Telugu Style)
SUMMARY:Margashiramu Shukla Paksham Chaturdashi  (23.12.2026)
UID:india-te-2026-12-23@panchangam
END:VEVENT
BEGIN:VEVENT
DTSTART;VALUE=DATE:20260207
CATEGORIES:PANCHANGAM
DESCRIPTION:Maghamu Krishna Paksham Shashti  (07.02.2026)\n\nSamvatsaram: Vishvavasu Samvatsaram\nAyanam: Uttarayanam\nRuthuvu: Shishira Ruthuvu\nMasam: Maghamu\nPaksham: Krishna Paksham\nTithi: upto 2.54 AM Shashti\, thereafter Saptami\nVaram: Shanivaram\nNakshatram: upto 3.11 AM Chitta (1 Padam)\, and then Swathi\nYogam: Shoola\nKaranam: Garajai\nRahu Kalam: 9.38 AM to 11.04 AM\nYamagandam: 1.56 PM to 3.22 PM\nDurmuhurtham: 6.46 AM to 7.32 AM\nAbhijit Muhurtham: 12.07 PM to 12.53 PM\nSuryodayam: 6.46 AM\nSuryastamayam: 6.14 PM\nChandrodayam: 11.08 PM\nChandrashtamam: Kumbham\nTaddinam Tithi: Shashti\nPradesham: Hyderabad (Telugu Style)
SUMMARY:Maghamu Krishna Paksham Shashti  (07.02.2026)
UID:india-te-2026-02-07@panchangam
END:VEVENT
BEGIN:VEVENT
DTSTART;VALUE=DATE:20260317
CATEGORIES:PANCHANGAM
DESCRIPTION:Phalgunamu Krishna Paksham Trayodashi  (17.03.2026)\n\nSamvatsaram: Vishvavasu Samvatsaram\nAyanam: Uttarayanam\nRuthuvu: Shishira Ruthuvu\nMasam: Phalgunamu\nPaksham: Krishna Paksham\nTithi: upto 9.23 AM Trayodashi\, thereafter Chaturdashi\nVaram: Mangalavaram\nNakshatram: upto 7.02 AM Dhanishta (4 Padam)\, and then Shatabhisham\nYogam: Siddha\nKaranam: Vanijai\nRahu Kalam: 3.25 PM to 4.55 PM\nYamagandam: 9.23 AM to 10.54 AM\nDurmuhurtham: 7.59 AM to 8.47 AM\, 11.12 AM to 12 Noon\nAbhijit Muhurtham: 12 Noon to 12.48 PM\nSuryodayam: 6.22 AM\nSuryastamayam: 6.26 PM\nChandrodayam: 5.05 AM\nChandrashtamam: Karkatakam\nTaddinam Tithi: Chaturdashi\nPradesham: Hyderabad (Telugu Style)
SUMMARY:Phalgunamu Krishna Paksham Trayodashi  (17.03.2026)
UID:india-te-2026-03-17@panchangam
END:VEVENT
BEGIN:VEVENT
DTSTART;VALUE=DATE:20260427
CATEGORIES:PANCHANGAM
DESCRIPTION:Vaishakhamu Shukla Paksham Ekadashi  (27.04.2026)\n\n🎉 SPECIAL: Ekadashi (Shukla)\nSamvatsaram: Parabhava Samvatsaram\nAyanam: Uttarayanam\nRuthuvu: Vasantha Ruthuvu\nMasam: Vaishakhamu\nPaksham: Shukla Paksham\nTithi: upto 6.16 PM Ekadashi\, thereafter Dwadashi\nVaram: Somavaram\nNakshatram: upto 10.00 PM Pubba (2 Padam)\, and then Uttara\nYogam: Dhruva\nKaranam: Vanijai\nRahu Kalam: 7.27 AM to 9.03 AM\nYamagandam: 10.38 AM to 12.13 PM\nDurmuhurtham: 12.39 PM to 1.30 PM\nAbhijit Muhurtham: 11.48 AM to 12.39 PM\nSuryodayam: 5.52 AM\nSuryastamayam: 6.35 PM\nChandrodayam: 3.03 PM\nChandrashtamam: Makaram\nTaddinam Tithi: Ekadashi\nPradesham: Hyderabad (Telugu Style)
SUMMARY:Vaishakhamu Shukla Paksham Ekadashi  (27.04.2026)
UID:india-te-2026-04-27@panchangam
END:VEVENT
BEGIN:VEVENT
BEGIN:VALARM
ACTION:DISPLAY
DESCRIPTION:
TRIGGER:-P1D
END:VALARM
CATEGORIES:VRATAM
DESCRIPTION:Astronomical duration of Pradosham (Shukla).
DTEND:20261122T210735Z
DTSTART:20261121T232658Z
SUMMARY:⏳ Pradosham (Shukla)
UID:india-te-202611220456-Pradosham(Shukla)@vratam
END:VEVENT
BEGIN:VEVENT
DTSTART;VALUE=DATE:20260706
CATEGORIES:PANCHANGAM
DESCRIPTION:Jyeshthamu Krishna Paksham Shashti  (06.07.2026)\n\nSamvatsaram: Parabhava Samvatsaram\nAyanam: Dakshinayanam\nRuthuvu: Grishma Ruthuvu\nMasam: Jyeshthamu\nPaksham: Krishna Paksham\nTithi: upto 1.47 PM Shashti\, thereafter Saptami\nVaram: Somavaram\nNakshatram: upto 4.48 PM Poorvabhadra (3 Padam)\, and then Uttarabhadra\nYogam: Saubhagya\nKaranam: Vanijai\nRahu Kalam: 7.25 AM to 9.03 AM\nYamagandam: 10.42 AM to 12.20 PM\nDurmuhurtham: 12.47 PM to 1.39 PM\nAbhijit Muhurtham: 11.54 AM to 12.47 PM\nSuryodayam: 5.46 AM\nSuryastamayam: 6.54 PM\nChandrodayam: 11.16 PM\nChandrashtamam: Karkatakam\nTaddinam Tithi: Saptami\nPradesham: Hyderabad (Telugu Style)
SUMMARY:Jyeshthamu Krishna Paksham Shashti  (06.07.2026)
UID:india-te-2026-07-06@panchangam
END:VEVENT
BEGIN:VEVENT
DTSTART;VALUE=DATE:20260816
CATEGORIES:PANCHANGAM
DESCRIPTION:Sravanamu Shukla Paksham Chavithi  (16.08.2026)\n\nSamvatsaram: Parabhava Samvatsaram\nAyanam: Dakshinayanam\nRuthuvu: Varsha Ruthuvu\nMasam: Sravanamu\nPaksham: Shukla Paksham\nTithi: upto 4.53 PM Chavithi\, thereafter Panchami\nVaram: Bhanuvaram\nNakshatram: upto 4.32 AM Hasta (1 Padam)\, and then Chitta\nYogam: Siddha\nKaranam: Vishti\nRahu Kalam: 5.06 PM to 6.41 PM\nYamagandam: 12.20 PM to 1.55 PM\nDurmuhurtham: 4.59 PM to 5.50 PM\nAbhijit Muhurtham: 11.54 AM to 12.45 PM\nSuryodayam: 5.59 AM\nSuryastamayam: 6.41 PM\nChandrodayam: 9.08 AM\nChandrashtamam: Kumbham\nTaddinam Tithi: Chavithi\nPradesham: Hyderabad (Telugu Style)
SUMMARY:Sravanamu Shukla Paksham Chavithi  (16.08.2026)
UID:india-te-2026-08-16@panchangam
END:VEVENT
BEGIN:VEVENT
DTSTART;VALUE=DATE:20260926
CATEGORIES:PANCHANGAM
DESCRIPTION:Bhadrapadamu Shukla Paksham Pournami 🌕 (26.09.2026)\n\nSamvatsaram: Parabhava Samvatsaram\nAyanam: Dakshinayanam\nRuthuvu: Varsha Ruthuvu\nMasam: Bhadrapadamu\nPaksham: Shukla Paksham\nTithi: upto 10.19 PM Pournami\, thereafter Padyami\nVaram: Shanivaram\nNakshatram: upto 12.12 PM Poorvabhadra (3 Padam)\, and then Uttarabhadra\nYogam: Ganda\nKaranam: Vishti\nRahu Kalam: 9.06 AM to 10.36 AM\nYamagandam: 1.37 PM to 3.08 PM\nDurmuhurtham: 6.05 AM to 6.53 AM\nAbhijit Muhurtham: 11.43 AM to 12.31 PM\nSuryodayam: 6.05 AM\nSuryastamayam: 6.09 PM\nChandrodayam: 5.52 PM\nChandrashtamam: Karkatakam\nTaddinam Tithi: Pournami\nPradesham: Hyderabad (Telugu Style)
SUMMARY:Bhadrapadamu Shukla Paksham Pournami 🌕 (26.09.2026)
UID:india-te-2026-09-26@panchangam
END:VEVENT
BEGIN:VEVENT
DTSTART;VALUE=DATE:20261021
CATEGORIES:PANCHANGAM
DESCRIPTION:Ashwayujamu Shukla Paksham Dashami  (21.10.2026)\n\n🎉 SPECIAL: Vijaya Dasami\nSamvatsaram: Parabhava Samvatsaram\nAyanam: Dakshinayanam\nRuthuvu: Sarad Ruthuvu\nMasam: Ashwayujamu\nPaksham: Shukla Paksham\nTithi: upto 2.12 PM Dashami\, thereafter Ekadashi\nVaram: Budhavaram\nNakshatram: upto 8.30 PM Dhanishta (2 Padam)\, and then Shatabhisham\nYogam: Ganda\nKaranam: Garajai\nRahu Kalam: 12 Noon to 1.28 PM\nYamagandam: 7.38 AM to 9.05 AM\nDurmuhurtham: 10.03 AM to 10.50 AM\nAbhijit Muhurtham: 11.37 AM to 12.23 PM\nSuryodayam: 6.10 AM\nSuryastamayam: 5.50 PM\nChandrodayam: 2.35 PM\nChandrashtamam: Mithunam\nTaddinam Tithi: Ekadashi\nPradesham: Hyderabad (Telugu Style)
SUMMARY:Ashwayujamu Shukla Paksham Dashami  (21.10.2026)
UID:india-te-2026-10-21@panchangam
END:VEVENT
BEGIN:VEVENT
DTSTART;VALUE=DATE:20260115
CATEGORIES:PANCHANGAM
DESCRIPTION:Pushyamu Krishna Paksham Dwadashi  (15.01.2026)\n\nSamvatsaram: Vishvavasu Samvatsaram\nAyanam: Uttarayanam\nRuthuvu: Hemantha Ruthuvu\nMasam: Pushyamu\nPaksham: Krishna Paksham\nTithi: upto 8.17 PM Dwadashi\, thereafter Trayodashi\nVaram: Guruvaram\nNakshatram: upto 6.31 AM Jyeshta (1 Padam)\, and then Moola\nYogam: Vriddhi\nKaranam: Kaulavai\nRahu Kalam: 1.49 PM to 3.13 PM\nYamagandam: 6.49 AM to 8.13 AM\nDurmuhurtham: 1.32 PM to 2.17 PM\nAbhijit Muhurtham: 12.03 PM to 12.47 PM\nSuryodayam: 6.49 AM\nSuryastamayam: 6.01 PM\nChandrodayam: 3.52 AM\nChandrashtamam: Mesham\nTaddinam Tithi: Dwadashi\nPradesham: Hyderabad (Telugu Style)
SUMMARY:Pushyamu Krishna Paksham Dwadashi  (15.01.2026)
UID:india-te-2026-01-15@panchangam
END:VEVENT
BEGIN:VEVENT
DTSTART;VALUE=DATE:20260225
CATEGORIES:PANCHANGAM
DESCRIPTION:Phalgunamu Shukla Paksham Navami  (25.02.2026)\n\nSamvatsaram: Vishvavasu Samvatsaram\nAyanam: Uttarayanam\nRuthuvu: Shishira Ruthuvu\nMasam: Phalgunamu\nPaksham: Shukla Paksham\nTithi: upto 2.41 AM Navami\, thereafter Dashami\nVaram: Budhavaram\nNakshatram: upto 2.15 PM Rohini (3 Padam)\, and then Mrigashira\nYogam: Vishkambha\nKaranam: Balavai\nRahu Kalam: 12.29 PM to 1.57 PM\nYamagandam: 8.05 AM to 9.33 AM\nDurmuhurtham: 10.31 AM to 11.18 AM\nAbhijit Muhurtham: 12.05 PM to 12.52 PM\nSuryodayam: 6.37 AM\nSuryastamayam: 6.21 PM\nChandrodayam: 12.19 PM\nChandrashtamam: Thula\nTaddinam Tithi: Navami\nPradesham: Hyderabad (Telugu Style)
SUMMARY:Phalgunamu Shukla Paksham Navami  (25.02.2026)
UID:india-te-2026-02-25@panchangam
END:VEVENT
BEGIN:VEVENT
DTSTART;VALUE=DATE:20260504
CATEGORIES:PANCHANGAM
DESCRIPTION:Vaishakhamu Krishna Paksham Thadiya  (04.05.2026)\n\nSamvatsaram: Parabhava Samvatsaram\nAyanam: Uttarayanam\nRuthuvu: Vasantha Ruthuvu\nMasam: Vaishakhamu\nPaksham: Krishna Paksham\nTithi: upto 5.24 AM Thadiya\, thereafter Chavithi\nVaram: Somavaram\nNakshatram: upto 10.42 AM Anuradha (4 Padam)\, and then Jyeshta\nYogam: Parigha\nKaranam: Vanijai\nRahu Kalam: 7.24 AM to 9.00 AM\nYamagandam: 10.36 AM to 12.12 PM\nDurmuhurtham: 12.38 PM to 1.29 PM\nAbhijit Muhurtham: 11.47 AM to 12.38 PM\nSuryodayam: 5.48 AM\nSuryastamayam: 6.37 PM\nChandrodayam: 9.03 PM\nChandrashtamam: Mesham\nTaddinam Tithi: Thadiya\nPradesham: Hyderabad (Telugu Style)
SUMMARY:Vaishakhamu Krishna Paksham Thadiya  (04.05.2026)
UID:india-te-2026-05-04@panchangam
END:VEVENT
BEGIN:VEVENT
DTSTART;VALUE=DATE:20251231
CATEGORIES:PANCHANGAM
DESCRIPTION:Pushyamu Shukla Paksham Dwadashi  (31.12.2025)\n\nSamvatsaram: Vishvavasu Samvatsaram\nAyanam: Uttarayanam\nRuthuvu: Hemantha Ruthuvu\nMasam: Pushyamu\nPaksham: Shukla Paksham\nTithi: upto 1.48 AM Dwadashi\, thereafter Trayodashi\nVaram: Budhavaram\nNakshatram: upto 2.05 AM Kruthika (1 Padam)\, and then Rohini\nYogam: Sadhya\nKaranam: Bavai\nRahu Kalam: 12.19 PM to 1.42 PM\nYamagandam: 8.09 AM to 9.32 AM\nDurmuhurtham: 10.27 AM to 11.12 AM\nAbhijit Muhurtham: 11.56 AM to 12.41 PM\nSuryodayam: 6.45 AM\nSuryastamayam: 5.52 PM\nChandrodayam: 2.41 PM\nChandrashtamam: Kanya\nTaddinam Tithi: Dwadashi\nPradesham: Hyderabad (Telugu Style)
SUMMARY:Pushyamu Shukla Paksham Dwadashi  (31.12.2025)
UID:india-te-2025-12-31@panchangam
END:VEVENT
BEGIN:VEVENT
DTSTART;VALUE=DATE:20260614
CATEGORIES:PANCHANGAM
DESCRIPTION:Jyeshthamu Krishna Paksham Chaturdashi  (14.06.2026)\n\nSamvatsaram: Parabhava Samvatsaram\nAyanam: Uttarayanam\nRuthuvu: Grishma Ruthuvu\nMasam: Jyeshthamu\nPaksham: Krishna Paksham\nTithi: upto 12.20 PM Chaturdashi\, thereafter Amavasya\nVaram: Bhanuvaram\nNakshatram: upto 10.48 PM Rohini (1 Padam)\, and then Mrigashira\nYogam: Dhruthi\nKaranam: Shakuni\nRahu Kalam: 5.12 PM to 6.51 PM\nYamagandam: 12.16 PM to 1.55 PM\nDurmuhurtham: 5.05 PM to 5.58 PM\nAbhijit Muhurtham: 11.49 AM to 12.42 PM\nSuryodayam: 5.41 AM\nSuryastamayam: 6.51 PM\nChandrodayam: 4.27 AM\nChandrashtamam: Thula\nTaddinam Tithi: Amavasya\nPradesham: Hyderabad (Telugu Style)
SUMMARY:Jyeshthamu Krishna Paksham Chaturdashi  (14.06.2026)
UID:india-te-2026-06-14@panchangam
END:VEVENT
BEGIN:VEVENT
DTSTART;VALUE=DATE:20260724
CATEGORIES:PANCHANGAM
DESCRIPTION:Ashadhamu Shukla Paksham Dashami  (24.07.2026)\n\nSamvatsaram: Parabhava Samvatsaram\nAyanam: Dakshinayanam\nRuthuvu: Grishma Ruthuvu\nMasam: Ashadhamu\nPaksham: Shukla Paksham\nTithi: upto 9.13 AM Dashami\, thereafter Ekadashi\nVaram: Shukravaram\nNakshatram: upto 5.21 AM Anuradha (1 Padam)\, and then Jyeshta\nYogam: Shukla\nKaranam: Garajai\nRahu Kalam: 10.45 AM to 12.22 PM\nYamagandam: 3.37 PM to 5.14 PM\nDurmuhurtham: 8.28 AM to 9.20 AM\, 12.48 PM to 1.40 PM\nAbhijit Muhurtham: 11.56 AM to 12.48 PM\nSuryodayam: 5.52 AM\nSuryastamayam: 6.52 PM\nChandrodayam: 2.48 PM\nChandrashtamam: Mesham\nTaddinam Tithi: Ekadashi\nPradesham: Hyderabad (Telugu Style)
SUMMARY:Ashadhamu Shukla Paksham Dashami  (24.07.2026)
UID:india-te-2026-07-24@panchangam
END:VEVENT
BEGIN:VEVENT
BEGIN:VALARM
ACTION:DISPLAY
DESCRIPTION:
TRIGGER:-P1D
END:VALARM
DTSTART;VALUE=DATE:20261220
CATEGORIES:FESTIVAL
DESCRIPTION:Deity: Lord Vishnu\nFood: Fasting / Light Food\nRules: Hyderabad (Telugu Style) Calendar
SUMMARY:🎉 Vaikunta Ekadashi
UID:india-te-2026-12-20-VaikuntaEkadashi@festival
END:VEVENT
BEGIN:VEVENT
DTSTART;VALUE=DATE:20261028
CATEGORIES:PANCHANGAM
DESCRIPTION:Ashwayujamu Krishna Paksham Thadiya  (28.10.2026)\n\nSamvatsaram: Parabhava Samvatsaram\nAyanam: Dakshinayanam\nRuthuvu: Sarad Ruthuvu\nMasam: Ashwayujamu\nPaksham: Krishna Paksham\nTithi: upto 1.07 AM Thadiya\, thereafter Chavithi\nVaram: Budhavaram\nNakshatram: upto 2.02 PM Kruthika (3 Padam)\, and then Rohini\nYogam: Vyatipata\nKaranam: Vanijai\nRahu Kalam: 11.59 AM to 1.26 PM\nYamagandam: 7.39 AM to 9.06 AM\nDurmuhurtham: 10.04 AM to 10.50 AM\nAbhijit Muhurtham: 11.36 AM to 12.22 PM\nSuryodayam: 6.12 AM\nSuryastamayam: 5.46 PM\nChandrodayam: 7.35 PM\nChandrashtamam: Thula\nTaddinam Tithi: Thadiya\nPradesham: Hyderabad (Telugu Style)
SUMMARY:Ashwayujamu Krishna Paksham Thadiya  (28.10.2026)
UID:india-te-2026-10-28@panchangam
END:VEVENT
BEGIN:VEVENT
DTSTART;VALUE=DATE:20260302
CATEGORIES:PANCHANGAM
DESCRIPTION:Phalgunamu Shukla Paksham Chaturdashi  (02.03.2026)\n\nSamvatsaram: Vishvavasu Samvatsaram\nAyanam: Uttarayanam\nRuthuvu: Shishira Ruthuvu\nMasam: Phalgunamu\nPaksham: Shukla Paksham\nTithi: upto 5.56 PM Chaturdashi\, thereafter Pournami\nVaram: Somavaram\nNakshatram: upto 8.30 AM Ashlesha (4 Padam)\, and then Makha\nYogam: Atiganda\nKaranam: Vanijai\nRahu Kalam: 8.02 AM to 9.31 AM\nYamagandam: 10.59 AM to 12.28 PM\nDurmuhurtham: 12.51 PM to 1.39 PM\nAbhijit Muhurtham: 12.04 PM to 12.51 PM\nSuryodayam: 6.33 AM\nSuryastamayam: 6.22 PM\nChandrodayam: 5.29 PM\nChandrashtamam: Dhanu\nTaddinam Tithi: Chaturdashi\nPradesham: Hyderabad (Telugu Style)
SUMMARY:Phalgunamu Shukla Paksham Chaturdashi  (02.03.2026)
UID:india-te-2026-03-02@panchangam
END:VEVENT
BEGIN:VEVENT
BEGIN:VALARM
ACTION:DISPLAY
DESCRIPTION:
TRIGGER:-P1D
END:VALARM
CATEGORIES:VRATAM
DESCRIPTION:Astronomical duration of Pradosham (Krishna).
DTEND:20260415T170138Z
DTSTART:20260414T184250Z
SUMMARY:⏳ Pradosham (Krishna)
UID:india-te-202604150012-Pradosham(Krishna)@vratam
END:VEVENT
BEGIN:VEVENT
DTSTART;VALUE=DATE:20260412
CATEGORIES:PANCHANGAM
DESCRIPTION:Chaitramu Krishna Paksham Dashami  (12.04.2026)\n\nSamvatsaram: Parabhava Samvatsaram\nAyanam: Uttarayanam\nRuthuvu: Vasantha Ruthuvu\nMasam: Chaitramu\nPaksham: Krishna Paksham\nTithi: upto 1.17 AM Dashami\, thereafter Ekadashi\nVaram: Bhanuvaram\nNakshatram: upto 3.55 PM Shravana (3 Padam)\, and then Dhanishta\nYogam: Sadhya\nKaranam: Vanijai\nRahu Kalam: 4.57 PM to 6.31 PM\nYamagandam: 12.16 PM to 1.50 PM\nDurmuhurtham: 4.51 PM to 5.41 PM\nAbhijit Muhurtham: 11.52 AM to 12.41 PM\nSuryodayam: 6.02 AM\nSuryastamayam: 6.31 PM\nChandrodayam: 2.18 AM\nChandrashtamam: Mithunam\nTaddinam Tithi: Dashami\nPradesham: Hyderabad (Telugu Style)
SUMMARY:Chaitramu Krishna Paksham Dashami  (12.04.2026)
UID:india-te-2026-04-12@panchangam
END:VEVENT
BEGIN:VEVENT
DTSTART;VALUE=DATE:20260522
CATEGORIES:PANCHANGAM
DESCRIPTION:Jyeshthamu Shukla Paksham Shashti  (22.05.2026)\n\n🎉 SPECIAL: Sashti (Shukla)\nSamvatsaram: Parabhava Samvatsaram\nAyanam: Uttarayanam\nRuthuvu: Grishma Ruthuvu\nMasam: Jyeshthamu\nPaksham: Shukla Paksham\nTithi: upto 6.25 AM Shashti\, upto 5.04 AM Saptami\, thereafter Ashtami\nVaram: Shukravaram\nNakshatram: upto 2.47 AM Ashlesha (1 Padam)\, and then Makha\nYogam: Vriddhi\nKaranam: Thaitilai\nRahu Kalam: 10.35 AM to 12.12 PM\nYamagandam: 3.28 PM to 5.05 PM\nDurmuhurtham: 8.18 AM to 9.10 AM\, 12.38 PM to 1.30 PM\nAbhijit Muhurtham: 11.46 AM to 12.38 PM\nSuryodayam: 5.42 AM\nSuryastamayam: 6.43 PM\nChandrodayam: 11.10 AM\nChandrashtamam: Dhanu\nTaddinam Tithi: Saptami\nPradesham: Hyderabad (Telugu Style)
SUMMARY:Jyeshthamu Shukla Paksham Shashti  (22.05.2026)
UID:india-te-2026-05-22@panchangam
END:VEVENT
BEGIN:VEVENT
DTSTART;VALUE=DATE:20260801
CATEGORIES:PANCHANGAM
DESCRIPTION:Ashadhamu Krishna Paksham Thadiya  (01.08.2026)\n\nSamvatsaram: Parabhava Samvatsaram\nAyanam: Dakshinayanam\nRuthuvu: Grishma Ruthuvu\nMasam: Ashadhamu\nPaksham: Krishna Paksham\nTithi: upto 11.07 PM Thadiya\, thereafter Chavithi\nVaram: Shanivaram\nNakshatram: upto 9.27 PM Shatabhisham (2 Padam)\, and then Poorvabhadra\nYogam: Shobhana\nKaranam: Vanijai\nRahu Kalam: 9.08 AM to 10.45 AM\nYamagandam: 1.59 PM to 3.35 PM\nDurmuhurtham: 5.55 AM to 6.46 AM\nAbhijit Muhurtham: 11.56 AM to 12.48 PM\nSuryodayam: 5.55 AM\nSuryastamayam: 6.49 PM\nChandrodayam: 8.42 PM\nChandrashtamam: Karkatakam\nTaddinam Tithi: Thadiya\nPradesham: Hyderabad (Telugu Style)
SUMMARY:Ashadhamu Krishna Paksham Thadiya  (01.08.2026)
UID:india-te-2026-08-01@panchangam
END:VEVENT
BEGIN:VEVENT
DTSTART;VALUE=DATE:20260911
CATEGORIES:PANCHANGAM
DESCRIPTION:Bhadrapadamu Krishna Paksham Amavasya 🌑 (11.09.2026)\n\nSamvatsaram: Parabhava Samvatsaram\nAyanam: Dakshinayanam\nRuthuvu: Varsha Ruthuvu\nMasam: Bhadrapadamu\nPaksham: Krishna Paksham\nTithi: upto 8.56 AM Amavasya\, thereafter Padyami\nVaram: Shukravaram\nNakshatram: upto 1.55 PM Pubba (3 Padam)\, and then Uttara\nYogam: Sadhya\nKaranam: Nagava\nRahu Kalam: 10.40 AM to 12.12 PM\nYamagandam: 3.17 PM to 4.49 PM\nDurmuhurtham: 8.31 AM to 9.20 AM\, 12.37 PM to 1.26 PM\nAbhijit Muhurtham: 11.48 AM to 12.37 PM\nSuryodayam: 6.03 AM\nSuryastamayam: 6.21 PM\nChandrodayam: 6.01 AM\nChandrashtamam: Makaram\nTaddinam Tithi: Padyami\nPradesham: Hyderabad (Telugu Style)
SUMMARY:Bhadrapadamu Krishna Paksham Amavasya 🌑 (11.09.2026)
UID:india-te-2026-09-11@panchangam
END:VEVENT
BEGIN:VEVENT
DTSTART;VALUE=DATE:20261105
CATEGORIES:PANCHANGAM
DESCRIPTION:Ashwayujamu Krishna Paksham Ekadashi  (05.11.2026)\n\n🎉 SPECIAL: Ekadashi (Krishna)\nSamvatsaram: Parabhava Samvatsaram\nAyanam: Dakshinayanam\nRuthuvu: Sarad Ruthuvu\nMasam: Ashwayujamu\nPaksham: Krishna Paksham\nTithi: upto 10.36 AM Ekadashi\, thereafter Dwadashi\nVaram: Guruvaram\nNakshatram: upto 4.37 AM Uttara (1 Padam)\, and then Hasta\nYogam: Indra\nKaranam: Balavai\nRahu Kalam: 1.25 PM to 2.51 PM\nYamagandam: 6.16 AM to 7.41 AM\nDurmuhurtham: 1.08 PM to 1.54 PM\nAbhijit Muhurtham: 11.36 AM to 12.22 PM\nSuryodayam: 6.16 AM\nSuryastamayam: 5.42 PM\nChandrodayam: 2.40 AM\nChandrashtamam: Makaram\nTaddinam Tithi: Dwadashi\nPradesham: Hyderabad (Telugu Style)
SUMMARY:Ashwayujamu Krishna Paksham Ekadashi  (05.11.2026)
UID:india-te-2026-11-05@panchangam
END:VEVENT
BEGIN:VEVENT
DTSTART;VALUE=DATE:20261215
CATEGORIES:PANCHANGAM
DESCRIPTION:Margashiramu Shukla Paksham Shashti  (15.12.2026)\n\n🎉 SPECIAL: Sashti (Shukla)\nSamvatsaram: Parabhava Samvatsaram\nAyanam: Dakshinayanam\nRuthuvu: Hemantha Ruthuvu\nMasam: Margashiramu\nPaksham: Shukla Paksham\nTithi: upto 9.19 PM Shashti\, thereafter Saptami\nVaram: Mangalavaram\nNakshatram: upto 12.37 PM Dhanishta (4 Padam)\, and then Shatabhisham\nYogam: Harshana\nKaranam: Kaulavai\nRahu Kalam: 2.57 PM to 4.20 PM\nYamagandam: 9.24 AM to 10.47 AM\nDurmuhurtham: 8.06 AM to 8.51 AM\, 11.04 AM to 11.48 AM\nAbhijit Muhurtham: 11.48 AM to 12.33 PM\nSuryodayam: 6.38 AM\nSuryastamayam: 5.44 PM\nChandrodayam: 11.04 AM\nChandrashtamam: Karkatakam\nTaddinam Tithi: Shashti\nPradesham: Hyderabad (Telugu Style)
SUMMARY:Margashiramu Shukla Paksham Shashti  (15.12.2026)
UID:india-te-2026-12-15@panchangam
END:VEVENT
BEGIN:VEVENT
DTSTART;VALUE=DATE:20260210
CATEGORIES:PANCHANGAM
DESCRIPTION:Maghamu Krishna Paksham Ashtami  (10.02.2026)\n\nSamvatsaram: Vishvavasu Samvatsaram\nAyanam: Uttarayanam\nRuthuvu: Shishira Ruthuvu\nMasam: Maghamu\nPaksham: Krishna Paksham\nTithi: upto 7.27 AM Ashtami\, thereafter Navami\nVaram: Mangalavaram\nNakshatram: upto 8.39 AM Vishakha (4 Padam)\, and then Anuradha\nYogam: Dhruva\nKaranam: Kaulavai\nRahu Kalam: 3.22 PM to 4.49 PM\nYamagandam: 9.37 AM to 11.04 AM\nDurmuhurtham: 8.17 AM to 9.03 AM\, 11.21 AM to 12.07 PM\nAbhijit Muhurtham: 12.07 PM to 12.53 PM\nSuryodayam: 6.45 AM\nSuryastamayam: 6.15 PM\nChandrodayam: 12.50 AM\nChandrashtamam: Mesham\nTaddinam Tithi: Navami\nPradesham: Hyderabad (Telugu Style)
SUMMARY:Maghamu Krishna Paksham Ashtami  (10.02.2026)
UID:india-te-2026-02-10@panchangam
END:VEVENT
BEGIN:VEVENT
DTSTART;VALUE=DATE:20260320
CATEGORIES:PANCHANGAM
DESCRIPTION:Chaitramu Shukla Paksham Vidiya  (20.03.2026)\n\nSamvatsaram: Vishvavasu Samvatsaram\nAyanam: Uttarayanam\nRuthuvu: Vasantha Ruthuvu\nMasam: Chaitramu\nPaksham: Shukla Paksham\nTithi: upto 2.31 AM Vidiya\, thereafter Thadiya\nVaram: Shukravaram\nNakshatram: upto 3.04 AM Revathi (1 Padam)\, and then Aswini\nYogam: Brahma\nKaranam: Balavai\nRahu Kalam: 10.52 AM to 12.23 PM\nYamagandam: 3.25 PM to 4.56 PM\nDurmuhurtham: 8.45 AM to 9.34 AM\, 12.47 PM to 1.36 PM\nAbhijit Muhurtham: 11.59 AM to 12.47 PM\nSuryodayam: 6.20 AM\nSuryastamayam: 6.26 PM\nChandrodayam: 6.59 AM\nChandrashtamam: Simham\nTaddinam Tithi: Vidiya\nPradesham: Hyderabad (Telugu Style)
SUMMARY:Chaitramu Shukla Paksham Vidiya  (20.03.2026)
UID:india-te-2026-03-20@panchangam
END:VEVENT
BEGIN:VEVENT
DTSTART;VALUE=DATE:20260430
CATEGORIES:PANCHANGAM
DESCRIPTION:Vaishakhamu Shukla Paksham Chaturdashi  (30.04.2026)\n\nSamvatsaram: Parabhava Samvatsaram\nAyanam: Uttarayanam\nRuthuvu: Vasantha Ruthuvu\nMasam: Vaishakhamu\nPaksham: Shukla Paksham\nTithi: upto 9.13 PM Chaturdashi\, thereafter Pournami\nVaram: Guruvaram\nNakshatram: upto 3.00 AM Chitta (1 Padam)\, and then Swathi\nYogam: Vajra\nKaranam: Garajai\nRahu Kalam: 1.49 PM to 3.24 PM\nYamagandam: 5.50 AM to 7.26 AM\nDurmuhurtham: 1.29 PM to 2.20 PM\nAbhijit Muhurtham: 11.47 AM to 12.38 PM\nSuryodayam: 5.50 AM\nSuryastamayam: 6.35 PM\nChandrodayam: 5.33 PM\nChandrashtamam: Kumbham\nTaddinam Tithi: Chaturdashi\nPradesham: Hyderabad (Telugu Style)
SUMMARY:Vaishakhamu Shukla Paksham Chaturdashi  (30.04.2026)
UID:india-te-2026-04-30@panchangam
END:VEVENT
BEGIN:VEVENT
DTSTART;VALUE=DATE:20260309
CATEGORIES:PANCHANGAM
DESCRIPTION:Phalgunamu Krishna Paksham Shashti  (09.03.2026)\n\nSamvatsaram: Vishvavasu Samvatsaram\nAyanam: Uttarayanam\nRuthuvu: Shishira Ruthuvu\nMasam: Phalgunamu\nPaksham: Krishna Paksham\nTithi: upto 11.27 PM Shashti\, thereafter Saptami\nVaram: Somavaram\nNakshatram: upto 4.55 PM Vishakha (3 Padam)\, and then Anuradha\nYogam: Vyaghata\nKaranam: Garajai\nRahu Kalam: 7.58 AM to 9.27 AM\nYamagandam: 10.57 AM to 12.26 PM\nDurmuhurtham: 12.50 PM to 1.38 PM\nAbhijit Muhurtham: 12.02 PM to 12.50 PM\nSuryodayam: 6.28 AM\nSuryastamayam: 6.24 PM\nChandrodayam: 11.33 PM\nChandrashtamam: Meenam\nTaddinam Tithi: Shashti\nPradesham: Hyderabad (Telugu Style)
SUMMARY:Phalgunamu Krishna Paksham Shashti  (09.03.2026)
UID:india-te-2026-03-09@panchangam
END:VEVENT
BEGIN:VEVENT
DTSTART;VALUE=DATE:20260419
CATEGORIES:PANCHANGAM
DESCRIPTION:Vaishakhamu Shukla Paksham Vidiya  (19.04.2026)\n\nSamvatsaram: Parabhava Samvatsaram\nAyanam: Uttarayanam\nRuthuvu: Vasantha Ruthuvu\nMasam: Vaishakhamu\nPaksham: Shukla Paksham\nTithi: upto 10.49 AM Vidiya\, thereafter Thadiya\nVaram: Bhanuvaram\nNakshatram: upto 7.45 AM Bharani (4 Padam)\, upto 5.10 AM Kruthika\, and then Rohini\nYogam: Aayushman\nKaranam: Kaulavai\nRahu Kalam: 4.58 PM to 6.33 PM\nYamagandam: 12.15 PM to 1.49 PM\nDurmuhurtham: 4.52 PM to 5.42 PM\nAbhijit Muhurtham: 11.50 AM to 12.40 PM\nSuryodayam: 5.57 AM\nSuryastamayam: 6.33 PM\nChandrodayam: 7.07 AM\nChandrashtamam: Kanya\nTaddinam Tithi: Thadiya\nPradesham: Hyderabad (Telugu Style)
SUMMARY:Vaishakhamu Shukla Paksham Vidiya  (19.04.2026)
UID:india-te-2026-04-19@panchangam
END:VEVENT
BEGIN:VEVENT
DTSTART;VALUE=DATE:20260529
CATEGORIES:PANCHANGAM
DESCRIPTION:Jyeshthamu Shukla Paksham Trayodashi  (29.05.2026)\n\nSamvatsaram: Parabhava Samvatsaram\nAyanam: Uttarayanam\nRuthuvu: Grishma Ruthuvu\nMasam: Jyeshthamu\nPaksham: Shukla Paksham\nTithi: upto 9.51 AM Trayodashi\, thereafter Chaturdashi\nVaram: Shukravaram\nNakshatram: upto 11.22 AM Swathi (4 Padam)\, and then Vishakha\nYogam: Parigha\nKaranam: Thaitilai\nRahu Kalam: 10.35 AM to 12.13 PM\nYamagandam: 3.29 PM to 5.07 PM\nDurmuhurtham: 8.18 AM to 9.10 AM\, 12.39 PM to 1.31 PM\nAbhijit Muhurtham: 11.47 AM to 12.39 PM\nSuryodayam: 5.41 AM\nSuryastamayam: 6.45 PM\nChandrodayam: 5.12 PM\nChandrashtamam: Meenam\nTaddinam Tithi: Chaturdashi\nPradesham: Hyderabad (Telugu Style)
SUMMARY:Jyeshthamu Shukla Paksham Trayodashi  (29.05.2026)
UID:india-te-2026-05-29@panchangam
END:VEVENT
BEGIN:VEVENT
DTSTART;VALUE=DATE:20260808
CATEGORIES:PANCHANGAM
DESCRIPTION:Ashadhamu Krishna Paksham Dashami  (08.08.2026)\n\nSamvatsaram: Parabhava Samvatsaram\nAyanam: Dakshinayanam\nRuthuvu: Grishma Ruthuvu\nMasam: Ashadhamu\nPaksham: Krishna Paksham\nTithi: upto 1.59 PM Dashami\, thereafter Ekadashi\nVaram: Shanivaram\nNakshatram: upto 5.28 PM Rohini (2 Padam)\, and then Mrigashira\nYogam: Dhruva\nKaranam: Vishti\nRahu Kalam: 9.09 AM to 10.45 AM\nYamagandam: 1.57 PM to 3.33 PM\nDurmuhurtham: 5.57 AM to 6.48 AM\nAbhijit Muhurtham: 11.56 AM to 12.47 PM\nSuryodayam: 5.57 AM\nSuryastamayam: 6.45 PM\nChandrodayam: 12.57 AM\nChandrashtamam: Thula\nTaddinam Tithi: Ekadashi\nPradesham: Hyderabad (Telugu Style)
SUMMARY:Ashadhamu Krishna Paksham Dashami  (08.08.2026)
UID:india-te-2026-08-08@panchangam
END:VEVENT
BEGIN:VEVENT
DTSTART;VALUE=DATE:20260918
CATEGORIES:PANCHANGAM
DESCRIPTION:Bhadrapadamu Shukla Paksham Saptami  (18.09.2026)\n\nSamvatsaram: Parabhava Samvatsaram\nAyanam: Dakshinayanam\nRuthuvu: Varsha Ruthuvu\nMasam: Bhadrapadamu\nPaksham: Shukla Paksham\nTithi: upto 1.01 PM Saptami\, thereafter Ashtami\nVaram: Shukravaram\nNakshatram: upto 11.30 PM Jyeshta (2 Padam)\, and then Moola\nYogam: Preethi\nKaranam: Vanijai\nRahu Kalam: 10.38 AM to 12.10 PM\nYamagandam: 3.13 PM to 4.44 PM\nDurmuhurtham: 8.30 AM to 9.19 AM\, 12.34 PM to 1.23 PM\nAbhijit Muhurtham: 11.45 AM to 12.34 PM\nSuryodayam: 6.04 AM\nSuryastamayam: 6.15 PM\nChandrodayam: 12.17 PM\nChandrashtamam: Mesham\nTaddinam Tithi: Ashtami\nPradesham: Hyderabad (Telugu Style)
SUMMARY:Bhadrapadamu Shukla Paksham Saptami  (18.09.2026)
UID:india-te-2026-09-18@panchangam
END:VEVENT
BEGIN:VEVENT
DTSTART;VALUE=DATE:20261013
CATEGORIES:PANCHANGAM
DESCRIPTION:Ashwayujamu Shukla Paksham Thadiya  (13.10.2026)\n\nSamvatsaram: Parabhava Samvatsaram\nAyanam: Dakshinayanam\nRuthuvu: Sarad Ruthuvu\nMasam: Ashwayujamu\nPaksham: Shukla Paksham\nTithi: upto 11.28 PM Thadiya\, thereafter Chavithi\nVaram: Mangalavaram\nNakshatram: upto 2.27 AM Vishakha (1 Padam)\, and then Anuradha\nYogam: Preethi\nKaranam: Thaitilai\nRahu Kalam: 2.59 PM to 4.27 PM\nYamagandam: 9.05 AM to 10.33 AM\nDurmuhurtham: 7.42 AM to 8.30 AM\, 10.51 AM to 11.38 AM\nAbhijit Muhurtham: 11.38 AM to 12.25 PM\nSuryodayam: 6.08 AM\nSuryastamayam: 5.55 PM\nChandrodayam: 8.18 AM\nChandrashtamam: Meenam\nTaddinam Tithi: Thadiya\nPradesham: Hyderabad (Telugu Style)
SUMMARY:Ashwayujamu Shukla Paksham Thadiya  (13.10.2026)
UID:india-te-2026-10-13@panchangam
END:VEVENT
BEGIN:VEVENT
DTSTART;VALUE=DATE:20261123
CATEGORIES:PANCHANGAM
DESCRIPTION:Karthikamu Shukla Paksham Chaturdashi  (23.11.2026)\n\nSamvatsaram: Parabhava Samvatsaram\nAyanam: Dakshinayanam\nRuthuvu: Sarad Ruthuvu\nMasam: Karthikamu\nPaksham: Shukla Paksham\nTithi: upto 11.42 PM Chaturdashi\, thereafter Pournami\nVaram: Somavaram\nNakshatram: upto 2.38 AM Bharani (1 Padam)\, and then Kruthika\nYogam: Variyana\nKaranam: Garajai\nRahu Kalam: 7.49 AM to 9.13 AM\nYamagandam: 10.38 AM to 12.02 PM\nDurmuhurtham: 12.24 PM to 1.09 PM\nAbhijit Muhurtham: 11.39 AM to 12.24 PM\nSuryodayam: 6.25 AM\nSuryastamayam: 5.39 PM\nChandrodayam: 4.24 PM\nChandrashtamam: Kanya\nTaddinam Tithi: Chaturdashi\nPradesham: Hyderabad (Telugu Style)
SUMMARY:Karthikamu Shukla Paksham Chaturdashi  (23.11.2026)
UID:india-te-2026-11-23@panchangam
END:VEVENT
BEGIN:VEVENT
BEGIN:VALARM
ACTION:DISPLAY
DESCRIPTION:
TRIGGER:-P1D
END:VALARM
CATEGORIES:VRATAM
DESCRIPTION:Astronomical duration of Pradosham (Shukla).
DTEND:20260331T012626Z
DTSTART:20260330T014007Z
SUMMARY:⏳ Pradosham (Shukla)
UID:india-te-202603300710-Pradosham(Shukla)@vratam
END:VEVENT
BEGIN:VEVENT
BEGIN:VALARM
ACTION:DISPLAY
DESCRIPTION:
TRIGGER:-P1D
END:VALARM
CATEGORIES:VRATAM
DESCRIPTION:Astronomical duration of Sashti (Shukla).
DTEND:20260818T122106Z
DTSTART:20260817T113033Z
SUMMARY:⏳ Sashti (Shukla)
UID:india-te-202608171700-Sashti(Shukla)@vratam
END:VEVENT
BEGIN:VEVENT
DTSTART;VALUE=DATE:20260107
CATEGORIES:PANCHANGAM
DESCRIPTION:Pushyamu Krishna Paksham Chavithi  (07.01.2026)\n\nSamvatsaram: Vishvavasu Samvatsaram\nAyanam: Uttarayanam\nRuthuvu: Hemantha Ruthuvu\nMasam: Pushyamu\nPaksham: Krishna Paksham\nTithi: upto 6.53 AM Chavithi\, upto 6.34 AM Panchami\, thereafter Shashti\nVaram: Budhavaram\nNakshatram: upto 12.35 PM Makha (4 Padam)\, and then Pubba\nYogam: Aayushman\nKaranam: Balavai\nRahu Kalam: 12.22 PM to 1.45 PM\nYamagandam: 8.11 AM to 9.35 AM\nDurmuhurtham: 10.30 AM to 11.15 AM\nAbhijit Muhurtham: 11.59 AM to 12.44 PM\nSuryodayam: 6.47 AM\nSuryastamayam: 5.56 PM\nChandrodayam: 9.57 PM\nChandrashtamam: Makaram\nTaddinam Tithi: Panchami\nPradesham: Hyderabad (Telugu Style)
SUMMARY:Pushyamu Krishna Paksham Chavithi  (07.01.2026)
UID:india-te-2026-01-07@panchangam
END:VEVENT
BEGIN:VEVENT
DTSTART;VALUE=DATE:20260217
CATEGORIES:PANCHANGAM
DESCRIPTION:Phalgunamu Krishna Paksham Amavasya 🌑 (17.02.2026)\n\nSamvatsaram: Vishvavasu Samvatsaram\nAyanam: Uttarayanam\nRuthuvu: Shishira Ruthuvu\nMasam: Phalgunamu\nPaksham: Krishna Paksham\nTithi: upto 5.31 PM Amavasya\, thereafter Padyami\nVaram: Mangalavaram\nNakshatram: upto 9.56 PM Dhanishta (2 Padam)\, and then Shatabhisham\nYogam: Parigha\nKaranam: Nagava\nRahu Kalam: 3.24 PM to 4.51 PM\nYamagandam: 9.35 AM to 11.03 AM\nDurmuhurtham: 8.14 AM to 9.01 AM\, 11.20 AM to 12.06 PM\nAbhijit Muhurtham: 12.06 PM to 12.53 PM\nSuryodayam: 6.41 AM\nSuryastamayam: 6.18 PM\nChandrodayam: 6.31 AM\nChandrashtamam: Mithunam\nTaddinam Tithi: Amavasya\nPradesham: Hyderabad (Telugu Style)
SUMMARY:Phalgunamu Krishna Paksham Amavasya 🌑 (17.02.2026)
UID:india-te-2026-02-17@panchangam
END:VEVENT
BEGIN:VEVENT
DTSTART;VALUE=DATE:20260327
CATEGORIES:PANCHANGAM
DESCRIPTION:Chaitramu Shukla Paksham Navami  (27.03.2026)\n\n🎉 SPECIAL: Srirama Navami\nSamvatsaram: Vishvavasu Samvatsaram\nAyanam: Uttarayanam\nRuthuvu: Vasantha Ruthuvu\nMasam: Chaitramu\nPaksham: Shukla Paksham\nTithi: upto 10.07 AM Navami\, thereafter Dashami\nVaram: Shukravaram\nNakshatram: upto 4.02 PM Punarvasu (3 Padam)\, and then Pushyami\nYogam: Atiganda\nKaranam: Kaulavai\nRahu Kalam: 10.49 AM to 12.21 PM\nYamagandam: 3.24 PM to 4.56 PM\nDurmuhurtham: 8.41 AM to 9.30 AM\, 12.46 PM to 1.34 PM\nAbhijit Muhurtham: 11.57 AM to 12.46 PM\nSuryodayam: 6.14 AM\nSuryastamayam: 6.28 PM\nChandrodayam: 1.22 PM\nChandrashtamam: Vrushchikam\nTaddinam Tithi: Dashami\nPradesham: Hyderabad (Telugu Style)
SUMMARY:Chaitramu Shukla Paksham Navami  (27.03.2026)
UID:india-te-2026-03-27@panchangam
END:VEVENT
BEGIN:VEVENT
BEGIN:VALARM
ACTION:DISPLAY
DESCRIPTION:
TRIGGER:-P1D
END:VALARM
CATEGORIES:VRATAM
DESCRIPTION:Astronomical duration of Sankatahara Chathurthi.
DTEND:20260506T022145Z
DTSTART:20260504T235448Z
SUMMARY:⏳ Sankatahara Chathurthi
UID:india-te-202605050524-SankataharaChathurthi@vratam
END:VEVENT
BEGIN:VEVENT
DTSTART;VALUE=DATE:20260606
CATEGORIES:PANCHANGAM
DESCRIPTION:Jyeshthamu Krishna Paksham Shashti  (06.06.2026)\n\nSamvatsaram: Parabhava Samvatsaram\nAyanam: Uttarayanam\nRuthuvu: Grishma Ruthuvu\nMasam: Jyeshthamu\nPaksham: Krishna Paksham\nTithi: upto 2.41 AM Shashti\, thereafter Saptami\nVaram: Shanivaram\nNakshatram: upto 6.46 AM Shravana (4 Padam)\, and then Dhanishta\nYogam: Indra\nKaranam: Garajai\nRahu Kalam: 8.57 AM to 10.36 AM\nYamagandam: 1.53 PM to 3.31 PM\nDurmuhurtham: 5.40 AM to 6.33 AM\nAbhijit Muhurtham: 11.48 AM to 12.40 PM\nSuryodayam: 5.40 AM\nSuryastamayam: 6.48 PM\nChandrodayam: 11.29 PM\nChandrashtamam: Mithunam\nTaddinam Tithi: Shashti\nPradesham: Hyderabad (Telugu Style)
SUMMARY:Jyeshthamu Krishna Paksham Shashti  (06.06.2026)
UID:india-te-2026-06-06@panchangam
END:VEVENT
BEGIN:VEVENT
DTSTART;VALUE=DATE:20260716
CATEGORIES:PANCHANGAM
DESCRIPTION:Ashadhamu Shukla Paksham Vidiya  (16.07.2026)\n\nSamvatsaram: Parabhava Samvatsaram\nAyanam: Dakshinayanam\nRuthuvu: Grishma Ruthuvu\nMasam: Ashadhamu\nPaksham: Shukla Paksham\nTithi: upto 8.53 AM Vidiya\, thereafter Thadiya\nVaram: Guruvaram\nNakshatram: upto 8.29 PM Ashlesha (2 Padam)\, and then Makha\nYogam: Siddhi\nKaranam: Kaulavai\nRahu Kalam: 2.00 PM to 3.38 PM\nYamagandam: 5.50 AM to 7.28 AM\nDurmuhurtham: 1.40 PM to 2.32 PM\nAbhijit Muhurtham: 11.55 AM to 12.48 PM\nSuryodayam: 5.50 AM\nSuryastamayam: 6.53 PM\nChandrodayam: 7.39 AM\nChandrashtamam: Dhanu\nTaddinam Tithi: Thadiya\nPradesham: Hyderabad (Telugu Style)
SUMMARY:Ashadhamu Shukla Paksham Vidiya  (16.07.2026)
UID:india-te-2026-07-16@panchangam
END:VEVENT
BEGIN:VEVENT
DTSTART;VALUE=DATE:20260826
CATEGORIES:PANCHANGAM
DESCRIPTION:Sravanamu Shukla Paksham Trayodashi  (26.08.2026)\n\nSamvatsaram: Parabhava Samvatsaram\nAyanam: Dakshinayanam\nRuthuvu: Varsha Ruthuvu\nMasam: Sravanamu\nPaksham: Shukla Paksham\nTithi: upto 7.59 AM Trayodashi\, thereafter Chaturdashi\nVaram: Budhavaram\nNakshatram: upto 1.31 AM Shravana (1 Padam)\, and then Dhanishta\nYogam: Saubhagya\nKaranam: Thaitilai\nRahu Kalam: 12.17 PM to 1.51 PM\nYamagandam: 7.35 AM to 9.09 AM\nDurmuhurtham: 10.12 AM to 11.02 AM\nAbhijit Muhurtham: 11.52 AM to 12.42 PM\nSuryodayam: 6.01 AM\nSuryastamayam: 6.34 PM\nChandrodayam: 5.28 PM\nChandrashtamam: Mithunam\nTaddinam Tithi: Chaturdashi\nPradesham: Hyderabad (Telugu Style)
SUMMARY:Sravanamu Shukla Paksham Trayodashi  (26.08.2026)
UID:india-te-2026-08-26@panchangam
END:VEVENT
BEGIN:VEVENT
DTSTART;VALUE=DATE:20261031
CATEGORIES:PANCHANGAM
DESCRIPTION:Ashwayujamu Krishna Paksham Shashti  (31.10.2026)\n\nSamvatsaram: Parabhava Samvatsaram\nAyanam: Dakshinayanam\nRuthuvu: Sarad Ruthuvu\nMasam: Ashwayujamu\nPaksham: Krishna Paksham\nTithi: upto 4.57 PM Shashti\, thereafter Saptami\nVaram: Shanivaram\nNakshatram: upto 7.49 AM Arudra (4 Padam)\, and then Punarvasu\nYogam: Siddha\nKaranam: Vanijai\nRahu Kalam: 9.06 AM to 10.33 AM\nYamagandam: 1.25 PM to 2.52 PM\nDurmuhurtham: 6.14 AM to 7.00 AM\nAbhijit Muhurtham: 11.36 AM to 12.22 PM\nSuryodayam: 6.14 AM\nSuryastamayam: 5.45 PM\nChandrodayam: 10.49 PM\nChandrashtamam: Vrushchikam\nTaddinam Tithi: Shashti\nPradesham: Hyderabad (Telugu Style)
SUMMARY:Ashwayujamu Krishna Paksham Shashti  (31.10.2026)
UID:india-te-2026-10-31@panchangam
END:VEVENT
BEGIN:VEVENT
DTSTART;VALUE=DATE:20260125
CATEGORIES:PANCHANGAM
DESCRIPTION:Maghamu Shukla Paksham Saptami  (25.01.2026)\n\nSamvatsaram: Vishvavasu Samvatsaram\nAyanam: Uttarayanam\nRuthuvu: Shishira Ruthuvu\nMasam: Maghamu\nPaksham: Shukla Paksham\nTithi: upto 11.10 PM Saptami\, thereafter Ashtami\nVaram: Bhanuvaram\nNakshatram: upto 2.13 PM Revathi (3 Padam)\, and then Aswini\nYogam: Siddha\nKaranam: Garajai\nRahu Kalam: 4.42 PM to 6.07 PM\nYamagandam: 12.28 PM to 1.53 PM\nDurmuhurtham: 4.37 PM to 5.22 PM\nAbhijit Muhurtham: 12.05 PM to 12.50 PM\nSuryodayam: 6.49 AM\nSuryastamayam: 6.07 PM\nChandrodayam: 11.02 AM\nChandrashtamam: Simham\nTaddinam Tithi: Saptami\nPradesham: Hyderabad (Telugu Style)
SUMMARY:Maghamu Shukla Paksham Saptami  (25.01.2026)
UID:india-te-2026-01-25@panchangam
END:VEVENT
BEGIN:VEVENT
DTSTART;VALUE=DATE:20260404
CATEGORIES:PANCHANGAM
DESCRIPTION:Chaitramu Krishna Paksham Vidiya  (04.04.2026)\n\nSamvatsaram: Parabhava Samvatsaram\nAyanam: Uttarayanam\nRuthuvu: Vasantha Ruthuvu\nMasam: Chaitramu\nPaksham: Krishna Paksham\nTithi: upto 10.09 AM Vidiya\, thereafter Thadiya\nVaram: Shanivaram\nNakshatram: upto 10.19 PM Swathi (2 Padam)\, and then Vishakha\nYogam: Harshana\nKaranam: Garajai\nRahu Kalam: 9.13 AM to 10.46 AM\nYamagandam: 1.51 PM to 3.24 PM\nDurmuhurtham: 6.08 AM to 6.57 AM\nAbhijit Muhurtham: 11.54 AM to 12.43 PM\nSuryodayam: 6.08 AM\nSuryastamayam: 6.29 PM\nChandrodayam: 8.31 PM\nChandrashtamam: Meenam\nTaddinam Tithi: Thadiya\nPradesham: Hyderabad (Telugu Style)
SUMMARY:Chaitramu Krishna Paksham Vidiya  (04.04.2026)
UID:india-te-2026-04-04@panchangam
END:VEVENT
BEGIN:VEVENT
DTSTART;VALUE=DATE:20260514
CATEGORIES:PANCHANGAM
DESCRIPTION:Vaishakhamu Krishna Paksham Dwadashi  (14.05.2026)\n\n🎉 SPECIAL: Pradosham (Krishna)\nSamvatsaram: Parabhava Samvatsaram\nAyanam: Uttarayanam\nRuthuvu: Vasantha Ruthuvu\nMasam: Vaishakhamu\nPaksham: Krishna Paksham\nTithi: upto 11.21 AM Dwadashi\, thereafter Trayodashi\nVaram: Guruvaram\nNakshatram: upto 11.10 PM Revathi (1 Padam)\, and then Aswini\nYogam: Preethi\nKaranam: Thaitilai\nRahu Kalam: 1.49 PM to 3.26 PM\nYamagandam: 5.44 AM to 7.21 AM\nDurmuhurtham: 1.30 PM to 2.21 PM\nAbhijit Muhurtham: 11.46 AM to 12.38 PM\nSuryodayam: 5.44 AM\nSuryastamayam: 6.40 PM\nChandrodayam: 3.23 AM\nChandrashtamam: Simham\nTaddinam Tithi: Trayodashi\nPradesham: Hyderabad (Telugu Style)
SUMMARY:Vaishakhamu Krishna Paksham Dwadashi  (14.05.2026)
UID:india-te-2026-05-14@panchangam
END:VEVENT
BEGIN:VEVENT
DTSTART;VALUE=DATE:20260624
CATEGORIES:PANCHANGAM
DESCRIPTION:Jyeshthamu Shukla Paksham Dashami  (24.06.2026)\n\nSamvatsaram: Parabhava Samvatsaram\nAyanam: Dakshinayanam\nRuthuvu: Grishma Ruthuvu\nMasam: Jyeshthamu\nPaksham: Shukla Paksham\nTithi: upto 6.12 PM Dashami\, thereafter Ekadashi\nVaram: Budhavaram\nNakshatram: upto 2.43 PM Chitta (3 Padam)\, and then Swathi\nYogam: Parigha\nKaranam: Garajai\nRahu Kalam: 12.18 PM to 1.57 PM\nYamagandam: 7.22 AM to 9.00 AM\nDurmuhurtham: 10.06 AM to 10.59 AM\nAbhijit Muhurtham: 11.52 AM to 12.44 PM\nSuryodayam: 5.43 AM\nSuryastamayam: 6.53 PM\nChandrodayam: 2.17 PM\nChandrashtamam: Meenam\nTaddinam Tithi: Dashami\nPradesham: Hyderabad (Telugu Style)
SUMMARY:Jyeshthamu Shukla Paksham Dashami  (24.06.2026)
UID:india-te-2026-06-24@panchangam
END:VEVENT
BEGIN:VEVENT
DTSTART;VALUE=DATE:20260903
CATEGORIES:PANCHANGAM
DESCRIPTION:Sravanamu Krishna Paksham Saptami  (03.09.2026)\n\nSamvatsaram: Parabhava Samvatsaram\nAyanam: Dakshinayanam\nRuthuvu: Varsha Ruthuvu\nMasam: Sravanamu\nPaksham: Krishna Paksham\nTithi: upto 2.25 AM Saptami\, thereafter Ashtami\nVaram: Guruvaram\nNakshatram: upto 1.07 AM Kruthika (1 Padam)\, and then Rohini\nYogam: Vyaghata\nKaranam: Vishti\nRahu Kalam: 1.48 PM to 3.21 PM\nYamagandam: 6.02 AM to 7.35 AM\nDurmuhurtham: 1.29 PM to 2.19 PM\nAbhijit Muhurtham: 11.50 AM to 12.40 PM\nSuryodayam: 6.02 AM\nSuryastamayam: 6.28 PM\nChandrodayam: 10.51 PM\nChandrashtamam: Kanya\nTaddinam Tithi: Saptami\nPradesham: Hyderabad (Telugu Style)
SUMMARY:Sravanamu Krishna Paksham Saptami  (03.09.2026)
UID:india-te-2026-09-03@panchangam
END:VEVENT
BEGIN:VEVENT
BEGIN:VALARM
ACTION:DISPLAY
DESCRIPTION:
TRIGGER:-P1D
END:VALARM
DTSTART;VALUE=DATE:20261108
CATEGORIES:FESTIVAL
DESCRIPTION:Deity: Goddess Lakshmi\nFood: Sweets\, Murukku\nRules: Hyderabad (Telugu Style) Calendar
SUMMARY:🎉 Deepavali
UID:india-te-2026-11-08-Deepavali@festival
END:VEVENT
BEGIN:VEVENT
BEGIN:VALARM
ACTION:DISPLAY
DESCRIPTION:
TRIGGER:-P1D
END:VALARM
CATEGORIES:VRATAM
DESCRIPTION:Astronomical duration of Pradosham (Shukla).
DTEND:20260727T104525Z
DTSTART:20260726T082821Z
SUMMARY:⏳ Pradosham (Shukla)
UID:india-te-202607261358-Pradosham(Shukla)@vratam
END:VEVENT
BEGIN:VEVENT
DTSTART;VALUE=DATE:20261207
CATEGORIES:PANCHANGAM
DESCRIPTION:Karthikamu Krishna Paksham Chaturdashi  (07.12.2026)\n\nSamvatsaram: Parabhava Samvatsaram\nAyanam: Dakshinayanam\nRuthuvu: Sarad Ruthuvu\nMasam: Karthikamu\nPaksham: Krishna Paksham\nTithi: upto 4.13 AM Chaturdashi\, thereafter Amavasya\nVaram: Somavaram\nNakshatram: upto 4.32 PM Vishakha (3 Padam)\, and then Anuradha\nYogam: Atiganda\nKaranam: Vishti\nRahu Kalam: 7.56 AM to 9.20 AM\nYamagandam: 10.43 AM to 12.07 PM\nDurmuhurtham: 12.29 PM to 1.14 PM\nAbhijit Muhurtham: 11.45 AM to 12.29 PM\nSuryodayam: 6.33 AM\nSuryastamayam: 5.41 PM\nChandrodayam: 4.58 AM\nChandrashtamam: Meenam\nTaddinam Tithi: Chaturdashi\nPradesham: Hyderabad (Telugu Style)
SUMMARY:Karthikamu Krishna Paksham Chaturdashi  (07.12.2026)
UID:india-te-2026-12-07@panchangam
END:VEVENT
BEGIN:VEVENT
DTSTART;VALUE=DATE:20260202
CATEGORIES:PANCHANGAM
DESCRIPTION:Maghamu Krishna Paksham Padyami  (02.02.2026)\n\nSamvatsaram: Vishvavasu Samvatsaram\nAyanam: Uttarayanam\nRuthuvu: Shishira Ruthuvu\nMasam: Maghamu\nPaksham: Krishna Paksham\nTithi: upto 1.52 AM Padyami\, thereafter Vidiya\nVaram: Somavaram\nNakshatram: upto 11.25 PM Ashlesha (2 Padam)\, and then Makha\nYogam: Aayushman\nKaranam: Balavai\nRahu Kalam: 8.13 AM to 9.38 AM\nYamagandam: 11.04 AM to 12.29 PM\nDurmuhurtham: 12.52 PM to 1.38 PM\nAbhijit Muhurtham: 12.06 PM to 12.52 PM\nSuryodayam: 6.47 AM\nSuryastamayam: 6.11 PM\nChandrodayam: 6.45 PM\nChandrashtamam: Dhanu\nTaddinam Tithi: Padyami\nPradesham: Hyderabad (Telugu Style)
SUMMARY:Maghamu Krishna Paksham Padyami  (02.02.2026)
UID:india-te-2026-02-02@panchangam
END:VEVENT
BEGIN:VEVENT
DTSTART;VALUE=DATE:20260312
CATEGORIES:PANCHANGAM
DESCRIPTION:Phalgunamu Krishna Paksham Navami  (12.03.2026)\n\nSamvatsaram: Vishvavasu Samvatsaram\nAyanam: Uttarayanam\nRuthuvu: Shishira Ruthuvu\nMasam: Phalgunamu\nPaksham: Krishna Paksham\nTithi: Navami\nVaram: Guruvaram\nNakshatram: upto 1.27 AM Moola (2 Padam)\, and then Poorvashada\nYogam: Siddhi\nKaranam: Thaitilai\nRahu Kalam: 1.55 PM to 3.25 PM\nYamagandam: 6.26 AM to 7.56 AM\nDurmuhurtham: 1.37 PM to 2.25 PM\nAbhijit Muhurtham: 12.01 PM to 12.49 PM\nSuryodayam: 6.26 AM\nSuryastamayam: 6.25 PM\nChandrodayam: 1.20 AM\nChandrashtamam: Vrushabham\nTaddinam Tithi: Navami\nPradesham: Hyderabad (Telugu Style)
SUMMARY:Phalgunamu Krishna Paksham Navami  (12.03.2026)
UID:india-te-2026-03-12@panchangam
END:VEVENT
BEGIN:VEVENT
DTSTART;VALUE=DATE:20260422
CATEGORIES:PANCHANGAM
DESCRIPTION:Vaishakhamu Shukla Paksham Shashti  (22.04.2026)\n\n🎉 SPECIAL: Sashti (Shukla)\nSamvatsaram: Parabhava Samvatsaram\nAyanam: Uttarayanam\nRuthuvu: Vasantha Ruthuvu\nMasam: Vaishakhamu\nPaksham: Shukla Paksham\nTithi: upto 10.50 PM Shashti\, thereafter Saptami\nVaram: Budhavaram\nNakshatram: upto 10.50 PM Arudra (1 Padam)\, and then Punarvasu\nYogam: Atiganda\nKaranam: Kaulavai\nRahu Kalam: 12.14 PM to 1.49 PM\nYamagandam: 7.30 AM to 9.05 AM\nDurmuhurtham: 10.08 AM to 10.58 AM\nAbhijit Muhurtham: 11.49 AM to 12.39 PM\nSuryodayam: 5.55 AM\nSuryastamayam: 6.33 PM\nChandrodayam: 10.10 AM\nChandrashtamam: Vrushchikam\nTaddinam Tithi: Shashti\nPradesham: Hyderabad (Telugu Style)
SUMMARY:Vaishakhamu Shukla Paksham Shashti  (22.04.2026)
UID:india-te-2026-04-22@panchangam
END:VEVENT
BEGIN:VEVENT
BEGIN:VALARM
ACTION:DISPLAY
DESCRIPTION:
TRIGGER:-P1D
END:VALARM
CATEGORIES:VRATAM
DESCRIPTION:Astronomical duration of Ekadashi (Shukla).
DTEND:20260922T161347Z
DTSTART:20260921T143124Z
SUMMARY:⏳ Ekadashi (Shukla)
UID:india-te-202609212001-Ekadashi(Shukla)@vratam
END:VEVENT
BEGIN:VEVENT
DTSTART;VALUE=DATE:20260701
CATEGORIES:PANCHANGAM
DESCRIPTION:Jyeshthamu Krishna Paksham Padyami  (01.07.2026)\n\nSamvatsaram: Parabhava Samvatsaram\nAyanam: Dakshinayanam\nRuthuvu: Grishma Ruthuvu\nMasam: Jyeshthamu\nPaksham: Krishna Paksham\nTithi: upto 7.38 AM Padyami\, thereafter Vidiya\nVaram: Budhavaram\nNakshatram: upto 7.36 AM Poorvashada (4 Padam)\, and then Uttarashada\nYogam: Indra\nKaranam: Kaulavai\nRahu Kalam: 12.19 PM to 1.58 PM\nYamagandam: 7.23 AM to 9.02 AM\nDurmuhurtham: 10.08 AM to 11.00 AM\nAbhijit Muhurtham: 11.53 AM to 12.46 PM\nSuryodayam: 5.45 AM\nSuryastamayam: 6.54 PM\nChandrodayam: 8.11 PM\nChandrashtamam: Vrushabham\nTaddinam Tithi: Vidiya\nPradesham: Hyderabad (Telugu Style)
SUMMARY:Jyeshthamu Krishna Paksham Padyami  (01.07.2026)
UID:india-te-2026-07-01@panchangam
END:VEVENT
BEGIN:VEVENT
DTSTART;VALUE=DATE:20260811
CATEGORIES:PANCHANGAM
DESCRIPTION:Ashadhamu Krishna Paksham Chaturdashi  (11.08.2026)\n\nSamvatsaram: Parabhava Samvatsaram\nAyanam: Dakshinayanam\nRuthuvu: Grishma Ruthuvu\nMasam: Ashadhamu\nPaksham: Krishna Paksham\nTithi: upto 1.53 AM Chaturdashi\, thereafter Amavasya\nVaram: Mangalavaram\nNakshatram: upto 10.46 AM Punarvasu (4 Padam)\, and then Pushyami\nYogam: Siddhi\nKaranam: Vishti\nRahu Kalam: 3.32 PM to 5.08 PM\nYamagandam: 9.09 AM to 10.45 AM\nDurmuhurtham: 7.40 AM to 8.31 AM\, 11.04 AM to 11.55 AM\nAbhijit Muhurtham: 11.55 AM to 12.46 PM\nSuryodayam: 5.58 AM\nSuryastamayam: 6.44 PM\nChandrodayam: 4.13 AM\nChandrashtamam: Dhanu\nTaddinam Tithi: Chaturdashi\nPradesham: Hyderabad (Telugu Style)
SUMMARY:Ashadhamu Krishna Paksham Chaturdashi  (11.08.2026)
UID:india-te-2026-08-11@panchangam
END:VEVENT
BEGIN:VEVENT
DTSTART;VALUE=DATE:20260921
CATEGORIES:PANCHANGAM
DESCRIPTION:Bhadrapadamu Shukla Paksham Dashami  (21.09.2026)\n\nSamvatsaram: Parabhava Samvatsaram\nAyanam: Dakshinayanam\nRuthuvu: Varsha Ruthuvu\nMasam: Bhadrapadamu\nPaksham: Shukla Paksham\nTithi: upto 8.01 PM Dashami\, thereafter Ekadashi\nVaram: Somavaram\nNakshatram: Uttarashada (1 Padam)\nYogam: Shobhana\nKaranam: Thaitilai\nRahu Kalam: 7.35 AM to 9.06 AM\nYamagandam: 10.38 AM to 12.09 PM\nDurmuhurtham: 12.33 PM to 1.21 PM\nAbhijit Muhurtham: 11.44 AM to 12.33 PM\nSuryodayam: 6.04 AM\nSuryastamayam: 6.13 PM\nChandrodayam: 2.42 PM\nChandrashtamam: Vrushabham\nTaddinam Tithi: Dashami\nPradesham: Hyderabad (Telugu Style)
SUMMARY:Bhadrapadamu Shukla Paksham Dashami  (21.09.2026)
UID:india-te-2026-09-21@panchangam
END:VEVENT
BEGIN:VEVENT
DTSTART;VALUE=DATE:20261005
CATEGORIES:PANCHANGAM
DESCRIPTION:Bhadrapadamu Krishna Paksham Dashami  (05.10.2026)\n\nSamvatsaram: Parabhava Samvatsaram\nAyanam: Dakshinayanam\nRuthuvu: Varsha Ruthuvu\nMasam: Bhadrapadamu\nPaksham: Krishna Paksham\nTithi: upto 2.08 AM Dashami\, thereafter Ekadashi\nVaram: Somavaram\nNakshatram: upto 11.48 PM Pushyami (1 Padam)\, and then Ashlesha\nYogam: Shiva\nKaranam: Vanijai\nRahu Kalam: 7.36 AM to 9.05 AM\nYamagandam: 10.35 AM to 12.04 PM\nDurmuhurtham: 12.28 PM to 1.15 PM\nAbhijit Muhurtham: 11.40 AM to 12.28 PM\nSuryodayam: 6.06 AM\nSuryastamayam: 6.01 PM\nChandrodayam: 12.55 AM\nChandrashtamam: Dhanu\nTaddinam Tithi: Dashami\nPradesham: Hyderabad (Telugu Style)
SUMMARY:Bhadrapadamu Krishna Paksham Dashami  (05.10.2026)
UID:india-te-2026-10-05@panchangam
END:VEVENT
BEGIN:VEVENT
DTSTART;VALUE=DATE:20261115
CATEGORIES:PANCHANGAM
DESCRIPTION:Karthikamu Shukla Paksham Shashti  (15.11.2026)\n\n🎉 SPECIAL: Sashti (Shukla)\nSamvatsaram: Parabhava Samvatsaram\nAyanam: Dakshinayanam\nRuthuvu: Sarad Ruthuvu\nMasam: Karthikamu\nPaksham: Shukla Paksham\nTithi: upto 2.01 AM Shashti\, thereafter Saptami\nVaram: Bhanuvaram\nNakshatram: upto 12.14 AM Uttarashada (2 Padam)\, and then Shravana\nYogam: Shoola\nKaranam: Kaulavai\nRahu Kalam: 4.15 PM to 5.40 PM\nYamagandam: 12 Noon to 1.25 PM\nDurmuhurtham: 4.09 PM to 4.54 PM\nAbhijit Muhurtham: 11.37 AM to 12.23 PM\nSuryodayam: 6.20 AM\nSuryastamayam: 5.40 PM\nChandrodayam: 11.13 AM\nChandrashtamam: Mithunam\nTaddinam Tithi: Shashti\nPradesham: Hyderabad (Telugu Style)
SUMMARY:Karthikamu Shukla Paksham Shashti  (15.11.2026)
UID:india-te-2026-11-15@panchangam
END:VEVENT
BEGIN:VEVENT
DTSTART;VALUE=DATE:20261225
CATEGORIES:PANCHANGAM
DESCRIPTION:Margashiramu Krishna Paksham Vidiya  (25.12.2026)\n\nSamvatsaram: Parabhava Samvatsaram\nAyanam: Uttarayanam\nRuthuvu: Hemantha Ruthuvu\nMasam: Margashiramu\nPaksham: Krishna Paksham\nTithi: upto 11.26 PM Vidiya\, thereafter Thadiya\nVaram: Shukravaram\nNakshatram: upto 11.26 PM Punarvasu (1 Padam)\, and then Pushyami\nYogam: Brahma\nKaranam: Thaitilai\nRahu Kalam: 10.52 AM to 12.15 PM\nYamagandam: 3.02 PM to 4.25 PM\nDurmuhurtham: 8.56 AM to 9.40 AM\, 12.38 PM to 1.22 PM\nAbhijit Muhurtham: 11.53 AM to 12.38 PM\nSuryodayam: 6.43 AM\nSuryastamayam: 5.48 PM\nChandrodayam: 7.21 PM\nChandrashtamam: Vrushchikam\nTaddinam Tithi: Vidiya\nPradesham: Hyderabad (Telugu Style)
SUMMARY:Margashiramu Krishna Paksham Vidiya  (25.12.2026)
UID:india-te-2026-12-25@panchangam
END:VEVENT
BEGIN:VEVENT
DTSTART;VALUE=DATE:20260110
CATEGORIES:PANCHANGAM
DESCRIPTION:Pushyamu Krishna Paksham Saptami  (10.01.2026)\n\nSamvatsaram: Vishvavasu Samvatsaram\nAyanam: Uttarayanam\nRuthuvu: Hemantha Ruthuvu\nMasam: Pushyamu\nPaksham: Krishna Paksham\nTithi: upto 8.24 AM Saptami\, thereafter Ashtami\nVaram: Shanivaram\nNakshatram: upto 4.22 PM Hasta (3 Padam)\, and then Chitta\nYogam: Atiganda\nKaranam: Bavai\nRahu Kalam: 9.36 AM to 10.59 AM\nYamagandam: 1.47 PM to 3.10 PM\nDurmuhurtham: 6.48 AM to 7.33 AM\nAbhijit Muhurtham: 12.01 PM to 12.45 PM\nSuryodayam: 6.48 AM\nSuryastamayam: 5.58 PM\nChandrodayam: N/A\nChandrashtamam: Kumbham\nTaddinam Tithi: Ashtami\nPradesham: Hyderabad (Telugu Style)
SUMMARY:Pushyamu Krishna Paksham Saptami  (10.01.2026)
UID:india-te-2026-01-10@panchangam
END:VEVENT
BEGIN:VEVENT
DTSTART;VALUE=DATE:20260220
CATEGORIES:PANCHANGAM
DESCRIPTION:Phalgunamu Shukla Paksham Thadiya  (20.02.2026)\n\nSamvatsaram: Vishvavasu Samvatsaram\nAyanam: Uttarayanam\nRuthuvu: Shishira Ruthuvu\nMasam: Phalgunamu\nPaksham: Shukla Paksham\nTithi: upto 2.38 PM Thadiya\, thereafter Chavithi\nVaram: Shukravaram\nNakshatram: upto 8.45 PM Uttarabhadra (2 Padam)\, and then Revathi\nYogam: Sadhya\nKaranam: Garajai\nRahu Kalam: 11.02 AM to 12.29 PM\nYamagandam: 3.24 PM to 4.52 PM\nDurmuhurtham: 9.00 AM to 9.46 AM\, 12.53 PM to 1.39 PM\nAbhijit Muhurtham: 12.06 PM to 12.53 PM\nSuryodayam: 6.40 AM\nSuryastamayam: 6.19 PM\nChandrodayam: 8.24 AM\nChandrashtamam: Simham\nTaddinam Tithi: Chavithi\nPradesham: Hyderabad (Telugu Style)
SUMMARY:Phalgunamu Shukla Paksham Thadiya  (20.02.2026)
UID:india-te-2026-02-20@panchangam
END:VEVENT
BEGIN:VEVENT
DTSTART;VALUE=DATE:20260330
CATEGORIES:PANCHANGAM
DESCRIPTION:Chaitramu Shukla Paksham Dwadashi  (30.03.2026)\n\n🎉 SPECIAL: Pradosham (Shukla)\nSamvatsaram: Vishvavasu Samvatsaram\nAyanam: Uttarayanam\nRuthuvu: Vasantha Ruthuvu\nMasam: Chaitramu\nPaksham: Shukla Paksham\nTithi: upto 7.10 AM Dwadashi\, thereafter Trayodashi\nVaram: Somavaram\nNakshatram: upto 3.28 PM Makha (3 Padam)\, and then Pubba\nYogam: Shoola\nKaranam: Balavai\nRahu Kalam: 7.44 AM to 9.16 AM\nYamagandam: 10.48 AM to 12.20 PM\nDurmuhurtham: 12.45 PM to 1.34 PM\nAbhijit Muhurtham: 11.56 AM to 12.45 PM\nSuryodayam: 6.12 AM\nSuryastamayam: 6.28 PM\nChandrodayam: 4.15 PM\nChandrashtamam: Makaram\nTaddinam Tithi: Trayodashi\nPradesham: Hyderabad (Telugu Style)
SUMMARY:Chaitramu Shukla Paksham Dwadashi  (30.03.2026)
UID:india-te-2026-03-30@panchangam
END:VEVENT
BEGIN:VEVENT
BEGIN:VALARM
ACTION:DISPLAY
DESCRIPTION:
TRIGGER:-P1D
END:VALARM
CATEGORIES:VRATAM
DESCRIPTION:Astronomical duration of Pradosham (Shukla).
DTEND:20260301T133943Z
DTSTART:20260228T151343Z
SUMMARY:⏳ Pradosham (Shukla)
UID:india-te-202602282043-Pradosham(Shukla)@vratam
END:VEVENT
BEGIN:VEVENT
BEGIN:VALARM
ACTION:DISPLAY
DESCRIPTION:
TRIGGER:-P1D
END:VALARM
CATEGORIES:VRATAM
DESCRIPTION:Astronomical duration of Sashti (Shukla).
DTEND:20260719T220023Z
DTSTART:20260718T221312Z
SUMMARY:⏳ Sashti (Shukla)
UID:india-te-202607190343-Sashti(Shukla)@vratam
END:VEVENT
BEGIN:VEVENT
BEGIN:VALARM
ACTION:DISPLAY
DESCRIPTION:
TRIGGER:-P1D
END:VALARM
CATEGORIES:VRATAM
DESCRIPTION:Astronomical duration of Ekadashi (Krishna).
DTEND:20260907T113440Z
DTSTART:20260906T135944Z
SUMMARY:⏳ Ekadashi (Krishna)
UID:india-te-202609061929-Ekadashi(Krishna)@vratam
END:VEVENT
BEGIN:VEVENT
DTSTART;VALUE=DATE:20260209
CATEGORIES:PANCHANGAM
DESCRIPTION:Maghamu Krishna Paksham Ashtami  (09.02.2026)\n\nSamvatsaram: Vishvavasu Samvatsaram\nAyanam: Uttarayanam\nRuthuvu: Shishira Ruthuvu\nMasam: Maghamu\nPaksham: Krishna Paksham\nTithi: Ashtami\nVaram: Somavaram\nNakshatram: Vishakha (1 Padam)\nYogam: Vriddhi\nKaranam: Balavai\nRahu Kalam: 8.11 AM to 9.37 AM\nYamagandam: 11.04 AM to 12.30 PM\nDurmuhurtham: 12.53 PM to 1.39 PM\nAbhijit Muhurtham: 12.07 PM to 12.53 PM\nSuryodayam: 6.45 AM\nSuryastamayam: 6.15 PM\nChandrodayam: N/A\nChandrashtamam: Meenam\nTaddinam Tithi: Ashtami\nPradesham: Hyderabad (Telugu Style)
SUMMARY:Maghamu Krishna Paksham Ashtami  (09.02.2026)
UID:india-te-2026-02-09@panchangam
END:VEVENT
BEGIN:VEVENT
DTSTART;VALUE=DATE:20260319
CATEGORIES:PANCHANGAM
DESCRIPTION:Chaitramu Krishna Paksham Amavasya 🌑 (19.03.2026)\n\nSamvatsaram: Vishvavasu Samvatsaram\nAyanam: Uttarayanam\nRuthuvu: Vasantha Ruthuvu\nMasam: Chaitramu\nPaksham: Krishna Paksham\nTithi: upto 6.53 AM Amavasya\, upto 4.52 AM Padyami\, thereafter Vidiya\nVaram: Guruvaram\nNakshatram: upto 4.42 AM Uttarabhadra (1 Padam)\, and then Revathi\nYogam: Shukla\nKaranam: Nagava\nRahu Kalam: 1.54 PM to 3.25 PM\nYamagandam: 6.21 AM to 7.51 AM\nDurmuhurtham: 1.36 PM to 2.24 PM\nAbhijit Muhurtham: 11.59 AM to 12.48 PM\nSuryodayam: 6.21 AM\nSuryastamayam: 6.26 PM\nChandrodayam: 6.20 AM\nChandrashtamam: Simham\nTaddinam Tithi: Padyami\nPradesham: Hyderabad (Telugu Style)
SUMMARY:Chaitramu Krishna Paksham Amavasya 🌑 (19.03.2026)
UID:india-te-2026-03-19@panchangam
END:VEVENT
BEGIN:VEVENT
BEGIN:VALARM
ACTION:DISPLAY
DESCRIPTION:
TRIGGER:-P1D
END:VALARM
CATEGORIES:VRATAM
DESCRIPTION:Astronomical duration of Ekadashi (Shukla).
DTEND:20260725T060447Z
DTSTART:20260724T034315Z
SUMMARY:⏳ Ekadashi (Shukla)
UID:india-te-202607240913-Ekadashi(Shukla)@vratam
END:VEVENT
BEGIN:VEVENT
DTSTART;VALUE=DATE:20260429
CATEGORIES:PANCHANGAM
DESCRIPTION:Vaishakhamu Shukla Paksham Trayodashi  (29.04.2026)\n\n🎉 SPECIAL: Pradosham (Shukla)\nSamvatsaram: Parabhava Samvatsaram\nAyanam: Uttarayanam\nRuthuvu: Vasantha Ruthuvu\nMasam: Vaishakhamu\nPaksham: Shukla Paksham\nTithi: upto 7.52 PM Trayodashi\, thereafter Chaturdashi\nVaram: Budhavaram\nNakshatram: upto 12.59 AM Hasta (2 Padam)\, and then Chitta\nYogam: Harshana\nKaranam: Kaulavai\nRahu Kalam: 12.13 PM to 1.49 PM\nYamagandam: 7.26 AM to 9.02 AM\nDurmuhurtham: 10.06 AM to 10.57 AM\nAbhijit Muhurtham: 11.48 AM to 12.39 PM\nSuryodayam: 5.51 AM\nSuryastamayam: 6.35 PM\nChandrodayam: 4.43 PM\nChandrashtamam: Kumbham\nTaddinam Tithi: Trayodashi\nPradesham: Hyderabad (Telugu Style)
SUMMARY:Vaishakhamu Shukla Paksham Trayodashi  (29.04.2026)
UID:india-te-2026-04-29@panchangam
END:VEVENT
BEGIN:VEVENT
DTSTART;VALUE=DATE:20260708
CATEGORIES:PANCHANGAM
DESCRIPTION:Jyeshthamu Krishna Paksham Ashtami  (08.07.2026)\n\nSamvatsaram: Parabhava Samvatsaram\nAyanam: Dakshinayanam\nRuthuvu: Grishma Ruthuvu\nMasam: Jyeshthamu\nPaksham: Krishna Paksham\nTithi: upto 12.22 PM Ashtami\, thereafter Navami\nVaram: Budhavaram\nNakshatram: upto 4.39 PM Revathi (3 Padam)\, and then Aswini\nYogam: Atiganda\nKaranam: Kaulavai\nRahu Kalam: 12.21 PM to 1.59 PM\nYamagandam: 7.25 AM to 9.04 AM\nDurmuhurtham: 10.09 AM to 11.02 AM\nAbhijit Muhurtham: 11.54 AM to 12.47 PM\nSuryodayam: 5.47 AM\nSuryastamayam: 6.54 PM\nChandrodayam: N/A\nChandrashtamam: Simham\nTaddinam Tithi: Navami\nPradesham: Hyderabad (Telugu Style)
SUMMARY:Jyeshthamu Krishna Paksham Ashtami  (08.07.2026)
UID:india-te-2026-07-08@panchangam
END:VEVENT
BEGIN:VEVENT
DTSTART;VALUE=DATE:20260818
CATEGORIES:PANCHANGAM
DESCRIPTION:Sravanamu Shukla Paksham Shashti  (18.08.2026)\n\n🎉 SPECIAL: Sashti (Shukla)\nSamvatsaram: Parabhava Samvatsaram\nAyanam: Dakshinayanam\nRuthuvu: Varsha Ruthuvu\nMasam: Sravanamu\nPaksham: Shukla Paksham\nTithi: upto 5.51 PM Shashti\, thereafter Saptami\nVaram: Mangalavaram\nNakshatram: Swathi (1 Padam)\nYogam: Shukla\nKaranam: Thaitilai\nRahu Kalam: 3.29 PM to 5.05 PM\nYamagandam: 9.09 AM to 10.44 AM\nDurmuhurtham: 7.41 AM to 8.31 AM\, 11.03 AM to 11.54 AM\nAbhijit Muhurtham: 11.54 AM to 12.45 PM\nSuryodayam: 5.59 AM\nSuryastamayam: 6.40 PM\nChandrodayam: 10.53 AM\nChandrashtamam: Meenam\nTaddinam Tithi: Shashti\nPradesham: Hyderabad (Telugu Style)
SUMMARY:Sravanamu Shukla Paksham Shashti  (18.08.2026)
UID:india-te-2026-08-18@panchangam
END:VEVENT
BEGIN:VEVENT
DTSTART;VALUE=DATE:20260928
CATEGORIES:PANCHANGAM
DESCRIPTION:Bhadrapadamu Krishna Paksham Vidiya  (28.09.2026)\n\nSamvatsaram: Parabhava Samvatsaram\nAyanam: Dakshinayanam\nRuthuvu: Varsha Ruthuvu\nMasam: Bhadrapadamu\nPaksham: Krishna Paksham\nTithi: upto 7.14 PM Vidiya\, thereafter Thadiya\nVaram: Somavaram\nNakshatram: upto 10.55 AM Revathi (4 Padam)\, and then Aswini\nYogam: Dhruva\nKaranam: Thaitilai\nRahu Kalam: 7.36 AM to 9.06 AM\nYamagandam: 10.36 AM to 12.06 PM\nDurmuhurtham: 12.30 PM to 1.18 PM\nAbhijit Muhurtham: 11.42 AM to 12.30 PM\nSuryodayam: 6.05 AM\nSuryastamayam: 6.07 PM\nChandrodayam: 7.11 PM\nChandrashtamam: Simham\nTaddinam Tithi: Vidiya\nPradesham: Hyderabad (Telugu Style)
SUMMARY:Bhadrapadamu Krishna Paksham Vidiya  (28.09.2026)
UID:india-te-2026-09-28@panchangam
END:VEVENT
BEGIN:VEVENT
DTSTART;VALUE=DATE:20261023
CATEGORIES:PANCHANGAM
DESCRIPTION:Ashwayujamu Shukla Paksham Dwadashi  (23.10.2026)\n\n🎉 SPECIAL: Pradosham (Shukla)\nSamvatsaram: Parabhava Samvatsaram\nAyanam: Dakshinayanam\nRuthuvu: Sarad Ruthuvu\nMasam: Ashwayujamu\nPaksham: Shukla Paksham\nTithi: upto 2.36 PM Dwadashi\, thereafter Trayodashi\nVaram: Shukravaram\nNakshatram: upto 9.43 PM Poorvabhadra (2 Padam)\, and then Uttarabhadra\nYogam: Dhruva\nKaranam: Balavai\nRahu Kalam: 10.33 AM to 12 Noon\nYamagandam: 2.54 PM to 4.22 PM\nDurmuhurtham: 8.30 AM to 9.17 AM\, 12.23 PM to 1.10 PM\nAbhijit Muhurtham: 11.37 AM to 12.23 PM\nSuryodayam: 6.11 AM\nSuryastamayam: 5.49 PM\nChandrodayam: 3.47 PM\nChandrashtamam: Karkatakam\nTaddinam Tithi: Dwadashi\nPradesham: Hyderabad (Telugu Style)
SUMMARY:Ashwayujamu Shukla Paksham Dwadashi  (23.10.2026)
UID:india-te-2026-10-23@panchangam
END:VEVENT
BEGIN:VEVENT
DTSTART;VALUE=DATE:20260117
CATEGORIES:PANCHANGAM
DESCRIPTION:Pushyamu Krishna Paksham Chaturdashi  (17.01.2026)\n\nSamvatsaram: Vishvavasu Samvatsaram\nAyanam: Uttarayanam\nRuthuvu: Hemantha Ruthuvu\nMasam: Pushyamu\nPaksham: Krishna Paksham\nTithi: upto 12.04 AM Chaturdashi\, thereafter Amavasya\nVaram: Shanivaram\nNakshatram: upto 8.55 AM Moola (4 Padam)\, and then Poorvashada\nYogam: Vyaghata\nKaranam: Vishti\nRahu Kalam: 9.37 AM to 11.01 AM\nYamagandam: 1.50 PM to 3.14 PM\nDurmuhurtham: 6.49 AM to 7.34 AM\nAbhijit Muhurtham: 12.03 PM to 12.48 PM\nSuryodayam: 6.49 AM\nSuryastamayam: 6.02 PM\nChandrodayam: 5.38 AM\nChandrashtamam: Vrushabham\nTaddinam Tithi: Chaturdashi\nPradesham: Hyderabad (Telugu Style)
SUMMARY:Pushyamu Krishna Paksham Chaturdashi  (17.01.2026)
UID:india-te-2026-01-17@panchangam
END:VEVENT
BEGIN:VEVENT
DTSTART;VALUE=DATE:20260227
CATEGORIES:PANCHANGAM
DESCRIPTION:Phalgunamu Shukla Paksham Ekadashi  (27.02.2026)\n\n🎉 SPECIAL: Ekadashi (Shukla)\nSamvatsaram: Vishvavasu Samvatsaram\nAyanam: Uttarayanam\nRuthuvu: Shishira Ruthuvu\nMasam: Phalgunamu\nPaksham: Shukla Paksham\nTithi: upto 10.33 PM Ekadashi\, thereafter Dwadashi\nVaram: Shukravaram\nNakshatram: upto 11.26 AM Arudra (4 Padam)\, and then Punarvasu\nYogam: Aayushman\nKaranam: Vanijai\nRahu Kalam: 11.00 AM to 12.28 PM\nYamagandam: 3.25 PM to 4.53 PM\nDurmuhurtham: 8.57 AM to 9.44 AM\, 12.52 PM to 1.39 PM\nAbhijit Muhurtham: 12.05 PM to 12.52 PM\nSuryodayam: 6.35 AM\nSuryastamayam: 6.21 PM\nChandrodayam: 2.26 PM\nChandrashtamam: Vrushchikam\nTaddinam Tithi: Ekadashi\nPradesham: Hyderabad (Telugu Style)
SUMMARY:Phalgunamu Shukla Paksham Ekadashi  (27.02.2026)
UID:india-te-2026-02-27@panchangam
END:VEVENT
BEGIN:VEVENT
BEGIN:VALARM
ACTION:DISPLAY
DESCRIPTION:
TRIGGER:-P1D
END:VALARM
CATEGORIES:VRATAM
DESCRIPTION:Astronomical duration of Ekadashi (Krishna).
DTEND:20261204T181512Z
DTSTART:20261203T173359Z
SUMMARY:⏳ Ekadashi (Krishna)
UID:india-te-202612032303-Ekadashi(Krishna)@vratam
END:VEVENT
BEGIN:VEVENT
DTSTART;VALUE=DATE:20260506
CATEGORIES:PANCHANGAM
DESCRIPTION:Vaishakhamu Krishna Paksham Chavithi  (06.05.2026)\n\nSamvatsaram: Parabhava Samvatsaram\nAyanam: Uttarayanam\nRuthuvu: Vasantha Ruthuvu\nMasam: Vaishakhamu\nPaksham: Krishna Paksham\nTithi: upto 7.51 AM Chavithi\, thereafter Panchami\nVaram: Budhavaram\nNakshatram: upto 4.38 PM Moola (3 Padam)\, and then Poorvashada\nYogam: Siddha\nKaranam: Balavai\nRahu Kalam: 12.12 PM to 1.49 PM\nYamagandam: 7.24 AM to 9.00 AM\nDurmuhurtham: 10.04 AM to 10.55 AM\nAbhijit Muhurtham: 11.47 AM to 12.38 PM\nSuryodayam: 5.47 AM\nSuryastamayam: 6.37 PM\nChandrodayam: 10.45 PM\nChandrashtamam: Vrushabham\nTaddinam Tithi: Panchami\nPradesham: Hyderabad (Telugu Style)
SUMMARY:Vaishakhamu Krishna Paksham Chavithi  (06.05.2026)
UID:india-te-2026-05-06@panchangam
END:VEVENT
BEGIN:VEVENT
DTSTART;VALUE=DATE:20260616
CATEGORIES:PANCHANGAM
DESCRIPTION:Jyeshthamu Shukla Paksham Vidiya  (16.06.2026)\n\nSamvatsaram: Parabhava Samvatsaram\nAyanam: Uttarayanam\nRuthuvu: Grishma Ruthuvu\nMasam: Jyeshthamu\nPaksham: Shukla Paksham\nTithi: upto 12.52 AM Vidiya\, thereafter Thadiya\nVaram: Mangalavaram\nNakshatram: upto 4.47 PM Arudra (2 Padam)\, and then Punarvasu\nYogam: Ganda\nKaranam: Balavai\nRahu Kalam: 3.34 PM to 5.12 PM\nYamagandam: 8.59 AM to 10.38 AM\nDurmuhurtham: 7.27 AM to 8.19 AM\, 10.57 AM to 11.50 AM\nAbhijit Muhurtham: 11.50 AM to 12.43 PM\nSuryodayam: 5.41 AM\nSuryastamayam: 6.51 PM\nChandrodayam: 6.40 AM\nChandrashtamam: Vrushchikam\nTaddinam Tithi: Vidiya\nPradesham: Hyderabad (Telugu Style)
SUMMARY:Jyeshthamu Shukla Paksham Vidiya  (16.06.2026)
UID:india-te-2026-06-16@panchangam
END:VEVENT
BEGIN:VEVENT
DTSTART;VALUE=DATE:20260726
CATEGORIES:PANCHANGAM
DESCRIPTION:Ashadhamu Shukla Paksham Dwadashi  (26.07.2026)\n\n🎉 SPECIAL: Pradosham (Shukla)\nSamvatsaram: Parabhava Samvatsaram\nAyanam: Dakshinayanam\nRuthuvu: Grishma Ruthuvu\nMasam: Ashadhamu\nPaksham: Shukla Paksham\nTithi: upto 1.58 PM Dwadashi\, thereafter Trayodashi\nVaram: Bhanuvaram\nNakshatram: upto 8.19 AM Jyeshta (4 Padam)\, and then Moola\nYogam: Indra\nKaranam: Balavai\nRahu Kalam: 5.14 PM to 6.51 PM\nYamagandam: 12.22 PM to 1.59 PM\nDurmuhurtham: 5.07 PM to 5.59 PM\nAbhijit Muhurtham: 11.56 AM to 12.48 PM\nSuryodayam: 5.53 AM\nSuryastamayam: 6.51 PM\nChandrodayam: 4.33 PM\nChandrashtamam: Mesham\nTaddinam Tithi: Trayodashi\nPradesham: Hyderabad (Telugu Style)
SUMMARY:Ashadhamu Shukla Paksham Dwadashi  (26.07.2026)
UID:india-te-2026-07-26@panchangam
END:VEVENT
BEGIN:VEVENT
BEGIN:VALARM
ACTION:DISPLAY
DESCRIPTION:
TRIGGER:-P1D
END:VALARM
CATEGORIES:VRATAM
DESCRIPTION:Astronomical duration of Sankatahara Chathurthi.
DTEND:20260406T084106Z
DTSTART:20260405T063016Z
SUMMARY:⏳ Sankatahara Chathurthi
UID:india-te-202604051200-SankataharaChathurthi@vratam
END:VEVENT
BEGIN:VEVENT
BEGIN:VALARM
ACTION:DISPLAY
DESCRIPTION:
TRIGGER:-P1D
END:VALARM
CATEGORIES:VRATAM
DESCRIPTION:Astronomical duration of Ekadashi (Shukla).
DTEND:20260823T224913Z
DTSTART:20260822T203052Z
SUMMARY:⏳ Ekadashi (Shukla)
UID:india-te-202608230200-Ekadashi(Shukla)@vratam
END:VEVENT
BEGIN:VEVENT
DTSTART;VALUE=DATE:20261210
CATEGORIES:PANCHANGAM
DESCRIPTION:Margashiramu Shukla Paksham Padyami  (10.12.2026)\n\nSamvatsaram: Parabhava Samvatsaram\nAyanam: Dakshinayanam\nRuthuvu: Hemantha Ruthuvu\nMasam: Margashiramu\nPaksham: Shukla Paksham\nTithi: upto 8.46 AM Padyami\, thereafter Vidiya\nVaram: Guruvaram\nNakshatram: upto 12.44 AM Moola (2 Padam)\, and then Poorvashada\nYogam: Shoola\nKaranam: Bavai\nRahu Kalam: 1.32 PM to 2.55 PM\nYamagandam: 6.35 AM to 7.58 AM\nDurmuhurtham: 1.15 PM to 1.59 PM\nAbhijit Muhurtham: 11.46 AM to 12.30 PM\nSuryodayam: 6.35 AM\nSuryastamayam: 5.42 PM\nChandrodayam: 7.37 AM\nChandrashtamam: Vrushabham\nTaddinam Tithi: Vidiya\nPradesham: Hyderabad (Telugu Style)
SUMMARY:Margashiramu Shukla Paksham Padyami  (10.12.2026)
UID:india-te-2026-12-10@panchangam
END:VEVENT
BEGIN:VEVENT
DTSTART;VALUE=DATE:20260304
CATEGORIES:PANCHANGAM
DESCRIPTION:Phalgunamu Krishna Paksham Padyami  (04.03.2026)\n\nSamvatsaram: Vishvavasu Samvatsaram\nAyanam: Uttarayanam\nRuthuvu: Shishira Ruthuvu\nMasam: Phalgunamu\nPaksham: Krishna Paksham\nTithi: upto 4.49 PM Padyami\, thereafter Vidiya\nVaram: Budhavaram\nNakshatram: upto 8.19 AM Pubba (4 Padam)\, and then Uttara\nYogam: Dhruthi\nKaranam: Kaulavai\nRahu Kalam: 12.27 PM to 1.56 PM\nYamagandam: 8.01 AM to 9.30 AM\nDurmuhurtham: 10.29 AM to 11.16 AM\nAbhijit Muhurtham: 12.04 PM to 12.51 PM\nSuryodayam: 6.32 AM\nSuryastamayam: 6.23 PM\nChandrodayam: 7.15 PM\nChandrashtamam: Makaram\nTaddinam Tithi: Padyami\nPradesham: Hyderabad (Telugu Style)
SUMMARY:Phalgunamu Krishna Paksham Padyami  (04.03.2026)
UID:india-te-2026-03-04@panchangam
END:VEVENT
BEGIN:VEVENT
DTSTART;VALUE=DATE:20260414
CATEGORIES:PANCHANGAM
DESCRIPTION:Chaitramu Krishna Paksham Dwadashi  (14.04.2026)\n\nSamvatsaram: Parabhava Samvatsaram\nAyanam: Uttarayanam\nRuthuvu: Vasantha Ruthuvu\nMasam: Chaitramu\nPaksham: Krishna Paksham\nTithi: upto 12.12 AM Dwadashi\, thereafter Trayodashi\nVaram: Mangalavaram\nNakshatram: upto 4.45 PM Shatabhisham (3 Padam)\, and then Poorvabhadra\nYogam: Shukla\nKaranam: Kaulavai\nRahu Kalam: 3.24 PM to 4.58 PM\nYamagandam: 9.08 AM to 10.42 AM\nDurmuhurtham: 7.41 AM to 8.31 AM\, 11.01 AM to 11.51 AM\nAbhijit Muhurtham: 11.51 AM to 12.41 PM\nSuryodayam: 6.01 AM\nSuryastamayam: 6.31 PM\nChandrodayam: 3.36 AM\nChandrashtamam: Karkatakam\nTaddinam Tithi: Dwadashi\nPradesham: Hyderabad (Telugu Style)
SUMMARY:Chaitramu Krishna Paksham Dwadashi  (14.04.2026)
UID:india-te-2026-04-14@panchangam
END:VEVENT
BEGIN:VEVENT
DTSTART;VALUE=DATE:20260524
CATEGORIES:PANCHANGAM
DESCRIPTION:Jyeshthamu Shukla Paksham Navami  (24.05.2026)\n\nSamvatsaram: Parabhava Samvatsaram\nAyanam: Uttarayanam\nRuthuvu: Grishma Ruthuvu\nMasam: Jyeshthamu\nPaksham: Shukla Paksham\nTithi: upto 4.31 AM Navami\, thereafter Dashami\nVaram: Bhanuvaram\nNakshatram: upto 3.32 AM Pubba (1 Padam)\, and then Uttara\nYogam: Vyaghata\nKaranam: Balavai\nRahu Kalam: 5.06 PM to 6.44 PM\nYamagandam: 12.12 PM to 1.50 PM\nDurmuhurtham: 4.59 PM to 5.51 PM\nAbhijit Muhurtham: 11.46 AM to 12.39 PM\nSuryodayam: 5.41 AM\nSuryastamayam: 6.44 PM\nChandrodayam: 1.00 PM\nChandrashtamam: Makaram\nTaddinam Tithi: Navami\nPradesham: Hyderabad (Telugu Style)
SUMMARY:Jyeshthamu Shukla Paksham Navami  (24.05.2026)
UID:india-te-2026-05-24@panchangam
END:VEVENT
BEGIN:VEVENT
DTSTART;VALUE=DATE:20260803
CATEGORIES:PANCHANGAM
DESCRIPTION:Ashadhamu Krishna Paksham Panchami  (03.08.2026)\n\nSamvatsaram: Parabhava Samvatsaram\nAyanam: Dakshinayanam\nRuthuvu: Grishma Ruthuvu\nMasam: Ashadhamu\nPaksham: Krishna Paksham\nTithi: upto 10.54 PM Panchami\, thereafter Shashti\nVaram: Somavaram\nNakshatram: upto 10.40 PM Uttarabhadra (2 Padam)\, and then Revathi\nYogam: Sukarman\nKaranam: Kaulavai\nRahu Kalam: 7.32 AM to 9.09 AM\nYamagandam: 10.45 AM to 12.22 PM\nDurmuhurtham: 12.47 PM to 1.39 PM\nAbhijit Muhurtham: 11.56 AM to 12.47 PM\nSuryodayam: 5.55 AM\nSuryastamayam: 6.48 PM\nChandrodayam: 9.53 PM\nChandrashtamam: Simham\nTaddinam Tithi: Panchami\nPradesham: Hyderabad (Telugu Style)
SUMMARY:Ashadhamu Krishna Paksham Panchami  (03.08.2026)
UID:india-te-2026-08-03@panchangam
END:VEVENT
BEGIN:VEVENT
DTSTART;VALUE=DATE:20260913
CATEGORIES:PANCHANGAM
DESCRIPTION:Bhadrapadamu Shukla Paksham Vidiya  (13.09.2026)\n\nSamvatsaram: Parabhava Samvatsaram\nAyanam: Dakshinayanam\nRuthuvu: Varsha Ruthuvu\nMasam: Bhadrapadamu\nPaksham: Shukla Paksham\nTithi: upto 7.08 AM Vidiya\, thereafter Thadiya\nVaram: Bhanuvaram\nNakshatram: upto 1.48 PM Hasta (3 Padam)\, and then Chitta\nYogam: Shukla\nKaranam: Kaulavai\nRahu Kalam: 4.48 PM to 6.20 PM\nYamagandam: 12.11 PM to 1.43 PM\nDurmuhurtham: 4.41 PM to 5.30 PM\nAbhijit Muhurtham: 11.47 AM to 12.36 PM\nSuryodayam: 6.03 AM\nSuryastamayam: 6.20 PM\nChandrodayam: 7.49 AM\nChandrashtamam: Kumbham\nTaddinam Tithi: Thadiya\nPradesham: Hyderabad (Telugu Style)
SUMMARY:Bhadrapadamu Shukla Paksham Vidiya  (13.09.2026)
UID:india-te-2026-09-13@panchangam
END:VEVENT
BEGIN:VEVENT
DTSTART;VALUE=DATE:20261107
CATEGORIES:PANCHANGAM
DESCRIPTION:Ashwayujamu Krishna Paksham Trayodashi  (07.11.2026)\n\nSamvatsaram: Parabhava Samvatsaram\nAyanam: Dakshinayanam\nRuthuvu: Sarad Ruthuvu\nMasam: Ashwayujamu\nPaksham: Krishna Paksham\nTithi: upto 10.48 AM Trayodashi\, thereafter Chaturdashi\nVaram: Shanivaram\nNakshatram: Chitta (1 Padam)\nYogam: Preethi\nKaranam: Vanijai\nRahu Kalam: 9.08 AM to 10.33 AM\nYamagandam: 1.25 PM to 2.50 PM\nDurmuhurtham: 6.16 AM to 7.02 AM\nAbhijit Muhurtham: 11.36 AM to 12.22 PM\nSuryodayam: 6.16 AM\nSuryastamayam: 5.42 PM\nChandrodayam: 4.24 AM\nChandrashtamam: Kumbham\nTaddinam Tithi: Chaturdashi\nPradesham: Hyderabad (Telugu Style)
SUMMARY:Ashwayujamu Krishna Paksham Trayodashi  (07.11.2026)
UID:india-te-2026-11-07@panchangam
END:VEVENT
BEGIN:VEVENT
DTSTART;VALUE=DATE:20261217
CATEGORIES:PANCHANGAM
DESCRIPTION:Margashiramu Shukla Paksham Ashtami  (17.12.2026)\n\nSamvatsaram: Parabhava Samvatsaram\nAyanam: Dakshinayanam\nRuthuvu: Hemantha Ruthuvu\nMasam: Margashiramu\nPaksham: Shukla Paksham\nTithi: upto 11.26 PM Ashtami\, thereafter Navami\nVaram: Guruvaram\nNakshatram: upto 4.13 PM Poorvabhadra (3 Padam)\, and then Uttarabhadra\nYogam: Siddhi\nKaranam: Vishti\nRahu Kalam: 1.35 PM to 2.58 PM\nYamagandam: 6.39 AM to 8.02 AM\nDurmuhurtham: 1.18 PM to 2.02 PM\nAbhijit Muhurtham: 11.49 AM to 12.34 PM\nSuryodayam: 6.39 AM\nSuryastamayam: 5.44 PM\nChandrodayam: 12.12 PM\nChandrashtamam: Karkatakam\nTaddinam Tithi: Ashtami\nPradesham: Hyderabad (Telugu Style)
SUMMARY:Margashiramu Shukla Paksham Ashtami  (17.12.2026)
UID:india-te-2026-12-17@panchangam
END:VEVENT
BEGIN:VEVENT
DTSTART;VALUE=DATE:20260102
CATEGORIES:PANCHANGAM
DESCRIPTION:Pushyamu Shukla Paksham Chaturdashi  (02.01.2026)\n\nSamvatsaram: Vishvavasu Samvatsaram\nAyanam: Uttarayanam\nRuthuvu: Hemantha Ruthuvu\nMasam: Pushyamu\nPaksham: Shukla Paksham\nTithi: upto 6.53 PM Chaturdashi\, thereafter Pournami\nVaram: Shukravaram\nNakshatram: upto 8.38 PM Mrigashira (2 Padam)\, and then Arudra\nYogam: Shukla\nKaranam: Garajai\nRahu Kalam: 10.56 AM to 12.20 PM\nYamagandam: 3.06 PM to 4.30 PM\nDurmuhurtham: 8.59 AM to 9.44 AM\, 12.42 PM to 1.26 PM\nAbhijit Muhurtham: 11.57 AM to 12.42 PM\nSuryodayam: 6.46 AM\nSuryastamayam: 5.53 PM\nChandrodayam: 4.45 PM\nChandrashtamam: Thula\nTaddinam Tithi: Chaturdashi\nPradesham: Hyderabad (Telugu Style)
SUMMARY:Pushyamu Shukla Paksham Chaturdashi  (02.01.2026)
UID:india-te-2026-01-02@panchangam
END:VEVENT
BEGIN:VEVENT
DTSTART;VALUE=DATE:20260212
CATEGORIES:PANCHANGAM
DESCRIPTION:Maghamu Krishna Paksham Dashami  (12.02.2026)\n\nSamvatsaram: Vishvavasu Samvatsaram\nAyanam: Uttarayanam\nRuthuvu: Shishira Ruthuvu\nMasam: Maghamu\nPaksham: Krishna Paksham\nTithi: upto 12.22 PM Dashami\, thereafter Ekadashi\nVaram: Guruvaram\nNakshatram: upto 2.26 PM Jyeshta (3 Padam)\, and then Moola\nYogam: Harshana\nKaranam: Vishti\nRahu Kalam: 1.56 PM to 3.23 PM\nYamagandam: 6.44 AM to 8.10 AM\nDurmuhurtham: 1.39 PM to 2.25 PM\nAbhijit Muhurtham: 12.07 PM to 12.53 PM\nSuryodayam: 6.44 AM\nSuryastamayam: 6.16 PM\nChandrodayam: 2.37 AM\nChandrashtamam: Mesham\nTaddinam Tithi: Ekadashi\nPradesham: Hyderabad (Telugu Style)
SUMMARY:Maghamu Krishna Paksham Dashami  (12.02.2026)
UID:india-te-2026-02-12@panchangam
END:VEVENT
BEGIN:VEVENT
DTSTART;VALUE=DATE:20260322
CATEGORIES:PANCHANGAM
DESCRIPTION:Chaitramu Shukla Paksham Chavithi  (22.03.2026)\n\nSamvatsaram: Vishvavasu Samvatsaram\nAyanam: Uttarayanam\nRuthuvu: Vasantha Ruthuvu\nMasam: Chaitramu\nPaksham: Shukla Paksham\nTithi: upto 9.17 PM Chavithi\, thereafter Panchami\nVaram: Bhanuvaram\nNakshatram: upto 11.19 PM Bharani (1 Padam)\, and then Kruthika\nYogam: Vaidhriti\nKaranam: Vanijai\nRahu Kalam: 4.56 PM to 6.27 PM\nYamagandam: 12.23 PM to 1.54 PM\nDurmuhurtham: 4.50 PM to 5.38 PM\nAbhijit Muhurtham: 11.58 AM to 12.47 PM\nSuryodayam: 6.18 AM\nSuryastamayam: 6.27 PM\nChandrodayam: 8.26 AM\nChandrashtamam: Kanya\nTaddinam Tithi: Chavithi\nPradesham: Hyderabad (Telugu Style)
SUMMARY:Chaitramu Shukla Paksham Chavithi  (22.03.2026)
UID:india-te-2026-03-22@panchangam
END:VEVENT
BEGIN:VEVENT
DTSTART;VALUE=DATE:20260601
CATEGORIES:PANCHANGAM
DESCRIPTION:Jyeshthamu Krishna Paksham Padyami  (01.06.2026)\n\nSamvatsaram: Parabhava Samvatsaram\nAyanam: Uttarayanam\nRuthuvu: Grishma Ruthuvu\nMasam: Jyeshthamu\nPaksham: Krishna Paksham\nTithi: upto 4.37 PM Padyami\, thereafter Vidiya\nVaram: Somavaram\nNakshatram: upto 7.53 PM Jyeshta (2 Padam)\, and then Moola\nYogam: Siddha\nKaranam: Kaulavai\nRahu Kalam: 7.19 AM to 8.57 AM\nYamagandam: 10.35 AM to 12.13 PM\nDurmuhurtham: 12.40 PM to 1.32 PM\nAbhijit Muhurtham: 11.47 AM to 12.40 PM\nSuryodayam: 5.40 AM\nSuryastamayam: 6.46 PM\nChandrodayam: 7.51 PM\nChandrashtamam: Mesham\nTaddinam Tithi: Padyami\nPradesham: Hyderabad (Telugu Style)
SUMMARY:Jyeshthamu Krishna Paksham Padyami  (01.06.2026)
UID:india-te-2026-06-01@panchangam
END:VEVENT
BEGIN:VEVENT
BEGIN:VALARM
ACTION:DISPLAY
DESCRIPTION:
TRIGGER:-P1D
END:VALARM
CATEGORIES:VRATAM
DESCRIPTION:Astronomical duration of Sankatahara Chathurthi.
DTEND:20260107T012303Z
DTSTART:20260106T023210Z
SUMMARY:⏳ Sankatahara Chathurthi
UID:india-te-202601060802-SankataharaChathurthi@vratam
END:VEVENT
BEGIN:VEVENT
DTSTART;VALUE=DATE:20260711
CATEGORIES:PANCHANGAM
DESCRIPTION:Jyeshthamu Krishna Paksham Dwadashi  (11.07.2026)\n\nSamvatsaram: Parabhava Samvatsaram\nAyanam: Dakshinayanam\nRuthuvu: Grishma Ruthuvu\nMasam: Jyeshthamu\nPaksham: Krishna Paksham\nTithi: upto 2.04 AM Dwadashi\, thereafter Trayodashi\nVaram: Shanivaram\nNakshatram: upto 11.39 AM Kruthika (3 Padam)\, and then Rohini\nYogam: Ganda\nKaranam: Kaulavai\nRahu Kalam: 9.04 AM to 10.43 AM\nYamagandam: 1.59 PM to 3.38 PM\nDurmuhurtham: 5.48 AM to 6.40 AM\nAbhijit Muhurtham: 11.55 AM to 12.47 PM\nSuryodayam: 5.48 AM\nSuryastamayam: 6.54 PM\nChandrodayam: 2.10 AM\nChandrashtamam: Thula\nTaddinam Tithi: Dwadashi\nPradesham: Hyderabad (Telugu Style)
SUMMARY:Jyeshthamu Krishna Paksham Dwadashi  (11.07.2026)
UID:india-te-2026-07-11@panchangam
END:VEVENT
BEGIN:VEVENT
DTSTART;VALUE=DATE:20260821
CATEGORIES:PANCHANGAM
DESCRIPTION:Sravanamu Shukla Paksham Navami  (21.08.2026)\n\n🎉 SPECIAL: Varalakshmi Vratam\nSamvatsaram: Parabhava Samvatsaram\nAyanam: Dakshinayanam\nRuthuvu: Varsha Ruthuvu\nMasam: Sravanamu\nPaksham: Shukla Paksham\nTithi: upto 11.36 PM Navami\, thereafter Dashami\nVaram: Shukravaram\nNakshatram: upto 12.38 PM Anuradha (4 Padam)\, and then Jyeshta\nYogam: Vaidhriti\nKaranam: Balavai\nRahu Kalam: 10.44 AM to 12.19 PM\nYamagandam: 3.28 PM to 5.03 PM\nDurmuhurtham: 8.31 AM to 9.22 AM\, 12.44 PM to 1.34 PM\nAbhijit Muhurtham: 11.53 AM to 12.44 PM\nSuryodayam: 6.00 AM\nSuryastamayam: 6.38 PM\nChandrodayam: 1.33 PM\nChandrashtamam: Mesham\nTaddinam Tithi: Navami\nPradesham: Hyderabad (Telugu Style)
SUMMARY:Sravanamu Shukla Paksham Navami  (21.08.2026)
UID:india-te-2026-08-21@panchangam
END:VEVENT
BEGIN:VEVENT
DTSTART;VALUE=DATE:20261015
CATEGORIES:PANCHANGAM
DESCRIPTION:Ashwayujamu Shukla Paksham Panchami  (15.10.2026)\n\nSamvatsaram: Parabhava Samvatsaram\nAyanam: Dakshinayanam\nRuthuvu: Sarad Ruthuvu\nMasam: Ashwayujamu\nPaksham: Shukla Paksham\nTithi: upto 3.25 AM Panchami\, thereafter Shashti\nVaram: Guruvaram\nNakshatram: Jyeshta (1 Padam)\nYogam: Saubhagya\nKaranam: Bavai\nRahu Kalam: 1.29 PM to 2.58 PM\nYamagandam: 6.09 AM to 7.37 AM\nDurmuhurtham: 1.12 PM to 1.59 PM\nAbhijit Muhurtham: 11.38 AM to 12.25 PM\nSuryodayam: 6.09 AM\nSuryastamayam: 5.54 PM\nChandrodayam: 10.07 AM\nChandrashtamam: Mesham\nTaddinam Tithi: Panchami\nPradesham: Hyderabad (Telugu Style)
SUMMARY:Ashwayujamu Shukla Paksham Panchami  (15.10.2026)
UID:india-te-2026-10-15@panchangam
END:VEVENT
BEGIN:VEVENT
DTSTART;VALUE=DATE:20261125
CATEGORIES:PANCHANGAM
DESCRIPTION:Karthikamu Krishna Paksham Padyami  (25.11.2026)\n\nSamvatsaram: Parabhava Samvatsaram\nAyanam: Dakshinayanam\nRuthuvu: Sarad Ruthuvu\nMasam: Karthikamu\nPaksham: Krishna Paksham\nTithi: upto 4.50 PM Padyami\, thereafter Vidiya\nVaram: Budhavaram\nNakshatram: upto 9.12 PM Rohini (2 Padam)\, and then Mrigashira\nYogam: Shiva\nKaranam: Balavai\nRahu Kalam: 12.02 PM to 1.27 PM\nYamagandam: 7.50 AM to 9.14 AM\nDurmuhurtham: 10.10 AM to 10.55 AM\nAbhijit Muhurtham: 11.40 AM to 12.25 PM\nSuryodayam: 6.26 AM\nSuryastamayam: 5.39 PM\nChandrodayam: 6.20 PM\nChandrashtamam: Thula\nTaddinam Tithi: Padyami\nPradesham: Hyderabad (Telugu Style)
SUMMARY:Karthikamu Krishna Paksham Padyami  (25.11.2026)
UID:india-te-2026-11-25@panchangam
END:VEVENT
BEGIN:VEVENT
DTSTART;VALUE=DATE:20260120
CATEGORIES:PANCHANGAM
DESCRIPTION:Maghamu Shukla Paksham Vidiya  (20.01.2026)\n\nSamvatsaram: Vishvavasu Samvatsaram\nAyanam: Uttarayanam\nRuthuvu: Shishira Ruthuvu\nMasam: Maghamu\nPaksham: Shukla Paksham\nTithi: upto 2.43 AM Vidiya\, thereafter Thadiya\nVaram: Mangalavaram\nNakshatram: upto 1.48 PM Shravana (3 Padam)\, and then Dhanishta\nYogam: Siddhi\nKaranam: Balavai\nRahu Kalam: 3.15 PM to 4.40 PM\nYamagandam: 9.38 AM to 11.02 AM\nDurmuhurtham: 8.19 AM to 9.04 AM\, 11.19 AM to 12.04 PM\nAbhijit Muhurtham: 12.04 PM to 12.49 PM\nSuryodayam: 6.49 AM\nSuryastamayam: 6.04 PM\nChandrodayam: 7.55 AM\nChandrashtamam: Mithunam\nTaddinam Tithi: Vidiya\nPradesham: Hyderabad (Telugu Style)
SUMMARY:Maghamu Shukla Paksham Vidiya  (20.01.2026)
UID:india-te-2026-01-20@panchangam
END:VEVENT
BEGIN:VEVENT
DTSTART;VALUE=DATE:20260109
CATEGORIES:PANCHANGAM
DESCRIPTION:Pushyamu Krishna Paksham Shashti  (09.01.2026)\n\nSamvatsaram: Vishvavasu Samvatsaram\nAyanam: Uttarayanam\nRuthuvu: Hemantha Ruthuvu\nMasam: Pushyamu\nPaksham: Krishna Paksham\nTithi: upto 7.05 AM Shashti\, thereafter Saptami\nVaram: Shukravaram\nNakshatram: upto 2.22 PM Uttara (3 Padam)\, and then Hasta\nYogam: Shobhana\nKaranam: Vanijai\nRahu Kalam: 10.59 AM to 12.23 PM\nYamagandam: 3.10 PM to 4.34 PM\nDurmuhurtham: 9.02 AM to 9.46 AM\, 12.45 PM to 1.30 PM\nAbhijit Muhurtham: 12 Noon to 12.45 PM\nSuryodayam: 6.48 AM\nSuryastamayam: 5.57 PM\nChandrodayam: 11.38 PM\nChandrashtamam: Kumbham\nTaddinam Tithi: Saptami\nPradesham: Hyderabad (Telugu Style)
SUMMARY:Pushyamu Krishna Paksham Shashti  (09.01.2026)
UID:india-te-2026-01-09@panchangam
END:VEVENT
BEGIN:VEVENT
DTSTART;VALUE=DATE:20260219
CATEGORIES:PANCHANGAM
DESCRIPTION:Phalgunamu Shukla Paksham Vidiya  (19.02.2026)\n\nSamvatsaram: Vishvavasu Samvatsaram\nAyanam: Uttarayanam\nRuthuvu: Shishira Ruthuvu\nMasam: Phalgunamu\nPaksham: Shukla Paksham\nTithi: upto 3.59 PM Vidiya\, thereafter Thadiya\nVaram: Guruvaram\nNakshatram: upto 9.30 PM Poorvabhadra (2 Padam)\, and then Uttarabhadra\nYogam: Siddha\nKaranam: Kaulavai\nRahu Kalam: 1.57 PM to 3.24 PM\nYamagandam: 6.40 AM to 8.08 AM\nDurmuhurtham: 1.39 PM to 2.26 PM\nAbhijit Muhurtham: 12.06 PM to 12.53 PM\nSuryodayam: 6.40 AM\nSuryastamayam: 6.19 PM\nChandrodayam: 7.47 AM\nChandrashtamam: Karkatakam\nTaddinam Tithi: Vidiya\nPradesham: Hyderabad (Telugu Style)
SUMMARY:Phalgunamu Shukla Paksham Vidiya  (19.02.2026)
UID:india-te-2026-02-19@panchangam
END:VEVENT
BEGIN:VEVENT
DTSTART;VALUE=DATE:20260329
CATEGORIES:PANCHANGAM
DESCRIPTION:Chaitramu Shukla Paksham Ekadashi  (29.03.2026)\n\n🎉 SPECIAL: Ekadashi (Shukla)\nSamvatsaram: Vishvavasu Samvatsaram\nAyanam: Uttarayanam\nRuthuvu: Vasantha Ruthuvu\nMasam: Chaitramu\nPaksham: Shukla Paksham\nTithi: upto 7.46 AM Ekadashi\, thereafter Dwadashi\nVaram: Bhanuvaram\nNakshatram: upto 3.17 PM Ashlesha (3 Padam)\, and then Makha\nYogam: Dhruthi\nKaranam: Vishti\nRahu Kalam: 4.56 PM to 6.28 PM\nYamagandam: 12.20 PM to 1.52 PM\nDurmuhurtham: 4.50 PM to 5.39 PM\nAbhijit Muhurtham: 11.56 AM to 12.45 PM\nSuryodayam: 6.13 AM\nSuryastamayam: 6.28 PM\nChandrodayam: 3.21 PM\nChandrashtamam: Dhanu\nTaddinam Tithi: Dwadashi\nPradesham: Hyderabad (Telugu Style)
SUMMARY:Chaitramu Shukla Paksham Ekadashi  (29.03.2026)
UID:india-te-2026-03-29@panchangam
END:VEVENT
BEGIN:VEVENT
BEGIN:VALARM
ACTION:DISPLAY
DESCRIPTION:
TRIGGER:-P1D
END:VALARM
DTSTART;VALUE=DATE:20260915
CATEGORIES:FESTIVAL
DESCRIPTION:Deity: Lord Ganesha\nFood: Kozhukattai / Kudumulu\nRules: Hyderabad (Telugu Style) Calendar
SUMMARY:🎉 Vinayaka Chavithi
UID:india-te-2026-09-15-VinayakaChavithi@festival
END:VEVENT
BEGIN:VEVENT
DTSTART;VALUE=DATE:20251225
CATEGORIES:PANCHANGAM
DESCRIPTION:Pushyamu Shukla Paksham Panchami  (25.12.2025)\n\nSamvatsaram: Vishvavasu Samvatsaram\nAyanam: Uttarayanam\nRuthuvu: Hemantha Ruthuvu\nMasam: Pushyamu\nPaksham: Shukla Paksham\nTithi: upto 1.43 PM Panchami\, thereafter Shashti\nVaram: Guruvaram\nNakshatram: upto 8.59 AM Dhanishta (4 Padam)\, and then Shatabhisham\nYogam: Vajra\nKaranam: Balavai\nRahu Kalam: 1.39 PM to 3.02 PM\nYamagandam: 6.43 AM to 8.06 AM\nDurmuhurtham: 1.22 PM to 2.07 PM\nAbhijit Muhurtham: 11.53 AM to 12.38 PM\nSuryodayam: 6.43 AM\nSuryastamayam: 5.48 PM\nChandrodayam: 10.33 AM\nChandrashtamam: Karkatakam\nTaddinam Tithi: Shashti\nPradesham: Hyderabad (Telugu Style)
SUMMARY:Pushyamu Shukla Paksham Panchami  (25.12.2025)
UID:india-te-2025-12-25@panchangam
END:VEVENT
BEGIN:VEVENT
DTSTART;VALUE=DATE:20260608
CATEGORIES:PANCHANGAM
DESCRIPTION:Jyeshthamu Krishna Paksham Ashtami  (08.06.2026)\n\nSamvatsaram: Parabhava Samvatsaram\nAyanam: Uttarayanam\nRuthuvu: Grishma Ruthuvu\nMasam: Jyeshthamu\nPaksham: Krishna Paksham\nTithi: upto 3.24 AM Ashtami\, thereafter Navami\nVaram: Somavaram\nNakshatram: upto 9.51 AM Shatabhisham (4 Padam)\, and then Poorvabhadra\nYogam: Vishkambha\nKaranam: Balavai\nRahu Kalam: 7.19 AM to 8.58 AM\nYamagandam: 10.36 AM to 12.15 PM\nDurmuhurtham: 12.41 PM to 1.33 PM\nAbhijit Muhurtham: 11.48 AM to 12.41 PM\nSuryodayam: 5.40 AM\nSuryastamayam: 6.49 PM\nChandrodayam: 12.05 AM\nChandrashtamam: Karkatakam\nTaddinam Tithi: Ashtami\nPradesham: Hyderabad (Telugu Style)
SUMMARY:Jyeshthamu Krishna Paksham Ashtami  (08.06.2026)
UID:india-te-2026-06-08@panchangam
END:VEVENT
BEGIN:VEVENT
DTSTART;VALUE=DATE:20260718
CATEGORIES:PANCHANGAM
DESCRIPTION:Ashadhamu Shukla Paksham Panchami  (18.07.2026)\n\nSamvatsaram: Parabhava Samvatsaram\nAyanam: Dakshinayanam\nRuthuvu: Grishma Ruthuvu\nMasam: Ashadhamu\nPaksham: Shukla Paksham\nTithi: upto 3.43 AM Panchami\, thereafter Shashti\nVaram: Shanivaram\nNakshatram: upto 6.40 PM Pubba (2 Padam)\, and then Uttara\nYogam: Variyana\nKaranam: Bavai\nRahu Kalam: 9.06 AM to 10.44 AM\nYamagandam: 2.00 PM to 3.37 PM\nDurmuhurtham: 5.50 AM to 6.43 AM\nAbhijit Muhurtham: 11.56 AM to 12.48 PM\nSuryodayam: 5.50 AM\nSuryastamayam: 6.53 PM\nChandrodayam: 9.35 AM\nChandrashtamam: Makaram\nTaddinam Tithi: Panchami\nPradesham: Hyderabad (Telugu Style)
SUMMARY:Ashadhamu Shukla Paksham Panchami  (18.07.2026)
UID:india-te-2026-07-18@panchangam
END:VEVENT
BEGIN:VEVENT
DTSTART;VALUE=DATE:20260828
CATEGORIES:PANCHANGAM
DESCRIPTION:Sravanamu Shukla Paksham Pournami 🌕 (28.08.2026)\n\n🎉 SPECIAL: Varalakshmi Vratam\nSamvatsaram: Parabhava Samvatsaram\nAyanam: Dakshinayanam\nRuthuvu: Varsha Ruthuvu\nMasam: Sravanamu\nPaksham: Shukla Paksham\nTithi: upto 9.48 AM Pournami\, thereafter Padyami\nVaram: Shukravaram\nNakshatram: upto 3.54 AM Shatabhisham (1 Padam)\, and then Poorvabhadra\nYogam: Atiganda\nKaranam: Bavai\nRahu Kalam: 10.43 AM to 12.17 PM\nYamagandam: 3.25 PM to 4.59 PM\nDurmuhurtham: 8.31 AM to 9.21 AM\, 12.42 PM to 1.32 PM\nAbhijit Muhurtham: 11.52 AM to 12.42 PM\nSuryodayam: 6.01 AM\nSuryastamayam: 6.32 PM\nChandrodayam: 6.42 PM\nChandrashtamam: Karkatakam\nTaddinam Tithi: Padyami\nPradesham: Hyderabad (Telugu Style)
SUMMARY:Sravanamu Shukla Paksham Pournami 🌕 (28.08.2026)
UID:india-te-2026-08-28@panchangam
END:VEVENT
BEGIN:VEVENT
DTSTART;VALUE=DATE:20261202
CATEGORIES:PANCHANGAM
DESCRIPTION:Karthikamu Krishna Paksham Navami  (02.12.2026)\n\nSamvatsaram: Parabhava Samvatsaram\nAyanam: Dakshinayanam\nRuthuvu: Sarad Ruthuvu\nMasam: Karthikamu\nPaksham: Krishna Paksham\nTithi: upto 10.52 PM Navami\, thereafter Dashami\nVaram: Budhavaram\nNakshatram: upto 9.36 AM Pubba (4 Padam)\, and then Uttara\nYogam: Vishkambha\nKaranam: Thaitilai\nRahu Kalam: 12.05 PM to 1.29 PM\nYamagandam: 7.54 AM to 9.17 AM\nDurmuhurtham: 10.13 AM to 10.58 AM\nAbhijit Muhurtham: 11.42 AM to 12.27 PM\nSuryodayam: 6.30 AM\nSuryastamayam: 5.40 PM\nChandrodayam: 12.37 AM\nChandrashtamam: Makaram\nTaddinam Tithi: Navami\nPradesham: Hyderabad (Telugu Style)
SUMMARY:Karthikamu Krishna Paksham Navami  (02.12.2026)
UID:india-te-2026-12-02@panchangam
END:VEVENT
BEGIN:VEVENT
BEGIN:VALARM
ACTION:DISPLAY
DESCRIPTION:
TRIGGER:-P1D
END:VALARM
CATEGORIES:VRATAM
DESCRIPTION:Astronomical duration of Sashti (Shukla).
DTEND:20261215T154953Z
DTSTART:20261214T134633Z
SUMMARY:⏳ Sashti (Shukla)
UID:india-te-202612141916-Sashti(Shukla)@vratam
END:VEVENT
BEGIN:VEVENT
DTSTART;VALUE=DATE:20260127
CATEGORIES:PANCHANGAM
DESCRIPTION:Maghamu Shukla Paksham Navami  (27.01.2026)\n\nSamvatsaram: Vishvavasu Samvatsaram\nAyanam: Uttarayanam\nRuthuvu: Shishira Ruthuvu\nMasam: Maghamu\nPaksham: Shukla Paksham\nTithi: upto 7.05 PM Navami\, thereafter Dashami\nVaram: Mangalavaram\nNakshatram: upto 11.45 AM Bharani (4 Padam)\, and then Kruthika\nYogam: Shubha\nKaranam: Balavai\nRahu Kalam: 3.18 PM to 4.43 PM\nYamagandam: 9.38 AM to 11.03 AM\nDurmuhurtham: 8.19 AM to 9.04 AM\, 11.20 AM to 12.06 PM\nAbhijit Muhurtham: 12.06 PM to 12.51 PM\nSuryodayam: 6.49 AM\nSuryastamayam: 6.08 PM\nChandrodayam: 12.32 PM\nChandrashtamam: Kanya\nTaddinam Tithi: Navami\nPradesham: Hyderabad (Telugu Style)
SUMMARY:Maghamu Shukla Paksham Navami  (27.01.2026)
UID:india-te-2026-01-27@panchangam
END:VEVENT
BEGIN:VEVENT
DTSTART;VALUE=DATE:20260406
CATEGORIES:PANCHANGAM
DESCRIPTION:Chaitramu Krishna Paksham Chavithi  (06.04.2026)\n\nSamvatsaram: Parabhava Samvatsaram\nAyanam: Uttarayanam\nRuthuvu: Vasantha Ruthuvu\nMasam: Chaitramu\nPaksham: Krishna Paksham\nTithi: upto 2.11 PM Chavithi\, thereafter Panchami\nVaram: Somavaram\nNakshatram: upto 3.41 AM Anuradha (1 Padam)\, and then Jyeshta\nYogam: Siddhi\nKaranam: Balavai\nRahu Kalam: 7.39 AM to 9.12 AM\nYamagandam: 10.45 AM to 12.18 PM\nDurmuhurtham: 12.43 PM to 1.32 PM\nAbhijit Muhurtham: 11.53 AM to 12.43 PM\nSuryodayam: 6.07 AM\nSuryastamayam: 6.30 PM\nChandrodayam: 10.17 PM\nChandrashtamam: Mesham\nTaddinam Tithi: Panchami\nPradesham: Hyderabad (Telugu Style)
SUMMARY:Chaitramu Krishna Paksham Chavithi  (06.04.2026)
UID:india-te-2026-04-06@panchangam
END:VEVENT
BEGIN:VEVENT
DTSTART;VALUE=DATE:20260516
CATEGORIES:PANCHANGAM
DESCRIPTION:Jyeshthamu Krishna Paksham Amavasya 🌑 (16.05.2026)\n\nSamvatsaram: Parabhava Samvatsaram\nAyanam: Uttarayanam\nRuthuvu: Grishma Ruthuvu\nMasam: Jyeshthamu\nPaksham: Krishna Paksham\nTithi: upto 1.31 AM Amavasya\, thereafter Padyami\nVaram: Shanivaram\nNakshatram: upto 6.05 PM Bharani (2 Padam)\, and then Kruthika\nYogam: Saubhagya\nKaranam: Chatushpada\nRahu Kalam: 8.58 AM to 10.35 AM\nYamagandam: 1.49 PM to 3.26 PM\nDurmuhurtham: 5.43 AM to 6.35 AM\nAbhijit Muhurtham: 11.46 AM to 12.38 PM\nSuryodayam: 5.43 AM\nSuryastamayam: 6.41 PM\nChandrodayam: 4.52 AM\nChandrashtamam: Kanya\nTaddinam Tithi: Amavasya\nPradesham: Hyderabad (Telugu Style)
SUMMARY:Jyeshthamu Krishna Paksham Amavasya 🌑 (16.05.2026)
UID:india-te-2026-05-16@panchangam
END:VEVENT
BEGIN:VEVENT
DTSTART;VALUE=DATE:20260626
CATEGORIES:PANCHANGAM
DESCRIPTION:Jyeshthamu Shukla Paksham Dwadashi  (26.06.2026)\n\nSamvatsaram: Parabhava Samvatsaram\nAyanam: Dakshinayanam\nRuthuvu: Grishma Ruthuvu\nMasam: Jyeshthamu\nPaksham: Shukla Paksham\nTithi: upto 10.22 PM Dwadashi\, thereafter Trayodashi\nVaram: Shukravaram\nNakshatram: upto 8.00 PM Vishakha (2 Padam)\, and then Anuradha\nYogam: Siddha\nKaranam: Bavai\nRahu Kalam: 10.40 AM to 12.18 PM\nYamagandam: 3.36 PM to 5.15 PM\nDurmuhurtham: 8.21 AM to 9.14 AM\, 12.45 PM to 1.37 PM\nAbhijit Muhurtham: 11.52 AM to 12.45 PM\nSuryodayam: 5.43 AM\nSuryastamayam: 6.53 PM\nChandrodayam: 4.00 PM\nChandrashtamam: Meenam\nTaddinam Tithi: Dwadashi\nPradesham: Hyderabad (Telugu Style)
SUMMARY:Jyeshthamu Shukla Paksham Dwadashi  (26.06.2026)
UID:india-te-2026-06-26@panchangam
END:VEVENT
BEGIN:VEVENT
DTSTART;VALUE=DATE:20260905
CATEGORIES:PANCHANGAM
DESCRIPTION:Sravanamu Krishna Paksham Navami  (05.09.2026)\n\nSamvatsaram: Parabhava Samvatsaram\nAyanam: Dakshinayanam\nRuthuvu: Varsha Ruthuvu\nMasam: Sravanamu\nPaksham: Krishna Paksham\nTithi: upto 9.54 PM Navami\, thereafter Dashami\nVaram: Shanivaram\nNakshatram: upto 10.08 PM Mrigashira (2 Padam)\, and then Arudra\nYogam: Vajra\nKaranam: Thaitilai\nRahu Kalam: 9.08 AM to 10.41 AM\nYamagandam: 1.47 PM to 3.20 PM\nDurmuhurtham: 6.02 AM to 6.52 AM\nAbhijit Muhurtham: 11.49 AM to 12.39 PM\nSuryodayam: 6.02 AM\nSuryastamayam: 6.26 PM\nChandrodayam: N/A\nChandrashtamam: Thula\nTaddinam Tithi: Navami\nPradesham: Hyderabad (Telugu Style)
SUMMARY:Sravanamu Krishna Paksham Navami  (05.09.2026)
UID:india-te-2026-09-05@panchangam
END:VEVENT
BEGIN:VEVENT
DTSTART;VALUE=DATE:20261110
CATEGORIES:PANCHANGAM
DESCRIPTION:Karthikamu Shukla Paksham Padyami  (10.11.2026)\n\nSamvatsaram: Parabhava Samvatsaram\nAyanam: Dakshinayanam\nRuthuvu: Sarad Ruthuvu\nMasam: Karthikamu\nPaksham: Shukla Paksham\nTithi: upto 2.00 PM Padyami\, thereafter Vidiya\nVaram: Mangalavaram\nNakshatram: upto 10.03 AM Vishakha (4 Padam)\, and then Anuradha\nYogam: Shobhana\nKaranam: Bavai\nRahu Kalam: 2.50 PM to 4.15 PM\nYamagandam: 9.09 AM to 10.34 AM\nDurmuhurtham: 7.49 AM to 8.34 AM\, 10.51 AM to 11.37 AM\nAbhijit Muhurtham: 11.37 AM to 12.22 PM\nSuryodayam: 6.18 AM\nSuryastamayam: 5.41 PM\nChandrodayam: 7.04 AM\nChandrashtamam: Mesham\nTaddinam Tithi: Vidiya\nPradesham: Hyderabad (Telugu Style)
SUMMARY:Karthikamu Shukla Paksham Padyami  (10.11.2026)
UID:india-te-2026-11-10@panchangam
END:VEVENT
BEGIN:VEVENT
DTSTART;VALUE=DATE:20261220
CATEGORIES:PANCHANGAM
DESCRIPTION:Margashiramu Shukla Paksham Ekadashi  (20.12.2026)\n\n🎉 SPECIAL: Vaikunta Ekadashi\, Ekadashi (Shukla)\nSamvatsaram: Parabhava Samvatsaram\nAyanam: Dakshinayanam\nRuthuvu: Hemantha Ruthuvu\nMasam: Margashiramu\nPaksham: Shukla Paksham\nTithi: upto 8.15 PM Ekadashi\, thereafter Dwadashi\nVaram: Bhanuvaram\nNakshatram: upto 3.34 PM Aswini (3 Padam)\, and then Bharani\nYogam: Parigha\nKaranam: Vanijai\nRahu Kalam: 4.23 PM to 5.46 PM\nYamagandam: 12.13 PM to 1.36 PM\nDurmuhurtham: 4.17 PM to 5.01 PM\nAbhijit Muhurtham: 11.51 AM to 12.35 PM\nSuryodayam: 6.40 AM\nSuryastamayam: 5.46 PM\nChandrodayam: 2.10 PM\nChandrashtamam: Kanya\nTaddinam Tithi: Ekadashi\nPradesham: Hyderabad (Telugu Style)
SUMMARY:Margashiramu Shukla Paksham Ekadashi  (20.12.2026)
UID:india-te-2026-12-20@panchangam
END:VEVENT
BEGIN:VEVENT
DTSTART;VALUE=DATE:20261209
CATEGORIES:PANCHANGAM
DESCRIPTION:Margashiramu Shukla Paksham Padyami  (09.12.2026)\n\nSamvatsaram: Parabhava Samvatsaram\nAyanam: Dakshinayanam\nRuthuvu: Hemantha Ruthuvu\nMasam: Margashiramu\nPaksham: Shukla Paksham\nTithi: Padyami\nVaram: Budhavaram\nNakshatram: upto 9.46 PM Jyeshta (2 Padam)\, and then Moola\nYogam: Dhruthi\nKaranam: Kimstughna\nRahu Kalam: 12.08 PM to 1.31 PM\nYamagandam: 7.58 AM to 9.21 AM\nDurmuhurtham: 10.17 AM to 11.01 AM\nAbhijit Muhurtham: 11.45 AM to 12.30 PM\nSuryodayam: 6.34 AM\nSuryastamayam: 5.41 PM\nChandrodayam: 6.45 AM\nChandrashtamam: Mesham\nTaddinam Tithi: Padyami\nPradesham: Hyderabad (Telugu Style)
SUMMARY:Margashiramu Shukla Paksham Padyami  (09.12.2026)
UID:india-te-2026-12-09@panchangam
END:VEVENT
BEGIN:VEVENT
BEGIN:VALARM
ACTION:DISPLAY
DESCRIPTION:
TRIGGER:-P1D
END:VALARM
CATEGORIES:VRATAM
DESCRIPTION:Astronomical duration of Sankatahara Chathurthi.
DTEND:20260307T134742Z
DTSTART:20260306T122352Z
SUMMARY:⏳ Sankatahara Chathurthi
UID:india-te-202603061753-SankataharaChathurthi@vratam
END:VEVENT
BEGIN:VEVENT
DTSTART;VALUE=DATE:20260204
CATEGORIES:PANCHANGAM
DESCRIPTION:Maghamu Krishna Paksham Thadiya  (04.02.2026)\n\nSamvatsaram: Vishvavasu Samvatsaram\nAyanam: Uttarayanam\nRuthuvu: Shishira Ruthuvu\nMasam: Maghamu\nPaksham: Krishna Paksham\nTithi: upto 12.10 AM Thadiya\, thereafter Chavithi\nVaram: Budhavaram\nNakshatram: upto 10.52 PM Pubba (2 Padam)\, and then Uttara\nYogam: Atiganda\nKaranam: Vanijai\nRahu Kalam: 12.29 PM to 1.55 PM\nYamagandam: 8.12 AM to 9.38 AM\nDurmuhurtham: 10.35 AM to 11.21 AM\nAbhijit Muhurtham: 12.07 PM to 12.52 PM\nSuryodayam: 6.47 AM\nSuryastamayam: 6.12 PM\nChandrodayam: 8.36 PM\nChandrashtamam: Makaram\nTaddinam Tithi: Thadiya\nPradesham: Hyderabad (Telugu Style)
SUMMARY:Maghamu Krishna Paksham Thadiya  (04.02.2026)
UID:india-te-2026-02-04@panchangam
END:VEVENT
BEGIN:VEVENT
DTSTART;VALUE=DATE:20260314
CATEGORIES:PANCHANGAM
DESCRIPTION:Phalgunamu Krishna Paksham Dashami  (14.03.2026)\n\nSamvatsaram: Vishvavasu Samvatsaram\nAyanam: Uttarayanam\nRuthuvu: Shishira Ruthuvu\nMasam: Phalgunamu\nPaksham: Krishna Paksham\nTithi: upto 8.11 AM Dashami\, thereafter Ekadashi\nVaram: Shanivaram\nNakshatram: upto 5.31 AM Uttarashada (1 Padam)\, and then Shravana\nYogam: Variyana\nKaranam: Vishti\nRahu Kalam: 9.25 AM to 10.55 AM\nYamagandam: 1.55 PM to 3.25 PM\nDurmuhurtham: 6.25 AM to 7.13 AM\nAbhijit Muhurtham: 12.01 PM to 12.49 PM\nSuryodayam: 6.25 AM\nSuryastamayam: 6.25 PM\nChandrodayam: 2.59 AM\nChandrashtamam: Vrushabham\nTaddinam Tithi: Ekadashi\nPradesham: Hyderabad (Telugu Style)
SUMMARY:Phalgunamu Krishna Paksham Dashami  (14.03.2026)
UID:india-te-2026-03-14@panchangam
END:VEVENT
BEGIN:VEVENT
DTSTART;VALUE=DATE:20260424
CATEGORIES:PANCHANGAM
DESCRIPTION:Vaishakhamu Shukla Paksham Ashtami  (24.04.2026)\n\nSamvatsaram: Parabhava Samvatsaram\nAyanam: Uttarayanam\nRuthuvu: Vasantha Ruthuvu\nMasam: Vaishakhamu\nPaksham: Shukla Paksham\nTithi: upto 7.22 PM Ashtami\, thereafter Navami\nVaram: Shukravaram\nNakshatram: upto 8.53 PM Pushyami (2 Padam)\, and then Ashlesha\nYogam: Shoola\nKaranam: Vishti\nRahu Kalam: 10.39 AM to 12.14 PM\nYamagandam: 3.24 PM to 4.59 PM\nDurmuhurtham: 8.26 AM to 9.17 AM\, 12.39 PM to 1.30 PM\nAbhijit Muhurtham: 11.48 AM to 12.39 PM\nSuryodayam: 5.54 AM\nSuryastamayam: 6.34 PM\nChandrodayam: 12.18 PM\nChandrashtamam: Dhanu\nTaddinam Tithi: Ashtami\nPradesham: Hyderabad (Telugu Style)
SUMMARY:Vaishakhamu Shukla Paksham Ashtami  (24.04.2026)
UID:india-te-2026-04-24@panchangam
END:VEVENT
BEGIN:VEVENT
DTSTART;VALUE=DATE:20260703
CATEGORIES:PANCHANGAM
DESCRIPTION:Jyeshthamu Krishna Paksham Thadiya  (03.07.2026)\n\n🎉 SPECIAL: Sankatahara Chathurthi\nSamvatsaram: Parabhava Samvatsaram\nAyanam: Dakshinayanam\nRuthuvu: Grishma Ruthuvu\nMasam: Jyeshthamu\nPaksham: Krishna Paksham\nTithi: upto 11.20 AM Thadiya\, thereafter Chavithi\nVaram: Shukravaram\nNakshatram: upto 12.30 PM Shravana (3 Padam)\, and then Dhanishta\nYogam: Vishkambha\nKaranam: Vishti\nRahu Kalam: 10.41 AM to 12.20 PM\nYamagandam: 3.37 PM to 5.16 PM\nDurmuhurtham: 8.23 AM to 9.16 AM\, 12.46 PM to 1.39 PM\nAbhijit Muhurtham: 11.53 AM to 12.46 PM\nSuryodayam: 5.45 AM\nSuryastamayam: 6.54 PM\nChandrodayam: 9.30 PM\nChandrashtamam: Mithunam\nTaddinam Tithi: Chavithi\nPradesham: Hyderabad (Telugu Style)
SUMMARY:Jyeshthamu Krishna Paksham Thadiya  (03.07.2026)
UID:india-te-2026-07-03@panchangam
END:VEVENT
BEGIN:VEVENT
DTSTART;VALUE=DATE:20260813
CATEGORIES:PANCHANGAM
DESCRIPTION:Sravanamu Shukla Paksham Padyami  (13.08.2026)\n\nSamvatsaram: Parabhava Samvatsaram\nAyanam: Dakshinayanam\nRuthuvu: Varsha Ruthuvu\nMasam: Sravanamu\nPaksham: Shukla Paksham\nTithi: upto 8.42 PM Padyami\, thereafter Vidiya\nVaram: Guruvaram\nNakshatram: upto 6.44 AM Ashlesha (4 Padam)\, upto 5.16 AM Makha\, and then Pubba\nYogam: Variyana\nKaranam: Kimstughna\nRahu Kalam: 1.56 PM to 3.32 PM\nYamagandam: 5.58 AM to 7.34 AM\nDurmuhurtham: 1.37 PM to 2.28 PM\nAbhijit Muhurtham: 11.55 AM to 12.46 PM\nSuryodayam: 5.58 AM\nSuryastamayam: 6.43 PM\nChandrodayam: 6.21 AM\nChandrashtamam: Dhanu\nTaddinam Tithi: Padyami\nPradesham: Hyderabad (Telugu Style)
SUMMARY:Sravanamu Shukla Paksham Padyami  (13.08.2026)
UID:india-te-2026-08-13@panchangam
END:VEVENT
BEGIN:VEVENT
BEGIN:VALARM
ACTION:DISPLAY
DESCRIPTION:
TRIGGER:-P1D
END:VALARM
CATEGORIES:VRATAM
DESCRIPTION:Astronomical duration of Sashti (Shukla).
DTEND:20260917T051822Z
DTSTART:20260916T032952Z
SUMMARY:⏳ Sashti (Shukla)
UID:india-te-202609160859-Sashti(Shukla)@vratam
END:VEVENT
BEGIN:VEVENT
DTSTART;VALUE=DATE:20260923
CATEGORIES:PANCHANGAM
DESCRIPTION:Bhadrapadamu Shukla Paksham Dwadashi  (23.09.2026)\n\nSamvatsaram: Parabhava Samvatsaram\nAyanam: Dakshinayanam\nRuthuvu: Varsha Ruthuvu\nMasam: Bhadrapadamu\nPaksham: Shukla Paksham\nTithi: upto 10.51 PM Dwadashi\, thereafter Trayodashi\nVaram: Budhavaram\nNakshatram: upto 9.52 AM Shravana (4 Padam)\, and then Dhanishta\nYogam: Sukarman\nKaranam: Bavai\nRahu Kalam: 12.08 PM to 1.39 PM\nYamagandam: 7.35 AM to 9.06 AM\nDurmuhurtham: 10.07 AM to 10.55 AM\nAbhijit Muhurtham: 11.44 AM to 12.32 PM\nSuryodayam: 6.05 AM\nSuryastamayam: 6.11 PM\nChandrodayam: 4.03 PM\nChandrashtamam: Mithunam\nTaddinam Tithi: Dwadashi\nPradesham: Hyderabad (Telugu Style)
SUMMARY:Bhadrapadamu Shukla Paksham Dwadashi  (23.09.2026)
UID:india-te-2026-09-23@panchangam
END:VEVENT
BEGIN:VEVENT
BEGIN:VALARM
ACTION:DISPLAY
DESCRIPTION:
TRIGGER:-P1D
END:VALARM
CATEGORIES:VRATAM
DESCRIPTION:Astronomical duration of Pradosham (Shukla).
DTEND:20260131T025602Z
DTSTART:20260130T053938Z
SUMMARY:⏳ Pradosham (Shukla)
UID:india-te-202601301109-Pradosham(Shukla)@vratam
END:VEVENT
BEGIN:VEVENT
DTSTART;VALUE=DATE:20261007
CATEGORIES:PANCHANGAM
DESCRIPTION:Bhadrapadamu Krishna Paksham Dwadashi  (07.10.2026)\n\nSamvatsaram: Parabhava Samvatsaram\nAyanam: Dakshinayanam\nRuthuvu: Varsha Ruthuvu\nMasam: Bhadrapadamu\nPaksham: Krishna Paksham\nTithi: upto 11.17 PM Dwadashi\, thereafter Trayodashi\nVaram: Budhavaram\nNakshatram: upto 10.20 PM Makha (2 Padam)\, and then Pubba\nYogam: Sadhya\nKaranam: Kaulavai\nRahu Kalam: 12.03 PM to 1.32 PM\nYamagandam: 7.36 AM to 9.05 AM\nDurmuhurtham: 10.04 AM to 10.52 AM\nAbhijit Muhurtham: 11.40 AM to 12.27 PM\nSuryodayam: 6.07 AM\nSuryastamayam: 6.00 PM\nChandrodayam: 2.56 AM\nChandrashtamam: Makaram\nTaddinam Tithi: Dwadashi\nPradesham: Hyderabad (Telugu Style)
SUMMARY:Bhadrapadamu Krishna Paksham Dwadashi  (07.10.2026)
UID:india-te-2026-10-07@panchangam
END:VEVENT
BEGIN:VEVENT
DTSTART;VALUE=DATE:20261117
CATEGORIES:PANCHANGAM
DESCRIPTION:Karthikamu Shukla Paksham Ashtami  (17.11.2026)\n\nSamvatsaram: Parabhava Samvatsaram\nAyanam: Dakshinayanam\nRuthuvu: Sarad Ruthuvu\nMasam: Karthikamu\nPaksham: Shukla Paksham\nTithi: upto 6.05 AM Ashtami\, thereafter Navami\nVaram: Mangalavaram\nNakshatram: upto 5.18 AM Dhanishta (1 Padam)\, and then Shatabhisham\nYogam: Vriddhi\nKaranam: Vishti\nRahu Kalam: 2.50 PM to 4.15 PM\nYamagandam: 9.11 AM to 10.36 AM\nDurmuhurtham: 7.52 AM to 8.37 AM\, 10.53 AM to 11.38 AM\nAbhijit Muhurtham: 11.38 AM to 12.23 PM\nSuryodayam: 6.21 AM\nSuryastamayam: 5.39 PM\nChandrodayam: 12.30 PM\nChandrashtamam: Mithunam\nTaddinam Tithi: Ashtami\nPradesham: Hyderabad (Telugu Style)
SUMMARY:Karthikamu Shukla Paksham Ashtami  (17.11.2026)
UID:india-te-2026-11-17@panchangam
END:VEVENT
BEGIN:VEVENT
DTSTART;VALUE=DATE:20260112
CATEGORIES:PANCHANGAM
DESCRIPTION:Pushyamu Krishna Paksham Navami  (12.01.2026)\n\nSamvatsaram: Vishvavasu Samvatsaram\nAyanam: Uttarayanam\nRuthuvu: Hemantha Ruthuvu\nMasam: Pushyamu\nPaksham: Krishna Paksham\nTithi: upto 12.43 PM Navami\, thereafter Dashami\nVaram: Somavaram\nNakshatram: upto 9.49 PM Swathi (2 Padam)\, and then Vishakha\nYogam: Dhruthi\nKaranam: Garajai\nRahu Kalam: 8.12 AM to 9.36 AM\nYamagandam: 11.00 AM to 12.24 PM\nDurmuhurtham: 12.46 PM to 1.31 PM\nAbhijit Muhurtham: 12.01 PM to 12.46 PM\nSuryodayam: 6.48 AM\nSuryastamayam: 5.59 PM\nChandrodayam: 1.16 AM\nChandrashtamam: Meenam\nTaddinam Tithi: Dashami\nPradesham: Hyderabad (Telugu Style)
SUMMARY:Pushyamu Krishna Paksham Navami  (12.01.2026)
UID:india-te-2026-01-12@panchangam
END:VEVENT
BEGIN:VEVENT
DTSTART;VALUE=DATE:20260222
CATEGORIES:PANCHANGAM
DESCRIPTION:Phalgunamu Shukla Paksham Panchami  (22.02.2026)\n\nSamvatsaram: Vishvavasu Samvatsaram\nAyanam: Uttarayanam\nRuthuvu: Shishira Ruthuvu\nMasam: Phalgunamu\nPaksham: Shukla Paksham\nTithi: upto 11.10 AM Panchami\, thereafter Shashti\nVaram: Bhanuvaram\nNakshatram: upto 6.32 PM Aswini (2 Padam)\, and then Bharani\nYogam: Shukla\nKaranam: Balavai\nRahu Kalam: 4.52 PM to 6.20 PM\nYamagandam: 12.29 PM to 1.57 PM\nDurmuhurtham: 4.46 PM to 5.33 PM\nAbhijit Muhurtham: 12.06 PM to 12.53 PM\nSuryodayam: 6.38 AM\nSuryastamayam: 6.20 PM\nChandrodayam: 9.44 AM\nChandrashtamam: Kanya\nTaddinam Tithi: Shashti\nPradesham: Hyderabad (Telugu Style)
SUMMARY:Phalgunamu Shukla Paksham Panchami  (22.02.2026)
UID:india-te-2026-02-22@panchangam
END:VEVENT
BEGIN:VEVENT
DTSTART;VALUE=DATE:20260501
CATEGORIES:PANCHANGAM
DESCRIPTION:Vaishakhamu Shukla Paksham Pournami 🌕 (01.05.2026)\n\nSamvatsaram: Parabhava Samvatsaram\nAyanam: Uttarayanam\nRuthuvu: Vasantha Ruthuvu\nMasam: Vaishakhamu\nPaksham: Shukla Paksham\nTithi: upto 10.53 PM Pournami\, thereafter Padyami\nVaram: Shukravaram\nNakshatram: upto 5.19 AM Swathi (1 Padam)\, and then Vishakha\nYogam: Siddhi\nKaranam: Vishti\nRahu Kalam: 10.37 AM to 12.13 PM\nYamagandam: 3.24 PM to 5.00 PM\nDurmuhurtham: 8.23 AM to 9.14 AM\, 12.38 PM to 1.29 PM\nAbhijit Muhurtham: 11.47 AM to 12.38 PM\nSuryodayam: 5.50 AM\nSuryastamayam: 6.36 PM\nChandrodayam: 6.24 PM\nChandrashtamam: Meenam\nTaddinam Tithi: Pournami\nPradesham: Hyderabad (Telugu Style)
SUMMARY:Vaishakhamu Shukla Paksham Pournami 🌕 (01.05.2026)
UID:india-te-2026-05-01@panchangam
END:VEVENT
BEGIN:VEVENT
DTSTART;VALUE=DATE:20260611
CATEGORIES:PANCHANGAM
DESCRIPTION:Jyeshthamu Krishna Paksham Ekadashi  (11.06.2026)\n\n🎉 SPECIAL: Ekadashi (Krishna)\nSamvatsaram: Parabhava Samvatsaram\nAyanam: Uttarayanam\nRuthuvu: Grishma Ruthuvu\nMasam: Jyeshthamu\nPaksham: Krishna Paksham\nTithi: upto 10.36 PM Ekadashi\, thereafter Dwadashi\nVaram: Guruvaram\nNakshatram: upto 8.54 AM Revathi (4 Padam)\, and then Aswini\nYogam: Shobhana\nKaranam: Bavai\nRahu Kalam: 1.54 PM to 3.32 PM\nYamagandam: 5.41 AM to 7.19 AM\nDurmuhurtham: 1.34 PM to 2.27 PM\nAbhijit Muhurtham: 11.49 AM to 12.41 PM\nSuryodayam: 5.41 AM\nSuryastamayam: 6.50 PM\nChandrodayam: 1.56 AM\nChandrashtamam: Simham\nTaddinam Tithi: Ekadashi\nPradesham: Hyderabad (Telugu Style)
SUMMARY:Jyeshthamu Krishna Paksham Ekadashi  (11.06.2026)
UID:india-te-2026-06-11@panchangam
END:VEVENT
BEGIN:VEVENT
DTSTART;VALUE=DATE:20260721
CATEGORIES:PANCHANGAM
DESCRIPTION:Ashadhamu Shukla Paksham Ashtami  (21.07.2026)\n\nSamvatsaram: Parabhava Samvatsaram\nAyanam: Dakshinayanam\nRuthuvu: Grishma Ruthuvu\nMasam: Ashadhamu\nPaksham: Shukla Paksham\nTithi: upto 5.17 AM Ashtami\, thereafter Navami\nVaram: Mangalavaram\nNakshatram: upto 9.32 PM Chitta (2 Padam)\, and then Swathi\nYogam: Siddha\nKaranam: Vishti\nRahu Kalam: 3.37 PM to 5.15 PM\nYamagandam: 9.07 AM to 10.44 AM\nDurmuhurtham: 7.36 AM to 8.28 AM\, 11.04 AM to 11.56 AM\nAbhijit Muhurtham: 11.56 AM to 12.48 PM\nSuryodayam: 5.51 AM\nSuryastamayam: 6.52 PM\nChandrodayam: 12.11 PM\nChandrashtamam: Kumbham\nTaddinam Tithi: Ashtami\nPradesham: Hyderabad (Telugu Style)
SUMMARY:Ashadhamu Shukla Paksham Ashtami  (21.07.2026)
UID:india-te-2026-07-21@panchangam
END:VEVENT
BEGIN:VEVENT
DTSTART;VALUE=DATE:20260831
CATEGORIES:PANCHANGAM
DESCRIPTION:Sravanamu Krishna Paksham Thadiya  (31.08.2026)\n\n🎉 SPECIAL: Sankatahara Chathurthi\nSamvatsaram: Parabhava Samvatsaram\nAyanam: Dakshinayanam\nRuthuvu: Varsha Ruthuvu\nMasam: Sravanamu\nPaksham: Krishna Paksham\nTithi: upto 8.51 AM Thadiya\, thereafter Chavithi\nVaram: Somavaram\nNakshatram: upto 4.03 AM Revathi (1 Padam)\, and then Aswini\nYogam: Ganda\nKaranam: Vishti\nRahu Kalam: 7.35 AM to 9.09 AM\nYamagandam: 10.42 AM to 12.16 PM\nDurmuhurtham: 12.41 PM to 1.31 PM\nAbhijit Muhurtham: 11.51 AM to 12.41 PM\nSuryodayam: 6.02 AM\nSuryastamayam: 6.30 PM\nChandrodayam: 8.32 PM\nChandrashtamam: Simham\nTaddinam Tithi: Chavithi\nPradesham: Hyderabad (Telugu Style)
SUMMARY:Sravanamu Krishna Paksham Thadiya  (31.08.2026)
UID:india-te-2026-08-31@panchangam
END:VEVENT
BEGIN:VEVENT
BEGIN:VALARM
ACTION:DISPLAY
DESCRIPTION:
TRIGGER:-P1D
END:VALARM
CATEGORIES:VRATAM
DESCRIPTION:Astronomical duration of Sashti (Shukla).
DTEND:20261017T002450Z
DTSTART:20261015T215539Z
SUMMARY:⏳ Sashti (Shukla)
UID:india-te-202610160325-Sashti(Shukla)@vratam
END:VEVENT
BEGIN:VEVENT
BEGIN:VALARM
ACTION:DISPLAY
DESCRIPTION:
TRIGGER:-P1D
END:VALARM
CATEGORIES:VRATAM
DESCRIPTION:Astronomical duration of Pradosham (Shukla).
DTEND:20260429T142206Z
DTSTART:20260428T132222Z
SUMMARY:⏳ Pradosham (Shukla)
UID:india-te-202604281852-Pradosham(Shukla)@vratam
END:VEVENT
BEGIN:VEVENT
BEGIN:VALARM
ACTION:DISPLAY
DESCRIPTION:
TRIGGER:-P1D
END:VALARM
CATEGORIES:VRATAM
DESCRIPTION:Astronomical duration of Ekadashi (Krishna).
DTEND:20260611T170643Z
DTSTART:20260610T192816Z
SUMMARY:⏳ Ekadashi (Krishna)
UID:india-te-202606110058-Ekadashi(Krishna)@vratam
END:VEVENT
BEGIN:VEVENT
BEGIN:VALARM
ACTION:DISPLAY
DESCRIPTION:
TRIGGER:-P1D
END:VALARM
CATEGORIES:VRATAM
DESCRIPTION:Astronomical duration of Sankatahara Chathurthi.
DTEND:20260802T174547Z
DTSTART:20260801T173747Z
SUMMARY:⏳ Sankatahara Chathurthi
UID:india-te-202608012307-SankataharaChathurthi@vratam
END:VEVENT
BEGIN:VEVENT
DTSTART;VALUE=DATE:20261025
CATEGORIES:PANCHANGAM
DESCRIPTION:Ashwayujamu Shukla Paksham Chaturdashi  (25.10.2026)\n\nSamvatsaram: Parabhava Samvatsaram\nAyanam: Dakshinayanam\nRuthuvu: Sarad Ruthuvu\nMasam: Ashwayujamu\nPaksham: Shukla Paksham\nTithi: upto 11.56 AM Chaturdashi\, thereafter Pournami\nVaram: Bhanuvaram\nNakshatram: upto 8.00 PM Revathi (2 Padam)\, and then Aswini\nYogam: Harshana\nKaranam: Vanijai\nRahu Kalam: 4.21 PM to 5.48 PM\nYamagandam: 12 Noon to 1.27 PM\nDurmuhurtham: 4.15 PM to 5.01 PM\nAbhijit Muhurtham: 11.36 AM to 12.23 PM\nSuryodayam: 6.11 AM\nSuryastamayam: 5.48 PM\nChandrodayam: 5.04 PM\nChandrashtamam: Simham\nTaddinam Tithi: Pournami\nPradesham: Hyderabad (Telugu Style)
SUMMARY:Ashwayujamu Shukla Paksham Chaturdashi  (25.10.2026)
UID:india-te-2026-10-25@panchangam
END:VEVENT
BEGIN:VEVENT
DTSTART;VALUE=DATE:20260130
CATEGORIES:PANCHANGAM
DESCRIPTION:Maghamu Shukla Paksham Dwadashi  (30.01.2026)\n\n🎉 SPECIAL: Pradosham (Shukla)\nSamvatsaram: Vishvavasu Samvatsaram\nAyanam: Uttarayanam\nRuthuvu: Shishira Ruthuvu\nMasam: Maghamu\nPaksham: Shukla Paksham\nTithi: upto 11.09 AM Dwadashi\, thereafter Trayodashi\nVaram: Shukravaram\nNakshatram: upto 4.03 AM Arudra (1 Padam)\, and then Punarvasu\nYogam: Vaidhriti\nKaranam: Balavai\nRahu Kalam: 11.04 AM to 12.29 PM\nYamagandam: 3.19 PM to 4.45 PM\nDurmuhurtham: 9.04 AM to 9.50 AM\, 12.52 PM to 1.37 PM\nAbhijit Muhurtham: 12.06 PM to 12.52 PM\nSuryodayam: 6.48 AM\nSuryastamayam: 6.10 PM\nChandrodayam: 3.32 PM\nChandrashtamam: Vrushchikam\nTaddinam Tithi: Trayodashi\nPradesham: Hyderabad (Telugu Style)
SUMMARY:Maghamu Shukla Paksham Dwadashi  (30.01.2026)
UID:india-te-2026-01-30@panchangam
END:VEVENT
BEGIN:VEVENT
BEGIN:VALARM
ACTION:DISPLAY
DESCRIPTION:
TRIGGER:-P1D
END:VALARM
CATEGORIES:VRATAM
DESCRIPTION:Astronomical duration of Pradosham (Shukla).
DTEND:20260627T191353Z
DTSTART:20260626T165245Z
SUMMARY:⏳ Pradosham (Shukla)
UID:india-te-202606262222-Pradosham(Shukla)@vratam
END:VEVENT
BEGIN:VEVENT
DTSTART;VALUE=DATE:20260119
CATEGORIES:PANCHANGAM
DESCRIPTION:Maghamu Shukla Paksham Padyami  (19.01.2026)\n\nSamvatsaram: Vishvavasu Samvatsaram\nAyanam: Uttarayanam\nRuthuvu: Shishira Ruthuvu\nMasam: Maghamu\nPaksham: Shukla Paksham\nTithi: upto 2.14 AM Padyami\, thereafter Vidiya\nVaram: Somavaram\nNakshatram: upto 12.34 PM Uttarashada (4 Padam)\, and then Shravana\nYogam: Vajra\nKaranam: Kimstughna\nRahu Kalam: 8.13 AM to 9.38 AM\nYamagandam: 11.02 AM to 12.26 PM\nDurmuhurtham: 12.49 PM to 1.34 PM\nAbhijit Muhurtham: 12.04 PM to 12.49 PM\nSuryodayam: 6.49 AM\nSuryastamayam: 6.03 PM\nChandrodayam: 7.13 AM\nChandrashtamam: Mithunam\nTaddinam Tithi: Padyami\nPradesham: Hyderabad (Telugu Style)
SUMMARY:Maghamu Shukla Paksham Padyami  (19.01.2026)
UID:india-te-2026-01-19@panchangam
END:VEVENT
BEGIN:VEVENT
DTSTART;VALUE=DATE:20260508
CATEGORIES:PANCHANGAM
DESCRIPTION:Vaishakhamu Krishna Paksham Shashti  (08.05.2026)\n\nSamvatsaram: Parabhava Samvatsaram\nAyanam: Uttarayanam\nRuthuvu: Vasantha Ruthuvu\nMasam: Vaishakhamu\nPaksham: Krishna Paksham\nTithi: upto 12.22 PM Shashti\, thereafter Saptami\nVaram: Shukravaram\nNakshatram: upto 10.03 PM Uttarashada (2 Padam)\, and then Shravana\nYogam: Shubha\nKaranam: Vanijai\nRahu Kalam: 10.36 AM to 12.12 PM\nYamagandam: 3.25 PM to 5.01 PM\nDurmuhurtham: 8.21 AM to 9.12 AM\, 12.38 PM to 1.29 PM\nAbhijit Muhurtham: 11.46 AM to 12.38 PM\nSuryodayam: 5.46 AM\nSuryastamayam: 6.38 PM\nChandrodayam: N/A\nChandrashtamam: Mithunam\nTaddinam Tithi: Saptami\nPradesham: Hyderabad (Telugu Style)
SUMMARY:Vaishakhamu Krishna Paksham Shashti  (08.05.2026)
UID:india-te-2026-05-08@panchangam
END:VEVENT
BEGIN:VEVENT
DTSTART;VALUE=DATE:20260618
CATEGORIES:PANCHANGAM
DESCRIPTION:Jyeshthamu Shukla Paksham Chavithi  (18.06.2026)\n\nSamvatsaram: Parabhava Samvatsaram\nAyanam: Uttarayanam\nRuthuvu: Grishma Ruthuvu\nMasam: Jyeshthamu\nPaksham: Shukla Paksham\nTithi: upto 6.59 PM Chavithi\, thereafter Panchami\nVaram: Guruvaram\nNakshatram: upto 12.09 PM Pushyami (3 Padam)\, and then Ashlesha\nYogam: Vyaghata\nKaranam: Vanijai\nRahu Kalam: 1.55 PM to 3.34 PM\nYamagandam: 5.42 AM to 7.20 AM\nDurmuhurtham: 1.36 PM to 2.28 PM\nAbhijit Muhurtham: 11.50 AM to 12.43 PM\nSuryodayam: 5.42 AM\nSuryastamayam: 6.52 PM\nChandrodayam: 8.55 AM\nChandrashtamam: Dhanu\nTaddinam Tithi: Chavithi\nPradesham: Hyderabad (Telugu Style)
SUMMARY:Jyeshthamu Shukla Paksham Chavithi  (18.06.2026)
UID:india-te-2026-06-18@panchangam
END:VEVENT
BEGIN:VEVENT
DTSTART;VALUE=DATE:20260728
CATEGORIES:PANCHANGAM
DESCRIPTION:Ashadhamu Shukla Paksham Chaturdashi  (28.07.2026)\n\nSamvatsaram: Parabhava Samvatsaram\nAyanam: Dakshinayanam\nRuthuvu: Grishma Ruthuvu\nMasam: Ashadhamu\nPaksham: Shukla Paksham\nTithi: upto 6.19 PM Chaturdashi\, thereafter Pournami\nVaram: Mangalavaram\nNakshatram: upto 1.55 PM Poorvashada (3 Padam)\, and then Uttarashada\nYogam: Vishkambha\nKaranam: Vanijai\nRahu Kalam: 3.36 PM to 5.13 PM\nYamagandam: 9.08 AM to 10.45 AM\nDurmuhurtham: 7.37 AM to 8.29 AM\, 11.04 AM to 11.56 AM\nAbhijit Muhurtham: 11.56 AM to 12.48 PM\nSuryodayam: 5.54 AM\nSuryastamayam: 6.50 PM\nChandrodayam: 6.08 PM\nChandrashtamam: Vrushabham\nTaddinam Tithi: Chaturdashi\nPradesham: Hyderabad (Telugu Style)
SUMMARY:Ashadhamu Shukla Paksham Chaturdashi  (28.07.2026)
UID:india-te-2026-07-28@panchangam
END:VEVENT
BEGIN:VEVENT
BEGIN:VALARM
ACTION:DISPLAY
DESCRIPTION:
TRIGGER:-P1D
END:VALARM
DTSTART;VALUE=DATE:20260821
CATEGORIES:FESTIVAL
DESCRIPTION:Deity: Goddess Lakshmi\nFood: Burelu\, Garelu\, Pulihora\nRules: Hyderabad (Telugu Style) Calendar
SUMMARY:🎉 Varalakshmi Vratam
UID:india-te-2026-08-21-VaralakshmiVratam@festival
END:VEVENT
BEGIN:VEVENT
DTSTART;VALUE=DATE:20261102
CATEGORIES:PANCHANGAM
DESCRIPTION:Ashwayujamu Krishna Paksham Ashtami  (02.11.2026)\n\nSamvatsaram: Parabhava Samvatsaram\nAyanam: Dakshinayanam\nRuthuvu: Sarad Ruthuvu\nMasam: Ashwayujamu\nPaksham: Krishna Paksham\nTithi: upto 1.11 PM Ashtami\, thereafter Navami\nVaram: Somavaram\nNakshatram: upto 4.26 AM Ashlesha (1 Padam)\, and then Makha\nYogam: Shubha\nKaranam: Kaulavai\nRahu Kalam: 7.41 AM to 9.07 AM\nYamagandam: 10.33 AM to 11.59 AM\nDurmuhurtham: 12.22 PM to 1.08 PM\nAbhijit Muhurtham: 11.36 AM to 12.22 PM\nSuryodayam: 6.14 AM\nSuryastamayam: 5.44 PM\nChandrodayam: N/A\nChandrashtamam: Dhanu\nTaddinam Tithi: Navami\nPradesham: Hyderabad (Telugu Style)
SUMMARY:Ashwayujamu Krishna Paksham Ashtami  (02.11.2026)
UID:india-te-2026-11-02@panchangam
END:VEVENT
BEGIN:VEVENT
DTSTART;VALUE=DATE:20261212
CATEGORIES:PANCHANGAM
DESCRIPTION:Margashiramu Shukla Paksham Thadiya  (12.12.2026)\n\nSamvatsaram: Parabhava Samvatsaram\nAyanam: Dakshinayanam\nRuthuvu: Hemantha Ruthuvu\nMasam: Margashiramu\nPaksham: Shukla Paksham\nTithi: upto 2.06 PM Thadiya\, thereafter Chavithi\nVaram: Shanivaram\nNakshatram: Uttarashada (1 Padam)\nYogam: Vriddhi\nKaranam: Garajai\nRahu Kalam: 9.22 AM to 10.46 AM\nYamagandam: 1.32 PM to 2.56 PM\nDurmuhurtham: 6.36 AM to 7.20 AM\nAbhijit Muhurtham: 11.47 AM to 12.31 PM\nSuryodayam: 6.36 AM\nSuryastamayam: 5.42 PM\nChandrodayam: 9.10 AM\nChandrashtamam: Vrushabham\nTaddinam Tithi: Chavithi\nPradesham: Hyderabad (Telugu Style)
SUMMARY:Margashiramu Shukla Paksham Thadiya  (12.12.2026)
UID:india-te-2026-12-12@panchangam
END:VEVENT
BEGIN:VEVENT
DTSTART;VALUE=DATE:20260306
CATEGORIES:PANCHANGAM
DESCRIPTION:Phalgunamu Krishna Paksham Thadiya  (06.03.2026)\n\n🎉 SPECIAL: Sankatahara Chathurthi\nSamvatsaram: Vishvavasu Samvatsaram\nAyanam: Uttarayanam\nRuthuvu: Shishira Ruthuvu\nMasam: Phalgunamu\nPaksham: Krishna Paksham\nTithi: upto 5.53 PM Thadiya\, thereafter Chavithi\nVaram: Shukravaram\nNakshatram: upto 10.11 AM Hasta (4 Padam)\, and then Chitta\nYogam: Ganda\nKaranam: Vishti\nRahu Kalam: 10.58 AM to 12.27 PM\nYamagandam: 3.25 PM to 4.54 PM\nDurmuhurtham: 8.53 AM to 9.41 AM\, 12.51 PM to 1.38 PM\nAbhijit Muhurtham: 12.03 PM to 12.51 PM\nSuryodayam: 6.31 AM\nSuryastamayam: 6.23 PM\nChandrodayam: 8.57 PM\nChandrashtamam: Kumbham\nTaddinam Tithi: Thadiya\nPradesham: Hyderabad (Telugu Style)
SUMMARY:Phalgunamu Krishna Paksham Thadiya  (06.03.2026)
UID:india-te-2026-03-06@panchangam
END:VEVENT
BEGIN:VEVENT
DTSTART;VALUE=DATE:20260416
CATEGORIES:PANCHANGAM
DESCRIPTION:Chaitramu Krishna Paksham Chaturdashi  (16.04.2026)\n\nSamvatsaram: Parabhava Samvatsaram\nAyanam: Uttarayanam\nRuthuvu: Vasantha Ruthuvu\nMasam: Chaitramu\nPaksham: Krishna Paksham\nTithi: upto 8.11 PM Chaturdashi\, thereafter Amavasya\nVaram: Guruvaram\nNakshatram: upto 2.35 PM Uttarabhadra (3 Padam)\, and then Revathi\nYogam: Indra\nKaranam: Vishti\nRahu Kalam: 1.50 PM to 3.24 PM\nYamagandam: 5.59 AM to 7.33 AM\nDurmuhurtham: 1.31 PM to 2.21 PM\nAbhijit Muhurtham: 11.50 AM to 12.41 PM\nSuryodayam: 5.59 AM\nSuryastamayam: 6.32 PM\nChandrodayam: 4.52 AM\nChandrashtamam: Simham\nTaddinam Tithi: Chaturdashi\nPradesham: Hyderabad (Telugu Style)
SUMMARY:Chaitramu Krishna Paksham Chaturdashi  (16.04.2026)
UID:india-te-2026-04-16@panchangam
END:VEVENT
BEGIN:VEVENT
DTSTART;VALUE=DATE:20260526
CATEGORIES:PANCHANGAM
DESCRIPTION:Jyeshthamu Shukla Paksham Ekadashi  (26.05.2026)\n\n🎉 SPECIAL: Ekadashi (Shukla)\nSamvatsaram: Parabhava Samvatsaram\nAyanam: Uttarayanam\nRuthuvu: Grishma Ruthuvu\nMasam: Jyeshthamu\nPaksham: Shukla Paksham\nTithi: Ekadashi\nVaram: Mangalavaram\nNakshatram: Hasta (1 Padam)\nYogam: Siddhi\nKaranam: Vanijai\nRahu Kalam: 3.28 PM to 5.06 PM\nYamagandam: 8.57 AM to 10.35 AM\nDurmuhurtham: 7.25 AM to 8.18 AM\, 10.54 AM to 11.47 AM\nAbhijit Muhurtham: 11.47 AM to 12.39 PM\nSuryodayam: 5.41 AM\nSuryastamayam: 6.44 PM\nChandrodayam: 2.40 PM\nChandrashtamam: Kumbham\nTaddinam Tithi: Ekadashi\nPradesham: Hyderabad (Telugu Style)
SUMMARY:Jyeshthamu Shukla Paksham Ekadashi  (26.05.2026)
UID:india-te-2026-05-26@panchangam
END:VEVENT
BEGIN:VEVENT
DTSTART;VALUE=DATE:20260805
CATEGORIES:PANCHANGAM
DESCRIPTION:Ashadhamu Krishna Paksham Saptami  (05.08.2026)\n\nSamvatsaram: Parabhava Samvatsaram\nAyanam: Dakshinayanam\nRuthuvu: Grishma Ruthuvu\nMasam: Ashadhamu\nPaksham: Krishna Paksham\nTithi: upto 8.42 PM Saptami\, thereafter Ashtami\nVaram: Budhavaram\nNakshatram: upto 9.57 PM Aswini (2 Padam)\, and then Bharani\nYogam: Shoola\nKaranam: Vishti\nRahu Kalam: 12.21 PM to 1.58 PM\nYamagandam: 7.32 AM to 9.09 AM\nDurmuhurtham: 10.13 AM to 11.04 AM\nAbhijit Muhurtham: 11.56 AM to 12.47 PM\nSuryodayam: 5.56 AM\nSuryastamayam: 6.47 PM\nChandrodayam: 11.14 PM\nChandrashtamam: Kanya\nTaddinam Tithi: Saptami\nPradesham: Hyderabad (Telugu Style)
SUMMARY:Ashadhamu Krishna Paksham Saptami  (05.08.2026)
UID:india-te-2026-08-05@panchangam
END:VEVENT
BEGIN:VEVENT
DTSTART;VALUE=DATE:20260915
CATEGORIES:PANCHANGAM
DESCRIPTION:Bhadrapadamu Shukla Paksham Chavithi  (15.09.2026)\n\n🎉 SPECIAL: Vinayaka Chavithi\nSamvatsaram: Parabhava Samvatsaram\nAyanam: Dakshinayanam\nRuthuvu: Varsha Ruthuvu\nMasam: Bhadrapadamu\nPaksham: Shukla Paksham\nTithi: upto 7.44 AM Chavithi\, thereafter Panchami\nVaram: Mangalavaram\nNakshatram: upto 4.04 PM Swathi (3 Padam)\, and then Vishakha\nYogam: Indra\nKaranam: Vishti\nRahu Kalam: 3.14 PM to 4.46 PM\nYamagandam: 9.07 AM to 10.39 AM\nDurmuhurtham: 7.41 AM to 8.30 AM\, 10.57 AM to 11.46 AM\nAbhijit Muhurtham: 11.46 AM to 12.35 PM\nSuryodayam: 6.04 AM\nSuryastamayam: 6.18 PM\nChandrodayam: 9.35 AM\nChandrashtamam: Meenam\nTaddinam Tithi: Panchami\nPradesham: Hyderabad (Telugu Style)
SUMMARY:Bhadrapadamu Shukla Paksham Chavithi  (15.09.2026)
UID:india-te-2026-09-15@panchangam
END:VEVENT
BEGIN:VEVENT
DTSTART;VALUE=DATE:20261010
CATEGORIES:PANCHANGAM
DESCRIPTION:Ashwayujamu Krishna Paksham Amavasya 🌑 (10.10.2026)\n\nSamvatsaram: Parabhava Samvatsaram\nAyanam: Dakshinayanam\nRuthuvu: Sarad Ruthuvu\nMasam: Ashwayujamu\nPaksham: Krishna Paksham\nTithi: upto 9.20 PM Amavasya\, thereafter Padyami\nVaram: Shanivaram\nNakshatram: upto 10.24 PM Hasta (2 Padam)\, and then Chitta\nYogam: Indra\nKaranam: Chatushpada\nRahu Kalam: 9.05 AM to 10.34 AM\nYamagandam: 1.31 PM to 3.00 PM\nDurmuhurtham: 6.07 AM to 6.55 AM\nAbhijit Muhurtham: 11.39 AM to 12.26 PM\nSuryodayam: 6.07 AM\nSuryastamayam: 5.58 PM\nChandrodayam: 5.38 AM\nChandrashtamam: Kumbham\nTaddinam Tithi: Amavasya\nPradesham: Hyderabad (Telugu Style)
SUMMARY:Ashwayujamu Krishna Paksham Amavasya 🌑 (10.10.2026)
UID:india-te-2026-10-10@panchangam
END:VEVENT
BEGIN:VEVENT
BEGIN:VALARM
ACTION:DISPLAY
DESCRIPTION:
TRIGGER:-P1D
END:VALARM
CATEGORIES:VRATAM
DESCRIPTION:Astronomical duration of Pradosham (Krishna).
DTEND:20261107T051822Z
DTSTART:20261106T050107Z
SUMMARY:⏳ Pradosham (Krishna)
UID:india-te-202611061031-Pradosham(Krishna)@vratam
END:VEVENT
BEGIN:VEVENT
DTSTART;VALUE=DATE:20261120
CATEGORIES:PANCHANGAM
DESCRIPTION:Karthikamu Shukla Paksham Dashami  (20.11.2026)\n\nSamvatsaram: Parabhava Samvatsaram\nAyanam: Dakshinayanam\nRuthuvu: Sarad Ruthuvu\nMasam: Karthikamu\nPaksham: Shukla Paksham\nTithi: upto 7.16 AM Dashami\, thereafter Ekadashi\nVaram: Shukravaram\nNakshatram: upto 7.37 AM Poorvabhadra (4 Padam)\, and then Uttarabhadra\nYogam: Harshana\nKaranam: Garajai\nRahu Kalam: 10.37 AM to 12.01 PM\nYamagandam: 2.50 PM to 4.15 PM\nDurmuhurtham: 8.38 AM to 9.23 AM\, 12.24 PM to 1.09 PM\nAbhijit Muhurtham: 11.39 AM to 12.24 PM\nSuryodayam: 6.23 AM\nSuryastamayam: 5.39 PM\nChandrodayam: 2.17 PM\nChandrashtamam: Simham\nTaddinam Tithi: Ekadashi\nPradesham: Hyderabad (Telugu Style)
SUMMARY:Karthikamu Shukla Paksham Dashami  (20.11.2026)
UID:india-te-2026-11-20@panchangam
END:VEVENT
BEGIN:VEVENT
DTSTART;VALUE=DATE:20261109
CATEGORIES:PANCHANGAM
DESCRIPTION:Karthikamu Krishna Paksham Amavasya 🌑 (09.11.2026)\n\nSamvatsaram: Parabhava Samvatsaram\nAyanam: Dakshinayanam\nRuthuvu: Sarad Ruthuvu\nMasam: Karthikamu\nPaksham: Krishna Paksham\nTithi: upto 12.32 PM Amavasya\, thereafter Padyami\nVaram: Somavaram\nNakshatram: upto 8.07 AM Swathi (4 Padam)\, and then Vishakha\nYogam: Saubhagya\nKaranam: Nagava\nRahu Kalam: 7.43 AM to 9.08 AM\nYamagandam: 10.34 AM to 11.59 AM\nDurmuhurtham: 12.22 PM to 1.08 PM\nAbhijit Muhurtham: 11.36 AM to 12.22 PM\nSuryodayam: 6.17 AM\nSuryastamayam: 5.41 PM\nChandrodayam: 6.10 AM\nChandrashtamam: Meenam\nTaddinam Tithi: Padyami\nPradesham: Hyderabad (Telugu Style)
SUMMARY:Karthikamu Krishna Paksham Amavasya 🌑 (09.11.2026)
UID:india-te-2026-11-09@panchangam
END:VEVENT
BEGIN:VEVENT
DTSTART;VALUE=DATE:20261219
CATEGORIES:PANCHANGAM
DESCRIPTION:Margashiramu Shukla Paksham Dashami  (19.12.2026)\n\nSamvatsaram: Parabhava Samvatsaram\nAyanam: Dakshinayanam\nRuthuvu: Hemantha Ruthuvu\nMasam: Margashiramu\nPaksham: Shukla Paksham\nTithi: upto 10.09 PM Dashami\, thereafter Ekadashi\nVaram: Shanivaram\nNakshatram: upto 4.37 PM Revathi (3 Padam)\, and then Aswini\nYogam: Variyana\nKaranam: Thaitilai\nRahu Kalam: 9.26 AM to 10.49 AM\nYamagandam: 1.36 PM to 2.59 PM\nDurmuhurtham: 6.40 AM to 7.24 AM\nAbhijit Muhurtham: 11.50 AM to 12.35 PM\nSuryodayam: 6.40 AM\nSuryastamayam: 5.45 PM\nChandrodayam: 1.27 PM\nChandrashtamam: Simham\nTaddinam Tithi: Dashami\nPradesham: Hyderabad (Telugu Style)
SUMMARY:Margashiramu Shukla Paksham Dashami  (19.12.2026)
UID:india-te-2026-12-19@panchangam
END:VEVENT
BEGIN:VEVENT
DTSTART;VALUE=DATE:20260104
CATEGORIES:PANCHANGAM
DESCRIPTION:Pushyamu Krishna Paksham Padyami  (04.01.2026)\n\nSamvatsaram: Vishvavasu Samvatsaram\nAyanam: Uttarayanam\nRuthuvu: Hemantha Ruthuvu\nMasam: Pushyamu\nPaksham: Krishna Paksham\nTithi: upto 12.30 PM Padyami\, thereafter Vidiya\nVaram: Bhanuvaram\nNakshatram: upto 3.47 PM Punarvasu (3 Padam)\, and then Pushyami\nYogam: Vaidhriti\nKaranam: Kaulavai\nRahu Kalam: 4.31 PM to 5.54 PM\nYamagandam: 12.20 PM to 1.44 PM\nDurmuhurtham: 4.25 PM to 5.10 PM\nAbhijit Muhurtham: 11.58 AM to 12.43 PM\nSuryodayam: 6.47 AM\nSuryastamayam: 5.54 PM\nChandrodayam: 7.01 PM\nChandrashtamam: Vrushchikam\nTaddinam Tithi: Vidiya\nPradesham: Hyderabad (Telugu Style)
SUMMARY:Pushyamu Krishna Paksham Padyami  (04.01.2026)
UID:india-te-2026-01-04@panchangam
END:VEVENT
BEGIN:VEVENT
DTSTART;VALUE=DATE:20260214
CATEGORIES:PANCHANGAM
DESCRIPTION:Maghamu Krishna Paksham Dwadashi  (14.02.2026)\n\n🎉 SPECIAL: Pradosham (Krishna)\nSamvatsaram: Vishvavasu Samvatsaram\nAyanam: Uttarayanam\nRuthuvu: Shishira Ruthuvu\nMasam: Maghamu\nPaksham: Krishna Paksham\nTithi: upto 4.02 PM Dwadashi\, thereafter Trayodashi\nVaram: Shanivaram\nNakshatram: upto 6.58 PM Poorvashada (3 Padam)\, and then Uttarashada\nYogam: Siddhi\nKaranam: Thaitilai\nRahu Kalam: 9.36 AM to 11.03 AM\nYamagandam: 1.57 PM to 3.23 PM\nDurmuhurtham: 6.43 AM to 7.29 AM\nAbhijit Muhurtham: 12.07 PM to 12.53 PM\nSuryodayam: 6.43 AM\nSuryastamayam: 6.17 PM\nChandrodayam: 4.20 AM\nChandrashtamam: Vrushabham\nTaddinam Tithi: Dwadashi\nPradesham: Hyderabad (Telugu Style)
SUMMARY:Maghamu Krishna Paksham Dwadashi  (14.02.2026)
UID:india-te-2026-02-14@panchangam
END:VEVENT
BEGIN:VEVENT
DTSTART;VALUE=DATE:20260324
CATEGORIES:PANCHANGAM
DESCRIPTION:Chaitramu Shukla Paksham Shashti  (24.03.2026)\n\n🎉 SPECIAL: Sashti (Shukla)\nSamvatsaram: Vishvavasu Samvatsaram\nAyanam: Uttarayanam\nRuthuvu: Vasantha Ruthuvu\nMasam: Chaitramu\nPaksham: Shukla Paksham\nTithi: upto 4.08 PM Shashti\, thereafter Saptami\nVaram: Mangalavaram\nNakshatram: upto 7.41 PM Rohini (2 Padam)\, and then Mrigashira\nYogam: Preethi\nKaranam: Thaitilai\nRahu Kalam: 3.25 PM to 4.56 PM\nYamagandam: 9.19 AM to 10.51 AM\nDurmuhurtham: 7.54 AM to 8.43 AM\, 11.09 AM to 11.58 AM\nAbhijit Muhurtham: 11.58 AM to 12.46 PM\nSuryodayam: 6.17 AM\nSuryastamayam: 6.27 PM\nChandrodayam: 10.14 AM\nChandrashtamam: Thula\nTaddinam Tithi: Shashti\nPradesham: Hyderabad (Telugu Style)
SUMMARY:Chaitramu Shukla Paksham Shashti  (24.03.2026)
UID:india-te-2026-03-24@panchangam
END:VEVENT
BEGIN:VEVENT
DTSTART;VALUE=DATE:20260603
CATEGORIES:PANCHANGAM
DESCRIPTION:Jyeshthamu Krishna Paksham Thadiya  (03.06.2026)\n\nSamvatsaram: Parabhava Samvatsaram\nAyanam: Uttarayanam\nRuthuvu: Grishma Ruthuvu\nMasam: Jyeshthamu\nPaksham: Krishna Paksham\nTithi: upto 9.21 PM Thadiya\, thereafter Chavithi\nVaram: Budhavaram\nNakshatram: upto 1.44 AM Poorvashada (2 Padam)\, and then Uttarashada\nYogam: Shubha\nKaranam: Vanijai\nRahu Kalam: 12.14 PM to 1.52 PM\nYamagandam: 7.19 AM to 8.57 AM\nDurmuhurtham: 10.03 AM to 10.55 AM\nAbhijit Muhurtham: 11.47 AM to 12.40 PM\nSuryodayam: 5.40 AM\nSuryastamayam: 6.47 PM\nChandrodayam: 9.28 PM\nChandrashtamam: Vrushabham\nTaddinam Tithi: Thadiya\nPradesham: Hyderabad (Telugu Style)
SUMMARY:Jyeshthamu Krishna Paksham Thadiya  (03.06.2026)
UID:india-te-2026-06-03@panchangam
END:VEVENT
BEGIN:VEVENT
DTSTART;VALUE=DATE:20260713
CATEGORIES:PANCHANGAM
DESCRIPTION:Jyeshthamu Krishna Paksham Chaturdashi  (13.07.2026)\n\nSamvatsaram: Parabhava Samvatsaram\nAyanam: Dakshinayanam\nRuthuvu: Grishma Ruthuvu\nMasam: Jyeshthamu\nPaksham: Krishna Paksham\nTithi: upto 6.50 PM Chaturdashi\, thereafter Amavasya\nVaram: Somavaram\nNakshatram: upto 6.17 AM Mrigashira (4 Padam)\, upto 3.27 AM Arudra\, and then Punarvasu\nYogam: Dhruva\nKaranam: Vishti\nRahu Kalam: 7.27 AM to 9.05 AM\nYamagandam: 10.43 AM to 12.21 PM\nDurmuhurtham: 12.47 PM to 1.40 PM\nAbhijit Muhurtham: 11.55 AM to 12.47 PM\nSuryodayam: 5.49 AM\nSuryastamayam: 6.54 PM\nChandrodayam: 4.16 AM\nChandrashtamam: Vrushchikam\nTaddinam Tithi: Chaturdashi\nPradesham: Hyderabad (Telugu Style)
SUMMARY:Jyeshthamu Krishna Paksham Chaturdashi  (13.07.2026)
UID:india-te-2026-07-13@panchangam
END:VEVENT
BEGIN:VEVENT
DTSTART;VALUE=DATE:20260823
CATEGORIES:PANCHANGAM
DESCRIPTION:Sravanamu Shukla Paksham Ekadashi  (23.08.2026)\n\n🎉 SPECIAL: Ekadashi (Shukla)\nSamvatsaram: Parabhava Samvatsaram\nAyanam: Dakshinayanam\nRuthuvu: Varsha Ruthuvu\nMasam: Sravanamu\nPaksham: Shukla Paksham\nTithi: upto 4.19 AM Ekadashi\, thereafter Dwadashi\nVaram: Bhanuvaram\nNakshatram: upto 6.29 PM Moola (3 Padam)\, and then Poorvashada\nYogam: Vishkambha\nKaranam: Vanijai\nRahu Kalam: 5.02 PM to 6.36 PM\nYamagandam: 12.18 PM to 1.53 PM\nDurmuhurtham: 4.55 PM to 5.46 PM\nAbhijit Muhurtham: 11.53 AM to 12.43 PM\nSuryodayam: 6.00 AM\nSuryastamayam: 6.36 PM\nChandrodayam: 3.16 PM\nChandrashtamam: Vrushabham\nTaddinam Tithi: Ekadashi\nPradesham: Hyderabad (Telugu Style)
SUMMARY:Sravanamu Shukla Paksham Ekadashi  (23.08.2026)
UID:india-te-2026-08-23@panchangam
END:VEVENT
BEGIN:VEVENT
BEGIN:VALARM
ACTION:DISPLAY
DESCRIPTION:
TRIGGER:-P1D
END:VALARM
CATEGORIES:VRATAM
DESCRIPTION:Astronomical duration of Ekadashi (Shukla).
DTEND:20261220T144503Z
DTSTART:20261219T163950Z
SUMMARY:⏳ Ekadashi (Shukla)
UID:india-te-202612192209-Ekadashi(Shukla)@vratam
END:VEVENT
BEGIN:VEVENT
DTSTART;VALUE=DATE:20261017
CATEGORIES:PANCHANGAM
DESCRIPTION:Ashwayujamu Shukla Paksham Saptami  (17.10.2026)\n\nSamvatsaram: Parabhava Samvatsaram\nAyanam: Dakshinayanam\nRuthuvu: Sarad Ruthuvu\nMasam: Ashwayujamu\nPaksham: Shukla Paksham\nTithi: Saptami\nVaram: Shanivaram\nNakshatram: upto 10.32 AM Moola (4 Padam)\, and then Poorvashada\nYogam: Atiganda\nKaranam: Garajai\nRahu Kalam: 9.05 AM to 10.33 AM\nYamagandam: 1.29 PM to 2.57 PM\nDurmuhurtham: 6.09 AM to 6.56 AM\nAbhijit Muhurtham: 11.37 AM to 12.24 PM\nSuryodayam: 6.09 AM\nSuryastamayam: 5.53 PM\nChandrodayam: 11.49 AM\nChandrashtamam: Vrushabham\nTaddinam Tithi: Saptami\nPradesham: Hyderabad (Telugu Style)
SUMMARY:Ashwayujamu Shukla Paksham Saptami  (17.10.2026)
UID:india-te-2026-10-17@panchangam
END:VEVENT
BEGIN:VEVENT
DTSTART;VALUE=DATE:20261127
CATEGORIES:PANCHANGAM
DESCRIPTION:Karthikamu Krishna Paksham Thadiya  (27.11.2026)\n\n🎉 SPECIAL: Sankatahara Chathurthi\nSamvatsaram: Parabhava Samvatsaram\nAyanam: Dakshinayanam\nRuthuvu: Sarad Ruthuvu\nMasam: Karthikamu\nPaksham: Krishna Paksham\nTithi: upto 9.49 AM Thadiya\, thereafter Chavithi\nVaram: Shukravaram\nNakshatram: upto 3.45 PM Arudra (3 Padam)\, and then Punarvasu\nYogam: Shubha\nKaranam: Vishti\nRahu Kalam: 10.39 AM to 12.03 PM\nYamagandam: 2.51 PM to 4.15 PM\nDurmuhurtham: 8.41 AM to 9.26 AM\, 12.25 PM to 1.10 PM\nAbhijit Muhurtham: 11.41 AM to 12.25 PM\nSuryodayam: 6.27 AM\nSuryastamayam: 5.39 PM\nChandrodayam: 8.36 PM\nChandrashtamam: Vrushchikam\nTaddinam Tithi: Chavithi\nPradesham: Hyderabad (Telugu Style)
SUMMARY:Karthikamu Krishna Paksham Thadiya  (27.11.2026)
UID:india-te-2026-11-27@panchangam
END:VEVENT
BEGIN:VEVENT
DTSTART;VALUE=DATE:20260122
CATEGORIES:PANCHANGAM
DESCRIPTION:Maghamu Shukla Paksham Chavithi  (22.01.2026)\n\nSamvatsaram: Vishvavasu Samvatsaram\nAyanam: Uttarayanam\nRuthuvu: Shishira Ruthuvu\nMasam: Maghamu\nPaksham: Shukla Paksham\nTithi: upto 2.28 AM Chavithi\, thereafter Panchami\nVaram: Guruvaram\nNakshatram: upto 3.06 PM Shatabhisham (3 Padam)\, and then Poorvabhadra\nYogam: Variyana\nKaranam: Vanijai\nRahu Kalam: 1.52 PM to 3.16 PM\nYamagandam: 6.49 AM to 8.14 AM\nDurmuhurtham: 1.35 PM to 2.20 PM\nAbhijit Muhurtham: 12.05 PM to 12.50 PM\nSuryodayam: 6.49 AM\nSuryastamayam: 6.05 PM\nChandrodayam: 9.11 AM\nChandrashtamam: Karkatakam\nTaddinam Tithi: Chavithi\nPradesham: Hyderabad (Telugu Style)
SUMMARY:Maghamu Shukla Paksham Chavithi  (22.01.2026)
UID:india-te-2026-01-22@panchangam
END:VEVENT
BEGIN:VEVENT
DTSTART;VALUE=DATE:20260401
CATEGORIES:PANCHANGAM
DESCRIPTION:Chaitramu Shukla Paksham Chaturdashi  (01.04.2026)\n\nSamvatsaram: Parabhava Samvatsaram\nAyanam: Uttarayanam\nRuthuvu: Vasantha Ruthuvu\nMasam: Chaitramu\nPaksham: Shukla Paksham\nTithi: upto 7.06 AM Chaturdashi\, thereafter Pournami\nVaram: Budhavaram\nNakshatram: upto 4.59 PM Uttara (3 Padam)\, and then Hasta\nYogam: Vriddhi\nKaranam: Vanijai\nRahu Kalam: 12.20 PM to 1.52 PM\nYamagandam: 7.43 AM to 9.15 AM\nDurmuhurtham: 10.17 AM to 11.06 AM\nAbhijit Muhurtham: 11.55 AM to 12.44 PM\nSuryodayam: 6.10 AM\nSuryastamayam: 6.29 PM\nChandrodayam: 5.58 PM\nChandrashtamam: Kumbham\nTaddinam Tithi: Pournami\nPradesham: Hyderabad (Telugu Style)
SUMMARY:Chaitramu Shukla Paksham Chaturdashi  (01.04.2026)
UID:india-te-2026-04-01@panchangam
END:VEVENT
BEGIN:VEVENT
DTSTART;VALUE=DATE:20260511
CATEGORIES:PANCHANGAM
DESCRIPTION:Vaishakhamu Krishna Paksham Navami  (11.05.2026)\n\nSamvatsaram: Parabhava Samvatsaram\nAyanam: Uttarayanam\nRuthuvu: Vasantha Ruthuvu\nMasam: Vaishakhamu\nPaksham: Krishna Paksham\nTithi: upto 3.25 PM Navami\, thereafter Dashami\nVaram: Somavaram\nNakshatram: upto 2.08 AM Shatabhisham (1 Padam)\, and then Poorvabhadra\nYogam: Indra\nKaranam: Garajai\nRahu Kalam: 7.22 AM to 8.59 AM\nYamagandam: 10.35 AM to 12.12 PM\nDurmuhurtham: 12.38 PM to 1.29 PM\nAbhijit Muhurtham: 11.46 AM to 12.38 PM\nSuryodayam: 5.45 AM\nSuryastamayam: 6.39 PM\nChandrodayam: 1.31 AM\nChandrashtamam: Karkatakam\nTaddinam Tithi: Navami\nPradesham: Hyderabad (Telugu Style)
SUMMARY:Vaishakhamu Krishna Paksham Navami  (11.05.2026)
UID:india-te-2026-05-11@panchangam
END:VEVENT
BEGIN:VEVENT
DTSTART;VALUE=DATE:20260621
CATEGORIES:PANCHANGAM
DESCRIPTION:Jyeshthamu Shukla Paksham Saptami  (21.06.2026)\n\nSamvatsaram: Parabhava Samvatsaram\nAyanam: Uttarayanam\nRuthuvu: Grishma Ruthuvu\nMasam: Jyeshthamu\nPaksham: Shukla Paksham\nTithi: upto 3.21 PM Saptami\, thereafter Ashtami\nVaram: Bhanuvaram\nNakshatram: upto 10.12 AM Pubba (4 Padam)\, and then Uttara\nYogam: Siddhi\nKaranam: Vanijai\nRahu Kalam: 5.14 PM to 6.52 PM\nYamagandam: 12.17 PM to 1.56 PM\nDurmuhurtham: 5.07 PM to 6.00 PM\nAbhijit Muhurtham: 11.51 AM to 12.44 PM\nSuryodayam: 5.42 AM\nSuryastamayam: 6.52 PM\nChandrodayam: 11.46 AM\nChandrashtamam: Makaram\nTaddinam Tithi: Saptami\nPradesham: Hyderabad (Telugu Style)
SUMMARY:Jyeshthamu Shukla Paksham Saptami  (21.06.2026)
UID:india-te-2026-06-21@panchangam
END:VEVENT
BEGIN:VEVENT
DTSTART;VALUE=DATE:20260731
CATEGORIES:PANCHANGAM
DESCRIPTION:Ashadhamu Krishna Paksham Vidiya  (31.07.2026)\n\nSamvatsaram: Parabhava Samvatsaram\nAyanam: Dakshinayanam\nRuthuvu: Grishma Ruthuvu\nMasam: Ashadhamu\nPaksham: Krishna Paksham\nTithi: upto 10.32 PM Vidiya\, thereafter Thadiya\nVaram: Shukravaram\nNakshatram: upto 8.09 PM Dhanishta (2 Padam)\, and then Shatabhisham\nYogam: Saubhagya\nKaranam: Thaitilai\nRahu Kalam: 10.45 AM to 12.22 PM\nYamagandam: 3.36 PM to 5.12 PM\nDurmuhurtham: 8.29 AM to 9.21 AM\, 12.48 PM to 1.39 PM\nAbhijit Muhurtham: 11.56 AM to 12.48 PM\nSuryodayam: 5.55 AM\nSuryastamayam: 6.49 PM\nChandrodayam: 8.07 PM\nChandrashtamam: Mithunam\nTaddinam Tithi: Vidiya\nPradesham: Hyderabad (Telugu Style)
SUMMARY:Ashadhamu Krishna Paksham Vidiya  (31.07.2026)
UID:india-te-2026-07-31@panchangam
END:VEVENT
BEGIN:VEVENT
BEGIN:VALARM
ACTION:DISPLAY
DESCRIPTION:
TRIGGER:-P1D
END:VALARM
CATEGORIES:VRATAM
DESCRIPTION:Astronomical duration of Ekadashi (Shukla).
DTEND:20260129T082538Z
DTSTART:20260128T110632Z
SUMMARY:⏳ Ekadashi (Shukla)
UID:india-te-202601281636-Ekadashi(Shukla)@vratam
END:VEVENT
BEGIN:VEVENT
DTSTART;VALUE=DATE:20251227
CATEGORIES:PANCHANGAM
DESCRIPTION:Pushyamu Shukla Paksham Saptami  (27.12.2025)\n\nSamvatsaram: Vishvavasu Samvatsaram\nAyanam: Uttarayanam\nRuthuvu: Hemantha Ruthuvu\nMasam: Pushyamu\nPaksham: Shukla Paksham\nTithi: upto 1.10 PM Saptami\, thereafter Ashtami\nVaram: Shanivaram\nNakshatram: upto 9.48 AM Poorvabhadra (4 Padam)\, and then Uttarabhadra\nYogam: Vyatipata\nKaranam: Vanijai\nRahu Kalam: 9.30 AM to 10.53 AM\nYamagandam: 1.40 PM to 3.03 PM\nDurmuhurtham: 6.44 AM to 7.28 AM\nAbhijit Muhurtham: 11.54 AM to 12.39 PM\nSuryodayam: 6.44 AM\nSuryastamayam: 5.50 PM\nChandrodayam: 11.46 AM\nChandrashtamam: Simham\nTaddinam Tithi: Ashtami\nPradesham: Hyderabad (Telugu Style)
SUMMARY:Pushyamu Shukla Paksham Saptami  (27.12.2025)
UID:india-te-2025-12-27@panchangam
END:VEVENT
BEGIN:VEVENT
DTSTART;VALUE=DATE:20261204
CATEGORIES:PANCHANGAM
DESCRIPTION:Karthikamu Krishna Paksham Ekadashi  (04.12.2026)\n\n🎉 SPECIAL: Ekadashi (Krishna)\nSamvatsaram: Parabhava Samvatsaram\nAyanam: Dakshinayanam\nRuthuvu: Sarad Ruthuvu\nMasam: Karthikamu\nPaksham: Krishna Paksham\nTithi: upto 11.45 PM Ekadashi\, thereafter Dwadashi\nVaram: Shukravaram\nNakshatram: upto 11.05 AM Hasta (4 Padam)\, and then Chitta\nYogam: Aayushman\nKaranam: Bavai\nRahu Kalam: 10.42 AM to 12.06 PM\nYamagandam: 2.53 PM to 4.16 PM\nDurmuhurtham: 8.45 AM to 9.30 AM\, 12.28 PM to 1.12 PM\nAbhijit Muhurtham: 11.43 AM to 12.28 PM\nSuryodayam: 6.31 AM\nSuryastamayam: 5.40 PM\nChandrodayam: 2.20 AM\nChandrashtamam: Kumbham\nTaddinam Tithi: Ekadashi\nPradesham: Hyderabad (Telugu Style)
SUMMARY:Karthikamu Krishna Paksham Ekadashi  (04.12.2026)
UID:india-te-2026-12-04@panchangam
END:VEVENT
BEGIN:VEVENT
DTSTART;VALUE=DATE:20260129
CATEGORIES:PANCHANGAM
DESCRIPTION:Maghamu Shukla Paksham Ekadashi  (29.01.2026)\n\n🎉 SPECIAL: Ekadashi (Shukla)\nSamvatsaram: Vishvavasu Samvatsaram\nAyanam: Uttarayanam\nRuthuvu: Shishira Ruthuvu\nMasam: Maghamu\nPaksham: Shukla Paksham\nTithi: upto 1.55 PM Ekadashi\, thereafter Dwadashi\nVaram: Guruvaram\nNakshatram: upto 8.07 AM Rohini (4 Padam)\, upto 6.05 AM Mrigashira\, and then Arudra\nYogam: Indra\nKaranam: Vishti\nRahu Kalam: 1.54 PM to 3.19 PM\nYamagandam: 6.48 AM to 8.13 AM\nDurmuhurtham: 1.37 PM to 2.22 PM\nAbhijit Muhurtham: 12.06 PM to 12.51 PM\nSuryodayam: 6.48 AM\nSuryastamayam: 6.09 PM\nChandrodayam: 2.27 PM\nChandrashtamam: Thula\nTaddinam Tithi: Dwadashi\nPradesham: Hyderabad (Telugu Style)
SUMMARY:Maghamu Shukla Paksham Ekadashi  (29.01.2026)
UID:india-te-2026-01-29@panchangam
END:VEVENT
BEGIN:VEVENT
BEGIN:VALARM
ACTION:DISPLAY
DESCRIPTION:
TRIGGER:-P1D
END:VALARM
CATEGORIES:VRATAM
DESCRIPTION:Astronomical duration of Sankatahara Chathurthi.
DTEND:20260205T185242Z
DTSTART:20260204T184001Z
SUMMARY:⏳ Sankatahara Chathurthi
UID:india-te-202602050010-SankataharaChathurthi@vratam
END:VEVENT
BEGIN:VEVENT
BEGIN:VALARM
ACTION:DISPLAY
DESCRIPTION:
TRIGGER:-P1D
END:VALARM
CATEGORIES:VRATAM
DESCRIPTION:Astronomical duration of Ekadashi (Krishna).
DTEND:20261006T190502Z
DTSTART:20261005T203802Z
SUMMARY:⏳ Ekadashi (Krishna)
UID:india-te-202610060208-Ekadashi(Krishna)@vratam
END:VEVENT
BEGIN:VEVENT
DTSTART;VALUE=DATE:20260408
CATEGORIES:PANCHANGAM
DESCRIPTION:Chaitramu Krishna Paksham Shashti  (08.04.2026)\n\nSamvatsaram: Parabhava Samvatsaram\nAyanam: Uttarayanam\nRuthuvu: Vasantha Ruthuvu\nMasam: Chaitramu\nPaksham: Krishna Paksham\nTithi: upto 7.02 PM Shashti\, thereafter Saptami\nVaram: Budhavaram\nNakshatram: upto 6.38 AM Jyeshta (4 Padam)\, and then Moola\nYogam: Variyana\nKaranam: Vanijai\nRahu Kalam: 12.18 PM to 1.51 PM\nYamagandam: 7.38 AM to 9.11 AM\nDurmuhurtham: 10.13 AM to 11.03 AM\nAbhijit Muhurtham: 11.53 AM to 12.42 PM\nSuryodayam: 6.05 AM\nSuryastamayam: 6.30 PM\nChandrodayam: N/A\nChandrashtamam: Mesham\nTaddinam Tithi: Shashti\nPradesham: Hyderabad (Telugu Style)
SUMMARY:Chaitramu Krishna Paksham Shashti  (08.04.2026)
UID:india-te-2026-04-08@panchangam
END:VEVENT
BEGIN:VEVENT
BEGIN:VALARM
ACTION:DISPLAY
DESCRIPTION:
TRIGGER:-P1D
END:VALARM
CATEGORIES:VRATAM
DESCRIPTION:Astronomical duration of Ekadashi (Krishna).
DTEND:20260513T080021Z
DTSTART:20260512T092255Z
SUMMARY:⏳ Ekadashi (Krishna)
UID:india-te-202605121452-Ekadashi(Krishna)@vratam
END:VEVENT
BEGIN:VEVENT
DTSTART;VALUE=DATE:20260518
CATEGORIES:PANCHANGAM
DESCRIPTION:Jyeshthamu Shukla Paksham Vidiya  (18.05.2026)\n\nSamvatsaram: Parabhava Samvatsaram\nAyanam: Uttarayanam\nRuthuvu: Grishma Ruthuvu\nMasam: Jyeshthamu\nPaksham: Shukla Paksham\nTithi: upto 5.53 PM Vidiya\, thereafter Thadiya\nVaram: Somavaram\nNakshatram: upto 12.06 PM Rohini (3 Padam)\, and then Mrigashira\nYogam: Sukarman\nKaranam: Balavai\nRahu Kalam: 7.20 AM to 8.57 AM\nYamagandam: 10.35 AM to 12.12 PM\nDurmuhurtham: 12.38 PM to 1.30 PM\nAbhijit Muhurtham: 11.46 AM to 12.38 PM\nSuryodayam: 5.43 AM\nSuryastamayam: 6.41 PM\nChandrodayam: 6.48 AM\nChandrashtamam: Thula\nTaddinam Tithi: Vidiya\nPradesham: Hyderabad (Telugu Style)
SUMMARY:Jyeshthamu Shukla Paksham Vidiya  (18.05.2026)
UID:india-te-2026-05-18@panchangam
END:VEVENT
BEGIN:VEVENT
DTSTART;VALUE=DATE:20260628
CATEGORIES:PANCHANGAM
DESCRIPTION:Jyeshthamu Shukla Paksham Chaturdashi  (28.06.2026)\n\nSamvatsaram: Parabhava Samvatsaram\nAyanam: Dakshinayanam\nRuthuvu: Grishma Ruthuvu\nMasam: Jyeshthamu\nPaksham: Shukla Paksham\nTithi: upto 3.06 AM Chaturdashi\, thereafter Pournami\nVaram: Bhanuvaram\nNakshatram: upto 1.53 AM Jyeshta (2 Padam)\, and then Moola\nYogam: Shubha\nKaranam: Garajai\nRahu Kalam: 5.15 PM to 6.54 PM\nYamagandam: 12.19 PM to 1.57 PM\nDurmuhurtham: 5.08 PM to 6.01 PM\nAbhijit Muhurtham: 11.52 AM to 12.45 PM\nSuryodayam: 5.44 AM\nSuryastamayam: 6.54 PM\nChandrodayam: 5.46 PM\nChandrashtamam: Mesham\nTaddinam Tithi: Chaturdashi\nPradesham: Hyderabad (Telugu Style)
SUMMARY:Jyeshthamu Shukla Paksham Chaturdashi  (28.06.2026)
UID:india-te-2026-06-28@panchangam
END:VEVENT
BEGIN:VEVENT
DTSTART;VALUE=DATE:20260907
CATEGORIES:PANCHANGAM
DESCRIPTION:Sravanamu Krishna Paksham Ekadashi  (07.09.2026)\n\n🎉 SPECIAL: Ekadashi (Krishna)\nSamvatsaram: Parabhava Samvatsaram\nAyanam: Dakshinayanam\nRuthuvu: Varsha Ruthuvu\nMasam: Sravanamu\nPaksham: Krishna Paksham\nTithi: upto 5.04 PM Ekadashi\, thereafter Dwadashi\nVaram: Somavaram\nNakshatram: upto 6.51 PM Punarvasu (2 Padam)\, and then Pushyami\nYogam: Vyatipata\nKaranam: Bavai\nRahu Kalam: 7.35 AM to 9.08 AM\nYamagandam: 10.41 AM to 12.14 PM\nDurmuhurtham: 12.38 PM to 1.28 PM\nAbhijit Muhurtham: 11.49 AM to 12.38 PM\nSuryodayam: 6.03 AM\nSuryastamayam: 6.25 PM\nChandrodayam: 1.59 AM\nChandrashtamam: Vrushchikam\nTaddinam Tithi: Ekadashi\nPradesham: Hyderabad (Telugu Style)
SUMMARY:Sravanamu Krishna Paksham Ekadashi  (07.09.2026)
UID:india-te-2026-09-07@panchangam
END:VEVENT
BEGIN:VEVENT
DTSTART;VALUE=DATE:20261002
CATEGORIES:PANCHANGAM
DESCRIPTION:Bhadrapadamu Krishna Paksham Shashti  (02.10.2026)\n\nSamvatsaram: Parabhava Samvatsaram\nAyanam: Dakshinayanam\nRuthuvu: Varsha Ruthuvu\nMasam: Bhadrapadamu\nPaksham: Krishna Paksham\nTithi: upto 10.15 AM Shashti\, thereafter Saptami\nVaram: Shukravaram\nNakshatram: upto 3.33 AM Mrigashira (1 Padam)\, and then Arudra\nYogam: Vyatipata\nKaranam: Vanijai\nRahu Kalam: 10.35 AM to 12.05 PM\nYamagandam: 3.04 PM to 4.34 PM\nDurmuhurtham: 8.30 AM to 9.17 AM\, 12.29 PM to 1.17 PM\nAbhijit Muhurtham: 11.41 AM to 12.29 PM\nSuryodayam: 6.06 AM\nSuryastamayam: 6.04 PM\nChandrodayam: 10.47 PM\nChandrashtamam: Thula\nTaddinam Tithi: Saptami\nPradesham: Hyderabad (Telugu Style)
SUMMARY:Bhadrapadamu Krishna Paksham Shashti  (02.10.2026)
UID:india-te-2026-10-02@panchangam
END:VEVENT
BEGIN:VEVENT
DTSTART;VALUE=DATE:20261112
CATEGORIES:PANCHANGAM
DESCRIPTION:Karthikamu Shukla Paksham Thadiya  (12.11.2026)\n\nSamvatsaram: Parabhava Samvatsaram\nAyanam: Dakshinayanam\nRuthuvu: Sarad Ruthuvu\nMasam: Karthikamu\nPaksham: Shukla Paksham\nTithi: upto 6.09 PM Thadiya\, thereafter Chavithi\nVaram: Guruvaram\nNakshatram: upto 3.04 PM Jyeshta (3 Padam)\, and then Moola\nYogam: Sukarman\nKaranam: Garajai\nRahu Kalam: 1.25 PM to 2.50 PM\nYamagandam: 6.19 AM to 7.44 AM\nDurmuhurtham: 1.08 PM to 1.53 PM\nAbhijit Muhurtham: 11.37 AM to 12.22 PM\nSuryodayam: 6.19 AM\nSuryastamayam: 5.40 PM\nChandrodayam: 8.52 AM\nChandrashtamam: Mesham\nTaddinam Tithi: Thadiya\nPradesham: Hyderabad (Telugu Style)
SUMMARY:Karthikamu Shukla Paksham Thadiya  (12.11.2026)
UID:india-te-2026-11-12@panchangam
END:VEVENT
BEGIN:VEVENT
DTSTART;VALUE=DATE:20261222
CATEGORIES:PANCHANGAM
DESCRIPTION:Margashiramu Shukla Paksham Trayodashi  (22.12.2026)\n\nSamvatsaram: Parabhava Samvatsaram\nAyanam: Dakshinayanam\nRuthuvu: Hemantha Ruthuvu\nMasam: Margashiramu\nPaksham: Shukla Paksham\nTithi: upto 2.24 PM Trayodashi\, thereafter Chaturdashi\nVaram: Mangalavaram\nNakshatram: upto 11.21 AM Kruthika (4 Padam)\, and then Rohini\nYogam: Sadhya\nKaranam: Thaitilai\nRahu Kalam: 3.00 PM to 4.24 PM\nYamagandam: 9.28 AM to 10.51 AM\nDurmuhurtham: 8.10 AM to 8.54 AM\, 11.07 AM to 11.52 AM\nAbhijit Muhurtham: 11.52 AM to 12.36 PM\nSuryodayam: 6.41 AM\nSuryastamayam: 5.47 PM\nChandrodayam: 3.57 PM\nChandrashtamam: Thula\nTaddinam Tithi: Chaturdashi\nPradesham: Hyderabad (Telugu Style)
SUMMARY:Margashiramu Shukla Paksham Trayodashi  (22.12.2026)
UID:india-te-2026-12-22@panchangam
END:VEVENT
BEGIN:VEVENT
DTSTART;VALUE=DATE:20260206
CATEGORIES:PANCHANGAM
DESCRIPTION:Maghamu Krishna Paksham Panchami  (06.02.2026)\n\nSamvatsaram: Vishvavasu Samvatsaram\nAyanam: Uttarayanam\nRuthuvu: Shishira Ruthuvu\nMasam: Maghamu\nPaksham: Krishna Paksham\nTithi: upto 1.19 AM Panchami\, thereafter Shashti\nVaram: Shukravaram\nNakshatram: upto 1.06 AM Hasta (2 Padam)\, and then Chitta\nYogam: Dhruthi\nKaranam: Kaulavai\nRahu Kalam: 11.04 AM to 12.30 PM\nYamagandam: 3.21 PM to 4.47 PM\nDurmuhurtham: 9.04 AM to 9.49 AM\, 12.53 PM to 1.38 PM\nAbhijit Muhurtham: 12.07 PM to 12.53 PM\nSuryodayam: 6.46 AM\nSuryastamayam: 6.13 PM\nChandrodayam: 10.17 PM\nChandrashtamam: Kumbham\nTaddinam Tithi: Panchami\nPradesham: Hyderabad (Telugu Style)
SUMMARY:Maghamu Krishna Paksham Panchami  (06.02.2026)
UID:india-te-2026-02-06@panchangam
END:VEVENT
BEGIN:VEVENT
DTSTART;VALUE=DATE:20260316
CATEGORIES:PANCHANGAM
DESCRIPTION:Phalgunamu Krishna Paksham Dwadashi  (16.03.2026)\n\n🎉 SPECIAL: Pradosham (Krishna)\nSamvatsaram: Vishvavasu Samvatsaram\nAyanam: Uttarayanam\nRuthuvu: Shishira Ruthuvu\nMasam: Phalgunamu\nPaksham: Krishna Paksham\nTithi: upto 9.41 AM Dwadashi\, thereafter Trayodashi\nVaram: Somavaram\nNakshatram: upto 6.37 AM Shravana (4 Padam)\, and then Dhanishta\nYogam: Shiva\nKaranam: Thaitilai\nRahu Kalam: 7.53 AM to 9.24 AM\nYamagandam: 10.54 AM to 12.24 PM\nDurmuhurtham: 12.48 PM to 1.37 PM\nAbhijit Muhurtham: 12 Noon to 12.48 PM\nSuryodayam: 6.23 AM\nSuryastamayam: 6.26 PM\nChandrodayam: 4.25 AM\nChandrashtamam: Mithunam\nTaddinam Tithi: Trayodashi\nPradesham: Hyderabad (Telugu Style)
SUMMARY:Phalgunamu Krishna Paksham Dwadashi  (16.03.2026)
UID:india-te-2026-03-16@panchangam
END:VEVENT
BEGIN:VEVENT
DTSTART;VALUE=DATE:20260426
CATEGORIES:PANCHANGAM
DESCRIPTION:Vaishakhamu Shukla Paksham Dashami  (26.04.2026)\n\nSamvatsaram: Parabhava Samvatsaram\nAyanam: Uttarayanam\nRuthuvu: Vasantha Ruthuvu\nMasam: Vaishakhamu\nPaksham: Shukla Paksham\nTithi: upto 6.07 PM Dashami\, thereafter Ekadashi\nVaram: Bhanuvaram\nNakshatram: upto 9.08 PM Makha (2 Padam)\, and then Pubba\nYogam: Vriddhi\nKaranam: Thaitilai\nRahu Kalam: 4.59 PM to 6.34 PM\nYamagandam: 12.13 PM to 1.49 PM\nDurmuhurtham: 4.53 PM to 5.44 PM\nAbhijit Muhurtham: 11.48 AM to 12.39 PM\nSuryodayam: 5.53 AM\nSuryastamayam: 6.34 PM\nChandrodayam: 2.11 PM\nChandrashtamam: Makaram\nTaddinam Tithi: Dashami\nPradesham: Hyderabad (Telugu Style)
SUMMARY:Vaishakhamu Shukla Paksham Dashami  (26.04.2026)
UID:india-te-2026-04-26@panchangam
END:VEVENT
BEGIN:VEVENT
DTSTART;VALUE=DATE:20260705
CATEGORIES:PANCHANGAM
DESCRIPTION:Jyeshthamu Krishna Paksham Panchami  (05.07.2026)\n\nSamvatsaram: Parabhava Samvatsaram\nAyanam: Dakshinayanam\nRuthuvu: Grishma Ruthuvu\nMasam: Jyeshthamu\nPaksham: Krishna Paksham\nTithi: upto 1.31 PM Panchami\, thereafter Shashti\nVaram: Bhanuvaram\nNakshatram: upto 3.54 PM Shatabhisham (3 Padam)\, and then Poorvabhadra\nYogam: Aayushman\nKaranam: Thaitilai\nRahu Kalam: 5.16 PM to 6.54 PM\nYamagandam: 12.20 PM to 1.59 PM\nDurmuhurtham: 5.09 PM to 6.02 PM\nAbhijit Muhurtham: 11.54 AM to 12.46 PM\nSuryodayam: 5.46 AM\nSuryastamayam: 6.54 PM\nChandrodayam: 10.40 PM\nChandrashtamam: Karkatakam\nTaddinam Tithi: Shashti\nPradesham: Hyderabad (Telugu Style)
SUMMARY:Jyeshthamu Krishna Paksham Panchami  (05.07.2026)
UID:india-te-2026-07-05@panchangam
END:VEVENT
BEGIN:VEVENT
DTSTART;VALUE=DATE:20260815
CATEGORIES:PANCHANGAM
DESCRIPTION:Sravanamu Shukla Paksham Thadiya  (15.08.2026)\n\nSamvatsaram: Parabhava Samvatsaram\nAyanam: Dakshinayanam\nRuthuvu: Varsha Ruthuvu\nMasam: Sravanamu\nPaksham: Shukla Paksham\nTithi: upto 5.29 PM Thadiya\, thereafter Chavithi\nVaram: Shanivaram\nNakshatram: upto 4.05 AM Uttara (1 Padam)\, and then Hasta\nYogam: Shiva\nKaranam: Thaitilai\nRahu Kalam: 9.09 AM to 10.45 AM\nYamagandam: 1.55 PM to 3.31 PM\nDurmuhurtham: 5.59 AM to 6.49 AM\nAbhijit Muhurtham: 11.55 AM to 12.45 PM\nSuryodayam: 5.59 AM\nSuryastamayam: 6.41 PM\nChandrodayam: 8.15 AM\nChandrashtamam: Makaram\nTaddinam Tithi: Thadiya\nPradesham: Hyderabad (Telugu Style)
SUMMARY:Sravanamu Shukla Paksham Thadiya  (15.08.2026)
UID:india-te-2026-08-15@panchangam
END:VEVENT
BEGIN:VEVENT
DTSTART;VALUE=DATE:20260925
CATEGORIES:PANCHANGAM
DESCRIPTION:Bhadrapadamu Shukla Paksham Chaturdashi  (25.09.2026)\n\nSamvatsaram: Parabhava Samvatsaram\nAyanam: Dakshinayanam\nRuthuvu: Varsha Ruthuvu\nMasam: Bhadrapadamu\nPaksham: Shukla Paksham\nTithi: upto 11.07 PM Chaturdashi\, thereafter Pournami\nVaram: Shukravaram\nNakshatram: upto 12.03 PM Shatabhisham (4 Padam)\, and then Poorvabhadra\nYogam: Shoola\nKaranam: Garajai\nRahu Kalam: 10.37 AM to 12.07 PM\nYamagandam: 3.08 PM to 4.39 PM\nDurmuhurtham: 8.30 AM to 9.18 AM\, 12.31 PM to 1.20 PM\nAbhijit Muhurtham: 11.43 AM to 12.31 PM\nSuryodayam: 6.05 AM\nSuryastamayam: 6.09 PM\nChandrodayam: 5.16 PM\nChandrashtamam: Karkatakam\nTaddinam Tithi: Chaturdashi\nPradesham: Hyderabad (Telugu Style)
SUMMARY:Bhadrapadamu Shukla Paksham Chaturdashi  (25.09.2026)
UID:india-te-2026-09-25@panchangam
END:VEVENT
BEGIN:VEVENT
DTSTART;VALUE=DATE:20261020
CATEGORIES:PANCHANGAM
DESCRIPTION:Ashwayujamu Shukla Paksham Navami  (20.10.2026)\n\nSamvatsaram: Parabhava Samvatsaram\nAyanam: Dakshinayanam\nRuthuvu: Sarad Ruthuvu\nMasam: Ashwayujamu\nPaksham: Shukla Paksham\nTithi: upto 12.50 PM Navami\, thereafter Dashami\nVaram: Mangalavaram\nNakshatram: upto 6.46 PM Shravana (3 Padam)\, and then Dhanishta\nYogam: Shoola\nKaranam: Kaulavai\nRahu Kalam: 2.55 PM to 4.23 PM\nYamagandam: 9.05 AM to 10.33 AM\nDurmuhurtham: 7.43 AM to 8.30 AM\, 10.50 AM to 11.37 AM\nAbhijit Muhurtham: 11.37 AM to 12.24 PM\nSuryodayam: 6.10 AM\nSuryastamayam: 5.51 PM\nChandrodayam: 1.57 PM\nChandrashtamam: Mithunam\nTaddinam Tithi: Dashami\nPradesham: Hyderabad (Telugu Style)
SUMMARY:Ashwayujamu Shukla Paksham Navami  (20.10.2026)
UID:india-te-2026-10-20@panchangam
END:VEVENT
BEGIN:VEVENT
DTSTART;VALUE=DATE:20261130
CATEGORIES:PANCHANGAM
DESCRIPTION:Karthikamu Krishna Paksham Saptami  (30.11.2026)\n\nSamvatsaram: Parabhava Samvatsaram\nAyanam: Dakshinayanam\nRuthuvu: Sarad Ruthuvu\nMasam: Karthikamu\nPaksham: Krishna Paksham\nTithi: upto 12.12 AM Saptami\, thereafter Ashtami\nVaram: Somavaram\nNakshatram: upto 10.21 AM Ashlesha (4 Padam)\, and then Makha\nYogam: Indra\nKaranam: Vishti\nRahu Kalam: 7.53 AM to 9.16 AM\nYamagandam: 10.40 AM to 12.04 PM\nDurmuhurtham: 12.26 PM to 1.11 PM\nAbhijit Muhurtham: 11.42 AM to 12.26 PM\nSuryodayam: 6.29 AM\nSuryastamayam: 5.39 PM\nChandrodayam: 11.42 PM\nChandrashtamam: Dhanu\nTaddinam Tithi: Saptami\nPradesham: Hyderabad (Telugu Style)
SUMMARY:Karthikamu Krishna Paksham Saptami  (30.11.2026)
UID:india-te-2026-11-30@panchangam
END:VEVENT
BEGIN:VEVENT
BEGIN:VALARM
ACTION:DISPLAY
DESCRIPTION:
TRIGGER:-P1D
END:VALARM
CATEGORIES:VRATAM
DESCRIPTION:Astronomical duration of Ekadashi (Shukla).
DTEND:20261022T091834Z
DTSTART:20261021T084222Z
SUMMARY:⏳ Ekadashi (Shukla)
UID:india-te-202610211412-Ekadashi(Shukla)@vratam
END:VEVENT
BEGIN:VEVENT
BEGIN:VALARM
ACTION:DISPLAY
DESCRIPTION:
TRIGGER:-P1D
END:VALARM
CATEGORIES:VRATAM
DESCRIPTION:Astronomical duration of Ekadashi (Krishna).
DTEND:20260413T193911Z
DTSTART:20260412T194725Z
SUMMARY:⏳ Ekadashi (Krishna)
UID:india-te-202604130117-Ekadashi(Krishna)@vratam
END:VEVENT
BEGIN:VEVENT
DTSTART;VALUE=DATE:20261009
CATEGORIES:PANCHANGAM
DESCRIPTION:Bhadrapadamu Krishna Paksham Chaturdashi  (09.10.2026)\n\nSamvatsaram: Parabhava Samvatsaram\nAyanam: Dakshinayanam\nRuthuvu: Varsha Ruthuvu\nMasam: Bhadrapadamu\nPaksham: Krishna Paksham\nTithi: upto 9.36 PM Chaturdashi\, thereafter Amavasya\nVaram: Shukravaram\nNakshatram: upto 10.00 PM Uttara (2 Padam)\, and then Hasta\nYogam: Brahma\nKaranam: Vishti\nRahu Kalam: 10.34 AM to 12.03 PM\nYamagandam: 3.01 PM to 4.29 PM\nDurmuhurtham: 8.29 AM to 9.17 AM\, 12.26 PM to 1.14 PM\nAbhijit Muhurtham: 11.39 AM to 12.26 PM\nSuryodayam: 6.07 AM\nSuryastamayam: 5.58 PM\nChandrodayam: 4.45 AM\nChandrashtamam: Kumbham\nTaddinam Tithi: Chaturdashi\nPradesham: Hyderabad (Telugu Style)
SUMMARY:Bhadrapadamu Krishna Paksham Chaturdashi  (09.10.2026)
UID:india-te-2026-10-09@panchangam
END:VEVENT
BEGIN:VEVENT
BEGIN:VALARM
ACTION:DISPLAY
DESCRIPTION:
TRIGGER:-P1D
END:VALARM
CATEGORIES:VRATAM
DESCRIPTION:Astronomical duration of Ekadashi (Krishna).
DTEND:20260213T085625Z
DTSTART:20260212T065240Z
SUMMARY:⏳ Ekadashi (Krishna)
UID:india-te-202602121222-Ekadashi(Krishna)@vratam
END:VEVENT
BEGIN:VEVENT
DTSTART;VALUE=DATE:20261119
CATEGORIES:PANCHANGAM
DESCRIPTION:Karthikamu Shukla Paksham Navami  (19.11.2026)\n\nSamvatsaram: Parabhava Samvatsaram\nAyanam: Dakshinayanam\nRuthuvu: Sarad Ruthuvu\nMasam: Karthikamu\nPaksham: Shukla Paksham\nTithi: upto 7.06 AM Navami\, thereafter Dashami\nVaram: Guruvaram\nNakshatram: upto 6.53 AM Shatabhisham (4 Padam)\, and then Poorvabhadra\nYogam: Vyaghata\nKaranam: Kaulavai\nRahu Kalam: 1.25 PM to 2.50 PM\nYamagandam: 6.22 AM to 7.47 AM\nDurmuhurtham: 1.08 PM to 1.54 PM\nAbhijit Muhurtham: 11.38 AM to 12.23 PM\nSuryodayam: 6.22 AM\nSuryastamayam: 5.39 PM\nChandrodayam: 1.41 PM\nChandrashtamam: Karkatakam\nTaddinam Tithi: Dashami\nPradesham: Hyderabad (Telugu Style)
SUMMARY:Karthikamu Shukla Paksham Navami  (19.11.2026)
UID:india-te-2026-11-19@panchangam
END:VEVENT
BEGIN:VEVENT
DTSTART;VALUE=DATE:20260114
CATEGORIES:PANCHANGAM
DESCRIPTION:Pushyamu Krishna Paksham Ekadashi  (14.01.2026)\n\n🎉 SPECIAL: Ekadashi (Krishna)\nSamvatsaram: Vishvavasu Samvatsaram\nAyanam: Uttarayanam\nRuthuvu: Hemantha Ruthuvu\nMasam: Pushyamu\nPaksham: Krishna Paksham\nTithi: upto 5.53 PM Ekadashi\, thereafter Dwadashi\nVaram: Budhavaram\nNakshatram: upto 3.47 AM Anuradha (1 Padam)\, and then Jyeshta\nYogam: Ganda\nKaranam: Balavai\nRahu Kalam: 12.25 PM to 1.49 PM\nYamagandam: 8.13 AM to 9.37 AM\nDurmuhurtham: 10.33 AM to 11.17 AM\nAbhijit Muhurtham: 12.02 PM to 12.47 PM\nSuryodayam: 6.49 AM\nSuryastamayam: 6.00 PM\nChandrodayam: 2.59 AM\nChandrashtamam: Mesham\nTaddinam Tithi: Ekadashi\nPradesham: Hyderabad (Telugu Style)
SUMMARY:Pushyamu Krishna Paksham Ekadashi  (14.01.2026)
UID:india-te-2026-01-14@panchangam
END:VEVENT
BEGIN:VEVENT
DTSTART;VALUE=DATE:20260224
CATEGORIES:PANCHANGAM
DESCRIPTION:Phalgunamu Shukla Paksham Saptami  (24.02.2026)\n\nSamvatsaram: Vishvavasu Samvatsaram\nAyanam: Uttarayanam\nRuthuvu: Shishira Ruthuvu\nMasam: Phalgunamu\nPaksham: Shukla Paksham\nTithi: upto 7.02 AM Saptami\, upto 4.52 AM Ashtami\, thereafter Navami\nVaram: Mangalavaram\nNakshatram: upto 3.44 PM Kruthika (3 Padam)\, and then Rohini\nYogam: Indra\nKaranam: Vanijai\nRahu Kalam: 3.25 PM to 4.53 PM\nYamagandam: 9.33 AM to 11.01 AM\nDurmuhurtham: 8.11 AM to 8.58 AM\, 11.19 AM to 12.05 PM\nAbhijit Muhurtham: 12.05 PM to 12.52 PM\nSuryodayam: 6.37 AM\nSuryastamayam: 6.20 PM\nChandrodayam: 11.21 AM\nChandrashtamam: Thula\nTaddinam Tithi: Ashtami\nPradesham: Hyderabad (Telugu Style)
SUMMARY:Phalgunamu Shukla Paksham Saptami  (24.02.2026)
UID:india-te-2026-02-24@panchangam
END:VEVENT
BEGIN:VEVENT
DTSTART;VALUE=DATE:20260503
CATEGORIES:PANCHANGAM
DESCRIPTION:Vaishakhamu Krishna Paksham Vidiya  (03.05.2026)\n\nSamvatsaram: Parabhava Samvatsaram\nAyanam: Uttarayanam\nRuthuvu: Vasantha Ruthuvu\nMasam: Vaishakhamu\nPaksham: Krishna Paksham\nTithi: upto 3.02 AM Vidiya\, thereafter Thadiya\nVaram: Bhanuvaram\nNakshatram: upto 7.54 AM Vishakha (4 Padam)\, and then Anuradha\nYogam: Variyana\nKaranam: Thaitilai\nRahu Kalam: 5.00 PM to 6.36 PM\nYamagandam: 12.13 PM to 1.48 PM\nDurmuhurtham: 4.54 PM to 5.45 PM\nAbhijit Muhurtham: 11.47 AM to 12.38 PM\nSuryodayam: 5.49 AM\nSuryastamayam: 6.36 PM\nChandrodayam: 8.10 PM\nChandrashtamam: Mesham\nTaddinam Tithi: Vidiya\nPradesham: Hyderabad (Telugu Style)
SUMMARY:Vaishakhamu Krishna Paksham Vidiya  (03.05.2026)
UID:india-te-2026-05-03@panchangam
END:VEVENT
BEGIN:VEVENT
DTSTART;VALUE=DATE:20251230
CATEGORIES:PANCHANGAM
DESCRIPTION:Pushyamu Shukla Paksham Dashami  (30.12.2025)\n\nSamvatsaram: Vishvavasu Samvatsaram\nAyanam: Uttarayanam\nRuthuvu: Hemantha Ruthuvu\nMasam: Pushyamu\nPaksham: Shukla Paksham\nTithi: upto 7.51 AM Dashami\, upto 5.01 AM Ekadashi\, thereafter Dwadashi\nVaram: Mangalavaram\nNakshatram: upto 4.33 AM Bharani (1 Padam)\, and then Kruthika\nYogam: Siddha\nKaranam: Garajai\nRahu Kalam: 3.05 PM to 4.28 PM\nYamagandam: 9.32 AM to 10.55 AM\nDurmuhurtham: 8.14 AM to 8.58 AM\, 11.11 AM to 11.56 AM\nAbhijit Muhurtham: 11.56 AM to 12.40 PM\nSuryodayam: 6.45 AM\nSuryastamayam: 5.51 PM\nChandrodayam: 1.49 PM\nChandrashtamam: Kanya\nTaddinam Tithi: Ekadashi\nPradesham: Hyderabad (Telugu Style)
SUMMARY:Pushyamu Shukla Paksham Dashami  (30.12.2025)
UID:india-te-2025-12-30@panchangam
END:VEVENT
BEGIN:VEVENT
DTSTART;VALUE=DATE:20260613
CATEGORIES:PANCHANGAM
DESCRIPTION:Jyeshthamu Krishna Paksham Trayodashi  (13.06.2026)\n\nSamvatsaram: Parabhava Samvatsaram\nAyanam: Uttarayanam\nRuthuvu: Grishma Ruthuvu\nMasam: Jyeshthamu\nPaksham: Krishna Paksham\nTithi: upto 4.08 PM Trayodashi\, thereafter Chaturdashi\nVaram: Shanivaram\nNakshatram: upto 1.52 AM Kruthika (1 Padam)\, and then Rohini\nYogam: Sukarman\nKaranam: Garajai\nRahu Kalam: 8.58 AM to 10.37 AM\nYamagandam: 1.54 PM to 3.33 PM\nDurmuhurtham: 5.41 AM to 6.33 AM\nAbhijit Muhurtham: 11.49 AM to 12.42 PM\nSuryodayam: 5.41 AM\nSuryastamayam: 6.50 PM\nChandrodayam: 3.29 AM\nChandrashtamam: Kanya\nTaddinam Tithi: Trayodashi\nPradesham: Hyderabad (Telugu Style)
SUMMARY:Jyeshthamu Krishna Paksham Trayodashi  (13.06.2026)
UID:india-te-2026-06-13@panchangam
END:VEVENT
BEGIN:VEVENT
BEGIN:VALARM
ACTION:DISPLAY
DESCRIPTION:
TRIGGER:-P1D
END:VALARM
CATEGORIES:VRATAM
DESCRIPTION:Astronomical duration of Pradosham (Krishna).
DTEND:20260317T035330Z
DTSTART:20260316T041121Z
SUMMARY:⏳ Pradosham (Krishna)
UID:india-te-202603160941-Pradosham(Krishna)@vratam
END:VEVENT
BEGIN:VEVENT
DTSTART;VALUE=DATE:20260723
CATEGORIES:PANCHANGAM
DESCRIPTION:Ashadhamu Shukla Paksham Navami  (23.07.2026)\n\nSamvatsaram: Parabhava Samvatsaram\nAyanam: Dakshinayanam\nRuthuvu: Grishma Ruthuvu\nMasam: Ashadhamu\nPaksham: Shukla Paksham\nTithi: upto 7.03 AM Navami\, thereafter Dashami\nVaram: Guruvaram\nNakshatram: upto 2.27 AM Vishakha (1 Padam)\, and then Anuradha\nYogam: Shubha\nKaranam: Kaulavai\nRahu Kalam: 1.59 PM to 3.37 PM\nYamagandam: 5.52 AM to 7.30 AM\nDurmuhurtham: 1.40 PM to 2.32 PM\nAbhijit Muhurtham: 11.56 AM to 12.48 PM\nSuryodayam: 5.52 AM\nSuryastamayam: 6.52 PM\nChandrodayam: 1.55 PM\nChandrashtamam: Meenam\nTaddinam Tithi: Dashami\nPradesham: Hyderabad (Telugu Style)
SUMMARY:Ashadhamu Shukla Paksham Navami  (23.07.2026)
UID:india-te-2026-07-23@panchangam
END:VEVENT
BEGIN:VEVENT
DTSTART;VALUE=DATE:20261027
CATEGORIES:PANCHANGAM
DESCRIPTION:Ashwayujamu Krishna Paksham Padyami  (27.10.2026)\n\nSamvatsaram: Parabhava Samvatsaram\nAyanam: Dakshinayanam\nRuthuvu: Sarad Ruthuvu\nMasam: Ashwayujamu\nPaksham: Krishna Paksham\nTithi: upto 7.02 AM Padyami\, upto 4.07 AM Vidiya\, thereafter Thadiya\nVaram: Mangalavaram\nNakshatram: upto 4.16 PM Bharani (3 Padam)\, and then Kruthika\nYogam: Siddhi\nKaranam: Kaulavai\nRahu Kalam: 2.53 PM to 4.20 PM\nYamagandam: 9.06 AM to 10.33 AM\nDurmuhurtham: 7.45 AM to 8.31 AM\, 10.50 AM to 11.36 AM\nAbhijit Muhurtham: 11.36 AM to 12.22 PM\nSuryodayam: 6.12 AM\nSuryastamayam: 5.47 PM\nChandrodayam: 6.39 PM\nChandrashtamam: Kanya\nTaddinam Tithi: Vidiya\nPradesham: Hyderabad (Telugu Style)
SUMMARY:Ashwayujamu Krishna Paksham Padyami  (27.10.2026)
UID:india-te-2026-10-27@panchangam
END:VEVENT
BEGIN:VEVENT
BEGIN:VALARM
ACTION:DISPLAY
DESCRIPTION:
TRIGGER:-P1D
END:VALARM
CATEGORIES:VRATAM
DESCRIPTION:Astronomical duration of Sankatahara Chathurthi.
DTEND:20260930T092549Z
DTSTART:20260929T114041Z
SUMMARY:⏳ Sankatahara Chathurthi
UID:india-te-202609291710-SankataharaChathurthi@vratam
END:VEVENT
BEGIN:VEVENT
DTSTART;VALUE=DATE:20260301
CATEGORIES:PANCHANGAM
DESCRIPTION:Phalgunamu Shukla Paksham Trayodashi  (01.03.2026)\n\n🎉 SPECIAL: Pradosham (Shukla)\nSamvatsaram: Vishvavasu Samvatsaram\nAyanam: Uttarayanam\nRuthuvu: Shishira Ruthuvu\nMasam: Phalgunamu\nPaksham: Shukla Paksham\nTithi: upto 7.09 PM Trayodashi\, thereafter Chaturdashi\nVaram: Bhanuvaram\nNakshatram: upto 9.12 AM Pushyami (4 Padam)\, and then Ashlesha\nYogam: Shobhana\nKaranam: Kaulavai\nRahu Kalam: 4.53 PM to 6.22 PM\nYamagandam: 12.28 PM to 1.56 PM\nDurmuhurtham: 4.48 PM to 5.35 PM\nAbhijit Muhurtham: 12.04 PM to 12.52 PM\nSuryodayam: 6.34 AM\nSuryastamayam: 6.22 PM\nChandrodayam: 4.31 PM\nChandrashtamam: Dhanu\nTaddinam Tithi: Trayodashi\nPradesham: Hyderabad (Telugu Style)
SUMMARY:Phalgunamu Shukla Paksham Trayodashi  (01.03.2026)
UID:india-te-2026-03-01@panchangam
END:VEVENT
BEGIN:VEVENT
DTSTART;VALUE=DATE:20260411
CATEGORIES:PANCHANGAM
DESCRIPTION:Chaitramu Krishna Paksham Navami  (11.04.2026)\n\nSamvatsaram: Parabhava Samvatsaram\nAyanam: Uttarayanam\nRuthuvu: Vasantha Ruthuvu\nMasam: Chaitramu\nPaksham: Krishna Paksham\nTithi: upto 12.38 AM Navami\, thereafter Dashami\nVaram: Shanivaram\nNakshatram: upto 2.22 PM Uttarashada (3 Padam)\, and then Shravana\nYogam: Siddha\nKaranam: Thaitilai\nRahu Kalam: 9.10 AM to 10.43 AM\nYamagandam: 1.50 PM to 3.24 PM\nDurmuhurtham: 6.03 AM to 6.53 AM\nAbhijit Muhurtham: 11.52 AM to 12.42 PM\nSuryodayam: 6.03 AM\nSuryastamayam: 6.31 PM\nChandrodayam: 1.36 AM\nChandrashtamam: Mithunam\nTaddinam Tithi: Navami\nPradesham: Hyderabad (Telugu Style)
SUMMARY:Chaitramu Krishna Paksham Navami  (11.04.2026)
UID:india-te-2026-04-11@panchangam
END:VEVENT
BEGIN:VEVENT
DTSTART;VALUE=DATE:20260521
CATEGORIES:PANCHANGAM
DESCRIPTION:Jyeshthamu Shukla Paksham Panchami  (21.05.2026)\n\nSamvatsaram: Parabhava Samvatsaram\nAyanam: Uttarayanam\nRuthuvu: Grishma Ruthuvu\nMasam: Jyeshthamu\nPaksham: Shukla Paksham\nTithi: upto 8.27 AM Panchami\, thereafter Shashti\nVaram: Guruvaram\nNakshatram: upto 3.27 AM Pushyami (1 Padam)\, and then Ashlesha\nYogam: Ganda\nKaranam: Balavai\nRahu Kalam: 1.50 PM to 3.27 PM\nYamagandam: 5.42 AM to 7.20 AM\nDurmuhurtham: 1.30 PM to 2.22 PM\nAbhijit Muhurtham: 11.46 AM to 12.38 PM\nSuryodayam: 5.42 AM\nSuryastamayam: 6.42 PM\nChandrodayam: 10.08 AM\nChandrashtamam: Dhanu\nTaddinam Tithi: Shashti\nPradesham: Hyderabad (Telugu Style)
SUMMARY:Jyeshthamu Shukla Paksham Panchami  (21.05.2026)
UID:india-te-2026-05-21@panchangam
END:VEVENT
BEGIN:VEVENT
DTSTART;VALUE=DATE:20260910
CATEGORIES:PANCHANGAM
DESCRIPTION:Sravanamu Krishna Paksham Chaturdashi  (10.09.2026)\n\nSamvatsaram: Parabhava Samvatsaram\nAyanam: Dakshinayanam\nRuthuvu: Varsha Ruthuvu\nMasam: Sravanamu\nPaksham: Krishna Paksham\nTithi: upto 10.33 AM Chaturdashi\, thereafter Amavasya\nVaram: Guruvaram\nNakshatram: upto 2.43 PM Makha (3 Padam)\, and then Pubba\nYogam: Siddha\nKaranam: Shakuni\nRahu Kalam: 1.45 PM to 3.17 PM\nYamagandam: 6.03 AM to 7.35 AM\nDurmuhurtham: 1.26 PM to 2.16 PM\nAbhijit Muhurtham: 11.48 AM to 12.37 PM\nSuryodayam: 6.03 AM\nSuryastamayam: 6.22 PM\nChandrodayam: 5.05 AM\nChandrashtamam: Makaram\nTaddinam Tithi: Amavasya\nPradesham: Hyderabad (Telugu Style)
SUMMARY:Sravanamu Krishna Paksham Chaturdashi  (10.09.2026)
UID:india-te-2026-09-10@panchangam
END:VEVENT
BEGIN:VEVENT
DTSTART;VALUE=DATE:20261104
CATEGORIES:PANCHANGAM
DESCRIPTION:Ashwayujamu Krishna Paksham Dashami  (04.11.2026)\n\nSamvatsaram: Parabhava Samvatsaram\nAyanam: Dakshinayanam\nRuthuvu: Sarad Ruthuvu\nMasam: Ashwayujamu\nPaksham: Krishna Paksham\nTithi: upto 11.03 AM Dashami\, thereafter Ekadashi\nVaram: Budhavaram\nNakshatram: upto 4.11 AM Pubba (1 Padam)\, and then Uttara\nYogam: Brahma\nKaranam: Vishti\nRahu Kalam: 11.59 AM to 1.25 PM\nYamagandam: 7.41 AM to 9.07 AM\nDurmuhurtham: 10.04 AM to 10.50 AM\nAbhijit Muhurtham: 11.36 AM to 12.22 PM\nSuryodayam: 6.15 AM\nSuryastamayam: 5.43 PM\nChandrodayam: 1.47 AM\nChandrashtamam: Makaram\nTaddinam Tithi: Ekadashi\nPradesham: Hyderabad (Telugu Style)
SUMMARY:Ashwayujamu Krishna Paksham Dashami  (04.11.2026)
UID:india-te-2026-11-04@panchangam
END:VEVENT
BEGIN:VEVENT
DTSTART;VALUE=DATE:20261214
CATEGORIES:PANCHANGAM
DESCRIPTION:Margashiramu Shukla Paksham Panchami  (14.12.2026)\n\nSamvatsaram: Parabhava Samvatsaram\nAyanam: Dakshinayanam\nRuthuvu: Hemantha Ruthuvu\nMasam: Margashiramu\nPaksham: Shukla Paksham\nTithi: upto 7.16 PM Panchami\, thereafter Shashti\nVaram: Somavaram\nNakshatram: upto 9.57 AM Shravana (4 Padam)\, and then Dhanishta\nYogam: Vyaghata\nKaranam: Balavai\nRahu Kalam: 8.00 AM to 9.24 AM\nYamagandam: 10.47 AM to 12.10 PM\nDurmuhurtham: 12.32 PM to 1.17 PM\nAbhijit Muhurtham: 11.48 AM to 12.32 PM\nSuryodayam: 6.37 AM\nSuryastamayam: 5.43 PM\nChandrodayam: 10.29 AM\nChandrashtamam: Mithunam\nTaddinam Tithi: Panchami\nPradesham: Hyderabad (Telugu Style)
SUMMARY:Margashiramu Shukla Paksham Panchami  (14.12.2026)
UID:india-te-2026-12-14@panchangam
END:VEVENT
BEGIN:VEVENT
BEGIN:VALARM
ACTION:DISPLAY
DESCRIPTION:
TRIGGER:-P1D
END:VALARM
DTSTART;VALUE=DATE:20260828
CATEGORIES:FESTIVAL
DESCRIPTION:Deity: Goddess Lakshmi\nFood: Burelu\, Garelu\, Pulihora\nRules: Hyderabad (Telugu Style) Calendar
SUMMARY:🎉 Varalakshmi Vratam
UID:india-te-2026-08-28-VaralakshmiVratam@festival
END:VEVENT
BEGIN:VEVENT
BEGIN:VALARM
ACTION:DISPLAY
DESCRIPTION:
TRIGGER:-P1D
END:VALARM
CATEGORIES:VRATAM
DESCRIPTION:Astronomical duration of Ekadashi (Krishna).
DTEND:20261105T050607Z
DTSTART:20261104T053346Z
SUMMARY:⏳ Ekadashi (Krishna)
UID:india-te-202611041103-Ekadashi(Krishna)@vratam
END:VEVENT
BEGIN:VEVENT
DTSTART;VALUE=DATE:20260308
CATEGORIES:PANCHANGAM
DESCRIPTION:Phalgunamu Krishna Paksham Panchami  (08.03.2026)\n\nSamvatsaram: Vishvavasu Samvatsaram\nAyanam: Uttarayanam\nRuthuvu: Shishira Ruthuvu\nMasam: Phalgunamu\nPaksham: Krishna Paksham\nTithi: upto 9.11 PM Panchami\, thereafter Shashti\nVaram: Bhanuvaram\nNakshatram: upto 2.15 PM Swathi (3 Padam)\, and then Vishakha\nYogam: Dhruva\nKaranam: Kaulavai\nRahu Kalam: 4.54 PM to 6.24 PM\nYamagandam: 12.26 PM to 1.56 PM\nDurmuhurtham: 4.49 PM to 5.36 PM\nAbhijit Muhurtham: 12.03 PM to 12.50 PM\nSuryodayam: 6.29 AM\nSuryastamayam: 6.24 PM\nChandrodayam: 10.40 PM\nChandrashtamam: Meenam\nTaddinam Tithi: Panchami\nPradesham: Hyderabad (Telugu Style)
SUMMARY:Phalgunamu Krishna Paksham Panchami  (08.03.2026)
UID:india-te-2026-03-08@panchangam
END:VEVENT
BEGIN:VEVENT
DTSTART;VALUE=DATE:20260418
CATEGORIES:PANCHANGAM
DESCRIPTION:Vaishakhamu Shukla Paksham Padyami  (18.04.2026)\n\nSamvatsaram: Parabhava Samvatsaram\nAyanam: Uttarayanam\nRuthuvu: Vasantha Ruthuvu\nMasam: Vaishakhamu\nPaksham: Shukla Paksham\nTithi: upto 2.11 PM Padyami\, thereafter Vidiya\nVaram: Shanivaram\nNakshatram: upto 10.18 AM Aswini (4 Padam)\, and then Bharani\nYogam: Preethi\nKaranam: Bavai\nRahu Kalam: 9.06 AM to 10.41 AM\nYamagandam: 1.49 PM to 3.24 PM\nDurmuhurtham: 5.58 AM to 6.48 AM\nAbhijit Muhurtham: 11.50 AM to 12.40 PM\nSuryodayam: 5.58 AM\nSuryastamayam: 6.32 PM\nChandrodayam: 6.17 AM\nChandrashtamam: Kanya\nTaddinam Tithi: Vidiya\nPradesham: Hyderabad (Telugu Style)
SUMMARY:Vaishakhamu Shukla Paksham Padyami  (18.04.2026)
UID:india-te-2026-04-18@panchangam
END:VEVENT
BEGIN:VEVENT
DTSTART;VALUE=DATE:20260528
CATEGORIES:PANCHANGAM
DESCRIPTION:Jyeshthamu Shukla Paksham Dwadashi  (28.05.2026)\n\n🎉 SPECIAL: Pradosham (Shukla)\nSamvatsaram: Parabhava Samvatsaram\nAyanam: Uttarayanam\nRuthuvu: Grishma Ruthuvu\nMasam: Jyeshthamu\nPaksham: Shukla Paksham\nTithi: upto 7.57 AM Dwadashi\, thereafter Trayodashi\nVaram: Guruvaram\nNakshatram: upto 8.52 AM Chitta (4 Padam)\, and then Swathi\nYogam: Variyana\nKaranam: Balavai\nRahu Kalam: 1.51 PM to 3.29 PM\nYamagandam: 5.41 AM to 7.19 AM\nDurmuhurtham: 1.31 PM to 2.24 PM\nAbhijit Muhurtham: 11.47 AM to 12.39 PM\nSuryodayam: 5.41 AM\nSuryastamayam: 6.45 PM\nChandrodayam: 4.20 PM\nChandrashtamam: Meenam\nTaddinam Tithi: Trayodashi\nPradesham: Hyderabad (Telugu Style)
SUMMARY:Jyeshthamu Shukla Paksham Dwadashi  (28.05.2026)
UID:india-te-2026-05-28@panchangam
END:VEVENT
BEGIN:VEVENT
DTSTART;VALUE=DATE:20260807
CATEGORIES:PANCHANGAM
DESCRIPTION:Ashadhamu Krishna Paksham Navami  (07.08.2026)\n\nSamvatsaram: Parabhava Samvatsaram\nAyanam: Dakshinayanam\nRuthuvu: Grishma Ruthuvu\nMasam: Ashadhamu\nPaksham: Krishna Paksham\nTithi: upto 4.37 PM Navami\, thereafter Dashami\nVaram: Shukravaram\nNakshatram: upto 7.20 PM Kruthika (2 Padam)\, and then Rohini\nYogam: Vriddhi\nKaranam: Garajai\nRahu Kalam: 10.45 AM to 12.21 PM\nYamagandam: 3.34 PM to 5.10 PM\nDurmuhurtham: 8.30 AM to 9.22 AM\, 12.47 PM to 1.38 PM\nAbhijit Muhurtham: 11.56 AM to 12.47 PM\nSuryodayam: 5.57 AM\nSuryastamayam: 6.46 PM\nChandrodayam: 12.02 AM\nChandrashtamam: Thula\nTaddinam Tithi: Navami\nPradesham: Hyderabad (Telugu Style)
SUMMARY:Ashadhamu Krishna Paksham Navami  (07.08.2026)
UID:india-te-2026-08-07@panchangam
END:VEVENT
BEGIN:VEVENT
DTSTART;VALUE=DATE:20260917
CATEGORIES:PANCHANGAM
DESCRIPTION:Bhadrapadamu Shukla Paksham Shashti  (17.09.2026)\n\n🎉 SPECIAL: Sashti (Shukla)\nSamvatsaram: Parabhava Samvatsaram\nAyanam: Dakshinayanam\nRuthuvu: Varsha Ruthuvu\nMasam: Bhadrapadamu\nPaksham: Shukla Paksham\nTithi: upto 10.48 AM Shashti\, thereafter Saptami\nVaram: Guruvaram\nNakshatram: upto 8.38 PM Anuradha (2 Padam)\, and then Jyeshta\nYogam: Vishkambha\nKaranam: Thaitilai\nRahu Kalam: 1.42 PM to 3.13 PM\nYamagandam: 6.04 AM to 7.35 AM\nDurmuhurtham: 1.23 PM to 2.12 PM\nAbhijit Muhurtham: 11.46 AM to 12.34 PM\nSuryodayam: 6.04 AM\nSuryastamayam: 6.16 PM\nChandrodayam: 11.24 AM\nChandrashtamam: Mesham\nTaddinam Tithi: Saptami\nPradesham: Hyderabad (Telugu Style)
SUMMARY:Bhadrapadamu Shukla Paksham Shashti  (17.09.2026)
UID:india-te-2026-09-17@panchangam
END:VEVENT
BEGIN:VEVENT
DTSTART;VALUE=DATE:20261012
CATEGORIES:PANCHANGAM
DESCRIPTION:Ashwayujamu Shukla Paksham Vidiya  (12.10.2026)\n\nSamvatsaram: Parabhava Samvatsaram\nAyanam: Dakshinayanam\nRuthuvu: Sarad Ruthuvu\nMasam: Ashwayujamu\nPaksham: Shukla Paksham\nTithi: upto 10.13 PM Vidiya\, thereafter Thadiya\nVaram: Somavaram\nNakshatram: upto 12.35 AM Swathi (2 Padam)\, and then Vishakha\nYogam: Vishkambha\nKaranam: Balavai\nRahu Kalam: 7.36 AM to 9.05 AM\nYamagandam: 10.33 AM to 12.02 PM\nDurmuhurtham: 12.26 PM to 1.13 PM\nAbhijit Muhurtham: 11.38 AM to 12.26 PM\nSuryodayam: 6.08 AM\nSuryastamayam: 5.56 PM\nChandrodayam: 7.24 AM\nChandrashtamam: Meenam\nTaddinam Tithi: Vidiya\nPradesham: Hyderabad (Telugu Style)
SUMMARY:Ashwayujamu Shukla Paksham Vidiya  (12.10.2026)
UID:india-te-2026-10-12@panchangam
END:VEVENT
BEGIN:VEVENT
DTSTART;VALUE=DATE:20261122
CATEGORIES:PANCHANGAM
DESCRIPTION:Karthikamu Shukla Paksham Trayodashi  (22.11.2026)\n\n🎉 SPECIAL: Pradosham (Shukla)\nSamvatsaram: Parabhava Samvatsaram\nAyanam: Dakshinayanam\nRuthuvu: Sarad Ruthuvu\nMasam: Karthikamu\nPaksham: Shukla Paksham\nTithi: upto 2.37 AM Trayodashi\, thereafter Chaturdashi\nVaram: Bhanuvaram\nNakshatram: upto 6.33 AM Revathi (4 Padam)\, upto 4.53 AM Aswini\, and then Bharani\nYogam: Vyatipata\nKaranam: Kaulavai\nRahu Kalam: 4.15 PM to 5.39 PM\nYamagandam: 12.02 PM to 1.26 PM\nDurmuhurtham: 4.09 PM to 4.54 PM\nAbhijit Muhurtham: 11.39 AM to 12.24 PM\nSuryodayam: 6.24 AM\nSuryastamayam: 5.39 PM\nChandrodayam: 3.36 PM\nChandrashtamam: Simham\nTaddinam Tithi: Trayodashi\nPradesham: Hyderabad (Telugu Style)
SUMMARY:Karthikamu Shukla Paksham Trayodashi  (22.11.2026)
UID:india-te-2026-11-22@panchangam
END:VEVENT
BEGIN:VEVENT
DTSTART;VALUE=DATE:20260106
CATEGORIES:PANCHANGAM
DESCRIPTION:Pushyamu Krishna Paksham Thadiya  (06.01.2026)\n\n🎉 SPECIAL: Sankatahara Chathurthi\nSamvatsaram: Vishvavasu Samvatsaram\nAyanam: Uttarayanam\nRuthuvu: Hemantha Ruthuvu\nMasam: Pushyamu\nPaksham: Krishna Paksham\nTithi: upto 8.02 AM Thadiya\, thereafter Chavithi\nVaram: Mangalavaram\nNakshatram: upto 12.55 PM Ashlesha (3 Padam)\, and then Makha\nYogam: Preethi\nKaranam: Vishti\nRahu Kalam: 3.08 PM to 4.32 PM\nYamagandam: 9.34 AM to 10.58 AM\nDurmuhurtham: 8.16 AM to 9.01 AM\, 11.15 AM to 11.59 AM\nAbhijit Muhurtham: 11.59 AM to 12.44 PM\nSuryodayam: 6.47 AM\nSuryastamayam: 5.55 PM\nChandrodayam: 9.03 PM\nChandrashtamam: Dhanu\nTaddinam Tithi: Chavithi\nPradesham: Hyderabad (Telugu Style)
SUMMARY:Pushyamu Krishna Paksham Thadiya  (06.01.2026)
UID:india-te-2026-01-06@panchangam
END:VEVENT
BEGIN:VEVENT
DTSTART;VALUE=DATE:20260216
CATEGORIES:PANCHANGAM
DESCRIPTION:Maghamu Krishna Paksham Chaturdashi  (16.02.2026)\n\nSamvatsaram: Vishvavasu Samvatsaram\nAyanam: Uttarayanam\nRuthuvu: Shishira Ruthuvu\nMasam: Maghamu\nPaksham: Krishna Paksham\nTithi: upto 5.34 PM Chaturdashi\, thereafter Amavasya\nVaram: Somavaram\nNakshatram: upto 9.28 PM Shravana (2 Padam)\, and then Dhanishta\nYogam: Variyana\nKaranam: Shakuni\nRahu Kalam: 8.09 AM to 9.36 AM\nYamagandam: 11.03 AM to 12.30 PM\nDurmuhurtham: 12.53 PM to 1.39 PM\nAbhijit Muhurtham: 12.06 PM to 12.53 PM\nSuryodayam: 6.42 AM\nSuryastamayam: 6.18 PM\nChandrodayam: 5.51 AM\nChandrashtamam: Mithunam\nTaddinam Tithi: Chaturdashi\nPradesham: Hyderabad (Telugu Style)
SUMMARY:Maghamu Krishna Paksham Chaturdashi  (16.02.2026)
UID:india-te-2026-02-16@panchangam
END:VEVENT
BEGIN:VEVENT
DTSTART;VALUE=DATE:20260326
CATEGORIES:PANCHANGAM
DESCRIPTION:Chaitramu Shukla Paksham Ashtami  (26.03.2026)\n\nSamvatsaram: Vishvavasu Samvatsaram\nAyanam: Uttarayanam\nRuthuvu: Vasantha Ruthuvu\nMasam: Chaitramu\nPaksham: Shukla Paksham\nTithi: upto 11.49 AM Ashtami\, thereafter Navami\nVaram: Guruvaram\nNakshatram: upto 4.57 PM Arudra (3 Padam)\, and then Punarvasu\nYogam: Shobhana\nKaranam: Bavai\nRahu Kalam: 1.53 PM to 3.24 PM\nYamagandam: 6.15 AM to 7.47 AM\nDurmuhurtham: 1.35 PM to 2.23 PM\nAbhijit Muhurtham: 11.57 AM to 12.46 PM\nSuryodayam: 6.15 AM\nSuryastamayam: 6.28 PM\nChandrodayam: 12.19 PM\nChandrashtamam: Vrushchikam\nTaddinam Tithi: Navami\nPradesham: Hyderabad (Telugu Style)
SUMMARY:Chaitramu Shukla Paksham Ashtami  (26.03.2026)
UID:india-te-2026-03-26@panchangam
END:VEVENT
BEGIN:VEVENT
BEGIN:VALARM
ACTION:DISPLAY
DESCRIPTION:
TRIGGER:-P1D
END:VALARM
CATEGORIES:VRATAM
DESCRIPTION:Astronomical duration of Ekadashi (Shukla).
DTEND:20260329T021657Z
DTSTART:20260328T031615Z
SUMMARY:⏳ Ekadashi (Shukla)
UID:india-te-202603280846-Ekadashi(Shukla)@vratam
END:VEVENT
BEGIN:VEVENT
DTSTART;VALUE=DATE:20260605
CATEGORIES:PANCHANGAM
DESCRIPTION:Jyeshthamu Krishna Paksham Panchami  (05.06.2026)\n\nSamvatsaram: Parabhava Samvatsaram\nAyanam: Uttarayanam\nRuthuvu: Grishma Ruthuvu\nMasam: Jyeshthamu\nPaksham: Krishna Paksham\nTithi: upto 1.20 AM Panchami\, thereafter Shashti\nVaram: Shukravaram\nNakshatram: Shravana (1 Padam)\nYogam: Brahma\nKaranam: Kaulavai\nRahu Kalam: 10.36 AM to 12.14 PM\nYamagandam: 3.31 PM to 5.09 PM\nDurmuhurtham: 8.18 AM to 9.10 AM\, 12.40 PM to 1.33 PM\nAbhijit Muhurtham: 11.48 AM to 12.40 PM\nSuryodayam: 5.40 AM\nSuryastamayam: 6.48 PM\nChandrodayam: 10.52 PM\nChandrashtamam: Mithunam\nTaddinam Tithi: Panchami\nPradesham: Hyderabad (Telugu Style)
SUMMARY:Jyeshthamu Krishna Paksham Panchami  (05.06.2026)
UID:india-te-2026-06-05@panchangam
END:VEVENT
BEGIN:VEVENT
DTSTART;VALUE=DATE:20260715
CATEGORIES:PANCHANGAM
DESCRIPTION:Ashadhamu Shukla Paksham Padyami  (15.07.2026)\n\nSamvatsaram: Parabhava Samvatsaram\nAyanam: Dakshinayanam\nRuthuvu: Grishma Ruthuvu\nMasam: Ashadhamu\nPaksham: Shukla Paksham\nTithi: upto 11.51 AM Padyami\, thereafter Vidiya\nVaram: Budhavaram\nNakshatram: upto 10.23 PM Pushyami (1 Padam)\, and then Ashlesha\nYogam: Harshana\nKaranam: Bavai\nRahu Kalam: 12.21 PM to 2.00 PM\nYamagandam: 7.27 AM to 9.05 AM\nDurmuhurtham: 10.11 AM to 11.03 AM\nAbhijit Muhurtham: 11.55 AM to 12.48 PM\nSuryodayam: 5.49 AM\nSuryastamayam: 6.54 PM\nChandrodayam: 6.34 AM\nChandrashtamam: Dhanu\nTaddinam Tithi: Vidiya\nPradesham: Hyderabad (Telugu Style)
SUMMARY:Ashadhamu Shukla Paksham Padyami  (15.07.2026)
UID:india-te-2026-07-15@panchangam
END:VEVENT
BEGIN:VEVENT
DTSTART;VALUE=DATE:20260825
CATEGORIES:PANCHANGAM
DESCRIPTION:Sravanamu Shukla Paksham Dwadashi  (25.08.2026)\n\n🎉 SPECIAL: Pradosham (Shukla)\nSamvatsaram: Parabhava Samvatsaram\nAyanam: Dakshinayanam\nRuthuvu: Varsha Ruthuvu\nMasam: Sravanamu\nPaksham: Shukla Paksham\nTithi: upto 6.21 AM Dwadashi\, thereafter Trayodashi\nVaram: Mangalavaram\nNakshatram: upto 11.35 PM Uttarashada (2 Padam)\, and then Shravana\nYogam: Aayushman\nKaranam: Balavai\nRahu Kalam: 3.26 PM to 5.00 PM\nYamagandam: 9.09 AM to 10.43 AM\nDurmuhurtham: 7.41 AM to 8.31 AM\, 11.02 AM to 11.52 AM\nAbhijit Muhurtham: 11.52 AM to 12.43 PM\nSuryodayam: 6.01 AM\nSuryastamayam: 6.35 PM\nChandrodayam: 4.48 PM\nChandrashtamam: Mithunam\nTaddinam Tithi: Trayodashi\nPradesham: Hyderabad (Telugu Style)
SUMMARY:Sravanamu Shukla Paksham Dwadashi  (25.08.2026)
UID:india-te-2026-08-25@panchangam
END:VEVENT
BEGIN:VEVENT
DTSTART;VALUE=DATE:20261030
CATEGORIES:PANCHANGAM
DESCRIPTION:Ashwayujamu Krishna Paksham Panchami  (30.10.2026)\n\nSamvatsaram: Parabhava Samvatsaram\nAyanam: Dakshinayanam\nRuthuvu: Sarad Ruthuvu\nMasam: Ashwayujamu\nPaksham: Krishna Paksham\nTithi: upto 7.25 PM Panchami\, thereafter Shashti\nVaram: Shukravaram\nNakshatram: upto 9.41 AM Mrigashira (4 Padam)\, and then Arudra\nYogam: Shiva\nKaranam: Kaulavai\nRahu Kalam: 10.33 AM to 11.59 AM\nYamagandam: 2.52 PM to 4.19 PM\nDurmuhurtham: 8.32 AM to 9.18 AM\, 12.22 PM to 1.08 PM\nAbhijit Muhurtham: 11.36 AM to 12.22 PM\nSuryodayam: 6.13 AM\nSuryastamayam: 5.45 PM\nChandrodayam: 9.43 PM\nChandrashtamam: Vrushchikam\nTaddinam Tithi: Panchami\nPradesham: Hyderabad (Telugu Style)
SUMMARY:Ashwayujamu Krishna Paksham Panchami  (30.10.2026)
UID:india-te-2026-10-30@panchangam
END:VEVENT
BEGIN:VEVENT
DTSTART;VALUE=DATE:20261019
CATEGORIES:PANCHANGAM
DESCRIPTION:Ashwayujamu Shukla Paksham Ashtami  (19.10.2026)\n\nSamvatsaram: Parabhava Samvatsaram\nAyanam: Dakshinayanam\nRuthuvu: Sarad Ruthuvu\nMasam: Ashwayujamu\nPaksham: Shukla Paksham\nTithi: upto 10.52 AM Ashtami\, thereafter Navami\nVaram: Somavaram\nNakshatram: upto 4.23 PM Uttarashada (3 Padam)\, and then Shravana\nYogam: Dhruthi\nKaranam: Bavai\nRahu Kalam: 7.37 AM to 9.05 AM\nYamagandam: 10.33 AM to 12 Noon\nDurmuhurtham: 12.24 PM to 1.11 PM\nAbhijit Muhurtham: 11.37 AM to 12.24 PM\nSuryodayam: 6.10 AM\nSuryastamayam: 5.51 PM\nChandrodayam: 1.18 PM\nChandrashtamam: Mithunam\nTaddinam Tithi: Navami\nPradesham: Hyderabad (Telugu Style)
SUMMARY:Ashwayujamu Shukla Paksham Ashtami  (19.10.2026)
UID:india-te-2026-10-19@panchangam
END:VEVENT
BEGIN:VEVENT
DTSTART;VALUE=DATE:20261129
CATEGORIES:PANCHANGAM
DESCRIPTION:Karthikamu Krishna Paksham Shashti  (29.11.2026)\n\nSamvatsaram: Parabhava Samvatsaram\nAyanam: Dakshinayanam\nRuthuvu: Sarad Ruthuvu\nMasam: Karthikamu\nPaksham: Krishna Paksham\nTithi: upto 1.47 AM Shashti\, thereafter Saptami\nVaram: Bhanuvaram\nNakshatram: upto 11.37 AM Pushyami (4 Padam)\, and then Ashlesha\nYogam: Brahma\nKaranam: Garajai\nRahu Kalam: 4.15 PM to 5.39 PM\nYamagandam: 12.04 PM to 1.28 PM\nDurmuhurtham: 4.10 PM to 4.54 PM\nAbhijit Muhurtham: 11.41 AM to 12.26 PM\nSuryodayam: 6.28 AM\nSuryastamayam: 5.39 PM\nChandrodayam: 10.44 PM\nChandrashtamam: Dhanu\nTaddinam Tithi: Shashti\nPradesham: Hyderabad (Telugu Style)
SUMMARY:Karthikamu Krishna Paksham Shashti  (29.11.2026)
UID:india-te-2026-11-29@panchangam
END:VEVENT
BEGIN:VEVENT
BEGIN:VALARM
ACTION:DISPLAY
DESCRIPTION:
TRIGGER:-P1D
END:VALARM
CATEGORIES:VRATAM
DESCRIPTION:Astronomical duration of Sankatahara Chathurthi.
DTEND:20260704T071029Z
DTSTART:20260703T055053Z
SUMMARY:⏳ Sankatahara Chathurthi
UID:india-te-202607031120-SankataharaChathurthi@vratam
END:VEVENT
BEGIN:VEVENT
DTSTART;VALUE=DATE:20260124
CATEGORIES:PANCHANGAM
DESCRIPTION:Maghamu Shukla Paksham Shashti  (24.01.2026)\n\n🎉 SPECIAL: Sashti (Shukla)\nSamvatsaram: Vishvavasu Samvatsaram\nAyanam: Uttarayanam\nRuthuvu: Shishira Ruthuvu\nMasam: Maghamu\nPaksham: Shukla Paksham\nTithi: upto 12.40 AM Shashti\, thereafter Saptami\nVaram: Shanivaram\nNakshatram: upto 2.54 PM Uttarabhadra (3 Padam)\, and then Revathi\nYogam: Shiva\nKaranam: Kaulavai\nRahu Kalam: 9.38 AM to 11.03 AM\nYamagandam: 1.52 PM to 3.17 PM\nDurmuhurtham: 6.49 AM to 7.34 AM\nAbhijit Muhurtham: 12.05 PM to 12.50 PM\nSuryodayam: 6.49 AM\nSuryastamayam: 6.06 PM\nChandrodayam: 10.24 AM\nChandrashtamam: Simham\nTaddinam Tithi: Shashti\nPradesham: Hyderabad (Telugu Style)
SUMMARY:Maghamu Shukla Paksham Shashti  (24.01.2026)
UID:india-te-2026-01-24@panchangam
END:VEVENT
BEGIN:VEVENT
BEGIN:VALARM
ACTION:DISPLAY
DESCRIPTION:
TRIGGER:-P1D
END:VALARM
CATEGORIES:VRATAM
DESCRIPTION:Astronomical duration of Pradosham (Shukla).
DTEND:20260101T165244Z
DTSTART:20251231T201827Z
SUMMARY:⏳ Pradosham (Shukla)
UID:india-te-202601010148-Pradosham(Shukla)@vratam
END:VEVENT
BEGIN:VEVENT
DTSTART;VALUE=DATE:20260403
CATEGORIES:PANCHANGAM
DESCRIPTION:Chaitramu Krishna Paksham Padyami  (03.04.2026)\n\nSamvatsaram: Parabhava Samvatsaram\nAyanam: Uttarayanam\nRuthuvu: Vasantha Ruthuvu\nMasam: Chaitramu\nPaksham: Krishna Paksham\nTithi: upto 8.42 AM Padyami\, thereafter Vidiya\nVaram: Shukravaram\nNakshatram: upto 8.07 PM Chitta (2 Padam)\, and then Swathi\nYogam: Vyaghata\nKaranam: Kaulavai\nRahu Kalam: 10.46 AM to 12.19 PM\nYamagandam: 3.24 PM to 4.57 PM\nDurmuhurtham: 8.37 AM to 9.26 AM\, 12.44 PM to 1.33 PM\nAbhijit Muhurtham: 11.54 AM to 12.44 PM\nSuryodayam: 6.09 AM\nSuryastamayam: 6.29 PM\nChandrodayam: 7.39 PM\nChandrashtamam: Kumbham\nTaddinam Tithi: Vidiya\nPradesham: Hyderabad (Telugu Style)
SUMMARY:Chaitramu Krishna Paksham Padyami  (03.04.2026)
UID:india-te-2026-04-03@panchangam
END:VEVENT
BEGIN:VEVENT
DTSTART;VALUE=DATE:20260513
CATEGORIES:PANCHANGAM
DESCRIPTION:Vaishakhamu Krishna Paksham Ekadashi  (13.05.2026)\n\n🎉 SPECIAL: Ekadashi (Krishna)\nSamvatsaram: Parabhava Samvatsaram\nAyanam: Uttarayanam\nRuthuvu: Vasantha Ruthuvu\nMasam: Vaishakhamu\nPaksham: Krishna Paksham\nTithi: upto 1.30 PM Ekadashi\, thereafter Dwadashi\nVaram: Budhavaram\nNakshatram: upto 12.55 AM Uttarabhadra (1 Padam)\, and then Revathi\nYogam: Vishkambha\nKaranam: Balavai\nRahu Kalam: 12.12 PM to 1.49 PM\nYamagandam: 7.21 AM to 8.58 AM\nDurmuhurtham: 10.03 AM to 10.54 AM\nAbhijit Muhurtham: 11.46 AM to 12.38 PM\nSuryodayam: 5.44 AM\nSuryastamayam: 6.40 PM\nChandrodayam: 2.44 AM\nChandrashtamam: Simham\nTaddinam Tithi: Dwadashi\nPradesham: Hyderabad (Telugu Style)
SUMMARY:Vaishakhamu Krishna Paksham Ekadashi  (13.05.2026)
UID:india-te-2026-05-13@panchangam
END:VEVENT
BEGIN:VEVENT
DTSTART;VALUE=DATE:20260623
CATEGORIES:PANCHANGAM
DESCRIPTION:Jyeshthamu Shukla Paksham Navami  (23.06.2026)\n\nSamvatsaram: Parabhava Samvatsaram\nAyanam: Dakshinayanam\nRuthuvu: Grishma Ruthuvu\nMasam: Jyeshthamu\nPaksham: Shukla Paksham\nTithi: upto 4.40 PM Navami\, thereafter Dashami\nVaram: Mangalavaram\nNakshatram: upto 12.37 PM Hasta (3 Padam)\, and then Chitta\nYogam: Variyana\nKaranam: Kaulavai\nRahu Kalam: 3.35 PM to 5.14 PM\nYamagandam: 9.00 AM to 10.39 AM\nDurmuhurtham: 7.28 AM to 8.21 AM\, 10.59 AM to 11.51 AM\nAbhijit Muhurtham: 11.51 AM to 12.44 PM\nSuryodayam: 5.43 AM\nSuryastamayam: 6.53 PM\nChandrodayam: 1.27 PM\nChandrashtamam: Kumbham\nTaddinam Tithi: Navami\nPradesham: Hyderabad (Telugu Style)
SUMMARY:Jyeshthamu Shukla Paksham Navami  (23.06.2026)
UID:india-te-2026-06-23@panchangam
END:VEVENT
BEGIN:VEVENT
DTSTART;VALUE=DATE:20260902
CATEGORIES:PANCHANGAM
DESCRIPTION:Sravanamu Krishna Paksham Panchami  (02.09.2026)\n\nSamvatsaram: Parabhava Samvatsaram\nAyanam: Dakshinayanam\nRuthuvu: Varsha Ruthuvu\nMasam: Sravanamu\nPaksham: Krishna Paksham\nTithi: upto 6.13 AM Panchami\, upto 4.26 AM Shashti\, thereafter Saptami\nVaram: Budhavaram\nNakshatram: upto 2.21 AM Bharani (1 Padam)\, and then Kruthika\nYogam: Dhruva\nKaranam: Thaitilai\nRahu Kalam: 12.15 PM to 1.49 PM\nYamagandam: 7.35 AM to 9.08 AM\nDurmuhurtham: 10.11 AM to 11.01 AM\nAbhijit Muhurtham: 11.50 AM to 12.40 PM\nSuryodayam: 6.02 AM\nSuryastamayam: 6.29 PM\nChandrodayam: 9.59 PM\nChandrashtamam: Kanya\nTaddinam Tithi: Shashti\nPradesham: Hyderabad (Telugu Style)
SUMMARY:Sravanamu Krishna Paksham Panchami  (02.09.2026)
UID:india-te-2026-09-02@panchangam
END:VEVENT
BEGIN:VEVENT
DTSTART;VALUE=DATE:20251229
CATEGORIES:PANCHANGAM
DESCRIPTION:Pushyamu Shukla Paksham Navami  (29.12.2025)\n\nSamvatsaram: Vishvavasu Samvatsaram\nAyanam: Uttarayanam\nRuthuvu: Hemantha Ruthuvu\nMasam: Pushyamu\nPaksham: Shukla Paksham\nTithi: upto 10.12 AM Navami\, thereafter Dashami\nVaram: Somavaram\nNakshatram: upto 8.18 AM Revathi (4 Padam)\, upto 6.40 AM Aswini\, and then Bharani\nYogam: Parigha\nKaranam: Kaulavai\nRahu Kalam: 8.08 AM to 9.31 AM\nYamagandam: 10.54 AM to 12.18 PM\nDurmuhurtham: 12.40 PM to 1.24 PM\nAbhijit Muhurtham: 11.55 AM to 12.40 PM\nSuryodayam: 6.45 AM\nSuryastamayam: 5.51 PM\nChandrodayam: 1.04 PM\nChandrashtamam: Simham\nTaddinam Tithi: Dashami\nPradesham: Hyderabad (Telugu Style)
SUMMARY:Pushyamu Shukla Paksham Navami  (29.12.2025)
UID:india-te-2025-12-29@panchangam
END:VEVENT
BEGIN:VEVENT
DTSTART;VALUE=DATE:20261206
CATEGORIES:PANCHANGAM
DESCRIPTION:Karthikamu Krishna Paksham Trayodashi  (06.12.2026)\n\n🎉 SPECIAL: Pradosham (Krishna)\nSamvatsaram: Parabhava Samvatsaram\nAyanam: Dakshinayanam\nRuthuvu: Sarad Ruthuvu\nMasam: Karthikamu\nPaksham: Krishna Paksham\nTithi: upto 2.22 AM Trayodashi\, thereafter Chaturdashi\nVaram: Bhanuvaram\nNakshatram: upto 2.22 PM Swathi (3 Padam)\, and then Vishakha\nYogam: Shobhana\nKaranam: Garajai\nRahu Kalam: 4.17 PM to 5.41 PM\nYamagandam: 12.06 PM to 1.30 PM\nDurmuhurtham: 4.11 PM to 4.56 PM\nAbhijit Muhurtham: 11.44 AM to 12.29 PM\nSuryodayam: 6.32 AM\nSuryastamayam: 5.41 PM\nChandrodayam: 4.04 AM\nChandrashtamam: Meenam\nTaddinam Tithi: Trayodashi\nPradesham: Hyderabad (Telugu Style)
SUMMARY:Karthikamu Krishna Paksham Trayodashi  (06.12.2026)
UID:india-te-2026-12-06@panchangam
END:VEVENT
BEGIN:VEVENT
DTSTART;VALUE=DATE:20260201
CATEGORIES:PANCHANGAM
DESCRIPTION:Maghamu Shukla Paksham Pournami 🌕 (01.02.2026)\n\nSamvatsaram: Vishvavasu Samvatsaram\nAyanam: Uttarayanam\nRuthuvu: Shishira Ruthuvu\nMasam: Maghamu\nPaksham: Shukla Paksham\nTithi: upto 3.39 AM Pournami\, thereafter Padyami\nVaram: Bhanuvaram\nNakshatram: upto 12.35 AM Pushyami (1 Padam)\, and then Ashlesha\nYogam: Preethi\nKaranam: Vishti\nRahu Kalam: 4.45 PM to 6.11 PM\nYamagandam: 12.29 PM to 1.55 PM\nDurmuhurtham: 4.40 PM to 5.25 PM\nAbhijit Muhurtham: 12.06 PM to 12.52 PM\nSuryodayam: 6.48 AM\nSuryastamayam: 6.11 PM\nChandrodayam: 5.44 PM\nChandrashtamam: Dhanu\nTaddinam Tithi: Pournami\nPradesham: Hyderabad (Telugu Style)
SUMMARY:Maghamu Shukla Paksham Pournami 🌕 (01.02.2026)
UID:india-te-2026-02-01@panchangam
END:VEVENT
BEGIN:VEVENT
DTSTART;VALUE=DATE:20260311
CATEGORIES:PANCHANGAM
DESCRIPTION:Phalgunamu Krishna Paksham Ashtami  (11.03.2026)\n\nSamvatsaram: Vishvavasu Samvatsaram\nAyanam: Uttarayanam\nRuthuvu: Shishira Ruthuvu\nMasam: Phalgunamu\nPaksham: Krishna Paksham\nTithi: upto 4.19 AM Ashtami\, thereafter Navami\nVaram: Budhavaram\nNakshatram: upto 10.44 PM Jyeshta (2 Padam)\, and then Moola\nYogam: Vajra\nKaranam: Balavai\nRahu Kalam: 12.26 PM to 1.55 PM\nYamagandam: 7.57 AM to 9.26 AM\nDurmuhurtham: 10.26 AM to 11.14 AM\nAbhijit Muhurtham: 12.02 PM to 12.50 PM\nSuryodayam: 6.27 AM\nSuryastamayam: 6.24 PM\nChandrodayam: 12.27 AM\nChandrashtamam: Mesham\nTaddinam Tithi: Ashtami\nPradesham: Hyderabad (Telugu Style)
SUMMARY:Phalgunamu Krishna Paksham Ashtami  (11.03.2026)
UID:india-te-2026-03-11@panchangam
END:VEVENT
BEGIN:VEVENT
DTSTART;VALUE=DATE:20260421
CATEGORIES:PANCHANGAM
DESCRIPTION:Vaishakhamu Shukla Paksham Panchami  (21.04.2026)\n\nSamvatsaram: Parabhava Samvatsaram\nAyanam: Uttarayanam\nRuthuvu: Vasantha Ruthuvu\nMasam: Vaishakhamu\nPaksham: Shukla Paksham\nTithi: upto 1.20 AM Panchami\, thereafter Shashti\nVaram: Mangalavaram\nNakshatram: upto 12.35 AM Mrigashira (1 Padam)\, and then Arudra\nYogam: Shobhana\nKaranam: Bavai\nRahu Kalam: 3.24 PM to 4.58 PM\nYamagandam: 9.05 AM to 10.40 AM\nDurmuhurtham: 7.37 AM to 8.27 AM\, 10.59 AM to 11.49 AM\nAbhijit Muhurtham: 11.49 AM to 12.40 PM\nSuryodayam: 5.56 AM\nSuryastamayam: 6.33 PM\nChandrodayam: 9.05 AM\nChandrashtamam: Thula\nTaddinam Tithi: Panchami\nPradesham: Hyderabad (Telugu Style)
SUMMARY:Vaishakhamu Shukla Paksham Panchami  (21.04.2026)
UID:india-te-2026-04-21@panchangam
END:VEVENT
BEGIN:VEVENT
DTSTART;VALUE=DATE:20260531
CATEGORIES:PANCHANGAM
DESCRIPTION:Jyeshthamu Shukla Paksham Pournami 🌕 (31.05.2026)\n\nSamvatsaram: Parabhava Samvatsaram\nAyanam: Uttarayanam\nRuthuvu: Grishma Ruthuvu\nMasam: Jyeshthamu\nPaksham: Shukla Paksham\nTithi: upto 2.15 PM Pournami\, thereafter Padyami\nVaram: Bhanuvaram\nNakshatram: upto 4.56 PM Anuradha (3 Padam)\, and then Jyeshta\nYogam: Shiva\nKaranam: Bavai\nRahu Kalam: 5.08 PM to 6.46 PM\nYamagandam: 12.13 PM to 1.51 PM\nDurmuhurtham: 5.01 PM to 5.54 PM\nAbhijit Muhurtham: 11.47 AM to 12.39 PM\nSuryodayam: 5.40 AM\nSuryastamayam: 6.46 PM\nChandrodayam: 6.58 PM\nChandrashtamam: Mesham\nTaddinam Tithi: Padyami\nPradesham: Hyderabad (Telugu Style)
SUMMARY:Jyeshthamu Shukla Paksham Pournami 🌕 (31.05.2026)
UID:india-te-2026-05-31@panchangam
END:VEVENT
BEGIN:VEVENT
DTSTART;VALUE=DATE:20260810
CATEGORIES:PANCHANGAM
DESCRIPTION:Ashadhamu Krishna Paksham Dwadashi  (10.08.2026)\n\n🎉 SPECIAL: Pradosham (Krishna)\nSamvatsaram: Parabhava Samvatsaram\nAyanam: Dakshinayanam\nRuthuvu: Grishma Ruthuvu\nMasam: Ashadhamu\nPaksham: Krishna Paksham\nTithi: upto 8.01 AM Dwadashi\, upto 4.54 AM Trayodashi\, thereafter Chaturdashi\nVaram: Somavaram\nNakshatram: upto 1.03 PM Arudra (3 Padam)\, and then Punarvasu\nYogam: Vajra\nKaranam: Thaitilai\nRahu Kalam: 7.33 AM to 9.09 AM\nYamagandam: 10.45 AM to 12.21 PM\nDurmuhurtham: 12.46 PM to 1.38 PM\nAbhijit Muhurtham: 11.55 AM to 12.46 PM\nSuryodayam: 5.57 AM\nSuryastamayam: 6.44 PM\nChandrodayam: 3.05 AM\nChandrashtamam: Vrushchikam\nTaddinam Tithi: Trayodashi\nPradesham: Hyderabad (Telugu Style)
SUMMARY:Ashadhamu Krishna Paksham Dwadashi  (10.08.2026)
UID:india-te-2026-08-10@panchangam
END:VEVENT
BEGIN:VEVENT
DTSTART;VALUE=DATE:20260920
CATEGORIES:PANCHANGAM
DESCRIPTION:Bhadrapadamu Shukla Paksham Navami  (20.09.2026)\n\nSamvatsaram: Parabhava Samvatsaram\nAyanam: Dakshinayanam\nRuthuvu: Varsha Ruthuvu\nMasam: Bhadrapadamu\nPaksham: Shukla Paksham\nTithi: upto 5.52 PM Navami\, thereafter Dashami\nVaram: Bhanuvaram\nNakshatram: upto 5.19 AM Poorvashada (1 Padam)\, and then Uttarashada\nYogam: Saubhagya\nKaranam: Kaulavai\nRahu Kalam: 4.42 PM to 6.14 PM\nYamagandam: 12.09 PM to 1.40 PM\nDurmuhurtham: 4.36 PM to 5.25 PM\nAbhijit Muhurtham: 11.45 AM to 12.33 PM\nSuryodayam: 6.04 AM\nSuryastamayam: 6.14 PM\nChandrodayam: 1.57 PM\nChandrashtamam: Vrushabham\nTaddinam Tithi: Navami\nPradesham: Hyderabad (Telugu Style)
SUMMARY:Bhadrapadamu Shukla Paksham Navami  (20.09.2026)
UID:india-te-2026-09-20@panchangam
END:VEVENT
BEGIN:VEVENT
DTSTART;VALUE=DATE:20260909
CATEGORIES:PANCHANGAM
DESCRIPTION:Sravanamu Krishna Paksham Trayodashi  (09.09.2026)\n\nSamvatsaram: Parabhava Samvatsaram\nAyanam: Dakshinayanam\nRuthuvu: Varsha Ruthuvu\nMasam: Sravanamu\nPaksham: Krishna Paksham\nTithi: upto 12.31 PM Trayodashi\, thereafter Chaturdashi\nVaram: Budhavaram\nNakshatram: upto 3.52 PM Ashlesha (3 Padam)\, and then Makha\nYogam: Shiva\nKaranam: Vanijai\nRahu Kalam: 12.13 PM to 1.45 PM\nYamagandam: 7.35 AM to 9.08 AM\nDurmuhurtham: 10.09 AM to 10.59 AM\nAbhijit Muhurtham: 11.48 AM to 12.38 PM\nSuryodayam: 6.03 AM\nSuryastamayam: 6.23 PM\nChandrodayam: 4.06 AM\nChandrashtamam: Dhanu\nTaddinam Tithi: Chaturdashi\nPradesham: Hyderabad (Telugu Style)
SUMMARY:Sravanamu Krishna Paksham Trayodashi  (09.09.2026)
UID:india-te-2026-09-09@panchangam
END:VEVENT
BEGIN:VEVENT
DTSTART;VALUE=DATE:20261004
CATEGORIES:PANCHANGAM
DESCRIPTION:Bhadrapadamu Krishna Paksham Navami  (04.10.2026)\n\nSamvatsaram: Parabhava Samvatsaram\nAyanam: Dakshinayanam\nRuthuvu: Varsha Ruthuvu\nMasam: Bhadrapadamu\nPaksham: Krishna Paksham\nTithi: upto 3.54 AM Navami\, thereafter Dashami\nVaram: Bhanuvaram\nNakshatram: upto 12.52 AM Punarvasu (1 Padam)\, and then Pushyami\nYogam: Parigha\nKaranam: Thaitilai\nRahu Kalam: 4.33 PM to 6.02 PM\nYamagandam: 12.04 PM to 1.34 PM\nDurmuhurtham: 4.27 PM to 5.14 PM\nAbhijit Muhurtham: 11.40 AM to 12.28 PM\nSuryodayam: 6.06 AM\nSuryastamayam: 6.02 PM\nChandrodayam: N/A\nChandrashtamam: Vrushchikam\nTaddinam Tithi: Navami\nPradesham: Hyderabad (Telugu Style)
SUMMARY:Bhadrapadamu Krishna Paksham Navami  (04.10.2026)
UID:india-te-2026-10-04@panchangam
END:VEVENT
BEGIN:VEVENT
DTSTART;VALUE=DATE:20261114
CATEGORIES:PANCHANGAM
DESCRIPTION:Karthikamu Shukla Paksham Panchami  (14.11.2026)\n\nSamvatsaram: Parabhava Samvatsaram\nAyanam: Dakshinayanam\nRuthuvu: Sarad Ruthuvu\nMasam: Karthikamu\nPaksham: Shukla Paksham\nTithi: upto 11.24 PM Panchami\, thereafter Shashti\nVaram: Shanivaram\nNakshatram: upto 9.10 PM Poorvashada (2 Padam)\, and then Uttarashada\nYogam: Dhruthi\nKaranam: Bavai\nRahu Kalam: 9.10 AM to 10.35 AM\nYamagandam: 1.25 PM to 2.50 PM\nDurmuhurtham: 6.20 AM to 7.05 AM\nAbhijit Muhurtham: 11.37 AM to 12.23 PM\nSuryodayam: 6.20 AM\nSuryastamayam: 5.40 PM\nChandrodayam: 10.30 AM\nChandrashtamam: Vrushabham\nTaddinam Tithi: Panchami\nPradesham: Hyderabad (Telugu Style)
SUMMARY:Karthikamu Shukla Paksham Panchami  (14.11.2026)
UID:india-te-2026-11-14@panchangam
END:VEVENT
BEGIN:VEVENT
DTSTART;VALUE=DATE:20261224
CATEGORIES:PANCHANGAM
DESCRIPTION:Margashiramu Shukla Paksham Pournami 🌕 (24.12.2026)\n\nSamvatsaram: Parabhava Samvatsaram\nAyanam: Uttarayanam\nRuthuvu: Hemantha Ruthuvu\nMasam: Margashiramu\nPaksham: Shukla Paksham\nTithi: upto 6.58 AM Pournami\, upto 3.07 AM Padyami\, thereafter Vidiya\nVaram: Guruvaram\nNakshatram: upto 2.22 AM Arudra (1 Padam)\, and then Punarvasu\nYogam: Shukla\nKaranam: Bavai\nRahu Kalam: 1.38 PM to 3.01 PM\nYamagandam: 6.42 AM to 8.05 AM\nDurmuhurtham: 1.22 PM to 2.06 PM\nAbhijit Muhurtham: 11.53 AM to 12.37 PM\nSuryodayam: 6.42 AM\nSuryastamayam: 5.48 PM\nChandrodayam: 6.11 PM\nChandrashtamam: Vrushchikam\nTaddinam Tithi: Padyami\nPradesham: Hyderabad (Telugu Style)
SUMMARY:Margashiramu Shukla Paksham Pournami 🌕 (24.12.2026)
UID:india-te-2026-12-24@panchangam
END:VEVENT
BEGIN:VEVENT
BEGIN:VALARM
ACTION:DISPLAY
DESCRIPTION:
TRIGGER:-P1D
END:VALARM
DTSTART;VALUE=DATE:20260327
CATEGORIES:FESTIVAL
DESCRIPTION:Deity: Lord Rama\nFood: Panakam\, Vadapappu\nRules: Hyderabad (Telugu Style) Calendar
SUMMARY:🎉 Srirama Navami
UID:india-te-2026-03-27-SriramaNavami@festival
END:VEVENT
BEGIN:VEVENT
DTSTART;VALUE=DATE:20260208
CATEGORIES:PANCHANGAM
DESCRIPTION:Maghamu Krishna Paksham Saptami  (08.02.2026)\n\nSamvatsaram: Vishvavasu Samvatsaram\nAyanam: Uttarayanam\nRuthuvu: Shishira Ruthuvu\nMasam: Maghamu\nPaksham: Krishna Paksham\nTithi: upto 5.01 AM Saptami\, thereafter Ashtami\nVaram: Bhanuvaram\nNakshatram: upto 5.46 AM Swathi (1 Padam)\, and then Vishakha\nYogam: Ganda\nKaranam: Vishti\nRahu Kalam: 4.48 PM to 6.14 PM\nYamagandam: 12.30 PM to 1.56 PM\nDurmuhurtham: 4.42 PM to 5.28 PM\nAbhijit Muhurtham: 12.07 PM to 12.53 PM\nSuryodayam: 6.45 AM\nSuryastamayam: 6.14 PM\nChandrodayam: 11.58 PM\nChandrashtamam: Meenam\nTaddinam Tithi: Saptami\nPradesham: Hyderabad (Telugu Style)
SUMMARY:Maghamu Krishna Paksham Saptami  (08.02.2026)
UID:india-te-2026-02-08@panchangam
END:VEVENT
BEGIN:VEVENT
DTSTART;VALUE=DATE:20260318
CATEGORIES:PANCHANGAM
DESCRIPTION:Phalgunamu Krishna Paksham Chaturdashi  (18.03.2026)\n\nSamvatsaram: Vishvavasu Samvatsaram\nAyanam: Uttarayanam\nRuthuvu: Shishira Ruthuvu\nMasam: Phalgunamu\nPaksham: Krishna Paksham\nTithi: upto 8.25 AM Chaturdashi\, thereafter Amavasya\nVaram: Budhavaram\nNakshatram: upto 6.47 AM Shatabhisham (4 Padam)\, upto 5.59 AM Poorvabhadra\, and then Uttarabhadra\nYogam: Sadhya\nKaranam: Shakuni\nRahu Kalam: 12.24 PM to 1.54 PM\nYamagandam: 7.52 AM to 9.23 AM\nDurmuhurtham: 10.23 AM to 11.11 AM\nAbhijit Muhurtham: 12 Noon to 12.48 PM\nSuryodayam: 6.22 AM\nSuryastamayam: 6.26 PM\nChandrodayam: 5.43 AM\nChandrashtamam: Karkatakam\nTaddinam Tithi: Amavasya\nPradesham: Hyderabad (Telugu Style)
SUMMARY:Phalgunamu Krishna Paksham Chaturdashi  (18.03.2026)
UID:india-te-2026-03-18@panchangam
END:VEVENT
BEGIN:VEVENT
DTSTART;VALUE=DATE:20260428
CATEGORIES:PANCHANGAM
DESCRIPTION:Vaishakhamu Shukla Paksham Dwadashi  (28.04.2026)\n\nSamvatsaram: Parabhava Samvatsaram\nAyanam: Uttarayanam\nRuthuvu: Vasantha Ruthuvu\nMasam: Vaishakhamu\nPaksham: Shukla Paksham\nTithi: upto 6.52 PM Dwadashi\, thereafter Trayodashi\nVaram: Mangalavaram\nNakshatram: upto 11.18 PM Uttara (2 Padam)\, and then Hasta\nYogam: Vyaghata\nKaranam: Bavai\nRahu Kalam: 3.24 PM to 4.59 PM\nYamagandam: 9.02 AM to 10.38 AM\nDurmuhurtham: 7.33 AM to 8.24 AM\, 10.57 AM to 11.48 AM\nAbhijit Muhurtham: 11.48 AM to 12.39 PM\nSuryodayam: 5.51 AM\nSuryastamayam: 6.35 PM\nChandrodayam: 3.54 PM\nChandrashtamam: Kumbham\nTaddinam Tithi: Dwadashi\nPradesham: Hyderabad (Telugu Style)
SUMMARY:Vaishakhamu Shukla Paksham Dwadashi  (28.04.2026)
UID:india-te-2026-04-28@panchangam
END:VEVENT
BEGIN:VEVENT
DTSTART;VALUE=DATE:20260707
CATEGORIES:PANCHANGAM
DESCRIPTION:Jyeshthamu Krishna Paksham Saptami  (07.07.2026)\n\nSamvatsaram: Parabhava Samvatsaram\nAyanam: Dakshinayanam\nRuthuvu: Grishma Ruthuvu\nMasam: Jyeshthamu\nPaksham: Krishna Paksham\nTithi: upto 1.25 PM Saptami\, thereafter Ashtami\nVaram: Mangalavaram\nNakshatram: upto 5.04 PM Uttarabhadra (3 Padam)\, and then Revathi\nYogam: Shobhana\nKaranam: Bavai\nRahu Kalam: 3.37 PM to 5.16 PM\nYamagandam: 9.04 AM to 10.42 AM\nDurmuhurtham: 7.32 AM to 8.24 AM\, 11.02 AM to 11.54 AM\nAbhijit Muhurtham: 11.54 AM to 12.47 PM\nSuryodayam: 5.47 AM\nSuryastamayam: 6.54 PM\nChandrodayam: 11.52 PM\nChandrashtamam: Simham\nTaddinam Tithi: Ashtami\nPradesham: Hyderabad (Telugu Style)
SUMMARY:Jyeshthamu Krishna Paksham Saptami  (07.07.2026)
UID:india-te-2026-07-07@panchangam
END:VEVENT
BEGIN:VEVENT
DTSTART;VALUE=DATE:20260817
CATEGORIES:PANCHANGAM
DESCRIPTION:Sravanamu Shukla Paksham Panchami  (17.08.2026)\n\nSamvatsaram: Parabhava Samvatsaram\nAyanam: Dakshinayanam\nRuthuvu: Varsha Ruthuvu\nMasam: Sravanamu\nPaksham: Shukla Paksham\nTithi: upto 5.00 PM Panchami\, thereafter Shashti\nVaram: Somavaram\nNakshatram: upto 5.41 AM Chitta (1 Padam)\, and then Swathi\nYogam: Shubha\nKaranam: Balavai\nRahu Kalam: 7.34 AM to 9.09 AM\nYamagandam: 10.44 AM to 12.20 PM\nDurmuhurtham: 12.45 PM to 1.36 PM\nAbhijit Muhurtham: 11.54 AM to 12.45 PM\nSuryodayam: 5.59 AM\nSuryastamayam: 6.40 PM\nChandrodayam: 10.01 AM\nChandrashtamam: Kumbham\nTaddinam Tithi: Panchami\nPradesham: Hyderabad (Telugu Style)
SUMMARY:Sravanamu Shukla Paksham Panchami  (17.08.2026)
UID:india-te-2026-08-17@panchangam
END:VEVENT
BEGIN:VEVENT
DTSTART;VALUE=DATE:20260927
CATEGORIES:PANCHANGAM
DESCRIPTION:Bhadrapadamu Krishna Paksham Padyami  (27.09.2026)\n\nSamvatsaram: Parabhava Samvatsaram\nAyanam: Dakshinayanam\nRuthuvu: Varsha Ruthuvu\nMasam: Bhadrapadamu\nPaksham: Krishna Paksham\nTithi: upto 8.59 PM Padyami\, thereafter Vidiya\nVaram: Bhanuvaram\nNakshatram: upto 11.47 AM Uttarabhadra (4 Padam)\, and then Revathi\nYogam: Vriddhi\nKaranam: Balavai\nRahu Kalam: 4.37 PM to 6.08 PM\nYamagandam: 12.06 PM to 1.37 PM\nDurmuhurtham: 4.31 PM to 5.20 PM\nAbhijit Muhurtham: 11.42 AM to 12.31 PM\nSuryodayam: 6.05 AM\nSuryastamayam: 6.08 PM\nChandrodayam: 6.30 PM\nChandrashtamam: Simham\nTaddinam Tithi: Padyami\nPradesham: Hyderabad (Telugu Style)
SUMMARY:Bhadrapadamu Krishna Paksham Padyami  (27.09.2026)
UID:india-te-2026-09-27@panchangam
END:VEVENT
BEGIN:VEVENT
DTSTART;VALUE=DATE:20261022
CATEGORIES:PANCHANGAM
DESCRIPTION:Ashwayujamu Shukla Paksham Ekadashi  (22.10.2026)\n\n🎉 SPECIAL: Ekadashi (Shukla)\nSamvatsaram: Parabhava Samvatsaram\nAyanam: Dakshinayanam\nRuthuvu: Sarad Ruthuvu\nMasam: Ashwayujamu\nPaksham: Shukla Paksham\nTithi: upto 2.48 PM Ekadashi\, thereafter Dwadashi\nVaram: Guruvaram\nNakshatram: upto 9.30 PM Shatabhisham (2 Padam)\, and then Poorvabhadra\nYogam: Vriddhi\nKaranam: Vishti\nRahu Kalam: 1.27 PM to 2.55 PM\nYamagandam: 6.10 AM to 7.38 AM\nDurmuhurtham: 1.10 PM to 1.56 PM\nAbhijit Muhurtham: 11.37 AM to 12.23 PM\nSuryodayam: 6.10 AM\nSuryastamayam: 5.49 PM\nChandrodayam: 3.11 PM\nChandrashtamam: Karkatakam\nTaddinam Tithi: Ekadashi\nPradesham: Hyderabad (Telugu Style)
SUMMARY:Ashwayujamu Shukla Paksham Ekadashi  (22.10.2026)
UID:india-te-2026-10-22@panchangam
END:VEVENT
BEGIN:VEVENT
DTSTART;VALUE=DATE:20260116
CATEGORIES:PANCHANGAM
DESCRIPTION:Pushyamu Krishna Paksham Trayodashi  (16.01.2026)\n\n🎉 SPECIAL: Pradosham (Krishna)\nSamvatsaram: Vishvavasu Samvatsaram\nAyanam: Uttarayanam\nRuthuvu: Hemantha Ruthuvu\nMasam: Pushyamu\nPaksham: Krishna Paksham\nTithi: upto 10.22 PM Trayodashi\, thereafter Chaturdashi\nVaram: Shukravaram\nNakshatram: Moola (1 Padam)\nYogam: Dhruva\nKaranam: Garajai\nRahu Kalam: 11.01 AM to 12.25 PM\nYamagandam: 3.13 PM to 4.38 PM\nDurmuhurtham: 9.03 AM to 9.48 AM\, 12.48 PM to 1.33 PM\nAbhijit Muhurtham: 12.03 PM to 12.48 PM\nSuryodayam: 6.49 AM\nSuryastamayam: 6.02 PM\nChandrodayam: 4.46 AM\nChandrashtamam: Vrushabham\nTaddinam Tithi: Trayodashi\nPradesham: Hyderabad (Telugu Style)
SUMMARY:Pushyamu Krishna Paksham Trayodashi  (16.01.2026)
UID:india-te-2026-01-16@panchangam
END:VEVENT
BEGIN:VEVENT
BEGIN:VALARM
ACTION:DISPLAY
DESCRIPTION:
TRIGGER:-P1D
END:VALARM
CATEGORIES:VRATAM
DESCRIPTION:Astronomical duration of Pradosham (Krishna).
DTEND:20260116T165212Z
DTSTART:20260115T144701Z
SUMMARY:⏳ Pradosham (Krishna)
UID:india-te-202601152017-Pradosham(Krishna)@vratam
END:VEVENT
BEGIN:VEVENT
DTSTART;VALUE=DATE:20260226
CATEGORIES:PANCHANGAM
DESCRIPTION:Phalgunamu Shukla Paksham Dashami  (26.02.2026)\n\nSamvatsaram: Vishvavasu Samvatsaram\nAyanam: Uttarayanam\nRuthuvu: Shishira Ruthuvu\nMasam: Phalgunamu\nPaksham: Shukla Paksham\nTithi: upto 12.33 AM Dashami\, thereafter Ekadashi\nVaram: Guruvaram\nNakshatram: upto 12.48 PM Mrigashira (3 Padam)\, and then Arudra\nYogam: Preethi\nKaranam: Thaitilai\nRahu Kalam: 1.57 PM to 3.25 PM\nYamagandam: 6.36 AM to 8.04 AM\nDurmuhurtham: 1.39 PM to 2.26 PM\nAbhijit Muhurtham: 12.05 PM to 12.52 PM\nSuryodayam: 6.36 AM\nSuryastamayam: 6.21 PM\nChandrodayam: 1.21 PM\nChandrashtamam: Vrushchikam\nTaddinam Tithi: Dashami\nPradesham: Hyderabad (Telugu Style)
SUMMARY:Phalgunamu Shukla Paksham Dashami  (26.02.2026)
UID:india-te-2026-02-26@panchangam
END:VEVENT
BEGIN:VEVENT
DTSTART;VALUE=DATE:20260505
CATEGORIES:PANCHANGAM
DESCRIPTION:Vaishakhamu Krishna Paksham Chavithi  (05.05.2026)\n\n🎉 SPECIAL: Sankatahara Chathurthi\nSamvatsaram: Parabhava Samvatsaram\nAyanam: Uttarayanam\nRuthuvu: Vasantha Ruthuvu\nMasam: Vaishakhamu\nPaksham: Krishna Paksham\nTithi: Chavithi\nVaram: Mangalavaram\nNakshatram: upto 1.39 PM Jyeshta (3 Padam)\, and then Moola\nYogam: Shiva\nKaranam: Bavai\nRahu Kalam: 3.25 PM to 5.01 PM\nYamagandam: 9.00 AM to 10.36 AM\nDurmuhurtham: 7.30 AM to 8.22 AM\, 10.55 AM to 11.47 AM\nAbhijit Muhurtham: 11.47 AM to 12.38 PM\nSuryodayam: 5.48 AM\nSuryastamayam: 6.37 PM\nChandrodayam: 9.55 PM\nChandrashtamam: Mesham\nTaddinam Tithi: Chavithi\nPradesham: Hyderabad (Telugu Style)
SUMMARY:Vaishakhamu Krishna Paksham Chavithi  (05.05.2026)
UID:india-te-2026-05-05@panchangam
END:VEVENT
BEGIN:VEVENT
DTSTART;VALUE=DATE:20260615
CATEGORIES:PANCHANGAM
DESCRIPTION:Jyeshthamu Krishna Paksham Amavasya 🌑 (15.06.2026)\n\nSamvatsaram: Parabhava Samvatsaram\nAyanam: Uttarayanam\nRuthuvu: Grishma Ruthuvu\nMasam: Jyeshthamu\nPaksham: Krishna Paksham\nTithi: upto 8.24 AM Amavasya\, upto 4.31 AM Padyami\, thereafter Vidiya\nVaram: Somavaram\nNakshatram: upto 7.43 PM Mrigashira (2 Padam)\, and then Arudra\nYogam: Shoola\nKaranam: Nagava\nRahu Kalam: 7.20 AM to 8.59 AM\nYamagandam: 10.37 AM to 12.16 PM\nDurmuhurtham: 12.42 PM to 1.35 PM\nAbhijit Muhurtham: 11.50 AM to 12.42 PM\nSuryodayam: 5.41 AM\nSuryastamayam: 6.51 PM\nChandrodayam: 5.31 AM\nChandrashtamam: Thula\nTaddinam Tithi: Padyami\nPradesham: Hyderabad (Telugu Style)
SUMMARY:Jyeshthamu Krishna Paksham Amavasya 🌑 (15.06.2026)
UID:india-te-2026-06-15@panchangam
END:VEVENT
BEGIN:VEVENT
DTSTART;VALUE=DATE:20260725
CATEGORIES:PANCHANGAM
DESCRIPTION:Ashadhamu Shukla Paksham Ekadashi  (25.07.2026)\n\n🎉 SPECIAL: Ekadashi (Shukla)\nSamvatsaram: Parabhava Samvatsaram\nAyanam: Dakshinayanam\nRuthuvu: Grishma Ruthuvu\nMasam: Ashadhamu\nPaksham: Shukla Paksham\nTithi: upto 11.34 AM Ekadashi\, thereafter Dwadashi\nVaram: Shanivaram\nNakshatram: Jyeshta (1 Padam)\nYogam: Brahma\nKaranam: Vishti\nRahu Kalam: 9.07 AM to 10.45 AM\nYamagandam: 1.59 PM to 3.37 PM\nDurmuhurtham: 5.53 AM to 6.45 AM\nAbhijit Muhurtham: 11.56 AM to 12.48 PM\nSuryodayam: 5.53 AM\nSuryastamayam: 6.51 PM\nChandrodayam: 3.41 PM\nChandrashtamam: Mesham\nTaddinam Tithi: Dwadashi\nPradesham: Hyderabad (Telugu Style)
SUMMARY:Ashadhamu Shukla Paksham Ekadashi  (25.07.2026)
UID:india-te-2026-07-25@panchangam
END:VEVENT
BEGIN:VEVENT
DTSTART;VALUE=DATE:20261029
CATEGORIES:PANCHANGAM
DESCRIPTION:Ashwayujamu Krishna Paksham Chavithi  (29.10.2026)\n\n🎉 SPECIAL: Sankatahara Chathurthi\nSamvatsaram: Parabhava Samvatsaram\nAyanam: Dakshinayanam\nRuthuvu: Sarad Ruthuvu\nMasam: Ashwayujamu\nPaksham: Krishna Paksham\nTithi: upto 10.10 PM Chavithi\, thereafter Panchami\nVaram: Guruvaram\nNakshatram: upto 11.48 AM Rohini (3 Padam)\, and then Mrigashira\nYogam: Parigha\nKaranam: Bavai\nRahu Kalam: 1.26 PM to 2.52 PM\nYamagandam: 6.13 AM to 7.39 AM\nDurmuhurtham: 1.08 PM to 1.55 PM\nAbhijit Muhurtham: 11.36 AM to 12.22 PM\nSuryodayam: 6.13 AM\nSuryastamayam: 5.46 PM\nChandrodayam: 8.38 PM\nChandrashtamam: Thula\nTaddinam Tithi: Chavithi\nPradesham: Hyderabad (Telugu Style)
SUMMARY:Ashwayujamu Krishna Paksham Chavithi  (29.10.2026)
UID:india-te-2026-10-29@panchangam
END:VEVENT
BEGIN:VEVENT
BEGIN:VALARM
ACTION:DISPLAY
DESCRIPTION:
TRIGGER:-P1D
END:VALARM
CATEGORIES:VRATAM
DESCRIPTION:Astronomical duration of Sashti (Shukla).
DTEND:20260324T103820Z
DTSTART:20260323T130850Z
SUMMARY:⏳ Sashti (Shukla)
UID:india-te-202603231838-Sashti(Shukla)@vratam
END:VEVENT
BEGIN:VEVENT
DTSTART;VALUE=DATE:20260303
CATEGORIES:PANCHANGAM
DESCRIPTION:Phalgunamu Shukla Paksham Pournami 🌕 (03.03.2026)\n\nSamvatsaram: Vishvavasu Samvatsaram\nAyanam: Uttarayanam\nRuthuvu: Shishira Ruthuvu\nMasam: Phalgunamu\nPaksham: Shukla Paksham\nTithi: upto 5.07 PM Pournami\, thereafter Padyami\nVaram: Mangalavaram\nNakshatram: upto 8.10 AM Makha (4 Padam)\, and then Pubba\nYogam: Sukarman\nKaranam: Bavai\nRahu Kalam: 3.25 PM to 4.54 PM\nYamagandam: 9.30 AM to 10.59 AM\nDurmuhurtham: 8.07 AM to 8.55 AM\, 11.17 AM to 12.04 PM\nAbhijit Muhurtham: 12.04 PM to 12.51 PM\nSuryodayam: 6.33 AM\nSuryastamayam: 6.23 PM\nChandrodayam: 6.23 PM\nChandrashtamam: Makaram\nTaddinam Tithi: Pournami\nPradesham: Hyderabad (Telugu Style)
SUMMARY:Phalgunamu Shukla Paksham Pournami 🌕 (03.03.2026)
UID:india-te-2026-03-03@panchangam
END:VEVENT
BEGIN:VEVENT
DTSTART;VALUE=DATE:20260413
CATEGORIES:PANCHANGAM
DESCRIPTION:Chaitramu Krishna Paksham Ekadashi  (13.04.2026)\n\n🎉 SPECIAL: Ekadashi (Krishna)\nSamvatsaram: Parabhava Samvatsaram\nAyanam: Uttarayanam\nRuthuvu: Vasantha Ruthuvu\nMasam: Chaitramu\nPaksham: Krishna Paksham\nTithi: upto 1.09 AM Ekadashi\, thereafter Dwadashi\nVaram: Somavaram\nNakshatram: upto 4.44 PM Dhanishta (3 Padam)\, and then Shatabhisham\nYogam: Shubha\nKaranam: Bavai\nRahu Kalam: 7.35 AM to 9.09 AM\nYamagandam: 10.42 AM to 12.16 PM\nDurmuhurtham: 12.41 PM to 1.31 PM\nAbhijit Muhurtham: 11.51 AM to 12.41 PM\nSuryodayam: 6.01 AM\nSuryastamayam: 6.31 PM\nChandrodayam: 2.58 AM\nChandrashtamam: Karkatakam\nTaddinam Tithi: Ekadashi\nPradesham: Hyderabad (Telugu Style)
SUMMARY:Chaitramu Krishna Paksham Ekadashi  (13.04.2026)
UID:india-te-2026-04-13@panchangam
END:VEVENT
BEGIN:VEVENT
DTSTART;VALUE=DATE:20260523
CATEGORIES:PANCHANGAM
DESCRIPTION:Jyeshthamu Shukla Paksham Ashtami  (23.05.2026)\n\nSamvatsaram: Parabhava Samvatsaram\nAyanam: Uttarayanam\nRuthuvu: Grishma Ruthuvu\nMasam: Jyeshthamu\nPaksham: Shukla Paksham\nTithi: upto 4.27 AM Ashtami\, thereafter Navami\nVaram: Shanivaram\nNakshatram: upto 2.49 AM Makha (1 Padam)\, and then Pubba\nYogam: Dhruva\nKaranam: Vishti\nRahu Kalam: 8.57 AM to 10.35 AM\nYamagandam: 1.50 PM to 3.28 PM\nDurmuhurtham: 5.42 AM to 6.34 AM\nAbhijit Muhurtham: 11.46 AM to 12.38 PM\nSuryodayam: 5.42 AM\nSuryastamayam: 6.43 PM\nChandrodayam: 12.07 PM\nChandrashtamam: Makaram\nTaddinam Tithi: Ashtami\nPradesham: Hyderabad (Telugu Style)
SUMMARY:Jyeshthamu Shukla Paksham Ashtami  (23.05.2026)
UID:india-te-2026-05-23@panchangam
END:VEVENT
BEGIN:VEVENT
DTSTART;VALUE=DATE:20260802
CATEGORIES:PANCHANGAM
DESCRIPTION:Ashadhamu Krishna Paksham Chavithi  (02.08.2026)\n\n🎉 SPECIAL: Sankatahara Chathurthi\nSamvatsaram: Parabhava Samvatsaram\nAyanam: Dakshinayanam\nRuthuvu: Grishma Ruthuvu\nMasam: Ashadhamu\nPaksham: Krishna Paksham\nTithi: upto 11.15 PM Chavithi\, thereafter Panchami\nVaram: Bhanuvaram\nNakshatram: upto 10.18 PM Poorvabhadra (2 Padam)\, and then Uttarabhadra\nYogam: Atiganda\nKaranam: Bavai\nRahu Kalam: 5.12 PM to 6.48 PM\nYamagandam: 12.22 PM to 1.58 PM\nDurmuhurtham: 5.05 PM to 5.57 PM\nAbhijit Muhurtham: 11.56 AM to 12.48 PM\nSuryodayam: 5.55 AM\nSuryastamayam: 6.48 PM\nChandrodayam: 9.17 PM\nChandrashtamam: Karkatakam\nTaddinam Tithi: Chavithi\nPradesham: Hyderabad (Telugu Style)
SUMMARY:Ashadhamu Krishna Paksham Chavithi  (02.08.2026)
UID:india-te-2026-08-02@panchangam
END:VEVENT
BEGIN:VEVENT
DTSTART;VALUE=DATE:20260912
CATEGORIES:PANCHANGAM
DESCRIPTION:Bhadrapadamu Shukla Paksham Padyami  (12.09.2026)\n\nSamvatsaram: Parabhava Samvatsaram\nAyanam: Dakshinayanam\nRuthuvu: Varsha Ruthuvu\nMasam: Bhadrapadamu\nPaksham: Shukla Paksham\nTithi: upto 7.46 AM Padyami\, thereafter Vidiya\nVaram: Shanivaram\nNakshatram: upto 1.35 PM Uttara (3 Padam)\, and then Hasta\nYogam: Shubha\nKaranam: Bavai\nRahu Kalam: 9.07 AM to 10.40 AM\nYamagandam: 1.44 PM to 3.16 PM\nDurmuhurtham: 6.03 AM to 6.52 AM\nAbhijit Muhurtham: 11.47 AM to 12.36 PM\nSuryodayam: 6.03 AM\nSuryastamayam: 6.20 PM\nChandrodayam: 6.55 AM\nChandrashtamam: Kumbham\nTaddinam Tithi: Vidiya\nPradesham: Hyderabad (Telugu Style)
SUMMARY:Bhadrapadamu Shukla Paksham Padyami  (12.09.2026)
UID:india-te-2026-09-12@panchangam
END:VEVENT
BEGIN:VEVENT
BEGIN:VALARM
ACTION:DISPLAY
DESCRIPTION:
TRIGGER:-P1D
END:VALARM
CATEGORIES:VRATAM
DESCRIPTION:Astronomical duration of Pradosham (Krishna).
DTEND:20260712T170027Z
DTSTART:20260711T203446Z
SUMMARY:⏳ Pradosham (Krishna)
UID:india-te-202607120204-Pradosham(Krishna)@vratam
END:VEVENT
BEGIN:VEVENT
DTSTART;VALUE=DATE:20261106
CATEGORIES:PANCHANGAM
DESCRIPTION:Ashwayujamu Krishna Paksham Dwadashi  (06.11.2026)\n\n🎉 SPECIAL: Pradosham (Krishna)\nSamvatsaram: Parabhava Samvatsaram\nAyanam: Dakshinayanam\nRuthuvu: Sarad Ruthuvu\nMasam: Ashwayujamu\nPaksham: Krishna Paksham\nTithi: upto 10.31 AM Dwadashi\, thereafter Trayodashi\nVaram: Shukravaram\nNakshatram: upto 5.25 AM Hasta (1 Padam)\, and then Chitta\nYogam: Vaidhriti\nKaranam: Thaitilai\nRahu Kalam: 10.33 AM to 11.59 AM\nYamagandam: 2.51 PM to 4.16 PM\nDurmuhurtham: 8.33 AM to 9.19 AM\, 12.22 PM to 1.08 PM\nAbhijit Muhurtham: 11.36 AM to 12.22 PM\nSuryodayam: 6.16 AM\nSuryastamayam: 5.42 PM\nChandrodayam: 3.32 AM\nChandrashtamam: Kumbham\nTaddinam Tithi: Trayodashi\nPradesham: Hyderabad (Telugu Style)
SUMMARY:Ashwayujamu Krishna Paksham Dwadashi  (06.11.2026)
UID:india-te-2026-11-06@panchangam
END:VEVENT
BEGIN:VEVENT
DTSTART;VALUE=DATE:20261216
CATEGORIES:PANCHANGAM
DESCRIPTION:Margashiramu Shukla Paksham Saptami  (16.12.2026)\n\nSamvatsaram: Parabhava Samvatsaram\nAyanam: Dakshinayanam\nRuthuvu: Hemantha Ruthuvu\nMasam: Margashiramu\nPaksham: Shukla Paksham\nTithi: upto 10.46 PM Saptami\, thereafter Ashtami\nVaram: Budhavaram\nNakshatram: upto 2.46 PM Shatabhisham (3 Padam)\, and then Poorvabhadra\nYogam: Vajra\nKaranam: Garajai\nRahu Kalam: 12.11 PM to 1.34 PM\nYamagandam: 8.01 AM to 9.25 AM\nDurmuhurtham: 10.20 AM to 11.04 AM\nAbhijit Muhurtham: 11.49 AM to 12.33 PM\nSuryodayam: 6.38 AM\nSuryastamayam: 5.44 PM\nChandrodayam: 11.38 AM\nChandrashtamam: Karkatakam\nTaddinam Tithi: Saptami\nPradesham: Hyderabad (Telugu Style)
SUMMARY:Margashiramu Shukla Paksham Saptami  (16.12.2026)
UID:india-te-2026-12-16@panchangam
END:VEVENT
BEGIN:VEVENT
DTSTART;VALUE=DATE:20260101
CATEGORIES:PANCHANGAM
DESCRIPTION:Pushyamu Shukla Paksham Trayodashi  (01.01.2026)\n\n🎉 SPECIAL: Pradosham (Shukla)\nSamvatsaram: Vishvavasu Samvatsaram\nAyanam: Uttarayanam\nRuthuvu: Hemantha Ruthuvu\nMasam: Pushyamu\nPaksham: Shukla Paksham\nTithi: upto 10.22 PM Trayodashi\, thereafter Chaturdashi\nVaram: Guruvaram\nNakshatram: upto 11.23 PM Rohini (1 Padam)\, and then Mrigashira\nYogam: Shubha\nKaranam: Kaulavai\nRahu Kalam: 1.42 PM to 3.06 PM\nYamagandam: 6.46 AM to 8.09 AM\nDurmuhurtham: 1.26 PM to 2.10 PM\nAbhijit Muhurtham: 11.57 AM to 12.41 PM\nSuryodayam: 6.46 AM\nSuryastamayam: 5.52 PM\nChandrodayam: 3.40 PM\nChandrashtamam: Thula\nTaddinam Tithi: Trayodashi\nPradesham: Hyderabad (Telugu Style)
SUMMARY:Pushyamu Shukla Paksham Trayodashi  (01.01.2026)
UID:india-te-2026-01-01@panchangam
END:VEVENT
BEGIN:VEVENT
DTSTART;VALUE=DATE:20260211
CATEGORIES:PANCHANGAM
DESCRIPTION:Maghamu Krishna Paksham Navami  (11.02.2026)\n\nSamvatsaram: Vishvavasu Samvatsaram\nAyanam: Uttarayanam\nRuthuvu: Shishira Ruthuvu\nMasam: Maghamu\nPaksham: Krishna Paksham\nTithi: upto 9.59 AM Navami\, thereafter Dashami\nVaram: Budhavaram\nNakshatram: upto 11.37 AM Anuradha (4 Padam)\, and then Jyeshta\nYogam: Vyaghata\nKaranam: Garajai\nRahu Kalam: 12.30 PM to 1.56 PM\nYamagandam: 8.11 AM to 9.37 AM\nDurmuhurtham: 10.35 AM to 11.21 AM\nAbhijit Muhurtham: 12.07 PM to 12.53 PM\nSuryodayam: 6.44 AM\nSuryastamayam: 6.16 PM\nChandrodayam: 1.43 AM\nChandrashtamam: Mesham\nTaddinam Tithi: Dashami\nPradesham: Hyderabad (Telugu Style)
SUMMARY:Maghamu Krishna Paksham Navami  (11.02.2026)
UID:india-te-2026-02-11@panchangam
END:VEVENT
BEGIN:VEVENT
DTSTART;VALUE=DATE:20260321
CATEGORIES:PANCHANGAM
DESCRIPTION:Chaitramu Shukla Paksham Thadiya  (21.03.2026)\n\nSamvatsaram: Vishvavasu Samvatsaram\nAyanam: Uttarayanam\nRuthuvu: Vasantha Ruthuvu\nMasam: Chaitramu\nPaksham: Shukla Paksham\nTithi: upto 11.56 PM Thadiya\, thereafter Chavithi\nVaram: Shanivaram\nNakshatram: upto 1.14 AM Aswini (1 Padam)\, and then Bharani\nYogam: Indra\nKaranam: Thaitilai\nRahu Kalam: 9.21 AM to 10.52 AM\nYamagandam: 1.54 PM to 3.25 PM\nDurmuhurtham: 6.19 AM to 7.08 AM\nAbhijit Muhurtham: 11.59 AM to 12.47 PM\nSuryodayam: 6.19 AM\nSuryastamayam: 6.27 PM\nChandrodayam: 7.41 AM\nChandrashtamam: Kanya\nTaddinam Tithi: Thadiya\nPradesham: Hyderabad (Telugu Style)
SUMMARY:Chaitramu Shukla Paksham Thadiya  (21.03.2026)
UID:india-te-2026-03-21@panchangam
END:VEVENT
BEGIN:VEVENT
DTSTART;VALUE=DATE:20260710
CATEGORIES:PANCHANGAM
DESCRIPTION:Jyeshthamu Krishna Paksham Dashami  (10.07.2026)\n\nSamvatsaram: Parabhava Samvatsaram\nAyanam: Dakshinayanam\nRuthuvu: Grishma Ruthuvu\nMasam: Jyeshthamu\nPaksham: Krishna Paksham\nTithi: upto 8.16 AM Dashami\, upto 5.23 AM Ekadashi\, thereafter Dwadashi\nVaram: Shukravaram\nNakshatram: upto 1.52 PM Bharani (3 Padam)\, and then Kruthika\nYogam: Dhruthi\nKaranam: Vishti\nRahu Kalam: 10.43 AM to 12.21 PM\nYamagandam: 3.37 PM to 5.16 PM\nDurmuhurtham: 8.25 AM to 9.17 AM\, 12.47 PM to 1.40 PM\nAbhijit Muhurtham: 11.55 AM to 12.47 PM\nSuryodayam: 5.48 AM\nSuryastamayam: 6.54 PM\nChandrodayam: 1.18 AM\nChandrashtamam: Kanya\nTaddinam Tithi: Ekadashi\nPradesham: Hyderabad (Telugu Style)
SUMMARY:Jyeshthamu Krishna Paksham Dashami  (10.07.2026)
UID:india-te-2026-07-10@panchangam
END:VEVENT
BEGIN:VEVENT
DTSTART;VALUE=DATE:20260820
CATEGORIES:PANCHANGAM
DESCRIPTION:Sravanamu Shukla Paksham Ashtami  (20.08.2026)\n\nSamvatsaram: Parabhava Samvatsaram\nAyanam: Dakshinayanam\nRuthuvu: Varsha Ruthuvu\nMasam: Sravanamu\nPaksham: Shukla Paksham\nTithi: upto 9.18 PM Ashtami\, thereafter Navami\nVaram: Guruvaram\nNakshatram: upto 9.52 AM Vishakha (4 Padam)\, and then Anuradha\nYogam: Indra\nKaranam: Vishti\nRahu Kalam: 1.54 PM to 3.29 PM\nYamagandam: 6.00 AM to 7.34 AM\nDurmuhurtham: 1.35 PM to 2.25 PM\nAbhijit Muhurtham: 11.54 AM to 12.44 PM\nSuryodayam: 6.00 AM\nSuryastamayam: 6.38 PM\nChandrodayam: 12.40 PM\nChandrashtamam: Mesham\nTaddinam Tithi: Ashtami\nPradesham: Hyderabad (Telugu Style)
SUMMARY:Sravanamu Shukla Paksham Ashtami  (20.08.2026)
UID:india-te-2026-08-20@panchangam
END:VEVENT
BEGIN:VEVENT
DTSTART;VALUE=DATE:20260930
CATEGORIES:PANCHANGAM
DESCRIPTION:Bhadrapadamu Krishna Paksham Chavithi  (30.09.2026)\n\nSamvatsaram: Parabhava Samvatsaram\nAyanam: Dakshinayanam\nRuthuvu: Varsha Ruthuvu\nMasam: Bhadrapadamu\nPaksham: Krishna Paksham\nTithi: upto 2.55 PM Chavithi\, thereafter Panchami\nVaram: Budhavaram\nNakshatram: upto 8.14 AM Bharani (4 Padam)\, and then Kruthika\nYogam: Vajra\nKaranam: Balavai\nRahu Kalam: 12.05 PM to 1.35 PM\nYamagandam: 7.36 AM to 9.06 AM\nDurmuhurtham: 10.06 AM to 10.54 AM\nAbhijit Muhurtham: 11.41 AM to 12.29 PM\nSuryodayam: 6.06 AM\nSuryastamayam: 6.05 PM\nChandrodayam: 8.48 PM\nChandrashtamam: Kanya\nTaddinam Tithi: Chavithi\nPradesham: Hyderabad (Telugu Style)
SUMMARY:Bhadrapadamu Krishna Paksham Chavithi  (30.09.2026)
UID:india-te-2026-09-30@panchangam
END:VEVENT
BEGIN:VEVENT
BEGIN:VALARM
ACTION:DISPLAY
DESCRIPTION:
TRIGGER:-P1D
END:VALARM
CATEGORIES:VRATAM
DESCRIPTION:Astronomical duration of Ekadashi (Krishna).
DTEND:20260315T034701Z
DTSTART:20260314T024127Z
SUMMARY:⏳ Ekadashi (Krishna)
UID:india-te-202603140811-Ekadashi(Krishna)@vratam
END:VEVENT
BEGIN:VEVENT
BEGIN:VALARM
ACTION:DISPLAY
DESCRIPTION:
TRIGGER:-P1D
END:VALARM
CATEGORIES:VRATAM
DESCRIPTION:Astronomical duration of Sashti (Shukla).
DTEND:20260223T033945Z
DTSTART:20260222T054025Z
SUMMARY:⏳ Sashti (Shukla)
UID:india-te-202602221110-Sashti(Shukla)@vratam
END:VEVENT
BEGIN:VEVENT
DTSTART;VALUE=DATE:20260809
CATEGORIES:PANCHANGAM
DESCRIPTION:Ashadhamu Krishna Paksham Ekadashi  (09.08.2026)\n\n🎉 SPECIAL: Ekadashi (Krishna)\nSamvatsaram: Parabhava Samvatsaram\nAyanam: Dakshinayanam\nRuthuvu: Grishma Ruthuvu\nMasam: Ashadhamu\nPaksham: Krishna Paksham\nTithi: upto 11.05 AM Ekadashi\, thereafter Dwadashi\nVaram: Bhanuvaram\nNakshatram: upto 3.20 PM Mrigashira (3 Padam)\, and then Arudra\nYogam: Vyaghata\nKaranam: Balavai\nRahu Kalam: 5.09 PM to 6.45 PM\nYamagandam: 12.21 PM to 1.57 PM\nDurmuhurtham: 5.03 PM to 5.54 PM\nAbhijit Muhurtham: 11.55 AM to 12.47 PM\nSuryodayam: 5.57 AM\nSuryastamayam: 6.45 PM\nChandrodayam: 1.59 AM\nChandrashtamam: Vrushchikam\nTaddinam Tithi: Dwadashi\nPradesham: Hyderabad (Telugu Style)
SUMMARY:Ashadhamu Krishna Paksham Ekadashi  (09.08.2026)
UID:india-te-2026-08-09@panchangam
END:VEVENT
BEGIN:VEVENT
BEGIN:VALARM
ACTION:DISPLAY
DESCRIPTION:
TRIGGER:-P1D
END:VALARM
CATEGORIES:VRATAM
DESCRIPTION:Astronomical duration of Pradosham (Shukla).
DTEND:20260826T022938Z
DTSTART:20260825T005122Z
SUMMARY:⏳ Pradosham (Shukla)
UID:india-te-202608250621-Pradosham(Shukla)@vratam
END:VEVENT
BEGIN:VEVENT
DTSTART;VALUE=DATE:20260919
CATEGORIES:PANCHANGAM
DESCRIPTION:Bhadrapadamu Shukla Paksham Ashtami  (19.09.2026)\n\nSamvatsaram: Parabhava Samvatsaram\nAyanam: Dakshinayanam\nRuthuvu: Varsha Ruthuvu\nMasam: Bhadrapadamu\nPaksham: Shukla Paksham\nTithi: upto 3.27 PM Ashtami\, thereafter Navami\nVaram: Shanivaram\nNakshatram: upto 2.28 AM Moola (1 Padam)\, and then Poorvashada\nYogam: Aayushman\nKaranam: Bavai\nRahu Kalam: 9.07 AM to 10.38 AM\nYamagandam: 1.41 PM to 3.12 PM\nDurmuhurtham: 6.04 AM to 6.53 AM\nAbhijit Muhurtham: 11.45 AM to 12.34 PM\nSuryodayam: 6.04 AM\nSuryastamayam: 6.15 PM\nChandrodayam: 1.08 PM\nChandrashtamam: Vrushabham\nTaddinam Tithi: Ashtami\nPradesham: Hyderabad (Telugu Style)
SUMMARY:Bhadrapadamu Shukla Paksham Ashtami  (19.09.2026)
UID:india-te-2026-09-19@panchangam
END:VEVENT
BEGIN:VEVENT
DTSTART;VALUE=DATE:20261014
CATEGORIES:PANCHANGAM
DESCRIPTION:Ashwayujamu Shukla Paksham Chavithi  (14.10.2026)\n\nSamvatsaram: Parabhava Samvatsaram\nAyanam: Dakshinayanam\nRuthuvu: Sarad Ruthuvu\nMasam: Ashwayujamu\nPaksham: Shukla Paksham\nTithi: upto 1.13 AM Chavithi\, thereafter Panchami\nVaram: Budhavaram\nNakshatram: upto 4.48 AM Anuradha (1 Padam)\, and then Jyeshta\nYogam: Aayushman\nKaranam: Vanijai\nRahu Kalam: 12.01 PM to 1.30 PM\nYamagandam: 7.37 AM to 9.05 AM\nDurmuhurtham: 10.04 AM to 10.51 AM\nAbhijit Muhurtham: 11.38 AM to 12.25 PM\nSuryodayam: 6.08 AM\nSuryastamayam: 5.55 PM\nChandrodayam: 9.13 AM\nChandrashtamam: Mesham\nTaddinam Tithi: Chavithi\nPradesham: Hyderabad (Telugu Style)
SUMMARY:Ashwayujamu Shukla Paksham Chavithi  (14.10.2026)
UID:india-te-2026-10-14@panchangam
END:VEVENT
BEGIN:VEVENT
DTSTART;VALUE=DATE:20261124
CATEGORIES:PANCHANGAM
DESCRIPTION:Karthikamu Shukla Paksham Pournami 🌕 (24.11.2026)\n\nSamvatsaram: Parabhava Samvatsaram\nAyanam: Dakshinayanam\nRuthuvu: Sarad Ruthuvu\nMasam: Karthikamu\nPaksham: Shukla Paksham\nTithi: upto 8.23 PM Pournami\, thereafter Padyami\nVaram: Mangalavaram\nNakshatram: upto 12.01 AM Kruthika (1 Padam)\, and then Rohini\nYogam: Parigha\nKaranam: Vishti\nRahu Kalam: 2.51 PM to 4.15 PM\nYamagandam: 9.14 AM to 10.38 AM\nDurmuhurtham: 7.55 AM to 8.40 AM\, 10.55 AM to 11.40 AM\nAbhijit Muhurtham: 11.40 AM to 12.25 PM\nSuryodayam: 6.25 AM\nSuryastamayam: 5.39 PM\nChandrodayam: 5.18 PM\nChandrashtamam: Kanya\nTaddinam Tithi: Pournami\nPradesham: Hyderabad (Telugu Style)
SUMMARY:Karthikamu Shukla Paksham Pournami 🌕 (24.11.2026)
UID:india-te-2026-11-24@panchangam
END:VEVENT
BEGIN:VEVENT
BEGIN:VALARM
ACTION:DISPLAY
DESCRIPTION:
TRIGGER:-P1D
END:VALARM
CATEGORIES:VRATAM
DESCRIPTION:Astronomical duration of Sankatahara Chathurthi.
DTEND:20261029T164038Z
DTSTART:20261028T193713Z
SUMMARY:⏳ Sankatahara Chathurthi
UID:india-te-202610290107-SankataharaChathurthi@vratam
END:VEVENT
BEGIN:VEVENT
BEGIN:VALARM
ACTION:DISPLAY
DESCRIPTION:
TRIGGER:-P1D
END:VALARM
CATEGORIES:VRATAM
DESCRIPTION:Astronomical duration of Ekadashi (Shukla).
DTEND:20260527T005215Z
DTSTART:20260525T234124Z
SUMMARY:⏳ Ekadashi (Shukla)
UID:india-te-202605260511-Ekadashi(Shukla)@vratam
END:VEVENT
BEGIN:VEVENT
DTSTART;VALUE=DATE:20260108
CATEGORIES:PANCHANGAM
DESCRIPTION:Pushyamu Krishna Paksham Shashti  (08.01.2026)\n\nSamvatsaram: Vishvavasu Samvatsaram\nAyanam: Uttarayanam\nRuthuvu: Hemantha Ruthuvu\nMasam: Pushyamu\nPaksham: Krishna Paksham\nTithi: Shashti\nVaram: Guruvaram\nNakshatram: upto 1.05 PM Pubba (3 Padam)\, and then Uttara\nYogam: Saubhagya\nKaranam: Garajai\nRahu Kalam: 1.46 PM to 3.09 PM\nYamagandam: 6.48 AM to 8.11 AM\nDurmuhurtham: 1.29 PM to 2.14 PM\nAbhijit Muhurtham: 12 Noon to 12.44 PM\nSuryodayam: 6.48 AM\nSuryastamayam: 5.57 PM\nChandrodayam: 10.48 PM\nChandrashtamam: Makaram\nTaddinam Tithi: Shashti\nPradesham: Hyderabad (Telugu Style)
SUMMARY:Pushyamu Krishna Paksham Shashti  (08.01.2026)
UID:india-te-2026-01-08@panchangam
END:VEVENT
BEGIN:VEVENT
DTSTART;VALUE=DATE:20260218
CATEGORIES:PANCHANGAM
DESCRIPTION:Phalgunamu Shukla Paksham Padyami  (18.02.2026)\n\nSamvatsaram: Vishvavasu Samvatsaram\nAyanam: Uttarayanam\nRuthuvu: Shishira Ruthuvu\nMasam: Phalgunamu\nPaksham: Shukla Paksham\nTithi: upto 4.58 PM Padyami\, thereafter Vidiya\nVaram: Budhavaram\nNakshatram: upto 9.55 PM Shatabhisham (2 Padam)\, and then Poorvabhadra\nYogam: Shiva\nKaranam: Bavai\nRahu Kalam: 12.30 PM to 1.57 PM\nYamagandam: 8.08 AM to 9.35 AM\nDurmuhurtham: 10.33 AM to 11.20 AM\nAbhijit Muhurtham: 12.06 PM to 12.53 PM\nSuryodayam: 6.41 AM\nSuryastamayam: 6.18 PM\nChandrodayam: 7.10 AM\nChandrashtamam: Karkatakam\nTaddinam Tithi: Padyami\nPradesham: Hyderabad (Telugu Style)
SUMMARY:Phalgunamu Shukla Paksham Padyami  (18.02.2026)
UID:india-te-2026-02-18@panchangam
END:VEVENT
BEGIN:VEVENT
DTSTART;VALUE=DATE:20260328
CATEGORIES:PANCHANGAM
DESCRIPTION:Chaitramu Shukla Paksham Dashami  (28.03.2026)\n\nSamvatsaram: Vishvavasu Samvatsaram\nAyanam: Uttarayanam\nRuthuvu: Vasantha Ruthuvu\nMasam: Chaitramu\nPaksham: Shukla Paksham\nTithi: upto 8.46 AM Dashami\, thereafter Ekadashi\nVaram: Shanivaram\nNakshatram: upto 3.29 PM Pushyami (3 Padam)\, and then Ashlesha\nYogam: Sukarman\nKaranam: Garajai\nRahu Kalam: 9.17 AM to 10.49 AM\nYamagandam: 1.53 PM to 3.24 PM\nDurmuhurtham: 6.14 AM to 7.03 AM\nAbhijit Muhurtham: 11.56 AM to 12.45 PM\nSuryodayam: 6.14 AM\nSuryastamayam: 6.28 PM\nChandrodayam: 2.23 PM\nChandrashtamam: Dhanu\nTaddinam Tithi: Ekadashi\nPradesham: Hyderabad (Telugu Style)
SUMMARY:Chaitramu Shukla Paksham Dashami  (28.03.2026)
UID:india-te-2026-03-28@panchangam
END:VEVENT
BEGIN:VEVENT
BEGIN:VALARM
ACTION:DISPLAY
DESCRIPTION:
TRIGGER:-P1D
END:VALARM
CATEGORIES:VRATAM
DESCRIPTION:Astronomical duration of Pradosham (Shukla).
DTEND:20260529T042110Z
DTSTART:20260528T022727Z
SUMMARY:⏳ Pradosham (Shukla)
UID:india-te-202605280757-Pradosham(Shukla)@vratam
END:VEVENT
BEGIN:VEVENT
DTSTART;VALUE=DATE:20260607
CATEGORIES:PANCHANGAM
DESCRIPTION:Jyeshthamu Krishna Paksham Saptami  (07.06.2026)\n\nSamvatsaram: Parabhava Samvatsaram\nAyanam: Uttarayanam\nRuthuvu: Grishma Ruthuvu\nMasam: Jyeshthamu\nPaksham: Krishna Paksham\nTithi: upto 3.25 AM Saptami\, thereafter Ashtami\nVaram: Bhanuvaram\nNakshatram: upto 8.38 AM Dhanishta (4 Padam)\, and then Shatabhisham\nYogam: Vaidhriti\nKaranam: Vishti\nRahu Kalam: 5.10 PM to 6.48 PM\nYamagandam: 12.14 PM to 1.53 PM\nDurmuhurtham: 5.03 PM to 5.56 PM\nAbhijit Muhurtham: 11.48 AM to 12.41 PM\nSuryodayam: 5.40 AM\nSuryastamayam: 6.48 PM\nChandrodayam: N/A\nChandrashtamam: Karkatakam\nTaddinam Tithi: Saptami\nPradesham: Hyderabad (Telugu Style)
SUMMARY:Jyeshthamu Krishna Paksham Saptami  (07.06.2026)
UID:india-te-2026-06-07@panchangam
END:VEVENT
BEGIN:VEVENT
DTSTART;VALUE=DATE:20260717
CATEGORIES:PANCHANGAM
DESCRIPTION:Ashadhamu Shukla Paksham Thadiya  (17.07.2026)\n\nSamvatsaram: Parabhava Samvatsaram\nAyanam: Dakshinayanam\nRuthuvu: Grishma Ruthuvu\nMasam: Ashadhamu\nPaksham: Shukla Paksham\nTithi: upto 6.28 AM Thadiya\, upto 4.43 AM Chavithi\, thereafter Panchami\nVaram: Shukravaram\nNakshatram: upto 7.13 PM Makha (2 Padam)\, and then Pubba\nYogam: Vyatipata\nKaranam: Garajai\nRahu Kalam: 10.44 AM to 12.22 PM\nYamagandam: 3.37 PM to 5.15 PM\nDurmuhurtham: 8.27 AM to 9.19 AM\, 12.48 PM to 1.40 PM\nAbhijit Muhurtham: 11.56 AM to 12.48 PM\nSuryodayam: 5.50 AM\nSuryastamayam: 6.53 PM\nChandrodayam: 8.39 AM\nChandrashtamam: Makaram\nTaddinam Tithi: Chavithi\nPradesham: Hyderabad (Telugu Style)
SUMMARY:Ashadhamu Shukla Paksham Thadiya  (17.07.2026)
UID:india-te-2026-07-17@panchangam
END:VEVENT
BEGIN:VEVENT
DTSTART;VALUE=DATE:20260827
CATEGORIES:PANCHANGAM
DESCRIPTION:Sravanamu Shukla Paksham Chaturdashi  (27.08.2026)\n\nSamvatsaram: Parabhava Samvatsaram\nAyanam: Dakshinayanam\nRuthuvu: Varsha Ruthuvu\nMasam: Sravanamu\nPaksham: Shukla Paksham\nTithi: upto 9.09 AM Chaturdashi\, thereafter Pournami\nVaram: Guruvaram\nNakshatram: upto 2.57 AM Dhanishta (1 Padam)\, and then Shatabhisham\nYogam: Shobhana\nKaranam: Vanijai\nRahu Kalam: 1.51 PM to 3.25 PM\nYamagandam: 6.01 AM to 7.35 AM\nDurmuhurtham: 1.32 PM to 2.22 PM\nAbhijit Muhurtham: 11.52 AM to 12.42 PM\nSuryodayam: 6.01 AM\nSuryastamayam: 6.33 PM\nChandrodayam: 6.06 PM\nChandrashtamam: Mithunam\nTaddinam Tithi: Pournami\nPradesham: Hyderabad (Telugu Style)
SUMMARY:Sravanamu Shukla Paksham Chaturdashi  (27.08.2026)
UID:india-te-2026-08-27@panchangam
END:VEVENT
BEGIN:VEVENT
DTSTART;VALUE=DATE:20261201
CATEGORIES:PANCHANGAM
DESCRIPTION:Karthikamu Krishna Paksham Ashtami  (01.12.2026)\n\nSamvatsaram: Parabhava Samvatsaram\nAyanam: Dakshinayanam\nRuthuvu: Sarad Ruthuvu\nMasam: Karthikamu\nPaksham: Krishna Paksham\nTithi: upto 11.14 PM Ashtami\, thereafter Navami\nVaram: Mangalavaram\nNakshatram: upto 9.40 AM Makha (4 Padam)\, and then Pubba\nYogam: Vaidhriti\nKaranam: Balavai\nRahu Kalam: 2.52 PM to 4.16 PM\nYamagandam: 9.17 AM to 10.41 AM\nDurmuhurtham: 7.59 AM to 8.43 AM\, 10.57 AM to 11.42 AM\nAbhijit Muhurtham: 11.42 AM to 12.27 PM\nSuryodayam: 6.29 AM\nSuryastamayam: 5.39 PM\nChandrodayam: N/A\nChandrashtamam: Makaram\nTaddinam Tithi: Ashtami\nPradesham: Hyderabad (Telugu Style)
SUMMARY:Karthikamu Krishna Paksham Ashtami  (01.12.2026)
UID:india-te-2026-12-01@panchangam
END:VEVENT
BEGIN:VEVENT
DTSTART;VALUE=DATE:20260126
CATEGORIES:PANCHANGAM
DESCRIPTION:Maghamu Shukla Paksham Ashtami  (26.01.2026)\n\nSamvatsaram: Vishvavasu Samvatsaram\nAyanam: Uttarayanam\nRuthuvu: Shishira Ruthuvu\nMasam: Maghamu\nPaksham: Shukla Paksham\nTithi: upto 9.18 PM Ashtami\, thereafter Navami\nVaram: Somavaram\nNakshatram: upto 1.10 PM Aswini (3 Padam)\, and then Bharani\nYogam: Sadhya\nKaranam: Vishti\nRahu Kalam: 8.14 AM to 9.38 AM\nYamagandam: 11.03 AM to 12.28 PM\nDurmuhurtham: 12.51 PM to 1.36 PM\nAbhijit Muhurtham: 12.05 PM to 12.51 PM\nSuryodayam: 6.49 AM\nSuryastamayam: 6.08 PM\nChandrodayam: 11.45 AM\nChandrashtamam: Kanya\nTaddinam Tithi: Ashtami\nPradesham: Hyderabad (Telugu Style)
SUMMARY:Maghamu Shukla Paksham Ashtami  (26.01.2026)
UID:india-te-2026-01-26@panchangam
END:VEVENT
BEGIN:VEVENT
DTSTART;VALUE=DATE:20260405
CATEGORIES:PANCHANGAM
DESCRIPTION:Chaitramu Krishna Paksham Thadiya  (05.04.2026)\n\n🎉 SPECIAL: Sankatahara Chathurthi\nSamvatsaram: Parabhava Samvatsaram\nAyanam: Uttarayanam\nRuthuvu: Vasantha Ruthuvu\nMasam: Chaitramu\nPaksham: Krishna Paksham\nTithi: upto 12 Noon Thadiya\, thereafter Chavithi\nVaram: Bhanuvaram\nNakshatram: upto 12.52 AM Vishakha (2 Padam)\, and then Anuradha\nYogam: Vajra\nKaranam: Vishti\nRahu Kalam: 4.57 PM to 6.30 PM\nYamagandam: 12.18 PM to 1.51 PM\nDurmuhurtham: 4.51 PM to 5.40 PM\nAbhijit Muhurtham: 11.54 AM to 12.43 PM\nSuryodayam: 6.07 AM\nSuryastamayam: 6.30 PM\nChandrodayam: 9.24 PM\nChandrashtamam: Meenam\nTaddinam Tithi: Chavithi\nPradesham: Hyderabad (Telugu Style)
SUMMARY:Chaitramu Krishna Paksham Thadiya  (05.04.2026)
UID:india-te-2026-04-05@panchangam
END:VEVENT
BEGIN:VEVENT
DTSTART;VALUE=DATE:20260515
CATEGORIES:PANCHANGAM
DESCRIPTION:Vaishakhamu Krishna Paksham Trayodashi  (15.05.2026)\n\nSamvatsaram: Parabhava Samvatsaram\nAyanam: Uttarayanam\nRuthuvu: Vasantha Ruthuvu\nMasam: Vaishakhamu\nPaksham: Krishna Paksham\nTithi: upto 8.31 AM Trayodashi\, upto 5.11 AM Chaturdashi\, thereafter Amavasya\nVaram: Shukravaram\nNakshatram: upto 8.50 PM Aswini (2 Padam)\, and then Bharani\nYogam: Aayushman\nKaranam: Vanijai\nRahu Kalam: 10.35 AM to 12.12 PM\nYamagandam: 3.26 PM to 5.03 PM\nDurmuhurtham: 8.19 AM to 9.11 AM\, 12.38 PM to 1.30 PM\nAbhijit Muhurtham: 11.46 AM to 12.38 PM\nSuryodayam: 5.44 AM\nSuryastamayam: 6.40 PM\nChandrodayam: 4.05 AM\nChandrashtamam: Kanya\nTaddinam Tithi: Chaturdashi\nPradesham: Hyderabad (Telugu Style)
SUMMARY:Vaishakhamu Krishna Paksham Trayodashi  (15.05.2026)
UID:india-te-2026-05-15@panchangam
END:VEVENT
BEGIN:VEVENT
DTSTART;VALUE=DATE:20260625
CATEGORIES:PANCHANGAM
DESCRIPTION:Jyeshthamu Shukla Paksham Ekadashi  (25.06.2026)\n\n🎉 SPECIAL: Ekadashi (Shukla)\nSamvatsaram: Parabhava Samvatsaram\nAyanam: Dakshinayanam\nRuthuvu: Grishma Ruthuvu\nMasam: Jyeshthamu\nPaksham: Shukla Paksham\nTithi: upto 8.09 PM Ekadashi\, thereafter Dwadashi\nVaram: Guruvaram\nNakshatram: upto 5.13 PM Swathi (3 Padam)\, and then Vishakha\nYogam: Shiva\nKaranam: Vanijai\nRahu Kalam: 1.57 PM to 3.36 PM\nYamagandam: 5.43 AM to 7.22 AM\nDurmuhurtham: 1.37 PM to 2.30 PM\nAbhijit Muhurtham: 11.52 AM to 12.45 PM\nSuryodayam: 5.43 AM\nSuryastamayam: 6.53 PM\nChandrodayam: 3.08 PM\nChandrashtamam: Meenam\nTaddinam Tithi: Ekadashi\nPradesham: Hyderabad (Telugu Style)
SUMMARY:Jyeshthamu Shukla Paksham Ekadashi  (25.06.2026)
UID:india-te-2026-06-25@panchangam
END:VEVENT
BEGIN:VEVENT
DTSTART;VALUE=DATE:20260904
CATEGORIES:PANCHANGAM
DESCRIPTION:Sravanamu Krishna Paksham Ashtami  (04.09.2026)\n\nSamvatsaram: Parabhava Samvatsaram\nAyanam: Dakshinayanam\nRuthuvu: Varsha Ruthuvu\nMasam: Sravanamu\nPaksham: Krishna Paksham\nTithi: upto 12.14 AM Ashtami\, thereafter Navami\nVaram: Shukravaram\nNakshatram: upto 11.42 PM Rohini (1 Padam)\, and then Mrigashira\nYogam: Harshana\nKaranam: Balavai\nRahu Kalam: 10.41 AM to 12.15 PM\nYamagandam: 3.21 PM to 4.54 PM\nDurmuhurtham: 8.31 AM to 9.21 AM\, 12.39 PM to 1.29 PM\nAbhijit Muhurtham: 11.50 AM to 12.39 PM\nSuryodayam: 6.02 AM\nSuryastamayam: 6.27 PM\nChandrodayam: 11.50 PM\nChandrashtamam: Thula\nTaddinam Tithi: Ashtami\nPradesham: Hyderabad (Telugu Style)
SUMMARY:Sravanamu Krishna Paksham Ashtami  (04.09.2026)
UID:india-te-2026-09-04@panchangam
END:VEVENT
BEGIN:VEVENT
DTSTART;VALUE=DATE:20261208
CATEGORIES:PANCHANGAM
DESCRIPTION:Karthikamu Krishna Paksham Amavasya 🌑 (08.12.2026)\n\nSamvatsaram: Parabhava Samvatsaram\nAyanam: Dakshinayanam\nRuthuvu: Sarad Ruthuvu\nMasam: Karthikamu\nPaksham: Krishna Paksham\nTithi: upto 6.21 AM Amavasya\, thereafter Padyami\nVaram: Mangalavaram\nNakshatram: upto 7.01 PM Anuradha (3 Padam)\, and then Jyeshta\nYogam: Sukarman\nKaranam: Chatushpada\nRahu Kalam: 2.54 PM to 4.18 PM\nYamagandam: 9.20 AM to 10.44 AM\nDurmuhurtham: 8.03 AM to 8.47 AM\, 11.01 AM to 11.45 AM\nAbhijit Muhurtham: 11.45 AM to 12.30 PM\nSuryodayam: 6.34 AM\nSuryastamayam: 5.41 PM\nChandrodayam: 5.52 AM\nChandrashtamam: Mesham\nTaddinam Tithi: Amavasya\nPradesham: Hyderabad (Telugu Style)
SUMMARY:Karthikamu Krishna Paksham Amavasya 🌑 (08.12.2026)
UID:india-te-2026-12-08@panchangam
END:VEVENT
BEGIN:VEVENT
DTSTART;VALUE=DATE:20260203
CATEGORIES:PANCHANGAM
DESCRIPTION:Maghamu Krishna Paksham Vidiya  (03.02.2026)\n\nSamvatsaram: Vishvavasu Samvatsaram\nAyanam: Uttarayanam\nRuthuvu: Shishira Ruthuvu\nMasam: Maghamu\nPaksham: Krishna Paksham\nTithi: upto 12.41 AM Vidiya\, thereafter Thadiya\nVaram: Mangalavaram\nNakshatram: upto 10.49 PM Makha (2 Padam)\, and then Pubba\nYogam: Shobhana\nKaranam: Thaitilai\nRahu Kalam: 3.21 PM to 4.46 PM\nYamagandam: 9.38 AM to 11.04 AM\nDurmuhurtham: 8.18 AM to 9.04 AM\, 11.21 AM to 12.07 PM\nAbhijit Muhurtham: 12.07 PM to 12.52 PM\nSuryodayam: 6.47 AM\nSuryastamayam: 6.12 PM\nChandrodayam: 7.42 PM\nChandrashtamam: Makaram\nTaddinam Tithi: Vidiya\nPradesham: Hyderabad (Telugu Style)
SUMMARY:Maghamu Krishna Paksham Vidiya  (03.02.2026)
UID:india-te-2026-02-03@panchangam
END:VEVENT
BEGIN:VEVENT
DTSTART;VALUE=DATE:20260313
CATEGORIES:PANCHANGAM
DESCRIPTION:Phalgunamu Krishna Paksham Navami  (13.03.2026)\n\nSamvatsaram: Vishvavasu Samvatsaram\nAyanam: Uttarayanam\nRuthuvu: Shishira Ruthuvu\nMasam: Phalgunamu\nPaksham: Krishna Paksham\nTithi: upto 6.29 AM Navami\, thereafter Dashami\nVaram: Shukravaram\nNakshatram: upto 3.46 AM Poorvashada (1 Padam)\, and then Uttarashada\nYogam: Vyatipata\nKaranam: Garajai\nRahu Kalam: 10.55 AM to 12.25 PM\nYamagandam: 3.25 PM to 4.55 PM\nDurmuhurtham: 8.49 AM to 9.37 AM\, 12.49 PM to 1.37 PM\nAbhijit Muhurtham: 12.01 PM to 12.49 PM\nSuryodayam: 6.25 AM\nSuryastamayam: 6.25 PM\nChandrodayam: 2.11 AM\nChandrashtamam: Vrushabham\nTaddinam Tithi: Dashami\nPradesham: Hyderabad (Telugu Style)
SUMMARY:Phalgunamu Krishna Paksham Navami  (13.03.2026)
UID:india-te-2026-03-13@panchangam
END:VEVENT
BEGIN:VEVENT
DTSTART;VALUE=DATE:20260423
CATEGORIES:PANCHANGAM
DESCRIPTION:Vaishakhamu Shukla Paksham Saptami  (23.04.2026)\n\nSamvatsaram: Parabhava Samvatsaram\nAyanam: Uttarayanam\nRuthuvu: Vasantha Ruthuvu\nMasam: Vaishakhamu\nPaksham: Shukla Paksham\nTithi: upto 8.49 PM Saptami\, thereafter Ashtami\nVaram: Guruvaram\nNakshatram: upto 9.35 PM Punarvasu (2 Padam)\, and then Pushyami\nYogam: Sukarman\nKaranam: Garajai\nRahu Kalam: 1.49 PM to 3.24 PM\nYamagandam: 5.54 AM to 7.29 AM\nDurmuhurtham: 1.30 PM to 2.21 PM\nAbhijit Muhurtham: 11.49 AM to 12.39 PM\nSuryodayam: 5.54 AM\nSuryastamayam: 6.34 PM\nChandrodayam: 11.16 AM\nChandrashtamam: Vrushchikam\nTaddinam Tithi: Saptami\nPradesham: Hyderabad (Telugu Style)
SUMMARY:Vaishakhamu Shukla Paksham Saptami  (23.04.2026)
UID:india-te-2026-04-23@panchangam
END:VEVENT
BEGIN:VEVENT
BEGIN:VALARM
ACTION:DISPLAY
DESCRIPTION:
TRIGGER:-P1D
END:VALARM
CATEGORIES:VRATAM
DESCRIPTION:Astronomical duration of Ekadashi (Krishna).
DTEND:20260809T053532Z
DTSTART:20260808T082946Z
SUMMARY:⏳ Ekadashi (Krishna)
UID:india-te-202608081359-Ekadashi(Krishna)@vratam
END:VEVENT
BEGIN:VEVENT
DTSTART;VALUE=DATE:20260702
CATEGORIES:PANCHANGAM
DESCRIPTION:Jyeshthamu Krishna Paksham Vidiya  (02.07.2026)\n\nSamvatsaram: Parabhava Samvatsaram\nAyanam: Dakshinayanam\nRuthuvu: Grishma Ruthuvu\nMasam: Jyeshthamu\nPaksham: Krishna Paksham\nTithi: upto 9.38 AM Vidiya\, thereafter Thadiya\nVaram: Guruvaram\nNakshatram: upto 10.11 AM Uttarashada (4 Padam)\, and then Shravana\nYogam: Vaidhriti\nKaranam: Garajai\nRahu Kalam: 1.58 PM to 3.37 PM\nYamagandam: 5.45 AM to 7.24 AM\nDurmuhurtham: 1.38 PM to 2.31 PM\nAbhijit Muhurtham: 11.53 AM to 12.46 PM\nSuryodayam: 5.45 AM\nSuryastamayam: 6.54 PM\nChandrodayam: 8.52 PM\nChandrashtamam: Mithunam\nTaddinam Tithi: Thadiya\nPradesham: Hyderabad (Telugu Style)
SUMMARY:Jyeshthamu Krishna Paksham Vidiya  (02.07.2026)
UID:india-te-2026-07-02@panchangam
END:VEVENT
BEGIN:VEVENT
DTSTART;VALUE=DATE:20260812
CATEGORIES:PANCHANGAM
DESCRIPTION:Sravanamu Krishna Paksham Amavasya 🌑 (12.08.2026)\n\nSamvatsaram: Parabhava Samvatsaram\nAyanam: Dakshinayanam\nRuthuvu: Varsha Ruthuvu\nMasam: Sravanamu\nPaksham: Krishna Paksham\nTithi: upto 11.06 PM Amavasya\, thereafter Padyami\nVaram: Budhavaram\nNakshatram: upto 8.36 AM Pushyami (4 Padam)\, and then Ashlesha\nYogam: Vyatipata\nKaranam: Chatushpada\nRahu Kalam: 12.21 PM to 1.56 PM\nYamagandam: 7.33 AM to 9.09 AM\nDurmuhurtham: 10.13 AM to 11.04 AM\nAbhijit Muhurtham: 11.55 AM to 12.46 PM\nSuryodayam: 5.58 AM\nSuryastamayam: 6.43 PM\nChandrodayam: 5.19 AM\nChandrashtamam: Dhanu\nTaddinam Tithi: Amavasya\nPradesham: Hyderabad (Telugu Style)
SUMMARY:Sravanamu Krishna Paksham Amavasya 🌑 (12.08.2026)
UID:india-te-2026-08-12@panchangam
END:VEVENT
BEGIN:VEVENT
BEGIN:VALARM
ACTION:DISPLAY
DESCRIPTION:
TRIGGER:-P1D
END:VALARM
CATEGORIES:VRATAM
DESCRIPTION:Astronomical duration of Sashti (Shukla).
DTEND:20260124T191026Z
DTSTART:20260123T201631Z
SUMMARY:⏳ Sashti (Shukla)
UID:india-te-202601240146-Sashti(Shukla)@vratam
END:VEVENT
BEGIN:VEVENT
DTSTART;VALUE=DATE:20260922
CATEGORIES:PANCHANGAM
DESCRIPTION:Bhadrapadamu Shukla Paksham Ekadashi  (22.09.2026)\n\n🎉 SPECIAL: Ekadashi (Shukla)\nSamvatsaram: Parabhava Samvatsaram\nAyanam: Dakshinayanam\nRuthuvu: Varsha Ruthuvu\nMasam: Bhadrapadamu\nPaksham: Shukla Paksham\nTithi: upto 9.43 PM Ekadashi\, thereafter Dwadashi\nVaram: Mangalavaram\nNakshatram: upto 7.51 AM Uttarashada (4 Padam)\, and then Shravana\nYogam: Atiganda\nKaranam: Vanijai\nRahu Kalam: 3.10 PM to 4.41 PM\nYamagandam: 9.06 AM to 10.37 AM\nDurmuhurtham: 7.41 AM to 8.30 AM\, 10.55 AM to 11.44 AM\nAbhijit Muhurtham: 11.44 AM to 12.32 PM\nSuryodayam: 6.04 AM\nSuryastamayam: 6.12 PM\nChandrodayam: 3.24 PM\nChandrashtamam: Mithunam\nTaddinam Tithi: Ekadashi\nPradesham: Hyderabad (Telugu Style)
SUMMARY:Bhadrapadamu Shukla Paksham Ekadashi  (22.09.2026)
UID:india-te-2026-09-22@panchangam
END:VEVENT
BEGIN:VEVENT
BEGIN:VALARM
ACTION:DISPLAY
DESCRIPTION:
TRIGGER:-P1D
END:VALARM
CATEGORIES:VRATAM
DESCRIPTION:Astronomical duration of Pradosham (Shukla).
DTEND:20261024T080722Z
DTSTART:20261023T090625Z
SUMMARY:⏳ Pradosham (Shukla)
UID:india-te-202610231436-Pradosham(Shukla)@vratam
END:VEVENT
BEGIN:VEVENT
DTSTART;VALUE=DATE:20261006
CATEGORIES:PANCHANGAM
DESCRIPTION:Bhadrapadamu Krishna Paksham Ekadashi  (06.10.2026)\n\n🎉 SPECIAL: Ekadashi (Krishna)\nSamvatsaram: Parabhava Samvatsaram\nAyanam: Dakshinayanam\nRuthuvu: Varsha Ruthuvu\nMasam: Bhadrapadamu\nPaksham: Krishna Paksham\nTithi: upto 12.35 AM Ekadashi\, thereafter Dwadashi\nVaram: Mangalavaram\nNakshatram: upto 10.56 PM Ashlesha (2 Padam)\, and then Makha\nYogam: Siddha\nKaranam: Bavai\nRahu Kalam: 3.02 PM to 4.31 PM\nYamagandam: 9.05 AM to 10.34 AM\nDurmuhurtham: 7.42 AM to 8.29 AM\, 10.52 AM to 11.40 AM\nAbhijit Muhurtham: 11.40 AM to 12.27 PM\nSuryodayam: 6.07 AM\nSuryastamayam: 6.01 PM\nChandrodayam: 1.57 AM\nChandrashtamam: Dhanu\nTaddinam Tithi: Ekadashi\nPradesham: Hyderabad (Telugu Style)
SUMMARY:Bhadrapadamu Krishna Paksham Ekadashi  (06.10.2026)
UID:india-te-2026-10-06@panchangam
END:VEVENT
BEGIN:VEVENT
DTSTART;VALUE=DATE:20261116
CATEGORIES:PANCHANGAM
DESCRIPTION:Karthikamu Shukla Paksham Saptami  (16.11.2026)\n\nSamvatsaram: Parabhava Samvatsaram\nAyanam: Dakshinayanam\nRuthuvu: Sarad Ruthuvu\nMasam: Karthikamu\nPaksham: Shukla Paksham\nTithi: upto 4.20 AM Saptami\, thereafter Ashtami\nVaram: Somavaram\nNakshatram: upto 3.02 AM Shravana (1 Padam)\, and then Dhanishta\nYogam: Ganda\nKaranam: Garajai\nRahu Kalam: 7.46 AM to 9.11 AM\nYamagandam: 10.35 AM to 12 Noon\nDurmuhurtham: 12.23 PM to 1.08 PM\nAbhijit Muhurtham: 11.38 AM to 12.23 PM\nSuryodayam: 6.21 AM\nSuryastamayam: 5.40 PM\nChandrodayam: 11.53 AM\nChandrashtamam: Mithunam\nTaddinam Tithi: Saptami\nPradesham: Hyderabad (Telugu Style)
SUMMARY:Karthikamu Shukla Paksham Saptami  (16.11.2026)
UID:india-te-2026-11-16@panchangam
END:VEVENT
BEGIN:VEVENT
BEGIN:VALARM
ACTION:DISPLAY
DESCRIPTION:
TRIGGER:-P1D
END:VALARM
CATEGORIES:VRATAM
DESCRIPTION:Astronomical duration of Sankatahara Chathurthi.
DTEND:20260604T180057Z
DTSTART:20260603T155145Z
SUMMARY:⏳ Sankatahara Chathurthi
UID:india-te-202606032121-SankataharaChathurthi@vratam
END:VEVENT
BEGIN:VEVENT
DTSTART;VALUE=DATE:20260111
CATEGORIES:PANCHANGAM
DESCRIPTION:Pushyamu Krishna Paksham Ashtami  (11.01.2026)\n\nSamvatsaram: Vishvavasu Samvatsaram\nAyanam: Uttarayanam\nRuthuvu: Hemantha Ruthuvu\nMasam: Pushyamu\nPaksham: Krishna Paksham\nTithi: upto 10.20 AM Ashtami\, thereafter Navami\nVaram: Bhanuvaram\nNakshatram: upto 6.56 PM Chitta (3 Padam)\, and then Swathi\nYogam: Sukarman\nKaranam: Kaulavai\nRahu Kalam: 4.35 PM to 5.59 PM\nYamagandam: 12.23 PM to 1.47 PM\nDurmuhurtham: 4.29 PM to 5.14 PM\nAbhijit Muhurtham: 12.01 PM to 12.46 PM\nSuryodayam: 6.48 AM\nSuryastamayam: 5.59 PM\nChandrodayam: 12.27 AM\nChandrashtamam: Meenam\nTaddinam Tithi: Navami\nPradesham: Hyderabad (Telugu Style)
SUMMARY:Pushyamu Krishna Paksham Ashtami  (11.01.2026)
UID:india-te-2026-01-11@panchangam
END:VEVENT
BEGIN:VEVENT
DTSTART;VALUE=DATE:20260221
CATEGORIES:PANCHANGAM
DESCRIPTION:Phalgunamu Shukla Paksham Chavithi  (21.02.2026)\n\nSamvatsaram: Vishvavasu Samvatsaram\nAyanam: Uttarayanam\nRuthuvu: Shishira Ruthuvu\nMasam: Phalgunamu\nPaksham: Shukla Paksham\nTithi: upto 1.01 PM Chavithi\, thereafter Panchami\nVaram: Shanivaram\nNakshatram: upto 7.44 PM Revathi (2 Padam)\, and then Aswini\nYogam: Shubha\nKaranam: Vishti\nRahu Kalam: 9.34 AM to 11.02 AM\nYamagandam: 1.57 PM to 3.24 PM\nDurmuhurtham: 6.39 AM to 7.26 AM\nAbhijit Muhurtham: 12.06 PM to 12.53 PM\nSuryodayam: 6.39 AM\nSuryastamayam: 6.19 PM\nChandrodayam: 9.03 AM\nChandrashtamam: Simham\nTaddinam Tithi: Panchami\nPradesham: Hyderabad (Telugu Style)
SUMMARY:Phalgunamu Shukla Paksham Chavithi  (21.02.2026)
UID:india-te-2026-02-21@panchangam
END:VEVENT
BEGIN:VEVENT
DTSTART;VALUE=DATE:20260331
CATEGORIES:PANCHANGAM
DESCRIPTION:Chaitramu Shukla Paksham Trayodashi  (31.03.2026)\n\nSamvatsaram: Vishvavasu Samvatsaram\nAyanam: Uttarayanam\nRuthuvu: Vasantha Ruthuvu\nMasam: Chaitramu\nPaksham: Shukla Paksham\nTithi: upto 6.56 AM Trayodashi\, thereafter Chaturdashi\nVaram: Mangalavaram\nNakshatram: upto 4.01 PM Pubba (3 Padam)\, and then Uttara\nYogam: Ganda\nKaranam: Thaitilai\nRahu Kalam: 3.24 PM to 4.56 PM\nYamagandam: 9.16 AM to 10.48 AM\nDurmuhurtham: 7.50 AM to 8.39 AM\, 11.06 AM to 11.55 AM\nAbhijit Muhurtham: 11.55 AM to 12.44 PM\nSuryodayam: 6.11 AM\nSuryastamayam: 6.29 PM\nChandrodayam: 5.07 PM\nChandrashtamam: Makaram\nTaddinam Tithi: Chaturdashi\nPradesham: Hyderabad (Telugu Style)
SUMMARY:Chaitramu Shukla Paksham Trayodashi  (31.03.2026)
UID:india-te-2026-03-31@panchangam
END:VEVENT
BEGIN:VEVENT
DTSTART;VALUE=DATE:20260610
CATEGORIES:PANCHANGAM
DESCRIPTION:Jyeshthamu Krishna Paksham Dashami  (10.06.2026)\n\nSamvatsaram: Parabhava Samvatsaram\nAyanam: Uttarayanam\nRuthuvu: Grishma Ruthuvu\nMasam: Jyeshthamu\nPaksham: Krishna Paksham\nTithi: upto 12.58 AM Dashami\, thereafter Ekadashi\nVaram: Budhavaram\nNakshatram: upto 10.00 AM Uttarabhadra (4 Padam)\, and then Revathi\nYogam: Aayushman\nKaranam: Vanijai\nRahu Kalam: 12.15 PM to 1.54 PM\nYamagandam: 7.19 AM to 8.58 AM\nDurmuhurtham: 10.04 AM to 10.56 AM\nAbhijit Muhurtham: 11.49 AM to 12.41 PM\nSuryodayam: 5.41 AM\nSuryastamayam: 6.49 PM\nChandrodayam: 1.17 AM\nChandrashtamam: Simham\nTaddinam Tithi: Dashami\nPradesham: Hyderabad (Telugu Style)
SUMMARY:Jyeshthamu Krishna Paksham Dashami  (10.06.2026)
UID:india-te-2026-06-10@panchangam
END:VEVENT
BEGIN:VEVENT
DTSTART;VALUE=DATE:20260720
CATEGORIES:PANCHANGAM
DESCRIPTION:Ashadhamu Shukla Paksham Saptami  (20.07.2026)\n\nSamvatsaram: Parabhava Samvatsaram\nAyanam: Dakshinayanam\nRuthuvu: Grishma Ruthuvu\nMasam: Ashadhamu\nPaksham: Shukla Paksham\nTithi: upto 4.03 AM Saptami\, thereafter Ashtami\nVaram: Somavaram\nNakshatram: upto 7.52 PM Hasta (2 Padam)\, and then Chitta\nYogam: Shiva\nKaranam: Garajai\nRahu Kalam: 7.29 AM to 9.06 AM\nYamagandam: 10.44 AM to 12.22 PM\nDurmuhurtham: 12.48 PM to 1.40 PM\nAbhijit Muhurtham: 11.56 AM to 12.48 PM\nSuryodayam: 5.51 AM\nSuryastamayam: 6.53 PM\nChandrodayam: 11.20 AM\nChandrashtamam: Kumbham\nTaddinam Tithi: Saptami\nPradesham: Hyderabad (Telugu Style)
SUMMARY:Ashadhamu Shukla Paksham Saptami  (20.07.2026)
UID:india-te-2026-07-20@panchangam
END:VEVENT
BEGIN:VEVENT
DTSTART;VALUE=DATE:20260830
CATEGORIES:PANCHANGAM
DESCRIPTION:Sravanamu Krishna Paksham Vidiya  (30.08.2026)\n\nSamvatsaram: Parabhava Samvatsaram\nAyanam: Dakshinayanam\nRuthuvu: Varsha Ruthuvu\nMasam: Sravanamu\nPaksham: Krishna Paksham\nTithi: upto 9.37 AM Vidiya\, thereafter Thadiya\nVaram: Bhanuvaram\nNakshatram: upto 4.24 AM Uttarabhadra (1 Padam)\, and then Revathi\nYogam: Dhruthi\nKaranam: Garajai\nRahu Kalam: 4.57 PM to 6.31 PM\nYamagandam: 12.16 PM to 1.50 PM\nDurmuhurtham: 4.51 PM to 5.41 PM\nAbhijit Muhurtham: 11.51 AM to 12.41 PM\nSuryodayam: 6.01 AM\nSuryastamayam: 6.31 PM\nChandrodayam: 7.54 PM\nChandrashtamam: Simham\nTaddinam Tithi: Thadiya\nPradesham: Hyderabad (Telugu Style)
SUMMARY:Sravanamu Krishna Paksham Vidiya  (30.08.2026)
UID:india-te-2026-08-30@panchangam
END:VEVENT
BEGIN:VEVENT
BEGIN:VALARM
ACTION:DISPLAY
DESCRIPTION:
TRIGGER:-P1D
END:VALARM
CATEGORIES:VRATAM
DESCRIPTION:Astronomical duration of Sashti (Shukla).
DTEND:20260522T005503Z
DTSTART:20260521T025708Z
SUMMARY:⏳ Sashti (Shukla)
UID:india-te-202605210827-Sashti(Shukla)@vratam
END:VEVENT
BEGIN:VEVENT
DTSTART;VALUE=DATE:20260709
CATEGORIES:PANCHANGAM
DESCRIPTION:Jyeshthamu Krishna Paksham Navami  (09.07.2026)\n\nSamvatsaram: Parabhava Samvatsaram\nAyanam: Dakshinayanam\nRuthuvu: Grishma Ruthuvu\nMasam: Jyeshthamu\nPaksham: Krishna Paksham\nTithi: upto 10.38 AM Navami\, thereafter Dashami\nVaram: Guruvaram\nNakshatram: upto 3.34 PM Aswini (3 Padam)\, and then Bharani\nYogam: Sukarman\nKaranam: Garajai\nRahu Kalam: 1.59 PM to 3.37 PM\nYamagandam: 5.47 AM to 7.26 AM\nDurmuhurtham: 1.39 PM to 2.32 PM\nAbhijit Muhurtham: 11.55 AM to 12.47 PM\nSuryodayam: 5.47 AM\nSuryastamayam: 6.54 PM\nChandrodayam: 12.33 AM\nChandrashtamam: Kanya\nTaddinam Tithi: Dashami\nPradesham: Hyderabad (Telugu Style)
SUMMARY:Jyeshthamu Krishna Paksham Navami  (09.07.2026)
UID:india-te-2026-07-09@panchangam
END:VEVENT
BEGIN:VEVENT
DTSTART;VALUE=DATE:20260819
CATEGORIES:PANCHANGAM
DESCRIPTION:Sravanamu Shukla Paksham Saptami  (19.08.2026)\n\nSamvatsaram: Parabhava Samvatsaram\nAyanam: Dakshinayanam\nRuthuvu: Varsha Ruthuvu\nMasam: Sravanamu\nPaksham: Shukla Paksham\nTithi: upto 7.19 PM Saptami\, thereafter Ashtami\nVaram: Budhavaram\nNakshatram: upto 7.30 AM Swathi (4 Padam)\, and then Vishakha\nYogam: Brahma\nKaranam: Garajai\nRahu Kalam: 12.19 PM to 1.54 PM\nYamagandam: 7.34 AM to 9.09 AM\nDurmuhurtham: 10.13 AM to 11.03 AM\nAbhijit Muhurtham: 11.54 AM to 12.44 PM\nSuryodayam: 5.59 AM\nSuryastamayam: 6.39 PM\nChandrodayam: 11.46 AM\nChandrashtamam: Meenam\nTaddinam Tithi: Saptami\nPradesham: Hyderabad (Telugu Style)
SUMMARY:Sravanamu Shukla Paksham Saptami  (19.08.2026)
UID:india-te-2026-08-19@panchangam
END:VEVENT
BEGIN:VEVENT
DTSTART;VALUE=DATE:20260929
CATEGORIES:PANCHANGAM
DESCRIPTION:Bhadrapadamu Krishna Paksham Thadiya  (29.09.2026)\n\n🎉 SPECIAL: Sankatahara Chathurthi\nSamvatsaram: Parabhava Samvatsaram\nAyanam: Dakshinayanam\nRuthuvu: Varsha Ruthuvu\nMasam: Bhadrapadamu\nPaksham: Krishna Paksham\nTithi: upto 5.10 PM Thadiya\, thereafter Chavithi\nVaram: Mangalavaram\nNakshatram: upto 9.41 AM Aswini (4 Padam)\, and then Bharani\nYogam: Vyaghata\nKaranam: Vanijai\nRahu Kalam: 3.06 PM to 4.36 PM\nYamagandam: 9.06 AM to 10.36 AM\nDurmuhurtham: 7.42 AM to 8.30 AM\, 10.54 AM to 11.42 AM\nAbhijit Muhurtham: 11.42 AM to 12.30 PM\nSuryodayam: 6.05 AM\nSuryastamayam: 6.06 PM\nChandrodayam: 7.56 PM\nChandrashtamam: Kanya\nTaddinam Tithi: Thadiya\nPradesham: Hyderabad (Telugu Style)
SUMMARY:Bhadrapadamu Krishna Paksham Thadiya  (29.09.2026)
UID:india-te-2026-09-29@panchangam
END:VEVENT
BEGIN:VEVENT
DTSTART;VALUE=DATE:20261024
CATEGORIES:PANCHANGAM
DESCRIPTION:Ashwayujamu Shukla Paksham Trayodashi  (24.10.2026)\n\nSamvatsaram: Parabhava Samvatsaram\nAyanam: Dakshinayanam\nRuthuvu: Sarad Ruthuvu\nMasam: Ashwayujamu\nPaksham: Shukla Paksham\nTithi: upto 1.37 PM Trayodashi\, thereafter Chaturdashi\nVaram: Shanivaram\nNakshatram: upto 9.11 PM Uttarabhadra (2 Padam)\, and then Revathi\nYogam: Vyaghata\nKaranam: Thaitilai\nRahu Kalam: 9.05 AM to 10.33 AM\nYamagandam: 1.27 PM to 2.54 PM\nDurmuhurtham: 6.11 AM to 6.58 AM\nAbhijit Muhurtham: 11.36 AM to 12.23 PM\nSuryodayam: 6.11 AM\nSuryastamayam: 5.48 PM\nChandrodayam: 4.24 PM\nChandrashtamam: Simham\nTaddinam Tithi: Chaturdashi\nPradesham: Hyderabad (Telugu Style)
SUMMARY:Ashwayujamu Shukla Paksham Trayodashi  (24.10.2026)
UID:india-te-2026-10-24@panchangam
END:VEVENT
BEGIN:VEVENT
BEGIN:VALARM
ACTION:DISPLAY
DESCRIPTION:
TRIGGER:-P1D
END:VALARM
CATEGORIES:VRATAM
DESCRIPTION:Astronomical duration of Sashti (Shukla).
DTEND:20261115T203140Z
DTSTART:20261114T175429Z
SUMMARY:⏳ Sashti (Shukla)
UID:india-te-202611142324-Sashti(Shukla)@vratam
END:VEVENT
BEGIN:VEVENT
BEGIN:VALARM
ACTION:DISPLAY
DESCRIPTION:
TRIGGER:-P1D
END:VALARM
CATEGORIES:VRATAM
DESCRIPTION:Astronomical duration of Sankatahara Chathurthi.
DTEND:20261128T011022Z
DTSTART:20261127T041902Z
SUMMARY:⏳ Sankatahara Chathurthi
UID:india-te-202611270949-SankataharaChathurthi@vratam
END:VEVENT
BEGIN:VEVENT
DTSTART;VALUE=DATE:20260118
CATEGORIES:PANCHANGAM
DESCRIPTION:Maghamu Krishna Paksham Amavasya 🌑 (18.01.2026)\n\nSamvatsaram: Vishvavasu Samvatsaram\nAyanam: Uttarayanam\nRuthuvu: Shishira Ruthuvu\nMasam: Maghamu\nPaksham: Krishna Paksham\nTithi: upto 1.21 AM Amavasya\, thereafter Padyami\nVaram: Bhanuvaram\nNakshatram: upto 10.56 AM Poorvashada (4 Padam)\, and then Uttarashada\nYogam: Harshana\nKaranam: Chatushpada\nRahu Kalam: 4.39 PM to 6.03 PM\nYamagandam: 12.26 PM to 1.50 PM\nDurmuhurtham: 4.33 PM to 5.18 PM\nAbhijit Muhurtham: 12.03 PM to 12.48 PM\nSuryodayam: 6.49 AM\nSuryastamayam: 6.03 PM\nChandrodayam: 6.27 AM\nChandrashtamam: Vrushabham\nTaddinam Tithi: Amavasya\nPradesham: Hyderabad (Telugu Style)
SUMMARY:Maghamu Krishna Paksham Amavasya 🌑 (18.01.2026)
UID:india-te-2026-01-18@panchangam
END:VEVENT
BEGIN:VEVENT
DTSTART;VALUE=DATE:20260228
CATEGORIES:PANCHANGAM
DESCRIPTION:Phalgunamu Shukla Paksham Dwadashi  (28.02.2026)\n\nSamvatsaram: Vishvavasu Samvatsaram\nAyanam: Uttarayanam\nRuthuvu: Shishira Ruthuvu\nMasam: Phalgunamu\nPaksham: Shukla Paksham\nTithi: upto 8.43 PM Dwadashi\, thereafter Trayodashi\nVaram: Shanivaram\nNakshatram: upto 10.12 AM Punarvasu (4 Padam)\, and then Pushyami\nYogam: Saubhagya\nKaranam: Bavai\nRahu Kalam: 9.31 AM to 11.00 AM\nYamagandam: 1.57 PM to 3.25 PM\nDurmuhurtham: 6.35 AM to 7.22 AM\nAbhijit Muhurtham: 12.05 PM to 12.52 PM\nSuryodayam: 6.35 AM\nSuryastamayam: 6.22 PM\nChandrodayam: 3.30 PM\nChandrashtamam: Dhanu\nTaddinam Tithi: Dwadashi\nPradesham: Hyderabad (Telugu Style)
SUMMARY:Phalgunamu Shukla Paksham Dwadashi  (28.02.2026)
UID:india-te-2026-02-28@panchangam
END:VEVENT
BEGIN:VEVENT
BEGIN:VALARM
ACTION:DISPLAY
DESCRIPTION:
TRIGGER:-P1D
END:VALARM
CATEGORIES:VRATAM
DESCRIPTION:Astronomical duration of Sashti (Shukla).
DTEND:20251226T081402Z
DTSTART:20251225T081313Z
SUMMARY:⏳ Sashti (Shukla)
UID:india-te-202512251343-Sashti(Shukla)@vratam
END:VEVENT
BEGIN:VEVENT
DTSTART;VALUE=DATE:20260507
CATEGORIES:PANCHANGAM
DESCRIPTION:Vaishakhamu Krishna Paksham Panchami  (07.05.2026)\n\nSamvatsaram: Parabhava Samvatsaram\nAyanam: Uttarayanam\nRuthuvu: Vasantha Ruthuvu\nMasam: Vaishakhamu\nPaksham: Krishna Paksham\nTithi: upto 10.14 AM Panchami\, thereafter Shashti\nVaram: Guruvaram\nNakshatram: upto 7.30 PM Poorvashada (2 Padam)\, and then Uttarashada\nYogam: Sadhya\nKaranam: Thaitilai\nRahu Kalam: 1.49 PM to 3.25 PM\nYamagandam: 5.47 AM to 7.23 AM\nDurmuhurtham: 1.29 PM to 2.21 PM\nAbhijit Muhurtham: 11.47 AM to 12.38 PM\nSuryodayam: 5.47 AM\nSuryastamayam: 6.38 PM\nChandrodayam: 11.31 PM\nChandrashtamam: Vrushabham\nTaddinam Tithi: Shashti\nPradesham: Hyderabad (Telugu Style)
SUMMARY:Vaishakhamu Krishna Paksham Panchami  (07.05.2026)
UID:india-te-2026-05-07@panchangam
END:VEVENT
BEGIN:VEVENT
DTSTART;VALUE=DATE:20260617
CATEGORIES:PANCHANGAM
DESCRIPTION:Jyeshthamu Shukla Paksham Thadiya  (17.06.2026)\n\nSamvatsaram: Parabhava Samvatsaram\nAyanam: Uttarayanam\nRuthuvu: Grishma Ruthuvu\nMasam: Jyeshthamu\nPaksham: Shukla Paksham\nTithi: upto 9.39 PM Thadiya\, thereafter Chavithi\nVaram: Budhavaram\nNakshatram: upto 2.13 PM Punarvasu (3 Padam)\, and then Pushyami\nYogam: Dhruva\nKaranam: Thaitilai\nRahu Kalam: 12.16 PM to 1.55 PM\nYamagandam: 7.20 AM to 8.59 AM\nDurmuhurtham: 10.05 AM to 10.57 AM\nAbhijit Muhurtham: 11.50 AM to 12.43 PM\nSuryodayam: 5.41 AM\nSuryastamayam: 6.51 PM\nChandrodayam: 7.49 AM\nChandrashtamam: Vrushchikam\nTaddinam Tithi: Thadiya\nPradesham: Hyderabad (Telugu Style)
SUMMARY:Jyeshthamu Shukla Paksham Thadiya  (17.06.2026)
UID:india-te-2026-06-17@panchangam
END:VEVENT
BEGIN:VEVENT
DTSTART;VALUE=DATE:20260727
CATEGORIES:PANCHANGAM
DESCRIPTION:Ashadhamu Shukla Paksham Trayodashi  (27.07.2026)\n\nSamvatsaram: Parabhava Samvatsaram\nAyanam: Dakshinayanam\nRuthuvu: Grishma Ruthuvu\nMasam: Ashadhamu\nPaksham: Shukla Paksham\nTithi: upto 4.15 PM Trayodashi\, thereafter Chaturdashi\nVaram: Somavaram\nNakshatram: upto 11.13 AM Moola (4 Padam)\, and then Poorvashada\nYogam: Vaidhriti\nKaranam: Thaitilai\nRahu Kalam: 7.30 AM to 9.08 AM\nYamagandam: 10.45 AM to 12.22 PM\nDurmuhurtham: 12.48 PM to 1.40 PM\nAbhijit Muhurtham: 11.56 AM to 12.48 PM\nSuryodayam: 5.53 AM\nSuryastamayam: 6.51 PM\nChandrodayam: 5.22 PM\nChandrashtamam: Vrushabham\nTaddinam Tithi: Trayodashi\nPradesham: Hyderabad (Telugu Style)
SUMMARY:Ashadhamu Shukla Paksham Trayodashi  (27.07.2026)
UID:india-te-2026-07-27@panchangam
END:VEVENT
BEGIN:VEVENT
DTSTART;VALUE=DATE:20261101
CATEGORIES:PANCHANGAM
DESCRIPTION:Ashwayujamu Krishna Paksham Saptami  (01.11.2026)\n\nSamvatsaram: Parabhava Samvatsaram\nAyanam: Dakshinayanam\nRuthuvu: Sarad Ruthuvu\nMasam: Ashwayujamu\nPaksham: Krishna Paksham\nTithi: upto 2.52 PM Saptami\, thereafter Ashtami\nVaram: Bhanuvaram\nNakshatram: upto 6.18 AM Punarvasu (4 Padam)\, upto 5.09 AM Pushyami\, and then Ashlesha\nYogam: Sadhya\nKaranam: Bavai\nRahu Kalam: 4.18 PM to 5.44 PM\nYamagandam: 11.59 AM to 1.25 PM\nDurmuhurtham: 4.12 PM to 4.58 PM\nAbhijit Muhurtham: 11.36 AM to 12.22 PM\nSuryodayam: 6.14 AM\nSuryastamayam: 5.44 PM\nChandrodayam: 11.52 PM\nChandrashtamam: Dhanu\nTaddinam Tithi: Saptami\nPradesham: Hyderabad (Telugu Style)
SUMMARY:Ashwayujamu Krishna Paksham Saptami  (01.11.2026)
UID:india-te-2026-11-01@panchangam
END:VEVENT
BEGIN:VEVENT
DTSTART;VALUE=DATE:20261211
CATEGORIES:PANCHANGAM
DESCRIPTION:Margashiramu Shukla Paksham Vidiya  (11.12.2026)\n\nSamvatsaram: Parabhava Samvatsaram\nAyanam: Dakshinayanam\nRuthuvu: Hemantha Ruthuvu\nMasam: Margashiramu\nPaksham: Shukla Paksham\nTithi: upto 11.23 AM Vidiya\, thereafter Thadiya\nVaram: Shukravaram\nNakshatram: upto 3.50 AM Poorvashada (1 Padam)\, and then Uttarashada\nYogam: Ganda\nKaranam: Kaulavai\nRahu Kalam: 10.45 AM to 12.09 PM\nYamagandam: 2.55 PM to 4.19 PM\nDurmuhurtham: 8.49 AM to 9.33 AM\, 12.31 PM to 1.15 PM\nAbhijit Muhurtham: 11.46 AM to 12.31 PM\nSuryodayam: 6.35 AM\nSuryastamayam: 5.42 PM\nChandrodayam: 8.26 AM\nChandrashtamam: Vrushabham\nTaddinam Tithi: Thadiya\nPradesham: Hyderabad (Telugu Style)
SUMMARY:Margashiramu Shukla Paksham Vidiya  (11.12.2026)
UID:india-te-2026-12-11@panchangam
END:VEVENT
BEGIN:VEVENT
DTSTART;VALUE=DATE:20260305
CATEGORIES:PANCHANGAM
DESCRIPTION:Phalgunamu Krishna Paksham Vidiya  (05.03.2026)\n\nSamvatsaram: Vishvavasu Samvatsaram\nAyanam: Uttarayanam\nRuthuvu: Shishira Ruthuvu\nMasam: Phalgunamu\nPaksham: Krishna Paksham\nTithi: upto 5.04 PM Vidiya\, thereafter Thadiya\nVaram: Guruvaram\nNakshatram: upto 8.58 AM Uttara (4 Padam)\, and then Hasta\nYogam: Shoola\nKaranam: Garajai\nRahu Kalam: 1.56 PM to 3.25 PM\nYamagandam: 6.31 AM to 8.00 AM\nDurmuhurtham: 1.38 PM to 2.26 PM\nAbhijit Muhurtham: 12.03 PM to 12.51 PM\nSuryodayam: 6.31 AM\nSuryastamayam: 6.23 PM\nChandrodayam: 8.06 PM\nChandrashtamam: Kumbham\nTaddinam Tithi: Vidiya\nPradesham: Hyderabad (Telugu Style)
SUMMARY:Phalgunamu Krishna Paksham Vidiya  (05.03.2026)
UID:india-te-2026-03-05@panchangam
END:VEVENT
BEGIN:VEVENT
DTSTART;VALUE=DATE:20260415
CATEGORIES:PANCHANGAM
DESCRIPTION:Chaitramu Krishna Paksham Trayodashi  (15.04.2026)\n\n🎉 SPECIAL: Pradosham (Krishna)\nSamvatsaram: Parabhava Samvatsaram\nAyanam: Uttarayanam\nRuthuvu: Vasantha Ruthuvu\nMasam: Chaitramu\nPaksham: Krishna Paksham\nTithi: upto 10.31 PM Trayodashi\, thereafter Chaturdashi\nVaram: Budhavaram\nNakshatram: upto 4.00 PM Poorvabhadra (3 Padam)\, and then Uttarabhadra\nYogam: Brahma\nKaranam: Garajai\nRahu Kalam: 12.16 PM to 1.50 PM\nYamagandam: 7.34 AM to 9.08 AM\nDurmuhurtham: 10.10 AM to 11.01 AM\nAbhijit Muhurtham: 11.51 AM to 12.41 PM\nSuryodayam: 6.00 AM\nSuryastamayam: 6.32 PM\nChandrodayam: 4.13 AM\nChandrashtamam: Karkatakam\nTaddinam Tithi: Trayodashi\nPradesham: Hyderabad (Telugu Style)
SUMMARY:Chaitramu Krishna Paksham Trayodashi  (15.04.2026)
UID:india-te-2026-04-15@panchangam
END:VEVENT
BEGIN:VEVENT
DTSTART;VALUE=DATE:20260525
CATEGORIES:PANCHANGAM
DESCRIPTION:Jyeshthamu Shukla Paksham Dashami  (25.05.2026)\n\nSamvatsaram: Parabhava Samvatsaram\nAyanam: Uttarayanam\nRuthuvu: Grishma Ruthuvu\nMasam: Jyeshthamu\nPaksham: Shukla Paksham\nTithi: upto 5.11 AM Dashami\, thereafter Ekadashi\nVaram: Somavaram\nNakshatram: upto 4.51 AM Uttara (1 Padam)\, and then Hasta\nYogam: Vajra\nKaranam: Thaitilai\nRahu Kalam: 7.19 AM to 8.57 AM\nYamagandam: 10.35 AM to 12.13 PM\nDurmuhurtham: 12.39 PM to 1.31 PM\nAbhijit Muhurtham: 11.46 AM to 12.39 PM\nSuryodayam: 5.41 AM\nSuryastamayam: 6.44 PM\nChandrodayam: 1.51 PM\nChandrashtamam: Makaram\nTaddinam Tithi: Dashami\nPradesham: Hyderabad (Telugu Style)
SUMMARY:Jyeshthamu Shukla Paksham Dashami  (25.05.2026)
UID:india-te-2026-05-25@panchangam
END:VEVENT
BEGIN:VEVENT
DTSTART;VALUE=DATE:20260804
CATEGORIES:PANCHANGAM
DESCRIPTION:Ashadhamu Krishna Paksham Shashti  (04.08.2026)\n\nSamvatsaram: Parabhava Samvatsaram\nAyanam: Dakshinayanam\nRuthuvu: Grishma Ruthuvu\nMasam: Ashadhamu\nPaksham: Krishna Paksham\nTithi: upto 10.03 PM Shashti\, thereafter Saptami\nVaram: Mangalavaram\nNakshatram: upto 10.33 PM Revathi (2 Padam)\, and then Aswini\nYogam: Dhruthi\nKaranam: Garajai\nRahu Kalam: 3.35 PM to 5.11 PM\nYamagandam: 9.09 AM to 10.45 AM\nDurmuhurtham: 7.39 AM to 8.30 AM\, 11.04 AM to 11.56 AM\nAbhijit Muhurtham: 11.56 AM to 12.47 PM\nSuryodayam: 5.56 AM\nSuryastamayam: 6.47 PM\nChandrodayam: 10.31 PM\nChandrashtamam: Simham\nTaddinam Tithi: Shashti\nPradesham: Hyderabad (Telugu Style)
SUMMARY:Ashadhamu Krishna Paksham Shashti  (04.08.2026)
UID:india-te-2026-08-04@panchangam
END:VEVENT
BEGIN:VEVENT
DTSTART;VALUE=DATE:20260914
CATEGORIES:PANCHANGAM
DESCRIPTION:Bhadrapadamu Shukla Paksham Thadiya  (14.09.2026)\n\nSamvatsaram: Parabhava Samvatsaram\nAyanam: Dakshinayanam\nRuthuvu: Varsha Ruthuvu\nMasam: Bhadrapadamu\nPaksham: Shukla Paksham\nTithi: upto 7.07 AM Thadiya\, thereafter Chavithi\nVaram: Somavaram\nNakshatram: upto 2.37 PM Chitta (3 Padam)\, and then Swathi\nYogam: Brahma\nKaranam: Garajai\nRahu Kalam: 7.35 AM to 9.07 AM\nYamagandam: 10.39 AM to 12.11 PM\nDurmuhurtham: 12.36 PM to 1.25 PM\nAbhijit Muhurtham: 11.47 AM to 12.36 PM\nSuryodayam: 6.03 AM\nSuryastamayam: 6.19 PM\nChandrodayam: 8.42 AM\nChandrashtamam: Meenam\nTaddinam Tithi: Chavithi\nPradesham: Hyderabad (Telugu Style)
SUMMARY:Bhadrapadamu Shukla Paksham Thadiya  (14.09.2026)
UID:india-te-2026-09-14@panchangam
END:VEVENT
BEGIN:VEVENT
DTSTART;VALUE=DATE:20261108
CATEGORIES:PANCHANGAM
DESCRIPTION:Ashwayujamu Krishna Paksham Chaturdashi  (08.11.2026)\n\n🎉 SPECIAL: Deepavali\nSamvatsaram: Parabhava Samvatsaram\nAyanam: Dakshinayanam\nRuthuvu: Sarad Ruthuvu\nMasam: Ashwayujamu\nPaksham: Krishna Paksham\nTithi: upto 11.28 AM Chaturdashi\, thereafter Amavasya\nVaram: Bhanuvaram\nNakshatram: upto 6.35 AM Chitta (4 Padam)\, and then Swathi\nYogam: Aayushman\nKaranam: Shakuni\nRahu Kalam: 4.16 PM to 5.41 PM\nYamagandam: 11.59 AM to 1.25 PM\nDurmuhurtham: 4.10 PM to 4.56 PM\nAbhijit Muhurtham: 11.36 AM to 12.22 PM\nSuryodayam: 6.17 AM\nSuryastamayam: 5.41 PM\nChandrodayam: 5.16 AM\nChandrashtamam: Meenam\nTaddinam Tithi: Amavasya\nPradesham: Hyderabad (Telugu Style)
SUMMARY:Ashwayujamu Krishna Paksham Chaturdashi  (08.11.2026)
UID:india-te-2026-11-08@panchangam
END:VEVENT
BEGIN:VEVENT
DTSTART;VALUE=DATE:20261218
CATEGORIES:PANCHANGAM
DESCRIPTION:Margashiramu Shukla Paksham Navami  (18.12.2026)\n\nSamvatsaram: Parabhava Samvatsaram\nAyanam: Dakshinayanam\nRuthuvu: Hemantha Ruthuvu\nMasam: Margashiramu\nPaksham: Shukla Paksham\nTithi: upto 11.14 PM Navami\, thereafter Dashami\nVaram: Shukravaram\nNakshatram: upto 4.51 PM Uttarabhadra (3 Padam)\, and then Revathi\nYogam: Vyatipata\nKaranam: Balavai\nRahu Kalam: 10.49 AM to 12.12 PM\nYamagandam: 2.58 PM to 4.22 PM\nDurmuhurtham: 8.52 AM to 9.37 AM\, 12.34 PM to 1.19 PM\nAbhijit Muhurtham: 11.50 AM to 12.34 PM\nSuryodayam: 6.39 AM\nSuryastamayam: 5.45 PM\nChandrodayam: 12.48 PM\nChandrashtamam: Simham\nTaddinam Tithi: Navami\nPradesham: Hyderabad (Telugu Style)
SUMMARY:Margashiramu Shukla Paksham Navami  (18.12.2026)
UID:india-te-2026-12-18@panchangam
END:VEVENT
BEGIN:VEVENT
DTSTART;VALUE=DATE:20260103
CATEGORIES:PANCHANGAM
DESCRIPTION:Pushyamu Shukla Paksham Pournami 🌕 (03.01.2026)\n\nSamvatsaram: Vishvavasu Samvatsaram\nAyanam: Uttarayanam\nRuthuvu: Hemantha Ruthuvu\nMasam: Pushyamu\nPaksham: Shukla Paksham\nTithi: upto 3.32 PM Pournami\, thereafter Padyami\nVaram: Shanivaram\nNakshatram: upto 6.03 PM Arudra (2 Padam)\, and then Punarvasu\nYogam: Brahma\nKaranam: Bavai\nRahu Kalam: 9.33 AM to 10.57 AM\nYamagandam: 1.43 PM to 3.07 PM\nDurmuhurtham: 6.46 AM to 7.31 AM\nAbhijit Muhurtham: 11.58 AM to 12.42 PM\nSuryodayam: 6.46 AM\nSuryastamayam: 5.54 PM\nChandrodayam: 5.54 PM\nChandrashtamam: Vrushchikam\nTaddinam Tithi: Pournami\nPradesham: Hyderabad (Telugu Style)
SUMMARY:Pushyamu Shukla Paksham Pournami 🌕 (03.01.2026)
UID:india-te-2026-01-03@panchangam
END:VEVENT
BEGIN:VEVENT
DTSTART;VALUE=DATE:20260213
CATEGORIES:PANCHANGAM
DESCRIPTION:Maghamu Krishna Paksham Ekadashi  (13.02.2026)\n\n🎉 SPECIAL: Ekadashi (Krishna)\nSamvatsaram: Vishvavasu Samvatsaram\nAyanam: Uttarayanam\nRuthuvu: Shishira Ruthuvu\nMasam: Maghamu\nPaksham: Krishna Paksham\nTithi: upto 2.26 PM Ekadashi\, thereafter Dwadashi\nVaram: Shukravaram\nNakshatram: upto 4.56 PM Moola (3 Padam)\, and then Poorvashada\nYogam: Vajra\nKaranam: Balavai\nRahu Kalam: 11.03 AM to 12.30 PM\nYamagandam: 3.23 PM to 4.50 PM\nDurmuhurtham: 9.02 AM to 9.48 AM\, 12.53 PM to 1.39 PM\nAbhijit Muhurtham: 12.07 PM to 12.53 PM\nSuryodayam: 6.43 AM\nSuryastamayam: 6.16 PM\nChandrodayam: 3.29 AM\nChandrashtamam: Vrushabham\nTaddinam Tithi: Dwadashi\nPradesham: Hyderabad (Telugu Style)
SUMMARY:Maghamu Krishna Paksham Ekadashi  (13.02.2026)
UID:india-te-2026-02-13@panchangam
END:VEVENT
BEGIN:VEVENT
DTSTART;VALUE=DATE:20260323
CATEGORIES:PANCHANGAM
DESCRIPTION:Chaitramu Shukla Paksham Panchami  (23.03.2026)\n\nSamvatsaram: Vishvavasu Samvatsaram\nAyanam: Uttarayanam\nRuthuvu: Vasantha Ruthuvu\nMasam: Chaitramu\nPaksham: Shukla Paksham\nTithi: upto 6.38 PM Panchami\, thereafter Shashti\nVaram: Somavaram\nNakshatram: upto 9.26 PM Kruthika (2 Padam)\, and then Rohini\nYogam: Vishkambha\nKaranam: Bavai\nRahu Kalam: 7.49 AM to 9.20 AM\nYamagandam: 10.51 AM to 12.22 PM\nDurmuhurtham: 12.47 PM to 1.35 PM\nAbhijit Muhurtham: 11.58 AM to 12.47 PM\nSuryodayam: 6.18 AM\nSuryastamayam: 6.27 PM\nChandrodayam: 9.17 AM\nChandrashtamam: Thula\nTaddinam Tithi: Panchami\nPradesham: Hyderabad (Telugu Style)
SUMMARY:Chaitramu Shukla Paksham Panchami  (23.03.2026)
UID:india-te-2026-03-23@panchangam
END:VEVENT
BEGIN:VEVENT
DTSTART;VALUE=DATE:20260602
CATEGORIES:PANCHANGAM
DESCRIPTION:Jyeshthamu Krishna Paksham Vidiya  (02.06.2026)\n\nSamvatsaram: Parabhava Samvatsaram\nAyanam: Uttarayanam\nRuthuvu: Grishma Ruthuvu\nMasam: Jyeshthamu\nPaksham: Krishna Paksham\nTithi: upto 7.01 PM Vidiya\, thereafter Thadiya\nVaram: Mangalavaram\nNakshatram: upto 10.51 PM Moola (2 Padam)\, and then Poorvashada\nYogam: Sadhya\nKaranam: Thaitilai\nRahu Kalam: 3.30 PM to 5.08 PM\nYamagandam: 8.57 AM to 10.35 AM\nDurmuhurtham: 7.25 AM to 8.18 AM\, 10.55 AM to 11.47 AM\nAbhijit Muhurtham: 11.47 AM to 12.40 PM\nSuryodayam: 5.40 AM\nSuryastamayam: 6.47 PM\nChandrodayam: 8.41 PM\nChandrashtamam: Vrushabham\nTaddinam Tithi: Vidiya\nPradesham: Hyderabad (Telugu Style)
SUMMARY:Jyeshthamu Krishna Paksham Vidiya  (02.06.2026)
UID:india-te-2026-06-02@panchangam
END:VEVENT
BEGIN:VEVENT
DTSTART;VALUE=DATE:20260712
CATEGORIES:PANCHANGAM
DESCRIPTION:Jyeshthamu Krishna Paksham Trayodashi  (12.07.2026)\n\n🎉 SPECIAL: Pradosham (Krishna)\nSamvatsaram: Parabhava Samvatsaram\nAyanam: Dakshinayanam\nRuthuvu: Grishma Ruthuvu\nMasam: Jyeshthamu\nPaksham: Krishna Paksham\nTithi: upto 10.30 PM Trayodashi\, thereafter Chaturdashi\nVaram: Bhanuvaram\nNakshatram: upto 9.04 AM Rohini (4 Padam)\, and then Mrigashira\nYogam: Vriddhi\nKaranam: Garajai\nRahu Kalam: 5.16 PM to 6.54 PM\nYamagandam: 12.21 PM to 1.59 PM\nDurmuhurtham: 5.09 PM to 6.02 PM\nAbhijit Muhurtham: 11.55 AM to 12.47 PM\nSuryodayam: 5.48 AM\nSuryastamayam: 6.54 PM\nChandrodayam: 3.10 AM\nChandrashtamam: Thula\nTaddinam Tithi: Trayodashi\nPradesham: Hyderabad (Telugu Style)
SUMMARY:Jyeshthamu Krishna Paksham Trayodashi  (12.07.2026)
UID:india-te-2026-07-12@panchangam
END:VEVENT
BEGIN:VEVENT
DTSTART;VALUE=DATE:20260822
CATEGORIES:PANCHANGAM
DESCRIPTION:Sravanamu Shukla Paksham Dashami  (22.08.2026)\n\nSamvatsaram: Parabhava Samvatsaram\nAyanam: Dakshinayanam\nRuthuvu: Varsha Ruthuvu\nMasam: Sravanamu\nPaksham: Shukla Paksham\nTithi: upto 2.00 AM Dashami\, thereafter Ekadashi\nVaram: Shanivaram\nNakshatram: upto 3.34 PM Jyeshta (3 Padam)\, and then Moola\nYogam: Vaidhriti\nKaranam: Thaitilai\nRahu Kalam: 9.09 AM to 10.44 AM\nYamagandam: 1.53 PM to 3.28 PM\nDurmuhurtham: 6.00 AM to 6.50 AM\nAbhijit Muhurtham: 11.53 AM to 12.44 PM\nSuryodayam: 6.00 AM\nSuryastamayam: 6.37 PM\nChandrodayam: 2.26 PM\nChandrashtamam: Mesham\nTaddinam Tithi: Dashami\nPradesham: Hyderabad (Telugu Style)
SUMMARY:Sravanamu Shukla Paksham Dashami  (22.08.2026)
UID:india-te-2026-08-22@panchangam
END:VEVENT
BEGIN:VEVENT
BEGIN:VALARM
ACTION:DISPLAY
DESCRIPTION:
TRIGGER:-P1D
END:VALARM
DTSTART;VALUE=DATE:20261021
CATEGORIES:FESTIVAL
DESCRIPTION:Deity: Goddess Durga\nFood: Sweets\nRules: Hyderabad (Telugu Style) Calendar
SUMMARY:🎉 Vijaya Dasami
UID:india-te-2026-10-21-VijayaDasami@festival
END:VEVENT
BEGIN:VEVENT
DTSTART;VALUE=DATE:20261016
CATEGORIES:PANCHANGAM
DESCRIPTION:Ashwayujamu Shukla Paksham Shashti  (16.10.2026)\n\n🎉 SPECIAL: Sashti (Shukla)\nSamvatsaram: Parabhava Samvatsaram\nAyanam: Dakshinayanam\nRuthuvu: Sarad Ruthuvu\nMasam: Ashwayujamu\nPaksham: Shukla Paksham\nTithi: upto 5.54 AM Shashti\, thereafter Saptami\nVaram: Shukravaram\nNakshatram: upto 7.33 AM Jyeshta (4 Padam)\, and then Moola\nYogam: Shobhana\nKaranam: Kaulavai\nRahu Kalam: 10.33 AM to 12.01 PM\nYamagandam: 2.57 PM to 4.25 PM\nDurmuhurtham: 8.30 AM to 9.17 AM\, 12.25 PM to 1.11 PM\nAbhijit Muhurtham: 11.38 AM to 12.25 PM\nSuryodayam: 6.09 AM\nSuryastamayam: 5.53 PM\nChandrodayam: 11.00 AM\nChandrashtamam: Mesham\nTaddinam Tithi: Shashti\nPradesham: Hyderabad (Telugu Style)
SUMMARY:Ashwayujamu Shukla Paksham Shashti  (16.10.2026)
UID:india-te-2026-10-16@panchangam
END:VEVENT
BEGIN:VEVENT
DTSTART;VALUE=DATE:20261126
CATEGORIES:PANCHANGAM
DESCRIPTION:Karthikamu Krishna Paksham Vidiya  (26.11.2026)\n\nSamvatsaram: Parabhava Samvatsaram\nAyanam: Dakshinayanam\nRuthuvu: Sarad Ruthuvu\nMasam: Karthikamu\nPaksham: Krishna Paksham\nTithi: upto 1.15 PM Vidiya\, thereafter Thadiya\nVaram: Guruvaram\nNakshatram: upto 6.23 PM Mrigashira (2 Padam)\, and then Arudra\nYogam: Siddha\nKaranam: Garajai\nRahu Kalam: 1.27 PM to 2.51 PM\nYamagandam: 6.26 AM to 7.50 AM\nDurmuhurtham: 1.10 PM to 1.55 PM\nAbhijit Muhurtham: 11.40 AM to 12.25 PM\nSuryodayam: 6.26 AM\nSuryastamayam: 5.39 PM\nChandrodayam: 7.27 PM\nChandrashtamam: Thula\nTaddinam Tithi: Thadiya\nPradesham: Hyderabad (Telugu Style)
SUMMARY:Karthikamu Krishna Paksham Vidiya  (26.11.2026)
UID:india-te-2026-11-26@panchangam
END:VEVENT
BEGIN:VEVENT
DTSTART;VALUE=DATE:20260121
CATEGORIES:PANCHANGAM
DESCRIPTION:Maghamu Shukla Paksham Thadiya  (21.01.2026)\n\nSamvatsaram: Vishvavasu Samvatsaram\nAyanam: Uttarayanam\nRuthuvu: Shishira Ruthuvu\nMasam: Maghamu\nPaksham: Shukla Paksham\nTithi: upto 2.47 AM Thadiya\, thereafter Chavithi\nVaram: Budhavaram\nNakshatram: upto 2.38 PM Dhanishta (3 Padam)\, and then Shatabhisham\nYogam: Vyatipata\nKaranam: Thaitilai\nRahu Kalam: 12.27 PM to 1.51 PM\nYamagandam: 8.14 AM to 9.38 AM\nDurmuhurtham: 10.34 AM to 11.19 AM\nAbhijit Muhurtham: 12.04 PM to 12.49 PM\nSuryodayam: 6.49 AM\nSuryastamayam: 6.05 PM\nChandrodayam: 8.34 AM\nChandrashtamam: Karkatakam\nTaddinam Tithi: Thadiya\nPradesham: Hyderabad (Telugu Style)
SUMMARY:Maghamu Shukla Paksham Thadiya  (21.01.2026)
UID:india-te-2026-01-21@panchangam
END:VEVENT
BEGIN:VEVENT
DTSTART;VALUE=DATE:20260510
CATEGORIES:PANCHANGAM
DESCRIPTION:Vaishakhamu Krishna Paksham Ashtami  (10.05.2026)\n\nSamvatsaram: Parabhava Samvatsaram\nAyanam: Uttarayanam\nRuthuvu: Vasantha Ruthuvu\nMasam: Vaishakhamu\nPaksham: Krishna Paksham\nTithi: upto 3.07 PM Ashtami\, thereafter Navami\nVaram: Bhanuvaram\nNakshatram: upto 1.31 AM Dhanishta (1 Padam)\, and then Shatabhisham\nYogam: Brahma\nKaranam: Kaulavai\nRahu Kalam: 5.02 PM to 6.39 PM\nYamagandam: 12.12 PM to 1.49 PM\nDurmuhurtham: 4.55 PM to 5.47 PM\nAbhijit Muhurtham: 11.46 AM to 12.38 PM\nSuryodayam: 5.46 AM\nSuryastamayam: 6.39 PM\nChandrodayam: 12.53 AM\nChandrashtamam: Mithunam\nTaddinam Tithi: Ashtami\nPradesham: Hyderabad (Telugu Style)
SUMMARY:Vaishakhamu Krishna Paksham Ashtami  (10.05.2026)
UID:india-te-2026-05-10@panchangam
END:VEVENT
BEGIN:VEVENT
DTSTART;VALUE=DATE:20260620
CATEGORIES:PANCHANGAM
DESCRIPTION:Jyeshthamu Shukla Paksham Shashti  (20.06.2026)\n\n🎉 SPECIAL: Sashti (Shukla)\nSamvatsaram: Parabhava Samvatsaram\nAyanam: Uttarayanam\nRuthuvu: Grishma Ruthuvu\nMasam: Jyeshthamu\nPaksham: Shukla Paksham\nTithi: upto 3.47 PM Shashti\, thereafter Saptami\nVaram: Shanivaram\nNakshatram: upto 10.05 AM Makha (4 Padam)\, and then Pubba\nYogam: Vajra\nKaranam: Thaitilai\nRahu Kalam: 9.00 AM to 10.38 AM\nYamagandam: 1.56 PM to 3.35 PM\nDurmuhurtham: 5.42 AM to 6.35 AM\nAbhijit Muhurtham: 11.51 AM to 12.43 PM\nSuryodayam: 5.42 AM\nSuryastamayam: 6.52 PM\nChandrodayam: 10.53 AM\nChandrashtamam: Makaram\nTaddinam Tithi: Shashti\nPradesham: Hyderabad (Telugu Style)
SUMMARY:Jyeshthamu Shukla Paksham Shashti  (20.06.2026)
UID:india-te-2026-06-20@panchangam
END:VEVENT
BEGIN:VEVENT
DTSTART;VALUE=DATE:20260730
CATEGORIES:PANCHANGAM
DESCRIPTION:Ashadhamu Krishna Paksham Padyami  (30.07.2026)\n\nSamvatsaram: Parabhava Samvatsaram\nAyanam: Dakshinayanam\nRuthuvu: Grishma Ruthuvu\nMasam: Ashadhamu\nPaksham: Krishna Paksham\nTithi: upto 9.30 PM Padyami\, thereafter Vidiya\nVaram: Guruvaram\nNakshatram: upto 6.26 PM Shravana (3 Padam)\, and then Dhanishta\nYogam: Aayushman\nKaranam: Balavai\nRahu Kalam: 1.59 PM to 3.36 PM\nYamagandam: 5.54 AM to 7.31 AM\nDurmuhurtham: 1.39 PM to 2.31 PM\nAbhijit Muhurtham: 11.56 AM to 12.48 PM\nSuryodayam: 5.54 AM\nSuryastamayam: 6.50 PM\nChandrodayam: 7.30 PM\nChandrashtamam: Mithunam\nTaddinam Tithi: Padyami\nPradesham: Hyderabad (Telugu Style)
SUMMARY:Ashadhamu Krishna Paksham Padyami  (30.07.2026)
UID:india-te-2026-07-30@panchangam
END:VEVENT
BEGIN:VEVENT
DTSTART;VALUE=DATE:20251226
CATEGORIES:PANCHANGAM
DESCRIPTION:Pushyamu Shukla Paksham Shashti  (26.12.2025)\n\n🎉 SPECIAL: Sashti (Shukla)\nSamvatsaram: Vishvavasu Samvatsaram\nAyanam: Uttarayanam\nRuthuvu: Hemantha Ruthuvu\nMasam: Pushyamu\nPaksham: Shukla Paksham\nTithi: upto 1.44 PM Shashti\, thereafter Saptami\nVaram: Shukravaram\nNakshatram: upto 9.40 AM Shatabhisham (4 Padam)\, and then Poorvabhadra\nYogam: Siddhi\nKaranam: Thaitilai\nRahu Kalam: 10.53 AM to 12.16 PM\nYamagandam: 3.03 PM to 4.26 PM\nDurmuhurtham: 8.56 AM to 9.41 AM\, 12.38 PM to 1.23 PM\nAbhijit Muhurtham: 11.54 AM to 12.38 PM\nSuryodayam: 6.43 AM\nSuryastamayam: 5.49 PM\nChandrodayam: 11.10 AM\nChandrashtamam: Karkatakam\nTaddinam Tithi: Saptami\nPradesham: Hyderabad (Telugu Style)
SUMMARY:Pushyamu Shukla Paksham Shashti  (26.12.2025)
UID:india-te-2025-12-26@panchangam
END:VEVENT
BEGIN:VEVENT
DTSTART;VALUE=DATE:20260609
CATEGORIES:PANCHANGAM
DESCRIPTION:Jyeshthamu Krishna Paksham Navami  (09.06.2026)\n\nSamvatsaram: Parabhava Samvatsaram\nAyanam: Uttarayanam\nRuthuvu: Grishma Ruthuvu\nMasam: Jyeshthamu\nPaksham: Krishna Paksham\nTithi: upto 2.35 AM Navami\, thereafter Dashami\nVaram: Mangalavaram\nNakshatram: upto 10.19 AM Poorvabhadra (4 Padam)\, and then Uttarabhadra\nYogam: Preethi\nKaranam: Thaitilai\nRahu Kalam: 3.32 PM to 5.11 PM\nYamagandam: 8.58 AM to 10.36 AM\nDurmuhurtham: 7.26 AM to 8.18 AM\, 10.56 AM to 11.49 AM\nAbhijit Muhurtham: 11.49 AM to 12.41 PM\nSuryodayam: 5.40 AM\nSuryastamayam: 6.49 PM\nChandrodayam: 12.40 AM\nChandrashtamam: Simham\nTaddinam Tithi: Navami\nPradesham: Hyderabad (Telugu Style)
SUMMARY:Jyeshthamu Krishna Paksham Navami  (09.06.2026)
UID:india-te-2026-06-09@panchangam
END:VEVENT
BEGIN:VEVENT
DTSTART;VALUE=DATE:20260719
CATEGORIES:PANCHANGAM
DESCRIPTION:Ashadhamu Shukla Paksham Shashti  (19.07.2026)\n\n🎉 SPECIAL: Sashti (Shukla)\nSamvatsaram: Parabhava Samvatsaram\nAyanam: Dakshinayanam\nRuthuvu: Grishma Ruthuvu\nMasam: Ashadhamu\nPaksham: Shukla Paksham\nTithi: upto 3.30 AM Shashti\, thereafter Saptami\nVaram: Bhanuvaram\nNakshatram: upto 6.53 PM Uttara (2 Padam)\, and then Hasta\nYogam: Parigha\nKaranam: Kaulavai\nRahu Kalam: 5.15 PM to 6.53 PM\nYamagandam: 12.22 PM to 2.00 PM\nDurmuhurtham: 5.09 PM to 6.01 PM\nAbhijit Muhurtham: 11.56 AM to 12.48 PM\nSuryodayam: 5.51 AM\nSuryastamayam: 6.53 PM\nChandrodayam: 10.28 AM\nChandrashtamam: Kumbham\nTaddinam Tithi: Shashti\nPradesham: Hyderabad (Telugu Style)
SUMMARY:Ashadhamu Shukla Paksham Shashti  (19.07.2026)
UID:india-te-2026-07-19@panchangam
END:VEVENT
BEGIN:VEVENT
DTSTART;VALUE=DATE:20260829
CATEGORIES:PANCHANGAM
DESCRIPTION:Sravanamu Krishna Paksham Padyami  (29.08.2026)\n\nSamvatsaram: Parabhava Samvatsaram\nAyanam: Dakshinayanam\nRuthuvu: Varsha Ruthuvu\nMasam: Sravanamu\nPaksham: Krishna Paksham\nTithi: upto 9.57 AM Padyami\, thereafter Vidiya\nVaram: Shanivaram\nNakshatram: upto 4.23 AM Poorvabhadra (1 Padam)\, and then Uttarabhadra\nYogam: Sukarman\nKaranam: Kaulavai\nRahu Kalam: 9.09 AM to 10.43 AM\nYamagandam: 1.50 PM to 3.24 PM\nDurmuhurtham: 6.01 AM to 6.51 AM\nAbhijit Muhurtham: 11.51 AM to 12.41 PM\nSuryodayam: 6.01 AM\nSuryastamayam: 6.32 PM\nChandrodayam: 7.18 PM\nChandrashtamam: Karkatakam\nTaddinam Tithi: Vidiya\nPradesham: Hyderabad (Telugu Style)
SUMMARY:Sravanamu Krishna Paksham Padyami  (29.08.2026)
UID:india-te-2026-08-29@panchangam
END:VEVENT
BEGIN:VEVENT
DTSTART;VALUE=DATE:20261203
CATEGORIES:PANCHANGAM
DESCRIPTION:Karthikamu Krishna Paksham Dashami  (03.12.2026)\n\nSamvatsaram: Parabhava Samvatsaram\nAyanam: Dakshinayanam\nRuthuvu: Sarad Ruthuvu\nMasam: Karthikamu\nPaksham: Krishna Paksham\nTithi: upto 11.03 PM Dashami\, thereafter Ekadashi\nVaram: Guruvaram\nNakshatram: upto 10.05 AM Uttara (4 Padam)\, and then Hasta\nYogam: Preethi\nKaranam: Vanijai\nRahu Kalam: 1.29 PM to 2.53 PM\nYamagandam: 6.31 AM to 7.54 AM\nDurmuhurtham: 1.12 PM to 1.57 PM\nAbhijit Muhurtham: 11.43 AM to 12.28 PM\nSuryodayam: 6.31 AM\nSuryastamayam: 5.40 PM\nChandrodayam: 1.29 AM\nChandrashtamam: Kumbham\nTaddinam Tithi: Dashami\nPradesham: Hyderabad (Telugu Style)
SUMMARY:Karthikamu Krishna Paksham Dashami  (03.12.2026)
UID:india-te-2026-12-03@panchangam
END:VEVENT
BEGIN:VEVENT
BEGIN:VALARM
ACTION:DISPLAY
DESCRIPTION:
TRIGGER:-P1D
END:VALARM
CATEGORIES:VRATAM
DESCRIPTION:Astronomical duration of Pradosham (Krishna).
DTEND:20261206T205233Z
DTSTART:20261205T192226Z
SUMMARY:⏳ Pradosham (Krishna)
UID:india-te-202612060052-Pradosham(Krishna)@vratam
END:VEVENT
BEGIN:VEVENT
BEGIN:VALARM
ACTION:DISPLAY
DESCRIPTION:
TRIGGER:-P1D
END:VALARM
CATEGORIES:VRATAM
DESCRIPTION:Astronomical duration of Pradosham (Krishna).
DTEND:20260515T030144Z
DTSTART:20260514T055101Z
SUMMARY:⏳ Pradosham (Krishna)
UID:india-te-202605141121-Pradosham(Krishna)@vratam
END:VEVENT
BEGIN:VEVENT
BEGIN:VALARM
ACTION:DISPLAY
DESCRIPTION:
TRIGGER:-P1D
END:VALARM
CATEGORIES:VRATAM
DESCRIPTION:Astronomical duration of Pradosham (Krishna).
DTEND:20260810T232444Z
DTSTART:20260810T023122Z
SUMMARY:⏳ Pradosham (Krishna)
UID:india-te-202608100801-Pradosham(Krishna)@vratam
END:VEVENT
BEGIN:VEVENT
DTSTART;VALUE=DATE:20260128
CATEGORIES:PANCHANGAM
DESCRIPTION:Maghamu Shukla Paksham Dashami  (28.01.2026)\n\nSamvatsaram: Vishvavasu Samvatsaram\nAyanam: Uttarayanam\nRuthuvu: Shishira Ruthuvu\nMasam: Maghamu\nPaksham: Shukla Paksham\nTithi: upto 4.36 PM Dashami\, thereafter Ekadashi\nVaram: Budhavaram\nNakshatram: upto 10.03 AM Kruthika (4 Padam)\, and then Rohini\nYogam: Brahma\nKaranam: Garajai\nRahu Kalam: 12.29 PM to 1.54 PM\nYamagandam: 8.13 AM to 9.38 AM\nDurmuhurtham: 10.35 AM to 11.20 AM\nAbhijit Muhurtham: 12.06 PM to 12.51 PM\nSuryodayam: 6.48 AM\nSuryastamayam: 6.09 PM\nChandrodayam: 1.26 PM\nChandrashtamam: Thula\nTaddinam Tithi: Dashami\nPradesham: Hyderabad (Telugu Style)
SUMMARY:Maghamu Shukla Paksham Dashami  (28.01.2026)
UID:india-te-2026-01-28@panchangam
END:VEVENT
BEGIN:VEVENT
DTSTART;VALUE=DATE:20260407
CATEGORIES:PANCHANGAM
DESCRIPTION:Chaitramu Krishna Paksham Panchami  (07.04.2026)\n\nSamvatsaram: Parabhava Samvatsaram\nAyanam: Uttarayanam\nRuthuvu: Vasantha Ruthuvu\nMasam: Chaitramu\nPaksham: Krishna Paksham\nTithi: upto 4.35 PM Panchami\, thereafter Shashti\nVaram: Mangalavaram\nNakshatram: Jyeshta (1 Padam)\nYogam: Vyatipata\nKaranam: Thaitilai\nRahu Kalam: 3.24 PM to 4.57 PM\nYamagandam: 9.12 AM to 10.45 AM\nDurmuhurtham: 7.45 AM to 8.35 AM\, 11.03 AM to 11.53 AM\nAbhijit Muhurtham: 11.53 AM to 12.43 PM\nSuryodayam: 6.06 AM\nSuryastamayam: 6.30 PM\nChandrodayam: 11.11 PM\nChandrashtamam: Mesham\nTaddinam Tithi: Panchami\nPradesham: Hyderabad (Telugu Style)
SUMMARY:Chaitramu Krishna Paksham Panchami  (07.04.2026)
UID:india-te-2026-04-07@panchangam
END:VEVENT
BEGIN:VEVENT
DTSTART;VALUE=DATE:20260517
CATEGORIES:PANCHANGAM
DESCRIPTION:Jyeshthamu Shukla Paksham Padyami  (17.05.2026)\n\nSamvatsaram: Parabhava Samvatsaram\nAyanam: Uttarayanam\nRuthuvu: Grishma Ruthuvu\nMasam: Jyeshthamu\nPaksham: Shukla Paksham\nTithi: upto 9.41 PM Padyami\, thereafter Vidiya\nVaram: Bhanuvaram\nNakshatram: upto 3.06 PM Kruthika (3 Padam)\, and then Rohini\nYogam: Shobhana\nKaranam: Kimstughna\nRahu Kalam: 5.04 PM to 6.41 PM\nYamagandam: 12.12 PM to 1.49 PM\nDurmuhurtham: 4.57 PM to 5.49 PM\nAbhijit Muhurtham: 11.46 AM to 12.38 PM\nSuryodayam: 5.43 AM\nSuryastamayam: 6.41 PM\nChandrodayam: 5.47 AM\nChandrashtamam: Thula\nTaddinam Tithi: Padyami\nPradesham: Hyderabad (Telugu Style)
SUMMARY:Jyeshthamu Shukla Paksham Padyami  (17.05.2026)
UID:india-te-2026-05-17@panchangam
END:VEVENT
BEGIN:VEVENT
DTSTART;VALUE=DATE:20260627
CATEGORIES:PANCHANGAM
DESCRIPTION:Jyeshthamu Shukla Paksham Trayodashi  (27.06.2026)\n\n🎉 SPECIAL: Pradosham (Shukla)\nSamvatsaram: Parabhava Samvatsaram\nAyanam: Dakshinayanam\nRuthuvu: Grishma Ruthuvu\nMasam: Jyeshthamu\nPaksham: Shukla Paksham\nTithi: upto 12.43 AM Trayodashi\, thereafter Chaturdashi\nVaram: Shanivaram\nNakshatram: upto 10.56 PM Anuradha (2 Padam)\, and then Jyeshta\nYogam: Sadhya\nKaranam: Kaulavai\nRahu Kalam: 9.01 AM to 10.40 AM\nYamagandam: 1.57 PM to 3.36 PM\nDurmuhurtham: 5.44 AM to 6.36 AM\nAbhijit Muhurtham: 11.52 AM to 12.45 PM\nSuryodayam: 5.44 AM\nSuryastamayam: 6.53 PM\nChandrodayam: 4.53 PM\nChandrashtamam: Mesham\nTaddinam Tithi: Trayodashi\nPradesham: Hyderabad (Telugu Style)
SUMMARY:Jyeshthamu Shukla Paksham Trayodashi  (27.06.2026)
UID:india-te-2026-06-27@panchangam
END:VEVENT
BEGIN:VEVENT
DTSTART;VALUE=DATE:20260906
CATEGORIES:PANCHANGAM
DESCRIPTION:Sravanamu Krishna Paksham Dashami  (06.09.2026)\n\nSamvatsaram: Parabhava Samvatsaram\nAyanam: Dakshinayanam\nRuthuvu: Varsha Ruthuvu\nMasam: Sravanamu\nPaksham: Krishna Paksham\nTithi: upto 7.29 PM Dashami\, thereafter Ekadashi\nVaram: Bhanuvaram\nNakshatram: upto 8.30 PM Arudra (2 Padam)\, and then Punarvasu\nYogam: Siddhi\nKaranam: Vanijai\nRahu Kalam: 4.52 PM to 6.25 PM\nYamagandam: 12.14 PM to 1.47 PM\nDurmuhurtham: 4.46 PM to 5.36 PM\nAbhijit Muhurtham: 11.49 AM to 12.39 PM\nSuryodayam: 6.02 AM\nSuryastamayam: 6.25 PM\nChandrodayam: 12.53 AM\nChandrashtamam: Vrushchikam\nTaddinam Tithi: Dashami\nPradesham: Hyderabad (Telugu Style)
SUMMARY:Sravanamu Krishna Paksham Dashami  (06.09.2026)
UID:india-te-2026-09-06@panchangam
END:VEVENT
BEGIN:VEVENT
DTSTART;VALUE=DATE:20261001
CATEGORIES:PANCHANGAM
DESCRIPTION:Bhadrapadamu Krishna Paksham Panchami  (01.10.2026)\n\nSamvatsaram: Parabhava Samvatsaram\nAyanam: Dakshinayanam\nRuthuvu: Varsha Ruthuvu\nMasam: Bhadrapadamu\nPaksham: Krishna Paksham\nTithi: upto 12.35 PM Panchami\, thereafter Shashti\nVaram: Guruvaram\nNakshatram: upto 6.40 AM Kruthika (4 Padam)\, upto 5.05 AM Rohini\, and then Mrigashira\nYogam: Siddhi\nKaranam: Thaitilai\nRahu Kalam: 1.35 PM to 3.05 PM\nYamagandam: 6.06 AM to 7.36 AM\nDurmuhurtham: 1.17 PM to 2.05 PM\nAbhijit Muhurtham: 11.41 AM to 12.29 PM\nSuryodayam: 6.06 AM\nSuryastamayam: 6.05 PM\nChandrodayam: 9.45 PM\nChandrashtamam: Thula\nTaddinam Tithi: Shashti\nPradesham: Hyderabad (Telugu Style)
SUMMARY:Bhadrapadamu Krishna Paksham Panchami  (01.10.2026)
UID:india-te-2026-10-01@panchangam
END:VEVENT
BEGIN:VEVENT
DTSTART;VALUE=DATE:20261111
CATEGORIES:PANCHANGAM
DESCRIPTION:Karthikamu Shukla Paksham Vidiya  (11.11.2026)\n\nSamvatsaram: Parabhava Samvatsaram\nAyanam: Dakshinayanam\nRuthuvu: Sarad Ruthuvu\nMasam: Karthikamu\nPaksham: Shukla Paksham\nTithi: upto 3.53 PM Vidiya\, thereafter Thadiya\nVaram: Budhavaram\nNakshatram: upto 12.23 PM Anuradha (4 Padam)\, and then Jyeshta\nYogam: Atiganda\nKaranam: Kaulavai\nRahu Kalam: 11.59 AM to 1.25 PM\nYamagandam: 7.44 AM to 9.09 AM\nDurmuhurtham: 10.06 AM to 10.51 AM\nAbhijit Muhurtham: 11.37 AM to 12.22 PM\nSuryodayam: 6.18 AM\nSuryastamayam: 5.41 PM\nChandrodayam: 7.58 AM\nChandrashtamam: Mesham\nTaddinam Tithi: Vidiya\nPradesham: Hyderabad (Telugu Style)
SUMMARY:Karthikamu Shukla Paksham Vidiya  (11.11.2026)
UID:india-te-2026-11-11@panchangam
END:VEVENT
BEGIN:VEVENT
DTSTART;VALUE=DATE:20261221
CATEGORIES:PANCHANGAM
DESCRIPTION:Margashiramu Shukla Paksham Dwadashi  (21.12.2026)\n\nSamvatsaram: Parabhava Samvatsaram\nAyanam: Dakshinayanam\nRuthuvu: Hemantha Ruthuvu\nMasam: Margashiramu\nPaksham: Shukla Paksham\nTithi: upto 5.36 PM Dwadashi\, thereafter Trayodashi\nVaram: Somavaram\nNakshatram: upto 1.46 PM Bharani (3 Padam)\, and then Kruthika\nYogam: Siddha\nKaranam: Bavai\nRahu Kalam: 8.04 AM to 9.27 AM\nYamagandam: 10.50 AM to 12.14 PM\nDurmuhurtham: 12.36 PM to 1.20 PM\nAbhijit Muhurtham: 11.51 AM to 12.36 PM\nSuryodayam: 6.41 AM\nSuryastamayam: 5.46 PM\nChandrodayam: 3.00 PM\nChandrashtamam: Kanya\nTaddinam Tithi: Dwadashi\nPradesham: Hyderabad (Telugu Style)
SUMMARY:Margashiramu Shukla Paksham Dwadashi  (21.12.2026)
UID:india-te-2026-12-21@panchangam
END:VEVENT
BEGIN:VEVENT
DTSTART;VALUE=DATE:20260205
CATEGORIES:PANCHANGAM
DESCRIPTION:Maghamu Krishna Paksham Chavithi  (05.02.2026)\n\n🎉 SPECIAL: Sankatahara Chathurthi\nSamvatsaram: Vishvavasu Samvatsaram\nAyanam: Uttarayanam\nRuthuvu: Shishira Ruthuvu\nMasam: Maghamu\nPaksham: Krishna Paksham\nTithi: upto 12.22 AM Chavithi\, thereafter Panchami\nVaram: Guruvaram\nNakshatram: upto 11.38 PM Uttara (2 Padam)\, and then Hasta\nYogam: Sukarman\nKaranam: Bavai\nRahu Kalam: 1.55 PM to 3.21 PM\nYamagandam: 6.46 AM to 8.12 AM\nDurmuhurtham: 1.38 PM to 2.24 PM\nAbhijit Muhurtham: 12.07 PM to 12.52 PM\nSuryodayam: 6.46 AM\nSuryastamayam: 6.13 PM\nChandrodayam: 9.27 PM\nChandrashtamam: Kumbham\nTaddinam Tithi: Chavithi\nPradesham: Hyderabad (Telugu Style)
SUMMARY:Maghamu Krishna Paksham Chavithi  (05.02.2026)
UID:india-te-2026-02-05@panchangam
END:VEVENT
BEGIN:VEVENT
DTSTART;VALUE=DATE:20260315
CATEGORIES:PANCHANGAM
DESCRIPTION:Phalgunamu Krishna Paksham Ekadashi  (15.03.2026)\n\n🎉 SPECIAL: Ekadashi (Krishna)\nSamvatsaram: Vishvavasu Samvatsaram\nAyanam: Uttarayanam\nRuthuvu: Shishira Ruthuvu\nMasam: Phalgunamu\nPaksham: Krishna Paksham\nTithi: upto 9.17 AM Ekadashi\, thereafter Dwadashi\nVaram: Bhanuvaram\nNakshatram: Shravana (1 Padam)\nYogam: Parigha\nKaranam: Balavai\nRahu Kalam: 4.55 PM to 6.25 PM\nYamagandam: 12.25 PM to 1.55 PM\nDurmuhurtham: 4.49 PM to 5.37 PM\nAbhijit Muhurtham: 12.01 PM to 12.49 PM\nSuryodayam: 6.24 AM\nSuryastamayam: 6.25 PM\nChandrodayam: 3.43 AM\nChandrashtamam: Mithunam\nTaddinam Tithi: Dwadashi\nPradesham: Hyderabad (Telugu Style)
SUMMARY:Phalgunamu Krishna Paksham Ekadashi  (15.03.2026)
UID:india-te-2026-03-15@panchangam
END:VEVENT
BEGIN:VEVENT
DTSTART;VALUE=DATE:20260425
CATEGORIES:PANCHANGAM
DESCRIPTION:Vaishakhamu Shukla Paksham Navami  (25.04.2026)\n\nSamvatsaram: Parabhava Samvatsaram\nAyanam: Uttarayanam\nRuthuvu: Vasantha Ruthuvu\nMasam: Vaishakhamu\nPaksham: Shukla Paksham\nTithi: upto 6.28 PM Navami\, thereafter Dashami\nVaram: Shanivaram\nNakshatram: upto 8.44 PM Ashlesha (2 Padam)\, and then Makha\nYogam: Ganda\nKaranam: Balavai\nRahu Kalam: 9.03 AM to 10.39 AM\nYamagandam: 1.49 PM to 3.24 PM\nDurmuhurtham: 5.53 AM to 6.44 AM\nAbhijit Muhurtham: 11.48 AM to 12.39 PM\nSuryodayam: 5.53 AM\nSuryastamayam: 6.34 PM\nChandrodayam: 1.17 PM\nChandrashtamam: Dhanu\nTaddinam Tithi: Navami\nPradesham: Hyderabad (Telugu Style)
SUMMARY:Vaishakhamu Shukla Paksham Navami  (25.04.2026)
UID:india-te-2026-04-25@panchangam
END:VEVENT
BEGIN:VEVENT
DTSTART;VALUE=DATE:20260704
CATEGORIES:PANCHANGAM
DESCRIPTION:Jyeshthamu Krishna Paksham Chavithi  (04.07.2026)\n\nSamvatsaram: Parabhava Samvatsaram\nAyanam: Dakshinayanam\nRuthuvu: Grishma Ruthuvu\nMasam: Jyeshthamu\nPaksham: Krishna Paksham\nTithi: upto 12.40 PM Chavithi\, thereafter Panchami\nVaram: Shanivaram\nNakshatram: upto 2.26 PM Dhanishta (3 Padam)\, and then Shatabhisham\nYogam: Preethi\nKaranam: Balavai\nRahu Kalam: 9.03 AM to 10.41 AM\nYamagandam: 1.58 PM to 3.37 PM\nDurmuhurtham: 5.46 AM to 6.38 AM\nAbhijit Muhurtham: 11.54 AM to 12.46 PM\nSuryodayam: 5.46 AM\nSuryastamayam: 6.54 PM\nChandrodayam: 10.06 PM\nChandrashtamam: Karkatakam\nTaddinam Tithi: Panchami\nPradesham: Hyderabad (Telugu Style)
SUMMARY:Jyeshthamu Krishna Paksham Chavithi  (04.07.2026)
UID:india-te-2026-07-04@panchangam
END:VEVENT
BEGIN:VEVENT
DTSTART;VALUE=DATE:20260814
CATEGORIES:PANCHANGAM
DESCRIPTION:Sravanamu Shukla Paksham Vidiya  (14.08.2026)\n\nSamvatsaram: Parabhava Samvatsaram\nAyanam: Dakshinayanam\nRuthuvu: Varsha Ruthuvu\nMasam: Sravanamu\nPaksham: Shukla Paksham\nTithi: upto 6.47 PM Vidiya\, thereafter Thadiya\nVaram: Shukravaram\nNakshatram: upto 4.22 AM Pubba (1 Padam)\, and then Uttara\nYogam: Parigha\nKaranam: Balavai\nRahu Kalam: 10.45 AM to 12.20 PM\nYamagandam: 3.31 PM to 5.07 PM\nDurmuhurtham: 8.31 AM to 9.22 AM\, 12.46 PM to 1.37 PM\nAbhijit Muhurtham: 11.55 AM to 12.46 PM\nSuryodayam: 5.58 AM\nSuryastamayam: 6.42 PM\nChandrodayam: 7.20 AM\nChandrashtamam: Makaram\nTaddinam Tithi: Vidiya\nPradesham: Hyderabad (Telugu Style)
SUMMARY:Sravanamu Shukla Paksham Vidiya  (14.08.2026)
UID:india-te-2026-08-14@panchangam
END:VEVENT
BEGIN:VEVENT
DTSTART;VALUE=DATE:20260924
CATEGORIES:PANCHANGAM
DESCRIPTION:Bhadrapadamu Shukla Paksham Trayodashi  (24.09.2026)\n\n🎉 SPECIAL: Pradosham (Shukla)\nSamvatsaram: Parabhava Samvatsaram\nAyanam: Dakshinayanam\nRuthuvu: Varsha Ruthuvu\nMasam: Bhadrapadamu\nPaksham: Shukla Paksham\nTithi: upto 11.18 PM Trayodashi\, thereafter Chaturdashi\nVaram: Guruvaram\nNakshatram: upto 11.17 AM Dhanishta (4 Padam)\, and then Shatabhisham\nYogam: Dhruthi\nKaranam: Kaulavai\nRahu Kalam: 1.38 PM to 3.09 PM\nYamagandam: 6.05 AM to 7.35 AM\nDurmuhurtham: 1.20 PM to 2.08 PM\nAbhijit Muhurtham: 11.43 AM to 12.32 PM\nSuryodayam: 6.05 AM\nSuryastamayam: 6.10 PM\nChandrodayam: 4.40 PM\nChandrashtamam: Karkatakam\nTaddinam Tithi: Trayodashi\nPradesham: Hyderabad (Telugu Style)
SUMMARY:Bhadrapadamu Shukla Paksham Trayodashi  (24.09.2026)
UID:india-te-2026-09-24@panchangam
END:VEVENT
BEGIN:VEVENT
DTSTART;VALUE=DATE:20261008
CATEGORIES:PANCHANGAM
DESCRIPTION:Bhadrapadamu Krishna Paksham Trayodashi  (08.10.2026)\n\n🎉 SPECIAL: Pradosham (Krishna)\nSamvatsaram: Parabhava Samvatsaram\nAyanam: Dakshinayanam\nRuthuvu: Varsha Ruthuvu\nMasam: Bhadrapadamu\nPaksham: Krishna Paksham\nTithi: upto 10.16 PM Trayodashi\, thereafter Chaturdashi\nVaram: Guruvaram\nNakshatram: upto 10.00 PM Pubba (2 Padam)\, and then Uttara\nYogam: Shukla\nKaranam: Garajai\nRahu Kalam: 1.32 PM to 3.01 PM\nYamagandam: 6.07 AM to 7.36 AM\nDurmuhurtham: 1.14 PM to 2.02 PM\nAbhijit Muhurtham: 11.39 AM to 12.27 PM\nSuryodayam: 6.07 AM\nSuryastamayam: 5.59 PM\nChandrodayam: 3.51 AM\nChandrashtamam: Makaram\nTaddinam Tithi: Trayodashi\nPradesham: Hyderabad (Telugu Style)
SUMMARY:Bhadrapadamu Krishna Paksham Trayodashi  (08.10.2026)
UID:india-te-2026-10-08@panchangam
END:VEVENT
BEGIN:VEVENT
DTSTART;VALUE=DATE:20261118
CATEGORIES:PANCHANGAM
DESCRIPTION:Karthikamu Shukla Paksham Navami  (18.11.2026)\n\nSamvatsaram: Parabhava Samvatsaram\nAyanam: Dakshinayanam\nRuthuvu: Sarad Ruthuvu\nMasam: Karthikamu\nPaksham: Shukla Paksham\nTithi: Navami\nVaram: Budhavaram\nNakshatram: Shatabhisham (1 Padam)\nYogam: Dhruva\nKaranam: Balavai\nRahu Kalam: 12.01 PM to 1.25 PM\nYamagandam: 7.47 AM to 9.11 AM\nDurmuhurtham: 10.08 AM to 10.53 AM\nAbhijit Muhurtham: 11.38 AM to 12.23 PM\nSuryodayam: 6.22 AM\nSuryastamayam: 5.39 PM\nChandrodayam: 1.06 PM\nChandrashtamam: Karkatakam\nTaddinam Tithi: Navami\nPradesham: Hyderabad (Telugu Style)
SUMMARY:Karthikamu Shukla Paksham Navami  (18.11.2026)
UID:india-te-2026-11-18@panchangam
END:VEVENT
BEGIN:VEVENT
BEGIN:VALARM
ACTION:DISPLAY
DESCRIPTION:
TRIGGER:-P1D
END:VALARM
CATEGORIES:VRATAM
DESCRIPTION:Astronomical duration of Pradosham (Krishna).
DTEND:20260215T113521Z
DTSTART:20260214T103212Z
SUMMARY:⏳ Pradosham (Krishna)
UID:india-te-202602141602-Pradosham(Krishna)@vratam
END:VEVENT
BEGIN:VEVENT
DTSTART;VALUE=DATE:20260113
CATEGORIES:PANCHANGAM
DESCRIPTION:Pushyamu Krishna Paksham Dashami  (13.01.2026)\n\nSamvatsaram: Vishvavasu Samvatsaram\nAyanam: Uttarayanam\nRuthuvu: Hemantha Ruthuvu\nMasam: Pushyamu\nPaksham: Krishna Paksham\nTithi: upto 3.18 PM Dashami\, thereafter Ekadashi\nVaram: Mangalavaram\nNakshatram: upto 12.50 AM Vishakha (2 Padam)\, and then Anuradha\nYogam: Shoola\nKaranam: Vishti\nRahu Kalam: 3.12 PM to 4.36 PM\nYamagandam: 9.36 AM to 11.00 AM\nDurmuhurtham: 8.18 AM to 9.03 AM\, 11.17 AM to 12.02 PM\nAbhijit Muhurtham: 12.02 PM to 12.47 PM\nSuryodayam: 6.49 AM\nSuryastamayam: 6.00 PM\nChandrodayam: 2.07 AM\nChandrashtamam: Meenam\nTaddinam Tithi: Dashami\nPradesham: Hyderabad (Telugu Style)
SUMMARY:Pushyamu Krishna Paksham Dashami  (13.01.2026)
UID:india-te-2026-01-13@panchangam
END:VEVENT
BEGIN:VEVENT
DTSTART;VALUE=DATE:20260223
CATEGORIES:PANCHANGAM
DESCRIPTION:Phalgunamu Shukla Paksham Shashti  (23.02.2026)\n\n🎉 SPECIAL: Sashti (Shukla)\nSamvatsaram: Vishvavasu Samvatsaram\nAyanam: Uttarayanam\nRuthuvu: Shishira Ruthuvu\nMasam: Phalgunamu\nPaksham: Shukla Paksham\nTithi: upto 9.09 AM Shashti\, thereafter Saptami\nVaram: Somavaram\nNakshatram: upto 5.10 PM Bharani (3 Padam)\, and then Kruthika\nYogam: Brahma\nKaranam: Thaitilai\nRahu Kalam: 8.06 AM to 9.33 AM\nYamagandam: 11.01 AM to 12.29 PM\nDurmuhurtham: 12.52 PM to 1.39 PM\nAbhijit Muhurtham: 12.06 PM to 12.52 PM\nSuryodayam: 6.38 AM\nSuryastamayam: 6.20 PM\nChandrodayam: 10.30 AM\nChandrashtamam: Kanya\nTaddinam Tithi: Saptami\nPradesham: Hyderabad (Telugu Style)
SUMMARY:Phalgunamu Shukla Paksham Shashti  (23.02.2026)
UID:india-te-2026-02-23@panchangam
END:VEVENT
BEGIN:VEVENT
DTSTART;VALUE=DATE:20260502
CATEGORIES:PANCHANGAM
DESCRIPTION:Vaishakhamu Krishna Paksham Padyami  (02.05.2026)\n\nSamvatsaram: Parabhava Samvatsaram\nAyanam: Uttarayanam\nRuthuvu: Vasantha Ruthuvu\nMasam: Vaishakhamu\nPaksham: Krishna Paksham\nTithi: upto 12.50 AM Padyami\, thereafter Vidiya\nVaram: Shanivaram\nNakshatram: Vishakha (1 Padam)\nYogam: Vyatipata\nKaranam: Balavai\nRahu Kalam: 9.01 AM to 10.37 AM\nYamagandam: 1.48 PM to 3.24 PM\nDurmuhurtham: 5.49 AM to 6.40 AM\nAbhijit Muhurtham: 11.47 AM to 12.38 PM\nSuryodayam: 5.49 AM\nSuryastamayam: 6.36 PM\nChandrodayam: 7.17 PM\nChandrashtamam: Meenam\nTaddinam Tithi: Padyami\nPradesham: Hyderabad (Telugu Style)
SUMMARY:Vaishakhamu Krishna Paksham Padyami  (02.05.2026)
UID:india-te-2026-05-02@panchangam
END:VEVENT
BEGIN:VEVENT
DTSTART;VALUE=DATE:20260612
CATEGORIES:PANCHANGAM
DESCRIPTION:Jyeshthamu Krishna Paksham Dwadashi  (12.06.2026)\n\nSamvatsaram: Parabhava Samvatsaram\nAyanam: Uttarayanam\nRuthuvu: Grishma Ruthuvu\nMasam: Jyeshthamu\nPaksham: Krishna Paksham\nTithi: upto 7.37 PM Dwadashi\, thereafter Trayodashi\nVaram: Shukravaram\nNakshatram: upto 7.05 AM Aswini (4 Padam)\, upto 4.41 AM Bharani\, and then Kruthika\nYogam: Atiganda\nKaranam: Kaulavai\nRahu Kalam: 10.37 AM to 12.15 PM\nYamagandam: 3.33 PM to 5.11 PM\nDurmuhurtham: 8.19 AM to 9.11 AM\, 12.42 PM to 1.34 PM\nAbhijit Muhurtham: 11.49 AM to 12.42 PM\nSuryodayam: 5.41 AM\nSuryastamayam: 6.50 PM\nChandrodayam: 2.40 AM\nChandrashtamam: Kanya\nTaddinam Tithi: Dwadashi\nPradesham: Hyderabad (Telugu Style)
SUMMARY:Jyeshthamu Krishna Paksham Dwadashi  (12.06.2026)
UID:india-te-2026-06-12@panchangam
END:VEVENT
BEGIN:VEVENT
DTSTART;VALUE=DATE:20260722
CATEGORIES:PANCHANGAM
DESCRIPTION:Ashadhamu Shukla Paksham Navami  (22.07.2026)\n\nSamvatsaram: Parabhava Samvatsaram\nAyanam: Dakshinayanam\nRuthuvu: Grishma Ruthuvu\nMasam: Ashadhamu\nPaksham: Shukla Paksham\nTithi: Navami\nVaram: Budhavaram\nNakshatram: upto 11.47 PM Swathi (2 Padam)\, and then Vishakha\nYogam: Sadhya\nKaranam: Balavai\nRahu Kalam: 12.22 PM to 2.00 PM\nYamagandam: 7.29 AM to 9.07 AM\nDurmuhurtham: 10.12 AM to 11.04 AM\nAbhijit Muhurtham: 11.56 AM to 12.48 PM\nSuryodayam: 5.52 AM\nSuryastamayam: 6.52 PM\nChandrodayam: 1.02 PM\nChandrashtamam: Meenam\nTaddinam Tithi: Navami\nPradesham: Hyderabad (Telugu Style)
SUMMARY:Ashadhamu Shukla Paksham Navami  (22.07.2026)
UID:india-te-2026-07-22@panchangam
END:VEVENT
BEGIN:VEVENT
BEGIN:VALARM
ACTION:DISPLAY
DESCRIPTION:
TRIGGER:-P1D
END:VALARM
CATEGORIES:VRATAM
DESCRIPTION:Astronomical duration of Sashti (Shukla).
DTEND:20260620T101709Z
DTSTART:20260619T113021Z
SUMMARY:⏳ Sashti (Shukla)
UID:india-te-202606191700-Sashti(Shukla)@vratam
END:VEVENT
BEGIN:VEVENT
DTSTART;VALUE=DATE:20261026
CATEGORIES:PANCHANGAM
DESCRIPTION:Ashwayujamu Shukla Paksham Pournami 🌕 (26.10.2026)\n\nSamvatsaram: Parabhava Samvatsaram\nAyanam: Dakshinayanam\nRuthuvu: Sarad Ruthuvu\nMasam: Ashwayujamu\nPaksham: Shukla Paksham\nTithi: upto 9.41 AM Pournami\, thereafter Padyami\nVaram: Somavaram\nNakshatram: upto 6.18 PM Aswini (2 Padam)\, and then Bharani\nYogam: Vajra\nKaranam: Bavai\nRahu Kalam: 7.39 AM to 9.06 AM\nYamagandam: 10.33 AM to 11.59 AM\nDurmuhurtham: 12.23 PM to 1.09 PM\nAbhijit Muhurtham: 11.36 AM to 12.23 PM\nSuryodayam: 6.12 AM\nSuryastamayam: 5.47 PM\nChandrodayam: 5.48 PM\nChandrashtamam: Kanya\nTaddinam Tithi: Padyami\nPradesham: Hyderabad (Telugu Style)
SUMMARY:Ashwayujamu Shukla Paksham Pournami 🌕 (26.10.2026)
UID:india-te-2026-10-26@panchangam
END:VEVENT
BEGIN:VEVENT
DTSTART;VALUE=DATE:20260131
CATEGORIES:PANCHANGAM
DESCRIPTION:Maghamu Shukla Paksham Trayodashi  (31.01.2026)\n\nSamvatsaram: Vishvavasu Samvatsaram\nAyanam: Uttarayanam\nRuthuvu: Shishira Ruthuvu\nMasam: Maghamu\nPaksham: Shukla Paksham\nTithi: upto 8.26 AM Trayodashi\, upto 5.53 AM Chaturdashi\, thereafter Pournami\nVaram: Shanivaram\nNakshatram: upto 2.10 AM Punarvasu (1 Padam)\, and then Pushyami\nYogam: Vishkambha\nKaranam: Thaitilai\nRahu Kalam: 9.38 AM to 11.04 AM\nYamagandam: 1.54 PM to 3.20 PM\nDurmuhurtham: 6.48 AM to 7.33 AM\nAbhijit Muhurtham: 12.06 PM to 12.52 PM\nSuryodayam: 6.48 AM\nSuryastamayam: 6.10 PM\nChandrodayam: 4.39 PM\nChandrashtamam: Vrushchikam\nTaddinam Tithi: Chaturdashi\nPradesham: Hyderabad (Telugu Style)
SUMMARY:Maghamu Shukla Paksham Trayodashi  (31.01.2026)
UID:india-te-2026-01-31@panchangam
END:VEVENT
BEGIN:VEVENT
DTSTART;VALUE=DATE:20260410
CATEGORIES:PANCHANGAM
DESCRIPTION:Chaitramu Krishna Paksham Ashtami  (10.04.2026)\n\nSamvatsaram: Parabhava Samvatsaram\nAyanam: Uttarayanam\nRuthuvu: Vasantha Ruthuvu\nMasam: Chaitramu\nPaksham: Krishna Paksham\nTithi: upto 11.16 PM Ashtami\, thereafter Navami\nVaram: Shukravaram\nNakshatram: upto 12.11 PM Poorvashada (4 Padam)\, and then Uttarashada\nYogam: Shiva\nKaranam: Balavai\nRahu Kalam: 10.44 AM to 12.17 PM\nYamagandam: 3.24 PM to 4.57 PM\nDurmuhurtham: 8.33 AM to 9.23 AM\, 12.42 PM to 1.32 PM\nAbhijit Muhurtham: 11.52 AM to 12.42 PM\nSuryodayam: 6.03 AM\nSuryastamayam: 6.31 PM\nChandrodayam: 12.51 AM\nChandrashtamam: Vrushabham\nTaddinam Tithi: Ashtami\nPradesham: Hyderabad (Telugu Style)
SUMMARY:Chaitramu Krishna Paksham Ashtami  (10.04.2026)
UID:india-te-2026-04-10@panchangam
END:VEVENT
BEGIN:VEVENT
DTSTART;VALUE=DATE:20260520
CATEGORIES:PANCHANGAM
DESCRIPTION:Jyeshthamu Shukla Paksham Chavithi  (20.05.2026)\n\nSamvatsaram: Parabhava Samvatsaram\nAyanam: Uttarayanam\nRuthuvu: Grishma Ruthuvu\nMasam: Jyeshthamu\nPaksham: Shukla Paksham\nTithi: upto 11.07 AM Chavithi\, thereafter Panchami\nVaram: Budhavaram\nNakshatram: upto 6.48 AM Arudra (4 Padam)\, upto 4.49 AM Punarvasu\, and then Pushyami\nYogam: Shoola\nKaranam: Vishti\nRahu Kalam: 12.12 PM to 1.50 PM\nYamagandam: 7.20 AM to 8.57 AM\nDurmuhurtham: 10.02 AM to 10.54 AM\nAbhijit Muhurtham: 11.46 AM to 12.38 PM\nSuryodayam: 5.42 AM\nSuryastamayam: 6.42 PM\nChandrodayam: 9.02 AM\nChandrashtamam: Vrushchikam\nTaddinam Tithi: Panchami\nPradesham: Hyderabad (Telugu Style)
SUMMARY:Jyeshthamu Shukla Paksham Chavithi  (20.05.2026)
UID:india-te-2026-05-20@panchangam
END:VEVENT
BEGIN:VEVENT
DTSTART;VALUE=DATE:20260630
CATEGORIES:PANCHANGAM
DESCRIPTION:Jyeshthamu Krishna Paksham Padyami  (30.06.2026)\n\nSamvatsaram: Parabhava Samvatsaram\nAyanam: Dakshinayanam\nRuthuvu: Grishma Ruthuvu\nMasam: Jyeshthamu\nPaksham: Krishna Paksham\nTithi: Padyami\nVaram: Mangalavaram\nNakshatram: Poorvashada (1 Padam)\nYogam: Brahma\nKaranam: Balavai\nRahu Kalam: 3.37 PM to 5.15 PM\nYamagandam: 9.02 AM to 10.41 AM\nDurmuhurtham: 7.30 AM to 8.22 AM\, 11.00 AM to 11.53 AM\nAbhijit Muhurtham: 11.53 AM to 12.45 PM\nSuryodayam: 5.45 AM\nSuryastamayam: 6.54 PM\nChandrodayam: 7.26 PM\nChandrashtamam: Vrushabham\nTaddinam Tithi: Padyami\nPradesham: Hyderabad (Telugu Style)
SUMMARY:Jyeshthamu Krishna Paksham Padyami  (30.06.2026)
UID:india-te-2026-06-30@panchangam
END:VEVENT
BEGIN:VEVENT
BEGIN:VALARM
ACTION:DISPLAY
DESCRIPTION:
TRIGGER:-P1D
END:VALARM
CATEGORIES:VRATAM
DESCRIPTION:Astronomical duration of Ekadashi (Shukla).
DTEND:20260625T143951Z
DTSTART:20260624T124248Z
SUMMARY:⏳ Ekadashi (Shukla)
UID:india-te-202606241812-Ekadashi(Shukla)@vratam
END:VEVENT
END:VCALENDAR