BEGIN:VCALENDAR
VERSION:2.0
PRODID:ics.py - http://git.io/lLljaA
BEGIN:VEVENT
DTSTART;VALUE=DATE:20260715
DESCRIPTION:Aani - 30 (15.07.2026) Wednesday\n\nYear: Parabhava Varudam (Parabhava Nama Samvathsaram)\nAyanam: Dhatchinayanam\nRuthu: Grishma Ruthu\nMonth: Aani Masam (Mithunam Masam)\nPaksham: Shukla Paksham\nThithi: upto 11.51 AM Prathamai\, thereafter Dwitiyai\nDay: {Budha Vasaram} Wednesday\nNakshatthiram: upto 10.23 PM Poosam\, and then Aayilyam\nYogam: Harshana\nKaranam: Bavai\nAmirthathiyogam: Siddha Yogam\nSubayogam: Subayogam\nRaghu Kalam: 12.21 PM to 2.00 PM\nYemakandam: 7.27 AM to 9.05 AM\nKuligai: 9.05 AM to 10.43 AM\nGood time: 5.49 AM to 7.27 AM and 2.00 PM to 3.38 PM\nSun Rise: 5.49 AM\nSun Set: 6.54 PM\nChandhirashtamam: Dhanus\nSoolam: North\nPrayatchittham: Milk / Paal\nSradhdhathithi: Dwitiyai\nLocation: Hyderabad\, India
SUMMARY:Aani - 30 (15.07.2026) Wednesday
UID:india-2026-07-15@panchangam
END:VEVENT
BEGIN:VEVENT
DTSTART;VALUE=DATE:20260825
DESCRIPTION:Aavani - 08 (25.08.2026) Tuesday\n\nYear: Parabhava Varudam (Parabhava Nama Samvathsaram)\nAyanam: Dhatchinayanam\nRuthu: Varsha Ruthu\nMonth: Aavani Masam (Simham Masam)\nPaksham: Shukla Paksham\nThithi: upto 6.21 AM Dwadashi\, thereafter Trayodashi\nDay: {Bhauma Vasaram} Tuesday\nNakshatthiram: upto 11.35 PM Uthiradam\, and then Thiruvonam\nYogam: Aayushman\nKaranam: Balavai\nAmirthathiyogam: Marana Yogam\nSubayogam: \nRaghu Kalam: 3.26 PM to 5.00 PM\nYemakandam: 9.09 AM to 10.43 AM\nKuligai: 10.43 AM to 12.18 PM\nGood time: 7.35 AM to 9.09 AM and 3.26 PM to 5.00 PM\nSun Rise: 6.01 AM\nSun Set: 6.35 PM\nChandhirashtamam: Mithunam\nSoolam: North\nPrayatchittham: Milk / Paal\nSradhdhathithi: Trayodashi\nLocation: Hyderabad\, India
SUMMARY:Aavani - 08 (25.08.2026) Tuesday
UID:india-2026-08-25@panchangam
END:VEVENT
BEGIN:VEVENT
DTSTART;VALUE=DATE:20261030
DESCRIPTION:Aippasi - 13 (30.10.2026) Friday\n\nYear: Parabhava Varudam (Parabhava Nama Samvathsaram)\nAyanam: Dhatchinayanam\nRuthu: Sarath Ruthu\nMonth: Aippasi Masam (Thulam Masam)\nPaksham: Krushna Paksham\nThithi: upto 7.25 PM Panchami\, thereafter Shashti\nDay: {Sukra Vasaram} Friday\nNakshatthiram: upto 9.41 AM Mrigashirsham\, and then Thiruvathirai\nYogam: Shiva\nKaranam: Kaulavai\nAmirthathiyogam: Siddha Yogam\nSubayogam: Subayogam\nRaghu Kalam: 10.33 AM to 11.59 AM\nYemakandam: 2.52 PM to 4.19 PM\nKuligai: 6.13 AM to 7.40 AM\nGood time: 6.13 AM to 7.40 AM and 2.52 PM to 4.19 PM\nSun Rise: 6.13 AM\nSun Set: 5.45 PM\nChandhirashtamam: Virutchigam\nSoolam: West\nPrayatchittham: Jaggery / Vellam\nSradhdhathithi: Panchami\nLocation: Hyderabad\, India
SUMMARY:Aippasi - 13 (30.10.2026) Friday
UID:india-2026-10-30@panchangam
END:VEVENT
BEGIN:VEVENT
DTSTART;VALUE=DATE:20261019
DESCRIPTION:Aippasi - 02 (19.10.2026) Monday\n\nYear: Parabhava Varudam (Parabhava Nama Samvathsaram)\nAyanam: Dhatchinayanam\nRuthu: Sarath Ruthu\nMonth: Aippasi Masam (Thulam Masam)\nPaksham: Shukla Paksham\nThithi: upto 10.52 AM Ashtami\, thereafter Navami\nDay: {Soma Vasaram} Monday\nNakshatthiram: upto 4.23 PM Uthiradam\, and then Thiruvonam\nYogam: Dhriti\nKaranam: Bavai\nAmirthathiyogam: Siddha Yogam\nSubayogam: Subayogam\nRaghu Kalam: 7.37 AM to 9.05 AM\nYemakandam: 10.33 AM to 12 Noon\nKuligai: 12 Noon to 1.28 PM\nGood time: 6.10 AM to 7.37 AM and 12 Noon to 1.28 PM\nSun Rise: 6.10 AM\nSun Set: 5.51 PM\nChandhirashtamam: Mithunam\nSoolam: East\nPrayatchittham: Curd / Thayir\nSradhdhathithi: Navami\nLocation: Hyderabad\, India
SUMMARY:Aippasi - 02 (19.10.2026) Monday
UID:india-2026-10-19@panchangam
END:VEVENT
BEGIN:VEVENT
DTSTART;VALUE=DATE:20261129
DESCRIPTION:Karthigai - 13 (29.11.2026) Sunday\n\nYear: Parabhava Varudam (Parabhava Nama Samvathsaram)\nAyanam: Dhatchinayanam\nRuthu: Sarath Ruthu\nMonth: Karthigai Masam (Virutchigam Masam)\nPaksham: Krushna Paksham\nThithi: upto 1.47 AM Shashti\, thereafter Saptami\nDay: {Ravi Vasaram} Sunday\nNakshatthiram: upto 11.37 AM Poosam\, and then Aayilyam\nYogam: Brahma\nKaranam: Garajai\nAmirthathiyogam: Siddha Yogam\nSubayogam: Subayogam\nRaghu Kalam: 4.15 PM to 5.39 PM\nYemakandam: 12.04 PM to 1.28 PM\nKuligai: 1.28 PM to 2.51 PM\nGood time: 6.28 AM to 7.52 AM and 12.04 PM to 1.28 PM\nSun Rise: 6.28 AM\nSun Set: 5.39 PM\nChandhirashtamam: Dhanus\nSoolam: West\nPrayatchittham: Jaggery / Vellam\nSradhdhathithi: Shashti\nLocation: Hyderabad\, India
SUMMARY:Karthigai - 13 (29.11.2026) Sunday
UID:india-2026-11-29@panchangam
END:VEVENT
BEGIN:VEVENT
DESCRIPTION:Exact Astronomical Duration (Hyderabad\, India)
DTEND:20261121T010200Z
DTSTART:20261120T014609Z
SUMMARY:Shukla Ekadasi
UID:india-202611200146-11@tithi
END:VEVENT
BEGIN:VEVENT
DTSTART;VALUE=DATE:20260124
DESCRIPTION:Thai - 10 (24.01.2026) Saturday\n\nYear: Vishvavasu Varudam (Vishvavasu Nama Samvathsaram)\nAyanam: Utharayanam\nRuthu: Hemantha Ruthu\nMonth: Thai Masam (Makaram Masam)\nPaksham: Shukla Paksham\nThithi: upto 12.40 AM Shashti\, thereafter Saptami\nDay: {Sani Vasaram} Saturday\nNakshatthiram: upto 2.54 PM Uthirattathi\, and then Revathi\nYogam: Shiva\nKaranam: Kaulavai\nAmirthathiyogam: Siddha Yogam\nSubayogam: Subayogam\nRaghu Kalam: 9.38 AM to 11.03 AM\nYemakandam: 1.52 PM to 3.17 PM\nKuligai: 3.17 PM to 4.42 PM\nGood time: 9.38 AM to 11.03 AM and 1.52 PM to 3.17 PM\nSun Rise: 6.49 AM\nSun Set: 6.06 PM\nChandhirashtamam: Simham\nSoolam: East\nPrayatchittham: Curd / Thayir\nSradhdhathithi: Shashti\nLocation: Hyderabad\, India
SUMMARY:Thai - 10 (24.01.2026) Saturday
UID:india-2026-01-24@panchangam
END:VEVENT
BEGIN:VEVENT
DTSTART;VALUE=DATE:20260403
DESCRIPTION:Panguni - 19 (03.04.2026) Friday\n\nYear: Vishvavasu Varudam (Vishvavasu Nama Samvathsaram)\nAyanam: Utharayanam\nRuthu: Shishira Ruthu\nMonth: Panguni Masam (Meenam Masam)\nPaksham: Krushna Paksham\nThithi: upto 8.42 AM Prathamai\, thereafter Dwitiyai\nDay: {Sukra Vasaram} Friday\nNakshatthiram: upto 8.07 PM Chitthirai\, and then Swathi\nYogam: Vyaghata\nKaranam: Kaulavai\nAmirthathiyogam: Siddha Yogam\nSubayogam: Subayogam\nRaghu Kalam: 10.46 AM to 12.19 PM\nYemakandam: 3.24 PM to 4.57 PM\nKuligai: 6.09 AM to 7.41 AM\nGood time: 6.09 AM to 7.41 AM and 12.19 PM to 1.52 PM\nSun Rise: 6.09 AM\nSun Set: 6.29 PM\nChandhirashtamam: Kumbham\nSoolam: West\nPrayatchittham: Jaggery / Vellam\nSradhdhathithi: Dwitiyai\nLocation: Hyderabad\, India
SUMMARY:Panguni - 19 (03.04.2026) Friday
UID:india-2026-04-03@panchangam
END:VEVENT
BEGIN:VEVENT
DTSTART;VALUE=DATE:20260513
DESCRIPTION:Chithirai - 29 (13.05.2026) Wednesday\n\nYear: Parabhava Varudam (Parabhava Nama Samvathsaram)\nAyanam: Utharayanam\nRuthu: Vasantha Ruthu\nMonth: Chithirai Masam (Mesham Masam)\nPaksham: Krushna Paksham\nThithi: upto 1.30 PM Ekadashi\, thereafter Dwadashi\nDay: {Budha Vasaram} Wednesday\nNakshatthiram: upto 12.55 AM Uthirattathi\, and then Revathi\nYogam: Vishkambha\nKaranam: Balavai\nAmirthathiyogam: Siddha Yogam\nSubayogam: Subayogam\nRaghu Kalam: 12.12 PM to 1.49 PM\nYemakandam: 7.21 AM to 8.58 AM\nKuligai: 8.58 AM to 10.35 AM\nGood time: 5.44 AM to 7.21 AM and 1.49 PM to 3.26 PM\nSun Rise: 5.44 AM\nSun Set: 6.40 PM\nChandhirashtamam: Simham\nSoolam: North\nPrayatchittham: Milk / Paal\nSradhdhathithi: Dwadashi\nLocation: Hyderabad\, India
SUMMARY:Chithirai - 29 (13.05.2026) Wednesday
UID:india-2026-05-13@panchangam
END:VEVENT
BEGIN:VEVENT
DTSTART;VALUE=DATE:20260623
DESCRIPTION:Aani - 08 (23.06.2026) Tuesday\n\nYear: Parabhava Varudam (Parabhava Nama Samvathsaram)\nAyanam: Dhatchinayanam\nRuthu: Grishma Ruthu\nMonth: Aani Masam (Mithunam Masam)\nPaksham: Shukla Paksham\nThithi: upto 4.40 PM Navami\, thereafter Dashami\nDay: {Bhauma Vasaram} Tuesday\nNakshatthiram: upto 12.37 PM Hastham\, and then Chitthirai\nYogam: Variyana\nKaranam: Kaulavai\nAmirthathiyogam: Siddha Yogam\nSubayogam: Subayogam\nRaghu Kalam: 3.35 PM to 5.14 PM\nYemakandam: 9.00 AM to 10.39 AM\nKuligai: 10.39 AM to 12.18 PM\nGood time: 7.21 AM to 9.00 AM and 3.35 PM to 5.14 PM\nSun Rise: 5.43 AM\nSun Set: 6.53 PM\nChandhirashtamam: Kumbham\nSoolam: North\nPrayatchittham: Milk / Paal\nSradhdhathithi: Navami\nLocation: Hyderabad\, India
SUMMARY:Aani - 08 (23.06.2026) Tuesday
UID:india-2026-06-23@panchangam
END:VEVENT
BEGIN:VEVENT
DESCRIPTION:Exact Astronomical Duration (Hyderabad\, India)
DTEND:20261128T011022Z
DTSTART:20261127T041902Z
SUMMARY:Sankatahara Chathurthi
UID:india-202611270419-19@tithi
END:VEVENT
BEGIN:VEVENT
DTSTART;VALUE=DATE:20260902
DESCRIPTION:Aavani - 16 (02.09.2026) Wednesday\n\nYear: Parabhava Varudam (Parabhava Nama Samvathsaram)\nAyanam: Dhatchinayanam\nRuthu: Varsha Ruthu\nMonth: Aavani Masam (Simham Masam)\nPaksham: Krushna Paksham\nThithi: upto 6.13 AM Panchami\, upto 4.26 AM Shashti\, thereafter Saptami\nDay: {Budha Vasaram} Wednesday\nNakshatthiram: upto 2.21 AM Bharani\, and then Karthigai\nYogam: Dhruva\nKaranam: Thaitilai\nAmirthathiyogam: Siddha Yogam\nSubayogam: Subayogam\nRaghu Kalam: 12.15 PM to 1.49 PM\nYemakandam: 7.35 AM to 9.08 AM\nKuligai: 9.08 AM to 10.42 AM\nGood time: 6.02 AM to 7.35 AM and 1.49 PM to 3.22 PM\nSun Rise: 6.02 AM\nSun Set: 6.29 PM\nChandhirashtamam: Kanni\nSoolam: North\nPrayatchittham: Milk / Paal\nSradhdhathithi: Shashti\nLocation: Hyderabad\, India
SUMMARY:Aavani - 16 (02.09.2026) Wednesday
UID:india-2026-09-02@panchangam
END:VEVENT
BEGIN:VEVENT
DTSTART;VALUE=DATE:20251229
DESCRIPTION:Margazhi - 07 (29.12.2025) Monday\n\nYear: Vishvavasu Varudam (Vishvavasu Nama Samvathsaram)\nAyanam: Utharayanam\nRuthu: Hemantha Ruthu\nMonth: Margazhi Masam (Dhanus Masam)\nPaksham: Shukla Paksham\nThithi: upto 10.12 AM Navami\, thereafter Dashami\nDay: {Soma Vasaram} Monday\nNakshatthiram: upto 8.18 AM Revathi\, upto 6.40 AM Ashwini\, and then Bharani\nYogam: Parigha\nKaranam: Kaulavai\nAmirthathiyogam: Siddha Yogam\nSubayogam: Subayogam\nRaghu Kalam: 8.08 AM to 9.31 AM\nYemakandam: 10.54 AM to 12.18 PM\nKuligai: 12.18 PM to 1.41 PM\nGood time: 6.45 AM to 8.08 AM and 12.18 PM to 1.41 PM\nSun Rise: 6.45 AM\nSun Set: 5.51 PM\nChandhirashtamam: Simham\nSoolam: East\nPrayatchittham: Curd / Thayir\nSradhdhathithi: Dashami\nLocation: Hyderabad\, India
SUMMARY:Margazhi - 07 (29.12.2025) Monday
UID:india-2025-12-29@panchangam
END:VEVENT
BEGIN:VEVENT
DTSTART;VALUE=DATE:20261206
DESCRIPTION:Karthigai - 20 (06.12.2026) Sunday\n\nYear: Parabhava Varudam (Parabhava Nama Samvathsaram)\nAyanam: Dhatchinayanam\nRuthu: Sarath Ruthu\nMonth: Karthigai Masam (Virutchigam Masam)\nPaksham: Krushna Paksham\nThithi: upto 2.22 AM Trayodashi\, thereafter Chadhurdasi\nDay: {Ravi Vasaram} Sunday\nNakshatthiram: upto 2.22 PM Swathi\, and then Visakam\nYogam: Shobhana\nKaranam: Garajai\nAmirthathiyogam: Siddha Yogam\nSubayogam: Subayogam\nRaghu Kalam: 4.17 PM to 5.41 PM\nYemakandam: 12.06 PM to 1.30 PM\nKuligai: 1.30 PM to 2.53 PM\nGood time: 6.32 AM to 7.56 AM and 12.06 PM to 1.30 PM\nSun Rise: 6.32 AM\nSun Set: 5.41 PM\nChandhirashtamam: Meenam\nSoolam: West\nPrayatchittham: Jaggery / Vellam\nSradhdhathithi: Trayodashi\nLocation: Hyderabad\, India
SUMMARY:Karthigai - 20 (06.12.2026) Sunday
UID:india-2026-12-06@panchangam
END:VEVENT
BEGIN:VEVENT
DTSTART;VALUE=DATE:20260201
DESCRIPTION:Thai - 18 (01.02.2026) Sunday\n\nYear: Vishvavasu Varudam (Vishvavasu Nama Samvathsaram)\nAyanam: Utharayanam\nRuthu: Hemantha Ruthu\nMonth: Thai Masam (Makaram Masam)\nPaksham: Shukla Paksham\nThithi: upto 3.39 AM Pournami\, thereafter Prathamai\nDay: {Ravi Vasaram} Sunday\nNakshatthiram: upto 12.35 AM Poosam\, and then Aayilyam\nYogam: Priti\nKaranam: Vishti\nAmirthathiyogam: Siddha Yogam\nSubayogam: Subayogam\nRaghu Kalam: 4.45 PM to 6.11 PM\nYemakandam: 12.29 PM to 1.55 PM\nKuligai: 1.55 PM to 3.20 PM\nGood time: 6.48 AM to 8.13 AM and 12.29 PM to 1.55 PM\nSun Rise: 6.48 AM\nSun Set: 6.11 PM\nChandhirashtamam: Dhanus\nSoolam: West\nPrayatchittham: Jaggery / Vellam\nSradhdhathithi: Pournami\nLocation: Hyderabad\, India
SUMMARY:Thai - 18 (01.02.2026) Sunday
UID:india-2026-02-01@panchangam
END:VEVENT
BEGIN:VEVENT
DESCRIPTION:Exact Astronomical Duration (Hyderabad\, India)
DTEND:20260818T122106Z
DTSTART:20260817T113033Z
SUMMARY:Shukla Shashti
UID:india-202608171130-6@tithi
END:VEVENT
BEGIN:VEVENT
DTSTART;VALUE=DATE:20260311
DESCRIPTION:Maasi - 26 (11.03.2026) Wednesday\n\nYear: Vishvavasu Varudam (Vishvavasu Nama Samvathsaram)\nAyanam: Utharayanam\nRuthu: Shishira Ruthu\nMonth: Maasi Masam (Kumbham Masam)\nPaksham: Krushna Paksham\nThithi: upto 4.19 AM Ashtami\, thereafter Navami\nDay: {Budha Vasaram} Wednesday\nNakshatthiram: upto 10.44 PM Kettai\, and then Moolam\nYogam: Vajra\nKaranam: Balavai\nAmirthathiyogam: Siddha Yogam\nSubayogam: Subayogam\nRaghu Kalam: 12.26 PM to 1.55 PM\nYemakandam: 7.57 AM to 9.26 AM\nKuligai: 9.26 AM to 10.56 AM\nGood time: 6.27 AM to 7.57 AM and 1.55 PM to 3.25 PM\nSun Rise: 6.27 AM\nSun Set: 6.24 PM\nChandhirashtamam: Mesham\nSoolam: North\nPrayatchittham: Milk / Paal\nSradhdhathithi: Ashtami\nLocation: Hyderabad\, India
SUMMARY:Maasi - 26 (11.03.2026) Wednesday
UID:india-2026-03-11@panchangam
END:VEVENT
BEGIN:VEVENT
DTSTART;VALUE=DATE:20260421
DESCRIPTION:Chithirai - 07 (21.04.2026) Tuesday\n\nYear: Parabhava Varudam (Parabhava Nama Samvathsaram)\nAyanam: Utharayanam\nRuthu: Vasantha Ruthu\nMonth: Chithirai Masam (Mesham Masam)\nPaksham: Shukla Paksham\nThithi: upto 1.20 AM Panchami\, thereafter Shashti\nDay: {Bhauma Vasaram} Tuesday\nNakshatthiram: upto 12.35 AM Mrigashirsham\, and then Thiruvathirai\nYogam: Shobhana\nKaranam: Bavai\nAmirthathiyogam: Siddha Yogam\nSubayogam: Subayogam\nRaghu Kalam: 3.24 PM to 4.58 PM\nYemakandam: 9.05 AM to 10.40 AM\nKuligai: 10.40 AM to 12.14 PM\nGood time: 7.30 AM to 9.05 AM and 3.24 PM to 4.58 PM\nSun Rise: 5.56 AM\nSun Set: 6.33 PM\nChandhirashtamam: Thulam\nSoolam: North\nPrayatchittham: Milk / Paal\nSradhdhathithi: Panchami\nLocation: Hyderabad\, India
SUMMARY:Chithirai - 07 (21.04.2026) Tuesday
UID:india-2026-04-21@panchangam
END:VEVENT
BEGIN:VEVENT
DTSTART;VALUE=DATE:20260531
DESCRIPTION:Vaikasi - 16 (31.05.2026) Sunday\n\nYear: Parabhava Varudam (Parabhava Nama Samvathsaram)\nAyanam: Utharayanam\nRuthu: Vasantha Ruthu\nMonth: Vaikasi Masam (Rishabam Masam)\nPaksham: Shukla Paksham\nThithi: upto 2.15 PM Pournami\, thereafter Prathamai\nDay: {Ravi Vasaram} Sunday\nNakshatthiram: upto 4.56 PM Anusham\, and then Kettai\nYogam: Shiva\nKaranam: Bavai\nAmirthathiyogam: Siddha Yogam\nSubayogam: Subayogam\nRaghu Kalam: 5.08 PM to 6.46 PM\nYemakandam: 12.13 PM to 1.51 PM\nKuligai: 1.51 PM to 3.30 PM\nGood time: 5.40 AM to 7.19 AM and 12.13 PM to 1.51 PM\nSun Rise: 5.40 AM\nSun Set: 6.46 PM\nChandhirashtamam: Mesham\nSoolam: West\nPrayatchittham: Jaggery / Vellam\nSradhdhathithi: Prathamai\nLocation: Hyderabad\, India
SUMMARY:Vaikasi - 16 (31.05.2026) Sunday
UID:india-2026-05-31@panchangam
END:VEVENT
BEGIN:VEVENT
DTSTART;VALUE=DATE:20260810
DESCRIPTION:Aadi - 24 (10.08.2026) Monday\n\nYear: Parabhava Varudam (Parabhava Nama Samvathsaram)\nAyanam: Dhatchinayanam\nRuthu: Grishma Ruthu\nMonth: Aadi Masam (Katakam Masam)\nPaksham: Krushna Paksham\nThithi: upto 8.01 AM Dwadashi\, upto 4.54 AM Trayodashi\, thereafter Chadhurdasi\nDay: {Soma Vasaram} Monday\nNakshatthiram: upto 1.03 PM Thiruvathirai\, and then Punarpoosam\nYogam: Vajra\nKaranam: Thaitilai\nAmirthathiyogam: Siddha Yogam\nSubayogam: Subayogam\nRaghu Kalam: 7.33 AM to 9.09 AM\nYemakandam: 10.45 AM to 12.21 PM\nKuligai: 12.21 PM to 1.57 PM\nGood time: 5.57 AM to 7.33 AM and 12.21 PM to 1.57 PM\nSun Rise: 5.57 AM\nSun Set: 6.44 PM\nChandhirashtamam: Virutchigam\nSoolam: East\nPrayatchittham: Curd / Thayir\nSradhdhathithi: Trayodashi\nLocation: Hyderabad\, India
SUMMARY:Aadi - 24 (10.08.2026) Monday
UID:india-2026-08-10@panchangam
END:VEVENT
BEGIN:VEVENT
DTSTART;VALUE=DATE:20260920
DESCRIPTION:Purattasi - 03 (20.09.2026) Sunday\n\nYear: Parabhava Varudam (Parabhava Nama Samvathsaram)\nAyanam: Dhatchinayanam\nRuthu: Varsha Ruthu\nMonth: Purattasi Masam (Kanni Masam)\nPaksham: Shukla Paksham\nThithi: upto 5.52 PM Navami\, thereafter Dashami\nDay: {Ravi Vasaram} Sunday\nNakshatthiram: upto 5.19 AM Pooradam\, and then Uthiradam\nYogam: Saubhagya\nKaranam: Kaulavai\nAmirthathiyogam: Siddha Yogam\nSubayogam: Subayogam\nRaghu Kalam: 4.42 PM to 6.14 PM\nYemakandam: 12.09 PM to 1.40 PM\nKuligai: 1.40 PM to 3.11 PM\nGood time: 6.04 AM to 7.35 AM and 12.09 PM to 1.40 PM\nSun Rise: 6.04 AM\nSun Set: 6.14 PM\nChandhirashtamam: Rishabam\nSoolam: West\nPrayatchittham: Jaggery / Vellam\nSradhdhathithi: Navami\nLocation: Hyderabad\, India
SUMMARY:Purattasi - 03 (20.09.2026) Sunday
UID:india-2026-09-20@panchangam
END:VEVENT
BEGIN:VEVENT
DTSTART;VALUE=DATE:20260909
DESCRIPTION:Aavani - 23 (09.09.2026) Wednesday\n\nYear: Parabhava Varudam (Parabhava Nama Samvathsaram)\nAyanam: Dhatchinayanam\nRuthu: Varsha Ruthu\nMonth: Aavani Masam (Simham Masam)\nPaksham: Krushna Paksham\nThithi: upto 12.31 PM Trayodashi\, thereafter Chadhurdasi\nDay: {Budha Vasaram} Wednesday\nNakshatthiram: upto 3.52 PM Aayilyam\, and then Magam\nYogam: Shiva\nKaranam: Vanijai\nAmirthathiyogam: Marana Yogam\nSubayogam: \nRaghu Kalam: 12.13 PM to 1.45 PM\nYemakandam: 7.35 AM to 9.08 AM\nKuligai: 9.08 AM to 10.40 AM\nGood time: 6.03 AM to 7.35 AM and 1.45 PM to 3.18 PM\nSun Rise: 6.03 AM\nSun Set: 6.23 PM\nChandhirashtamam: Dhanus\nSoolam: North\nPrayatchittham: Milk / Paal\nSradhdhathithi: Chadhurdasi\nLocation: Hyderabad\, India
SUMMARY:Aavani - 23 (09.09.2026) Wednesday
UID:india-2026-09-09@panchangam
END:VEVENT
BEGIN:VEVENT
DTSTART;VALUE=DATE:20261004
DESCRIPTION:Purattasi - 17 (04.10.2026) Sunday\n\nYear: Parabhava Varudam (Parabhava Nama Samvathsaram)\nAyanam: Dhatchinayanam\nRuthu: Varsha Ruthu\nMonth: Purattasi Masam (Kanni Masam)\nPaksham: Krushna Paksham\nThithi: upto 3.54 AM Navami\, thereafter Dashami\nDay: {Ravi Vasaram} Sunday\nNakshatthiram: upto 12.52 AM Punarpoosam\, and then Poosam\nYogam: Parigha\nKaranam: Thaitilai\nAmirthathiyogam: Siddha Yogam\nSubayogam: Subayogam\nRaghu Kalam: 4.33 PM to 6.02 PM\nYemakandam: 12.04 PM to 1.34 PM\nKuligai: 1.34 PM to 3.03 PM\nGood time: 6.06 AM to 7.36 AM and 12.04 PM to 1.34 PM\nSun Rise: 6.06 AM\nSun Set: 6.02 PM\nChandhirashtamam: Virutchigam\nSoolam: West\nPrayatchittham: Jaggery / Vellam\nSradhdhathithi: Navami\nLocation: Hyderabad\, India
SUMMARY:Purattasi - 17 (04.10.2026) Sunday
UID:india-2026-10-04@panchangam
END:VEVENT
BEGIN:VEVENT
DTSTART;VALUE=DATE:20261114
DESCRIPTION:Aippasi - 28 (14.11.2026) Saturday\n\nYear: Parabhava Varudam (Parabhava Nama Samvathsaram)\nAyanam: Dhatchinayanam\nRuthu: Sarath Ruthu\nMonth: Aippasi Masam (Thulam Masam)\nPaksham: Shukla Paksham\nThithi: upto 11.24 PM Panchami\, thereafter Shashti\nDay: {Sani Vasaram} Saturday\nNakshatthiram: upto 9.10 PM Pooradam\, and then Uthiradam\nYogam: Dhriti\nKaranam: Bavai\nAmirthathiyogam: Siddha Yogam\nSubayogam: Subayogam\nRaghu Kalam: 9.10 AM to 10.35 AM\nYemakandam: 1.25 PM to 2.50 PM\nKuligai: 2.50 PM to 4.15 PM\nGood time: 9.10 AM to 10.35 AM and 1.25 PM to 2.50 PM\nSun Rise: 6.20 AM\nSun Set: 5.40 PM\nChandhirashtamam: Rishabam\nSoolam: East\nPrayatchittham: Curd / Thayir\nSradhdhathithi: Panchami\nLocation: Hyderabad\, India
SUMMARY:Aippasi - 28 (14.11.2026) Saturday
UID:india-2026-11-14@panchangam
END:VEVENT
BEGIN:VEVENT
DTSTART;VALUE=DATE:20261224
DESCRIPTION:Margazhi - 08 (24.12.2026) Thursday\n\nYear: Parabhava Varudam (Parabhava Nama Samvathsaram)\nAyanam: Utharayanam\nRuthu: Hemantha Ruthu\nMonth: Margazhi Masam (Dhanus Masam)\nPaksham: Shukla Paksham\nThithi: upto 6.58 AM Pournami\, upto 3.07 AM Prathamai\, thereafter Dwitiyai\nDay: {Guru Vasaram} Thursday\nNakshatthiram: upto 2.22 AM Thiruvathirai\, and then Punarpoosam\nYogam: Shukla\nKaranam: Bavai\nAmirthathiyogam: Siddha Yogam\nSubayogam: Subayogam\nRaghu Kalam: 1.38 PM to 3.01 PM\nYemakandam: 6.42 AM to 8.05 AM\nKuligai: 8.05 AM to 9.29 AM\nGood time: 6.42 AM to 8.05 AM and 12.15 PM to 1.38 PM\nSun Rise: 6.42 AM\nSun Set: 5.48 PM\nChandhirashtamam: Virutchigam\nSoolam: South\nPrayatchittham: Oil / Thailam\nSradhdhathithi: Prathamai\nLocation: Hyderabad\, India
SUMMARY:Margazhi - 08 (24.12.2026) Thursday
UID:india-2026-12-24@panchangam
END:VEVENT
BEGIN:VEVENT
DESCRIPTION:Exact Astronomical Duration (Hyderabad\, India)
DTEND:20260930T092549Z
DTSTART:20260929T114041Z
SUMMARY:Sankatahara Chathurthi
UID:india-202609291140-19@tithi
END:VEVENT
BEGIN:VEVENT
DESCRIPTION:Exact Astronomical Duration (Hyderabad\, India)
DTEND:20260604T180057Z
DTSTART:20260603T155145Z
SUMMARY:Sankatahara Chathurthi
UID:india-202606031551-19@tithi
END:VEVENT
BEGIN:VEVENT
DTSTART;VALUE=DATE:20260208
DESCRIPTION:Thai - 25 (08.02.2026) Sunday\n\nYear: Vishvavasu Varudam (Vishvavasu Nama Samvathsaram)\nAyanam: Utharayanam\nRuthu: Hemantha Ruthu\nMonth: Thai Masam (Makaram Masam)\nPaksham: Krushna Paksham\nThithi: upto 5.01 AM Saptami\, thereafter Ashtami\nDay: {Ravi Vasaram} Sunday\nNakshatthiram: upto 5.46 AM Swathi\, and then Visakam\nYogam: Ganda\nKaranam: Vishti\nAmirthathiyogam: Siddha Yogam\nSubayogam: Subayogam\nRaghu Kalam: 4.48 PM to 6.14 PM\nYemakandam: 12.30 PM to 1.56 PM\nKuligai: 1.56 PM to 3.22 PM\nGood time: 6.45 AM to 8.11 AM and 12.30 PM to 1.56 PM\nSun Rise: 6.45 AM\nSun Set: 6.14 PM\nChandhirashtamam: Meenam\nSoolam: West\nPrayatchittham: Jaggery / Vellam\nSradhdhathithi: Saptami\nLocation: Hyderabad\, India
SUMMARY:Thai - 25 (08.02.2026) Sunday
UID:india-2026-02-08@panchangam
END:VEVENT
BEGIN:VEVENT
DTSTART;VALUE=DATE:20260318
DESCRIPTION:Panguni - 03 (18.03.2026) Wednesday\n\nYear: Vishvavasu Varudam (Vishvavasu Nama Samvathsaram)\nAyanam: Utharayanam\nRuthu: Shishira Ruthu\nMonth: Panguni Masam (Meenam Masam)\nPaksham: Krushna Paksham\nThithi: upto 8.25 AM Chadhurdasi\, thereafter Amavasai\nDay: {Budha Vasaram} Wednesday\nNakshatthiram: upto 6.47 AM Sathayam\, upto 5.59 AM Poorattathi\, and then Uthirattathi\nYogam: Sadhya\nKaranam: Shakuni\nAmirthathiyogam: Siddha Yogam\nSubayogam: Subayogam\nRaghu Kalam: 12.24 PM to 1.54 PM\nYemakandam: 7.52 AM to 9.23 AM\nKuligai: 9.23 AM to 10.53 AM\nGood time: 6.22 AM to 7.52 AM and 1.54 PM to 3.25 PM\nSun Rise: 6.22 AM\nSun Set: 6.26 PM\nChandhirashtamam: Katakam\nSoolam: North\nPrayatchittham: Milk / Paal\nSradhdhathithi: Amavasai\nLocation: Hyderabad\, India
SUMMARY:Panguni - 03 (18.03.2026) Wednesday
UID:india-2026-03-18@panchangam
END:VEVENT
BEGIN:VEVENT
DTSTART;VALUE=DATE:20260428
DESCRIPTION:Chithirai - 14 (28.04.2026) Tuesday\n\nYear: Parabhava Varudam (Parabhava Nama Samvathsaram)\nAyanam: Utharayanam\nRuthu: Vasantha Ruthu\nMonth: Chithirai Masam (Mesham Masam)\nPaksham: Shukla Paksham\nThithi: upto 6.52 PM Dwadashi\, thereafter Trayodashi\nDay: {Bhauma Vasaram} Tuesday\nNakshatthiram: upto 11.18 PM Uthiram\, and then Hastham\nYogam: Vyaghata\nKaranam: Bavai\nAmirthathiyogam: Siddha Yogam\nSubayogam: Subayogam\nRaghu Kalam: 3.24 PM to 4.59 PM\nYemakandam: 9.02 AM to 10.38 AM\nKuligai: 10.38 AM to 12.13 PM\nGood time: 7.27 AM to 9.02 AM and 3.24 PM to 4.59 PM\nSun Rise: 5.51 AM\nSun Set: 6.35 PM\nChandhirashtamam: Kumbham\nSoolam: North\nPrayatchittham: Milk / Paal\nSradhdhathithi: Dwadashi\nLocation: Hyderabad\, India
SUMMARY:Chithirai - 14 (28.04.2026) Tuesday
UID:india-2026-04-28@panchangam
END:VEVENT
BEGIN:VEVENT
DTSTART;VALUE=DATE:20260707
DESCRIPTION:Aani - 22 (07.07.2026) Tuesday\n\nYear: Parabhava Varudam (Parabhava Nama Samvathsaram)\nAyanam: Dhatchinayanam\nRuthu: Grishma Ruthu\nMonth: Aani Masam (Mithunam Masam)\nPaksham: Krushna Paksham\nThithi: upto 1.25 PM Saptami\, thereafter Ashtami\nDay: {Bhauma Vasaram} Tuesday\nNakshatthiram: upto 5.04 PM Uthirattathi\, and then Revathi\nYogam: Shobhana\nKaranam: Bavai\nAmirthathiyogam: Marana Yogam\nSubayogam: \nRaghu Kalam: 3.37 PM to 5.16 PM\nYemakandam: 9.04 AM to 10.42 AM\nKuligai: 10.42 AM to 12.20 PM\nGood time: 7.25 AM to 9.04 AM and 3.37 PM to 5.16 PM\nSun Rise: 5.47 AM\nSun Set: 6.54 PM\nChandhirashtamam: Simham\nSoolam: North\nPrayatchittham: Milk / Paal\nSradhdhathithi: Ashtami\nLocation: Hyderabad\, India
SUMMARY:Aani - 22 (07.07.2026) Tuesday
UID:india-2026-07-07@panchangam
END:VEVENT
BEGIN:VEVENT
DTSTART;VALUE=DATE:20260817
DESCRIPTION:Aadi - 31 (17.08.2026) Monday\n\nYear: Parabhava Varudam (Parabhava Nama Samvathsaram)\nAyanam: Dhatchinayanam\nRuthu: Grishma Ruthu\nMonth: Aadi Masam (Katakam Masam)\nPaksham: Shukla Paksham\nThithi: upto 5.00 PM Panchami\, thereafter Shashti\nDay: {Soma Vasaram} Monday\nNakshatthiram: upto 5.41 AM Chitthirai\, and then Swathi\nYogam: Shubha\nKaranam: Balavai\nAmirthathiyogam: Marana Yogam\nSubayogam: \nRaghu Kalam: 7.34 AM to 9.09 AM\nYemakandam: 10.44 AM to 12.20 PM\nKuligai: 12.20 PM to 1.55 PM\nGood time: 5.59 AM to 7.34 AM and 12.20 PM to 1.55 PM\nSun Rise: 5.59 AM\nSun Set: 6.40 PM\nChandhirashtamam: Kumbham\nSoolam: East\nPrayatchittham: Curd / Thayir\nSradhdhathithi: Panchami\nLocation: Hyderabad\, India
SUMMARY:Aadi - 31 (17.08.2026) Monday
UID:india-2026-08-17@panchangam
END:VEVENT
BEGIN:VEVENT
DTSTART;VALUE=DATE:20260927
DESCRIPTION:Purattasi - 10 (27.09.2026) Sunday\n\nYear: Parabhava Varudam (Parabhava Nama Samvathsaram)\nAyanam: Dhatchinayanam\nRuthu: Varsha Ruthu\nMonth: Purattasi Masam (Kanni Masam)\nPaksham: Krushna Paksham\nThithi: upto 8.59 PM Prathamai\, thereafter Dwitiyai\nDay: {Ravi Vasaram} Sunday\nNakshatthiram: upto 11.47 AM Uthirattathi\, and then Revathi\nYogam: Vriddhi\nKaranam: Balavai\nAmirthathiyogam: Siddha Yogam\nSubayogam: Subayogam\nRaghu Kalam: 4.37 PM to 6.08 PM\nYemakandam: 12.06 PM to 1.37 PM\nKuligai: 1.37 PM to 3.07 PM\nGood time: 6.05 AM to 7.36 AM and 12.06 PM to 1.37 PM\nSun Rise: 6.05 AM\nSun Set: 6.08 PM\nChandhirashtamam: Simham\nSoolam: West\nPrayatchittham: Jaggery / Vellam\nSradhdhathithi: Prathamai\nLocation: Hyderabad\, India
SUMMARY:Purattasi - 10 (27.09.2026) Sunday
UID:india-2026-09-27@panchangam
END:VEVENT
BEGIN:VEVENT
DTSTART;VALUE=DATE:20261022
DESCRIPTION:Aippasi - 05 (22.10.2026) Thursday\n\nYear: Parabhava Varudam (Parabhava Nama Samvathsaram)\nAyanam: Dhatchinayanam\nRuthu: Sarath Ruthu\nMonth: Aippasi Masam (Thulam Masam)\nPaksham: Shukla Paksham\nThithi: upto 2.48 PM Ekadashi\, thereafter Dwadashi\nDay: {Guru Vasaram} Thursday\nNakshatthiram: upto 9.30 PM Sathayam\, and then Poorattathi\nYogam: Vriddhi\nKaranam: Vishti\nAmirthathiyogam: Siddha Yogam\nSubayogam: Subayogam\nRaghu Kalam: 1.27 PM to 2.55 PM\nYemakandam: 6.10 AM to 7.38 AM\nKuligai: 7.38 AM to 9.05 AM\nGood time: 6.10 AM to 7.38 AM and 12 Noon to 1.27 PM\nSun Rise: 6.10 AM\nSun Set: 5.49 PM\nChandhirashtamam: Katakam\nSoolam: South\nPrayatchittham: Oil / Thailam\nSradhdhathithi: Ekadashi\nLocation: Hyderabad\, India
SUMMARY:Aippasi - 05 (22.10.2026) Thursday
UID:india-2026-10-22@panchangam
END:VEVENT
BEGIN:VEVENT
DTSTART;VALUE=DATE:20260116
DESCRIPTION:Thai - 02 (16.01.2026) Friday\n\nYear: Vishvavasu Varudam (Vishvavasu Nama Samvathsaram)\nAyanam: Utharayanam\nRuthu: Hemantha Ruthu\nMonth: Thai Masam (Makaram Masam)\nPaksham: Krushna Paksham\nThithi: upto 10.22 PM Trayodashi\, thereafter Chadhurdasi\nDay: {Sukra Vasaram} Friday\nNakshatthiram: Moolam\nYogam: Dhruva\nKaranam: Garajai\nAmirthathiyogam: Siddha Yogam\nSubayogam: Subayogam\nRaghu Kalam: 11.01 AM to 12.25 PM\nYemakandam: 3.13 PM to 4.38 PM\nKuligai: 6.49 AM to 8.13 AM\nGood time: 6.49 AM to 8.13 AM and 12.25 PM to 1.49 PM\nSun Rise: 6.49 AM\nSun Set: 6.02 PM\nChandhirashtamam: Rishabam\nSoolam: West\nPrayatchittham: Jaggery / Vellam\nSradhdhathithi: Trayodashi\nLocation: Hyderabad\, India
SUMMARY:Thai - 02 (16.01.2026) Friday
UID:india-2026-01-16@panchangam
END:VEVENT
BEGIN:VEVENT
DTSTART;VALUE=DATE:20260226
DESCRIPTION:Maasi - 13 (26.02.2026) Thursday\n\nYear: Vishvavasu Varudam (Vishvavasu Nama Samvathsaram)\nAyanam: Utharayanam\nRuthu: Shishira Ruthu\nMonth: Maasi Masam (Kumbham Masam)\nPaksham: Shukla Paksham\nThithi: upto 12.33 AM Dashami\, thereafter Ekadashi\nDay: {Guru Vasaram} Thursday\nNakshatthiram: upto 12.48 PM Mrigashirsham\, and then Thiruvathirai\nYogam: Priti\nKaranam: Thaitilai\nAmirthathiyogam: Marana Yogam\nSubayogam: \nRaghu Kalam: 1.57 PM to 3.25 PM\nYemakandam: 6.36 AM to 8.04 AM\nKuligai: 8.04 AM to 9.32 AM\nGood time: 6.36 AM to 8.04 AM and 12.29 PM to 1.57 PM\nSun Rise: 6.36 AM\nSun Set: 6.21 PM\nChandhirashtamam: Virutchigam\nSoolam: South\nPrayatchittham: Oil / Thailam\nSradhdhathithi: Dashami\nLocation: Hyderabad\, India
SUMMARY:Maasi - 13 (26.02.2026) Thursday
UID:india-2026-02-26@panchangam
END:VEVENT
BEGIN:VEVENT
DTSTART;VALUE=DATE:20260505
DESCRIPTION:Chithirai - 21 (05.05.2026) Tuesday\n\nYear: Parabhava Varudam (Parabhava Nama Samvathsaram)\nAyanam: Utharayanam\nRuthu: Vasantha Ruthu\nMonth: Chithirai Masam (Mesham Masam)\nPaksham: Krushna Paksham\nThithi: Chathurthi\nDay: {Bhauma Vasaram} Tuesday\nNakshatthiram: upto 1.39 PM Kettai\, and then Moolam\nYogam: Shiva\nKaranam: Bavai\nAmirthathiyogam: Siddha Yogam\nSubayogam: Subayogam\nRaghu Kalam: 3.25 PM to 5.01 PM\nYemakandam: 9.00 AM to 10.36 AM\nKuligai: 10.36 AM to 12.12 PM\nGood time: 7.24 AM to 9.00 AM and 3.25 PM to 5.01 PM\nSun Rise: 5.48 AM\nSun Set: 6.37 PM\nChandhirashtamam: Mesham\nSoolam: North\nPrayatchittham: Milk / Paal\nSradhdhathithi: Chathurthi\nLocation: Hyderabad\, India
SUMMARY:Chithirai - 21 (05.05.2026) Tuesday
UID:india-2026-05-05@panchangam
END:VEVENT
BEGIN:VEVENT
DTSTART;VALUE=DATE:20260615
DESCRIPTION:Vaikasi - 31 (15.06.2026) Monday\n\nYear: Parabhava Varudam (Parabhava Nama Samvathsaram)\nAyanam: Utharayanam\nRuthu: Vasantha Ruthu\nMonth: Vaikasi Masam (Rishabam Masam)\nPaksham: Krushna Paksham\nThithi: upto 8.24 AM Amavasai\, upto 4.31 AM Prathamai\, thereafter Dwitiyai\nDay: {Soma Vasaram} Monday\nNakshatthiram: upto 7.43 PM Mrigashirsham\, and then Thiruvathirai\nYogam: Shoola\nKaranam: Nagava\nAmirthathiyogam: Amirtha Yogam\nSubayogam: Subayogam\nRaghu Kalam: 7.20 AM to 8.59 AM\nYemakandam: 10.37 AM to 12.16 PM\nKuligai: 12.16 PM to 1.55 PM\nGood time: 5.41 AM to 7.20 AM and 12.16 PM to 1.55 PM\nSun Rise: 5.41 AM\nSun Set: 6.51 PM\nChandhirashtamam: Thulam\nSoolam: East\nPrayatchittham: Curd / Thayir\nSradhdhathithi: Prathamai\nLocation: Hyderabad\, India
SUMMARY:Vaikasi - 31 (15.06.2026) Monday
UID:india-2026-06-15@panchangam
END:VEVENT
BEGIN:VEVENT
DTSTART;VALUE=DATE:20260725
DESCRIPTION:Aadi - 08 (25.07.2026) Saturday\n\nYear: Parabhava Varudam (Parabhava Nama Samvathsaram)\nAyanam: Dhatchinayanam\nRuthu: Grishma Ruthu\nMonth: Aadi Masam (Katakam Masam)\nPaksham: Shukla Paksham\nThithi: upto 11.34 AM Ekadashi\, thereafter Dwadashi\nDay: {Sani Vasaram} Saturday\nNakshatthiram: Kettai\nYogam: Brahma\nKaranam: Vishti\nAmirthathiyogam: Siddha Yogam\nSubayogam: Subayogam\nRaghu Kalam: 9.07 AM to 10.45 AM\nYemakandam: 1.59 PM to 3.37 PM\nKuligai: 3.37 PM to 5.14 PM\nGood time: 9.07 AM to 10.45 AM and 1.59 PM to 3.37 PM\nSun Rise: 5.53 AM\nSun Set: 6.51 PM\nChandhirashtamam: Mesham\nSoolam: East\nPrayatchittham: Curd / Thayir\nSradhdhathithi: Dwadashi\nLocation: Hyderabad\, India
SUMMARY:Aadi - 08 (25.07.2026) Saturday
UID:india-2026-07-25@panchangam
END:VEVENT
BEGIN:VEVENT
DTSTART;VALUE=DATE:20261029
DESCRIPTION:Aippasi - 12 (29.10.2026) Thursday\n\nYear: Parabhava Varudam (Parabhava Nama Samvathsaram)\nAyanam: Dhatchinayanam\nRuthu: Sarath Ruthu\nMonth: Aippasi Masam (Thulam Masam)\nPaksham: Krushna Paksham\nThithi: upto 10.10 PM Chathurthi\, thereafter Panchami\nDay: {Guru Vasaram} Thursday\nNakshatthiram: upto 11.48 AM Rohini\, and then Mrigashirsham\nYogam: Parigha\nKaranam: Bavai\nAmirthathiyogam: Siddha Yogam\nSubayogam: Subayogam\nRaghu Kalam: 1.26 PM to 2.52 PM\nYemakandam: 6.13 AM to 7.39 AM\nKuligai: 7.39 AM to 9.06 AM\nGood time: 6.13 AM to 7.39 AM and 1.26 PM to 2.52 PM\nSun Rise: 6.13 AM\nSun Set: 5.46 PM\nChandhirashtamam: Thulam\nSoolam: South\nPrayatchittham: Oil / Thailam\nSradhdhathithi: Chathurthi\nLocation: Hyderabad\, India
SUMMARY:Aippasi - 12 (29.10.2026) Thursday
UID:india-2026-10-29@panchangam
END:VEVENT
BEGIN:VEVENT
DESCRIPTION:Exact Astronomical Duration (Hyderabad\, India)
DTEND:20260205T185242Z
DTSTART:20260204T184001Z
SUMMARY:Sankatahara Chathurthi
UID:india-202602041840-19@tithi
END:VEVENT
BEGIN:VEVENT
DTSTART;VALUE=DATE:20260303
DESCRIPTION:Maasi - 18 (03.03.2026) Tuesday\n\nYear: Vishvavasu Varudam (Vishvavasu Nama Samvathsaram)\nAyanam: Utharayanam\nRuthu: Shishira Ruthu\nMonth: Maasi Masam (Kumbham Masam)\nPaksham: Shukla Paksham\nThithi: upto 5.07 PM Pournami\, thereafter Prathamai\nDay: {Bhauma Vasaram} Tuesday\nNakshatthiram: upto 8.10 AM Magam\, and then Pooram\nYogam: Sukarman\nKaranam: Bavai\nAmirthathiyogam: Siddha Yogam\nSubayogam: Subayogam\nRaghu Kalam: 3.25 PM to 4.54 PM\nYemakandam: 9.30 AM to 10.59 AM\nKuligai: 10.59 AM to 12.28 PM\nGood time: 8.01 AM to 9.30 AM and 3.25 PM to 4.54 PM\nSun Rise: 6.33 AM\nSun Set: 6.23 PM\nChandhirashtamam: Makaram\nSoolam: North\nPrayatchittham: Milk / Paal\nSradhdhathithi: Pournami\nLocation: Hyderabad\, India
SUMMARY:Maasi - 18 (03.03.2026) Tuesday
UID:india-2026-03-03@panchangam
END:VEVENT
BEGIN:VEVENT
DTSTART;VALUE=DATE:20260413
DESCRIPTION:Panguni - 29 (13.04.2026) Monday\n\nYear: Vishvavasu Varudam (Vishvavasu Nama Samvathsaram)\nAyanam: Utharayanam\nRuthu: Shishira Ruthu\nMonth: Panguni Masam (Meenam Masam)\nPaksham: Krushna Paksham\nThithi: upto 1.09 AM Ekadashi\, thereafter Dwadashi\nDay: {Soma Vasaram} Monday\nNakshatthiram: upto 4.44 PM Avittam\, and then Sathayam\nYogam: Shubha\nKaranam: Bavai\nAmirthathiyogam: Marana Yogam\nSubayogam: \nRaghu Kalam: 7.35 AM to 9.09 AM\nYemakandam: 10.42 AM to 12.16 PM\nKuligai: 12.16 PM to 1.50 PM\nGood time: 6.01 AM to 7.35 AM and 12.16 PM to 1.50 PM\nSun Rise: 6.01 AM\nSun Set: 6.31 PM\nChandhirashtamam: Katakam\nSoolam: East\nPrayatchittham: Curd / Thayir\nSradhdhathithi: Ekadashi\nLocation: Hyderabad\, India
SUMMARY:Panguni - 29 (13.04.2026) Monday
UID:india-2026-04-13@panchangam
END:VEVENT
BEGIN:VEVENT
DTSTART;VALUE=DATE:20260523
DESCRIPTION:Vaikasi - 08 (23.05.2026) Saturday\n\nYear: Parabhava Varudam (Parabhava Nama Samvathsaram)\nAyanam: Utharayanam\nRuthu: Vasantha Ruthu\nMonth: Vaikasi Masam (Rishabam Masam)\nPaksham: Shukla Paksham\nThithi: upto 4.27 AM Ashtami\, thereafter Navami\nDay: {Sani Vasaram} Saturday\nNakshatthiram: upto 2.49 AM Magam\, and then Pooram\nYogam: Dhruva\nKaranam: Vishti\nAmirthathiyogam: Siddha Yogam\nSubayogam: Subayogam\nRaghu Kalam: 8.57 AM to 10.35 AM\nYemakandam: 1.50 PM to 3.28 PM\nKuligai: 3.28 PM to 5.05 PM\nGood time: 8.57 AM to 10.35 AM and 1.50 PM to 3.28 PM\nSun Rise: 5.42 AM\nSun Set: 6.43 PM\nChandhirashtamam: Makaram\nSoolam: East\nPrayatchittham: Curd / Thayir\nSradhdhathithi: Ashtami\nLocation: Hyderabad\, India
SUMMARY:Vaikasi - 08 (23.05.2026) Saturday
UID:india-2026-05-23@panchangam
END:VEVENT
BEGIN:VEVENT
DTSTART;VALUE=DATE:20260802
DESCRIPTION:Aadi - 16 (02.08.2026) Sunday\n\nYear: Parabhava Varudam (Parabhava Nama Samvathsaram)\nAyanam: Dhatchinayanam\nRuthu: Grishma Ruthu\nMonth: Aadi Masam (Katakam Masam)\nPaksham: Krushna Paksham\nThithi: upto 11.15 PM Chathurthi\, thereafter Panchami\nDay: {Ravi Vasaram} Sunday\nNakshatthiram: upto 10.18 PM Poorattathi\, and then Uthirattathi\nYogam: Atiganda\nKaranam: Bavai\nAmirthathiyogam: Siddha Yogam\nSubayogam: Subayogam\nRaghu Kalam: 5.12 PM to 6.48 PM\nYemakandam: 12.22 PM to 1.58 PM\nKuligai: 1.58 PM to 3.35 PM\nGood time: 5.55 AM to 7.32 AM and 12.22 PM to 1.58 PM\nSun Rise: 5.55 AM\nSun Set: 6.48 PM\nChandhirashtamam: Katakam\nSoolam: West\nPrayatchittham: Jaggery / Vellam\nSradhdhathithi: Chathurthi\nLocation: Hyderabad\, India
SUMMARY:Aadi - 16 (02.08.2026) Sunday
UID:india-2026-08-02@panchangam
END:VEVENT
BEGIN:VEVENT
DTSTART;VALUE=DATE:20260912
DESCRIPTION:Aavani - 26 (12.09.2026) Saturday\n\nYear: Parabhava Varudam (Parabhava Nama Samvathsaram)\nAyanam: Dhatchinayanam\nRuthu: Varsha Ruthu\nMonth: Aavani Masam (Simham Masam)\nPaksham: Shukla Paksham\nThithi: upto 7.46 AM Prathamai\, thereafter Dwitiyai\nDay: {Sani Vasaram} Saturday\nNakshatthiram: upto 1.35 PM Uthiram\, and then Hastham\nYogam: Shubha\nKaranam: Bavai\nAmirthathiyogam: Marana Yogam\nSubayogam: \nRaghu Kalam: 9.07 AM to 10.40 AM\nYemakandam: 1.44 PM to 3.16 PM\nKuligai: 3.16 PM to 4.48 PM\nGood time: 9.07 AM to 10.40 AM and 1.44 PM to 3.16 PM\nSun Rise: 6.03 AM\nSun Set: 6.20 PM\nChandhirashtamam: Kumbham\nSoolam: East\nPrayatchittham: Curd / Thayir\nSradhdhathithi: Dwitiyai\nLocation: Hyderabad\, India
SUMMARY:Aavani - 26 (12.09.2026) Saturday
UID:india-2026-09-12@panchangam
END:VEVENT
BEGIN:VEVENT
DTSTART;VALUE=DATE:20261106
DESCRIPTION:Aippasi - 20 (06.11.2026) Friday\n\nYear: Parabhava Varudam (Parabhava Nama Samvathsaram)\nAyanam: Dhatchinayanam\nRuthu: Sarath Ruthu\nMonth: Aippasi Masam (Thulam Masam)\nPaksham: Krushna Paksham\nThithi: upto 10.31 AM Dwadashi\, thereafter Trayodashi\nDay: {Sukra Vasaram} Friday\nNakshatthiram: upto 5.25 AM Hastham\, and then Chitthirai\nYogam: Vaidhriti\nKaranam: Thaitilai\nAmirthathiyogam: Siddha Yogam\nSubayogam: Subayogam\nRaghu Kalam: 10.33 AM to 11.59 AM\nYemakandam: 2.51 PM to 4.16 PM\nKuligai: 6.16 AM to 7.42 AM\nGood time: 6.16 AM to 7.42 AM and 2.51 PM to 4.16 PM\nSun Rise: 6.16 AM\nSun Set: 5.42 PM\nChandhirashtamam: Kumbham\nSoolam: West\nPrayatchittham: Jaggery / Vellam\nSradhdhathithi: Trayodashi\nLocation: Hyderabad\, India
SUMMARY:Aippasi - 20 (06.11.2026) Friday
UID:india-2026-11-06@panchangam
END:VEVENT
BEGIN:VEVENT
DTSTART;VALUE=DATE:20261216
DESCRIPTION:Karthigai - 30 (16.12.2026) Wednesday\n\nYear: Parabhava Varudam (Parabhava Nama Samvathsaram)\nAyanam: Dhatchinayanam\nRuthu: Sarath Ruthu\nMonth: Karthigai Masam (Virutchigam Masam)\nPaksham: Shukla Paksham\nThithi: upto 10.46 PM Saptami\, thereafter Ashtami\nDay: {Budha Vasaram} Wednesday\nNakshatthiram: upto 2.46 PM Sathayam\, and then Poorattathi\nYogam: Vajra\nKaranam: Garajai\nAmirthathiyogam: Siddha Yogam\nSubayogam: Subayogam\nRaghu Kalam: 12.11 PM to 1.34 PM\nYemakandam: 8.01 AM to 9.25 AM\nKuligai: 9.25 AM to 10.48 AM\nGood time: 6.38 AM to 8.01 AM and 1.34 PM to 2.57 PM\nSun Rise: 6.38 AM\nSun Set: 5.44 PM\nChandhirashtamam: Katakam\nSoolam: North\nPrayatchittham: Milk / Paal\nSradhdhathithi: Saptami\nLocation: Hyderabad\, India
SUMMARY:Karthigai - 30 (16.12.2026) Wednesday
UID:india-2026-12-16@panchangam
END:VEVENT
BEGIN:VEVENT
DTSTART;VALUE=DATE:20260101
DESCRIPTION:Margazhi - 10 (01.01.2026) Thursday\n\nYear: Vishvavasu Varudam (Vishvavasu Nama Samvathsaram)\nAyanam: Utharayanam\nRuthu: Hemantha Ruthu\nMonth: Margazhi Masam (Dhanus Masam)\nPaksham: Shukla Paksham\nThithi: upto 10.22 PM Trayodashi\, thereafter Chadhurdasi\nDay: {Guru Vasaram} Thursday\nNakshatthiram: upto 11.23 PM Rohini\, and then Mrigashirsham\nYogam: Shubha\nKaranam: Kaulavai\nAmirthathiyogam: Siddha Yogam\nSubayogam: Subayogam\nRaghu Kalam: 1.42 PM to 3.06 PM\nYemakandam: 6.46 AM to 8.09 AM\nKuligai: 8.09 AM to 9.32 AM\nGood time: 6.46 AM to 8.09 AM and 12.19 PM to 1.42 PM\nSun Rise: 6.46 AM\nSun Set: 5.52 PM\nChandhirashtamam: Thulam\nSoolam: South\nPrayatchittham: Oil / Thailam\nSradhdhathithi: Trayodashi\nLocation: Hyderabad\, India
SUMMARY:Margazhi - 10 (01.01.2026) Thursday
UID:india-2026-01-01@panchangam
END:VEVENT
BEGIN:VEVENT
DTSTART;VALUE=DATE:20260211
DESCRIPTION:Thai - 28 (11.02.2026) Wednesday\n\nYear: Vishvavasu Varudam (Vishvavasu Nama Samvathsaram)\nAyanam: Utharayanam\nRuthu: Hemantha Ruthu\nMonth: Thai Masam (Makaram Masam)\nPaksham: Krushna Paksham\nThithi: upto 9.59 AM Navami\, thereafter Dashami\nDay: {Budha Vasaram} Wednesday\nNakshatthiram: upto 11.37 AM Anusham\, and then Kettai\nYogam: Vyaghata\nKaranam: Garajai\nAmirthathiyogam: Amirtha Yogam\nSubayogam: Subayogam\nRaghu Kalam: 12.30 PM to 1.56 PM\nYemakandam: 8.11 AM to 9.37 AM\nKuligai: 9.37 AM to 11.03 AM\nGood time: 6.44 AM to 8.11 AM and 1.56 PM to 3.23 PM\nSun Rise: 6.44 AM\nSun Set: 6.16 PM\nChandhirashtamam: Mesham\nSoolam: North\nPrayatchittham: Milk / Paal\nSradhdhathithi: Dashami\nLocation: Hyderabad\, India
SUMMARY:Thai - 28 (11.02.2026) Wednesday
UID:india-2026-02-11@panchangam
END:VEVENT
BEGIN:VEVENT
DTSTART;VALUE=DATE:20260321
DESCRIPTION:Panguni - 06 (21.03.2026) Saturday\n\nYear: Vishvavasu Varudam (Vishvavasu Nama Samvathsaram)\nAyanam: Utharayanam\nRuthu: Shishira Ruthu\nMonth: Panguni Masam (Meenam Masam)\nPaksham: Shukla Paksham\nThithi: upto 11.56 PM Tritiyai\, thereafter Chathurthi\nDay: {Sani Vasaram} Saturday\nNakshatthiram: upto 1.14 AM Ashwini\, and then Bharani\nYogam: Indra\nKaranam: Thaitilai\nAmirthathiyogam: Siddha Yogam\nSubayogam: Subayogam\nRaghu Kalam: 9.21 AM to 10.52 AM\nYemakandam: 1.54 PM to 3.25 PM\nKuligai: 3.25 PM to 4.56 PM\nGood time: 9.21 AM to 10.52 AM and 1.54 PM to 3.25 PM\nSun Rise: 6.19 AM\nSun Set: 6.27 PM\nChandhirashtamam: Kanni\nSoolam: East\nPrayatchittham: Curd / Thayir\nSradhdhathithi: Tritiyai\nLocation: Hyderabad\, India
SUMMARY:Panguni - 06 (21.03.2026) Saturday
UID:india-2026-03-21@panchangam
END:VEVENT
BEGIN:VEVENT
DTSTART;VALUE=DATE:20260710
DESCRIPTION:Aani - 25 (10.07.2026) Friday\n\nYear: Parabhava Varudam (Parabhava Nama Samvathsaram)\nAyanam: Dhatchinayanam\nRuthu: Grishma Ruthu\nMonth: Aani Masam (Mithunam Masam)\nPaksham: Krushna Paksham\nThithi: upto 8.16 AM Dashami\, upto 5.23 AM Ekadashi\, thereafter Dwadashi\nDay: {Sukra Vasaram} Friday\nNakshatthiram: upto 1.52 PM Bharani\, and then Karthigai\nYogam: Dhriti\nKaranam: Vishti\nAmirthathiyogam: Siddha Yogam\nSubayogam: Subayogam\nRaghu Kalam: 10.43 AM to 12.21 PM\nYemakandam: 3.37 PM to 5.16 PM\nKuligai: 5.48 AM to 7.26 AM\nGood time: 5.48 AM to 7.26 AM and 12.21 PM to 1.59 PM\nSun Rise: 5.48 AM\nSun Set: 6.54 PM\nChandhirashtamam: Kanni\nSoolam: West\nPrayatchittham: Jaggery / Vellam\nSradhdhathithi: Ekadashi\nLocation: Hyderabad\, India
SUMMARY:Aani - 25 (10.07.2026) Friday
UID:india-2026-07-10@panchangam
END:VEVENT
BEGIN:VEVENT
DTSTART;VALUE=DATE:20260820
DESCRIPTION:Aavani - 03 (20.08.2026) Thursday\n\nYear: Parabhava Varudam (Parabhava Nama Samvathsaram)\nAyanam: Dhatchinayanam\nRuthu: Varsha Ruthu\nMonth: Aavani Masam (Simham Masam)\nPaksham: Shukla Paksham\nThithi: upto 9.18 PM Ashtami\, thereafter Navami\nDay: {Guru Vasaram} Thursday\nNakshatthiram: upto 9.52 AM Visakam\, and then Anusham\nYogam: Indra\nKaranam: Vishti\nAmirthathiyogam: Marana Yogam\nSubayogam: \nRaghu Kalam: 1.54 PM to 3.29 PM\nYemakandam: 6.00 AM to 7.34 AM\nKuligai: 7.34 AM to 9.09 AM\nGood time: 6.00 AM to 7.34 AM and 12.19 PM to 1.54 PM\nSun Rise: 6.00 AM\nSun Set: 6.38 PM\nChandhirashtamam: Mesham\nSoolam: South\nPrayatchittham: Oil / Thailam\nSradhdhathithi: Ashtami\nLocation: Hyderabad\, India
SUMMARY:Aavani - 03 (20.08.2026) Thursday
UID:india-2026-08-20@panchangam
END:VEVENT
BEGIN:VEVENT
DTSTART;VALUE=DATE:20260930
DESCRIPTION:Purattasi - 13 (30.09.2026) Wednesday\n\nYear: Parabhava Varudam (Parabhava Nama Samvathsaram)\nAyanam: Dhatchinayanam\nRuthu: Varsha Ruthu\nMonth: Purattasi Masam (Kanni Masam)\nPaksham: Krushna Paksham\nThithi: upto 2.55 PM Chathurthi\, thereafter Panchami\nDay: {Budha Vasaram} Wednesday\nNakshatthiram: upto 8.14 AM Bharani\, and then Karthigai\nYogam: Vajra\nKaranam: Balavai\nAmirthathiyogam: Siddha Yogam\nSubayogam: Subayogam\nRaghu Kalam: 12.05 PM to 1.35 PM\nYemakandam: 7.36 AM to 9.06 AM\nKuligai: 9.06 AM to 10.36 AM\nGood time: 6.06 AM to 7.36 AM and 1.35 PM to 3.05 PM\nSun Rise: 6.06 AM\nSun Set: 6.05 PM\nChandhirashtamam: Kanni\nSoolam: North\nPrayatchittham: Milk / Paal\nSradhdhathithi: Chathurthi\nLocation: Hyderabad\, India
SUMMARY:Purattasi - 13 (30.09.2026) Wednesday
UID:india-2026-09-30@panchangam
END:VEVENT
BEGIN:VEVENT
DTSTART;VALUE=DATE:20260809
DESCRIPTION:Aadi - 23 (09.08.2026) Sunday\n\nYear: Parabhava Varudam (Parabhava Nama Samvathsaram)\nAyanam: Dhatchinayanam\nRuthu: Grishma Ruthu\nMonth: Aadi Masam (Katakam Masam)\nPaksham: Krushna Paksham\nThithi: upto 11.05 AM Ekadashi\, thereafter Dwadashi\nDay: {Ravi Vasaram} Sunday\nNakshatthiram: upto 3.20 PM Mrigashirsham\, and then Thiruvathirai\nYogam: Vyaghata\nKaranam: Balavai\nAmirthathiyogam: Siddha Yogam\nSubayogam: Subayogam\nRaghu Kalam: 5.09 PM to 6.45 PM\nYemakandam: 12.21 PM to 1.57 PM\nKuligai: 1.57 PM to 3.33 PM\nGood time: 5.57 AM to 7.33 AM and 12.21 PM to 1.57 PM\nSun Rise: 5.57 AM\nSun Set: 6.45 PM\nChandhirashtamam: Virutchigam\nSoolam: West\nPrayatchittham: Jaggery / Vellam\nSradhdhathithi: Dwadashi\nLocation: Hyderabad\, India
SUMMARY:Aadi - 23 (09.08.2026) Sunday
UID:india-2026-08-09@panchangam
END:VEVENT
BEGIN:VEVENT
DTSTART;VALUE=DATE:20260919
DESCRIPTION:Purattasi - 02 (19.09.2026) Saturday\n\nYear: Parabhava Varudam (Parabhava Nama Samvathsaram)\nAyanam: Dhatchinayanam\nRuthu: Varsha Ruthu\nMonth: Purattasi Masam (Kanni Masam)\nPaksham: Shukla Paksham\nThithi: upto 3.27 PM Ashtami\, thereafter Navami\nDay: {Sani Vasaram} Saturday\nNakshatthiram: upto 2.28 AM Moolam\, and then Pooradam\nYogam: Aayushman\nKaranam: Bavai\nAmirthathiyogam: Siddha Yogam\nSubayogam: Subayogam\nRaghu Kalam: 9.07 AM to 10.38 AM\nYemakandam: 1.41 PM to 3.12 PM\nKuligai: 3.12 PM to 4.43 PM\nGood time: 9.07 AM to 10.38 AM and 1.41 PM to 3.12 PM\nSun Rise: 6.04 AM\nSun Set: 6.15 PM\nChandhirashtamam: Rishabam\nSoolam: East\nPrayatchittham: Curd / Thayir\nSradhdhathithi: Ashtami\nLocation: Hyderabad\, India
SUMMARY:Purattasi - 02 (19.09.2026) Saturday
UID:india-2026-09-19@panchangam
END:VEVENT
BEGIN:VEVENT
DTSTART;VALUE=DATE:20261014
DESCRIPTION:Purattasi - 27 (14.10.2026) Wednesday\n\nYear: Parabhava Varudam (Parabhava Nama Samvathsaram)\nAyanam: Dhatchinayanam\nRuthu: Varsha Ruthu\nMonth: Purattasi Masam (Kanni Masam)\nPaksham: Shukla Paksham\nThithi: upto 1.13 AM Chathurthi\, thereafter Panchami\nDay: {Budha Vasaram} Wednesday\nNakshatthiram: upto 4.48 AM Anusham\, and then Kettai\nYogam: Aayushman\nKaranam: Vanijai\nAmirthathiyogam: Amirtha Yogam\nSubayogam: Subayogam\nRaghu Kalam: 12.01 PM to 1.30 PM\nYemakandam: 7.37 AM to 9.05 AM\nKuligai: 9.05 AM to 10.33 AM\nGood time: 6.08 AM to 7.37 AM and 1.30 PM to 2.58 PM\nSun Rise: 6.08 AM\nSun Set: 5.55 PM\nChandhirashtamam: Mesham\nSoolam: North\nPrayatchittham: Milk / Paal\nSradhdhathithi: Chathurthi\nLocation: Hyderabad\, India
SUMMARY:Purattasi - 27 (14.10.2026) Wednesday
UID:india-2026-10-14@panchangam
END:VEVENT
BEGIN:VEVENT
DTSTART;VALUE=DATE:20261124
DESCRIPTION:Karthigai - 08 (24.11.2026) Tuesday\n\nYear: Parabhava Varudam (Parabhava Nama Samvathsaram)\nAyanam: Dhatchinayanam\nRuthu: Sarath Ruthu\nMonth: Karthigai Masam (Virutchigam Masam)\nPaksham: Shukla Paksham\nThithi: upto 8.23 PM Pournami\, thereafter Prathamai\nDay: {Bhauma Vasaram} Tuesday\nNakshatthiram: upto 12.01 AM Karthigai\, and then Rohini\nYogam: Parigha\nKaranam: Vishti\nAmirthathiyogam: Siddha Yogam\nSubayogam: Subayogam\nRaghu Kalam: 2.51 PM to 4.15 PM\nYemakandam: 9.14 AM to 10.38 AM\nKuligai: 10.38 AM to 12.02 PM\nGood time: 7.49 AM to 9.14 AM and 2.51 PM to 4.15 PM\nSun Rise: 6.25 AM\nSun Set: 5.39 PM\nChandhirashtamam: Kanni\nSoolam: North\nPrayatchittham: Milk / Paal\nSradhdhathithi: Pournami\nLocation: Hyderabad\, India
SUMMARY:Karthigai - 08 (24.11.2026) Tuesday
UID:india-2026-11-24@panchangam
END:VEVENT
BEGIN:VEVENT
DTSTART;VALUE=DATE:20260108
DESCRIPTION:Margazhi - 17 (08.01.2026) Thursday\n\nYear: Vishvavasu Varudam (Vishvavasu Nama Samvathsaram)\nAyanam: Utharayanam\nRuthu: Hemantha Ruthu\nMonth: Margazhi Masam (Dhanus Masam)\nPaksham: Krushna Paksham\nThithi: Shashti\nDay: {Guru Vasaram} Thursday\nNakshatthiram: upto 1.05 PM Pooram\, and then Uthiram\nYogam: Saubhagya\nKaranam: Garajai\nAmirthathiyogam: Siddha Yogam\nSubayogam: Subayogam\nRaghu Kalam: 1.46 PM to 3.09 PM\nYemakandam: 6.48 AM to 8.11 AM\nKuligai: 8.11 AM to 9.35 AM\nGood time: 6.48 AM to 8.11 AM and 12.22 PM to 1.46 PM\nSun Rise: 6.48 AM\nSun Set: 5.57 PM\nChandhirashtamam: Makaram\nSoolam: South\nPrayatchittham: Oil / Thailam\nSradhdhathithi: Shashti\nLocation: Hyderabad\, India
SUMMARY:Margazhi - 17 (08.01.2026) Thursday
UID:india-2026-01-08@panchangam
END:VEVENT
BEGIN:VEVENT
DTSTART;VALUE=DATE:20260218
DESCRIPTION:Maasi - 05 (18.02.2026) Wednesday\n\nYear: Vishvavasu Varudam (Vishvavasu Nama Samvathsaram)\nAyanam: Utharayanam\nRuthu: Shishira Ruthu\nMonth: Maasi Masam (Kumbham Masam)\nPaksham: Shukla Paksham\nThithi: upto 4.58 PM Prathamai\, thereafter Dwitiyai\nDay: {Budha Vasaram} Wednesday\nNakshatthiram: upto 9.55 PM Sathayam\, and then Poorattathi\nYogam: Shiva\nKaranam: Bavai\nAmirthathiyogam: Siddha Yogam\nSubayogam: Subayogam\nRaghu Kalam: 12.30 PM to 1.57 PM\nYemakandam: 8.08 AM to 9.35 AM\nKuligai: 9.35 AM to 11.02 AM\nGood time: 6.41 AM to 8.08 AM and 1.57 PM to 3.24 PM\nSun Rise: 6.41 AM\nSun Set: 6.18 PM\nChandhirashtamam: Katakam\nSoolam: North\nPrayatchittham: Milk / Paal\nSradhdhathithi: Prathamai\nLocation: Hyderabad\, India
SUMMARY:Maasi - 05 (18.02.2026) Wednesday
UID:india-2026-02-18@panchangam
END:VEVENT
BEGIN:VEVENT
DTSTART;VALUE=DATE:20260328
DESCRIPTION:Panguni - 13 (28.03.2026) Saturday\n\nYear: Vishvavasu Varudam (Vishvavasu Nama Samvathsaram)\nAyanam: Utharayanam\nRuthu: Shishira Ruthu\nMonth: Panguni Masam (Meenam Masam)\nPaksham: Shukla Paksham\nThithi: upto 8.46 AM Dashami\, thereafter Ekadashi\nDay: {Sani Vasaram} Saturday\nNakshatthiram: upto 3.29 PM Poosam\, and then Aayilyam\nYogam: Sukarman\nKaranam: Garajai\nAmirthathiyogam: Siddha Yogam\nSubayogam: Subayogam\nRaghu Kalam: 9.17 AM to 10.49 AM\nYemakandam: 1.53 PM to 3.24 PM\nKuligai: 3.24 PM to 4.56 PM\nGood time: 9.17 AM to 10.49 AM and 1.53 PM to 3.24 PM\nSun Rise: 6.14 AM\nSun Set: 6.28 PM\nChandhirashtamam: Dhanus\nSoolam: East\nPrayatchittham: Curd / Thayir\nSradhdhathithi: Ekadashi\nLocation: Hyderabad\, India
SUMMARY:Panguni - 13 (28.03.2026) Saturday
UID:india-2026-03-28@panchangam
END:VEVENT
BEGIN:VEVENT
DTSTART;VALUE=DATE:20260607
DESCRIPTION:Vaikasi - 23 (07.06.2026) Sunday\n\nYear: Parabhava Varudam (Parabhava Nama Samvathsaram)\nAyanam: Utharayanam\nRuthu: Vasantha Ruthu\nMonth: Vaikasi Masam (Rishabam Masam)\nPaksham: Krushna Paksham\nThithi: upto 3.25 AM Saptami\, thereafter Ashtami\nDay: {Ravi Vasaram} Sunday\nNakshatthiram: upto 8.38 AM Avittam\, and then Sathayam\nYogam: Vaidhriti\nKaranam: Vishti\nAmirthathiyogam: Siddha Yogam\nSubayogam: Subayogam\nRaghu Kalam: 5.10 PM to 6.48 PM\nYemakandam: 12.14 PM to 1.53 PM\nKuligai: 1.53 PM to 3.31 PM\nGood time: 5.40 AM to 7.19 AM and 12.14 PM to 1.53 PM\nSun Rise: 5.40 AM\nSun Set: 6.48 PM\nChandhirashtamam: Katakam\nSoolam: West\nPrayatchittham: Jaggery / Vellam\nSradhdhathithi: Saptami\nLocation: Hyderabad\, India
SUMMARY:Vaikasi - 23 (07.06.2026) Sunday
UID:india-2026-06-07@panchangam
END:VEVENT
BEGIN:VEVENT
DTSTART;VALUE=DATE:20260717
DESCRIPTION:Aani - 32 (17.07.2026) Friday\n\nYear: Parabhava Varudam (Parabhava Nama Samvathsaram)\nAyanam: Dhatchinayanam\nRuthu: Grishma Ruthu\nMonth: Aani Masam (Mithunam Masam)\nPaksham: Shukla Paksham\nThithi: upto 6.28 AM Tritiyai\, upto 4.43 AM Chathurthi\, thereafter Panchami\nDay: {Sukra Vasaram} Friday\nNakshatthiram: upto 7.13 PM Magam\, and then Pooram\nYogam: Vyatipata\nKaranam: Garajai\nAmirthathiyogam: Siddha Yogam\nSubayogam: Subayogam\nRaghu Kalam: 10.44 AM to 12.22 PM\nYemakandam: 3.37 PM to 5.15 PM\nKuligai: 5.50 AM to 7.28 AM\nGood time: 5.50 AM to 7.28 AM and 12.22 PM to 2.00 PM\nSun Rise: 5.50 AM\nSun Set: 6.53 PM\nChandhirashtamam: Makaram\nSoolam: West\nPrayatchittham: Jaggery / Vellam\nSradhdhathithi: Chathurthi\nLocation: Hyderabad\, India
SUMMARY:Aani - 32 (17.07.2026) Friday
UID:india-2026-07-17@panchangam
END:VEVENT
BEGIN:VEVENT
DTSTART;VALUE=DATE:20260827
DESCRIPTION:Aavani - 10 (27.08.2026) Thursday\n\nYear: Parabhava Varudam (Parabhava Nama Samvathsaram)\nAyanam: Dhatchinayanam\nRuthu: Varsha Ruthu\nMonth: Aavani Masam (Simham Masam)\nPaksham: Shukla Paksham\nThithi: upto 9.09 AM Chadhurdasi\, thereafter Pournami\nDay: {Guru Vasaram} Thursday\nNakshatthiram: upto 2.57 AM Avittam\, and then Sathayam\nYogam: Shobhana\nKaranam: Vanijai\nAmirthathiyogam: Siddha Yogam\nSubayogam: Subayogam\nRaghu Kalam: 1.51 PM to 3.25 PM\nYemakandam: 6.01 AM to 7.35 AM\nKuligai: 7.35 AM to 9.09 AM\nGood time: 6.01 AM to 7.35 AM and 12.17 PM to 1.51 PM\nSun Rise: 6.01 AM\nSun Set: 6.33 PM\nChandhirashtamam: Mithunam\nSoolam: South\nPrayatchittham: Oil / Thailam\nSradhdhathithi: Pournami\nLocation: Hyderabad\, India
SUMMARY:Aavani - 10 (27.08.2026) Thursday
UID:india-2026-08-27@panchangam
END:VEVENT
BEGIN:VEVENT
DESCRIPTION:Exact Astronomical Duration (Hyderabad\, India)
DTEND:20260406T084106Z
DTSTART:20260405T063016Z
SUMMARY:Sankatahara Chathurthi
UID:india-202604050630-19@tithi
END:VEVENT
BEGIN:VEVENT
DTSTART;VALUE=DATE:20261201
DESCRIPTION:Karthigai - 15 (01.12.2026) Tuesday\n\nYear: Parabhava Varudam (Parabhava Nama Samvathsaram)\nAyanam: Dhatchinayanam\nRuthu: Sarath Ruthu\nMonth: Karthigai Masam (Virutchigam Masam)\nPaksham: Krushna Paksham\nThithi: upto 11.14 PM Ashtami\, thereafter Navami\nDay: {Bhauma Vasaram} Tuesday\nNakshatthiram: upto 9.40 AM Magam\, and then Pooram\nYogam: Vaidhriti\nKaranam: Balavai\nAmirthathiyogam: Siddha Yogam\nSubayogam: Subayogam\nRaghu Kalam: 2.52 PM to 4.16 PM\nYemakandam: 9.17 AM to 10.41 AM\nKuligai: 10.41 AM to 12.04 PM\nGood time: 7.53 AM to 9.17 AM and 2.52 PM to 4.16 PM\nSun Rise: 6.29 AM\nSun Set: 5.39 PM\nChandhirashtamam: Makaram\nSoolam: North\nPrayatchittham: Milk / Paal\nSradhdhathithi: Ashtami\nLocation: Hyderabad\, India
SUMMARY:Karthigai - 15 (01.12.2026) Tuesday
UID:india-2026-12-01@panchangam
END:VEVENT
BEGIN:VEVENT
DTSTART;VALUE=DATE:20260126
DESCRIPTION:Thai - 12 (26.01.2026) Monday\n\nYear: Vishvavasu Varudam (Vishvavasu Nama Samvathsaram)\nAyanam: Utharayanam\nRuthu: Hemantha Ruthu\nMonth: Thai Masam (Makaram Masam)\nPaksham: Shukla Paksham\nThithi: upto 9.18 PM Ashtami\, thereafter Navami\nDay: {Soma Vasaram} Monday\nNakshatthiram: upto 1.10 PM Ashwini\, and then Bharani\nYogam: Sadhya\nKaranam: Vishti\nAmirthathiyogam: Siddha Yogam\nSubayogam: Subayogam\nRaghu Kalam: 8.14 AM to 9.38 AM\nYemakandam: 11.03 AM to 12.28 PM\nKuligai: 12.28 PM to 1.53 PM\nGood time: 6.49 AM to 8.14 AM and 12.28 PM to 1.53 PM\nSun Rise: 6.49 AM\nSun Set: 6.08 PM\nChandhirashtamam: Kanni\nSoolam: East\nPrayatchittham: Curd / Thayir\nSradhdhathithi: Ashtami\nLocation: Hyderabad\, India
SUMMARY:Thai - 12 (26.01.2026) Monday
UID:india-2026-01-26@panchangam
END:VEVENT
BEGIN:VEVENT
DTSTART;VALUE=DATE:20260405
DESCRIPTION:Panguni - 21 (05.04.2026) Sunday\n\nYear: Vishvavasu Varudam (Vishvavasu Nama Samvathsaram)\nAyanam: Utharayanam\nRuthu: Shishira Ruthu\nMonth: Panguni Masam (Meenam Masam)\nPaksham: Krushna Paksham\nThithi: upto 12 Noon Tritiyai\, thereafter Chathurthi\nDay: {Ravi Vasaram} Sunday\nNakshatthiram: upto 12.52 AM Visakam\, and then Anusham\nYogam: Vajra\nKaranam: Vishti\nAmirthathiyogam: Marana Yogam\nSubayogam: \nRaghu Kalam: 4.57 PM to 6.30 PM\nYemakandam: 12.18 PM to 1.51 PM\nKuligai: 1.51 PM to 3.24 PM\nGood time: 6.07 AM to 7.40 AM and 12.18 PM to 1.51 PM\nSun Rise: 6.07 AM\nSun Set: 6.30 PM\nChandhirashtamam: Meenam\nSoolam: West\nPrayatchittham: Jaggery / Vellam\nSradhdhathithi: Chathurthi\nLocation: Hyderabad\, India
SUMMARY:Panguni - 21 (05.04.2026) Sunday
UID:india-2026-04-05@panchangam
END:VEVENT
BEGIN:VEVENT
DTSTART;VALUE=DATE:20260515
DESCRIPTION:Chithirai - 31 (15.05.2026) Friday\n\nYear: Parabhava Varudam (Parabhava Nama Samvathsaram)\nAyanam: Utharayanam\nRuthu: Vasantha Ruthu\nMonth: Chithirai Masam (Mesham Masam)\nPaksham: Krushna Paksham\nThithi: upto 8.31 AM Trayodashi\, upto 5.11 AM Chadhurdasi\, thereafter Amavasai\nDay: {Sukra Vasaram} Friday\nNakshatthiram: upto 8.50 PM Ashwini\, and then Bharani\nYogam: Aayushman\nKaranam: Vanijai\nAmirthathiyogam: Siddha Yogam\nSubayogam: Subayogam\nRaghu Kalam: 10.35 AM to 12.12 PM\nYemakandam: 3.26 PM to 5.03 PM\nKuligai: 5.44 AM to 7.21 AM\nGood time: 5.44 AM to 7.21 AM and 12.12 PM to 1.49 PM\nSun Rise: 5.44 AM\nSun Set: 6.40 PM\nChandhirashtamam: Kanni\nSoolam: West\nPrayatchittham: Jaggery / Vellam\nSradhdhathithi: Chadhurdasi\nLocation: Hyderabad\, India
SUMMARY:Chithirai - 31 (15.05.2026) Friday
UID:india-2026-05-15@panchangam
END:VEVENT
BEGIN:VEVENT
DTSTART;VALUE=DATE:20260625
DESCRIPTION:Aani - 10 (25.06.2026) Thursday\n\nYear: Parabhava Varudam (Parabhava Nama Samvathsaram)\nAyanam: Dhatchinayanam\nRuthu: Grishma Ruthu\nMonth: Aani Masam (Mithunam Masam)\nPaksham: Shukla Paksham\nThithi: upto 8.09 PM Ekadashi\, thereafter Dwadashi\nDay: {Guru Vasaram} Thursday\nNakshatthiram: upto 5.13 PM Swathi\, and then Visakam\nYogam: Shiva\nKaranam: Vanijai\nAmirthathiyogam: Siddha Yogam\nSubayogam: Subayogam\nRaghu Kalam: 1.57 PM to 3.36 PM\nYemakandam: 5.43 AM to 7.22 AM\nKuligai: 7.22 AM to 9.01 AM\nGood time: 5.43 AM to 7.22 AM and 12.18 PM to 1.57 PM\nSun Rise: 5.43 AM\nSun Set: 6.53 PM\nChandhirashtamam: Meenam\nSoolam: South\nPrayatchittham: Oil / Thailam\nSradhdhathithi: Ekadashi\nLocation: Hyderabad\, India
SUMMARY:Aani - 10 (25.06.2026) Thursday
UID:india-2026-06-25@panchangam
END:VEVENT
BEGIN:VEVENT
DTSTART;VALUE=DATE:20260904
DESCRIPTION:Aavani - 18 (04.09.2026) Friday\n\nYear: Parabhava Varudam (Parabhava Nama Samvathsaram)\nAyanam: Dhatchinayanam\nRuthu: Varsha Ruthu\nMonth: Aavani Masam (Simham Masam)\nPaksham: Krushna Paksham\nThithi: upto 12.14 AM Ashtami\, thereafter Navami\nDay: {Sukra Vasaram} Friday\nNakshatthiram: upto 11.42 PM Rohini\, and then Mrigashirsham\nYogam: Harshana\nKaranam: Balavai\nAmirthathiyogam: Marana Yogam\nSubayogam: \nRaghu Kalam: 10.41 AM to 12.15 PM\nYemakandam: 3.21 PM to 4.54 PM\nKuligai: 6.02 AM to 7.35 AM\nGood time: 6.02 AM to 7.35 AM and 12.15 PM to 1.48 PM\nSun Rise: 6.02 AM\nSun Set: 6.27 PM\nChandhirashtamam: Thulam\nSoolam: West\nPrayatchittham: Jaggery / Vellam\nSradhdhathithi: Ashtami\nLocation: Hyderabad\, India
SUMMARY:Aavani - 18 (04.09.2026) Friday
UID:india-2026-09-04@panchangam
END:VEVENT
BEGIN:VEVENT
DTSTART;VALUE=DATE:20261208
DESCRIPTION:Karthigai - 22 (08.12.2026) Tuesday\n\nYear: Parabhava Varudam (Parabhava Nama Samvathsaram)\nAyanam: Dhatchinayanam\nRuthu: Sarath Ruthu\nMonth: Karthigai Masam (Virutchigam Masam)\nPaksham: Krushna Paksham\nThithi: upto 6.21 AM Amavasai\, thereafter Prathamai\nDay: {Bhauma Vasaram} Tuesday\nNakshatthiram: upto 7.01 PM Anusham\, and then Kettai\nYogam: Sukarman\nKaranam: Chatushpada\nAmirthathiyogam: Siddha Yogam\nSubayogam: Subayogam\nRaghu Kalam: 2.54 PM to 4.18 PM\nYemakandam: 9.20 AM to 10.44 AM\nKuligai: 10.44 AM to 12.07 PM\nGood time: 7.57 AM to 9.20 AM and 2.54 PM to 4.18 PM\nSun Rise: 6.34 AM\nSun Set: 5.41 PM\nChandhirashtamam: Mesham\nSoolam: North\nPrayatchittham: Milk / Paal\nSradhdhathithi: Amavasai\nLocation: Hyderabad\, India
SUMMARY:Karthigai - 22 (08.12.2026) Tuesday
UID:india-2026-12-08@panchangam
END:VEVENT
BEGIN:VEVENT
DTSTART;VALUE=DATE:20260203
DESCRIPTION:Thai - 20 (03.02.2026) Tuesday\n\nYear: Vishvavasu Varudam (Vishvavasu Nama Samvathsaram)\nAyanam: Utharayanam\nRuthu: Hemantha Ruthu\nMonth: Thai Masam (Makaram Masam)\nPaksham: Krushna Paksham\nThithi: upto 12.41 AM Dwitiyai\, thereafter Tritiyai\nDay: {Bhauma Vasaram} Tuesday\nNakshatthiram: upto 10.49 PM Magam\, and then Pooram\nYogam: Shobhana\nKaranam: Thaitilai\nAmirthathiyogam: Siddha Yogam\nSubayogam: Subayogam\nRaghu Kalam: 3.21 PM to 4.46 PM\nYemakandam: 9.38 AM to 11.04 AM\nKuligai: 11.04 AM to 12.29 PM\nGood time: 8.13 AM to 9.38 AM and 3.21 PM to 4.46 PM\nSun Rise: 6.47 AM\nSun Set: 6.12 PM\nChandhirashtamam: Makaram\nSoolam: North\nPrayatchittham: Milk / Paal\nSradhdhathithi: Dwitiyai\nLocation: Hyderabad\, India
SUMMARY:Thai - 20 (03.02.2026) Tuesday
UID:india-2026-02-03@panchangam
END:VEVENT
BEGIN:VEVENT
DTSTART;VALUE=DATE:20260313
DESCRIPTION:Maasi - 28 (13.03.2026) Friday\n\nYear: Vishvavasu Varudam (Vishvavasu Nama Samvathsaram)\nAyanam: Utharayanam\nRuthu: Shishira Ruthu\nMonth: Maasi Masam (Kumbham Masam)\nPaksham: Krushna Paksham\nThithi: upto 6.29 AM Navami\, thereafter Dashami\nDay: {Sukra Vasaram} Friday\nNakshatthiram: upto 3.46 AM Pooradam\, and then Uthiradam\nYogam: Vyatipata\nKaranam: Garajai\nAmirthathiyogam: Marana Yogam\nSubayogam: \nRaghu Kalam: 10.55 AM to 12.25 PM\nYemakandam: 3.25 PM to 4.55 PM\nKuligai: 6.25 AM to 7.55 AM\nGood time: 6.25 AM to 7.55 AM and 12.25 PM to 1.55 PM\nSun Rise: 6.25 AM\nSun Set: 6.25 PM\nChandhirashtamam: Rishabam\nSoolam: West\nPrayatchittham: Jaggery / Vellam\nSradhdhathithi: Dashami\nLocation: Hyderabad\, India
SUMMARY:Maasi - 28 (13.03.2026) Friday
UID:india-2026-03-13@panchangam
END:VEVENT
BEGIN:VEVENT
DTSTART;VALUE=DATE:20260423
DESCRIPTION:Chithirai - 09 (23.04.2026) Thursday\n\nYear: Parabhava Varudam (Parabhava Nama Samvathsaram)\nAyanam: Utharayanam\nRuthu: Vasantha Ruthu\nMonth: Chithirai Masam (Mesham Masam)\nPaksham: Shukla Paksham\nThithi: upto 8.49 PM Saptami\, thereafter Ashtami\nDay: {Guru Vasaram} Thursday\nNakshatthiram: upto 9.35 PM Punarpoosam\, and then Poosam\nYogam: Sukarman\nKaranam: Garajai\nAmirthathiyogam: Siddha Yogam\nSubayogam: Subayogam\nRaghu Kalam: 1.49 PM to 3.24 PM\nYemakandam: 5.54 AM to 7.29 AM\nKuligai: 7.29 AM to 9.04 AM\nGood time: 5.54 AM to 7.29 AM and 12.14 PM to 1.49 PM\nSun Rise: 5.54 AM\nSun Set: 6.34 PM\nChandhirashtamam: Virutchigam\nSoolam: South\nPrayatchittham: Oil / Thailam\nSradhdhathithi: Saptami\nLocation: Hyderabad\, India
SUMMARY:Chithirai - 09 (23.04.2026) Thursday
UID:india-2026-04-23@panchangam
END:VEVENT
BEGIN:VEVENT
DTSTART;VALUE=DATE:20260702
DESCRIPTION:Aani - 17 (02.07.2026) Thursday\n\nYear: Parabhava Varudam (Parabhava Nama Samvathsaram)\nAyanam: Dhatchinayanam\nRuthu: Grishma Ruthu\nMonth: Aani Masam (Mithunam Masam)\nPaksham: Krushna Paksham\nThithi: upto 9.38 AM Dwitiyai\, thereafter Tritiyai\nDay: {Guru Vasaram} Thursday\nNakshatthiram: upto 10.11 AM Uthiradam\, and then Thiruvonam\nYogam: Vaidhriti\nKaranam: Garajai\nAmirthathiyogam: Siddha Yogam\nSubayogam: Subayogam\nRaghu Kalam: 1.58 PM to 3.37 PM\nYemakandam: 5.45 AM to 7.24 AM\nKuligai: 7.24 AM to 9.02 AM\nGood time: 5.45 AM to 7.24 AM and 12.20 PM to 1.58 PM\nSun Rise: 5.45 AM\nSun Set: 6.54 PM\nChandhirashtamam: Mithunam\nSoolam: South\nPrayatchittham: Oil / Thailam\nSradhdhathithi: Tritiyai\nLocation: Hyderabad\, India
SUMMARY:Aani - 17 (02.07.2026) Thursday
UID:india-2026-07-02@panchangam
END:VEVENT
BEGIN:VEVENT
DTSTART;VALUE=DATE:20260812
DESCRIPTION:Aadi - 26 (12.08.2026) Wednesday\n\nYear: Parabhava Varudam (Parabhava Nama Samvathsaram)\nAyanam: Dhatchinayanam\nRuthu: Grishma Ruthu\nMonth: Aadi Masam (Katakam Masam)\nPaksham: Krushna Paksham\nThithi: upto 11.06 PM Amavasai\, thereafter Prathamai\nDay: {Budha Vasaram} Wednesday\nNakshatthiram: upto 8.36 AM Poosam\, and then Aayilyam\nYogam: Vyatipata\nKaranam: Chatushpada\nAmirthathiyogam: Siddha Yogam\nSubayogam: Subayogam\nRaghu Kalam: 12.21 PM to 1.56 PM\nYemakandam: 7.33 AM to 9.09 AM\nKuligai: 9.09 AM to 10.45 AM\nGood time: 5.58 AM to 7.33 AM and 1.56 PM to 3.32 PM\nSun Rise: 5.58 AM\nSun Set: 6.43 PM\nChandhirashtamam: Dhanus\nSoolam: North\nPrayatchittham: Milk / Paal\nSradhdhathithi: Amavasai\nLocation: Hyderabad\, India
SUMMARY:Aadi - 26 (12.08.2026) Wednesday
UID:india-2026-08-12@panchangam
END:VEVENT
BEGIN:VEVENT
DTSTART;VALUE=DATE:20260922
DESCRIPTION:Purattasi - 05 (22.09.2026) Tuesday\n\nYear: Parabhava Varudam (Parabhava Nama Samvathsaram)\nAyanam: Dhatchinayanam\nRuthu: Varsha Ruthu\nMonth: Purattasi Masam (Kanni Masam)\nPaksham: Shukla Paksham\nThithi: upto 9.43 PM Ekadashi\, thereafter Dwadashi\nDay: {Bhauma Vasaram} Tuesday\nNakshatthiram: upto 7.51 AM Uthiradam\, and then Thiruvonam\nYogam: Atiganda\nKaranam: Vanijai\nAmirthathiyogam: Marana Yogam\nSubayogam: \nRaghu Kalam: 3.10 PM to 4.41 PM\nYemakandam: 9.06 AM to 10.37 AM\nKuligai: 10.37 AM to 12.08 PM\nGood time: 7.35 AM to 9.06 AM and 3.10 PM to 4.41 PM\nSun Rise: 6.04 AM\nSun Set: 6.12 PM\nChandhirashtamam: Mithunam\nSoolam: North\nPrayatchittham: Milk / Paal\nSradhdhathithi: Ekadashi\nLocation: Hyderabad\, India
SUMMARY:Purattasi - 05 (22.09.2026) Tuesday
UID:india-2026-09-22@panchangam
END:VEVENT
BEGIN:VEVENT
DTSTART;VALUE=DATE:20261006
DESCRIPTION:Purattasi - 19 (06.10.2026) Tuesday\n\nYear: Parabhava Varudam (Parabhava Nama Samvathsaram)\nAyanam: Dhatchinayanam\nRuthu: Varsha Ruthu\nMonth: Purattasi Masam (Kanni Masam)\nPaksham: Krushna Paksham\nThithi: upto 12.35 AM Ekadashi\, thereafter Dwadashi\nDay: {Bhauma Vasaram} Tuesday\nNakshatthiram: upto 10.56 PM Aayilyam\, and then Magam\nYogam: Siddha\nKaranam: Bavai\nAmirthathiyogam: Siddha Yogam\nSubayogam: Subayogam\nRaghu Kalam: 3.02 PM to 4.31 PM\nYemakandam: 9.05 AM to 10.34 AM\nKuligai: 10.34 AM to 12.04 PM\nGood time: 7.36 AM to 9.05 AM and 3.02 PM to 4.31 PM\nSun Rise: 6.07 AM\nSun Set: 6.01 PM\nChandhirashtamam: Dhanus\nSoolam: North\nPrayatchittham: Milk / Paal\nSradhdhathithi: Ekadashi\nLocation: Hyderabad\, India
SUMMARY:Purattasi - 19 (06.10.2026) Tuesday
UID:india-2026-10-06@panchangam
END:VEVENT
BEGIN:VEVENT
DTSTART;VALUE=DATE:20261116
DESCRIPTION:Aippasi - 30 (16.11.2026) Monday\n\nYear: Parabhava Varudam (Parabhava Nama Samvathsaram)\nAyanam: Dhatchinayanam\nRuthu: Sarath Ruthu\nMonth: Aippasi Masam (Thulam Masam)\nPaksham: Shukla Paksham\nThithi: upto 4.20 AM Saptami\, thereafter Ashtami\nDay: {Soma Vasaram} Monday\nNakshatthiram: upto 3.02 AM Thiruvonam\, and then Avittam\nYogam: Ganda\nKaranam: Garajai\nAmirthathiyogam: Siddha Yogam\nSubayogam: Subayogam\nRaghu Kalam: 7.46 AM to 9.11 AM\nYemakandam: 10.35 AM to 12 Noon\nKuligai: 12 Noon to 1.25 PM\nGood time: 6.21 AM to 7.46 AM and 12 Noon to 1.25 PM\nSun Rise: 6.21 AM\nSun Set: 5.40 PM\nChandhirashtamam: Mithunam\nSoolam: East\nPrayatchittham: Curd / Thayir\nSradhdhathithi: Saptami\nLocation: Hyderabad\, India
SUMMARY:Aippasi - 30 (16.11.2026) Monday
UID:india-2026-11-16@panchangam
END:VEVENT
BEGIN:VEVENT
DTSTART;VALUE=DATE:20260111
DESCRIPTION:Margazhi - 20 (11.01.2026) Sunday\n\nYear: Vishvavasu Varudam (Vishvavasu Nama Samvathsaram)\nAyanam: Utharayanam\nRuthu: Hemantha Ruthu\nMonth: Margazhi Masam (Dhanus Masam)\nPaksham: Krushna Paksham\nThithi: upto 10.20 AM Ashtami\, thereafter Navami\nDay: {Ravi Vasaram} Sunday\nNakshatthiram: upto 6.56 PM Chitthirai\, and then Swathi\nYogam: Sukarman\nKaranam: Kaulavai\nAmirthathiyogam: Siddha Yogam\nSubayogam: Subayogam\nRaghu Kalam: 4.35 PM to 5.59 PM\nYemakandam: 12.23 PM to 1.47 PM\nKuligai: 1.47 PM to 3.11 PM\nGood time: 6.48 AM to 8.12 AM and 12.23 PM to 1.47 PM\nSun Rise: 6.48 AM\nSun Set: 5.59 PM\nChandhirashtamam: Meenam\nSoolam: West\nPrayatchittham: Jaggery / Vellam\nSradhdhathithi: Navami\nLocation: Hyderabad\, India
SUMMARY:Margazhi - 20 (11.01.2026) Sunday
UID:india-2026-01-11@panchangam
END:VEVENT
BEGIN:VEVENT
DTSTART;VALUE=DATE:20260221
DESCRIPTION:Maasi - 08 (21.02.2026) Saturday\n\nYear: Vishvavasu Varudam (Vishvavasu Nama Samvathsaram)\nAyanam: Utharayanam\nRuthu: Shishira Ruthu\nMonth: Maasi Masam (Kumbham Masam)\nPaksham: Shukla Paksham\nThithi: upto 1.01 PM Chathurthi\, thereafter Panchami\nDay: {Sani Vasaram} Saturday\nNakshatthiram: upto 7.44 PM Revathi\, and then Ashwini\nYogam: Shubha\nKaranam: Vishti\nAmirthathiyogam: Marana Yogam\nSubayogam: \nRaghu Kalam: 9.34 AM to 11.02 AM\nYemakandam: 1.57 PM to 3.24 PM\nKuligai: 3.24 PM to 4.52 PM\nGood time: 9.34 AM to 11.02 AM and 1.57 PM to 3.24 PM\nSun Rise: 6.39 AM\nSun Set: 6.19 PM\nChandhirashtamam: Simham\nSoolam: East\nPrayatchittham: Curd / Thayir\nSradhdhathithi: Panchami\nLocation: Hyderabad\, India
SUMMARY:Maasi - 08 (21.02.2026) Saturday
UID:india-2026-02-21@panchangam
END:VEVENT
BEGIN:VEVENT
DTSTART;VALUE=DATE:20260331
DESCRIPTION:Panguni - 16 (31.03.2026) Tuesday\n\nYear: Vishvavasu Varudam (Vishvavasu Nama Samvathsaram)\nAyanam: Utharayanam\nRuthu: Shishira Ruthu\nMonth: Panguni Masam (Meenam Masam)\nPaksham: Shukla Paksham\nThithi: upto 6.56 AM Trayodashi\, thereafter Chadhurdasi\nDay: {Bhauma Vasaram} Tuesday\nNakshatthiram: upto 4.01 PM Pooram\, and then Uthiram\nYogam: Ganda\nKaranam: Thaitilai\nAmirthathiyogam: Siddha Yogam\nSubayogam: Subayogam\nRaghu Kalam: 3.24 PM to 4.56 PM\nYemakandam: 9.16 AM to 10.48 AM\nKuligai: 10.48 AM to 12.20 PM\nGood time: 7.43 AM to 9.16 AM and 3.24 PM to 4.56 PM\nSun Rise: 6.11 AM\nSun Set: 6.29 PM\nChandhirashtamam: Makaram\nSoolam: North\nPrayatchittham: Milk / Paal\nSradhdhathithi: Chadhurdasi\nLocation: Hyderabad\, India
SUMMARY:Panguni - 16 (31.03.2026) Tuesday
UID:india-2026-03-31@panchangam
END:VEVENT
BEGIN:VEVENT
DTSTART;VALUE=DATE:20260610
DESCRIPTION:Vaikasi - 26 (10.06.2026) Wednesday\n\nYear: Parabhava Varudam (Parabhava Nama Samvathsaram)\nAyanam: Utharayanam\nRuthu: Vasantha Ruthu\nMonth: Vaikasi Masam (Rishabam Masam)\nPaksham: Krushna Paksham\nThithi: upto 12.58 AM Dashami\, thereafter Ekadashi\nDay: {Budha Vasaram} Wednesday\nNakshatthiram: upto 10.00 AM Uthirattathi\, and then Revathi\nYogam: Aayushman\nKaranam: Vanijai\nAmirthathiyogam: Siddha Yogam\nSubayogam: Subayogam\nRaghu Kalam: 12.15 PM to 1.54 PM\nYemakandam: 7.19 AM to 8.58 AM\nKuligai: 8.58 AM to 10.36 AM\nGood time: 5.41 AM to 7.19 AM and 1.54 PM to 3.32 PM\nSun Rise: 5.41 AM\nSun Set: 6.49 PM\nChandhirashtamam: Simham\nSoolam: North\nPrayatchittham: Milk / Paal\nSradhdhathithi: Dashami\nLocation: Hyderabad\, India
SUMMARY:Vaikasi - 26 (10.06.2026) Wednesday
UID:india-2026-06-10@panchangam
END:VEVENT
BEGIN:VEVENT
DTSTART;VALUE=DATE:20260720
DESCRIPTION:Aadi - 03 (20.07.2026) Monday\n\nYear: Parabhava Varudam (Parabhava Nama Samvathsaram)\nAyanam: Dhatchinayanam\nRuthu: Grishma Ruthu\nMonth: Aadi Masam (Katakam Masam)\nPaksham: Shukla Paksham\nThithi: upto 4.03 AM Saptami\, thereafter Ashtami\nDay: {Soma Vasaram} Monday\nNakshatthiram: upto 7.52 PM Hastham\, and then Chitthirai\nYogam: Shiva\nKaranam: Garajai\nAmirthathiyogam: Siddha Yogam\nSubayogam: Subayogam\nRaghu Kalam: 7.29 AM to 9.06 AM\nYemakandam: 10.44 AM to 12.22 PM\nKuligai: 12.22 PM to 2.00 PM\nGood time: 5.51 AM to 7.29 AM and 12.22 PM to 2.00 PM\nSun Rise: 5.51 AM\nSun Set: 6.53 PM\nChandhirashtamam: Kumbham\nSoolam: East\nPrayatchittham: Curd / Thayir\nSradhdhathithi: Saptami\nLocation: Hyderabad\, India
SUMMARY:Aadi - 03 (20.07.2026) Monday
UID:india-2026-07-20@panchangam
END:VEVENT
BEGIN:VEVENT
DTSTART;VALUE=DATE:20260830
DESCRIPTION:Aavani - 13 (30.08.2026) Sunday\n\nYear: Parabhava Varudam (Parabhava Nama Samvathsaram)\nAyanam: Dhatchinayanam\nRuthu: Varsha Ruthu\nMonth: Aavani Masam (Simham Masam)\nPaksham: Krushna Paksham\nThithi: upto 9.37 AM Dwitiyai\, thereafter Tritiyai\nDay: {Ravi Vasaram} Sunday\nNakshatthiram: upto 4.24 AM Uthirattathi\, and then Revathi\nYogam: Dhriti\nKaranam: Garajai\nAmirthathiyogam: Siddha Yogam\nSubayogam: Subayogam\nRaghu Kalam: 4.57 PM to 6.31 PM\nYemakandam: 12.16 PM to 1.50 PM\nKuligai: 1.50 PM to 3.24 PM\nGood time: 6.01 AM to 7.35 AM and 12.16 PM to 1.50 PM\nSun Rise: 6.01 AM\nSun Set: 6.31 PM\nChandhirashtamam: Simham\nSoolam: West\nPrayatchittham: Jaggery / Vellam\nSradhdhathithi: Tritiyai\nLocation: Hyderabad\, India
SUMMARY:Aavani - 13 (30.08.2026) Sunday
UID:india-2026-08-30@panchangam
END:VEVENT
BEGIN:VEVENT
DTSTART;VALUE=DATE:20260709
DESCRIPTION:Aani - 24 (09.07.2026) Thursday\n\nYear: Parabhava Varudam (Parabhava Nama Samvathsaram)\nAyanam: Dhatchinayanam\nRuthu: Grishma Ruthu\nMonth: Aani Masam (Mithunam Masam)\nPaksham: Krushna Paksham\nThithi: upto 10.38 AM Navami\, thereafter Dashami\nDay: {Guru Vasaram} Thursday\nNakshatthiram: upto 3.34 PM Ashwini\, and then Bharani\nYogam: Sukarman\nKaranam: Garajai\nAmirthathiyogam: Siddha Yogam\nSubayogam: Subayogam\nRaghu Kalam: 1.59 PM to 3.37 PM\nYemakandam: 5.47 AM to 7.26 AM\nKuligai: 7.26 AM to 9.04 AM\nGood time: 5.47 AM to 7.26 AM and 12.21 PM to 1.59 PM\nSun Rise: 5.47 AM\nSun Set: 6.54 PM\nChandhirashtamam: Kanni\nSoolam: South\nPrayatchittham: Oil / Thailam\nSradhdhathithi: Dashami\nLocation: Hyderabad\, India
SUMMARY:Aani - 24 (09.07.2026) Thursday
UID:india-2026-07-09@panchangam
END:VEVENT
BEGIN:VEVENT
DTSTART;VALUE=DATE:20260819
DESCRIPTION:Aavani - 02 (19.08.2026) Wednesday\n\nYear: Parabhava Varudam (Parabhava Nama Samvathsaram)\nAyanam: Dhatchinayanam\nRuthu: Varsha Ruthu\nMonth: Aavani Masam (Simham Masam)\nPaksham: Shukla Paksham\nThithi: upto 7.19 PM Saptami\, thereafter Ashtami\nDay: {Budha Vasaram} Wednesday\nNakshatthiram: upto 7.30 AM Swathi\, and then Visakam\nYogam: Brahma\nKaranam: Garajai\nAmirthathiyogam: Siddha Yogam\nSubayogam: Subayogam\nRaghu Kalam: 12.19 PM to 1.54 PM\nYemakandam: 7.34 AM to 9.09 AM\nKuligai: 9.09 AM to 10.44 AM\nGood time: 5.59 AM to 7.34 AM and 1.54 PM to 3.29 PM\nSun Rise: 5.59 AM\nSun Set: 6.39 PM\nChandhirashtamam: Meenam\nSoolam: North\nPrayatchittham: Milk / Paal\nSradhdhathithi: Saptami\nLocation: Hyderabad\, India
SUMMARY:Aavani - 02 (19.08.2026) Wednesday
UID:india-2026-08-19@panchangam
END:VEVENT
BEGIN:VEVENT
DTSTART;VALUE=DATE:20260929
DESCRIPTION:Purattasi - 12 (29.09.2026) Tuesday\n\nYear: Parabhava Varudam (Parabhava Nama Samvathsaram)\nAyanam: Dhatchinayanam\nRuthu: Varsha Ruthu\nMonth: Purattasi Masam (Kanni Masam)\nPaksham: Krushna Paksham\nThithi: upto 5.10 PM Tritiyai\, thereafter Chathurthi\nDay: {Bhauma Vasaram} Tuesday\nNakshatthiram: upto 9.41 AM Ashwini\, and then Bharani\nYogam: Vyaghata\nKaranam: Vanijai\nAmirthathiyogam: Amirtha Yogam\nSubayogam: Subayogam\nRaghu Kalam: 3.06 PM to 4.36 PM\nYemakandam: 9.06 AM to 10.36 AM\nKuligai: 10.36 AM to 12.06 PM\nGood time: 7.36 AM to 9.06 AM and 3.06 PM to 4.36 PM\nSun Rise: 6.05 AM\nSun Set: 6.06 PM\nChandhirashtamam: Kanni\nSoolam: North\nPrayatchittham: Milk / Paal\nSradhdhathithi: Tritiyai\nLocation: Hyderabad\, India
SUMMARY:Purattasi - 12 (29.09.2026) Tuesday
UID:india-2026-09-29@panchangam
END:VEVENT
BEGIN:VEVENT
DTSTART;VALUE=DATE:20261024
DESCRIPTION:Aippasi - 07 (24.10.2026) Saturday\n\nYear: Parabhava Varudam (Parabhava Nama Samvathsaram)\nAyanam: Dhatchinayanam\nRuthu: Sarath Ruthu\nMonth: Aippasi Masam (Thulam Masam)\nPaksham: Shukla Paksham\nThithi: upto 1.37 PM Trayodashi\, thereafter Chadhurdasi\nDay: {Sani Vasaram} Saturday\nNakshatthiram: upto 9.11 PM Uthirattathi\, and then Revathi\nYogam: Vyaghata\nKaranam: Thaitilai\nAmirthathiyogam: Siddha Yogam\nSubayogam: Subayogam\nRaghu Kalam: 9.05 AM to 10.33 AM\nYemakandam: 1.27 PM to 2.54 PM\nKuligai: 2.54 PM to 4.21 PM\nGood time: 9.05 AM to 10.33 AM and 1.27 PM to 2.54 PM\nSun Rise: 6.11 AM\nSun Set: 5.48 PM\nChandhirashtamam: Simham\nSoolam: East\nPrayatchittham: Curd / Thayir\nSradhdhathithi: Chadhurdasi\nLocation: Hyderabad\, India
SUMMARY:Aippasi - 07 (24.10.2026) Saturday
UID:india-2026-10-24@panchangam
END:VEVENT
BEGIN:VEVENT
DTSTART;VALUE=DATE:20260118
DESCRIPTION:Thai - 04 (18.01.2026) Sunday\n\nYear: Vishvavasu Varudam (Vishvavasu Nama Samvathsaram)\nAyanam: Utharayanam\nRuthu: Hemantha Ruthu\nMonth: Thai Masam (Makaram Masam)\nPaksham: Krushna Paksham\nThithi: upto 1.21 AM Amavasai\, thereafter Prathamai\nDay: {Ravi Vasaram} Sunday\nNakshatthiram: upto 10.56 AM Pooradam\, and then Uthiradam\nYogam: Harshana\nKaranam: Chatushpada\nAmirthathiyogam: Siddha Yogam\nSubayogam: Subayogam\nRaghu Kalam: 4.39 PM to 6.03 PM\nYemakandam: 12.26 PM to 1.50 PM\nKuligai: 1.50 PM to 3.14 PM\nGood time: 6.49 AM to 8.13 AM and 12.26 PM to 1.50 PM\nSun Rise: 6.49 AM\nSun Set: 6.03 PM\nChandhirashtamam: Rishabam\nSoolam: West\nPrayatchittham: Jaggery / Vellam\nSradhdhathithi: Amavasai\nLocation: Hyderabad\, India
SUMMARY:Thai - 04 (18.01.2026) Sunday
UID:india-2026-01-18@panchangam
END:VEVENT
BEGIN:VEVENT
DTSTART;VALUE=DATE:20260228
DESCRIPTION:Maasi - 15 (28.02.2026) Saturday\n\nYear: Vishvavasu Varudam (Vishvavasu Nama Samvathsaram)\nAyanam: Utharayanam\nRuthu: Shishira Ruthu\nMonth: Maasi Masam (Kumbham Masam)\nPaksham: Shukla Paksham\nThithi: upto 8.43 PM Dwadashi\, thereafter Trayodashi\nDay: {Sani Vasaram} Saturday\nNakshatthiram: upto 10.12 AM Punarpoosam\, and then Poosam\nYogam: Saubhagya\nKaranam: Bavai\nAmirthathiyogam: Siddha Yogam\nSubayogam: Subayogam\nRaghu Kalam: 9.31 AM to 11.00 AM\nYemakandam: 1.57 PM to 3.25 PM\nKuligai: 3.25 PM to 4.53 PM\nGood time: 9.31 AM to 11.00 AM and 1.57 PM to 3.25 PM\nSun Rise: 6.35 AM\nSun Set: 6.22 PM\nChandhirashtamam: Dhanus\nSoolam: East\nPrayatchittham: Curd / Thayir\nSradhdhathithi: Dwadashi\nLocation: Hyderabad\, India
SUMMARY:Maasi - 15 (28.02.2026) Saturday
UID:india-2026-02-28@panchangam
END:VEVENT
BEGIN:VEVENT
DTSTART;VALUE=DATE:20260507
DESCRIPTION:Chithirai - 23 (07.05.2026) Thursday\n\nYear: Parabhava Varudam (Parabhava Nama Samvathsaram)\nAyanam: Utharayanam\nRuthu: Vasantha Ruthu\nMonth: Chithirai Masam (Mesham Masam)\nPaksham: Krushna Paksham\nThithi: upto 10.14 AM Panchami\, thereafter Shashti\nDay: {Guru Vasaram} Thursday\nNakshatthiram: upto 7.30 PM Pooradam\, and then Uthiradam\nYogam: Sadhya\nKaranam: Thaitilai\nAmirthathiyogam: Siddha Yogam\nSubayogam: Subayogam\nRaghu Kalam: 1.49 PM to 3.25 PM\nYemakandam: 5.47 AM to 7.23 AM\nKuligai: 7.23 AM to 9.00 AM\nGood time: 5.47 AM to 7.23 AM and 12.12 PM to 1.49 PM\nSun Rise: 5.47 AM\nSun Set: 6.38 PM\nChandhirashtamam: Rishabam\nSoolam: South\nPrayatchittham: Oil / Thailam\nSradhdhathithi: Shashti\nLocation: Hyderabad\, India
SUMMARY:Chithirai - 23 (07.05.2026) Thursday
UID:india-2026-05-07@panchangam
END:VEVENT
BEGIN:VEVENT
DTSTART;VALUE=DATE:20260617
DESCRIPTION:Aani - 02 (17.06.2026) Wednesday\n\nYear: Parabhava Varudam (Parabhava Nama Samvathsaram)\nAyanam: Utharayanam\nRuthu: Grishma Ruthu\nMonth: Aani Masam (Mithunam Masam)\nPaksham: Shukla Paksham\nThithi: upto 9.39 PM Tritiyai\, thereafter Chathurthi\nDay: {Budha Vasaram} Wednesday\nNakshatthiram: upto 2.13 PM Punarpoosam\, and then Poosam\nYogam: Dhruva\nKaranam: Thaitilai\nAmirthathiyogam: Siddha Yogam\nSubayogam: Subayogam\nRaghu Kalam: 12.16 PM to 1.55 PM\nYemakandam: 7.20 AM to 8.59 AM\nKuligai: 8.59 AM to 10.38 AM\nGood time: 5.41 AM to 7.20 AM and 1.55 PM to 3.34 PM\nSun Rise: 5.41 AM\nSun Set: 6.51 PM\nChandhirashtamam: Virutchigam\nSoolam: North\nPrayatchittham: Milk / Paal\nSradhdhathithi: Tritiyai\nLocation: Hyderabad\, India
SUMMARY:Aani - 02 (17.06.2026) Wednesday
UID:india-2026-06-17@panchangam
END:VEVENT
BEGIN:VEVENT
DTSTART;VALUE=DATE:20260727
DESCRIPTION:Aadi - 10 (27.07.2026) Monday\n\nYear: Parabhava Varudam (Parabhava Nama Samvathsaram)\nAyanam: Dhatchinayanam\nRuthu: Grishma Ruthu\nMonth: Aadi Masam (Katakam Masam)\nPaksham: Shukla Paksham\nThithi: upto 4.15 PM Trayodashi\, thereafter Chadhurdasi\nDay: {Soma Vasaram} Monday\nNakshatthiram: upto 11.13 AM Moolam\, and then Pooradam\nYogam: Vaidhriti\nKaranam: Thaitilai\nAmirthathiyogam: Siddha Yogam\nSubayogam: Subayogam\nRaghu Kalam: 7.30 AM to 9.08 AM\nYemakandam: 10.45 AM to 12.22 PM\nKuligai: 12.22 PM to 1.59 PM\nGood time: 5.53 AM to 7.30 AM and 12.22 PM to 1.59 PM\nSun Rise: 5.53 AM\nSun Set: 6.51 PM\nChandhirashtamam: Rishabam\nSoolam: East\nPrayatchittham: Curd / Thayir\nSradhdhathithi: Trayodashi\nLocation: Hyderabad\, India
SUMMARY:Aadi - 10 (27.07.2026) Monday
UID:india-2026-07-27@panchangam
END:VEVENT
BEGIN:VEVENT
DTSTART;VALUE=DATE:20261101
DESCRIPTION:Aippasi - 15 (01.11.2026) Sunday\n\nYear: Parabhava Varudam (Parabhava Nama Samvathsaram)\nAyanam: Dhatchinayanam\nRuthu: Sarath Ruthu\nMonth: Aippasi Masam (Thulam Masam)\nPaksham: Krushna Paksham\nThithi: upto 2.52 PM Saptami\, thereafter Ashtami\nDay: {Ravi Vasaram} Sunday\nNakshatthiram: upto 6.18 AM Punarpoosam\, upto 5.09 AM Poosam\, and then Aayilyam\nYogam: Sadhya\nKaranam: Bavai\nAmirthathiyogam: Siddha Yogam\nSubayogam: Subayogam\nRaghu Kalam: 4.18 PM to 5.44 PM\nYemakandam: 11.59 AM to 1.25 PM\nKuligai: 1.25 PM to 2.52 PM\nGood time: 6.14 AM to 7.40 AM and 1.25 PM to 2.52 PM\nSun Rise: 6.14 AM\nSun Set: 5.44 PM\nChandhirashtamam: Dhanus\nSoolam: West\nPrayatchittham: Jaggery / Vellam\nSradhdhathithi: Saptami\nLocation: Hyderabad\, India
SUMMARY:Aippasi - 15 (01.11.2026) Sunday
UID:india-2026-11-01@panchangam
END:VEVENT
BEGIN:VEVENT
DTSTART;VALUE=DATE:20261211
DESCRIPTION:Karthigai - 25 (11.12.2026) Friday\n\nYear: Parabhava Varudam (Parabhava Nama Samvathsaram)\nAyanam: Dhatchinayanam\nRuthu: Sarath Ruthu\nMonth: Karthigai Masam (Virutchigam Masam)\nPaksham: Shukla Paksham\nThithi: upto 11.23 AM Dwitiyai\, thereafter Tritiyai\nDay: {Sukra Vasaram} Friday\nNakshatthiram: upto 3.50 AM Pooradam\, and then Uthiradam\nYogam: Ganda\nKaranam: Kaulavai\nAmirthathiyogam: Marana Yogam\nSubayogam: \nRaghu Kalam: 10.45 AM to 12.09 PM\nYemakandam: 2.55 PM to 4.19 PM\nKuligai: 6.35 AM to 7.59 AM\nGood time: 6.35 AM to 7.59 AM and 12.09 PM to 1.32 PM\nSun Rise: 6.35 AM\nSun Set: 5.42 PM\nChandhirashtamam: Rishabam\nSoolam: West\nPrayatchittham: Jaggery / Vellam\nSradhdhathithi: Tritiyai\nLocation: Hyderabad\, India
SUMMARY:Karthigai - 25 (11.12.2026) Friday
UID:india-2026-12-11@panchangam
END:VEVENT
BEGIN:VEVENT
DTSTART;VALUE=DATE:20260305
DESCRIPTION:Maasi - 20 (05.03.2026) Thursday\n\nYear: Vishvavasu Varudam (Vishvavasu Nama Samvathsaram)\nAyanam: Utharayanam\nRuthu: Shishira Ruthu\nMonth: Maasi Masam (Kumbham Masam)\nPaksham: Krushna Paksham\nThithi: upto 5.04 PM Dwitiyai\, thereafter Tritiyai\nDay: {Guru Vasaram} Thursday\nNakshatthiram: upto 8.58 AM Uthiram\, and then Hastham\nYogam: Shoola\nKaranam: Garajai\nAmirthathiyogam: Siddha Yogam\nSubayogam: Subayogam\nRaghu Kalam: 1.56 PM to 3.25 PM\nYemakandam: 6.31 AM to 8.00 AM\nKuligai: 8.00 AM to 9.29 AM\nGood time: 6.31 AM to 8.00 AM and 12.27 PM to 1.56 PM\nSun Rise: 6.31 AM\nSun Set: 6.23 PM\nChandhirashtamam: Kumbham\nSoolam: South\nPrayatchittham: Oil / Thailam\nSradhdhathithi: Dwitiyai\nLocation: Hyderabad\, India
SUMMARY:Maasi - 20 (05.03.2026) Thursday
UID:india-2026-03-05@panchangam
END:VEVENT
BEGIN:VEVENT
DTSTART;VALUE=DATE:20260415
DESCRIPTION:Chithirai - 01 (15.04.2026) Wednesday\n\nYear: Parabhava Varudam (Parabhava Nama Samvathsaram)\nAyanam: Utharayanam\nRuthu: Vasantha Ruthu\nMonth: Chithirai Masam (Mesham Masam)\nPaksham: Krushna Paksham\nThithi: upto 10.31 PM Trayodashi\, thereafter Chadhurdasi\nDay: {Budha Vasaram} Wednesday\nNakshatthiram: upto 4.00 PM Poorattathi\, and then Uthirattathi\nYogam: Brahma\nKaranam: Garajai\nAmirthathiyogam: Siddha Yogam\nSubayogam: Subayogam\nRaghu Kalam: 12.16 PM to 1.50 PM\nYemakandam: 7.34 AM to 9.08 AM\nKuligai: 9.08 AM to 10.42 AM\nGood time: 6.00 AM to 7.34 AM and 1.50 PM to 3.24 PM\nSun Rise: 6.00 AM\nSun Set: 6.32 PM\nChandhirashtamam: Katakam\nSoolam: North\nPrayatchittham: Milk / Paal\nSradhdhathithi: Trayodashi\nLocation: Hyderabad\, India
SUMMARY:Chithirai - 01 (15.04.2026) Wednesday
UID:india-2026-04-15@panchangam
END:VEVENT
BEGIN:VEVENT
DTSTART;VALUE=DATE:20260525
DESCRIPTION:Vaikasi - 10 (25.05.2026) Monday\n\nYear: Parabhava Varudam (Parabhava Nama Samvathsaram)\nAyanam: Utharayanam\nRuthu: Vasantha Ruthu\nMonth: Vaikasi Masam (Rishabam Masam)\nPaksham: Shukla Paksham\nThithi: upto 5.11 AM Dashami\, thereafter Ekadashi\nDay: {Soma Vasaram} Monday\nNakshatthiram: upto 4.51 AM Uthiram\, and then Hastham\nYogam: Vajra\nKaranam: Thaitilai\nAmirthathiyogam: Siddha Yogam\nSubayogam: Subayogam\nRaghu Kalam: 7.19 AM to 8.57 AM\nYemakandam: 10.35 AM to 12.13 PM\nKuligai: 12.13 PM to 1.50 PM\nGood time: 5.41 AM to 7.19 AM and 12.13 PM to 1.50 PM\nSun Rise: 5.41 AM\nSun Set: 6.44 PM\nChandhirashtamam: Makaram\nSoolam: East\nPrayatchittham: Curd / Thayir\nSradhdhathithi: Dashami\nLocation: Hyderabad\, India
SUMMARY:Vaikasi - 10 (25.05.2026) Monday
UID:india-2026-05-25@panchangam
END:VEVENT
BEGIN:VEVENT
DTSTART;VALUE=DATE:20260804
DESCRIPTION:Aadi - 18 (04.08.2026) Tuesday\n\nYear: Parabhava Varudam (Parabhava Nama Samvathsaram)\nAyanam: Dhatchinayanam\nRuthu: Grishma Ruthu\nMonth: Aadi Masam (Katakam Masam)\nPaksham: Krushna Paksham\nThithi: upto 10.03 PM Shashti\, thereafter Saptami\nDay: {Bhauma Vasaram} Tuesday\nNakshatthiram: upto 10.33 PM Revathi\, and then Ashwini\nYogam: Dhriti\nKaranam: Garajai\nAmirthathiyogam: Siddha Yogam\nSubayogam: Subayogam\nRaghu Kalam: 3.35 PM to 5.11 PM\nYemakandam: 9.09 AM to 10.45 AM\nKuligai: 10.45 AM to 12.22 PM\nGood time: 7.32 AM to 9.09 AM and 3.35 PM to 5.11 PM\nSun Rise: 5.56 AM\nSun Set: 6.47 PM\nChandhirashtamam: Simham\nSoolam: North\nPrayatchittham: Milk / Paal\nSradhdhathithi: Shashti\nLocation: Hyderabad\, India
SUMMARY:Aadi - 18 (04.08.2026) Tuesday
UID:india-2026-08-04@panchangam
END:VEVENT
BEGIN:VEVENT
DTSTART;VALUE=DATE:20260914
DESCRIPTION:Aavani - 28 (14.09.2026) Monday\n\nYear: Parabhava Varudam (Parabhava Nama Samvathsaram)\nAyanam: Dhatchinayanam\nRuthu: Varsha Ruthu\nMonth: Aavani Masam (Simham Masam)\nPaksham: Shukla Paksham\nThithi: upto 7.07 AM Tritiyai\, thereafter Chathurthi\nDay: {Soma Vasaram} Monday\nNakshatthiram: upto 2.37 PM Chitthirai\, and then Swathi\nYogam: Brahma\nKaranam: Garajai\nAmirthathiyogam: Marana Yogam\nSubayogam: \nRaghu Kalam: 7.35 AM to 9.07 AM\nYemakandam: 10.39 AM to 12.11 PM\nKuligai: 12.11 PM to 1.43 PM\nGood time: 6.03 AM to 7.35 AM and 12.11 PM to 1.43 PM\nSun Rise: 6.03 AM\nSun Set: 6.19 PM\nChandhirashtamam: Meenam\nSoolam: East\nPrayatchittham: Curd / Thayir\nSradhdhathithi: Chathurthi\nLocation: Hyderabad\, India
SUMMARY:Aavani - 28 (14.09.2026) Monday
UID:india-2026-09-14@panchangam
END:VEVENT
BEGIN:VEVENT
DTSTART;VALUE=DATE:20261108
DESCRIPTION:Aippasi - 22 (08.11.2026) Sunday\n\nYear: Parabhava Varudam (Parabhava Nama Samvathsaram)\nAyanam: Dhatchinayanam\nRuthu: Sarath Ruthu\nMonth: Aippasi Masam (Thulam Masam)\nPaksham: Krushna Paksham\nThithi: upto 11.28 AM Chadhurdasi\, thereafter Amavasai\nDay: {Ravi Vasaram} Sunday\nNakshatthiram: upto 6.35 AM Chitthirai\, and then Swathi\nYogam: Aayushman\nKaranam: Shakuni\nAmirthathiyogam: Siddha Yogam\nSubayogam: Subayogam\nRaghu Kalam: 4.16 PM to 5.41 PM\nYemakandam: 11.59 AM to 1.25 PM\nKuligai: 1.25 PM to 2.50 PM\nGood time: 6.17 AM to 7.42 AM and 1.25 PM to 2.50 PM\nSun Rise: 6.17 AM\nSun Set: 5.41 PM\nChandhirashtamam: Meenam\nSoolam: West\nPrayatchittham: Jaggery / Vellam\nSradhdhathithi: Amavasai\nLocation: Hyderabad\, India
SUMMARY:Aippasi - 22 (08.11.2026) Sunday
UID:india-2026-11-08@panchangam
END:VEVENT
BEGIN:VEVENT
DTSTART;VALUE=DATE:20261218
DESCRIPTION:Margazhi - 02 (18.12.2026) Friday\n\nYear: Parabhava Varudam (Parabhava Nama Samvathsaram)\nAyanam: Dhatchinayanam\nRuthu: Hemantha Ruthu\nMonth: Margazhi Masam (Dhanus Masam)\nPaksham: Shukla Paksham\nThithi: upto 11.14 PM Navami\, thereafter Dashami\nDay: {Sukra Vasaram} Friday\nNakshatthiram: upto 4.51 PM Uthirattathi\, and then Revathi\nYogam: Vyatipata\nKaranam: Balavai\nAmirthathiyogam: Siddha Yogam\nSubayogam: Subayogam\nRaghu Kalam: 10.49 AM to 12.12 PM\nYemakandam: 2.58 PM to 4.22 PM\nKuligai: 6.39 AM to 8.02 AM\nGood time: 6.39 AM to 8.02 AM and 12.12 PM to 1.35 PM\nSun Rise: 6.39 AM\nSun Set: 5.45 PM\nChandhirashtamam: Simham\nSoolam: West\nPrayatchittham: Jaggery / Vellam\nSradhdhathithi: Navami\nLocation: Hyderabad\, India
SUMMARY:Margazhi - 02 (18.12.2026) Friday
UID:india-2026-12-18@panchangam
END:VEVENT
BEGIN:VEVENT
DTSTART;VALUE=DATE:20260103
DESCRIPTION:Margazhi - 12 (03.01.2026) Saturday\n\nYear: Vishvavasu Varudam (Vishvavasu Nama Samvathsaram)\nAyanam: Utharayanam\nRuthu: Hemantha Ruthu\nMonth: Margazhi Masam (Dhanus Masam)\nPaksham: Shukla Paksham\nThithi: upto 3.32 PM Pournami\, thereafter Prathamai\nDay: {Sani Vasaram} Saturday\nNakshatthiram: upto 6.03 PM Thiruvathirai\, and then Punarpoosam\nYogam: Brahma\nKaranam: Bavai\nAmirthathiyogam: Siddha Yogam\nSubayogam: Subayogam\nRaghu Kalam: 9.33 AM to 10.57 AM\nYemakandam: 1.43 PM to 3.07 PM\nKuligai: 3.07 PM to 4.30 PM\nGood time: 9.33 AM to 10.57 AM and 1.43 PM to 3.07 PM\nSun Rise: 6.46 AM\nSun Set: 5.54 PM\nChandhirashtamam: Virutchigam\nSoolam: East\nPrayatchittham: Curd / Thayir\nSradhdhathithi: Pournami\nLocation: Hyderabad\, India
SUMMARY:Margazhi - 12 (03.01.2026) Saturday
UID:india-2026-01-03@panchangam
END:VEVENT
BEGIN:VEVENT
DTSTART;VALUE=DATE:20260213
DESCRIPTION:Thai - 30 (13.02.2026) Friday\n\nYear: Vishvavasu Varudam (Vishvavasu Nama Samvathsaram)\nAyanam: Utharayanam\nRuthu: Hemantha Ruthu\nMonth: Thai Masam (Makaram Masam)\nPaksham: Krushna Paksham\nThithi: upto 2.26 PM Ekadashi\, thereafter Dwadashi\nDay: {Sukra Vasaram} Friday\nNakshatthiram: upto 4.56 PM Moolam\, and then Pooradam\nYogam: Vajra\nKaranam: Balavai\nAmirthathiyogam: Siddha Yogam\nSubayogam: Subayogam\nRaghu Kalam: 11.03 AM to 12.30 PM\nYemakandam: 3.23 PM to 4.50 PM\nKuligai: 6.43 AM to 8.10 AM\nGood time: 6.43 AM to 8.10 AM and 12.30 PM to 1.56 PM\nSun Rise: 6.43 AM\nSun Set: 6.16 PM\nChandhirashtamam: Rishabam\nSoolam: West\nPrayatchittham: Jaggery / Vellam\nSradhdhathithi: Dwadashi\nLocation: Hyderabad\, India
SUMMARY:Thai - 30 (13.02.2026) Friday
UID:india-2026-02-13@panchangam
END:VEVENT
BEGIN:VEVENT
DTSTART;VALUE=DATE:20260323
DESCRIPTION:Panguni - 08 (23.03.2026) Monday\n\nYear: Vishvavasu Varudam (Vishvavasu Nama Samvathsaram)\nAyanam: Utharayanam\nRuthu: Shishira Ruthu\nMonth: Panguni Masam (Meenam Masam)\nPaksham: Shukla Paksham\nThithi: upto 6.38 PM Panchami\, thereafter Shashti\nDay: {Soma Vasaram} Monday\nNakshatthiram: upto 9.26 PM Karthigai\, and then Rohini\nYogam: Vishkambha\nKaranam: Bavai\nAmirthathiyogam: Siddha Yogam\nSubayogam: Subayogam\nRaghu Kalam: 7.49 AM to 9.20 AM\nYemakandam: 10.51 AM to 12.22 PM\nKuligai: 12.22 PM to 1.53 PM\nGood time: 6.18 AM to 7.49 AM and 12.22 PM to 1.53 PM\nSun Rise: 6.18 AM\nSun Set: 6.27 PM\nChandhirashtamam: Thulam\nSoolam: East\nPrayatchittham: Curd / Thayir\nSradhdhathithi: Panchami\nLocation: Hyderabad\, India
SUMMARY:Panguni - 08 (23.03.2026) Monday
UID:india-2026-03-23@panchangam
END:VEVENT
BEGIN:VEVENT
DTSTART;VALUE=DATE:20260602
DESCRIPTION:Vaikasi - 18 (02.06.2026) Tuesday\n\nYear: Parabhava Varudam (Parabhava Nama Samvathsaram)\nAyanam: Utharayanam\nRuthu: Vasantha Ruthu\nMonth: Vaikasi Masam (Rishabam Masam)\nPaksham: Krushna Paksham\nThithi: upto 7.01 PM Dwitiyai\, thereafter Tritiyai\nDay: {Bhauma Vasaram} Tuesday\nNakshatthiram: upto 10.51 PM Moolam\, and then Pooradam\nYogam: Sadhya\nKaranam: Thaitilai\nAmirthathiyogam: Siddha Yogam\nSubayogam: Subayogam\nRaghu Kalam: 3.30 PM to 5.08 PM\nYemakandam: 8.57 AM to 10.35 AM\nKuligai: 10.35 AM to 12.14 PM\nGood time: 7.19 AM to 8.57 AM and 3.30 PM to 5.08 PM\nSun Rise: 5.40 AM\nSun Set: 6.47 PM\nChandhirashtamam: Rishabam\nSoolam: North\nPrayatchittham: Milk / Paal\nSradhdhathithi: Dwitiyai\nLocation: Hyderabad\, India
SUMMARY:Vaikasi - 18 (02.06.2026) Tuesday
UID:india-2026-06-02@panchangam
END:VEVENT
BEGIN:VEVENT
DTSTART;VALUE=DATE:20260712
DESCRIPTION:Aani - 27 (12.07.2026) Sunday\n\nYear: Parabhava Varudam (Parabhava Nama Samvathsaram)\nAyanam: Dhatchinayanam\nRuthu: Grishma Ruthu\nMonth: Aani Masam (Mithunam Masam)\nPaksham: Krushna Paksham\nThithi: upto 10.30 PM Trayodashi\, thereafter Chadhurdasi\nDay: {Ravi Vasaram} Sunday\nNakshatthiram: upto 9.04 AM Rohini\, and then Mrigashirsham\nYogam: Vriddhi\nKaranam: Garajai\nAmirthathiyogam: Siddha Yogam\nSubayogam: Subayogam\nRaghu Kalam: 5.16 PM to 6.54 PM\nYemakandam: 12.21 PM to 1.59 PM\nKuligai: 1.59 PM to 3.38 PM\nGood time: 5.48 AM to 7.27 AM and 12.21 PM to 1.59 PM\nSun Rise: 5.48 AM\nSun Set: 6.54 PM\nChandhirashtamam: Thulam\nSoolam: West\nPrayatchittham: Jaggery / Vellam\nSradhdhathithi: Trayodashi\nLocation: Hyderabad\, India
SUMMARY:Aani - 27 (12.07.2026) Sunday
UID:india-2026-07-12@panchangam
END:VEVENT
BEGIN:VEVENT
DTSTART;VALUE=DATE:20260822
DESCRIPTION:Aavani - 05 (22.08.2026) Saturday\n\nYear: Parabhava Varudam (Parabhava Nama Samvathsaram)\nAyanam: Dhatchinayanam\nRuthu: Varsha Ruthu\nMonth: Aavani Masam (Simham Masam)\nPaksham: Shukla Paksham\nThithi: upto 2.00 AM Dashami\, thereafter Ekadashi\nDay: {Sani Vasaram} Saturday\nNakshatthiram: upto 3.34 PM Kettai\, and then Moolam\nYogam: Vaidhriti\nKaranam: Thaitilai\nAmirthathiyogam: Siddha Yogam\nSubayogam: Subayogam\nRaghu Kalam: 9.09 AM to 10.44 AM\nYemakandam: 1.53 PM to 3.28 PM\nKuligai: 3.28 PM to 5.02 PM\nGood time: 9.09 AM to 10.44 AM and 1.53 PM to 3.28 PM\nSun Rise: 6.00 AM\nSun Set: 6.37 PM\nChandhirashtamam: Mesham\nSoolam: East\nPrayatchittham: Curd / Thayir\nSradhdhathithi: Dashami\nLocation: Hyderabad\, India
SUMMARY:Aavani - 05 (22.08.2026) Saturday
UID:india-2026-08-22@panchangam
END:VEVENT
BEGIN:VEVENT
DTSTART;VALUE=DATE:20261016
DESCRIPTION:Purattasi - 29 (16.10.2026) Friday\n\nYear: Parabhava Varudam (Parabhava Nama Samvathsaram)\nAyanam: Dhatchinayanam\nRuthu: Varsha Ruthu\nMonth: Purattasi Masam (Kanni Masam)\nPaksham: Shukla Paksham\nThithi: upto 5.54 AM Shashti\, thereafter Saptami\nDay: {Sukra Vasaram} Friday\nNakshatthiram: upto 7.33 AM Kettai\, and then Moolam\nYogam: Shobhana\nKaranam: Kaulavai\nAmirthathiyogam: Marana Yogam\nSubayogam: \nRaghu Kalam: 10.33 AM to 12.01 PM\nYemakandam: 2.57 PM to 4.25 PM\nKuligai: 6.09 AM to 7.37 AM\nGood time: 6.09 AM to 7.37 AM and 12.01 PM to 1.29 PM\nSun Rise: 6.09 AM\nSun Set: 5.53 PM\nChandhirashtamam: Mesham\nSoolam: West\nPrayatchittham: Jaggery / Vellam\nSradhdhathithi: Shashti\nLocation: Hyderabad\, India
SUMMARY:Purattasi - 29 (16.10.2026) Friday
UID:india-2026-10-16@panchangam
END:VEVENT
BEGIN:VEVENT
DTSTART;VALUE=DATE:20261126
DESCRIPTION:Karthigai - 10 (26.11.2026) Thursday\n\nYear: Parabhava Varudam (Parabhava Nama Samvathsaram)\nAyanam: Dhatchinayanam\nRuthu: Sarath Ruthu\nMonth: Karthigai Masam (Virutchigam Masam)\nPaksham: Krushna Paksham\nThithi: upto 1.15 PM Dwitiyai\, thereafter Tritiyai\nDay: {Guru Vasaram} Thursday\nNakshatthiram: upto 6.23 PM Mrigashirsham\, and then Thiruvathirai\nYogam: Siddha\nKaranam: Garajai\nAmirthathiyogam: Marana Yogam\nSubayogam: \nRaghu Kalam: 1.27 PM to 2.51 PM\nYemakandam: 6.26 AM to 7.50 AM\nKuligai: 7.50 AM to 9.15 AM\nGood time: 6.26 AM to 7.50 AM and 12.03 PM to 1.27 PM\nSun Rise: 6.26 AM\nSun Set: 5.39 PM\nChandhirashtamam: Thulam\nSoolam: South\nPrayatchittham: Oil / Thailam\nSradhdhathithi: Tritiyai\nLocation: Hyderabad\, India
SUMMARY:Karthigai - 10 (26.11.2026) Thursday
UID:india-2026-11-26@panchangam
END:VEVENT
BEGIN:VEVENT
DESCRIPTION:Exact Astronomical Duration (Hyderabad\, India)
DTEND:20260427T124627Z
DTSTART:20260426T123728Z
SUMMARY:Shukla Ekadasi
UID:india-202604261237-11@tithi
END:VEVENT
BEGIN:VEVENT
DESCRIPTION:Exact Astronomical Duration (Hyderabad\, India)
DTEND:20260725T060447Z
DTSTART:20260724T034315Z
SUMMARY:Shukla Ekadasi
UID:india-202607240343-11@tithi
END:VEVENT
BEGIN:VEVENT
DTSTART;VALUE=DATE:20260121
DESCRIPTION:Thai - 07 (21.01.2026) Wednesday\n\nYear: Vishvavasu Varudam (Vishvavasu Nama Samvathsaram)\nAyanam: Utharayanam\nRuthu: Hemantha Ruthu\nMonth: Thai Masam (Makaram Masam)\nPaksham: Shukla Paksham\nThithi: upto 2.47 AM Tritiyai\, thereafter Chathurthi\nDay: {Budha Vasaram} Wednesday\nNakshatthiram: upto 2.38 PM Avittam\, and then Sathayam\nYogam: Vyatipata\nKaranam: Thaitilai\nAmirthathiyogam: Marana Yogam\nSubayogam: \nRaghu Kalam: 12.27 PM to 1.51 PM\nYemakandam: 8.14 AM to 9.38 AM\nKuligai: 9.38 AM to 11.02 AM\nGood time: 6.49 AM to 8.14 AM and 1.51 PM to 3.16 PM\nSun Rise: 6.49 AM\nSun Set: 6.05 PM\nChandhirashtamam: Katakam\nSoolam: North\nPrayatchittham: Milk / Paal\nSradhdhathithi: Tritiyai\nLocation: Hyderabad\, India
SUMMARY:Thai - 07 (21.01.2026) Wednesday
UID:india-2026-01-21@panchangam
END:VEVENT
BEGIN:VEVENT
DTSTART;VALUE=DATE:20260510
DESCRIPTION:Chithirai - 26 (10.05.2026) Sunday\n\nYear: Parabhava Varudam (Parabhava Nama Samvathsaram)\nAyanam: Utharayanam\nRuthu: Vasantha Ruthu\nMonth: Chithirai Masam (Mesham Masam)\nPaksham: Krushna Paksham\nThithi: upto 3.07 PM Ashtami\, thereafter Navami\nDay: {Ravi Vasaram} Sunday\nNakshatthiram: upto 1.31 AM Avittam\, and then Sathayam\nYogam: Brahma\nKaranam: Kaulavai\nAmirthathiyogam: Siddha Yogam\nSubayogam: Subayogam\nRaghu Kalam: 5.02 PM to 6.39 PM\nYemakandam: 12.12 PM to 1.49 PM\nKuligai: 1.49 PM to 3.25 PM\nGood time: 5.46 AM to 7.22 AM and 12.12 PM to 1.49 PM\nSun Rise: 5.46 AM\nSun Set: 6.39 PM\nChandhirashtamam: Mithunam\nSoolam: West\nPrayatchittham: Jaggery / Vellam\nSradhdhathithi: Ashtami\nLocation: Hyderabad\, India
SUMMARY:Chithirai - 26 (10.05.2026) Sunday
UID:india-2026-05-10@panchangam
END:VEVENT
BEGIN:VEVENT
DTSTART;VALUE=DATE:20260620
DESCRIPTION:Aani - 05 (20.06.2026) Saturday\n\nYear: Parabhava Varudam (Parabhava Nama Samvathsaram)\nAyanam: Utharayanam\nRuthu: Grishma Ruthu\nMonth: Aani Masam (Mithunam Masam)\nPaksham: Shukla Paksham\nThithi: upto 3.47 PM Shashti\, thereafter Saptami\nDay: {Sani Vasaram} Saturday\nNakshatthiram: upto 10.05 AM Magam\, and then Pooram\nYogam: Vajra\nKaranam: Thaitilai\nAmirthathiyogam: Siddha Yogam\nSubayogam: Subayogam\nRaghu Kalam: 9.00 AM to 10.38 AM\nYemakandam: 1.56 PM to 3.35 PM\nKuligai: 3.35 PM to 5.13 PM\nGood time: 9.00 AM to 10.38 AM and 1.56 PM to 3.35 PM\nSun Rise: 5.42 AM\nSun Set: 6.52 PM\nChandhirashtamam: Makaram\nSoolam: East\nPrayatchittham: Curd / Thayir\nSradhdhathithi: Shashti\nLocation: Hyderabad\, India
SUMMARY:Aani - 05 (20.06.2026) Saturday
UID:india-2026-06-20@panchangam
END:VEVENT
BEGIN:VEVENT
DTSTART;VALUE=DATE:20260730
DESCRIPTION:Aadi - 13 (30.07.2026) Thursday\n\nYear: Parabhava Varudam (Parabhava Nama Samvathsaram)\nAyanam: Dhatchinayanam\nRuthu: Grishma Ruthu\nMonth: Aadi Masam (Katakam Masam)\nPaksham: Krushna Paksham\nThithi: upto 9.30 PM Prathamai\, thereafter Dwitiyai\nDay: {Guru Vasaram} Thursday\nNakshatthiram: upto 6.26 PM Thiruvonam\, and then Avittam\nYogam: Aayushman\nKaranam: Balavai\nAmirthathiyogam: Siddha Yogam\nSubayogam: Subayogam\nRaghu Kalam: 1.59 PM to 3.36 PM\nYemakandam: 5.54 AM to 7.31 AM\nKuligai: 7.31 AM to 9.08 AM\nGood time: 5.54 AM to 7.31 AM and 12.22 PM to 1.59 PM\nSun Rise: 5.54 AM\nSun Set: 6.50 PM\nChandhirashtamam: Mithunam\nSoolam: South\nPrayatchittham: Oil / Thailam\nSradhdhathithi: Prathamai\nLocation: Hyderabad\, India
SUMMARY:Aadi - 13 (30.07.2026) Thursday
UID:india-2026-07-30@panchangam
END:VEVENT
BEGIN:VEVENT
DTSTART;VALUE=DATE:20251226
DESCRIPTION:Margazhi - 04 (26.12.2025) Friday\n\nYear: Vishvavasu Varudam (Vishvavasu Nama Samvathsaram)\nAyanam: Utharayanam\nRuthu: Hemantha Ruthu\nMonth: Margazhi Masam (Dhanus Masam)\nPaksham: Shukla Paksham\nThithi: upto 1.44 PM Shashti\, thereafter Saptami\nDay: {Sukra Vasaram} Friday\nNakshatthiram: upto 9.40 AM Sathayam\, and then Poorattathi\nYogam: Siddhi\nKaranam: Thaitilai\nAmirthathiyogam: Siddha Yogam\nSubayogam: Subayogam\nRaghu Kalam: 10.53 AM to 12.16 PM\nYemakandam: 3.03 PM to 4.26 PM\nKuligai: 6.43 AM to 8.06 AM\nGood time: 6.43 AM to 8.06 AM and 12.16 PM to 1.39 PM\nSun Rise: 6.43 AM\nSun Set: 5.49 PM\nChandhirashtamam: Katakam\nSoolam: West\nPrayatchittham: Jaggery / Vellam\nSradhdhathithi: Saptami\nLocation: Hyderabad\, India
SUMMARY:Margazhi - 04 (26.12.2025) Friday
UID:india-2025-12-26@panchangam
END:VEVENT
BEGIN:VEVENT
DTSTART;VALUE=DATE:20260609
DESCRIPTION:Vaikasi - 25 (09.06.2026) Tuesday\n\nYear: Parabhava Varudam (Parabhava Nama Samvathsaram)\nAyanam: Utharayanam\nRuthu: Vasantha Ruthu\nMonth: Vaikasi Masam (Rishabam Masam)\nPaksham: Krushna Paksham\nThithi: upto 2.35 AM Navami\, thereafter Dashami\nDay: {Bhauma Vasaram} Tuesday\nNakshatthiram: upto 10.19 AM Poorattathi\, and then Uthirattathi\nYogam: Priti\nKaranam: Thaitilai\nAmirthathiyogam: Siddha Yogam\nSubayogam: Subayogam\nRaghu Kalam: 3.32 PM to 5.11 PM\nYemakandam: 8.58 AM to 10.36 AM\nKuligai: 10.36 AM to 12.15 PM\nGood time: 7.19 AM to 8.58 AM and 3.32 PM to 5.11 PM\nSun Rise: 5.40 AM\nSun Set: 6.49 PM\nChandhirashtamam: Simham\nSoolam: North\nPrayatchittham: Milk / Paal\nSradhdhathithi: Navami\nLocation: Hyderabad\, India
SUMMARY:Vaikasi - 25 (09.06.2026) Tuesday
UID:india-2026-06-09@panchangam
END:VEVENT
BEGIN:VEVENT
DTSTART;VALUE=DATE:20260719
DESCRIPTION:Aadi - 02 (19.07.2026) Sunday\n\nYear: Parabhava Varudam (Parabhava Nama Samvathsaram)\nAyanam: Dhatchinayanam\nRuthu: Grishma Ruthu\nMonth: Aadi Masam (Katakam Masam)\nPaksham: Shukla Paksham\nThithi: upto 3.30 AM Shashti\, thereafter Saptami\nDay: {Ravi Vasaram} Sunday\nNakshatthiram: upto 6.53 PM Uthiram\, and then Hastham\nYogam: Parigha\nKaranam: Kaulavai\nAmirthathiyogam: Siddha Yogam\nSubayogam: Subayogam\nRaghu Kalam: 5.15 PM to 6.53 PM\nYemakandam: 12.22 PM to 2.00 PM\nKuligai: 2.00 PM to 3.37 PM\nGood time: 5.51 AM to 7.28 AM and 12.22 PM to 2.00 PM\nSun Rise: 5.51 AM\nSun Set: 6.53 PM\nChandhirashtamam: Kumbham\nSoolam: West\nPrayatchittham: Jaggery / Vellam\nSradhdhathithi: Shashti\nLocation: Hyderabad\, India
SUMMARY:Aadi - 02 (19.07.2026) Sunday
UID:india-2026-07-19@panchangam
END:VEVENT
BEGIN:VEVENT
DTSTART;VALUE=DATE:20260829
DESCRIPTION:Aavani - 12 (29.08.2026) Saturday\n\nYear: Parabhava Varudam (Parabhava Nama Samvathsaram)\nAyanam: Dhatchinayanam\nRuthu: Varsha Ruthu\nMonth: Aavani Masam (Simham Masam)\nPaksham: Krushna Paksham\nThithi: upto 9.57 AM Prathamai\, thereafter Dwitiyai\nDay: {Sani Vasaram} Saturday\nNakshatthiram: upto 4.23 AM Poorattathi\, and then Uthirattathi\nYogam: Sukarman\nKaranam: Kaulavai\nAmirthathiyogam: Siddha Yogam\nSubayogam: Subayogam\nRaghu Kalam: 9.09 AM to 10.43 AM\nYemakandam: 1.50 PM to 3.24 PM\nKuligai: 3.24 PM to 4.58 PM\nGood time: 9.09 AM to 10.43 AM and 1.50 PM to 3.24 PM\nSun Rise: 6.01 AM\nSun Set: 6.32 PM\nChandhirashtamam: Katakam\nSoolam: East\nPrayatchittham: Curd / Thayir\nSradhdhathithi: Dwitiyai\nLocation: Hyderabad\, India
SUMMARY:Aavani - 12 (29.08.2026) Saturday
UID:india-2026-08-29@panchangam
END:VEVENT
BEGIN:VEVENT
DTSTART;VALUE=DATE:20261203
DESCRIPTION:Karthigai - 17 (03.12.2026) Thursday\n\nYear: Parabhava Varudam (Parabhava Nama Samvathsaram)\nAyanam: Dhatchinayanam\nRuthu: Sarath Ruthu\nMonth: Karthigai Masam (Virutchigam Masam)\nPaksham: Krushna Paksham\nThithi: upto 11.03 PM Dashami\, thereafter Ekadashi\nDay: {Guru Vasaram} Thursday\nNakshatthiram: upto 10.05 AM Uthiram\, and then Hastham\nYogam: Priti\nKaranam: Vanijai\nAmirthathiyogam: Siddha Yogam\nSubayogam: Subayogam\nRaghu Kalam: 1.29 PM to 2.53 PM\nYemakandam: 6.31 AM to 7.54 AM\nKuligai: 7.54 AM to 9.18 AM\nGood time: 6.31 AM to 7.54 AM and 12.05 PM to 1.29 PM\nSun Rise: 6.31 AM\nSun Set: 5.40 PM\nChandhirashtamam: Kumbham\nSoolam: South\nPrayatchittham: Oil / Thailam\nSradhdhathithi: Dashami\nLocation: Hyderabad\, India
SUMMARY:Karthigai - 17 (03.12.2026) Thursday
UID:india-2026-12-03@panchangam
END:VEVENT
BEGIN:VEVENT
DTSTART;VALUE=DATE:20260128
DESCRIPTION:Thai - 14 (28.01.2026) Wednesday\n\nYear: Vishvavasu Varudam (Vishvavasu Nama Samvathsaram)\nAyanam: Utharayanam\nRuthu: Hemantha Ruthu\nMonth: Thai Masam (Makaram Masam)\nPaksham: Shukla Paksham\nThithi: upto 4.36 PM Dashami\, thereafter Ekadashi\nDay: {Budha Vasaram} Wednesday\nNakshatthiram: upto 10.03 AM Karthigai\, and then Rohini\nYogam: Brahma\nKaranam: Garajai\nAmirthathiyogam: Siddha Yogam\nSubayogam: Subayogam\nRaghu Kalam: 12.29 PM to 1.54 PM\nYemakandam: 8.13 AM to 9.38 AM\nKuligai: 9.38 AM to 11.03 AM\nGood time: 6.48 AM to 8.13 AM and 1.54 PM to 3.19 PM\nSun Rise: 6.48 AM\nSun Set: 6.09 PM\nChandhirashtamam: Thulam\nSoolam: North\nPrayatchittham: Milk / Paal\nSradhdhathithi: Dashami\nLocation: Hyderabad\, India
SUMMARY:Thai - 14 (28.01.2026) Wednesday
UID:india-2026-01-28@panchangam
END:VEVENT
BEGIN:VEVENT
DTSTART;VALUE=DATE:20260407
DESCRIPTION:Panguni - 23 (07.04.2026) Tuesday\n\nYear: Vishvavasu Varudam (Vishvavasu Nama Samvathsaram)\nAyanam: Utharayanam\nRuthu: Shishira Ruthu\nMonth: Panguni Masam (Meenam Masam)\nPaksham: Krushna Paksham\nThithi: upto 4.35 PM Panchami\, thereafter Shashti\nDay: {Bhauma Vasaram} Tuesday\nNakshatthiram: Kettai\nYogam: Vyatipata\nKaranam: Thaitilai\nAmirthathiyogam: Siddha Yogam\nSubayogam: Subayogam\nRaghu Kalam: 3.24 PM to 4.57 PM\nYemakandam: 9.12 AM to 10.45 AM\nKuligai: 10.45 AM to 12.18 PM\nGood time: 7.39 AM to 9.12 AM and 3.24 PM to 4.57 PM\nSun Rise: 6.06 AM\nSun Set: 6.30 PM\nChandhirashtamam: Mesham\nSoolam: North\nPrayatchittham: Milk / Paal\nSradhdhathithi: Panchami\nLocation: Hyderabad\, India
SUMMARY:Panguni - 23 (07.04.2026) Tuesday
UID:india-2026-04-07@panchangam
END:VEVENT
BEGIN:VEVENT
DTSTART;VALUE=DATE:20260517
DESCRIPTION:Vaikasi - 02 (17.05.2026) Sunday\n\nYear: Parabhava Varudam (Parabhava Nama Samvathsaram)\nAyanam: Utharayanam\nRuthu: Vasantha Ruthu\nMonth: Vaikasi Masam (Rishabam Masam)\nPaksham: Shukla Paksham\nThithi: upto 9.41 PM Prathamai\, thereafter Dwitiyai\nDay: {Ravi Vasaram} Sunday\nNakshatthiram: upto 3.06 PM Karthigai\, and then Rohini\nYogam: Shobhana\nKaranam: Kimstughna\nAmirthathiyogam: Marana Yogam\nSubayogam: \nRaghu Kalam: 5.04 PM to 6.41 PM\nYemakandam: 12.12 PM to 1.49 PM\nKuligai: 1.49 PM to 3.27 PM\nGood time: 5.43 AM to 7.20 AM and 12.12 PM to 1.49 PM\nSun Rise: 5.43 AM\nSun Set: 6.41 PM\nChandhirashtamam: Thulam\nSoolam: West\nPrayatchittham: Jaggery / Vellam\nSradhdhathithi: Prathamai\nLocation: Hyderabad\, India
SUMMARY:Vaikasi - 02 (17.05.2026) Sunday
UID:india-2026-05-17@panchangam
END:VEVENT
BEGIN:VEVENT
DTSTART;VALUE=DATE:20260627
DESCRIPTION:Aani - 12 (27.06.2026) Saturday\n\nYear: Parabhava Varudam (Parabhava Nama Samvathsaram)\nAyanam: Dhatchinayanam\nRuthu: Grishma Ruthu\nMonth: Aani Masam (Mithunam Masam)\nPaksham: Shukla Paksham\nThithi: upto 12.43 AM Trayodashi\, thereafter Chadhurdasi\nDay: {Sani Vasaram} Saturday\nNakshatthiram: upto 10.56 PM Anusham\, and then Kettai\nYogam: Sadhya\nKaranam: Kaulavai\nAmirthathiyogam: Siddha Yogam\nSubayogam: Subayogam\nRaghu Kalam: 9.01 AM to 10.40 AM\nYemakandam: 1.57 PM to 3.36 PM\nKuligai: 3.36 PM to 5.15 PM\nGood time: 9.01 AM to 10.40 AM and 1.57 PM to 3.36 PM\nSun Rise: 5.44 AM\nSun Set: 6.53 PM\nChandhirashtamam: Mesham\nSoolam: East\nPrayatchittham: Curd / Thayir\nSradhdhathithi: Trayodashi\nLocation: Hyderabad\, India
SUMMARY:Aani - 12 (27.06.2026) Saturday
UID:india-2026-06-27@panchangam
END:VEVENT
BEGIN:VEVENT
DTSTART;VALUE=DATE:20260906
DESCRIPTION:Aavani - 20 (06.09.2026) Sunday\n\nYear: Parabhava Varudam (Parabhava Nama Samvathsaram)\nAyanam: Dhatchinayanam\nRuthu: Varsha Ruthu\nMonth: Aavani Masam (Simham Masam)\nPaksham: Krushna Paksham\nThithi: upto 7.29 PM Dashami\, thereafter Ekadashi\nDay: {Ravi Vasaram} Sunday\nNakshatthiram: upto 8.30 PM Thiruvathirai\, and then Punarpoosam\nYogam: Siddhi\nKaranam: Vanijai\nAmirthathiyogam: Siddha Yogam\nSubayogam: Subayogam\nRaghu Kalam: 4.52 PM to 6.25 PM\nYemakandam: 12.14 PM to 1.47 PM\nKuligai: 1.47 PM to 3.20 PM\nGood time: 6.02 AM to 7.35 AM and 12.14 PM to 1.47 PM\nSun Rise: 6.02 AM\nSun Set: 6.25 PM\nChandhirashtamam: Virutchigam\nSoolam: West\nPrayatchittham: Jaggery / Vellam\nSradhdhathithi: Dashami\nLocation: Hyderabad\, India
SUMMARY:Aavani - 20 (06.09.2026) Sunday
UID:india-2026-09-06@panchangam
END:VEVENT
BEGIN:VEVENT
DTSTART;VALUE=DATE:20261001
DESCRIPTION:Purattasi - 14 (01.10.2026) Thursday\n\nYear: Parabhava Varudam (Parabhava Nama Samvathsaram)\nAyanam: Dhatchinayanam\nRuthu: Varsha Ruthu\nMonth: Purattasi Masam (Kanni Masam)\nPaksham: Krushna Paksham\nThithi: upto 12.35 PM Panchami\, thereafter Shashti\nDay: {Guru Vasaram} Thursday\nNakshatthiram: upto 6.40 AM Karthigai\, upto 5.05 AM Rohini\, and then Mrigashirsham\nYogam: Siddhi\nKaranam: Thaitilai\nAmirthathiyogam: Siddha Yogam\nSubayogam: Subayogam\nRaghu Kalam: 1.35 PM to 3.05 PM\nYemakandam: 6.06 AM to 7.36 AM\nKuligai: 7.36 AM to 9.05 AM\nGood time: 6.06 AM to 7.36 AM and 12.05 PM to 1.35 PM\nSun Rise: 6.06 AM\nSun Set: 6.05 PM\nChandhirashtamam: Thulam\nSoolam: South\nPrayatchittham: Oil / Thailam\nSradhdhathithi: Shashti\nLocation: Hyderabad\, India
SUMMARY:Purattasi - 14 (01.10.2026) Thursday
UID:india-2026-10-01@panchangam
END:VEVENT
BEGIN:VEVENT
DTSTART;VALUE=DATE:20261111
DESCRIPTION:Aippasi - 25 (11.11.2026) Wednesday\n\nYear: Parabhava Varudam (Parabhava Nama Samvathsaram)\nAyanam: Dhatchinayanam\nRuthu: Sarath Ruthu\nMonth: Aippasi Masam (Thulam Masam)\nPaksham: Shukla Paksham\nThithi: upto 3.53 PM Dwitiyai\, thereafter Tritiyai\nDay: {Budha Vasaram} Wednesday\nNakshatthiram: upto 12.23 PM Anusham\, and then Kettai\nYogam: Atiganda\nKaranam: Kaulavai\nAmirthathiyogam: Amirtha Yogam\nSubayogam: Subayogam\nRaghu Kalam: 11.59 AM to 1.25 PM\nYemakandam: 7.44 AM to 9.09 AM\nKuligai: 9.09 AM to 10.34 AM\nGood time: 6.18 AM to 7.44 AM and 1.25 PM to 2.50 PM\nSun Rise: 6.18 AM\nSun Set: 5.41 PM\nChandhirashtamam: Mesham\nSoolam: North\nPrayatchittham: Milk / Paal\nSradhdhathithi: Dwitiyai\nLocation: Hyderabad\, India
SUMMARY:Aippasi - 25 (11.11.2026) Wednesday
UID:india-2026-11-11@panchangam
END:VEVENT
BEGIN:VEVENT
DTSTART;VALUE=DATE:20261221
DESCRIPTION:Margazhi - 05 (21.12.2026) Monday\n\nYear: Parabhava Varudam (Parabhava Nama Samvathsaram)\nAyanam: Dhatchinayanam\nRuthu: Hemantha Ruthu\nMonth: Margazhi Masam (Dhanus Masam)\nPaksham: Shukla Paksham\nThithi: upto 5.36 PM Dwadashi\, thereafter Trayodashi\nDay: {Soma Vasaram} Monday\nNakshatthiram: upto 1.46 PM Bharani\, and then Karthigai\nYogam: Siddha\nKaranam: Bavai\nAmirthathiyogam: Siddha Yogam\nSubayogam: Subayogam\nRaghu Kalam: 8.04 AM to 9.27 AM\nYemakandam: 10.50 AM to 12.14 PM\nKuligai: 12.14 PM to 1.37 PM\nGood time: 6.41 AM to 8.04 AM and 12.14 PM to 1.37 PM\nSun Rise: 6.41 AM\nSun Set: 5.46 PM\nChandhirashtamam: Kanni\nSoolam: East\nPrayatchittham: Curd / Thayir\nSradhdhathithi: Dwadashi\nLocation: Hyderabad\, India
SUMMARY:Margazhi - 05 (21.12.2026) Monday
UID:india-2026-12-21@panchangam
END:VEVENT
BEGIN:VEVENT
DESCRIPTION:Exact Astronomical Duration (Hyderabad\, India)
DTEND:20260922T161347Z
DTSTART:20260921T143124Z
SUMMARY:Shukla Ekadasi
UID:india-202609211431-11@tithi
END:VEVENT
BEGIN:VEVENT
DTSTART;VALUE=DATE:20260205
DESCRIPTION:Thai - 22 (05.02.2026) Thursday\n\nYear: Vishvavasu Varudam (Vishvavasu Nama Samvathsaram)\nAyanam: Utharayanam\nRuthu: Hemantha Ruthu\nMonth: Thai Masam (Makaram Masam)\nPaksham: Krushna Paksham\nThithi: upto 12.22 AM Chathurthi\, thereafter Panchami\nDay: {Guru Vasaram} Thursday\nNakshatthiram: upto 11.38 PM Uthiram\, and then Hastham\nYogam: Sukarman\nKaranam: Bavai\nAmirthathiyogam: Siddha Yogam\nSubayogam: Subayogam\nRaghu Kalam: 1.55 PM to 3.21 PM\nYemakandam: 6.46 AM to 8.12 AM\nKuligai: 8.12 AM to 9.38 AM\nGood time: 6.46 AM to 8.12 AM and 12.30 PM to 1.55 PM\nSun Rise: 6.46 AM\nSun Set: 6.13 PM\nChandhirashtamam: Kumbham\nSoolam: South\nPrayatchittham: Oil / Thailam\nSradhdhathithi: Chathurthi\nLocation: Hyderabad\, India
SUMMARY:Thai - 22 (05.02.2026) Thursday
UID:india-2026-02-05@panchangam
END:VEVENT
BEGIN:VEVENT
DTSTART;VALUE=DATE:20260315
DESCRIPTION:Maasi - 30 (15.03.2026) Sunday\n\nYear: Vishvavasu Varudam (Vishvavasu Nama Samvathsaram)\nAyanam: Utharayanam\nRuthu: Shishira Ruthu\nMonth: Maasi Masam (Kumbham Masam)\nPaksham: Krushna Paksham\nThithi: upto 9.17 AM Ekadashi\, thereafter Dwadashi\nDay: {Ravi Vasaram} Sunday\nNakshatthiram: Thiruvonam\nYogam: Parigha\nKaranam: Balavai\nAmirthathiyogam: Siddha Yogam\nSubayogam: Subayogam\nRaghu Kalam: 4.55 PM to 6.25 PM\nYemakandam: 12.25 PM to 1.55 PM\nKuligai: 1.55 PM to 3.25 PM\nGood time: 6.24 AM to 7.54 AM and 12.25 PM to 1.55 PM\nSun Rise: 6.24 AM\nSun Set: 6.25 PM\nChandhirashtamam: Mithunam\nSoolam: West\nPrayatchittham: Jaggery / Vellam\nSradhdhathithi: Dwadashi\nLocation: Hyderabad\, India
SUMMARY:Maasi - 30 (15.03.2026) Sunday
UID:india-2026-03-15@panchangam
END:VEVENT
BEGIN:VEVENT
DTSTART;VALUE=DATE:20260425
DESCRIPTION:Chithirai - 11 (25.04.2026) Saturday\n\nYear: Parabhava Varudam (Parabhava Nama Samvathsaram)\nAyanam: Utharayanam\nRuthu: Vasantha Ruthu\nMonth: Chithirai Masam (Mesham Masam)\nPaksham: Shukla Paksham\nThithi: upto 6.28 PM Navami\, thereafter Dashami\nDay: {Sani Vasaram} Saturday\nNakshatthiram: upto 8.44 PM Aayilyam\, and then Magam\nYogam: Ganda\nKaranam: Balavai\nAmirthathiyogam: Siddha Yogam\nSubayogam: Subayogam\nRaghu Kalam: 9.03 AM to 10.39 AM\nYemakandam: 1.49 PM to 3.24 PM\nKuligai: 3.24 PM to 4.59 PM\nGood time: 9.03 AM to 10.39 AM and 1.49 PM to 3.24 PM\nSun Rise: 5.53 AM\nSun Set: 6.34 PM\nChandhirashtamam: Dhanus\nSoolam: East\nPrayatchittham: Curd / Thayir\nSradhdhathithi: Navami\nLocation: Hyderabad\, India
SUMMARY:Chithirai - 11 (25.04.2026) Saturday
UID:india-2026-04-25@panchangam
END:VEVENT
BEGIN:VEVENT
DTSTART;VALUE=DATE:20260704
DESCRIPTION:Aani - 19 (04.07.2026) Saturday\n\nYear: Parabhava Varudam (Parabhava Nama Samvathsaram)\nAyanam: Dhatchinayanam\nRuthu: Grishma Ruthu\nMonth: Aani Masam (Mithunam Masam)\nPaksham: Krushna Paksham\nThithi: upto 12.40 PM Chathurthi\, thereafter Panchami\nDay: {Sani Vasaram} Saturday\nNakshatthiram: upto 2.26 PM Avittam\, and then Sathayam\nYogam: Priti\nKaranam: Balavai\nAmirthathiyogam: Siddha Yogam\nSubayogam: Subayogam\nRaghu Kalam: 9.03 AM to 10.41 AM\nYemakandam: 1.58 PM to 3.37 PM\nKuligai: 3.37 PM to 5.16 PM\nGood time: 9.03 AM to 10.41 AM and 1.58 PM to 3.37 PM\nSun Rise: 5.46 AM\nSun Set: 6.54 PM\nChandhirashtamam: Katakam\nSoolam: East\nPrayatchittham: Curd / Thayir\nSradhdhathithi: Panchami\nLocation: Hyderabad\, India
SUMMARY:Aani - 19 (04.07.2026) Saturday
UID:india-2026-07-04@panchangam
END:VEVENT
BEGIN:VEVENT
DTSTART;VALUE=DATE:20260814
DESCRIPTION:Aadi - 28 (14.08.2026) Friday\n\nYear: Parabhava Varudam (Parabhava Nama Samvathsaram)\nAyanam: Dhatchinayanam\nRuthu: Grishma Ruthu\nMonth: Aadi Masam (Katakam Masam)\nPaksham: Shukla Paksham\nThithi: upto 6.47 PM Dwitiyai\, thereafter Tritiyai\nDay: {Sukra Vasaram} Friday\nNakshatthiram: upto 4.22 AM Pooram\, and then Uthiram\nYogam: Parigha\nKaranam: Balavai\nAmirthathiyogam: Siddha Yogam\nSubayogam: Subayogam\nRaghu Kalam: 10.45 AM to 12.20 PM\nYemakandam: 3.31 PM to 5.07 PM\nKuligai: 5.58 AM to 7.34 AM\nGood time: 5.58 AM to 7.34 AM and 12.20 PM to 1.56 PM\nSun Rise: 5.58 AM\nSun Set: 6.42 PM\nChandhirashtamam: Makaram\nSoolam: West\nPrayatchittham: Jaggery / Vellam\nSradhdhathithi: Dwitiyai\nLocation: Hyderabad\, India
SUMMARY:Aadi - 28 (14.08.2026) Friday
UID:india-2026-08-14@panchangam
END:VEVENT
BEGIN:VEVENT
DTSTART;VALUE=DATE:20260924
DESCRIPTION:Purattasi - 07 (24.09.2026) Thursday\n\nYear: Parabhava Varudam (Parabhava Nama Samvathsaram)\nAyanam: Dhatchinayanam\nRuthu: Varsha Ruthu\nMonth: Purattasi Masam (Kanni Masam)\nPaksham: Shukla Paksham\nThithi: upto 11.18 PM Trayodashi\, thereafter Chadhurdasi\nDay: {Guru Vasaram} Thursday\nNakshatthiram: upto 11.17 AM Avittam\, and then Sathayam\nYogam: Dhriti\nKaranam: Kaulavai\nAmirthathiyogam: Siddha Yogam\nSubayogam: Subayogam\nRaghu Kalam: 1.38 PM to 3.09 PM\nYemakandam: 6.05 AM to 7.35 AM\nKuligai: 7.35 AM to 9.06 AM\nGood time: 6.05 AM to 7.35 AM and 12.08 PM to 1.38 PM\nSun Rise: 6.05 AM\nSun Set: 6.10 PM\nChandhirashtamam: Katakam\nSoolam: South\nPrayatchittham: Oil / Thailam\nSradhdhathithi: Trayodashi\nLocation: Hyderabad\, India
SUMMARY:Purattasi - 07 (24.09.2026) Thursday
UID:india-2026-09-24@panchangam
END:VEVENT
BEGIN:VEVENT
DTSTART;VALUE=DATE:20261008
DESCRIPTION:Purattasi - 21 (08.10.2026) Thursday\n\nYear: Parabhava Varudam (Parabhava Nama Samvathsaram)\nAyanam: Dhatchinayanam\nRuthu: Varsha Ruthu\nMonth: Purattasi Masam (Kanni Masam)\nPaksham: Krushna Paksham\nThithi: upto 10.16 PM Trayodashi\, thereafter Chadhurdasi\nDay: {Guru Vasaram} Thursday\nNakshatthiram: upto 10.00 PM Pooram\, and then Uthiram\nYogam: Shukla\nKaranam: Garajai\nAmirthathiyogam: Siddha Yogam\nSubayogam: Subayogam\nRaghu Kalam: 1.32 PM to 3.01 PM\nYemakandam: 6.07 AM to 7.36 AM\nKuligai: 7.36 AM to 9.05 AM\nGood time: 6.07 AM to 7.36 AM and 12.03 PM to 1.32 PM\nSun Rise: 6.07 AM\nSun Set: 5.59 PM\nChandhirashtamam: Makaram\nSoolam: South\nPrayatchittham: Oil / Thailam\nSradhdhathithi: Trayodashi\nLocation: Hyderabad\, India
SUMMARY:Purattasi - 21 (08.10.2026) Thursday
UID:india-2026-10-08@panchangam
END:VEVENT
BEGIN:VEVENT
DTSTART;VALUE=DATE:20261118
DESCRIPTION:Karthigai - 02 (18.11.2026) Wednesday\n\nYear: Parabhava Varudam (Parabhava Nama Samvathsaram)\nAyanam: Dhatchinayanam\nRuthu: Sarath Ruthu\nMonth: Karthigai Masam (Virutchigam Masam)\nPaksham: Shukla Paksham\nThithi: Navami\nDay: {Budha Vasaram} Wednesday\nNakshatthiram: Sathayam\nYogam: Dhruva\nKaranam: Balavai\nAmirthathiyogam: Siddha Yogam\nSubayogam: Subayogam\nRaghu Kalam: 12.01 PM to 1.25 PM\nYemakandam: 7.47 AM to 9.11 AM\nKuligai: 9.11 AM to 10.36 AM\nGood time: 6.22 AM to 7.47 AM and 1.25 PM to 2.50 PM\nSun Rise: 6.22 AM\nSun Set: 5.39 PM\nChandhirashtamam: Katakam\nSoolam: North\nPrayatchittham: Milk / Paal\nSradhdhathithi: Navami\nLocation: Hyderabad\, India
SUMMARY:Karthigai - 02 (18.11.2026) Wednesday
UID:india-2026-11-18@panchangam
END:VEVENT
BEGIN:VEVENT
DTSTART;VALUE=DATE:20260113
DESCRIPTION:Margazhi - 22 (13.01.2026) Tuesday\n\nYear: Vishvavasu Varudam (Vishvavasu Nama Samvathsaram)\nAyanam: Utharayanam\nRuthu: Hemantha Ruthu\nMonth: Margazhi Masam (Dhanus Masam)\nPaksham: Krushna Paksham\nThithi: upto 3.18 PM Dashami\, thereafter Ekadashi\nDay: {Bhauma Vasaram} Tuesday\nNakshatthiram: upto 12.50 AM Visakam\, and then Anusham\nYogam: Shoola\nKaranam: Vishti\nAmirthathiyogam: Siddha Yogam\nSubayogam: Subayogam\nRaghu Kalam: 3.12 PM to 4.36 PM\nYemakandam: 9.36 AM to 11.00 AM\nKuligai: 11.00 AM to 12.24 PM\nGood time: 8.13 AM to 9.36 AM and 3.12 PM to 4.36 PM\nSun Rise: 6.49 AM\nSun Set: 6.00 PM\nChandhirashtamam: Meenam\nSoolam: North\nPrayatchittham: Milk / Paal\nSradhdhathithi: Dashami\nLocation: Hyderabad\, India
SUMMARY:Margazhi - 22 (13.01.2026) Tuesday
UID:india-2026-01-13@panchangam
END:VEVENT
BEGIN:VEVENT
DTSTART;VALUE=DATE:20260223
DESCRIPTION:Maasi - 10 (23.02.2026) Monday\n\nYear: Vishvavasu Varudam (Vishvavasu Nama Samvathsaram)\nAyanam: Utharayanam\nRuthu: Shishira Ruthu\nMonth: Maasi Masam (Kumbham Masam)\nPaksham: Shukla Paksham\nThithi: upto 9.09 AM Shashti\, thereafter Saptami\nDay: {Soma Vasaram} Monday\nNakshatthiram: upto 5.10 PM Bharani\, and then Karthigai\nYogam: Brahma\nKaranam: Thaitilai\nAmirthathiyogam: Siddha Yogam\nSubayogam: Subayogam\nRaghu Kalam: 8.06 AM to 9.33 AM\nYemakandam: 11.01 AM to 12.29 PM\nKuligai: 12.29 PM to 1.57 PM\nGood time: 6.38 AM to 8.06 AM and 12.29 PM to 1.57 PM\nSun Rise: 6.38 AM\nSun Set: 6.20 PM\nChandhirashtamam: Kanni\nSoolam: East\nPrayatchittham: Curd / Thayir\nSradhdhathithi: Saptami\nLocation: Hyderabad\, India
SUMMARY:Maasi - 10 (23.02.2026) Monday
UID:india-2026-02-23@panchangam
END:VEVENT
BEGIN:VEVENT
DTSTART;VALUE=DATE:20260502
DESCRIPTION:Chithirai - 18 (02.05.2026) Saturday\n\nYear: Parabhava Varudam (Parabhava Nama Samvathsaram)\nAyanam: Utharayanam\nRuthu: Vasantha Ruthu\nMonth: Chithirai Masam (Mesham Masam)\nPaksham: Krushna Paksham\nThithi: upto 12.50 AM Prathamai\, thereafter Dwitiyai\nDay: {Sani Vasaram} Saturday\nNakshatthiram: Visakam\nYogam: Vyatipata\nKaranam: Balavai\nAmirthathiyogam: Siddha Yogam\nSubayogam: Subayogam\nRaghu Kalam: 9.01 AM to 10.37 AM\nYemakandam: 1.48 PM to 3.24 PM\nKuligai: 3.24 PM to 5.00 PM\nGood time: 9.01 AM to 10.37 AM and 1.48 PM to 3.24 PM\nSun Rise: 5.49 AM\nSun Set: 6.36 PM\nChandhirashtamam: Meenam\nSoolam: East\nPrayatchittham: Curd / Thayir\nSradhdhathithi: Prathamai\nLocation: Hyderabad\, India
SUMMARY:Chithirai - 18 (02.05.2026) Saturday
UID:india-2026-05-02@panchangam
END:VEVENT
BEGIN:VEVENT
DTSTART;VALUE=DATE:20260612
DESCRIPTION:Vaikasi - 28 (12.06.2026) Friday\n\nYear: Parabhava Varudam (Parabhava Nama Samvathsaram)\nAyanam: Utharayanam\nRuthu: Vasantha Ruthu\nMonth: Vaikasi Masam (Rishabam Masam)\nPaksham: Krushna Paksham\nThithi: upto 7.37 PM Dwadashi\, thereafter Trayodashi\nDay: {Sukra Vasaram} Friday\nNakshatthiram: upto 7.05 AM Ashwini\, upto 4.41 AM Bharani\, and then Karthigai\nYogam: Atiganda\nKaranam: Kaulavai\nAmirthathiyogam: Siddha Yogam\nSubayogam: Subayogam\nRaghu Kalam: 10.37 AM to 12.15 PM\nYemakandam: 3.33 PM to 5.11 PM\nKuligai: 5.41 AM to 7.19 AM\nGood time: 5.41 AM to 7.19 AM and 12.15 PM to 1.54 PM\nSun Rise: 5.41 AM\nSun Set: 6.50 PM\nChandhirashtamam: Kanni\nSoolam: West\nPrayatchittham: Jaggery / Vellam\nSradhdhathithi: Dwadashi\nLocation: Hyderabad\, India
SUMMARY:Vaikasi - 28 (12.06.2026) Friday
UID:india-2026-06-12@panchangam
END:VEVENT
BEGIN:VEVENT
DTSTART;VALUE=DATE:20260722
DESCRIPTION:Aadi - 05 (22.07.2026) Wednesday\n\nYear: Parabhava Varudam (Parabhava Nama Samvathsaram)\nAyanam: Dhatchinayanam\nRuthu: Grishma Ruthu\nMonth: Aadi Masam (Katakam Masam)\nPaksham: Shukla Paksham\nThithi: Navami\nDay: {Budha Vasaram} Wednesday\nNakshatthiram: upto 11.47 PM Swathi\, and then Visakam\nYogam: Sadhya\nKaranam: Balavai\nAmirthathiyogam: Siddha Yogam\nSubayogam: Subayogam\nRaghu Kalam: 12.22 PM to 2.00 PM\nYemakandam: 7.29 AM to 9.07 AM\nKuligai: 9.07 AM to 10.44 AM\nGood time: 5.52 AM to 7.29 AM and 2.00 PM to 3.37 PM\nSun Rise: 5.52 AM\nSun Set: 6.52 PM\nChandhirashtamam: Meenam\nSoolam: North\nPrayatchittham: Milk / Paal\nSradhdhathithi: Navami\nLocation: Hyderabad\, India
SUMMARY:Aadi - 05 (22.07.2026) Wednesday
UID:india-2026-07-22@panchangam
END:VEVENT
BEGIN:VEVENT
DTSTART;VALUE=DATE:20261026
DESCRIPTION:Aippasi - 09 (26.10.2026) Monday\n\nYear: Parabhava Varudam (Parabhava Nama Samvathsaram)\nAyanam: Dhatchinayanam\nRuthu: Sarath Ruthu\nMonth: Aippasi Masam (Thulam Masam)\nPaksham: Shukla Paksham\nThithi: upto 9.41 AM Pournami\, thereafter Prathamai\nDay: {Soma Vasaram} Monday\nNakshatthiram: upto 6.18 PM Ashwini\, and then Bharani\nYogam: Vajra\nKaranam: Bavai\nAmirthathiyogam: Siddha Yogam\nSubayogam: Subayogam\nRaghu Kalam: 7.39 AM to 9.06 AM\nYemakandam: 10.33 AM to 11.59 AM\nKuligai: 11.59 AM to 1.26 PM\nGood time: 6.12 AM to 7.39 AM and 4.20 PM to 5.47 PM\nSun Rise: 6.12 AM\nSun Set: 5.47 PM\nChandhirashtamam: Kanni\nSoolam: East\nPrayatchittham: Curd / Thayir\nSradhdhathithi: Prathamai\nLocation: Hyderabad\, India
SUMMARY:Aippasi - 09 (26.10.2026) Monday
UID:india-2026-10-26@panchangam
END:VEVENT
BEGIN:VEVENT
DESCRIPTION:Exact Astronomical Duration (Hyderabad\, India)
DTEND:20260620T101709Z
DTSTART:20260619T113021Z
SUMMARY:Shukla Shashti
UID:india-202606191130-6@tithi
END:VEVENT
BEGIN:VEVENT
DTSTART;VALUE=DATE:20260131
DESCRIPTION:Thai - 17 (31.01.2026) Saturday\n\nYear: Vishvavasu Varudam (Vishvavasu Nama Samvathsaram)\nAyanam: Utharayanam\nRuthu: Hemantha Ruthu\nMonth: Thai Masam (Makaram Masam)\nPaksham: Shukla Paksham\nThithi: upto 8.26 AM Trayodashi\, upto 5.53 AM Chadhurdasi\, thereafter Pournami\nDay: {Sani Vasaram} Saturday\nNakshatthiram: upto 2.10 AM Punarpoosam\, and then Poosam\nYogam: Vishkambha\nKaranam: Thaitilai\nAmirthathiyogam: Siddha Yogam\nSubayogam: Subayogam\nRaghu Kalam: 9.38 AM to 11.04 AM\nYemakandam: 1.54 PM to 3.20 PM\nKuligai: 3.20 PM to 4.45 PM\nGood time: 9.38 AM to 11.04 AM and 1.54 PM to 3.20 PM\nSun Rise: 6.48 AM\nSun Set: 6.10 PM\nChandhirashtamam: Virutchigam\nSoolam: East\nPrayatchittham: Curd / Thayir\nSradhdhathithi: Chadhurdasi\nLocation: Hyderabad\, India
SUMMARY:Thai - 17 (31.01.2026) Saturday
UID:india-2026-01-31@panchangam
END:VEVENT
BEGIN:VEVENT
DTSTART;VALUE=DATE:20260410
DESCRIPTION:Panguni - 26 (10.04.2026) Friday\n\nYear: Vishvavasu Varudam (Vishvavasu Nama Samvathsaram)\nAyanam: Utharayanam\nRuthu: Shishira Ruthu\nMonth: Panguni Masam (Meenam Masam)\nPaksham: Krushna Paksham\nThithi: upto 11.16 PM Ashtami\, thereafter Navami\nDay: {Sukra Vasaram} Friday\nNakshatthiram: upto 12.11 PM Pooradam\, and then Uthiradam\nYogam: Shiva\nKaranam: Balavai\nAmirthathiyogam: Marana Yogam\nSubayogam: \nRaghu Kalam: 10.44 AM to 12.17 PM\nYemakandam: 3.24 PM to 4.57 PM\nKuligai: 6.03 AM to 7.37 AM\nGood time: 6.03 AM to 7.37 AM and 12.17 PM to 1.50 PM\nSun Rise: 6.03 AM\nSun Set: 6.31 PM\nChandhirashtamam: Rishabam\nSoolam: West\nPrayatchittham: Jaggery / Vellam\nSradhdhathithi: Ashtami\nLocation: Hyderabad\, India
SUMMARY:Panguni - 26 (10.04.2026) Friday
UID:india-2026-04-10@panchangam
END:VEVENT
BEGIN:VEVENT
DTSTART;VALUE=DATE:20260520
DESCRIPTION:Vaikasi - 05 (20.05.2026) Wednesday\n\nYear: Parabhava Varudam (Parabhava Nama Samvathsaram)\nAyanam: Utharayanam\nRuthu: Vasantha Ruthu\nMonth: Vaikasi Masam (Rishabam Masam)\nPaksham: Shukla Paksham\nThithi: upto 11.07 AM Chathurthi\, thereafter Panchami\nDay: {Budha Vasaram} Wednesday\nNakshatthiram: upto 6.48 AM Thiruvathirai\, upto 4.49 AM Punarpoosam\, and then Poosam\nYogam: Shoola\nKaranam: Vishti\nAmirthathiyogam: Siddha Yogam\nSubayogam: Subayogam\nRaghu Kalam: 12.12 PM to 1.50 PM\nYemakandam: 7.20 AM to 8.57 AM\nKuligai: 8.57 AM to 10.35 AM\nGood time: 5.42 AM to 7.20 AM and 1.50 PM to 3.27 PM\nSun Rise: 5.42 AM\nSun Set: 6.42 PM\nChandhirashtamam: Virutchigam\nSoolam: North\nPrayatchittham: Milk / Paal\nSradhdhathithi: Panchami\nLocation: Hyderabad\, India
SUMMARY:Vaikasi - 05 (20.05.2026) Wednesday
UID:india-2026-05-20@panchangam
END:VEVENT
BEGIN:VEVENT
DTSTART;VALUE=DATE:20260630
DESCRIPTION:Aani - 15 (30.06.2026) Tuesday\n\nYear: Parabhava Varudam (Parabhava Nama Samvathsaram)\nAyanam: Dhatchinayanam\nRuthu: Grishma Ruthu\nMonth: Aani Masam (Mithunam Masam)\nPaksham: Krushna Paksham\nThithi: Prathamai\nDay: {Bhauma Vasaram} Tuesday\nNakshatthiram: Pooradam\nYogam: Brahma\nKaranam: Balavai\nAmirthathiyogam: Siddha Yogam\nSubayogam: Subayogam\nRaghu Kalam: 3.37 PM to 5.15 PM\nYemakandam: 9.02 AM to 10.41 AM\nKuligai: 10.41 AM to 12.19 PM\nGood time: 7.23 AM to 9.02 AM and 3.37 PM to 5.15 PM\nSun Rise: 5.45 AM\nSun Set: 6.54 PM\nChandhirashtamam: Rishabam\nSoolam: North\nPrayatchittham: Milk / Paal\nSradhdhathithi: Prathamai\nLocation: Hyderabad\, India
SUMMARY:Aani - 15 (30.06.2026) Tuesday
UID:india-2026-06-30@panchangam
END:VEVENT
BEGIN:VEVENT
DTSTART;VALUE=DATE:20260509
DESCRIPTION:Chithirai - 25 (09.05.2026) Saturday\n\nYear: Parabhava Varudam (Parabhava Nama Samvathsaram)\nAyanam: Utharayanam\nRuthu: Vasantha Ruthu\nMonth: Chithirai Masam (Mesham Masam)\nPaksham: Krushna Paksham\nThithi: upto 2.03 PM Saptami\, thereafter Ashtami\nDay: {Sani Vasaram} Saturday\nNakshatthiram: upto 12.07 AM Thiruvonam\, and then Avittam\nYogam: Shukla\nKaranam: Bavai\nAmirthathiyogam: Siddha Yogam\nSubayogam: Subayogam\nRaghu Kalam: 8.59 AM to 10.36 AM\nYemakandam: 1.49 PM to 3.25 PM\nKuligai: 3.25 PM to 5.02 PM\nGood time: 8.59 AM to 10.36 AM and 1.49 PM to 3.25 PM\nSun Rise: 5.46 AM\nSun Set: 6.38 PM\nChandhirashtamam: Mithunam\nSoolam: East\nPrayatchittham: Curd / Thayir\nSradhdhathithi: Ashtami\nLocation: Hyderabad\, India
SUMMARY:Chithirai - 25 (09.05.2026) Saturday
UID:india-2026-05-09@panchangam
END:VEVENT
BEGIN:VEVENT
DTSTART;VALUE=DATE:20260619
DESCRIPTION:Aani - 04 (19.06.2026) Friday\n\nYear: Parabhava Varudam (Parabhava Nama Samvathsaram)\nAyanam: Utharayanam\nRuthu: Grishma Ruthu\nMonth: Aani Masam (Mithunam Masam)\nPaksham: Shukla Paksham\nThithi: upto 5.00 PM Panchami\, thereafter Shashti\nDay: {Sukra Vasaram} Friday\nNakshatthiram: upto 10.45 AM Aayilyam\, and then Magam\nYogam: Harshana\nKaranam: Bavai\nAmirthathiyogam: Siddha Yogam\nSubayogam: Subayogam\nRaghu Kalam: 10.38 AM to 12.17 PM\nYemakandam: 3.34 PM to 5.13 PM\nKuligai: 5.42 AM to 7.21 AM\nGood time: 5.42 AM to 7.21 AM and 12.17 PM to 1.56 PM\nSun Rise: 5.42 AM\nSun Set: 6.52 PM\nChandhirashtamam: Dhanus\nSoolam: West\nPrayatchittham: Jaggery / Vellam\nSradhdhathithi: Panchami\nLocation: Hyderabad\, India
SUMMARY:Aani - 04 (19.06.2026) Friday
UID:india-2026-06-19@panchangam
END:VEVENT
BEGIN:VEVENT
DTSTART;VALUE=DATE:20260729
DESCRIPTION:Aadi - 12 (29.07.2026) Wednesday\n\nYear: Parabhava Varudam (Parabhava Nama Samvathsaram)\nAyanam: Dhatchinayanam\nRuthu: Grishma Ruthu\nMonth: Aadi Masam (Katakam Masam)\nPaksham: Shukla Paksham\nThithi: upto 8.05 PM Pournami\, thereafter Prathamai\nDay: {Budha Vasaram} Wednesday\nNakshatthiram: upto 4.21 PM Uthiradam\, and then Thiruvonam\nYogam: Priti\nKaranam: Vishti\nAmirthathiyogam: Siddha Yogam\nSubayogam: Subayogam\nRaghu Kalam: 12.22 PM to 1.59 PM\nYemakandam: 7.31 AM to 9.08 AM\nKuligai: 9.08 AM to 10.45 AM\nGood time: 5.54 AM to 7.31 AM and 1.59 PM to 3.36 PM\nSun Rise: 5.54 AM\nSun Set: 6.50 PM\nChandhirashtamam: Mithunam\nSoolam: North\nPrayatchittham: Milk / Paal\nSradhdhathithi: Pournami\nLocation: Hyderabad\, India
SUMMARY:Aadi - 12 (29.07.2026) Wednesday
UID:india-2026-07-29@panchangam
END:VEVENT
BEGIN:VEVENT
DESCRIPTION:Exact Astronomical Duration (Hyderabad\, India)
DTEND:20260129T082538Z
DTSTART:20260128T110632Z
SUMMARY:Shukla Ekadasi
UID:india-202601281106-11@tithi
END:VEVENT
BEGIN:VEVENT
DTSTART;VALUE=DATE:20261103
DESCRIPTION:Aippasi - 17 (03.11.2026) Tuesday\n\nYear: Parabhava Varudam (Parabhava Nama Samvathsaram)\nAyanam: Dhatchinayanam\nRuthu: Sarath Ruthu\nMonth: Aippasi Masam (Thulam Masam)\nPaksham: Krushna Paksham\nThithi: upto 11.55 AM Navami\, thereafter Dashami\nDay: {Bhauma Vasaram} Tuesday\nNakshatthiram: upto 4.06 AM Magam\, and then Pooram\nYogam: Shukla\nKaranam: Garajai\nAmirthathiyogam: Siddha Yogam\nSubayogam: Subayogam\nRaghu Kalam: 2.51 PM to 4.17 PM\nYemakandam: 9.07 AM to 10.33 AM\nKuligai: 10.33 AM to 11.59 AM\nGood time: 7.41 AM to 9.07 AM and 2.51 PM to 4.17 PM\nSun Rise: 6.15 AM\nSun Set: 5.43 PM\nChandhirashtamam: Makaram\nSoolam: North\nPrayatchittham: Milk / Paal\nSradhdhathithi: Dashami\nLocation: Hyderabad\, India
SUMMARY:Aippasi - 17 (03.11.2026) Tuesday
UID:india-2026-11-03@panchangam
END:VEVENT
BEGIN:VEVENT
DTSTART;VALUE=DATE:20261213
DESCRIPTION:Karthigai - 27 (13.12.2026) Sunday\n\nYear: Parabhava Varudam (Parabhava Nama Samvathsaram)\nAyanam: Dhatchinayanam\nRuthu: Sarath Ruthu\nMonth: Karthigai Masam (Virutchigam Masam)\nPaksham: Shukla Paksham\nThithi: upto 4.48 PM Chathurthi\, thereafter Panchami\nDay: {Ravi Vasaram} Sunday\nNakshatthiram: upto 6.58 AM Uthiradam\, and then Thiruvonam\nYogam: Dhruva\nKaranam: Vishti\nAmirthathiyogam: Siddha Yogam\nSubayogam: Subayogam\nRaghu Kalam: 4.19 PM to 5.43 PM\nYemakandam: 12.10 PM to 1.33 PM\nKuligai: 1.33 PM to 2.56 PM\nGood time: 6.36 AM to 8.00 AM and 12.10 PM to 1.33 PM\nSun Rise: 6.36 AM\nSun Set: 5.43 PM\nChandhirashtamam: Mithunam\nSoolam: West\nPrayatchittham: Jaggery / Vellam\nSradhdhathithi: Chathurthi\nLocation: Hyderabad\, India
SUMMARY:Karthigai - 27 (13.12.2026) Sunday
UID:india-2026-12-13@panchangam
END:VEVENT
BEGIN:VEVENT
DESCRIPTION:Exact Astronomical Duration (Hyderabad\, India)
DTEND:20260719T220023Z
DTSTART:20260718T221312Z
SUMMARY:Shukla Shashti
UID:india-202607182213-6@tithi
END:VEVENT
BEGIN:VEVENT
DTSTART;VALUE=DATE:20260307
DESCRIPTION:Maasi - 22 (07.03.2026) Saturday\n\nYear: Vishvavasu Varudam (Vishvavasu Nama Samvathsaram)\nAyanam: Utharayanam\nRuthu: Shishira Ruthu\nMonth: Maasi Masam (Kumbham Masam)\nPaksham: Krushna Paksham\nThithi: upto 7.17 PM Chathurthi\, thereafter Panchami\nDay: {Sani Vasaram} Saturday\nNakshatthiram: upto 11.58 AM Chitthirai\, and then Swathi\nYogam: Vriddhi\nKaranam: Bavai\nAmirthathiyogam: Siddha Yogam\nSubayogam: Subayogam\nRaghu Kalam: 9.28 AM to 10.57 AM\nYemakandam: 1.56 PM to 3.25 PM\nKuligai: 3.25 PM to 4.54 PM\nGood time: 9.28 AM to 10.57 AM and 1.56 PM to 3.25 PM\nSun Rise: 6.30 AM\nSun Set: 6.24 PM\nChandhirashtamam: Meenam\nSoolam: East\nPrayatchittham: Curd / Thayir\nSradhdhathithi: Chathurthi\nLocation: Hyderabad\, India
SUMMARY:Maasi - 22 (07.03.2026) Saturday
UID:india-2026-03-07@panchangam
END:VEVENT
BEGIN:VEVENT
DTSTART;VALUE=DATE:20260417
DESCRIPTION:Chithirai - 03 (17.04.2026) Friday\n\nYear: Parabhava Varudam (Parabhava Nama Samvathsaram)\nAyanam: Utharayanam\nRuthu: Vasantha Ruthu\nMonth: Chithirai Masam (Mesham Masam)\nPaksham: Krushna Paksham\nThithi: upto 5.21 PM Amavasai\, thereafter Prathamai\nDay: {Sukra Vasaram} Friday\nNakshatthiram: upto 12.38 PM Revathi\, and then Ashwini\nYogam: Vaidhriti\nKaranam: Chatushpada\nAmirthathiyogam: Amirtha Yogam\nSubayogam: Subayogam\nRaghu Kalam: 10.41 AM to 12.15 PM\nYemakandam: 3.24 PM to 4.58 PM\nKuligai: 5.58 AM to 7.33 AM\nGood time: 5.58 AM to 7.33 AM and 12.15 PM to 1.49 PM\nSun Rise: 5.58 AM\nSun Set: 6.32 PM\nChandhirashtamam: Simham\nSoolam: West\nPrayatchittham: Jaggery / Vellam\nSradhdhathithi: Amavasai\nLocation: Hyderabad\, India
SUMMARY:Chithirai - 03 (17.04.2026) Friday
UID:india-2026-04-17@panchangam
END:VEVENT
BEGIN:VEVENT
DTSTART;VALUE=DATE:20260527
DESCRIPTION:Vaikasi - 12 (27.05.2026) Wednesday\n\nYear: Parabhava Varudam (Parabhava Nama Samvathsaram)\nAyanam: Utharayanam\nRuthu: Vasantha Ruthu\nMonth: Vaikasi Masam (Rishabam Masam)\nPaksham: Shukla Paksham\nThithi: upto 6.22 AM Ekadashi\, thereafter Dwadashi\nDay: {Budha Vasaram} Wednesday\nNakshatthiram: upto 6.40 AM Hastham\, and then Chitthirai\nYogam: Vyatipata\nKaranam: Vishti\nAmirthathiyogam: Siddha Yogam\nSubayogam: Subayogam\nRaghu Kalam: 12.13 PM to 1.51 PM\nYemakandam: 7.19 AM to 8.57 AM\nKuligai: 8.57 AM to 10.35 AM\nGood time: 5.41 AM to 7.19 AM and 1.51 PM to 3.29 PM\nSun Rise: 5.41 AM\nSun Set: 6.45 PM\nChandhirashtamam: Kumbham\nSoolam: North\nPrayatchittham: Milk / Paal\nSradhdhathithi: Dwadashi\nLocation: Hyderabad\, India
SUMMARY:Vaikasi - 12 (27.05.2026) Wednesday
UID:india-2026-05-27@panchangam
END:VEVENT
BEGIN:VEVENT
DTSTART;VALUE=DATE:20260806
DESCRIPTION:Aadi - 20 (06.08.2026) Thursday\n\nYear: Parabhava Varudam (Parabhava Nama Samvathsaram)\nAyanam: Dhatchinayanam\nRuthu: Grishma Ruthu\nMonth: Aadi Masam (Katakam Masam)\nPaksham: Krushna Paksham\nThithi: upto 6.53 PM Ashtami\, thereafter Navami\nDay: {Guru Vasaram} Thursday\nNakshatthiram: upto 8.51 PM Bharani\, and then Karthigai\nYogam: Ganda\nKaranam: Balavai\nAmirthathiyogam: Siddha Yogam\nSubayogam: Subayogam\nRaghu Kalam: 1.58 PM to 3.34 PM\nYemakandam: 5.56 AM to 7.33 AM\nKuligai: 7.33 AM to 9.09 AM\nGood time: 5.56 AM to 7.33 AM and 12.21 PM to 1.58 PM\nSun Rise: 5.56 AM\nSun Set: 6.47 PM\nChandhirashtamam: Kanni\nSoolam: South\nPrayatchittham: Oil / Thailam\nSradhdhathithi: Ashtami\nLocation: Hyderabad\, India
SUMMARY:Aadi - 20 (06.08.2026) Thursday
UID:india-2026-08-06@panchangam
END:VEVENT
BEGIN:VEVENT
DTSTART;VALUE=DATE:20260916
DESCRIPTION:Aavani - 30 (16.09.2026) Wednesday\n\nYear: Parabhava Varudam (Parabhava Nama Samvathsaram)\nAyanam: Dhatchinayanam\nRuthu: Varsha Ruthu\nMonth: Aavani Masam (Simham Masam)\nPaksham: Shukla Paksham\nThithi: upto 8.59 AM Panchami\, thereafter Shashti\nDay: {Budha Vasaram} Wednesday\nNakshatthiram: upto 6.06 PM Visakam\, and then Anusham\nYogam: Vaidhriti\nKaranam: Balavai\nAmirthathiyogam: Siddha Yogam\nSubayogam: Subayogam\nRaghu Kalam: 12.10 PM to 1.42 PM\nYemakandam: 7.35 AM to 9.07 AM\nKuligai: 9.07 AM to 10.39 AM\nGood time: 6.04 AM to 7.35 AM and 1.42 PM to 3.14 PM\nSun Rise: 6.04 AM\nSun Set: 6.17 PM\nChandhirashtamam: Meenam\nSoolam: North\nPrayatchittham: Milk / Paal\nSradhdhathithi: Shashti\nLocation: Hyderabad\, India
SUMMARY:Aavani - 30 (16.09.2026) Wednesday
UID:india-2026-09-16@panchangam
END:VEVENT
BEGIN:VEVENT
DTSTART;VALUE=DATE:20261011
DESCRIPTION:Purattasi - 24 (11.10.2026) Sunday\n\nYear: Parabhava Varudam (Parabhava Nama Samvathsaram)\nAyanam: Dhatchinayanam\nRuthu: Varsha Ruthu\nMonth: Purattasi Masam (Kanni Masam)\nPaksham: Shukla Paksham\nThithi: upto 9.31 PM Prathamai\, thereafter Dwitiyai\nDay: {Ravi Vasaram} Sunday\nNakshatthiram: upto 11.14 PM Chitthirai\, and then Swathi\nYogam: Vaidhriti\nKaranam: Kimstughna\nAmirthathiyogam: Siddha Yogam\nSubayogam: Subayogam\nRaghu Kalam: 4.28 PM to 5.57 PM\nYemakandam: 12.02 PM to 1.31 PM\nKuligai: 1.31 PM to 3.00 PM\nGood time: 6.08 AM to 7.36 AM and 12.02 PM to 1.31 PM\nSun Rise: 6.08 AM\nSun Set: 5.57 PM\nChandhirashtamam: Kumbham\nSoolam: West\nPrayatchittham: Jaggery / Vellam\nSradhdhathithi: Prathamai\nLocation: Hyderabad\, India
SUMMARY:Purattasi - 24 (11.10.2026) Sunday
UID:india-2026-10-11@panchangam
END:VEVENT
BEGIN:VEVENT
DTSTART;VALUE=DATE:20261121
DESCRIPTION:Karthigai - 05 (21.11.2026) Saturday\n\nYear: Parabhava Varudam (Parabhava Nama Samvathsaram)\nAyanam: Dhatchinayanam\nRuthu: Sarath Ruthu\nMonth: Karthigai Masam (Virutchigam Masam)\nPaksham: Shukla Paksham\nThithi: upto 6.32 AM Ekadashi\, upto 4.56 AM Dwadashi\, thereafter Trayodashi\nDay: {Sani Vasaram} Saturday\nNakshatthiram: upto 7.30 AM Uthirattathi\, and then Revathi\nYogam: Siddhi\nKaranam: Vishti\nAmirthathiyogam: Siddha Yogam\nSubayogam: Subayogam\nRaghu Kalam: 9.12 AM to 10.37 AM\nYemakandam: 1.26 PM to 2.50 PM\nKuligai: 2.50 PM to 4.15 PM\nGood time: 9.12 AM to 10.37 AM and 1.26 PM to 2.50 PM\nSun Rise: 6.24 AM\nSun Set: 5.39 PM\nChandhirashtamam: Simham\nSoolam: East\nPrayatchittham: Curd / Thayir\nSradhdhathithi: Dwadashi\nLocation: Hyderabad\, India
SUMMARY:Karthigai - 05 (21.11.2026) Saturday
UID:india-2026-11-21@panchangam
END:VEVENT
BEGIN:VEVENT
DTSTART;VALUE=DATE:20260105
DESCRIPTION:Margazhi - 14 (05.01.2026) Monday\n\nYear: Vishvavasu Varudam (Vishvavasu Nama Samvathsaram)\nAyanam: Utharayanam\nRuthu: Hemantha Ruthu\nMonth: Margazhi Masam (Dhanus Masam)\nPaksham: Krushna Paksham\nThithi: upto 9.57 AM Dwitiyai\, thereafter Tritiyai\nDay: {Soma Vasaram} Monday\nNakshatthiram: upto 2.01 PM Poosam\, and then Aayilyam\nYogam: Vishkambha\nKaranam: Garajai\nAmirthathiyogam: Siddha Yogam\nSubayogam: Subayogam\nRaghu Kalam: 8.10 AM to 9.34 AM\nYemakandam: 10.57 AM to 12.21 PM\nKuligai: 12.21 PM to 1.44 PM\nGood time: 6.47 AM to 8.10 AM and 12.21 PM to 1.44 PM\nSun Rise: 6.47 AM\nSun Set: 5.55 PM\nChandhirashtamam: Dhanus\nSoolam: East\nPrayatchittham: Curd / Thayir\nSradhdhathithi: Tritiyai\nLocation: Hyderabad\, India
SUMMARY:Margazhi - 14 (05.01.2026) Monday
UID:india-2026-01-05@panchangam
END:VEVENT
BEGIN:VEVENT
DTSTART;VALUE=DATE:20260215
DESCRIPTION:Maasi - 02 (15.02.2026) Sunday\n\nYear: Vishvavasu Varudam (Vishvavasu Nama Samvathsaram)\nAyanam: Utharayanam\nRuthu: Shishira Ruthu\nMonth: Maasi Masam (Kumbham Masam)\nPaksham: Krushna Paksham\nThithi: upto 5.05 PM Trayodashi\, thereafter Chadhurdasi\nDay: {Ravi Vasaram} Sunday\nNakshatthiram: upto 8.29 PM Uthiradam\, and then Thiruvonam\nYogam: Vyatipata\nKaranam: Vanijai\nAmirthathiyogam: Siddha Yogam\nSubayogam: Subayogam\nRaghu Kalam: 4.50 PM to 6.17 PM\nYemakandam: 12.30 PM to 1.57 PM\nKuligai: 1.57 PM to 3.23 PM\nGood time: 6.42 AM to 8.09 AM and 12.30 PM to 1.57 PM\nSun Rise: 6.42 AM\nSun Set: 6.17 PM\nChandhirashtamam: Mithunam\nSoolam: West\nPrayatchittham: Jaggery / Vellam\nSradhdhathithi: Trayodashi\nLocation: Hyderabad\, India
SUMMARY:Maasi - 02 (15.02.2026) Sunday
UID:india-2026-02-15@panchangam
END:VEVENT
BEGIN:VEVENT
DTSTART;VALUE=DATE:20260325
DESCRIPTION:Panguni - 10 (25.03.2026) Wednesday\n\nYear: Vishvavasu Varudam (Vishvavasu Nama Samvathsaram)\nAyanam: Utharayanam\nRuthu: Shishira Ruthu\nMonth: Panguni Masam (Meenam Masam)\nPaksham: Shukla Paksham\nThithi: upto 1.50 PM Saptami\, thereafter Ashtami\nDay: {Budha Vasaram} Wednesday\nNakshatthiram: upto 6.10 PM Mrigashirsham\, and then Thiruvathirai\nYogam: Aayushman\nKaranam: Vanijai\nAmirthathiyogam: Siddha Yogam\nSubayogam: Subayogam\nRaghu Kalam: 12.22 PM to 1.53 PM\nYemakandam: 7.47 AM to 9.19 AM\nKuligai: 9.19 AM to 10.50 AM\nGood time: 6.16 AM to 7.47 AM and 1.53 PM to 3.25 PM\nSun Rise: 6.16 AM\nSun Set: 6.27 PM\nChandhirashtamam: Thulam\nSoolam: North\nPrayatchittham: Milk / Paal\nSradhdhathithi: Ashtami\nLocation: Hyderabad\, India
SUMMARY:Panguni - 10 (25.03.2026) Wednesday
UID:india-2026-03-25@panchangam
END:VEVENT
BEGIN:VEVENT
DTSTART;VALUE=DATE:20260604
DESCRIPTION:Vaikasi - 20 (04.06.2026) Thursday\n\nYear: Parabhava Varudam (Parabhava Nama Samvathsaram)\nAyanam: Utharayanam\nRuthu: Vasantha Ruthu\nMonth: Vaikasi Masam (Rishabam Masam)\nPaksham: Krushna Paksham\nThithi: upto 11.30 PM Chathurthi\, thereafter Panchami\nDay: {Guru Vasaram} Thursday\nNakshatthiram: upto 4.25 AM Uthiradam\, and then Thiruvonam\nYogam: Shukla\nKaranam: Bavai\nAmirthathiyogam: Siddha Yogam\nSubayogam: Subayogam\nRaghu Kalam: 1.52 PM to 3.31 PM\nYemakandam: 5.40 AM to 7.19 AM\nKuligai: 7.19 AM to 8.57 AM\nGood time: 5.40 AM to 7.19 AM and 12.14 PM to 1.52 PM\nSun Rise: 5.40 AM\nSun Set: 6.47 PM\nChandhirashtamam: Rishabam\nSoolam: South\nPrayatchittham: Oil / Thailam\nSradhdhathithi: Chathurthi\nLocation: Hyderabad\, India
SUMMARY:Vaikasi - 20 (04.06.2026) Thursday
UID:india-2026-06-04@panchangam
END:VEVENT
BEGIN:VEVENT
DTSTART;VALUE=DATE:20260714
DESCRIPTION:Aani - 29 (14.07.2026) Tuesday\n\nYear: Parabhava Varudam (Parabhava Nama Samvathsaram)\nAyanam: Dhatchinayanam\nRuthu: Grishma Ruthu\nMonth: Aani Masam (Mithunam Masam)\nPaksham: Krushna Paksham\nThithi: upto 3.13 PM Amavasai\, thereafter Prathamai\nDay: {Bhauma Vasaram} Tuesday\nNakshatthiram: upto 12.45 AM Punarpoosam\, and then Poosam\nYogam: Vyaghata\nKaranam: Nagava\nAmirthathiyogam: Siddha Yogam\nSubayogam: Subayogam\nRaghu Kalam: 3.38 PM to 5.16 PM\nYemakandam: 9.05 AM to 10.43 AM\nKuligai: 10.43 AM to 12.21 PM\nGood time: 7.27 AM to 9.05 AM and 3.38 PM to 5.16 PM\nSun Rise: 5.49 AM\nSun Set: 6.54 PM\nChandhirashtamam: Virutchigam\nSoolam: North\nPrayatchittham: Milk / Paal\nSradhdhathithi: Amavasai\nLocation: Hyderabad\, India
SUMMARY:Aani - 29 (14.07.2026) Tuesday
UID:india-2026-07-14@panchangam
END:VEVENT
BEGIN:VEVENT
DTSTART;VALUE=DATE:20260824
DESCRIPTION:Aavani - 07 (24.08.2026) Monday\n\nYear: Parabhava Varudam (Parabhava Nama Samvathsaram)\nAyanam: Dhatchinayanam\nRuthu: Varsha Ruthu\nMonth: Aavani Masam (Simham Masam)\nPaksham: Shukla Paksham\nThithi: Dwadashi\nDay: {Soma Vasaram} Monday\nNakshatthiram: upto 9.12 PM Pooradam\, and then Uthiradam\nYogam: Priti\nKaranam: Bavai\nAmirthathiyogam: Marana Yogam\nSubayogam: \nRaghu Kalam: 7.35 AM to 9.09 AM\nYemakandam: 10.43 AM to 12.18 PM\nKuligai: 12.18 PM to 1.52 PM\nGood time: 6.00 AM to 7.35 AM and 12.18 PM to 1.52 PM\nSun Rise: 6.00 AM\nSun Set: 6.35 PM\nChandhirashtamam: Rishabam\nSoolam: East\nPrayatchittham: Curd / Thayir\nSradhdhathithi: Dwadashi\nLocation: Hyderabad\, India
SUMMARY:Aavani - 07 (24.08.2026) Monday
UID:india-2026-08-24@panchangam
END:VEVENT
BEGIN:VEVENT
DTSTART;VALUE=DATE:20261018
DESCRIPTION:Aippasi - 01 (18.10.2026) Sunday\n\nYear: Parabhava Varudam (Parabhava Nama Samvathsaram)\nAyanam: Dhatchinayanam\nRuthu: Sarath Ruthu\nMonth: Aippasi Masam (Thulam Masam)\nPaksham: Shukla Paksham\nThithi: upto 8.28 AM Saptami\, thereafter Ashtami\nDay: {Ravi Vasaram} Sunday\nNakshatthiram: upto 1.34 PM Pooradam\, and then Uthiradam\nYogam: Sukarman\nKaranam: Vanijai\nAmirthathiyogam: Siddha Yogam\nSubayogam: Subayogam\nRaghu Kalam: 4.24 PM to 5.52 PM\nYemakandam: 12.01 PM to 1.28 PM\nKuligai: 1.28 PM to 2.56 PM\nGood time: 6.09 AM to 7.37 AM and 12.01 PM to 1.28 PM\nSun Rise: 6.09 AM\nSun Set: 5.52 PM\nChandhirashtamam: Rishabam\nSoolam: West\nPrayatchittham: Jaggery / Vellam\nSradhdhathithi: Ashtami\nLocation: Hyderabad\, India
SUMMARY:Aippasi - 01 (18.10.2026) Sunday
UID:india-2026-10-18@panchangam
END:VEVENT
BEGIN:VEVENT
DESCRIPTION:Exact Astronomical Duration (Hyderabad\, India)
DTEND:20260506T022145Z
DTSTART:20260504T235448Z
SUMMARY:Sankatahara Chathurthi
UID:india-202605042354-19@tithi
END:VEVENT
BEGIN:VEVENT
DTSTART;VALUE=DATE:20261128
DESCRIPTION:Karthigai - 12 (28.11.2026) Saturday\n\nYear: Parabhava Varudam (Parabhava Nama Samvathsaram)\nAyanam: Dhatchinayanam\nRuthu: Sarath Ruthu\nMonth: Karthigai Masam (Virutchigam Masam)\nPaksham: Krushna Paksham\nThithi: upto 6.40 AM Chathurthi\, upto 3.57 AM Panchami\, thereafter Shashti\nDay: {Sani Vasaram} Saturday\nNakshatthiram: upto 1.27 PM Punarpoosam\, and then Poosam\nYogam: Shukla\nKaranam: Balavai\nAmirthathiyogam: Siddha Yogam\nSubayogam: Subayogam\nRaghu Kalam: 9.15 AM to 10.39 AM\nYemakandam: 1.27 PM to 2.51 PM\nKuligai: 2.51 PM to 4.15 PM\nGood time: 9.15 AM to 10.39 AM and 1.27 PM to 2.51 PM\nSun Rise: 6.28 AM\nSun Set: 5.39 PM\nChandhirashtamam: Virutchigam\nSoolam: East\nPrayatchittham: Curd / Thayir\nSradhdhathithi: Panchami\nLocation: Hyderabad\, India
SUMMARY:Karthigai - 12 (28.11.2026) Saturday
UID:india-2026-11-28@panchangam
END:VEVENT
BEGIN:VEVENT
DTSTART;VALUE=DATE:20260123
DESCRIPTION:Thai - 09 (23.01.2026) Friday\n\nYear: Vishvavasu Varudam (Vishvavasu Nama Samvathsaram)\nAyanam: Utharayanam\nRuthu: Hemantha Ruthu\nMonth: Thai Masam (Makaram Masam)\nPaksham: Shukla Paksham\nThithi: upto 1.46 AM Panchami\, thereafter Shashti\nDay: {Sukra Vasaram} Friday\nNakshatthiram: upto 3.12 PM Poorattathi\, and then Uthirattathi\nYogam: Parigha\nKaranam: Bavai\nAmirthathiyogam: Siddha Yogam\nSubayogam: Subayogam\nRaghu Kalam: 11.03 AM to 12.27 PM\nYemakandam: 3.17 PM to 4.41 PM\nKuligai: 6.49 AM to 8.14 AM\nGood time: 6.49 AM to 8.14 AM and 12.27 PM to 1.52 PM\nSun Rise: 6.49 AM\nSun Set: 6.06 PM\nChandhirashtamam: Katakam\nSoolam: West\nPrayatchittham: Jaggery / Vellam\nSradhdhathithi: Panchami\nLocation: Hyderabad\, India
SUMMARY:Thai - 09 (23.01.2026) Friday
UID:india-2026-01-23@panchangam
END:VEVENT
BEGIN:VEVENT
DESCRIPTION:Exact Astronomical Duration (Hyderabad\, India)
DTEND:20260625T143951Z
DTSTART:20260624T124248Z
SUMMARY:Shukla Ekadasi
UID:india-202606241242-11@tithi
END:VEVENT
BEGIN:VEVENT
DTSTART;VALUE=DATE:20260402
DESCRIPTION:Panguni - 18 (02.04.2026) Thursday\n\nYear: Vishvavasu Varudam (Vishvavasu Nama Samvathsaram)\nAyanam: Utharayanam\nRuthu: Shishira Ruthu\nMonth: Panguni Masam (Meenam Masam)\nPaksham: Shukla Paksham\nThithi: upto 7.41 AM Pournami\, thereafter Prathamai\nDay: {Guru Vasaram} Thursday\nNakshatthiram: upto 6.21 PM Hastham\, and then Chitthirai\nYogam: Dhruva\nKaranam: Bavai\nAmirthathiyogam: Siddha Yogam\nSubayogam: Subayogam\nRaghu Kalam: 1.52 PM to 3.24 PM\nYemakandam: 6.10 AM to 7.42 AM\nKuligai: 7.42 AM to 9.14 AM\nGood time: 6.10 AM to 7.42 AM and 12.19 PM to 1.52 PM\nSun Rise: 6.10 AM\nSun Set: 6.29 PM\nChandhirashtamam: Kumbham\nSoolam: South\nPrayatchittham: Oil / Thailam\nSradhdhathithi: Prathamai\nLocation: Hyderabad\, India
SUMMARY:Panguni - 18 (02.04.2026) Thursday
UID:india-2026-04-02@panchangam
END:VEVENT
BEGIN:VEVENT
DTSTART;VALUE=DATE:20260512
DESCRIPTION:Chithirai - 28 (12.05.2026) Tuesday\n\nYear: Parabhava Varudam (Parabhava Nama Samvathsaram)\nAyanam: Utharayanam\nRuthu: Vasantha Ruthu\nMonth: Chithirai Masam (Mesham Masam)\nPaksham: Krushna Paksham\nThithi: upto 2.52 PM Dashami\, thereafter Ekadashi\nDay: {Bhauma Vasaram} Tuesday\nNakshatthiram: upto 1.56 AM Poorattathi\, and then Uthirattathi\nYogam: Vaidhriti\nKaranam: Vishti\nAmirthathiyogam: Siddha Yogam\nSubayogam: Subayogam\nRaghu Kalam: 3.26 PM to 5.02 PM\nYemakandam: 8.58 AM to 10.35 AM\nKuligai: 10.35 AM to 12.12 PM\nGood time: 7.22 AM to 8.58 AM and 3.26 PM to 5.02 PM\nSun Rise: 5.45 AM\nSun Set: 6.39 PM\nChandhirashtamam: Katakam\nSoolam: North\nPrayatchittham: Milk / Paal\nSradhdhathithi: Dashami\nLocation: Hyderabad\, India
SUMMARY:Chithirai - 28 (12.05.2026) Tuesday
UID:india-2026-05-12@panchangam
END:VEVENT
BEGIN:VEVENT
DTSTART;VALUE=DATE:20260622
DESCRIPTION:Aani - 07 (22.06.2026) Monday\n\nYear: Parabhava Varudam (Parabhava Nama Samvathsaram)\nAyanam: Dhatchinayanam\nRuthu: Grishma Ruthu\nMonth: Aani Masam (Mithunam Masam)\nPaksham: Shukla Paksham\nThithi: upto 3.40 PM Ashtami\, thereafter Navami\nDay: {Soma Vasaram} Monday\nNakshatthiram: upto 11.04 AM Uthiram\, and then Hastham\nYogam: Vyatipata\nKaranam: Bavai\nAmirthathiyogam: Siddha Yogam\nSubayogam: Subayogam\nRaghu Kalam: 7.21 AM to 9.00 AM\nYemakandam: 10.39 AM to 12.18 PM\nKuligai: 12.18 PM to 1.56 PM\nGood time: 5.42 AM to 7.21 AM and 12.18 PM to 1.56 PM\nSun Rise: 5.42 AM\nSun Set: 6.53 PM\nChandhirashtamam: Kumbham\nSoolam: East\nPrayatchittham: Curd / Thayir\nSradhdhathithi: Ashtami\nLocation: Hyderabad\, India
SUMMARY:Aani - 07 (22.06.2026) Monday
UID:india-2026-06-22@panchangam
END:VEVENT
BEGIN:VEVENT
DTSTART;VALUE=DATE:20260901
DESCRIPTION:Aavani - 15 (01.09.2026) Tuesday\n\nYear: Parabhava Varudam (Parabhava Nama Samvathsaram)\nAyanam: Dhatchinayanam\nRuthu: Varsha Ruthu\nMonth: Aavani Masam (Simham Masam)\nPaksham: Krushna Paksham\nThithi: upto 7.42 AM Chathurthi\, thereafter Panchami\nDay: {Bhauma Vasaram} Tuesday\nNakshatthiram: upto 3.21 AM Ashwini\, and then Bharani\nYogam: Vriddhi\nKaranam: Balavai\nAmirthathiyogam: Amirtha Yogam\nSubayogam: Subayogam\nRaghu Kalam: 3.22 PM to 4.56 PM\nYemakandam: 9.09 AM to 10.42 AM\nKuligai: 10.42 AM to 12.16 PM\nGood time: 7.35 AM to 9.09 AM and 3.22 PM to 4.56 PM\nSun Rise: 6.02 AM\nSun Set: 6.29 PM\nChandhirashtamam: Kanni\nSoolam: North\nPrayatchittham: Milk / Paal\nSradhdhathithi: Panchami\nLocation: Hyderabad\, India
SUMMARY:Aavani - 15 (01.09.2026) Tuesday
UID:india-2026-09-01@panchangam
END:VEVENT
BEGIN:VEVENT
DTSTART;VALUE=DATE:20251228
DESCRIPTION:Margazhi - 06 (28.12.2025) Sunday\n\nYear: Vishvavasu Varudam (Vishvavasu Nama Samvathsaram)\nAyanam: Utharayanam\nRuthu: Hemantha Ruthu\nMonth: Margazhi Masam (Dhanus Masam)\nPaksham: Shukla Paksham\nThithi: upto 12 Noon Ashtami\, thereafter Navami\nDay: {Ravi Vasaram} Sunday\nNakshatthiram: upto 9.21 AM Uthirattathi\, and then Revathi\nYogam: Variyana\nKaranam: Bavai\nAmirthathiyogam: Siddha Yogam\nSubayogam: Subayogam\nRaghu Kalam: 4.27 PM to 5.50 PM\nYemakandam: 12.17 PM to 1.40 PM\nKuligai: 1.40 PM to 3.04 PM\nGood time: 6.44 AM to 8.07 AM and 12.17 PM to 1.40 PM\nSun Rise: 6.44 AM\nSun Set: 5.50 PM\nChandhirashtamam: Simham\nSoolam: West\nPrayatchittham: Jaggery / Vellam\nSradhdhathithi: Navami\nLocation: Hyderabad\, India
SUMMARY:Margazhi - 06 (28.12.2025) Sunday
UID:india-2025-12-28@panchangam
END:VEVENT
BEGIN:VEVENT
DTSTART;VALUE=DATE:20261205
DESCRIPTION:Karthigai - 19 (05.12.2026) Saturday\n\nYear: Parabhava Varudam (Parabhava Nama Samvathsaram)\nAyanam: Dhatchinayanam\nRuthu: Sarath Ruthu\nMonth: Karthigai Masam (Virutchigam Masam)\nPaksham: Krushna Paksham\nThithi: upto 12.52 AM Dwadashi\, thereafter Trayodashi\nDay: {Sani Vasaram} Saturday\nNakshatthiram: upto 12.32 PM Chitthirai\, and then Swathi\nYogam: Saubhagya\nKaranam: Kaulavai\nAmirthathiyogam: Siddha Yogam\nSubayogam: Subayogam\nRaghu Kalam: 9.19 AM to 10.42 AM\nYemakandam: 1.30 PM to 2.53 PM\nKuligai: 2.53 PM to 4.17 PM\nGood time: 9.19 AM to 10.42 AM and 1.30 PM to 2.53 PM\nSun Rise: 6.32 AM\nSun Set: 5.40 PM\nChandhirashtamam: Meenam\nSoolam: East\nPrayatchittham: Curd / Thayir\nSradhdhathithi: Dwadashi\nLocation: Hyderabad\, India
SUMMARY:Karthigai - 19 (05.12.2026) Saturday
UID:india-2026-12-05@panchangam
END:VEVENT
BEGIN:VEVENT
DTSTART;VALUE=DATE:20260310
DESCRIPTION:Maasi - 25 (10.03.2026) Tuesday\n\nYear: Vishvavasu Varudam (Vishvavasu Nama Samvathsaram)\nAyanam: Utharayanam\nRuthu: Shishira Ruthu\nMonth: Maasi Masam (Kumbham Masam)\nPaksham: Krushna Paksham\nThithi: upto 1.54 AM Saptami\, thereafter Ashtami\nDay: {Bhauma Vasaram} Tuesday\nNakshatthiram: upto 7.49 PM Anusham\, and then Kettai\nYogam: Harshana\nKaranam: Vishti\nAmirthathiyogam: Siddha Yogam\nSubayogam: Subayogam\nRaghu Kalam: 3.25 PM to 4.55 PM\nYemakandam: 9.27 AM to 10.56 AM\nKuligai: 10.56 AM to 12.26 PM\nGood time: 7.57 AM to 9.27 AM and 3.25 PM to 4.55 PM\nSun Rise: 6.28 AM\nSun Set: 6.24 PM\nChandhirashtamam: Mesham\nSoolam: North\nPrayatchittham: Milk / Paal\nSradhdhathithi: Saptami\nLocation: Hyderabad\, India
SUMMARY:Maasi - 25 (10.03.2026) Tuesday
UID:india-2026-03-10@panchangam
END:VEVENT
BEGIN:VEVENT
DTSTART;VALUE=DATE:20260420
DESCRIPTION:Chithirai - 06 (20.04.2026) Monday\n\nYear: Parabhava Varudam (Parabhava Nama Samvathsaram)\nAyanam: Utharayanam\nRuthu: Vasantha Ruthu\nMonth: Chithirai Masam (Mesham Masam)\nPaksham: Shukla Paksham\nThithi: upto 7.27 AM Tritiyai\, upto 4.15 AM Chathurthi\, thereafter Panchami\nDay: {Soma Vasaram} Monday\nNakshatthiram: upto 2.44 AM Rohini\, and then Mrigashirsham\nYogam: Saubhagya\nKaranam: Garajai\nAmirthathiyogam: Siddha Yogam\nSubayogam: Subayogam\nRaghu Kalam: 7.31 AM to 9.06 AM\nYemakandam: 10.40 AM to 12.15 PM\nKuligai: 12.15 PM to 1.49 PM\nGood time: 5.56 AM to 7.31 AM and 12.15 PM to 1.49 PM\nSun Rise: 5.56 AM\nSun Set: 6.33 PM\nChandhirashtamam: Thulam\nSoolam: East\nPrayatchittham: Curd / Thayir\nSradhdhathithi: Chathurthi\nLocation: Hyderabad\, India
SUMMARY:Chithirai - 06 (20.04.2026) Monday
UID:india-2026-04-20@panchangam
END:VEVENT
BEGIN:VEVENT
DTSTART;VALUE=DATE:20260530
DESCRIPTION:Vaikasi - 15 (30.05.2026) Saturday\n\nYear: Parabhava Varudam (Parabhava Nama Samvathsaram)\nAyanam: Utharayanam\nRuthu: Vasantha Ruthu\nMonth: Vaikasi Masam (Rishabam Masam)\nPaksham: Shukla Paksham\nThithi: upto 11.58 AM Chadhurdasi\, thereafter Pournami\nDay: {Sani Vasaram} Saturday\nNakshatthiram: upto 2.05 PM Visakam\, and then Anusham\nYogam: Parigha\nKaranam: Vanijai\nAmirthathiyogam: Siddha Yogam\nSubayogam: Subayogam\nRaghu Kalam: 8.57 AM to 10.35 AM\nYemakandam: 1.51 PM to 3.29 PM\nKuligai: 3.29 PM to 5.08 PM\nGood time: 8.57 AM to 10.35 AM and 1.51 PM to 3.29 PM\nSun Rise: 5.41 AM\nSun Set: 6.46 PM\nChandhirashtamam: Meenam\nSoolam: East\nPrayatchittham: Curd / Thayir\nSradhdhathithi: Pournami\nLocation: Hyderabad\, India
SUMMARY:Vaikasi - 15 (30.05.2026) Saturday
UID:india-2026-05-30@panchangam
END:VEVENT
BEGIN:VEVENT
DTSTART;VALUE=DATE:20260409
DESCRIPTION:Panguni - 25 (09.04.2026) Thursday\n\nYear: Vishvavasu Varudam (Vishvavasu Nama Samvathsaram)\nAyanam: Utharayanam\nRuthu: Shishira Ruthu\nMonth: Panguni Masam (Meenam Masam)\nPaksham: Krushna Paksham\nThithi: upto 9.20 PM Saptami\, thereafter Ashtami\nDay: {Guru Vasaram} Thursday\nNakshatthiram: upto 9.32 AM Moolam\, and then Pooradam\nYogam: Parigha\nKaranam: Vishti\nAmirthathiyogam: Siddha Yogam\nSubayogam: Subayogam\nRaghu Kalam: 1.51 PM to 3.24 PM\nYemakandam: 6.04 AM to 7.38 AM\nKuligai: 7.38 AM to 9.11 AM\nGood time: 6.04 AM to 7.38 AM and 12.17 PM to 1.51 PM\nSun Rise: 6.04 AM\nSun Set: 6.30 PM\nChandhirashtamam: Rishabam\nSoolam: South\nPrayatchittham: Oil / Thailam\nSradhdhathithi: Saptami\nLocation: Hyderabad\, India
SUMMARY:Panguni - 25 (09.04.2026) Thursday
UID:india-2026-04-09@panchangam
END:VEVENT
BEGIN:VEVENT
DTSTART;VALUE=DATE:20260519
DESCRIPTION:Vaikasi - 04 (19.05.2026) Tuesday\n\nYear: Parabhava Varudam (Parabhava Nama Samvathsaram)\nAyanam: Utharayanam\nRuthu: Vasantha Ruthu\nMonth: Vaikasi Masam (Rishabam Masam)\nPaksham: Shukla Paksham\nThithi: upto 2.18 PM Tritiyai\, thereafter Chathurthi\nDay: {Bhauma Vasaram} Tuesday\nNakshatthiram: upto 9.17 AM Mrigashirsham\, and then Thiruvathirai\nYogam: Dhriti\nKaranam: Garajai\nAmirthathiyogam: Siddha Yogam\nSubayogam: Subayogam\nRaghu Kalam: 3.27 PM to 5.04 PM\nYemakandam: 8.57 AM to 10.35 AM\nKuligai: 10.35 AM to 12.12 PM\nGood time: 7.20 AM to 8.57 AM and 3.27 PM to 5.04 PM\nSun Rise: 5.42 AM\nSun Set: 6.42 PM\nChandhirashtamam: Virutchigam\nSoolam: North\nPrayatchittham: Milk / Paal\nSradhdhathithi: Chathurthi\nLocation: Hyderabad\, India
SUMMARY:Vaikasi - 04 (19.05.2026) Tuesday
UID:india-2026-05-19@panchangam
END:VEVENT
BEGIN:VEVENT
DTSTART;VALUE=DATE:20260629
DESCRIPTION:Aani - 14 (29.06.2026) Monday\n\nYear: Parabhava Varudam (Parabhava Nama Samvathsaram)\nAyanam: Dhatchinayanam\nRuthu: Grishma Ruthu\nMonth: Aani Masam (Mithunam Masam)\nPaksham: Shukla Paksham\nThithi: upto 5.26 AM Pournami\, thereafter Prathamai\nDay: {Soma Vasaram} Monday\nNakshatthiram: upto 4.48 AM Moolam\, and then Pooradam\nYogam: Shukla\nKaranam: Vishti\nAmirthathiyogam: Siddha Yogam\nSubayogam: Subayogam\nRaghu Kalam: 7.23 AM to 9.02 AM\nYemakandam: 10.40 AM to 12.19 PM\nKuligai: 12.19 PM to 1.58 PM\nGood time: 5.44 AM to 7.23 AM and 12.19 PM to 1.58 PM\nSun Rise: 5.44 AM\nSun Set: 6.54 PM\nChandhirashtamam: Rishabam\nSoolam: East\nPrayatchittham: Curd / Thayir\nSradhdhathithi: Pournami\nLocation: Hyderabad\, India
SUMMARY:Aani - 14 (29.06.2026) Monday
UID:india-2026-06-29@panchangam
END:VEVENT
BEGIN:VEVENT
DTSTART;VALUE=DATE:20260908
DESCRIPTION:Aavani - 22 (08.09.2026) Tuesday\n\nYear: Parabhava Varudam (Parabhava Nama Samvathsaram)\nAyanam: Dhatchinayanam\nRuthu: Varsha Ruthu\nMonth: Aavani Masam (Simham Masam)\nPaksham: Krushna Paksham\nThithi: upto 2.43 PM Dwadashi\, thereafter Trayodashi\nDay: {Bhauma Vasaram} Tuesday\nNakshatthiram: upto 5.17 PM Poosam\, and then Aayilyam\nYogam: Parigha\nKaranam: Thaitilai\nAmirthathiyogam: Siddha Yogam\nSubayogam: Subayogam\nRaghu Kalam: 3.18 PM to 4.51 PM\nYemakandam: 9.08 AM to 10.41 AM\nKuligai: 10.41 AM to 12.13 PM\nGood time: 7.35 AM to 9.08 AM and 3.18 PM to 4.51 PM\nSun Rise: 6.03 AM\nSun Set: 6.24 PM\nChandhirashtamam: Dhanus\nSoolam: North\nPrayatchittham: Milk / Paal\nSradhdhathithi: Dwadashi\nLocation: Hyderabad\, India
SUMMARY:Aavani - 22 (08.09.2026) Tuesday
UID:india-2026-09-08@panchangam
END:VEVENT
BEGIN:VEVENT
DTSTART;VALUE=DATE:20261003
DESCRIPTION:Purattasi - 16 (03.10.2026) Saturday\n\nYear: Parabhava Varudam (Parabhava Nama Samvathsaram)\nAyanam: Dhatchinayanam\nRuthu: Varsha Ruthu\nMonth: Purattasi Masam (Kanni Masam)\nPaksham: Krushna Paksham\nThithi: upto 8.00 AM Saptami\, upto 5.52 AM Ashtami\, thereafter Navami\nDay: {Sani Vasaram} Saturday\nNakshatthiram: upto 2.07 AM Thiruvathirai\, and then Punarpoosam\nYogam: Variyana\nKaranam: Bavai\nAmirthathiyogam: Siddha Yogam\nSubayogam: Subayogam\nRaghu Kalam: 9.05 AM to 10.35 AM\nYemakandam: 1.34 PM to 3.04 PM\nKuligai: 3.04 PM to 4.33 PM\nGood time: 9.05 AM to 10.35 AM and 1.34 PM to 3.04 PM\nSun Rise: 6.06 AM\nSun Set: 6.03 PM\nChandhirashtamam: Virutchigam\nSoolam: East\nPrayatchittham: Curd / Thayir\nSradhdhathithi: Ashtami\nLocation: Hyderabad\, India
SUMMARY:Purattasi - 16 (03.10.2026) Saturday
UID:india-2026-10-03@panchangam
END:VEVENT
BEGIN:VEVENT
DTSTART;VALUE=DATE:20261113
DESCRIPTION:Aippasi - 27 (13.11.2026) Friday\n\nYear: Parabhava Varudam (Parabhava Nama Samvathsaram)\nAyanam: Dhatchinayanam\nRuthu: Sarath Ruthu\nMonth: Aippasi Masam (Thulam Masam)\nPaksham: Shukla Paksham\nThithi: upto 8.43 PM Chathurthi\, thereafter Panchami\nDay: {Sukra Vasaram} Friday\nNakshatthiram: upto 6.03 PM Moolam\, and then Pooradam\nYogam: Dhriti\nKaranam: Vanijai\nAmirthathiyogam: Siddha Yogam\nSubayogam: Subayogam\nRaghu Kalam: 10.35 AM to 12 Noon\nYemakandam: 2.50 PM to 4.15 PM\nKuligai: 6.19 AM to 7.44 AM\nGood time: 6.19 AM to 7.44 AM and 12 Noon to 1.25 PM\nSun Rise: 6.19 AM\nSun Set: 5.40 PM\nChandhirashtamam: Rishabam\nSoolam: West\nPrayatchittham: Jaggery / Vellam\nSradhdhathithi: Chathurthi\nLocation: Hyderabad\, India
SUMMARY:Aippasi - 27 (13.11.2026) Friday
UID:india-2026-11-13@panchangam
END:VEVENT
BEGIN:VEVENT
DTSTART;VALUE=DATE:20261223
DESCRIPTION:Margazhi - 07 (23.12.2026) Wednesday\n\nYear: Parabhava Varudam (Parabhava Nama Samvathsaram)\nAyanam: Utharayanam\nRuthu: Hemantha Ruthu\nMonth: Margazhi Masam (Dhanus Masam)\nPaksham: Shukla Paksham\nThithi: upto 10.47 AM Chadhurdasi\, thereafter Pournami\nDay: {Budha Vasaram} Wednesday\nNakshatthiram: upto 8.32 AM Rohini\, upto 5.28 AM Mrigashirsham\, and then Thiruvathirai\nYogam: Shubha\nKaranam: Vanijai\nAmirthathiyogam: Siddha Yogam\nSubayogam: Subayogam\nRaghu Kalam: 12.15 PM to 1.38 PM\nYemakandam: 8.05 AM to 9.28 AM\nKuligai: 9.28 AM to 10.51 AM\nGood time: 6.42 AM to 8.05 AM and 1.38 PM to 3.01 PM\nSun Rise: 6.42 AM\nSun Set: 5.47 PM\nChandhirashtamam: Thulam\nSoolam: North\nPrayatchittham: Milk / Paal\nSradhdhathithi: Pournami\nLocation: Hyderabad\, India
SUMMARY:Margazhi - 07 (23.12.2026) Wednesday
UID:india-2026-12-23@panchangam
END:VEVENT
BEGIN:VEVENT
DTSTART;VALUE=DATE:20260207
DESCRIPTION:Thai - 24 (07.02.2026) Saturday\n\nYear: Vishvavasu Varudam (Vishvavasu Nama Samvathsaram)\nAyanam: Utharayanam\nRuthu: Hemantha Ruthu\nMonth: Thai Masam (Makaram Masam)\nPaksham: Krushna Paksham\nThithi: upto 2.54 AM Shashti\, thereafter Saptami\nDay: {Sani Vasaram} Saturday\nNakshatthiram: upto 3.11 AM Chitthirai\, and then Swathi\nYogam: Shoola\nKaranam: Garajai\nAmirthathiyogam: Siddha Yogam\nSubayogam: Subayogam\nRaghu Kalam: 9.38 AM to 11.04 AM\nYemakandam: 1.56 PM to 3.22 PM\nKuligai: 3.22 PM to 4.48 PM\nGood time: 9.38 AM to 11.04 AM and 1.56 PM to 3.22 PM\nSun Rise: 6.46 AM\nSun Set: 6.14 PM\nChandhirashtamam: Kumbham\nSoolam: East\nPrayatchittham: Curd / Thayir\nSradhdhathithi: Shashti\nLocation: Hyderabad\, India
SUMMARY:Thai - 24 (07.02.2026) Saturday
UID:india-2026-02-07@panchangam
END:VEVENT
BEGIN:VEVENT
DTSTART;VALUE=DATE:20260317
DESCRIPTION:Panguni - 02 (17.03.2026) Tuesday\n\nYear: Vishvavasu Varudam (Vishvavasu Nama Samvathsaram)\nAyanam: Utharayanam\nRuthu: Shishira Ruthu\nMonth: Panguni Masam (Meenam Masam)\nPaksham: Krushna Paksham\nThithi: upto 9.23 AM Trayodashi\, thereafter Chadhurdasi\nDay: {Bhauma Vasaram} Tuesday\nNakshatthiram: upto 7.02 AM Avittam\, and then Sathayam\nYogam: Siddha\nKaranam: Vanijai\nAmirthathiyogam: Siddha Yogam\nSubayogam: Subayogam\nRaghu Kalam: 3.25 PM to 4.55 PM\nYemakandam: 9.23 AM to 10.54 AM\nKuligai: 10.54 AM to 12.24 PM\nGood time: 7.53 AM to 9.23 AM and 3.25 PM to 4.55 PM\nSun Rise: 6.22 AM\nSun Set: 6.26 PM\nChandhirashtamam: Katakam\nSoolam: North\nPrayatchittham: Milk / Paal\nSradhdhathithi: Chadhurdasi\nLocation: Hyderabad\, India
SUMMARY:Panguni - 02 (17.03.2026) Tuesday
UID:india-2026-03-17@panchangam
END:VEVENT
BEGIN:VEVENT
DTSTART;VALUE=DATE:20260427
DESCRIPTION:Chithirai - 13 (27.04.2026) Monday\n\nYear: Parabhava Varudam (Parabhava Nama Samvathsaram)\nAyanam: Utharayanam\nRuthu: Vasantha Ruthu\nMonth: Chithirai Masam (Mesham Masam)\nPaksham: Shukla Paksham\nThithi: upto 6.16 PM Ekadashi\, thereafter Dwadashi\nDay: {Soma Vasaram} Monday\nNakshatthiram: upto 10.00 PM Pooram\, and then Uthiram\nYogam: Dhruva\nKaranam: Vanijai\nAmirthathiyogam: Siddha Yogam\nSubayogam: Subayogam\nRaghu Kalam: 7.27 AM to 9.03 AM\nYemakandam: 10.38 AM to 12.13 PM\nKuligai: 12.13 PM to 1.49 PM\nGood time: 5.52 AM to 7.27 AM and 12.13 PM to 1.49 PM\nSun Rise: 5.52 AM\nSun Set: 6.35 PM\nChandhirashtamam: Makaram\nSoolam: East\nPrayatchittham: Curd / Thayir\nSradhdhathithi: Ekadashi\nLocation: Hyderabad\, India
SUMMARY:Chithirai - 13 (27.04.2026) Monday
UID:india-2026-04-27@panchangam
END:VEVENT
BEGIN:VEVENT
DTSTART;VALUE=DATE:20260706
DESCRIPTION:Aani - 21 (06.07.2026) Monday\n\nYear: Parabhava Varudam (Parabhava Nama Samvathsaram)\nAyanam: Dhatchinayanam\nRuthu: Grishma Ruthu\nMonth: Aani Masam (Mithunam Masam)\nPaksham: Krushna Paksham\nThithi: upto 1.47 PM Shashti\, thereafter Saptami\nDay: {Soma Vasaram} Monday\nNakshatthiram: upto 4.48 PM Poorattathi\, and then Uthirattathi\nYogam: Saubhagya\nKaranam: Vanijai\nAmirthathiyogam: Siddha Yogam\nSubayogam: Subayogam\nRaghu Kalam: 7.25 AM to 9.03 AM\nYemakandam: 10.42 AM to 12.20 PM\nKuligai: 12.20 PM to 1.59 PM\nGood time: 5.46 AM to 7.25 AM and 12.20 PM to 1.59 PM\nSun Rise: 5.46 AM\nSun Set: 6.54 PM\nChandhirashtamam: Katakam\nSoolam: East\nPrayatchittham: Curd / Thayir\nSradhdhathithi: Saptami\nLocation: Hyderabad\, India
SUMMARY:Aani - 21 (06.07.2026) Monday
UID:india-2026-07-06@panchangam
END:VEVENT
BEGIN:VEVENT
DTSTART;VALUE=DATE:20260816
DESCRIPTION:Aadi - 30 (16.08.2026) Sunday\n\nYear: Parabhava Varudam (Parabhava Nama Samvathsaram)\nAyanam: Dhatchinayanam\nRuthu: Grishma Ruthu\nMonth: Aadi Masam (Katakam Masam)\nPaksham: Shukla Paksham\nThithi: upto 4.53 PM Chathurthi\, thereafter Panchami\nDay: {Ravi Vasaram} Sunday\nNakshatthiram: upto 4.32 AM Hastham\, and then Chitthirai\nYogam: Siddha\nKaranam: Vishti\nAmirthathiyogam: Amirtha Yogam\nSubayogam: Subayogam\nRaghu Kalam: 5.06 PM to 6.41 PM\nYemakandam: 12.20 PM to 1.55 PM\nKuligai: 1.55 PM to 3.30 PM\nGood time: 5.59 AM to 7.34 AM and 12.20 PM to 1.55 PM\nSun Rise: 5.59 AM\nSun Set: 6.41 PM\nChandhirashtamam: Kumbham\nSoolam: West\nPrayatchittham: Jaggery / Vellam\nSradhdhathithi: Chathurthi\nLocation: Hyderabad\, India
SUMMARY:Aadi - 30 (16.08.2026) Sunday
UID:india-2026-08-16@panchangam
END:VEVENT
BEGIN:VEVENT
DTSTART;VALUE=DATE:20260926
DESCRIPTION:Purattasi - 09 (26.09.2026) Saturday\n\nYear: Parabhava Varudam (Parabhava Nama Samvathsaram)\nAyanam: Dhatchinayanam\nRuthu: Varsha Ruthu\nMonth: Purattasi Masam (Kanni Masam)\nPaksham: Shukla Paksham\nThithi: upto 10.19 PM Pournami\, thereafter Prathamai\nDay: {Sani Vasaram} Saturday\nNakshatthiram: upto 12.12 PM Poorattathi\, and then Uthirattathi\nYogam: Ganda\nKaranam: Vishti\nAmirthathiyogam: Siddha Yogam\nSubayogam: Subayogam\nRaghu Kalam: 9.06 AM to 10.36 AM\nYemakandam: 1.37 PM to 3.08 PM\nKuligai: 3.08 PM to 4.38 PM\nGood time: 9.06 AM to 10.36 AM and 1.37 PM to 3.08 PM\nSun Rise: 6.05 AM\nSun Set: 6.09 PM\nChandhirashtamam: Katakam\nSoolam: East\nPrayatchittham: Curd / Thayir\nSradhdhathithi: Pournami\nLocation: Hyderabad\, India
SUMMARY:Purattasi - 09 (26.09.2026) Saturday
UID:india-2026-09-26@panchangam
END:VEVENT
BEGIN:VEVENT
DTSTART;VALUE=DATE:20261021
DESCRIPTION:Aippasi - 04 (21.10.2026) Wednesday\n\nYear: Parabhava Varudam (Parabhava Nama Samvathsaram)\nAyanam: Dhatchinayanam\nRuthu: Sarath Ruthu\nMonth: Aippasi Masam (Thulam Masam)\nPaksham: Shukla Paksham\nThithi: upto 2.12 PM Dashami\, thereafter Ekadashi\nDay: {Budha Vasaram} Wednesday\nNakshatthiram: upto 8.30 PM Avittam\, and then Sathayam\nYogam: Ganda\nKaranam: Garajai\nAmirthathiyogam: Marana Yogam\nSubayogam: \nRaghu Kalam: 12 Noon to 1.28 PM\nYemakandam: 7.38 AM to 9.05 AM\nKuligai: 9.05 AM to 10.33 AM\nGood time: 6.10 AM to 7.38 AM and 1.28 PM to 2.55 PM\nSun Rise: 6.10 AM\nSun Set: 5.50 PM\nChandhirashtamam: Mithunam\nSoolam: North\nPrayatchittham: Milk / Paal\nSradhdhathithi: Ekadashi\nLocation: Hyderabad\, India
SUMMARY:Aippasi - 04 (21.10.2026) Wednesday
UID:india-2026-10-21@panchangam
END:VEVENT
BEGIN:VEVENT
DESCRIPTION:Exact Astronomical Duration (Hyderabad\, India)
DTEND:20261017T002450Z
DTSTART:20261015T215539Z
SUMMARY:Shukla Shashti
UID:india-202610152155-6@tithi
END:VEVENT
BEGIN:VEVENT
DTSTART;VALUE=DATE:20260115
DESCRIPTION:Thai - 01 (15.01.2026) Thursday\n\nYear: Vishvavasu Varudam (Vishvavasu Nama Samvathsaram)\nAyanam: Utharayanam\nRuthu: Hemantha Ruthu\nMonth: Thai Masam (Makaram Masam)\nPaksham: Krushna Paksham\nThithi: upto 8.17 PM Dwadashi\, thereafter Trayodashi\nDay: {Guru Vasaram} Thursday\nNakshatthiram: upto 6.31 AM Kettai\, and then Moolam\nYogam: Vriddhi\nKaranam: Kaulavai\nAmirthathiyogam: Siddha Yogam\nSubayogam: Subayogam\nRaghu Kalam: 1.49 PM to 3.13 PM\nYemakandam: 6.49 AM to 8.13 AM\nKuligai: 8.13 AM to 9.37 AM\nGood time: 6.49 AM to 8.13 AM and 12.25 PM to 1.49 PM\nSun Rise: 6.49 AM\nSun Set: 6.01 PM\nChandhirashtamam: Mesham\nSoolam: South\nPrayatchittham: Oil / Thailam\nSradhdhathithi: Dwadashi\nLocation: Hyderabad\, India
SUMMARY:Thai - 01 (15.01.2026) Thursday
UID:india-2026-01-15@panchangam
END:VEVENT
BEGIN:VEVENT
DTSTART;VALUE=DATE:20260225
DESCRIPTION:Maasi - 12 (25.02.2026) Wednesday\n\nYear: Vishvavasu Varudam (Vishvavasu Nama Samvathsaram)\nAyanam: Utharayanam\nRuthu: Shishira Ruthu\nMonth: Maasi Masam (Kumbham Masam)\nPaksham: Shukla Paksham\nThithi: upto 2.41 AM Navami\, thereafter Dashami\nDay: {Budha Vasaram} Wednesday\nNakshatthiram: upto 2.15 PM Rohini\, and then Mrigashirsham\nYogam: Vishkambha\nKaranam: Balavai\nAmirthathiyogam: Siddha Yogam\nSubayogam: Subayogam\nRaghu Kalam: 12.29 PM to 1.57 PM\nYemakandam: 8.05 AM to 9.33 AM\nKuligai: 9.33 AM to 11.01 AM\nGood time: 6.37 AM to 8.05 AM and 1.57 PM to 3.25 PM\nSun Rise: 6.37 AM\nSun Set: 6.21 PM\nChandhirashtamam: Thulam\nSoolam: North\nPrayatchittham: Milk / Paal\nSradhdhathithi: Navami\nLocation: Hyderabad\, India
SUMMARY:Maasi - 12 (25.02.2026) Wednesday
UID:india-2026-02-25@panchangam
END:VEVENT
BEGIN:VEVENT
DESCRIPTION:Exact Astronomical Duration (Hyderabad\, India)
DTEND:20260917T051822Z
DTSTART:20260916T032952Z
SUMMARY:Shukla Shashti
UID:india-202609160329-6@tithi
END:VEVENT
BEGIN:VEVENT
DTSTART;VALUE=DATE:20260504
DESCRIPTION:Chithirai - 20 (04.05.2026) Monday\n\nYear: Parabhava Varudam (Parabhava Nama Samvathsaram)\nAyanam: Utharayanam\nRuthu: Vasantha Ruthu\nMonth: Chithirai Masam (Mesham Masam)\nPaksham: Krushna Paksham\nThithi: upto 5.24 AM Tritiyai\, thereafter Chathurthi\nDay: {Soma Vasaram} Monday\nNakshatthiram: upto 10.42 AM Anusham\, and then Kettai\nYogam: Parigha\nKaranam: Vanijai\nAmirthathiyogam: Siddha Yogam\nSubayogam: Subayogam\nRaghu Kalam: 7.24 AM to 9.00 AM\nYemakandam: 10.36 AM to 12.12 PM\nKuligai: 12.12 PM to 1.48 PM\nGood time: 5.48 AM to 7.24 AM and 12.12 PM to 1.48 PM\nSun Rise: 5.48 AM\nSun Set: 6.37 PM\nChandhirashtamam: Mesham\nSoolam: East\nPrayatchittham: Curd / Thayir\nSradhdhathithi: Tritiyai\nLocation: Hyderabad\, India
SUMMARY:Chithirai - 20 (04.05.2026) Monday
UID:india-2026-05-04@panchangam
END:VEVENT
BEGIN:VEVENT
DESCRIPTION:Exact Astronomical Duration (Hyderabad\, India)
DTEND:20260329T021657Z
DTSTART:20260328T031615Z
SUMMARY:Shukla Ekadasi
UID:india-202603280316-11@tithi
END:VEVENT
BEGIN:VEVENT
DTSTART;VALUE=DATE:20251231
DESCRIPTION:Margazhi - 09 (31.12.2025) Wednesday\n\nYear: Vishvavasu Varudam (Vishvavasu Nama Samvathsaram)\nAyanam: Utharayanam\nRuthu: Hemantha Ruthu\nMonth: Margazhi Masam (Dhanus Masam)\nPaksham: Shukla Paksham\nThithi: upto 1.48 AM Dwadashi\, thereafter Trayodashi\nDay: {Budha Vasaram} Wednesday\nNakshatthiram: upto 2.05 AM Karthigai\, and then Rohini\nYogam: Sadhya\nKaranam: Bavai\nAmirthathiyogam: Siddha Yogam\nSubayogam: Subayogam\nRaghu Kalam: 12.19 PM to 1.42 PM\nYemakandam: 8.09 AM to 9.32 AM\nKuligai: 9.32 AM to 10.55 AM\nGood time: 6.45 AM to 8.09 AM and 1.42 PM to 3.05 PM\nSun Rise: 6.45 AM\nSun Set: 5.52 PM\nChandhirashtamam: Kanni\nSoolam: North\nPrayatchittham: Milk / Paal\nSradhdhathithi: Dwadashi\nLocation: Hyderabad\, India
SUMMARY:Margazhi - 09 (31.12.2025) Wednesday
UID:india-2025-12-31@panchangam
END:VEVENT
BEGIN:VEVENT
DTSTART;VALUE=DATE:20260614
DESCRIPTION:Vaikasi - 30 (14.06.2026) Sunday\n\nYear: Parabhava Varudam (Parabhava Nama Samvathsaram)\nAyanam: Utharayanam\nRuthu: Vasantha Ruthu\nMonth: Vaikasi Masam (Rishabam Masam)\nPaksham: Krushna Paksham\nThithi: upto 12.20 PM Chadhurdasi\, thereafter Amavasai\nDay: {Ravi Vasaram} Sunday\nNakshatthiram: upto 10.48 PM Rohini\, and then Mrigashirsham\nYogam: Dhriti\nKaranam: Shakuni\nAmirthathiyogam: Siddha Yogam\nSubayogam: Subayogam\nRaghu Kalam: 5.12 PM to 6.51 PM\nYemakandam: 12.16 PM to 1.55 PM\nKuligai: 1.55 PM to 3.33 PM\nGood time: 5.41 AM to 7.20 AM and 12.16 PM to 1.55 PM\nSun Rise: 5.41 AM\nSun Set: 6.51 PM\nChandhirashtamam: Thulam\nSoolam: West\nPrayatchittham: Jaggery / Vellam\nSradhdhathithi: Amavasai\nLocation: Hyderabad\, India
SUMMARY:Vaikasi - 30 (14.06.2026) Sunday
UID:india-2026-06-14@panchangam
END:VEVENT
BEGIN:VEVENT
DTSTART;VALUE=DATE:20260724
DESCRIPTION:Aadi - 07 (24.07.2026) Friday\n\nYear: Parabhava Varudam (Parabhava Nama Samvathsaram)\nAyanam: Dhatchinayanam\nRuthu: Grishma Ruthu\nMonth: Aadi Masam (Katakam Masam)\nPaksham: Shukla Paksham\nThithi: upto 9.13 AM Dashami\, thereafter Ekadashi\nDay: {Sukra Vasaram} Friday\nNakshatthiram: upto 5.21 AM Anusham\, and then Kettai\nYogam: Shukla\nKaranam: Garajai\nAmirthathiyogam: Siddha Yogam\nSubayogam: Subayogam\nRaghu Kalam: 10.45 AM to 12.22 PM\nYemakandam: 3.37 PM to 5.14 PM\nKuligai: 5.52 AM to 7.30 AM\nGood time: 5.52 AM to 7.30 AM and 12.22 PM to 1.59 PM\nSun Rise: 5.52 AM\nSun Set: 6.52 PM\nChandhirashtamam: Mesham\nSoolam: West\nPrayatchittham: Jaggery / Vellam\nSradhdhathithi: Ekadashi\nLocation: Hyderabad\, India
SUMMARY:Aadi - 07 (24.07.2026) Friday
UID:india-2026-07-24@panchangam
END:VEVENT
BEGIN:VEVENT
DTSTART;VALUE=DATE:20261028
DESCRIPTION:Aippasi - 11 (28.10.2026) Wednesday\n\nYear: Parabhava Varudam (Parabhava Nama Samvathsaram)\nAyanam: Dhatchinayanam\nRuthu: Sarath Ruthu\nMonth: Aippasi Masam (Thulam Masam)\nPaksham: Krushna Paksham\nThithi: upto 1.07 AM Tritiyai\, thereafter Chathurthi\nDay: {Budha Vasaram} Wednesday\nNakshatthiram: upto 2.02 PM Karthigai\, and then Rohini\nYogam: Vyatipata\nKaranam: Vanijai\nAmirthathiyogam: Siddha Yogam\nSubayogam: Subayogam\nRaghu Kalam: 11.59 AM to 1.26 PM\nYemakandam: 7.39 AM to 9.06 AM\nKuligai: 9.06 AM to 10.33 AM\nGood time: 6.12 AM to 7.39 AM and 1.26 PM to 2.53 PM\nSun Rise: 6.12 AM\nSun Set: 5.46 PM\nChandhirashtamam: Thulam\nSoolam: North\nPrayatchittham: Milk / Paal\nSradhdhathithi: Tritiyai\nLocation: Hyderabad\, India
SUMMARY:Aippasi - 11 (28.10.2026) Wednesday
UID:india-2026-10-28@panchangam
END:VEVENT
BEGIN:VEVENT
DESCRIPTION:Exact Astronomical Duration (Hyderabad\, India)
DTEND:20260802T174547Z
DTSTART:20260801T173747Z
SUMMARY:Sankatahara Chathurthi
UID:india-202608011737-19@tithi
END:VEVENT
BEGIN:VEVENT
DTSTART;VALUE=DATE:20260302
DESCRIPTION:Maasi - 17 (02.03.2026) Monday\n\nYear: Vishvavasu Varudam (Vishvavasu Nama Samvathsaram)\nAyanam: Utharayanam\nRuthu: Shishira Ruthu\nMonth: Maasi Masam (Kumbham Masam)\nPaksham: Shukla Paksham\nThithi: upto 5.56 PM Chadhurdasi\, thereafter Pournami\nDay: {Soma Vasaram} Monday\nNakshatthiram: upto 8.30 AM Aayilyam\, and then Magam\nYogam: Atiganda\nKaranam: Vanijai\nAmirthathiyogam: Siddha Yogam\nSubayogam: Subayogam\nRaghu Kalam: 8.02 AM to 9.31 AM\nYemakandam: 10.59 AM to 12.28 PM\nKuligai: 12.28 PM to 1.56 PM\nGood time: 6.33 AM to 8.02 AM and 12.28 PM to 1.56 PM\nSun Rise: 6.33 AM\nSun Set: 6.22 PM\nChandhirashtamam: Dhanus\nSoolam: East\nPrayatchittham: Curd / Thayir\nSradhdhathithi: Chadhurdasi\nLocation: Hyderabad\, India
SUMMARY:Maasi - 17 (02.03.2026) Monday
UID:india-2026-03-02@panchangam
END:VEVENT
BEGIN:VEVENT
DTSTART;VALUE=DATE:20260412
DESCRIPTION:Panguni - 28 (12.04.2026) Sunday\n\nYear: Vishvavasu Varudam (Vishvavasu Nama Samvathsaram)\nAyanam: Utharayanam\nRuthu: Shishira Ruthu\nMonth: Panguni Masam (Meenam Masam)\nPaksham: Krushna Paksham\nThithi: upto 1.17 AM Dashami\, thereafter Ekadashi\nDay: {Ravi Vasaram} Sunday\nNakshatthiram: upto 3.55 PM Thiruvonam\, and then Avittam\nYogam: Sadhya\nKaranam: Vanijai\nAmirthathiyogam: Siddha Yogam\nSubayogam: Subayogam\nRaghu Kalam: 4.57 PM to 6.31 PM\nYemakandam: 12.16 PM to 1.50 PM\nKuligai: 1.50 PM to 3.24 PM\nGood time: 6.02 AM to 7.36 AM and 12.16 PM to 1.50 PM\nSun Rise: 6.02 AM\nSun Set: 6.31 PM\nChandhirashtamam: Mithunam\nSoolam: West\nPrayatchittham: Jaggery / Vellam\nSradhdhathithi: Dashami\nLocation: Hyderabad\, India
SUMMARY:Panguni - 28 (12.04.2026) Sunday
UID:india-2026-04-12@panchangam
END:VEVENT
BEGIN:VEVENT
DTSTART;VALUE=DATE:20260522
DESCRIPTION:Vaikasi - 07 (22.05.2026) Friday\n\nYear: Parabhava Varudam (Parabhava Nama Samvathsaram)\nAyanam: Utharayanam\nRuthu: Vasantha Ruthu\nMonth: Vaikasi Masam (Rishabam Masam)\nPaksham: Shukla Paksham\nThithi: upto 6.25 AM Shashti\, upto 5.04 AM Saptami\, thereafter Ashtami\nDay: {Sukra Vasaram} Friday\nNakshatthiram: upto 2.47 AM Aayilyam\, and then Magam\nYogam: Vriddhi\nKaranam: Thaitilai\nAmirthathiyogam: Siddha Yogam\nSubayogam: Subayogam\nRaghu Kalam: 10.35 AM to 12.12 PM\nYemakandam: 3.28 PM to 5.05 PM\nKuligai: 5.42 AM to 7.19 AM\nGood time: 5.42 AM to 7.19 AM and 12.12 PM to 1.50 PM\nSun Rise: 5.42 AM\nSun Set: 6.43 PM\nChandhirashtamam: Dhanus\nSoolam: West\nPrayatchittham: Jaggery / Vellam\nSradhdhathithi: Saptami\nLocation: Hyderabad\, India
SUMMARY:Vaikasi - 07 (22.05.2026) Friday
UID:india-2026-05-22@panchangam
END:VEVENT
BEGIN:VEVENT
DTSTART;VALUE=DATE:20260801
DESCRIPTION:Aadi - 15 (01.08.2026) Saturday\n\nYear: Parabhava Varudam (Parabhava Nama Samvathsaram)\nAyanam: Dhatchinayanam\nRuthu: Grishma Ruthu\nMonth: Aadi Masam (Katakam Masam)\nPaksham: Krushna Paksham\nThithi: upto 11.07 PM Tritiyai\, thereafter Chathurthi\nDay: {Sani Vasaram} Saturday\nNakshatthiram: upto 9.27 PM Sathayam\, and then Poorattathi\nYogam: Shobhana\nKaranam: Vanijai\nAmirthathiyogam: Siddha Yogam\nSubayogam: Subayogam\nRaghu Kalam: 9.08 AM to 10.45 AM\nYemakandam: 1.59 PM to 3.35 PM\nKuligai: 3.35 PM to 5.12 PM\nGood time: 9.08 AM to 10.45 AM and 1.59 PM to 3.35 PM\nSun Rise: 5.55 AM\nSun Set: 6.49 PM\nChandhirashtamam: Katakam\nSoolam: East\nPrayatchittham: Curd / Thayir\nSradhdhathithi: Tritiyai\nLocation: Hyderabad\, India
SUMMARY:Aadi - 15 (01.08.2026) Saturday
UID:india-2026-08-01@panchangam
END:VEVENT
BEGIN:VEVENT
DTSTART;VALUE=DATE:20260911
DESCRIPTION:Aavani - 25 (11.09.2026) Friday\n\nYear: Parabhava Varudam (Parabhava Nama Samvathsaram)\nAyanam: Dhatchinayanam\nRuthu: Varsha Ruthu\nMonth: Aavani Masam (Simham Masam)\nPaksham: Krushna Paksham\nThithi: upto 8.56 AM Amavasai\, thereafter Prathamai\nDay: {Sukra Vasaram} Friday\nNakshatthiram: upto 1.55 PM Pooram\, and then Uthiram\nYogam: Sadhya\nKaranam: Nagava\nAmirthathiyogam: Siddha Yogam\nSubayogam: Subayogam\nRaghu Kalam: 10.40 AM to 12.12 PM\nYemakandam: 3.17 PM to 4.49 PM\nKuligai: 6.03 AM to 7.35 AM\nGood time: 6.03 AM to 7.35 AM and 12.12 PM to 1.44 PM\nSun Rise: 6.03 AM\nSun Set: 6.21 PM\nChandhirashtamam: Makaram\nSoolam: West\nPrayatchittham: Jaggery / Vellam\nSradhdhathithi: Prathamai\nLocation: Hyderabad\, India
SUMMARY:Aavani - 25 (11.09.2026) Friday
UID:india-2026-09-11@panchangam
END:VEVENT
BEGIN:VEVENT
DTSTART;VALUE=DATE:20261105
DESCRIPTION:Aippasi - 19 (05.11.2026) Thursday\n\nYear: Parabhava Varudam (Parabhava Nama Samvathsaram)\nAyanam: Dhatchinayanam\nRuthu: Sarath Ruthu\nMonth: Aippasi Masam (Thulam Masam)\nPaksham: Krushna Paksham\nThithi: upto 10.36 AM Ekadashi\, thereafter Dwadashi\nDay: {Guru Vasaram} Thursday\nNakshatthiram: upto 4.37 AM Uthiram\, and then Hastham\nYogam: Indra\nKaranam: Balavai\nAmirthathiyogam: Siddha Yogam\nSubayogam: Subayogam\nRaghu Kalam: 1.25 PM to 2.51 PM\nYemakandam: 6.16 AM to 7.41 AM\nKuligai: 7.41 AM to 9.07 AM\nGood time: 6.16 AM to 7.41 AM and 1.25 PM to 2.51 PM\nSun Rise: 6.16 AM\nSun Set: 5.42 PM\nChandhirashtamam: Makaram\nSoolam: South\nPrayatchittham: Oil / Thailam\nSradhdhathithi: Dwadashi\nLocation: Hyderabad\, India
SUMMARY:Aippasi - 19 (05.11.2026) Thursday
UID:india-2026-11-05@panchangam
END:VEVENT
BEGIN:VEVENT
DTSTART;VALUE=DATE:20261215
DESCRIPTION:Karthigai - 29 (15.12.2026) Tuesday\n\nYear: Parabhava Varudam (Parabhava Nama Samvathsaram)\nAyanam: Dhatchinayanam\nRuthu: Sarath Ruthu\nMonth: Karthigai Masam (Virutchigam Masam)\nPaksham: Shukla Paksham\nThithi: upto 9.19 PM Shashti\, thereafter Saptami\nDay: {Bhauma Vasaram} Tuesday\nNakshatthiram: upto 12.37 PM Avittam\, and then Sathayam\nYogam: Harshana\nKaranam: Kaulavai\nAmirthathiyogam: Siddha Yogam\nSubayogam: Subayogam\nRaghu Kalam: 2.57 PM to 4.20 PM\nYemakandam: 9.24 AM to 10.47 AM\nKuligai: 10.47 AM to 12.11 PM\nGood time: 8.01 AM to 9.24 AM and 2.57 PM to 4.20 PM\nSun Rise: 6.38 AM\nSun Set: 5.44 PM\nChandhirashtamam: Katakam\nSoolam: North\nPrayatchittham: Milk / Paal\nSradhdhathithi: Shashti\nLocation: Hyderabad\, India
SUMMARY:Karthigai - 29 (15.12.2026) Tuesday
UID:india-2026-12-15@panchangam
END:VEVENT
BEGIN:VEVENT
DTSTART;VALUE=DATE:20260210
DESCRIPTION:Thai - 27 (10.02.2026) Tuesday\n\nYear: Vishvavasu Varudam (Vishvavasu Nama Samvathsaram)\nAyanam: Utharayanam\nRuthu: Hemantha Ruthu\nMonth: Thai Masam (Makaram Masam)\nPaksham: Krushna Paksham\nThithi: upto 7.27 AM Ashtami\, thereafter Navami\nDay: {Bhauma Vasaram} Tuesday\nNakshatthiram: upto 8.39 AM Visakam\, and then Anusham\nYogam: Dhruva\nKaranam: Kaulavai\nAmirthathiyogam: Siddha Yogam\nSubayogam: Subayogam\nRaghu Kalam: 3.22 PM to 4.49 PM\nYemakandam: 9.37 AM to 11.04 AM\nKuligai: 11.04 AM to 12.30 PM\nGood time: 8.11 AM to 9.37 AM and 3.22 PM to 4.49 PM\nSun Rise: 6.45 AM\nSun Set: 6.15 PM\nChandhirashtamam: Mesham\nSoolam: North\nPrayatchittham: Milk / Paal\nSradhdhathithi: Navami\nLocation: Hyderabad\, India
SUMMARY:Thai - 27 (10.02.2026) Tuesday
UID:india-2026-02-10@panchangam
END:VEVENT
BEGIN:VEVENT
DTSTART;VALUE=DATE:20260320
DESCRIPTION:Panguni - 05 (20.03.2026) Friday\n\nYear: Vishvavasu Varudam (Vishvavasu Nama Samvathsaram)\nAyanam: Utharayanam\nRuthu: Shishira Ruthu\nMonth: Panguni Masam (Meenam Masam)\nPaksham: Shukla Paksham\nThithi: upto 2.31 AM Dwitiyai\, thereafter Tritiyai\nDay: {Sukra Vasaram} Friday\nNakshatthiram: upto 3.04 AM Revathi\, and then Ashwini\nYogam: Brahma\nKaranam: Balavai\nAmirthathiyogam: Amirtha Yogam\nSubayogam: Subayogam\nRaghu Kalam: 10.52 AM to 12.23 PM\nYemakandam: 3.25 PM to 4.56 PM\nKuligai: 6.20 AM to 7.51 AM\nGood time: 6.20 AM to 7.51 AM and 12.23 PM to 1.54 PM\nSun Rise: 6.20 AM\nSun Set: 6.26 PM\nChandhirashtamam: Simham\nSoolam: West\nPrayatchittham: Jaggery / Vellam\nSradhdhathithi: Dwitiyai\nLocation: Hyderabad\, India
SUMMARY:Panguni - 05 (20.03.2026) Friday
UID:india-2026-03-20@panchangam
END:VEVENT
BEGIN:VEVENT
DTSTART;VALUE=DATE:20260430
DESCRIPTION:Chithirai - 16 (30.04.2026) Thursday\n\nYear: Parabhava Varudam (Parabhava Nama Samvathsaram)\nAyanam: Utharayanam\nRuthu: Vasantha Ruthu\nMonth: Chithirai Masam (Mesham Masam)\nPaksham: Shukla Paksham\nThithi: upto 9.13 PM Chadhurdasi\, thereafter Pournami\nDay: {Guru Vasaram} Thursday\nNakshatthiram: upto 3.00 AM Chitthirai\, and then Swathi\nYogam: Vajra\nKaranam: Garajai\nAmirthathiyogam: Siddha Yogam\nSubayogam: Subayogam\nRaghu Kalam: 1.49 PM to 3.24 PM\nYemakandam: 5.50 AM to 7.26 AM\nKuligai: 7.26 AM to 9.02 AM\nGood time: 5.50 AM to 7.26 AM and 12.13 PM to 1.49 PM\nSun Rise: 5.50 AM\nSun Set: 6.35 PM\nChandhirashtamam: Kumbham\nSoolam: South\nPrayatchittham: Oil / Thailam\nSradhdhathithi: Chadhurdasi\nLocation: Hyderabad\, India
SUMMARY:Chithirai - 16 (30.04.2026) Thursday
UID:india-2026-04-30@panchangam
END:VEVENT
BEGIN:VEVENT
DTSTART;VALUE=DATE:20260309
DESCRIPTION:Maasi - 24 (09.03.2026) Monday\n\nYear: Vishvavasu Varudam (Vishvavasu Nama Samvathsaram)\nAyanam: Utharayanam\nRuthu: Shishira Ruthu\nMonth: Maasi Masam (Kumbham Masam)\nPaksham: Krushna Paksham\nThithi: upto 11.27 PM Shashti\, thereafter Saptami\nDay: {Soma Vasaram} Monday\nNakshatthiram: upto 4.55 PM Visakam\, and then Anusham\nYogam: Vyaghata\nKaranam: Garajai\nAmirthathiyogam: Siddha Yogam\nSubayogam: Subayogam\nRaghu Kalam: 7.58 AM to 9.27 AM\nYemakandam: 10.57 AM to 12.26 PM\nKuligai: 12.26 PM to 1.56 PM\nGood time: 6.28 AM to 7.58 AM and 12.26 PM to 1.56 PM\nSun Rise: 6.28 AM\nSun Set: 6.24 PM\nChandhirashtamam: Meenam\nSoolam: East\nPrayatchittham: Curd / Thayir\nSradhdhathithi: Shashti\nLocation: Hyderabad\, India
SUMMARY:Maasi - 24 (09.03.2026) Monday
UID:india-2026-03-09@panchangam
END:VEVENT
BEGIN:VEVENT
DTSTART;VALUE=DATE:20260419
DESCRIPTION:Chithirai - 05 (19.04.2026) Sunday\n\nYear: Parabhava Varudam (Parabhava Nama Samvathsaram)\nAyanam: Utharayanam\nRuthu: Vasantha Ruthu\nMonth: Chithirai Masam (Mesham Masam)\nPaksham: Shukla Paksham\nThithi: upto 10.49 AM Dwitiyai\, thereafter Tritiyai\nDay: {Ravi Vasaram} Sunday\nNakshatthiram: upto 7.45 AM Bharani\, upto 5.10 AM Karthigai\, and then Rohini\nYogam: Aayushman\nKaranam: Kaulavai\nAmirthathiyogam: Marana Yogam\nSubayogam: \nRaghu Kalam: 4.58 PM to 6.33 PM\nYemakandam: 12.15 PM to 1.49 PM\nKuligai: 1.49 PM to 3.24 PM\nGood time: 5.57 AM to 7.32 AM and 12.15 PM to 1.49 PM\nSun Rise: 5.57 AM\nSun Set: 6.33 PM\nChandhirashtamam: Kanni\nSoolam: West\nPrayatchittham: Jaggery / Vellam\nSradhdhathithi: Tritiyai\nLocation: Hyderabad\, India
SUMMARY:Chithirai - 05 (19.04.2026) Sunday
UID:india-2026-04-19@panchangam
END:VEVENT
BEGIN:VEVENT
DTSTART;VALUE=DATE:20260529
DESCRIPTION:Vaikasi - 14 (29.05.2026) Friday\n\nYear: Parabhava Varudam (Parabhava Nama Samvathsaram)\nAyanam: Utharayanam\nRuthu: Vasantha Ruthu\nMonth: Vaikasi Masam (Rishabam Masam)\nPaksham: Shukla Paksham\nThithi: upto 9.51 AM Trayodashi\, thereafter Chadhurdasi\nDay: {Sukra Vasaram} Friday\nNakshatthiram: upto 11.22 AM Swathi\, and then Visakam\nYogam: Parigha\nKaranam: Thaitilai\nAmirthathiyogam: Siddha Yogam\nSubayogam: Subayogam\nRaghu Kalam: 10.35 AM to 12.13 PM\nYemakandam: 3.29 PM to 5.07 PM\nKuligai: 5.41 AM to 7.19 AM\nGood time: 5.41 AM to 7.19 AM and 12.13 PM to 1.51 PM\nSun Rise: 5.41 AM\nSun Set: 6.45 PM\nChandhirashtamam: Meenam\nSoolam: West\nPrayatchittham: Jaggery / Vellam\nSradhdhathithi: Chadhurdasi\nLocation: Hyderabad\, India
SUMMARY:Vaikasi - 14 (29.05.2026) Friday
UID:india-2026-05-29@panchangam
END:VEVENT
BEGIN:VEVENT
DTSTART;VALUE=DATE:20260808
DESCRIPTION:Aadi - 22 (08.08.2026) Saturday\n\nYear: Parabhava Varudam (Parabhava Nama Samvathsaram)\nAyanam: Dhatchinayanam\nRuthu: Grishma Ruthu\nMonth: Aadi Masam (Katakam Masam)\nPaksham: Krushna Paksham\nThithi: upto 1.59 PM Dashami\, thereafter Ekadashi\nDay: {Sani Vasaram} Saturday\nNakshatthiram: upto 5.28 PM Rohini\, and then Mrigashirsham\nYogam: Dhruva\nKaranam: Vishti\nAmirthathiyogam: Amirtha Yogam\nSubayogam: Subayogam\nRaghu Kalam: 9.09 AM to 10.45 AM\nYemakandam: 1.57 PM to 3.33 PM\nKuligai: 3.33 PM to 5.09 PM\nGood time: 9.09 AM to 10.45 AM and 1.57 PM to 3.33 PM\nSun Rise: 5.57 AM\nSun Set: 6.45 PM\nChandhirashtamam: Thulam\nSoolam: East\nPrayatchittham: Curd / Thayir\nSradhdhathithi: Ekadashi\nLocation: Hyderabad\, India
SUMMARY:Aadi - 22 (08.08.2026) Saturday
UID:india-2026-08-08@panchangam
END:VEVENT
BEGIN:VEVENT
DTSTART;VALUE=DATE:20260918
DESCRIPTION:Purattasi - 01 (18.09.2026) Friday\n\nYear: Parabhava Varudam (Parabhava Nama Samvathsaram)\nAyanam: Dhatchinayanam\nRuthu: Varsha Ruthu\nMonth: Purattasi Masam (Kanni Masam)\nPaksham: Shukla Paksham\nThithi: upto 1.01 PM Saptami\, thereafter Ashtami\nDay: {Sukra Vasaram} Friday\nNakshatthiram: upto 11.30 PM Kettai\, and then Moolam\nYogam: Priti\nKaranam: Vanijai\nAmirthathiyogam: Marana Yogam\nSubayogam: \nRaghu Kalam: 10.38 AM to 12.10 PM\nYemakandam: 3.13 PM to 4.44 PM\nKuligai: 6.04 AM to 7.35 AM\nGood time: 6.04 AM to 7.35 AM and 12.10 PM to 1.41 PM\nSun Rise: 6.04 AM\nSun Set: 6.15 PM\nChandhirashtamam: Mesham\nSoolam: West\nPrayatchittham: Jaggery / Vellam\nSradhdhathithi: Ashtami\nLocation: Hyderabad\, India
SUMMARY:Purattasi - 01 (18.09.2026) Friday
UID:india-2026-09-18@panchangam
END:VEVENT
BEGIN:VEVENT
DTSTART;VALUE=DATE:20261013
DESCRIPTION:Purattasi - 26 (13.10.2026) Tuesday\n\nYear: Parabhava Varudam (Parabhava Nama Samvathsaram)\nAyanam: Dhatchinayanam\nRuthu: Varsha Ruthu\nMonth: Purattasi Masam (Kanni Masam)\nPaksham: Shukla Paksham\nThithi: upto 11.28 PM Tritiyai\, thereafter Chathurthi\nDay: {Bhauma Vasaram} Tuesday\nNakshatthiram: upto 2.27 AM Visakam\, and then Anusham\nYogam: Priti\nKaranam: Thaitilai\nAmirthathiyogam: Siddha Yogam\nSubayogam: Subayogam\nRaghu Kalam: 2.59 PM to 4.27 PM\nYemakandam: 9.05 AM to 10.33 AM\nKuligai: 10.33 AM to 12.02 PM\nGood time: 7.37 AM to 9.05 AM and 2.59 PM to 4.27 PM\nSun Rise: 6.08 AM\nSun Set: 5.55 PM\nChandhirashtamam: Meenam\nSoolam: North\nPrayatchittham: Milk / Paal\nSradhdhathithi: Tritiyai\nLocation: Hyderabad\, India
SUMMARY:Purattasi - 26 (13.10.2026) Tuesday
UID:india-2026-10-13@panchangam
END:VEVENT
BEGIN:VEVENT
DTSTART;VALUE=DATE:20261123
DESCRIPTION:Karthigai - 07 (23.11.2026) Monday\n\nYear: Parabhava Varudam (Parabhava Nama Samvathsaram)\nAyanam: Dhatchinayanam\nRuthu: Sarath Ruthu\nMonth: Karthigai Masam (Virutchigam Masam)\nPaksham: Shukla Paksham\nThithi: upto 11.42 PM Chadhurdasi\, thereafter Pournami\nDay: {Soma Vasaram} Monday\nNakshatthiram: upto 2.38 AM Bharani\, and then Karthigai\nYogam: Variyana\nKaranam: Garajai\nAmirthathiyogam: Siddha Yogam\nSubayogam: Subayogam\nRaghu Kalam: 7.49 AM to 9.13 AM\nYemakandam: 10.38 AM to 12.02 PM\nKuligai: 12.02 PM to 1.26 PM\nGood time: 6.25 AM to 7.49 AM and 12.02 PM to 1.26 PM\nSun Rise: 6.25 AM\nSun Set: 5.39 PM\nChandhirashtamam: Kanni\nSoolam: East\nPrayatchittham: Curd / Thayir\nSradhdhathithi: Chadhurdasi\nLocation: Hyderabad\, India
SUMMARY:Karthigai - 07 (23.11.2026) Monday
UID:india-2026-11-23@panchangam
END:VEVENT
BEGIN:VEVENT
DTSTART;VALUE=DATE:20260107
DESCRIPTION:Margazhi - 16 (07.01.2026) Wednesday\n\nYear: Vishvavasu Varudam (Vishvavasu Nama Samvathsaram)\nAyanam: Utharayanam\nRuthu: Hemantha Ruthu\nMonth: Margazhi Masam (Dhanus Masam)\nPaksham: Krushna Paksham\nThithi: upto 6.53 AM Chathurthi\, upto 6.34 AM Panchami\, thereafter Shashti\nDay: {Budha Vasaram} Wednesday\nNakshatthiram: upto 12.35 PM Magam\, and then Pooram\nYogam: Aayushman\nKaranam: Balavai\nAmirthathiyogam: Siddha Yogam\nSubayogam: Subayogam\nRaghu Kalam: 12.22 PM to 1.45 PM\nYemakandam: 8.11 AM to 9.35 AM\nKuligai: 9.35 AM to 10.58 AM\nGood time: 6.47 AM to 8.11 AM and 1.45 PM to 3.09 PM\nSun Rise: 6.47 AM\nSun Set: 5.56 PM\nChandhirashtamam: Makaram\nSoolam: North\nPrayatchittham: Milk / Paal\nSradhdhathithi: Panchami\nLocation: Hyderabad\, India
SUMMARY:Margazhi - 16 (07.01.2026) Wednesday
UID:india-2026-01-07@panchangam
END:VEVENT
BEGIN:VEVENT
DTSTART;VALUE=DATE:20260217
DESCRIPTION:Maasi - 04 (17.02.2026) Tuesday\n\nYear: Vishvavasu Varudam (Vishvavasu Nama Samvathsaram)\nAyanam: Utharayanam\nRuthu: Shishira Ruthu\nMonth: Maasi Masam (Kumbham Masam)\nPaksham: Krushna Paksham\nThithi: upto 5.31 PM Amavasai\, thereafter Prathamai\nDay: {Bhauma Vasaram} Tuesday\nNakshatthiram: upto 9.56 PM Avittam\, and then Sathayam\nYogam: Parigha\nKaranam: Nagava\nAmirthathiyogam: Siddha Yogam\nSubayogam: Subayogam\nRaghu Kalam: 3.24 PM to 4.51 PM\nYemakandam: 9.35 AM to 11.03 AM\nKuligai: 11.03 AM to 12.30 PM\nGood time: 8.08 AM to 9.35 AM and 3.24 PM to 4.51 PM\nSun Rise: 6.41 AM\nSun Set: 6.18 PM\nChandhirashtamam: Mithunam\nSoolam: North\nPrayatchittham: Milk / Paal\nSradhdhathithi: Amavasai\nLocation: Hyderabad\, India
SUMMARY:Maasi - 04 (17.02.2026) Tuesday
UID:india-2026-02-17@panchangam
END:VEVENT
BEGIN:VEVENT
DTSTART;VALUE=DATE:20260327
DESCRIPTION:Panguni - 12 (27.03.2026) Friday\n\nYear: Vishvavasu Varudam (Vishvavasu Nama Samvathsaram)\nAyanam: Utharayanam\nRuthu: Shishira Ruthu\nMonth: Panguni Masam (Meenam Masam)\nPaksham: Shukla Paksham\nThithi: upto 10.07 AM Navami\, thereafter Dashami\nDay: {Sukra Vasaram} Friday\nNakshatthiram: upto 4.02 PM Punarpoosam\, and then Poosam\nYogam: Atiganda\nKaranam: Kaulavai\nAmirthathiyogam: Siddha Yogam\nSubayogam: Subayogam\nRaghu Kalam: 10.49 AM to 12.21 PM\nYemakandam: 3.24 PM to 4.56 PM\nKuligai: 6.14 AM to 7.46 AM\nGood time: 6.14 AM to 7.46 AM and 12.21 PM to 1.53 PM\nSun Rise: 6.14 AM\nSun Set: 6.28 PM\nChandhirashtamam: Virutchigam\nSoolam: West\nPrayatchittham: Jaggery / Vellam\nSradhdhathithi: Dashami\nLocation: Hyderabad\, India
SUMMARY:Panguni - 12 (27.03.2026) Friday
UID:india-2026-03-27@panchangam
END:VEVENT
BEGIN:VEVENT
DESCRIPTION:Exact Astronomical Duration (Hyderabad\, India)
DTEND:20260307T134742Z
DTSTART:20260306T122352Z
SUMMARY:Sankatahara Chathurthi
UID:india-202603061223-19@tithi
END:VEVENT
BEGIN:VEVENT
DTSTART;VALUE=DATE:20260606
DESCRIPTION:Vaikasi - 22 (06.06.2026) Saturday\n\nYear: Parabhava Varudam (Parabhava Nama Samvathsaram)\nAyanam: Utharayanam\nRuthu: Vasantha Ruthu\nMonth: Vaikasi Masam (Rishabam Masam)\nPaksham: Krushna Paksham\nThithi: upto 2.41 AM Shashti\, thereafter Saptami\nDay: {Sani Vasaram} Saturday\nNakshatthiram: upto 6.46 AM Thiruvonam\, and then Avittam\nYogam: Indra\nKaranam: Garajai\nAmirthathiyogam: Siddha Yogam\nSubayogam: Subayogam\nRaghu Kalam: 8.57 AM to 10.36 AM\nYemakandam: 1.53 PM to 3.31 PM\nKuligai: 3.31 PM to 5.10 PM\nGood time: 8.57 AM to 10.36 AM and 1.53 PM to 3.31 PM\nSun Rise: 5.40 AM\nSun Set: 6.48 PM\nChandhirashtamam: Mithunam\nSoolam: East\nPrayatchittham: Curd / Thayir\nSradhdhathithi: Shashti\nLocation: Hyderabad\, India
SUMMARY:Vaikasi - 22 (06.06.2026) Saturday
UID:india-2026-06-06@panchangam
END:VEVENT
BEGIN:VEVENT
DTSTART;VALUE=DATE:20260716
DESCRIPTION:Aani - 31 (16.07.2026) Thursday\n\nYear: Parabhava Varudam (Parabhava Nama Samvathsaram)\nAyanam: Dhatchinayanam\nRuthu: Grishma Ruthu\nMonth: Aani Masam (Mithunam Masam)\nPaksham: Shukla Paksham\nThithi: upto 8.53 AM Dwitiyai\, thereafter Tritiyai\nDay: {Guru Vasaram} Thursday\nNakshatthiram: upto 8.29 PM Aayilyam\, and then Magam\nYogam: Siddhi\nKaranam: Kaulavai\nAmirthathiyogam: Siddha Yogam\nSubayogam: Subayogam\nRaghu Kalam: 2.00 PM to 3.38 PM\nYemakandam: 5.50 AM to 7.28 AM\nKuligai: 7.28 AM to 9.06 AM\nGood time: 5.50 AM to 7.28 AM and 12.22 PM to 2.00 PM\nSun Rise: 5.50 AM\nSun Set: 6.53 PM\nChandhirashtamam: Dhanus\nSoolam: South\nPrayatchittham: Oil / Thailam\nSradhdhathithi: Tritiyai\nLocation: Hyderabad\, India
SUMMARY:Aani - 31 (16.07.2026) Thursday
UID:india-2026-07-16@panchangam
END:VEVENT
BEGIN:VEVENT
DTSTART;VALUE=DATE:20260826
DESCRIPTION:Aavani - 09 (26.08.2026) Wednesday\n\nYear: Parabhava Varudam (Parabhava Nama Samvathsaram)\nAyanam: Dhatchinayanam\nRuthu: Varsha Ruthu\nMonth: Aavani Masam (Simham Masam)\nPaksham: Shukla Paksham\nThithi: upto 7.59 AM Trayodashi\, thereafter Chadhurdasi\nDay: {Budha Vasaram} Wednesday\nNakshatthiram: upto 1.31 AM Thiruvonam\, and then Avittam\nYogam: Saubhagya\nKaranam: Thaitilai\nAmirthathiyogam: Siddha Yogam\nSubayogam: Subayogam\nRaghu Kalam: 12.17 PM to 1.51 PM\nYemakandam: 7.35 AM to 9.09 AM\nKuligai: 9.09 AM to 10.43 AM\nGood time: 6.01 AM to 7.35 AM and 1.51 PM to 3.26 PM\nSun Rise: 6.01 AM\nSun Set: 6.34 PM\nChandhirashtamam: Mithunam\nSoolam: North\nPrayatchittham: Milk / Paal\nSradhdhathithi: Chadhurdasi\nLocation: Hyderabad\, India
SUMMARY:Aavani - 09 (26.08.2026) Wednesday
UID:india-2026-08-26@panchangam
END:VEVENT
BEGIN:VEVENT
DTSTART;VALUE=DATE:20261031
DESCRIPTION:Aippasi - 14 (31.10.2026) Saturday\n\nYear: Parabhava Varudam (Parabhava Nama Samvathsaram)\nAyanam: Dhatchinayanam\nRuthu: Sarath Ruthu\nMonth: Aippasi Masam (Thulam Masam)\nPaksham: Krushna Paksham\nThithi: upto 4.57 PM Shashti\, thereafter Saptami\nDay: {Sani Vasaram} Saturday\nNakshatthiram: upto 7.49 AM Thiruvathirai\, and then Punarpoosam\nYogam: Siddha\nKaranam: Vanijai\nAmirthathiyogam: Siddha Yogam\nSubayogam: Subayogam\nRaghu Kalam: 9.06 AM to 10.33 AM\nYemakandam: 1.25 PM to 2.52 PM\nKuligai: 2.52 PM to 4.18 PM\nGood time: 9.06 AM to 10.33 AM and 1.25 PM to 2.52 PM\nSun Rise: 6.14 AM\nSun Set: 5.45 PM\nChandhirashtamam: Virutchigam\nSoolam: East\nPrayatchittham: Curd / Thayir\nSradhdhathithi: Shashti\nLocation: Hyderabad\, India
SUMMARY:Aippasi - 14 (31.10.2026) Saturday
UID:india-2026-10-31@panchangam
END:VEVENT
BEGIN:VEVENT
DTSTART;VALUE=DATE:20260125
DESCRIPTION:Thai - 11 (25.01.2026) Sunday\n\nYear: Vishvavasu Varudam (Vishvavasu Nama Samvathsaram)\nAyanam: Utharayanam\nRuthu: Hemantha Ruthu\nMonth: Thai Masam (Makaram Masam)\nPaksham: Shukla Paksham\nThithi: upto 11.10 PM Saptami\, thereafter Ashtami\nDay: {Ravi Vasaram} Sunday\nNakshatthiram: upto 2.13 PM Revathi\, and then Ashwini\nYogam: Siddha\nKaranam: Garajai\nAmirthathiyogam: Siddha Yogam\nSubayogam: Subayogam\nRaghu Kalam: 4.42 PM to 6.07 PM\nYemakandam: 12.28 PM to 1.53 PM\nKuligai: 1.53 PM to 3.17 PM\nGood time: 6.49 AM to 8.14 AM and 12.28 PM to 1.53 PM\nSun Rise: 6.49 AM\nSun Set: 6.07 PM\nChandhirashtamam: Simham\nSoolam: West\nPrayatchittham: Jaggery / Vellam\nSradhdhathithi: Saptami\nLocation: Hyderabad\, India
SUMMARY:Thai - 11 (25.01.2026) Sunday
UID:india-2026-01-25@panchangam
END:VEVENT
BEGIN:VEVENT
DTSTART;VALUE=DATE:20260404
DESCRIPTION:Panguni - 20 (04.04.2026) Saturday\n\nYear: Vishvavasu Varudam (Vishvavasu Nama Samvathsaram)\nAyanam: Utharayanam\nRuthu: Shishira Ruthu\nMonth: Panguni Masam (Meenam Masam)\nPaksham: Krushna Paksham\nThithi: upto 10.09 AM Dwitiyai\, thereafter Tritiyai\nDay: {Sani Vasaram} Saturday\nNakshatthiram: upto 10.19 PM Swathi\, and then Visakam\nYogam: Harshana\nKaranam: Garajai\nAmirthathiyogam: Siddha Yogam\nSubayogam: Subayogam\nRaghu Kalam: 9.13 AM to 10.46 AM\nYemakandam: 1.51 PM to 3.24 PM\nKuligai: 3.24 PM to 4.57 PM\nGood time: 9.13 AM to 10.46 AM and 1.51 PM to 3.24 PM\nSun Rise: 6.08 AM\nSun Set: 6.29 PM\nChandhirashtamam: Meenam\nSoolam: East\nPrayatchittham: Curd / Thayir\nSradhdhathithi: Tritiyai\nLocation: Hyderabad\, India
SUMMARY:Panguni - 20 (04.04.2026) Saturday
UID:india-2026-04-04@panchangam
END:VEVENT
BEGIN:VEVENT
DTSTART;VALUE=DATE:20260514
DESCRIPTION:Chithirai - 30 (14.05.2026) Thursday\n\nYear: Parabhava Varudam (Parabhava Nama Samvathsaram)\nAyanam: Utharayanam\nRuthu: Vasantha Ruthu\nMonth: Chithirai Masam (Mesham Masam)\nPaksham: Krushna Paksham\nThithi: upto 11.21 AM Dwadashi\, thereafter Trayodashi\nDay: {Guru Vasaram} Thursday\nNakshatthiram: upto 11.10 PM Revathi\, and then Ashwini\nYogam: Priti\nKaranam: Thaitilai\nAmirthathiyogam: Siddha Yogam\nSubayogam: Subayogam\nRaghu Kalam: 1.49 PM to 3.26 PM\nYemakandam: 5.44 AM to 7.21 AM\nKuligai: 7.21 AM to 8.58 AM\nGood time: 5.44 AM to 7.21 AM and 12.12 PM to 1.49 PM\nSun Rise: 5.44 AM\nSun Set: 6.40 PM\nChandhirashtamam: Simham\nSoolam: South\nPrayatchittham: Oil / Thailam\nSradhdhathithi: Trayodashi\nLocation: Hyderabad\, India
SUMMARY:Chithirai - 30 (14.05.2026) Thursday
UID:india-2026-05-14@panchangam
END:VEVENT
BEGIN:VEVENT
DTSTART;VALUE=DATE:20260624
DESCRIPTION:Aani - 09 (24.06.2026) Wednesday\n\nYear: Parabhava Varudam (Parabhava Nama Samvathsaram)\nAyanam: Dhatchinayanam\nRuthu: Grishma Ruthu\nMonth: Aani Masam (Mithunam Masam)\nPaksham: Shukla Paksham\nThithi: upto 6.12 PM Dashami\, thereafter Ekadashi\nDay: {Budha Vasaram} Wednesday\nNakshatthiram: upto 2.43 PM Chitthirai\, and then Swathi\nYogam: Parigha\nKaranam: Garajai\nAmirthathiyogam: Siddha Yogam\nSubayogam: Subayogam\nRaghu Kalam: 12.18 PM to 1.57 PM\nYemakandam: 7.22 AM to 9.00 AM\nKuligai: 9.00 AM to 10.39 AM\nGood time: 5.43 AM to 7.22 AM and 1.57 PM to 3.35 PM\nSun Rise: 5.43 AM\nSun Set: 6.53 PM\nChandhirashtamam: Meenam\nSoolam: North\nPrayatchittham: Milk / Paal\nSradhdhathithi: Dashami\nLocation: Hyderabad\, India
SUMMARY:Aani - 09 (24.06.2026) Wednesday
UID:india-2026-06-24@panchangam
END:VEVENT
BEGIN:VEVENT
DTSTART;VALUE=DATE:20260903
DESCRIPTION:Aavani - 17 (03.09.2026) Thursday\n\nYear: Parabhava Varudam (Parabhava Nama Samvathsaram)\nAyanam: Dhatchinayanam\nRuthu: Varsha Ruthu\nMonth: Aavani Masam (Simham Masam)\nPaksham: Krushna Paksham\nThithi: upto 2.25 AM Saptami\, thereafter Ashtami\nDay: {Guru Vasaram} Thursday\nNakshatthiram: upto 1.07 AM Karthigai\, and then Rohini\nYogam: Vyaghata\nKaranam: Vishti\nAmirthathiyogam: Siddha Yogam\nSubayogam: Subayogam\nRaghu Kalam: 1.48 PM to 3.21 PM\nYemakandam: 6.02 AM to 7.35 AM\nKuligai: 7.35 AM to 9.08 AM\nGood time: 6.02 AM to 7.35 AM and 12.15 PM to 1.48 PM\nSun Rise: 6.02 AM\nSun Set: 6.28 PM\nChandhirashtamam: Kanni\nSoolam: South\nPrayatchittham: Oil / Thailam\nSradhdhathithi: Saptami\nLocation: Hyderabad\, India
SUMMARY:Aavani - 17 (03.09.2026) Thursday
UID:india-2026-09-03@panchangam
END:VEVENT
BEGIN:VEVENT
DESCRIPTION:Exact Astronomical Duration (Hyderabad\, India)
DTEND:20260527T005215Z
DTSTART:20260525T234124Z
SUMMARY:Shukla Ekadasi
UID:india-202605252341-11@tithi
END:VEVENT
BEGIN:VEVENT
DTSTART;VALUE=DATE:20261207
DESCRIPTION:Karthigai - 21 (07.12.2026) Monday\n\nYear: Parabhava Varudam (Parabhava Nama Samvathsaram)\nAyanam: Dhatchinayanam\nRuthu: Sarath Ruthu\nMonth: Karthigai Masam (Virutchigam Masam)\nPaksham: Krushna Paksham\nThithi: upto 4.13 AM Chadhurdasi\, thereafter Amavasai\nDay: {Soma Vasaram} Monday\nNakshatthiram: upto 4.32 PM Visakam\, and then Anusham\nYogam: Atiganda\nKaranam: Vishti\nAmirthathiyogam: Siddha Yogam\nSubayogam: Subayogam\nRaghu Kalam: 7.56 AM to 9.20 AM\nYemakandam: 10.43 AM to 12.07 PM\nKuligai: 12.07 PM to 1.30 PM\nGood time: 6.33 AM to 7.56 AM and 12.07 PM to 1.30 PM\nSun Rise: 6.33 AM\nSun Set: 5.41 PM\nChandhirashtamam: Meenam\nSoolam: East\nPrayatchittham: Curd / Thayir\nSradhdhathithi: Chadhurdasi\nLocation: Hyderabad\, India
SUMMARY:Karthigai - 21 (07.12.2026) Monday
UID:india-2026-12-07@panchangam
END:VEVENT
BEGIN:VEVENT
DTSTART;VALUE=DATE:20260202
DESCRIPTION:Thai - 19 (02.02.2026) Monday\n\nYear: Vishvavasu Varudam (Vishvavasu Nama Samvathsaram)\nAyanam: Utharayanam\nRuthu: Hemantha Ruthu\nMonth: Thai Masam (Makaram Masam)\nPaksham: Krushna Paksham\nThithi: upto 1.52 AM Prathamai\, thereafter Dwitiyai\nDay: {Soma Vasaram} Monday\nNakshatthiram: upto 11.25 PM Aayilyam\, and then Magam\nYogam: Aayushman\nKaranam: Balavai\nAmirthathiyogam: Siddha Yogam\nSubayogam: Subayogam\nRaghu Kalam: 8.13 AM to 9.38 AM\nYemakandam: 11.04 AM to 12.29 PM\nKuligai: 12.29 PM to 1.55 PM\nGood time: 6.47 AM to 8.13 AM and 12.29 PM to 1.55 PM\nSun Rise: 6.47 AM\nSun Set: 6.11 PM\nChandhirashtamam: Dhanus\nSoolam: East\nPrayatchittham: Curd / Thayir\nSradhdhathithi: Prathamai\nLocation: Hyderabad\, India
SUMMARY:Thai - 19 (02.02.2026) Monday
UID:india-2026-02-02@panchangam
END:VEVENT
BEGIN:VEVENT
DTSTART;VALUE=DATE:20260312
DESCRIPTION:Maasi - 27 (12.03.2026) Thursday\n\nYear: Vishvavasu Varudam (Vishvavasu Nama Samvathsaram)\nAyanam: Utharayanam\nRuthu: Shishira Ruthu\nMonth: Maasi Masam (Kumbham Masam)\nPaksham: Krushna Paksham\nThithi: Navami\nDay: {Guru Vasaram} Thursday\nNakshatthiram: upto 1.27 AM Moolam\, and then Pooradam\nYogam: Siddhi\nKaranam: Thaitilai\nAmirthathiyogam: Siddha Yogam\nSubayogam: Subayogam\nRaghu Kalam: 1.55 PM to 3.25 PM\nYemakandam: 6.26 AM to 7.56 AM\nKuligai: 7.56 AM to 9.26 AM\nGood time: 6.26 AM to 7.56 AM and 12.25 PM to 1.55 PM\nSun Rise: 6.26 AM\nSun Set: 6.25 PM\nChandhirashtamam: Rishabam\nSoolam: South\nPrayatchittham: Oil / Thailam\nSradhdhathithi: Navami\nLocation: Hyderabad\, India
SUMMARY:Maasi - 27 (12.03.2026) Thursday
UID:india-2026-03-12@panchangam
END:VEVENT
BEGIN:VEVENT
DTSTART;VALUE=DATE:20260422
DESCRIPTION:Chithirai - 08 (22.04.2026) Wednesday\n\nYear: Parabhava Varudam (Parabhava Nama Samvathsaram)\nAyanam: Utharayanam\nRuthu: Vasantha Ruthu\nMonth: Chithirai Masam (Mesham Masam)\nPaksham: Shukla Paksham\nThithi: upto 10.50 PM Shashti\, thereafter Saptami\nDay: {Budha Vasaram} Wednesday\nNakshatthiram: upto 10.50 PM Thiruvathirai\, and then Punarpoosam\nYogam: Atiganda\nKaranam: Kaulavai\nAmirthathiyogam: Siddha Yogam\nSubayogam: Subayogam\nRaghu Kalam: 12.14 PM to 1.49 PM\nYemakandam: 7.30 AM to 9.05 AM\nKuligai: 9.05 AM to 10.39 AM\nGood time: 5.55 AM to 7.30 AM and 1.49 PM to 3.24 PM\nSun Rise: 5.55 AM\nSun Set: 6.33 PM\nChandhirashtamam: Virutchigam\nSoolam: North\nPrayatchittham: Milk / Paal\nSradhdhathithi: Shashti\nLocation: Hyderabad\, India
SUMMARY:Chithirai - 08 (22.04.2026) Wednesday
UID:india-2026-04-22@panchangam
END:VEVENT
BEGIN:VEVENT
DESCRIPTION:Exact Astronomical Duration (Hyderabad\, India)
DTEND:20260823T224913Z
DTSTART:20260822T203052Z
SUMMARY:Shukla Ekadasi
UID:india-202608222030-11@tithi
END:VEVENT
BEGIN:VEVENT
DTSTART;VALUE=DATE:20260701
DESCRIPTION:Aani - 16 (01.07.2026) Wednesday\n\nYear: Parabhava Varudam (Parabhava Nama Samvathsaram)\nAyanam: Dhatchinayanam\nRuthu: Grishma Ruthu\nMonth: Aani Masam (Mithunam Masam)\nPaksham: Krushna Paksham\nThithi: upto 7.38 AM Prathamai\, thereafter Dwitiyai\nDay: {Budha Vasaram} Wednesday\nNakshatthiram: upto 7.36 AM Pooradam\, and then Uthiradam\nYogam: Indra\nKaranam: Kaulavai\nAmirthathiyogam: Siddha Yogam\nSubayogam: Subayogam\nRaghu Kalam: 12.19 PM to 1.58 PM\nYemakandam: 7.23 AM to 9.02 AM\nKuligai: 9.02 AM to 10.41 AM\nGood time: 5.45 AM to 7.23 AM and 1.58 PM to 3.37 PM\nSun Rise: 5.45 AM\nSun Set: 6.54 PM\nChandhirashtamam: Rishabam\nSoolam: North\nPrayatchittham: Milk / Paal\nSradhdhathithi: Dwitiyai\nLocation: Hyderabad\, India
SUMMARY:Aani - 16 (01.07.2026) Wednesday
UID:india-2026-07-01@panchangam
END:VEVENT
BEGIN:VEVENT
DTSTART;VALUE=DATE:20260811
DESCRIPTION:Aadi - 25 (11.08.2026) Tuesday\n\nYear: Parabhava Varudam (Parabhava Nama Samvathsaram)\nAyanam: Dhatchinayanam\nRuthu: Grishma Ruthu\nMonth: Aadi Masam (Katakam Masam)\nPaksham: Krushna Paksham\nThithi: upto 1.53 AM Chadhurdasi\, thereafter Amavasai\nDay: {Bhauma Vasaram} Tuesday\nNakshatthiram: upto 10.46 AM Punarpoosam\, and then Poosam\nYogam: Siddhi\nKaranam: Vishti\nAmirthathiyogam: Siddha Yogam\nSubayogam: Subayogam\nRaghu Kalam: 3.32 PM to 5.08 PM\nYemakandam: 9.09 AM to 10.45 AM\nKuligai: 10.45 AM to 12.21 PM\nGood time: 7.33 AM to 9.09 AM and 3.32 PM to 5.08 PM\nSun Rise: 5.58 AM\nSun Set: 6.44 PM\nChandhirashtamam: Dhanus\nSoolam: North\nPrayatchittham: Milk / Paal\nSradhdhathithi: Chadhurdasi\nLocation: Hyderabad\, India
SUMMARY:Aadi - 25 (11.08.2026) Tuesday
UID:india-2026-08-11@panchangam
END:VEVENT
BEGIN:VEVENT
DTSTART;VALUE=DATE:20260921
DESCRIPTION:Purattasi - 04 (21.09.2026) Monday\n\nYear: Parabhava Varudam (Parabhava Nama Samvathsaram)\nAyanam: Dhatchinayanam\nRuthu: Varsha Ruthu\nMonth: Purattasi Masam (Kanni Masam)\nPaksham: Shukla Paksham\nThithi: upto 8.01 PM Dashami\, thereafter Ekadashi\nDay: {Soma Vasaram} Monday\nNakshatthiram: Uthiradam\nYogam: Shobhana\nKaranam: Thaitilai\nAmirthathiyogam: Siddha Yogam\nSubayogam: Subayogam\nRaghu Kalam: 7.35 AM to 9.06 AM\nYemakandam: 10.38 AM to 12.09 PM\nKuligai: 12.09 PM to 1.40 PM\nGood time: 6.04 AM to 7.35 AM and 12.09 PM to 1.40 PM\nSun Rise: 6.04 AM\nSun Set: 6.13 PM\nChandhirashtamam: Rishabam\nSoolam: East\nPrayatchittham: Curd / Thayir\nSradhdhathithi: Dashami\nLocation: Hyderabad\, India
SUMMARY:Purattasi - 04 (21.09.2026) Monday
UID:india-2026-09-21@panchangam
END:VEVENT
BEGIN:VEVENT
DTSTART;VALUE=DATE:20261005
DESCRIPTION:Purattasi - 18 (05.10.2026) Monday\n\nYear: Parabhava Varudam (Parabhava Nama Samvathsaram)\nAyanam: Dhatchinayanam\nRuthu: Varsha Ruthu\nMonth: Purattasi Masam (Kanni Masam)\nPaksham: Krushna Paksham\nThithi: upto 2.08 AM Dashami\, thereafter Ekadashi\nDay: {Soma Vasaram} Monday\nNakshatthiram: upto 11.48 PM Poosam\, and then Aayilyam\nYogam: Shiva\nKaranam: Vanijai\nAmirthathiyogam: Siddha Yogam\nSubayogam: Subayogam\nRaghu Kalam: 7.36 AM to 9.05 AM\nYemakandam: 10.35 AM to 12.04 PM\nKuligai: 12.04 PM to 1.33 PM\nGood time: 6.06 AM to 7.36 AM and 12.04 PM to 1.33 PM\nSun Rise: 6.06 AM\nSun Set: 6.01 PM\nChandhirashtamam: Dhanus\nSoolam: East\nPrayatchittham: Curd / Thayir\nSradhdhathithi: Dashami\nLocation: Hyderabad\, India
SUMMARY:Purattasi - 18 (05.10.2026) Monday
UID:india-2026-10-05@panchangam
END:VEVENT
BEGIN:VEVENT
DTSTART;VALUE=DATE:20261115
DESCRIPTION:Aippasi - 29 (15.11.2026) Sunday\n\nYear: Parabhava Varudam (Parabhava Nama Samvathsaram)\nAyanam: Dhatchinayanam\nRuthu: Sarath Ruthu\nMonth: Aippasi Masam (Thulam Masam)\nPaksham: Shukla Paksham\nThithi: upto 2.01 AM Shashti\, thereafter Saptami\nDay: {Ravi Vasaram} Sunday\nNakshatthiram: upto 12.14 AM Uthiradam\, and then Thiruvonam\nYogam: Shoola\nKaranam: Kaulavai\nAmirthathiyogam: Siddha Yogam\nSubayogam: Subayogam\nRaghu Kalam: 4.15 PM to 5.40 PM\nYemakandam: 12 Noon to 1.25 PM\nKuligai: 1.25 PM to 2.50 PM\nGood time: 6.20 AM to 7.45 AM and 12 Noon to 1.25 PM\nSun Rise: 6.20 AM\nSun Set: 5.40 PM\nChandhirashtamam: Mithunam\nSoolam: West\nPrayatchittham: Jaggery / Vellam\nSradhdhathithi: Shashti\nLocation: Hyderabad\, India
SUMMARY:Aippasi - 29 (15.11.2026) Sunday
UID:india-2026-11-15@panchangam
END:VEVENT
BEGIN:VEVENT
DTSTART;VALUE=DATE:20261225
DESCRIPTION:Margazhi - 09 (25.12.2026) Friday\n\nYear: Parabhava Varudam (Parabhava Nama Samvathsaram)\nAyanam: Utharayanam\nRuthu: Hemantha Ruthu\nMonth: Margazhi Masam (Dhanus Masam)\nPaksham: Krushna Paksham\nThithi: upto 11.26 PM Dwitiyai\, thereafter Tritiyai\nDay: {Sukra Vasaram} Friday\nNakshatthiram: upto 11.26 PM Punarpoosam\, and then Poosam\nYogam: Brahma\nKaranam: Thaitilai\nAmirthathiyogam: Siddha Yogam\nSubayogam: Subayogam\nRaghu Kalam: 10.52 AM to 12.15 PM\nYemakandam: 3.02 PM to 4.25 PM\nKuligai: 6.43 AM to 8.06 AM\nGood time: 6.43 AM to 8.06 AM and 12.15 PM to 1.39 PM\nSun Rise: 6.43 AM\nSun Set: 5.48 PM\nChandhirashtamam: Virutchigam\nSoolam: West\nPrayatchittham: Jaggery / Vellam\nSradhdhathithi: Dwitiyai\nLocation: Hyderabad\, India
SUMMARY:Margazhi - 09 (25.12.2026) Friday
UID:india-2026-12-25@panchangam
END:VEVENT
BEGIN:VEVENT
DTSTART;VALUE=DATE:20260110
DESCRIPTION:Margazhi - 19 (10.01.2026) Saturday\n\nYear: Vishvavasu Varudam (Vishvavasu Nama Samvathsaram)\nAyanam: Utharayanam\nRuthu: Hemantha Ruthu\nMonth: Margazhi Masam (Dhanus Masam)\nPaksham: Krushna Paksham\nThithi: upto 8.24 AM Saptami\, thereafter Ashtami\nDay: {Sani Vasaram} Saturday\nNakshatthiram: upto 4.22 PM Hastham\, and then Chitthirai\nYogam: Atiganda\nKaranam: Bavai\nAmirthathiyogam: Marana Yogam\nSubayogam: \nRaghu Kalam: 9.36 AM to 10.59 AM\nYemakandam: 1.47 PM to 3.10 PM\nKuligai: 3.10 PM to 4.34 PM\nGood time: 9.36 AM to 10.59 AM and 1.47 PM to 3.10 PM\nSun Rise: 6.48 AM\nSun Set: 5.58 PM\nChandhirashtamam: Kumbham\nSoolam: East\nPrayatchittham: Curd / Thayir\nSradhdhathithi: Ashtami\nLocation: Hyderabad\, India
SUMMARY:Margazhi - 19 (10.01.2026) Saturday
UID:india-2026-01-10@panchangam
END:VEVENT
BEGIN:VEVENT
DTSTART;VALUE=DATE:20260220
DESCRIPTION:Maasi - 07 (20.02.2026) Friday\n\nYear: Vishvavasu Varudam (Vishvavasu Nama Samvathsaram)\nAyanam: Utharayanam\nRuthu: Shishira Ruthu\nMonth: Maasi Masam (Kumbham Masam)\nPaksham: Shukla Paksham\nThithi: upto 2.38 PM Tritiyai\, thereafter Chathurthi\nDay: {Sukra Vasaram} Friday\nNakshatthiram: upto 8.45 PM Uthirattathi\, and then Revathi\nYogam: Sadhya\nKaranam: Garajai\nAmirthathiyogam: Siddha Yogam\nSubayogam: Subayogam\nRaghu Kalam: 11.02 AM to 12.29 PM\nYemakandam: 3.24 PM to 4.52 PM\nKuligai: 6.40 AM to 8.07 AM\nGood time: 6.40 AM to 8.07 AM and 12.29 PM to 1.57 PM\nSun Rise: 6.40 AM\nSun Set: 6.19 PM\nChandhirashtamam: Simham\nSoolam: West\nPrayatchittham: Jaggery / Vellam\nSradhdhathithi: Chathurthi\nLocation: Hyderabad\, India
SUMMARY:Maasi - 07 (20.02.2026) Friday
UID:india-2026-02-20@panchangam
END:VEVENT
BEGIN:VEVENT
DTSTART;VALUE=DATE:20260330
DESCRIPTION:Panguni - 15 (30.03.2026) Monday\n\nYear: Vishvavasu Varudam (Vishvavasu Nama Samvathsaram)\nAyanam: Utharayanam\nRuthu: Shishira Ruthu\nMonth: Panguni Masam (Meenam Masam)\nPaksham: Shukla Paksham\nThithi: upto 7.10 AM Dwadashi\, thereafter Trayodashi\nDay: {Soma Vasaram} Monday\nNakshatthiram: upto 3.28 PM Magam\, and then Pooram\nYogam: Shoola\nKaranam: Balavai\nAmirthathiyogam: Siddha Yogam\nSubayogam: Subayogam\nRaghu Kalam: 7.44 AM to 9.16 AM\nYemakandam: 10.48 AM to 12.20 PM\nKuligai: 12.20 PM to 1.52 PM\nGood time: 6.12 AM to 7.44 AM and 12.20 PM to 1.52 PM\nSun Rise: 6.12 AM\nSun Set: 6.28 PM\nChandhirashtamam: Makaram\nSoolam: East\nPrayatchittham: Curd / Thayir\nSradhdhathithi: Trayodashi\nLocation: Hyderabad\, India
SUMMARY:Panguni - 15 (30.03.2026) Monday
UID:india-2026-03-30@panchangam
END:VEVENT
BEGIN:VEVENT
DTSTART;VALUE=DATE:20260209
DESCRIPTION:Thai - 26 (09.02.2026) Monday\n\nYear: Vishvavasu Varudam (Vishvavasu Nama Samvathsaram)\nAyanam: Utharayanam\nRuthu: Hemantha Ruthu\nMonth: Thai Masam (Makaram Masam)\nPaksham: Krushna Paksham\nThithi: Ashtami\nDay: {Soma Vasaram} Monday\nNakshatthiram: Visakam\nYogam: Vriddhi\nKaranam: Balavai\nAmirthathiyogam: Siddha Yogam\nSubayogam: Subayogam\nRaghu Kalam: 8.11 AM to 9.37 AM\nYemakandam: 11.04 AM to 12.30 PM\nKuligai: 12.30 PM to 1.56 PM\nGood time: 6.45 AM to 8.11 AM and 12.30 PM to 1.56 PM\nSun Rise: 6.45 AM\nSun Set: 6.15 PM\nChandhirashtamam: Meenam\nSoolam: East\nPrayatchittham: Curd / Thayir\nSradhdhathithi: Ashtami\nLocation: Hyderabad\, India
SUMMARY:Thai - 26 (09.02.2026) Monday
UID:india-2026-02-09@panchangam
END:VEVENT
BEGIN:VEVENT
DTSTART;VALUE=DATE:20260319
DESCRIPTION:Panguni - 04 (19.03.2026) Thursday\n\nYear: Vishvavasu Varudam (Vishvavasu Nama Samvathsaram)\nAyanam: Utharayanam\nRuthu: Shishira Ruthu\nMonth: Panguni Masam (Meenam Masam)\nPaksham: Krushna Paksham\nThithi: upto 6.53 AM Amavasai\, upto 4.52 AM Prathamai\, thereafter Dwitiyai\nDay: {Guru Vasaram} Thursday\nNakshatthiram: upto 4.42 AM Uthirattathi\, and then Revathi\nYogam: Shukla\nKaranam: Nagava\nAmirthathiyogam: Siddha Yogam\nSubayogam: Subayogam\nRaghu Kalam: 1.54 PM to 3.25 PM\nYemakandam: 6.21 AM to 7.51 AM\nKuligai: 7.51 AM to 9.22 AM\nGood time: 6.21 AM to 7.51 AM and 12.23 PM to 1.54 PM\nSun Rise: 6.21 AM\nSun Set: 6.26 PM\nChandhirashtamam: Simham\nSoolam: South\nPrayatchittham: Oil / Thailam\nSradhdhathithi: Prathamai\nLocation: Hyderabad\, India
SUMMARY:Panguni - 04 (19.03.2026) Thursday
UID:india-2026-03-19@panchangam
END:VEVENT
BEGIN:VEVENT
DTSTART;VALUE=DATE:20260429
DESCRIPTION:Chithirai - 15 (29.04.2026) Wednesday\n\nYear: Parabhava Varudam (Parabhava Nama Samvathsaram)\nAyanam: Utharayanam\nRuthu: Vasantha Ruthu\nMonth: Chithirai Masam (Mesham Masam)\nPaksham: Shukla Paksham\nThithi: upto 7.52 PM Trayodashi\, thereafter Chadhurdasi\nDay: {Budha Vasaram} Wednesday\nNakshatthiram: upto 12.59 AM Hastham\, and then Chitthirai\nYogam: Harshana\nKaranam: Kaulavai\nAmirthathiyogam: Siddha Yogam\nSubayogam: Subayogam\nRaghu Kalam: 12.13 PM to 1.49 PM\nYemakandam: 7.26 AM to 9.02 AM\nKuligai: 9.02 AM to 10.37 AM\nGood time: 5.51 AM to 7.26 AM and 1.49 PM to 3.24 PM\nSun Rise: 5.51 AM\nSun Set: 6.35 PM\nChandhirashtamam: Kumbham\nSoolam: North\nPrayatchittham: Milk / Paal\nSradhdhathithi: Trayodashi\nLocation: Hyderabad\, India
SUMMARY:Chithirai - 15 (29.04.2026) Wednesday
UID:india-2026-04-29@panchangam
END:VEVENT
BEGIN:VEVENT
DTSTART;VALUE=DATE:20260708
DESCRIPTION:Aani - 23 (08.07.2026) Wednesday\n\nYear: Parabhava Varudam (Parabhava Nama Samvathsaram)\nAyanam: Dhatchinayanam\nRuthu: Grishma Ruthu\nMonth: Aani Masam (Mithunam Masam)\nPaksham: Krushna Paksham\nThithi: upto 12.22 PM Ashtami\, thereafter Navami\nDay: {Budha Vasaram} Wednesday\nNakshatthiram: upto 4.39 PM Revathi\, and then Ashwini\nYogam: Atiganda\nKaranam: Kaulavai\nAmirthathiyogam: Siddha Yogam\nSubayogam: Subayogam\nRaghu Kalam: 12.21 PM to 1.59 PM\nYemakandam: 7.25 AM to 9.04 AM\nKuligai: 9.04 AM to 10.42 AM\nGood time: 5.47 AM to 7.25 AM and 1.59 PM to 3.37 PM\nSun Rise: 5.47 AM\nSun Set: 6.54 PM\nChandhirashtamam: Simham\nSoolam: North\nPrayatchittham: Milk / Paal\nSradhdhathithi: Navami\nLocation: Hyderabad\, India
SUMMARY:Aani - 23 (08.07.2026) Wednesday
UID:india-2026-07-08@panchangam
END:VEVENT
BEGIN:VEVENT
DTSTART;VALUE=DATE:20260818
DESCRIPTION:Aavani - 01 (18.08.2026) Tuesday\n\nYear: Parabhava Varudam (Parabhava Nama Samvathsaram)\nAyanam: Dhatchinayanam\nRuthu: Varsha Ruthu\nMonth: Aavani Masam (Simham Masam)\nPaksham: Shukla Paksham\nThithi: upto 5.51 PM Shashti\, thereafter Saptami\nDay: {Bhauma Vasaram} Tuesday\nNakshatthiram: Swathi\nYogam: Shukla\nKaranam: Thaitilai\nAmirthathiyogam: Siddha Yogam\nSubayogam: Subayogam\nRaghu Kalam: 3.29 PM to 5.05 PM\nYemakandam: 9.09 AM to 10.44 AM\nKuligai: 10.44 AM to 12.19 PM\nGood time: 7.34 AM to 9.09 AM and 3.29 PM to 5.05 PM\nSun Rise: 5.59 AM\nSun Set: 6.40 PM\nChandhirashtamam: Meenam\nSoolam: North\nPrayatchittham: Milk / Paal\nSradhdhathithi: Shashti\nLocation: Hyderabad\, India
SUMMARY:Aavani - 01 (18.08.2026) Tuesday
UID:india-2026-08-18@panchangam
END:VEVENT
BEGIN:VEVENT
DTSTART;VALUE=DATE:20260928
DESCRIPTION:Purattasi - 11 (28.09.2026) Monday\n\nYear: Parabhava Varudam (Parabhava Nama Samvathsaram)\nAyanam: Dhatchinayanam\nRuthu: Varsha Ruthu\nMonth: Purattasi Masam (Kanni Masam)\nPaksham: Krushna Paksham\nThithi: upto 7.14 PM Dwitiyai\, thereafter Tritiyai\nDay: {Soma Vasaram} Monday\nNakshatthiram: upto 10.55 AM Revathi\, and then Ashwini\nYogam: Dhruva\nKaranam: Thaitilai\nAmirthathiyogam: Siddha Yogam\nSubayogam: Subayogam\nRaghu Kalam: 7.36 AM to 9.06 AM\nYemakandam: 10.36 AM to 12.06 PM\nKuligai: 12.06 PM to 1.36 PM\nGood time: 6.05 AM to 7.36 AM and 12.06 PM to 1.36 PM\nSun Rise: 6.05 AM\nSun Set: 6.07 PM\nChandhirashtamam: Simham\nSoolam: East\nPrayatchittham: Curd / Thayir\nSradhdhathithi: Dwitiyai\nLocation: Hyderabad\, India
SUMMARY:Purattasi - 11 (28.09.2026) Monday
UID:india-2026-09-28@panchangam
END:VEVENT
BEGIN:VEVENT
DTSTART;VALUE=DATE:20261023
DESCRIPTION:Aippasi - 06 (23.10.2026) Friday\n\nYear: Parabhava Varudam (Parabhava Nama Samvathsaram)\nAyanam: Dhatchinayanam\nRuthu: Sarath Ruthu\nMonth: Aippasi Masam (Thulam Masam)\nPaksham: Shukla Paksham\nThithi: upto 2.36 PM Dwadashi\, thereafter Trayodashi\nDay: {Sukra Vasaram} Friday\nNakshatthiram: upto 9.43 PM Poorattathi\, and then Uthirattathi\nYogam: Dhruva\nKaranam: Balavai\nAmirthathiyogam: Siddha Yogam\nSubayogam: Subayogam\nRaghu Kalam: 10.33 AM to 12 Noon\nYemakandam: 2.54 PM to 4.22 PM\nKuligai: 6.11 AM to 7.38 AM\nGood time: 6.11 AM to 7.38 AM and 12 Noon to 1.27 PM\nSun Rise: 6.11 AM\nSun Set: 5.49 PM\nChandhirashtamam: Katakam\nSoolam: West\nPrayatchittham: Jaggery / Vellam\nSradhdhathithi: Dwadashi\nLocation: Hyderabad\, India
SUMMARY:Aippasi - 06 (23.10.2026) Friday
UID:india-2026-10-23@panchangam
END:VEVENT
BEGIN:VEVENT
DESCRIPTION:Exact Astronomical Duration (Hyderabad\, India)
DTEND:20260901T021224Z
DTSTART:20260831T032135Z
SUMMARY:Sankatahara Chathurthi
UID:india-202608310321-19@tithi
END:VEVENT
BEGIN:VEVENT
DTSTART;VALUE=DATE:20260117
DESCRIPTION:Thai - 03 (17.01.2026) Saturday\n\nYear: Vishvavasu Varudam (Vishvavasu Nama Samvathsaram)\nAyanam: Utharayanam\nRuthu: Hemantha Ruthu\nMonth: Thai Masam (Makaram Masam)\nPaksham: Krushna Paksham\nThithi: upto 12.04 AM Chadhurdasi\, thereafter Amavasai\nDay: {Sani Vasaram} Saturday\nNakshatthiram: upto 8.55 AM Moolam\, and then Pooradam\nYogam: Vyaghata\nKaranam: Vishti\nAmirthathiyogam: Siddha Yogam\nSubayogam: Subayogam\nRaghu Kalam: 9.37 AM to 11.01 AM\nYemakandam: 1.50 PM to 3.14 PM\nKuligai: 3.14 PM to 4.38 PM\nGood time: 9.37 AM to 11.01 AM and 1.50 PM to 3.14 PM\nSun Rise: 6.49 AM\nSun Set: 6.02 PM\nChandhirashtamam: Rishabam\nSoolam: East\nPrayatchittham: Curd / Thayir\nSradhdhathithi: Chadhurdasi\nLocation: Hyderabad\, India
SUMMARY:Thai - 03 (17.01.2026) Saturday
UID:india-2026-01-17@panchangam
END:VEVENT
BEGIN:VEVENT
DTSTART;VALUE=DATE:20260227
DESCRIPTION:Maasi - 14 (27.02.2026) Friday\n\nYear: Vishvavasu Varudam (Vishvavasu Nama Samvathsaram)\nAyanam: Utharayanam\nRuthu: Shishira Ruthu\nMonth: Maasi Masam (Kumbham Masam)\nPaksham: Shukla Paksham\nThithi: upto 10.33 PM Ekadashi\, thereafter Dwadashi\nDay: {Sukra Vasaram} Friday\nNakshatthiram: upto 11.26 AM Thiruvathirai\, and then Punarpoosam\nYogam: Aayushman\nKaranam: Vanijai\nAmirthathiyogam: Siddha Yogam\nSubayogam: Subayogam\nRaghu Kalam: 11.00 AM to 12.28 PM\nYemakandam: 3.25 PM to 4.53 PM\nKuligai: 6.35 AM to 8.04 AM\nGood time: 6.35 AM to 8.04 AM and 12.28 PM to 1.57 PM\nSun Rise: 6.35 AM\nSun Set: 6.21 PM\nChandhirashtamam: Virutchigam\nSoolam: West\nPrayatchittham: Jaggery / Vellam\nSradhdhathithi: Ekadashi\nLocation: Hyderabad\, India
SUMMARY:Maasi - 14 (27.02.2026) Friday
UID:india-2026-02-27@panchangam
END:VEVENT
BEGIN:VEVENT
DESCRIPTION:Exact Astronomical Duration (Hyderabad\, India)
DTEND:20260522T005503Z
DTSTART:20260521T025708Z
SUMMARY:Shukla Shashti
UID:india-202605210257-6@tithi
END:VEVENT
BEGIN:VEVENT
DTSTART;VALUE=DATE:20260506
DESCRIPTION:Chithirai - 22 (06.05.2026) Wednesday\n\nYear: Parabhava Varudam (Parabhava Nama Samvathsaram)\nAyanam: Utharayanam\nRuthu: Vasantha Ruthu\nMonth: Chithirai Masam (Mesham Masam)\nPaksham: Krushna Paksham\nThithi: upto 7.51 AM Chathurthi\, thereafter Panchami\nDay: {Budha Vasaram} Wednesday\nNakshatthiram: upto 4.38 PM Moolam\, and then Pooradam\nYogam: Siddha\nKaranam: Balavai\nAmirthathiyogam: Marana Yogam\nSubayogam: \nRaghu Kalam: 12.12 PM to 1.49 PM\nYemakandam: 7.24 AM to 9.00 AM\nKuligai: 9.00 AM to 10.36 AM\nGood time: 5.47 AM to 7.24 AM and 1.49 PM to 3.25 PM\nSun Rise: 5.47 AM\nSun Set: 6.37 PM\nChandhirashtamam: Rishabam\nSoolam: North\nPrayatchittham: Milk / Paal\nSradhdhathithi: Panchami\nLocation: Hyderabad\, India
SUMMARY:Chithirai - 22 (06.05.2026) Wednesday
UID:india-2026-05-06@panchangam
END:VEVENT
BEGIN:VEVENT
DTSTART;VALUE=DATE:20260616
DESCRIPTION:Aani - 01 (16.06.2026) Tuesday\n\nYear: Parabhava Varudam (Parabhava Nama Samvathsaram)\nAyanam: Utharayanam\nRuthu: Grishma Ruthu\nMonth: Aani Masam (Mithunam Masam)\nPaksham: Shukla Paksham\nThithi: upto 12.52 AM Dwitiyai\, thereafter Tritiyai\nDay: {Bhauma Vasaram} Tuesday\nNakshatthiram: upto 4.47 PM Thiruvathirai\, and then Punarpoosam\nYogam: Ganda\nKaranam: Balavai\nAmirthathiyogam: Siddha Yogam\nSubayogam: Subayogam\nRaghu Kalam: 3.34 PM to 5.12 PM\nYemakandam: 8.59 AM to 10.38 AM\nKuligai: 10.38 AM to 12.16 PM\nGood time: 7.20 AM to 8.59 AM and 3.34 PM to 5.12 PM\nSun Rise: 5.41 AM\nSun Set: 6.51 PM\nChandhirashtamam: Virutchigam\nSoolam: North\nPrayatchittham: Milk / Paal\nSradhdhathithi: Dwitiyai\nLocation: Hyderabad\, India
SUMMARY:Aani - 01 (16.06.2026) Tuesday
UID:india-2026-06-16@panchangam
END:VEVENT
BEGIN:VEVENT
DTSTART;VALUE=DATE:20260726
DESCRIPTION:Aadi - 09 (26.07.2026) Sunday\n\nYear: Parabhava Varudam (Parabhava Nama Samvathsaram)\nAyanam: Dhatchinayanam\nRuthu: Grishma Ruthu\nMonth: Aadi Masam (Katakam Masam)\nPaksham: Shukla Paksham\nThithi: upto 1.58 PM Dwadashi\, thereafter Trayodashi\nDay: {Ravi Vasaram} Sunday\nNakshatthiram: upto 8.19 AM Kettai\, and then Moolam\nYogam: Indra\nKaranam: Balavai\nAmirthathiyogam: Siddha Yogam\nSubayogam: Subayogam\nRaghu Kalam: 5.14 PM to 6.51 PM\nYemakandam: 12.22 PM to 1.59 PM\nKuligai: 1.59 PM to 3.37 PM\nGood time: 5.53 AM to 7.30 AM and 12.22 PM to 1.59 PM\nSun Rise: 5.53 AM\nSun Set: 6.51 PM\nChandhirashtamam: Mesham\nSoolam: West\nPrayatchittham: Jaggery / Vellam\nSradhdhathithi: Trayodashi\nLocation: Hyderabad\, India
SUMMARY:Aadi - 09 (26.07.2026) Sunday
UID:india-2026-07-26@panchangam
END:VEVENT
BEGIN:VEVENT
DTSTART;VALUE=DATE:20261210
DESCRIPTION:Karthigai - 24 (10.12.2026) Thursday\n\nYear: Parabhava Varudam (Parabhava Nama Samvathsaram)\nAyanam: Dhatchinayanam\nRuthu: Sarath Ruthu\nMonth: Karthigai Masam (Virutchigam Masam)\nPaksham: Shukla Paksham\nThithi: upto 8.46 AM Prathamai\, thereafter Dwitiyai\nDay: {Guru Vasaram} Thursday\nNakshatthiram: upto 12.44 AM Moolam\, and then Pooradam\nYogam: Shoola\nKaranam: Bavai\nAmirthathiyogam: Siddha Yogam\nSubayogam: Subayogam\nRaghu Kalam: 1.32 PM to 2.55 PM\nYemakandam: 6.35 AM to 7.58 AM\nKuligai: 7.58 AM to 9.21 AM\nGood time: 6.35 AM to 7.58 AM and 12.08 PM to 1.32 PM\nSun Rise: 6.35 AM\nSun Set: 5.42 PM\nChandhirashtamam: Rishabam\nSoolam: South\nPrayatchittham: Oil / Thailam\nSradhdhathithi: Dwitiyai\nLocation: Hyderabad\, India
SUMMARY:Karthigai - 24 (10.12.2026) Thursday
UID:india-2026-12-10@panchangam
END:VEVENT
BEGIN:VEVENT
DTSTART;VALUE=DATE:20260304
DESCRIPTION:Maasi - 19 (04.03.2026) Wednesday\n\nYear: Vishvavasu Varudam (Vishvavasu Nama Samvathsaram)\nAyanam: Utharayanam\nRuthu: Shishira Ruthu\nMonth: Maasi Masam (Kumbham Masam)\nPaksham: Krushna Paksham\nThithi: upto 4.49 PM Prathamai\, thereafter Dwitiyai\nDay: {Budha Vasaram} Wednesday\nNakshatthiram: upto 8.19 AM Pooram\, and then Uthiram\nYogam: Dhriti\nKaranam: Kaulavai\nAmirthathiyogam: Siddha Yogam\nSubayogam: Subayogam\nRaghu Kalam: 12.27 PM to 1.56 PM\nYemakandam: 8.01 AM to 9.30 AM\nKuligai: 9.30 AM to 10.59 AM\nGood time: 6.32 AM to 8.01 AM and 1.56 PM to 3.25 PM\nSun Rise: 6.32 AM\nSun Set: 6.23 PM\nChandhirashtamam: Makaram\nSoolam: North\nPrayatchittham: Milk / Paal\nSradhdhathithi: Prathamai\nLocation: Hyderabad\, India
SUMMARY:Maasi - 19 (04.03.2026) Wednesday
UID:india-2026-03-04@panchangam
END:VEVENT
BEGIN:VEVENT
DTSTART;VALUE=DATE:20260414
DESCRIPTION:Panguni - 30 (14.04.2026) Tuesday\n\nYear: Parabhava Varudam (Parabhava Nama Samvathsaram)\nAyanam: Utharayanam\nRuthu: Shishira Ruthu\nMonth: Panguni Masam (Meenam Masam)\nPaksham: Krushna Paksham\nThithi: upto 12.12 AM Dwadashi\, thereafter Trayodashi\nDay: {Bhauma Vasaram} Tuesday\nNakshatthiram: upto 4.45 PM Sathayam\, and then Poorattathi\nYogam: Shukla\nKaranam: Kaulavai\nAmirthathiyogam: Marana Yogam\nSubayogam: \nRaghu Kalam: 3.24 PM to 4.58 PM\nYemakandam: 9.08 AM to 10.42 AM\nKuligai: 10.42 AM to 12.16 PM\nGood time: 7.34 AM to 9.08 AM and 3.24 PM to 4.58 PM\nSun Rise: 6.01 AM\nSun Set: 6.31 PM\nChandhirashtamam: Katakam\nSoolam: North\nPrayatchittham: Milk / Paal\nSradhdhathithi: Dwadashi\nLocation: Hyderabad\, India
SUMMARY:Panguni - 30 (14.04.2026) Tuesday
UID:india-2026-04-14@panchangam
END:VEVENT
BEGIN:VEVENT
DTSTART;VALUE=DATE:20260524
DESCRIPTION:Vaikasi - 09 (24.05.2026) Sunday\n\nYear: Parabhava Varudam (Parabhava Nama Samvathsaram)\nAyanam: Utharayanam\nRuthu: Vasantha Ruthu\nMonth: Vaikasi Masam (Rishabam Masam)\nPaksham: Shukla Paksham\nThithi: upto 4.31 AM Navami\, thereafter Dashami\nDay: {Ravi Vasaram} Sunday\nNakshatthiram: upto 3.32 AM Pooram\, and then Uthiram\nYogam: Vyaghata\nKaranam: Balavai\nAmirthathiyogam: Siddha Yogam\nSubayogam: Subayogam\nRaghu Kalam: 5.06 PM to 6.44 PM\nYemakandam: 12.12 PM to 1.50 PM\nKuligai: 1.50 PM to 3.28 PM\nGood time: 5.41 AM to 7.19 AM and 12.12 PM to 1.50 PM\nSun Rise: 5.41 AM\nSun Set: 6.44 PM\nChandhirashtamam: Makaram\nSoolam: West\nPrayatchittham: Jaggery / Vellam\nSradhdhathithi: Navami\nLocation: Hyderabad\, India
SUMMARY:Vaikasi - 09 (24.05.2026) Sunday
UID:india-2026-05-24@panchangam
END:VEVENT
BEGIN:VEVENT
DESCRIPTION:Exact Astronomical Duration (Hyderabad\, India)
DTEND:20260227T170319Z
DTSTART:20260226T190356Z
SUMMARY:Shukla Ekadasi
UID:india-202602261903-11@tithi
END:VEVENT
BEGIN:VEVENT
DTSTART;VALUE=DATE:20260803
DESCRIPTION:Aadi - 17 (03.08.2026) Monday\n\nYear: Parabhava Varudam (Parabhava Nama Samvathsaram)\nAyanam: Dhatchinayanam\nRuthu: Grishma Ruthu\nMonth: Aadi Masam (Katakam Masam)\nPaksham: Krushna Paksham\nThithi: upto 10.54 PM Panchami\, thereafter Shashti\nDay: {Soma Vasaram} Monday\nNakshatthiram: upto 10.40 PM Uthirattathi\, and then Revathi\nYogam: Sukarman\nKaranam: Kaulavai\nAmirthathiyogam: Siddha Yogam\nSubayogam: Subayogam\nRaghu Kalam: 7.32 AM to 9.09 AM\nYemakandam: 10.45 AM to 12.22 PM\nKuligai: 12.22 PM to 1.58 PM\nGood time: 5.55 AM to 7.32 AM and 12.22 PM to 1.58 PM\nSun Rise: 5.55 AM\nSun Set: 6.48 PM\nChandhirashtamam: Simham\nSoolam: East\nPrayatchittham: Curd / Thayir\nSradhdhathithi: Panchami\nLocation: Hyderabad\, India
SUMMARY:Aadi - 17 (03.08.2026) Monday
UID:india-2026-08-03@panchangam
END:VEVENT
BEGIN:VEVENT
DTSTART;VALUE=DATE:20260913
DESCRIPTION:Aavani - 27 (13.09.2026) Sunday\n\nYear: Parabhava Varudam (Parabhava Nama Samvathsaram)\nAyanam: Dhatchinayanam\nRuthu: Varsha Ruthu\nMonth: Aavani Masam (Simham Masam)\nPaksham: Shukla Paksham\nThithi: upto 7.08 AM Dwitiyai\, thereafter Tritiyai\nDay: {Ravi Vasaram} Sunday\nNakshatthiram: upto 1.48 PM Hastham\, and then Chitthirai\nYogam: Shukla\nKaranam: Kaulavai\nAmirthathiyogam: Amirtha Yogam\nSubayogam: Subayogam\nRaghu Kalam: 4.48 PM to 6.20 PM\nYemakandam: 12.11 PM to 1.43 PM\nKuligai: 1.43 PM to 3.15 PM\nGood time: 6.03 AM to 7.35 AM and 12.11 PM to 1.43 PM\nSun Rise: 6.03 AM\nSun Set: 6.20 PM\nChandhirashtamam: Kumbham\nSoolam: West\nPrayatchittham: Jaggery / Vellam\nSradhdhathithi: Tritiyai\nLocation: Hyderabad\, India
SUMMARY:Aavani - 27 (13.09.2026) Sunday
UID:india-2026-09-13@panchangam
END:VEVENT
BEGIN:VEVENT
DTSTART;VALUE=DATE:20261107
DESCRIPTION:Aippasi - 21 (07.11.2026) Saturday\n\nYear: Parabhava Varudam (Parabhava Nama Samvathsaram)\nAyanam: Dhatchinayanam\nRuthu: Sarath Ruthu\nMonth: Aippasi Masam (Thulam Masam)\nPaksham: Krushna Paksham\nThithi: upto 10.48 AM Trayodashi\, thereafter Chadhurdasi\nDay: {Sani Vasaram} Saturday\nNakshatthiram: Chitthirai\nYogam: Priti\nKaranam: Vanijai\nAmirthathiyogam: Siddha Yogam\nSubayogam: Subayogam\nRaghu Kalam: 9.08 AM to 10.33 AM\nYemakandam: 1.25 PM to 2.50 PM\nKuligai: 2.50 PM to 4.16 PM\nGood time: 9.08 AM to 10.33 AM and 1.25 PM to 2.50 PM\nSun Rise: 6.16 AM\nSun Set: 5.42 PM\nChandhirashtamam: Kumbham\nSoolam: East\nPrayatchittham: Curd / Thayir\nSradhdhathithi: Chadhurdasi\nLocation: Hyderabad\, India
SUMMARY:Aippasi - 21 (07.11.2026) Saturday
UID:india-2026-11-07@panchangam
END:VEVENT
BEGIN:VEVENT
DTSTART;VALUE=DATE:20261217
DESCRIPTION:Margazhi - 01 (17.12.2026) Thursday\n\nYear: Parabhava Varudam (Parabhava Nama Samvathsaram)\nAyanam: Dhatchinayanam\nRuthu: Hemantha Ruthu\nMonth: Margazhi Masam (Dhanus Masam)\nPaksham: Shukla Paksham\nThithi: upto 11.26 PM Ashtami\, thereafter Navami\nDay: {Guru Vasaram} Thursday\nNakshatthiram: upto 4.13 PM Poorattathi\, and then Uthirattathi\nYogam: Siddhi\nKaranam: Vishti\nAmirthathiyogam: Siddha Yogam\nSubayogam: Subayogam\nRaghu Kalam: 1.35 PM to 2.58 PM\nYemakandam: 6.39 AM to 8.02 AM\nKuligai: 8.02 AM to 9.25 AM\nGood time: 6.39 AM to 8.02 AM and 12.12 PM to 1.35 PM\nSun Rise: 6.39 AM\nSun Set: 5.44 PM\nChandhirashtamam: Katakam\nSoolam: South\nPrayatchittham: Oil / Thailam\nSradhdhathithi: Ashtami\nLocation: Hyderabad\, India
SUMMARY:Margazhi - 01 (17.12.2026) Thursday
UID:india-2026-12-17@panchangam
END:VEVENT
BEGIN:VEVENT
DTSTART;VALUE=DATE:20260102
DESCRIPTION:Margazhi - 11 (02.01.2026) Friday\n\nYear: Vishvavasu Varudam (Vishvavasu Nama Samvathsaram)\nAyanam: Utharayanam\nRuthu: Hemantha Ruthu\nMonth: Margazhi Masam (Dhanus Masam)\nPaksham: Shukla Paksham\nThithi: upto 6.53 PM Chadhurdasi\, thereafter Pournami\nDay: {Sukra Vasaram} Friday\nNakshatthiram: upto 8.38 PM Mrigashirsham\, and then Thiruvathirai\nYogam: Shukla\nKaranam: Garajai\nAmirthathiyogam: Siddha Yogam\nSubayogam: Subayogam\nRaghu Kalam: 10.56 AM to 12.20 PM\nYemakandam: 3.06 PM to 4.30 PM\nKuligai: 6.46 AM to 8.09 AM\nGood time: 6.46 AM to 8.09 AM and 12.20 PM to 1.43 PM\nSun Rise: 6.46 AM\nSun Set: 5.53 PM\nChandhirashtamam: Thulam\nSoolam: West\nPrayatchittham: Jaggery / Vellam\nSradhdhathithi: Chadhurdasi\nLocation: Hyderabad\, India
SUMMARY:Margazhi - 11 (02.01.2026) Friday
UID:india-2026-01-02@panchangam
END:VEVENT
BEGIN:VEVENT
DTSTART;VALUE=DATE:20260212
DESCRIPTION:Thai - 29 (12.02.2026) Thursday\n\nYear: Vishvavasu Varudam (Vishvavasu Nama Samvathsaram)\nAyanam: Utharayanam\nRuthu: Hemantha Ruthu\nMonth: Thai Masam (Makaram Masam)\nPaksham: Krushna Paksham\nThithi: upto 12.22 PM Dashami\, thereafter Ekadashi\nDay: {Guru Vasaram} Thursday\nNakshatthiram: upto 2.26 PM Kettai\, and then Moolam\nYogam: Harshana\nKaranam: Vishti\nAmirthathiyogam: Siddha Yogam\nSubayogam: Subayogam\nRaghu Kalam: 1.56 PM to 3.23 PM\nYemakandam: 6.44 AM to 8.10 AM\nKuligai: 8.10 AM to 9.37 AM\nGood time: 6.44 AM to 8.10 AM and 12.30 PM to 1.56 PM\nSun Rise: 6.44 AM\nSun Set: 6.16 PM\nChandhirashtamam: Mesham\nSoolam: South\nPrayatchittham: Oil / Thailam\nSradhdhathithi: Ekadashi\nLocation: Hyderabad\, India
SUMMARY:Thai - 29 (12.02.2026) Thursday
UID:india-2026-02-12@panchangam
END:VEVENT
BEGIN:VEVENT
DTSTART;VALUE=DATE:20260322
DESCRIPTION:Panguni - 07 (22.03.2026) Sunday\n\nYear: Vishvavasu Varudam (Vishvavasu Nama Samvathsaram)\nAyanam: Utharayanam\nRuthu: Shishira Ruthu\nMonth: Panguni Masam (Meenam Masam)\nPaksham: Shukla Paksham\nThithi: upto 9.17 PM Chathurthi\, thereafter Panchami\nDay: {Ravi Vasaram} Sunday\nNakshatthiram: upto 11.19 PM Bharani\, and then Karthigai\nYogam: Vaidhriti\nKaranam: Vanijai\nAmirthathiyogam: Marana Yogam\nSubayogam: \nRaghu Kalam: 4.56 PM to 6.27 PM\nYemakandam: 12.23 PM to 1.54 PM\nKuligai: 1.54 PM to 3.25 PM\nGood time: 6.18 AM to 7.49 AM and 12.23 PM to 1.54 PM\nSun Rise: 6.18 AM\nSun Set: 6.27 PM\nChandhirashtamam: Kanni\nSoolam: West\nPrayatchittham: Jaggery / Vellam\nSradhdhathithi: Chathurthi\nLocation: Hyderabad\, India
SUMMARY:Panguni - 07 (22.03.2026) Sunday
UID:india-2026-03-22@panchangam
END:VEVENT
BEGIN:VEVENT
DTSTART;VALUE=DATE:20260601
DESCRIPTION:Vaikasi - 17 (01.06.2026) Monday\n\nYear: Parabhava Varudam (Parabhava Nama Samvathsaram)\nAyanam: Utharayanam\nRuthu: Vasantha Ruthu\nMonth: Vaikasi Masam (Rishabam Masam)\nPaksham: Krushna Paksham\nThithi: upto 4.37 PM Prathamai\, thereafter Dwitiyai\nDay: {Soma Vasaram} Monday\nNakshatthiram: upto 7.53 PM Kettai\, and then Moolam\nYogam: Siddha\nKaranam: Kaulavai\nAmirthathiyogam: Siddha Yogam\nSubayogam: Subayogam\nRaghu Kalam: 7.19 AM to 8.57 AM\nYemakandam: 10.35 AM to 12.13 PM\nKuligai: 12.13 PM to 1.52 PM\nGood time: 5.40 AM to 7.19 AM and 12.13 PM to 1.52 PM\nSun Rise: 5.40 AM\nSun Set: 6.46 PM\nChandhirashtamam: Mesham\nSoolam: East\nPrayatchittham: Curd / Thayir\nSradhdhathithi: Prathamai\nLocation: Hyderabad\, India
SUMMARY:Vaikasi - 17 (01.06.2026) Monday
UID:india-2026-06-01@panchangam
END:VEVENT
BEGIN:VEVENT
DTSTART;VALUE=DATE:20260711
DESCRIPTION:Aani - 26 (11.07.2026) Saturday\n\nYear: Parabhava Varudam (Parabhava Nama Samvathsaram)\nAyanam: Dhatchinayanam\nRuthu: Grishma Ruthu\nMonth: Aani Masam (Mithunam Masam)\nPaksham: Krushna Paksham\nThithi: upto 2.04 AM Dwadashi\, thereafter Trayodashi\nDay: {Sani Vasaram} Saturday\nNakshatthiram: upto 11.39 AM Karthigai\, and then Rohini\nYogam: Ganda\nKaranam: Kaulavai\nAmirthathiyogam: Siddha Yogam\nSubayogam: Subayogam\nRaghu Kalam: 9.04 AM to 10.43 AM\nYemakandam: 1.59 PM to 3.38 PM\nKuligai: 3.38 PM to 5.16 PM\nGood time: 9.04 AM to 10.43 AM and 1.59 PM to 3.38 PM\nSun Rise: 5.48 AM\nSun Set: 6.54 PM\nChandhirashtamam: Thulam\nSoolam: East\nPrayatchittham: Curd / Thayir\nSradhdhathithi: Dwadashi\nLocation: Hyderabad\, India
SUMMARY:Aani - 26 (11.07.2026) Saturday
UID:india-2026-07-11@panchangam
END:VEVENT
BEGIN:VEVENT
DTSTART;VALUE=DATE:20260821
DESCRIPTION:Aavani - 04 (21.08.2026) Friday\n\nYear: Parabhava Varudam (Parabhava Nama Samvathsaram)\nAyanam: Dhatchinayanam\nRuthu: Varsha Ruthu\nMonth: Aavani Masam (Simham Masam)\nPaksham: Shukla Paksham\nThithi: upto 11.36 PM Navami\, thereafter Dashami\nDay: {Sukra Vasaram} Friday\nNakshatthiram: upto 12.38 PM Anusham\, and then Kettai\nYogam: Vaidhriti\nKaranam: Balavai\nAmirthathiyogam: Siddha Yogam\nSubayogam: Subayogam\nRaghu Kalam: 10.44 AM to 12.19 PM\nYemakandam: 3.28 PM to 5.03 PM\nKuligai: 6.00 AM to 7.34 AM\nGood time: 6.00 AM to 7.34 AM and 12.19 PM to 1.53 PM\nSun Rise: 6.00 AM\nSun Set: 6.38 PM\nChandhirashtamam: Mesham\nSoolam: West\nPrayatchittham: Jaggery / Vellam\nSradhdhathithi: Navami\nLocation: Hyderabad\, India
SUMMARY:Aavani - 04 (21.08.2026) Friday
UID:india-2026-08-21@panchangam
END:VEVENT
BEGIN:VEVENT
DESCRIPTION:Exact Astronomical Duration (Hyderabad\, India)
DTEND:20260422T172004Z
DTSTART:20260421T195020Z
SUMMARY:Shukla Shashti
UID:india-202604211950-6@tithi
END:VEVENT
BEGIN:VEVENT
DTSTART;VALUE=DATE:20261015
DESCRIPTION:Purattasi - 28 (15.10.2026) Thursday\n\nYear: Parabhava Varudam (Parabhava Nama Samvathsaram)\nAyanam: Dhatchinayanam\nRuthu: Varsha Ruthu\nMonth: Purattasi Masam (Kanni Masam)\nPaksham: Shukla Paksham\nThithi: upto 3.25 AM Panchami\, thereafter Shashti\nDay: {Guru Vasaram} Thursday\nNakshatthiram: Kettai\nYogam: Saubhagya\nKaranam: Bavai\nAmirthathiyogam: Siddha Yogam\nSubayogam: Subayogam\nRaghu Kalam: 1.29 PM to 2.58 PM\nYemakandam: 6.09 AM to 7.37 AM\nKuligai: 7.37 AM to 9.05 AM\nGood time: 6.09 AM to 7.37 AM and 12.01 PM to 1.29 PM\nSun Rise: 6.09 AM\nSun Set: 5.54 PM\nChandhirashtamam: Mesham\nSoolam: South\nPrayatchittham: Oil / Thailam\nSradhdhathithi: Panchami\nLocation: Hyderabad\, India
SUMMARY:Purattasi - 28 (15.10.2026) Thursday
UID:india-2026-10-15@panchangam
END:VEVENT
BEGIN:VEVENT
DTSTART;VALUE=DATE:20261125
DESCRIPTION:Karthigai - 09 (25.11.2026) Wednesday\n\nYear: Parabhava Varudam (Parabhava Nama Samvathsaram)\nAyanam: Dhatchinayanam\nRuthu: Sarath Ruthu\nMonth: Karthigai Masam (Virutchigam Masam)\nPaksham: Krushna Paksham\nThithi: upto 4.50 PM Prathamai\, thereafter Dwitiyai\nDay: {Budha Vasaram} Wednesday\nNakshatthiram: upto 9.12 PM Rohini\, and then Mrigashirsham\nYogam: Shiva\nKaranam: Balavai\nAmirthathiyogam: Siddha Yogam\nSubayogam: Subayogam\nRaghu Kalam: 12.02 PM to 1.27 PM\nYemakandam: 7.50 AM to 9.14 AM\nKuligai: 9.14 AM to 10.38 AM\nGood time: 6.26 AM to 7.50 AM and 1.27 PM to 2.51 PM\nSun Rise: 6.26 AM\nSun Set: 5.39 PM\nChandhirashtamam: Thulam\nSoolam: North\nPrayatchittham: Milk / Paal\nSradhdhathithi: Prathamai\nLocation: Hyderabad\, India
SUMMARY:Karthigai - 09 (25.11.2026) Wednesday
UID:india-2026-11-25@panchangam
END:VEVENT
BEGIN:VEVENT
DTSTART;VALUE=DATE:20260120
DESCRIPTION:Thai - 06 (20.01.2026) Tuesday\n\nYear: Vishvavasu Varudam (Vishvavasu Nama Samvathsaram)\nAyanam: Utharayanam\nRuthu: Hemantha Ruthu\nMonth: Thai Masam (Makaram Masam)\nPaksham: Shukla Paksham\nThithi: upto 2.43 AM Dwitiyai\, thereafter Tritiyai\nDay: {Bhauma Vasaram} Tuesday\nNakshatthiram: upto 1.48 PM Thiruvonam\, and then Avittam\nYogam: Siddhi\nKaranam: Balavai\nAmirthathiyogam: Siddha Yogam\nSubayogam: Subayogam\nRaghu Kalam: 3.15 PM to 4.40 PM\nYemakandam: 9.38 AM to 11.02 AM\nKuligai: 11.02 AM to 12.27 PM\nGood time: 8.13 AM to 9.38 AM and 3.15 PM to 4.40 PM\nSun Rise: 6.49 AM\nSun Set: 6.04 PM\nChandhirashtamam: Mithunam\nSoolam: North\nPrayatchittham: Milk / Paal\nSradhdhathithi: Dwitiyai\nLocation: Hyderabad\, India
SUMMARY:Thai - 06 (20.01.2026) Tuesday
UID:india-2026-01-20@panchangam
END:VEVENT
BEGIN:VEVENT
DTSTART;VALUE=DATE:20260109
DESCRIPTION:Margazhi - 18 (09.01.2026) Friday\n\nYear: Vishvavasu Varudam (Vishvavasu Nama Samvathsaram)\nAyanam: Utharayanam\nRuthu: Hemantha Ruthu\nMonth: Margazhi Masam (Dhanus Masam)\nPaksham: Krushna Paksham\nThithi: upto 7.05 AM Shashti\, thereafter Saptami\nDay: {Sukra Vasaram} Friday\nNakshatthiram: upto 2.22 PM Uthiram\, and then Hastham\nYogam: Shobhana\nKaranam: Vanijai\nAmirthathiyogam: Siddha Yogam\nSubayogam: Subayogam\nRaghu Kalam: 10.59 AM to 12.23 PM\nYemakandam: 3.10 PM to 4.34 PM\nKuligai: 6.48 AM to 8.12 AM\nGood time: 6.48 AM to 8.12 AM and 12.23 PM to 1.46 PM\nSun Rise: 6.48 AM\nSun Set: 5.57 PM\nChandhirashtamam: Kumbham\nSoolam: West\nPrayatchittham: Jaggery / Vellam\nSradhdhathithi: Saptami\nLocation: Hyderabad\, India
SUMMARY:Margazhi - 18 (09.01.2026) Friday
UID:india-2026-01-09@panchangam
END:VEVENT
BEGIN:VEVENT
DTSTART;VALUE=DATE:20260219
DESCRIPTION:Maasi - 06 (19.02.2026) Thursday\n\nYear: Vishvavasu Varudam (Vishvavasu Nama Samvathsaram)\nAyanam: Utharayanam\nRuthu: Shishira Ruthu\nMonth: Maasi Masam (Kumbham Masam)\nPaksham: Shukla Paksham\nThithi: upto 3.59 PM Dwitiyai\, thereafter Tritiyai\nDay: {Guru Vasaram} Thursday\nNakshatthiram: upto 9.30 PM Poorattathi\, and then Uthirattathi\nYogam: Siddha\nKaranam: Kaulavai\nAmirthathiyogam: Siddha Yogam\nSubayogam: Subayogam\nRaghu Kalam: 1.57 PM to 3.24 PM\nYemakandam: 6.40 AM to 8.08 AM\nKuligai: 8.08 AM to 9.35 AM\nGood time: 6.40 AM to 8.08 AM and 12.29 PM to 1.57 PM\nSun Rise: 6.40 AM\nSun Set: 6.19 PM\nChandhirashtamam: Katakam\nSoolam: South\nPrayatchittham: Oil / Thailam\nSradhdhathithi: Dwitiyai\nLocation: Hyderabad\, India
SUMMARY:Maasi - 06 (19.02.2026) Thursday
UID:india-2026-02-19@panchangam
END:VEVENT
BEGIN:VEVENT
DTSTART;VALUE=DATE:20260329
DESCRIPTION:Panguni - 14 (29.03.2026) Sunday\n\nYear: Vishvavasu Varudam (Vishvavasu Nama Samvathsaram)\nAyanam: Utharayanam\nRuthu: Shishira Ruthu\nMonth: Panguni Masam (Meenam Masam)\nPaksham: Shukla Paksham\nThithi: upto 7.46 AM Ekadashi\, thereafter Dwadashi\nDay: {Ravi Vasaram} Sunday\nNakshatthiram: upto 3.17 PM Aayilyam\, and then Magam\nYogam: Dhriti\nKaranam: Vishti\nAmirthathiyogam: Siddha Yogam\nSubayogam: Subayogam\nRaghu Kalam: 4.56 PM to 6.28 PM\nYemakandam: 12.20 PM to 1.52 PM\nKuligai: 1.52 PM to 3.24 PM\nGood time: 6.13 AM to 7.45 AM and 12.20 PM to 1.52 PM\nSun Rise: 6.13 AM\nSun Set: 6.28 PM\nChandhirashtamam: Dhanus\nSoolam: West\nPrayatchittham: Jaggery / Vellam\nSradhdhathithi: Dwadashi\nLocation: Hyderabad\, India
SUMMARY:Panguni - 14 (29.03.2026) Sunday
UID:india-2026-03-29@panchangam
END:VEVENT
BEGIN:VEVENT
DTSTART;VALUE=DATE:20251225
DESCRIPTION:Margazhi - 03 (25.12.2025) Thursday\n\nYear: Vishvavasu Varudam (Vishvavasu Nama Samvathsaram)\nAyanam: Utharayanam\nRuthu: Hemantha Ruthu\nMonth: Margazhi Masam (Dhanus Masam)\nPaksham: Shukla Paksham\nThithi: upto 1.43 PM Panchami\, thereafter Shashti\nDay: {Guru Vasaram} Thursday\nNakshatthiram: upto 8.59 AM Avittam\, and then Sathayam\nYogam: Vajra\nKaranam: Balavai\nAmirthathiyogam: Siddha Yogam\nSubayogam: Subayogam\nRaghu Kalam: 1.39 PM to 3.02 PM\nYemakandam: 6.43 AM to 8.06 AM\nKuligai: 8.06 AM to 9.29 AM\nGood time: 6.43 AM to 8.06 AM and 12.16 PM to 1.39 PM\nSun Rise: 6.43 AM\nSun Set: 5.48 PM\nChandhirashtamam: Katakam\nSoolam: South\nPrayatchittham: Oil / Thailam\nSradhdhathithi: Shashti\nLocation: Hyderabad\, India
SUMMARY:Margazhi - 03 (25.12.2025) Thursday
UID:india-2025-12-25@panchangam
END:VEVENT
BEGIN:VEVENT
DTSTART;VALUE=DATE:20260608
DESCRIPTION:Vaikasi - 24 (08.06.2026) Monday\n\nYear: Parabhava Varudam (Parabhava Nama Samvathsaram)\nAyanam: Utharayanam\nRuthu: Vasantha Ruthu\nMonth: Vaikasi Masam (Rishabam Masam)\nPaksham: Krushna Paksham\nThithi: upto 3.24 AM Ashtami\, thereafter Navami\nDay: {Soma Vasaram} Monday\nNakshatthiram: upto 9.51 AM Sathayam\, and then Poorattathi\nYogam: Vishkambha\nKaranam: Balavai\nAmirthathiyogam: Siddha Yogam\nSubayogam: Subayogam\nRaghu Kalam: 7.19 AM to 8.58 AM\nYemakandam: 10.36 AM to 12.15 PM\nKuligai: 12.15 PM to 1.53 PM\nGood time: 5.40 AM to 7.19 AM and 12.15 PM to 1.53 PM\nSun Rise: 5.40 AM\nSun Set: 6.49 PM\nChandhirashtamam: Katakam\nSoolam: East\nPrayatchittham: Curd / Thayir\nSradhdhathithi: Ashtami\nLocation: Hyderabad\, India
SUMMARY:Vaikasi - 24 (08.06.2026) Monday
UID:india-2026-06-08@panchangam
END:VEVENT
BEGIN:VEVENT
DTSTART;VALUE=DATE:20260718
DESCRIPTION:Aadi - 01 (18.07.2026) Saturday\n\nYear: Parabhava Varudam (Parabhava Nama Samvathsaram)\nAyanam: Dhatchinayanam\nRuthu: Grishma Ruthu\nMonth: Aadi Masam (Katakam Masam)\nPaksham: Shukla Paksham\nThithi: upto 3.43 AM Panchami\, thereafter Shashti\nDay: {Sani Vasaram} Saturday\nNakshatthiram: upto 6.40 PM Pooram\, and then Uthiram\nYogam: Variyana\nKaranam: Bavai\nAmirthathiyogam: Marana Yogam\nSubayogam: \nRaghu Kalam: 9.06 AM to 10.44 AM\nYemakandam: 2.00 PM to 3.37 PM\nKuligai: 3.37 PM to 5.15 PM\nGood time: 9.06 AM to 10.44 AM and 2.00 PM to 3.37 PM\nSun Rise: 5.50 AM\nSun Set: 6.53 PM\nChandhirashtamam: Makaram\nSoolam: East\nPrayatchittham: Curd / Thayir\nSradhdhathithi: Panchami\nLocation: Hyderabad\, India
SUMMARY:Aadi - 01 (18.07.2026) Saturday
UID:india-2026-07-18@panchangam
END:VEVENT
BEGIN:VEVENT
DTSTART;VALUE=DATE:20260828
DESCRIPTION:Aavani - 11 (28.08.2026) Friday\n\nYear: Parabhava Varudam (Parabhava Nama Samvathsaram)\nAyanam: Dhatchinayanam\nRuthu: Varsha Ruthu\nMonth: Aavani Masam (Simham Masam)\nPaksham: Shukla Paksham\nThithi: upto 9.48 AM Pournami\, thereafter Prathamai\nDay: {Sukra Vasaram} Friday\nNakshatthiram: upto 3.54 AM Sathayam\, and then Poorattathi\nYogam: Atiganda\nKaranam: Bavai\nAmirthathiyogam: Siddha Yogam\nSubayogam: Subayogam\nRaghu Kalam: 10.43 AM to 12.17 PM\nYemakandam: 3.25 PM to 4.59 PM\nKuligai: 6.01 AM to 7.35 AM\nGood time: 6.01 AM to 7.35 AM and 12.17 PM to 1.51 PM\nSun Rise: 6.01 AM\nSun Set: 6.32 PM\nChandhirashtamam: Katakam\nSoolam: West\nPrayatchittham: Jaggery / Vellam\nSradhdhathithi: Prathamai\nLocation: Hyderabad\, India
SUMMARY:Aavani - 11 (28.08.2026) Friday
UID:india-2026-08-28@panchangam
END:VEVENT
BEGIN:VEVENT
DTSTART;VALUE=DATE:20261202
DESCRIPTION:Karthigai - 16 (02.12.2026) Wednesday\n\nYear: Parabhava Varudam (Parabhava Nama Samvathsaram)\nAyanam: Dhatchinayanam\nRuthu: Sarath Ruthu\nMonth: Karthigai Masam (Virutchigam Masam)\nPaksham: Krushna Paksham\nThithi: upto 10.52 PM Navami\, thereafter Dashami\nDay: {Budha Vasaram} Wednesday\nNakshatthiram: upto 9.36 AM Pooram\, and then Uthiram\nYogam: Vishkambha\nKaranam: Thaitilai\nAmirthathiyogam: Siddha Yogam\nSubayogam: Subayogam\nRaghu Kalam: 12.05 PM to 1.29 PM\nYemakandam: 7.54 AM to 9.17 AM\nKuligai: 9.17 AM to 10.41 AM\nGood time: 6.30 AM to 7.54 AM and 1.29 PM to 2.52 PM\nSun Rise: 6.30 AM\nSun Set: 5.40 PM\nChandhirashtamam: Makaram\nSoolam: North\nPrayatchittham: Milk / Paal\nSradhdhathithi: Navami\nLocation: Hyderabad\, India
SUMMARY:Karthigai - 16 (02.12.2026) Wednesday
UID:india-2026-12-02@panchangam
END:VEVENT
BEGIN:VEVENT
DTSTART;VALUE=DATE:20260127
DESCRIPTION:Thai - 13 (27.01.2026) Tuesday\n\nYear: Vishvavasu Varudam (Vishvavasu Nama Samvathsaram)\nAyanam: Utharayanam\nRuthu: Hemantha Ruthu\nMonth: Thai Masam (Makaram Masam)\nPaksham: Shukla Paksham\nThithi: upto 7.05 PM Navami\, thereafter Dashami\nDay: {Bhauma Vasaram} Tuesday\nNakshatthiram: upto 11.45 AM Bharani\, and then Karthigai\nYogam: Shubha\nKaranam: Balavai\nAmirthathiyogam: Siddha Yogam\nSubayogam: Subayogam\nRaghu Kalam: 3.18 PM to 4.43 PM\nYemakandam: 9.38 AM to 11.03 AM\nKuligai: 11.03 AM to 12.28 PM\nGood time: 8.13 AM to 9.38 AM and 3.18 PM to 4.43 PM\nSun Rise: 6.49 AM\nSun Set: 6.08 PM\nChandhirashtamam: Kanni\nSoolam: North\nPrayatchittham: Milk / Paal\nSradhdhathithi: Navami\nLocation: Hyderabad\, India
SUMMARY:Thai - 13 (27.01.2026) Tuesday
UID:india-2026-01-27@panchangam
END:VEVENT
BEGIN:VEVENT
DTSTART;VALUE=DATE:20260406
DESCRIPTION:Panguni - 22 (06.04.2026) Monday\n\nYear: Vishvavasu Varudam (Vishvavasu Nama Samvathsaram)\nAyanam: Utharayanam\nRuthu: Shishira Ruthu\nMonth: Panguni Masam (Meenam Masam)\nPaksham: Krushna Paksham\nThithi: upto 2.11 PM Chathurthi\, thereafter Panchami\nDay: {Soma Vasaram} Monday\nNakshatthiram: upto 3.41 AM Anusham\, and then Kettai\nYogam: Siddhi\nKaranam: Balavai\nAmirthathiyogam: Siddha Yogam\nSubayogam: Subayogam\nRaghu Kalam: 7.39 AM to 9.12 AM\nYemakandam: 10.45 AM to 12.18 PM\nKuligai: 12.18 PM to 1.51 PM\nGood time: 6.07 AM to 7.39 AM and 12.18 PM to 1.51 PM\nSun Rise: 6.07 AM\nSun Set: 6.30 PM\nChandhirashtamam: Mesham\nSoolam: East\nPrayatchittham: Curd / Thayir\nSradhdhathithi: Panchami\nLocation: Hyderabad\, India
SUMMARY:Panguni - 22 (06.04.2026) Monday
UID:india-2026-04-06@panchangam
END:VEVENT
BEGIN:VEVENT
DTSTART;VALUE=DATE:20260516
DESCRIPTION:Vaikasi - 01 (16.05.2026) Saturday\n\nYear: Parabhava Varudam (Parabhava Nama Samvathsaram)\nAyanam: Utharayanam\nRuthu: Vasantha Ruthu\nMonth: Vaikasi Masam (Rishabam Masam)\nPaksham: Krushna Paksham\nThithi: upto 1.31 AM Amavasai\, thereafter Prathamai\nDay: {Sani Vasaram} Saturday\nNakshatthiram: upto 6.05 PM Bharani\, and then Karthigai\nYogam: Saubhagya\nKaranam: Chatushpada\nAmirthathiyogam: Siddha Yogam\nSubayogam: Subayogam\nRaghu Kalam: 8.58 AM to 10.35 AM\nYemakandam: 1.49 PM to 3.26 PM\nKuligai: 3.26 PM to 5.03 PM\nGood time: 8.58 AM to 10.35 AM and 1.49 PM to 3.26 PM\nSun Rise: 5.43 AM\nSun Set: 6.41 PM\nChandhirashtamam: Kanni\nSoolam: East\nPrayatchittham: Curd / Thayir\nSradhdhathithi: Amavasai\nLocation: Hyderabad\, India
SUMMARY:Vaikasi - 01 (16.05.2026) Saturday
UID:india-2026-05-16@panchangam
END:VEVENT
BEGIN:VEVENT
DTSTART;VALUE=DATE:20260626
DESCRIPTION:Aani - 11 (26.06.2026) Friday\n\nYear: Parabhava Varudam (Parabhava Nama Samvathsaram)\nAyanam: Dhatchinayanam\nRuthu: Grishma Ruthu\nMonth: Aani Masam (Mithunam Masam)\nPaksham: Shukla Paksham\nThithi: upto 10.22 PM Dwadashi\, thereafter Trayodashi\nDay: {Sukra Vasaram} Friday\nNakshatthiram: upto 8.00 PM Visakam\, and then Anusham\nYogam: Siddha\nKaranam: Bavai\nAmirthathiyogam: Siddha Yogam\nSubayogam: Subayogam\nRaghu Kalam: 10.40 AM to 12.18 PM\nYemakandam: 3.36 PM to 5.15 PM\nKuligai: 5.43 AM to 7.22 AM\nGood time: 5.43 AM to 7.22 AM and 12.18 PM to 1.57 PM\nSun Rise: 5.43 AM\nSun Set: 6.53 PM\nChandhirashtamam: Meenam\nSoolam: West\nPrayatchittham: Jaggery / Vellam\nSradhdhathithi: Dwadashi\nLocation: Hyderabad\, India
SUMMARY:Aani - 11 (26.06.2026) Friday
UID:india-2026-06-26@panchangam
END:VEVENT
BEGIN:VEVENT
DTSTART;VALUE=DATE:20260905
DESCRIPTION:Aavani - 19 (05.09.2026) Saturday\n\nYear: Parabhava Varudam (Parabhava Nama Samvathsaram)\nAyanam: Dhatchinayanam\nRuthu: Varsha Ruthu\nMonth: Aavani Masam (Simham Masam)\nPaksham: Krushna Paksham\nThithi: upto 9.54 PM Navami\, thereafter Dashami\nDay: {Sani Vasaram} Saturday\nNakshatthiram: upto 10.08 PM Mrigashirsham\, and then Thiruvathirai\nYogam: Vajra\nKaranam: Thaitilai\nAmirthathiyogam: Siddha Yogam\nSubayogam: Subayogam\nRaghu Kalam: 9.08 AM to 10.41 AM\nYemakandam: 1.47 PM to 3.20 PM\nKuligai: 3.20 PM to 4.53 PM\nGood time: 9.08 AM to 10.41 AM and 1.47 PM to 3.20 PM\nSun Rise: 6.02 AM\nSun Set: 6.26 PM\nChandhirashtamam: Thulam\nSoolam: East\nPrayatchittham: Curd / Thayir\nSradhdhathithi: Navami\nLocation: Hyderabad\, India
SUMMARY:Aavani - 19 (05.09.2026) Saturday
UID:india-2026-09-05@panchangam
END:VEVENT
BEGIN:VEVENT
DTSTART;VALUE=DATE:20261110
DESCRIPTION:Aippasi - 24 (10.11.2026) Tuesday\n\nYear: Parabhava Varudam (Parabhava Nama Samvathsaram)\nAyanam: Dhatchinayanam\nRuthu: Sarath Ruthu\nMonth: Aippasi Masam (Thulam Masam)\nPaksham: Shukla Paksham\nThithi: upto 2.00 PM Prathamai\, thereafter Dwitiyai\nDay: {Bhauma Vasaram} Tuesday\nNakshatthiram: upto 10.03 AM Visakam\, and then Anusham\nYogam: Shobhana\nKaranam: Bavai\nAmirthathiyogam: Siddha Yogam\nSubayogam: Subayogam\nRaghu Kalam: 2.50 PM to 4.15 PM\nYemakandam: 9.09 AM to 10.34 AM\nKuligai: 10.34 AM to 11.59 AM\nGood time: 7.43 AM to 9.09 AM and 2.50 PM to 4.15 PM\nSun Rise: 6.18 AM\nSun Set: 5.41 PM\nChandhirashtamam: Mesham\nSoolam: North\nPrayatchittham: Milk / Paal\nSradhdhathithi: Dwitiyai\nLocation: Hyderabad\, India
SUMMARY:Aippasi - 24 (10.11.2026) Tuesday
UID:india-2026-11-10@panchangam
END:VEVENT
BEGIN:VEVENT
DTSTART;VALUE=DATE:20261220
DESCRIPTION:Margazhi - 04 (20.12.2026) Sunday\n\nYear: Parabhava Varudam (Parabhava Nama Samvathsaram)\nAyanam: Dhatchinayanam\nRuthu: Hemantha Ruthu\nMonth: Margazhi Masam (Dhanus Masam)\nPaksham: Shukla Paksham\nThithi: upto 8.15 PM Ekadashi\, thereafter Dwadashi\nDay: {Ravi Vasaram} Sunday\nNakshatthiram: upto 3.34 PM Ashwini\, and then Bharani\nYogam: Parigha\nKaranam: Vanijai\nAmirthathiyogam: Siddha Yogam\nSubayogam: Subayogam\nRaghu Kalam: 4.23 PM to 5.46 PM\nYemakandam: 12.13 PM to 1.36 PM\nKuligai: 1.36 PM to 2.59 PM\nGood time: 6.40 AM to 8.03 AM and 12.13 PM to 1.36 PM\nSun Rise: 6.40 AM\nSun Set: 5.46 PM\nChandhirashtamam: Kanni\nSoolam: West\nPrayatchittham: Jaggery / Vellam\nSradhdhathithi: Ekadashi\nLocation: Hyderabad\, India
SUMMARY:Margazhi - 04 (20.12.2026) Sunday
UID:india-2026-12-20@panchangam
END:VEVENT
BEGIN:VEVENT
DTSTART;VALUE=DATE:20261209
DESCRIPTION:Karthigai - 23 (09.12.2026) Wednesday\n\nYear: Parabhava Varudam (Parabhava Nama Samvathsaram)\nAyanam: Dhatchinayanam\nRuthu: Sarath Ruthu\nMonth: Karthigai Masam (Virutchigam Masam)\nPaksham: Shukla Paksham\nThithi: Prathamai\nDay: {Budha Vasaram} Wednesday\nNakshatthiram: upto 9.46 PM Kettai\, and then Moolam\nYogam: Dhriti\nKaranam: Kimstughna\nAmirthathiyogam: Siddha Yogam\nSubayogam: Subayogam\nRaghu Kalam: 12.08 PM to 1.31 PM\nYemakandam: 7.58 AM to 9.21 AM\nKuligai: 9.21 AM to 10.44 AM\nGood time: 6.34 AM to 7.58 AM and 1.31 PM to 2.55 PM\nSun Rise: 6.34 AM\nSun Set: 5.41 PM\nChandhirashtamam: Mesham\nSoolam: North\nPrayatchittham: Milk / Paal\nSradhdhathithi: Prathamai\nLocation: Hyderabad\, India
SUMMARY:Karthigai - 23 (09.12.2026) Wednesday
UID:india-2026-12-09@panchangam
END:VEVENT
BEGIN:VEVENT
DTSTART;VALUE=DATE:20260204
DESCRIPTION:Thai - 21 (04.02.2026) Wednesday\n\nYear: Vishvavasu Varudam (Vishvavasu Nama Samvathsaram)\nAyanam: Utharayanam\nRuthu: Hemantha Ruthu\nMonth: Thai Masam (Makaram Masam)\nPaksham: Krushna Paksham\nThithi: upto 12.10 AM Tritiyai\, thereafter Chathurthi\nDay: {Budha Vasaram} Wednesday\nNakshatthiram: upto 10.52 PM Pooram\, and then Uthiram\nYogam: Atiganda\nKaranam: Vanijai\nAmirthathiyogam: Siddha Yogam\nSubayogam: Subayogam\nRaghu Kalam: 12.29 PM to 1.55 PM\nYemakandam: 8.12 AM to 9.38 AM\nKuligai: 9.38 AM to 11.04 AM\nGood time: 6.47 AM to 8.12 AM and 1.55 PM to 3.21 PM\nSun Rise: 6.47 AM\nSun Set: 6.12 PM\nChandhirashtamam: Makaram\nSoolam: North\nPrayatchittham: Milk / Paal\nSradhdhathithi: Tritiyai\nLocation: Hyderabad\, India
SUMMARY:Thai - 21 (04.02.2026) Wednesday
UID:india-2026-02-04@panchangam
END:VEVENT
BEGIN:VEVENT
DTSTART;VALUE=DATE:20260314
DESCRIPTION:Maasi - 29 (14.03.2026) Saturday\n\nYear: Vishvavasu Varudam (Vishvavasu Nama Samvathsaram)\nAyanam: Utharayanam\nRuthu: Shishira Ruthu\nMonth: Maasi Masam (Kumbham Masam)\nPaksham: Krushna Paksham\nThithi: upto 8.11 AM Dashami\, thereafter Ekadashi\nDay: {Sani Vasaram} Saturday\nNakshatthiram: upto 5.31 AM Uthiradam\, and then Thiruvonam\nYogam: Variyana\nKaranam: Vishti\nAmirthathiyogam: Siddha Yogam\nSubayogam: Subayogam\nRaghu Kalam: 9.25 AM to 10.55 AM\nYemakandam: 1.55 PM to 3.25 PM\nKuligai: 3.25 PM to 4.55 PM\nGood time: 9.25 AM to 10.55 AM and 1.55 PM to 3.25 PM\nSun Rise: 6.25 AM\nSun Set: 6.25 PM\nChandhirashtamam: Rishabam\nSoolam: East\nPrayatchittham: Curd / Thayir\nSradhdhathithi: Ekadashi\nLocation: Hyderabad\, India
SUMMARY:Maasi - 29 (14.03.2026) Saturday
UID:india-2026-03-14@panchangam
END:VEVENT
BEGIN:VEVENT
DTSTART;VALUE=DATE:20260424
DESCRIPTION:Chithirai - 10 (24.04.2026) Friday\n\nYear: Parabhava Varudam (Parabhava Nama Samvathsaram)\nAyanam: Utharayanam\nRuthu: Vasantha Ruthu\nMonth: Chithirai Masam (Mesham Masam)\nPaksham: Shukla Paksham\nThithi: upto 7.22 PM Ashtami\, thereafter Navami\nDay: {Sukra Vasaram} Friday\nNakshatthiram: upto 8.53 PM Poosam\, and then Aayilyam\nYogam: Shoola\nKaranam: Vishti\nAmirthathiyogam: Siddha Yogam\nSubayogam: Subayogam\nRaghu Kalam: 10.39 AM to 12.14 PM\nYemakandam: 3.24 PM to 4.59 PM\nKuligai: 5.54 AM to 7.29 AM\nGood time: 5.54 AM to 7.29 AM and 12.14 PM to 1.49 PM\nSun Rise: 5.54 AM\nSun Set: 6.34 PM\nChandhirashtamam: Dhanus\nSoolam: West\nPrayatchittham: Jaggery / Vellam\nSradhdhathithi: Ashtami\nLocation: Hyderabad\, India
SUMMARY:Chithirai - 10 (24.04.2026) Friday
UID:india-2026-04-24@panchangam
END:VEVENT
BEGIN:VEVENT
DTSTART;VALUE=DATE:20260703
DESCRIPTION:Aani - 18 (03.07.2026) Friday\n\nYear: Parabhava Varudam (Parabhava Nama Samvathsaram)\nAyanam: Dhatchinayanam\nRuthu: Grishma Ruthu\nMonth: Aani Masam (Mithunam Masam)\nPaksham: Krushna Paksham\nThithi: upto 11.20 AM Tritiyai\, thereafter Chathurthi\nDay: {Sukra Vasaram} Friday\nNakshatthiram: upto 12.30 PM Thiruvonam\, and then Avittam\nYogam: Vishkambha\nKaranam: Vishti\nAmirthathiyogam: Siddha Yogam\nSubayogam: Subayogam\nRaghu Kalam: 10.41 AM to 12.20 PM\nYemakandam: 3.37 PM to 5.16 PM\nKuligai: 5.45 AM to 7.24 AM\nGood time: 5.45 AM to 7.24 AM and 12.20 PM to 1.58 PM\nSun Rise: 5.45 AM\nSun Set: 6.54 PM\nChandhirashtamam: Mithunam\nSoolam: West\nPrayatchittham: Jaggery / Vellam\nSradhdhathithi: Chathurthi\nLocation: Hyderabad\, India
SUMMARY:Aani - 18 (03.07.2026) Friday
UID:india-2026-07-03@panchangam
END:VEVENT
BEGIN:VEVENT
DTSTART;VALUE=DATE:20260813
DESCRIPTION:Aadi - 27 (13.08.2026) Thursday\n\nYear: Parabhava Varudam (Parabhava Nama Samvathsaram)\nAyanam: Dhatchinayanam\nRuthu: Grishma Ruthu\nMonth: Aadi Masam (Katakam Masam)\nPaksham: Shukla Paksham\nThithi: upto 8.42 PM Prathamai\, thereafter Dwitiyai\nDay: {Guru Vasaram} Thursday\nNakshatthiram: upto 6.44 AM Aayilyam\, upto 5.16 AM Magam\, and then Pooram\nYogam: Variyana\nKaranam: Kimstughna\nAmirthathiyogam: Siddha Yogam\nSubayogam: Subayogam\nRaghu Kalam: 1.56 PM to 3.32 PM\nYemakandam: 5.58 AM to 7.34 AM\nKuligai: 7.34 AM to 9.09 AM\nGood time: 5.58 AM to 7.34 AM and 12.20 PM to 1.56 PM\nSun Rise: 5.58 AM\nSun Set: 6.43 PM\nChandhirashtamam: Dhanus\nSoolam: South\nPrayatchittham: Oil / Thailam\nSradhdhathithi: Prathamai\nLocation: Hyderabad\, India
SUMMARY:Aadi - 27 (13.08.2026) Thursday
UID:india-2026-08-13@panchangam
END:VEVENT
BEGIN:VEVENT
DTSTART;VALUE=DATE:20260923
DESCRIPTION:Purattasi - 06 (23.09.2026) Wednesday\n\nYear: Parabhava Varudam (Parabhava Nama Samvathsaram)\nAyanam: Dhatchinayanam\nRuthu: Varsha Ruthu\nMonth: Purattasi Masam (Kanni Masam)\nPaksham: Shukla Paksham\nThithi: upto 10.51 PM Dwadashi\, thereafter Trayodashi\nDay: {Budha Vasaram} Wednesday\nNakshatthiram: upto 9.52 AM Thiruvonam\, and then Avittam\nYogam: Sukarman\nKaranam: Bavai\nAmirthathiyogam: Siddha Yogam\nSubayogam: Subayogam\nRaghu Kalam: 12.08 PM to 1.39 PM\nYemakandam: 7.35 AM to 9.06 AM\nKuligai: 9.06 AM to 10.37 AM\nGood time: 6.05 AM to 7.35 AM and 1.39 PM to 3.10 PM\nSun Rise: 6.05 AM\nSun Set: 6.11 PM\nChandhirashtamam: Mithunam\nSoolam: North\nPrayatchittham: Milk / Paal\nSradhdhathithi: Dwadashi\nLocation: Hyderabad\, India
SUMMARY:Purattasi - 06 (23.09.2026) Wednesday
UID:india-2026-09-23@panchangam
END:VEVENT
BEGIN:VEVENT
DTSTART;VALUE=DATE:20261007
DESCRIPTION:Purattasi - 20 (07.10.2026) Wednesday\n\nYear: Parabhava Varudam (Parabhava Nama Samvathsaram)\nAyanam: Dhatchinayanam\nRuthu: Varsha Ruthu\nMonth: Purattasi Masam (Kanni Masam)\nPaksham: Krushna Paksham\nThithi: upto 11.17 PM Dwadashi\, thereafter Trayodashi\nDay: {Budha Vasaram} Wednesday\nNakshatthiram: upto 10.20 PM Magam\, and then Pooram\nYogam: Sadhya\nKaranam: Kaulavai\nAmirthathiyogam: Siddha Yogam\nSubayogam: Subayogam\nRaghu Kalam: 12.03 PM to 1.32 PM\nYemakandam: 7.36 AM to 9.05 AM\nKuligai: 9.05 AM to 10.34 AM\nGood time: 6.07 AM to 7.36 AM and 1.32 PM to 3.02 PM\nSun Rise: 6.07 AM\nSun Set: 6.00 PM\nChandhirashtamam: Makaram\nSoolam: North\nPrayatchittham: Milk / Paal\nSradhdhathithi: Dwadashi\nLocation: Hyderabad\, India
SUMMARY:Purattasi - 20 (07.10.2026) Wednesday
UID:india-2026-10-07@panchangam
END:VEVENT
BEGIN:VEVENT
DTSTART;VALUE=DATE:20261117
DESCRIPTION:Karthigai - 01 (17.11.2026) Tuesday\n\nYear: Parabhava Varudam (Parabhava Nama Samvathsaram)\nAyanam: Dhatchinayanam\nRuthu: Sarath Ruthu\nMonth: Karthigai Masam (Virutchigam Masam)\nPaksham: Shukla Paksham\nThithi: upto 6.05 AM Ashtami\, thereafter Navami\nDay: {Bhauma Vasaram} Tuesday\nNakshatthiram: upto 5.18 AM Avittam\, and then Sathayam\nYogam: Vriddhi\nKaranam: Vishti\nAmirthathiyogam: Siddha Yogam\nSubayogam: Subayogam\nRaghu Kalam: 2.50 PM to 4.15 PM\nYemakandam: 9.11 AM to 10.36 AM\nKuligai: 10.36 AM to 12 Noon\nGood time: 7.46 AM to 9.11 AM and 2.50 PM to 4.15 PM\nSun Rise: 6.21 AM\nSun Set: 5.39 PM\nChandhirashtamam: Mithunam\nSoolam: North\nPrayatchittham: Milk / Paal\nSradhdhathithi: Ashtami\nLocation: Hyderabad\, India
SUMMARY:Karthigai - 01 (17.11.2026) Tuesday
UID:india-2026-11-17@panchangam
END:VEVENT
BEGIN:VEVENT
DTSTART;VALUE=DATE:20260112
DESCRIPTION:Margazhi - 21 (12.01.2026) Monday\n\nYear: Vishvavasu Varudam (Vishvavasu Nama Samvathsaram)\nAyanam: Utharayanam\nRuthu: Hemantha Ruthu\nMonth: Margazhi Masam (Dhanus Masam)\nPaksham: Krushna Paksham\nThithi: upto 12.43 PM Navami\, thereafter Dashami\nDay: {Soma Vasaram} Monday\nNakshatthiram: upto 9.49 PM Swathi\, and then Visakam\nYogam: Dhriti\nKaranam: Garajai\nAmirthathiyogam: Siddha Yogam\nSubayogam: Subayogam\nRaghu Kalam: 8.12 AM to 9.36 AM\nYemakandam: 11.00 AM to 12.24 PM\nKuligai: 12.24 PM to 1.48 PM\nGood time: 6.48 AM to 8.12 AM and 12.24 PM to 1.48 PM\nSun Rise: 6.48 AM\nSun Set: 5.59 PM\nChandhirashtamam: Meenam\nSoolam: East\nPrayatchittham: Curd / Thayir\nSradhdhathithi: Dashami\nLocation: Hyderabad\, India
SUMMARY:Margazhi - 21 (12.01.2026) Monday
UID:india-2026-01-12@panchangam
END:VEVENT
BEGIN:VEVENT
DTSTART;VALUE=DATE:20260222
DESCRIPTION:Maasi - 09 (22.02.2026) Sunday\n\nYear: Vishvavasu Varudam (Vishvavasu Nama Samvathsaram)\nAyanam: Utharayanam\nRuthu: Shishira Ruthu\nMonth: Maasi Masam (Kumbham Masam)\nPaksham: Shukla Paksham\nThithi: upto 11.10 AM Panchami\, thereafter Shashti\nDay: {Ravi Vasaram} Sunday\nNakshatthiram: upto 6.32 PM Ashwini\, and then Bharani\nYogam: Shukla\nKaranam: Balavai\nAmirthathiyogam: Siddha Yogam\nSubayogam: Subayogam\nRaghu Kalam: 4.52 PM to 6.20 PM\nYemakandam: 12.29 PM to 1.57 PM\nKuligai: 1.57 PM to 3.24 PM\nGood time: 6.38 AM to 8.06 AM and 12.29 PM to 1.57 PM\nSun Rise: 6.38 AM\nSun Set: 6.20 PM\nChandhirashtamam: Kanni\nSoolam: West\nPrayatchittham: Jaggery / Vellam\nSradhdhathithi: Shashti\nLocation: Hyderabad\, India
SUMMARY:Maasi - 09 (22.02.2026) Sunday
UID:india-2026-02-22@panchangam
END:VEVENT
BEGIN:VEVENT
DTSTART;VALUE=DATE:20260501
DESCRIPTION:Chithirai - 17 (01.05.2026) Friday\n\nYear: Parabhava Varudam (Parabhava Nama Samvathsaram)\nAyanam: Utharayanam\nRuthu: Vasantha Ruthu\nMonth: Chithirai Masam (Mesham Masam)\nPaksham: Shukla Paksham\nThithi: upto 10.53 PM Pournami\, thereafter Prathamai\nDay: {Sukra Vasaram} Friday\nNakshatthiram: upto 5.19 AM Swathi\, and then Visakam\nYogam: Siddhi\nKaranam: Vishti\nAmirthathiyogam: Siddha Yogam\nSubayogam: Subayogam\nRaghu Kalam: 10.37 AM to 12.13 PM\nYemakandam: 3.24 PM to 5.00 PM\nKuligai: 5.50 AM to 7.26 AM\nGood time: 5.50 AM to 7.26 AM and 12.13 PM to 1.49 PM\nSun Rise: 5.50 AM\nSun Set: 6.36 PM\nChandhirashtamam: Meenam\nSoolam: West\nPrayatchittham: Jaggery / Vellam\nSradhdhathithi: Pournami\nLocation: Hyderabad\, India
SUMMARY:Chithirai - 17 (01.05.2026) Friday
UID:india-2026-05-01@panchangam
END:VEVENT
BEGIN:VEVENT
DTSTART;VALUE=DATE:20260611
DESCRIPTION:Vaikasi - 27 (11.06.2026) Thursday\n\nYear: Parabhava Varudam (Parabhava Nama Samvathsaram)\nAyanam: Utharayanam\nRuthu: Vasantha Ruthu\nMonth: Vaikasi Masam (Rishabam Masam)\nPaksham: Krushna Paksham\nThithi: upto 10.36 PM Ekadashi\, thereafter Dwadashi\nDay: {Guru Vasaram} Thursday\nNakshatthiram: upto 8.54 AM Revathi\, and then Ashwini\nYogam: Shobhana\nKaranam: Bavai\nAmirthathiyogam: Siddha Yogam\nSubayogam: Subayogam\nRaghu Kalam: 1.54 PM to 3.32 PM\nYemakandam: 5.41 AM to 7.19 AM\nKuligai: 7.19 AM to 8.58 AM\nGood time: 5.41 AM to 7.19 AM and 12.15 PM to 1.54 PM\nSun Rise: 5.41 AM\nSun Set: 6.50 PM\nChandhirashtamam: Simham\nSoolam: South\nPrayatchittham: Oil / Thailam\nSradhdhathithi: Ekadashi\nLocation: Hyderabad\, India
SUMMARY:Vaikasi - 27 (11.06.2026) Thursday
UID:india-2026-06-11@panchangam
END:VEVENT
BEGIN:VEVENT
DTSTART;VALUE=DATE:20260721
DESCRIPTION:Aadi - 04 (21.07.2026) Tuesday\n\nYear: Parabhava Varudam (Parabhava Nama Samvathsaram)\nAyanam: Dhatchinayanam\nRuthu: Grishma Ruthu\nMonth: Aadi Masam (Katakam Masam)\nPaksham: Shukla Paksham\nThithi: upto 5.17 AM Ashtami\, thereafter Navami\nDay: {Bhauma Vasaram} Tuesday\nNakshatthiram: upto 9.32 PM Chitthirai\, and then Swathi\nYogam: Siddha\nKaranam: Vishti\nAmirthathiyogam: Siddha Yogam\nSubayogam: Subayogam\nRaghu Kalam: 3.37 PM to 5.15 PM\nYemakandam: 9.07 AM to 10.44 AM\nKuligai: 10.44 AM to 12.22 PM\nGood time: 7.29 AM to 9.07 AM and 3.37 PM to 5.15 PM\nSun Rise: 5.51 AM\nSun Set: 6.52 PM\nChandhirashtamam: Kumbham\nSoolam: North\nPrayatchittham: Milk / Paal\nSradhdhathithi: Ashtami\nLocation: Hyderabad\, India
SUMMARY:Aadi - 04 (21.07.2026) Tuesday
UID:india-2026-07-21@panchangam
END:VEVENT
BEGIN:VEVENT
DTSTART;VALUE=DATE:20260831
DESCRIPTION:Aavani - 14 (31.08.2026) Monday\n\nYear: Parabhava Varudam (Parabhava Nama Samvathsaram)\nAyanam: Dhatchinayanam\nRuthu: Varsha Ruthu\nMonth: Aavani Masam (Simham Masam)\nPaksham: Krushna Paksham\nThithi: upto 8.51 AM Tritiyai\, thereafter Chathurthi\nDay: {Soma Vasaram} Monday\nNakshatthiram: upto 4.03 AM Revathi\, and then Ashwini\nYogam: Ganda\nKaranam: Vishti\nAmirthathiyogam: Siddha Yogam\nSubayogam: Subayogam\nRaghu Kalam: 7.35 AM to 9.09 AM\nYemakandam: 10.42 AM to 12.16 PM\nKuligai: 12.16 PM to 1.49 PM\nGood time: 6.02 AM to 7.35 AM and 12.16 PM to 1.49 PM\nSun Rise: 6.02 AM\nSun Set: 6.30 PM\nChandhirashtamam: Simham\nSoolam: East\nPrayatchittham: Curd / Thayir\nSradhdhathithi: Chathurthi\nLocation: Hyderabad\, India
SUMMARY:Aavani - 14 (31.08.2026) Monday
UID:india-2026-08-31@panchangam
END:VEVENT
BEGIN:VEVENT
DTSTART;VALUE=DATE:20261025
DESCRIPTION:Aippasi - 08 (25.10.2026) Sunday\n\nYear: Parabhava Varudam (Parabhava Nama Samvathsaram)\nAyanam: Dhatchinayanam\nRuthu: Sarath Ruthu\nMonth: Aippasi Masam (Thulam Masam)\nPaksham: Shukla Paksham\nThithi: upto 11.56 AM Chadhurdasi\, thereafter Pournami\nDay: {Ravi Vasaram} Sunday\nNakshatthiram: upto 8.00 PM Revathi\, and then Ashwini\nYogam: Harshana\nKaranam: Vanijai\nAmirthathiyogam: Siddha Yogam\nSubayogam: Subayogam\nRaghu Kalam: 4.21 PM to 5.48 PM\nYemakandam: 12 Noon to 1.27 PM\nKuligai: 1.27 PM to 2.54 PM\nGood time: 6.11 AM to 7.38 AM and 12 Noon to 1.27 PM\nSun Rise: 6.11 AM\nSun Set: 5.48 PM\nChandhirashtamam: Simham\nSoolam: West\nPrayatchittham: Jaggery / Vellam\nSradhdhathithi: Pournami\nLocation: Hyderabad\, India
SUMMARY:Aippasi - 08 (25.10.2026) Sunday
UID:india-2026-10-25@panchangam
END:VEVENT
BEGIN:VEVENT
DTSTART;VALUE=DATE:20260130
DESCRIPTION:Thai - 16 (30.01.2026) Friday\n\nYear: Vishvavasu Varudam (Vishvavasu Nama Samvathsaram)\nAyanam: Utharayanam\nRuthu: Hemantha Ruthu\nMonth: Thai Masam (Makaram Masam)\nPaksham: Shukla Paksham\nThithi: upto 11.09 AM Dwadashi\, thereafter Trayodashi\nDay: {Sukra Vasaram} Friday\nNakshatthiram: upto 4.03 AM Thiruvathirai\, and then Punarpoosam\nYogam: Vaidhriti\nKaranam: Balavai\nAmirthathiyogam: Siddha Yogam\nSubayogam: Subayogam\nRaghu Kalam: 11.04 AM to 12.29 PM\nYemakandam: 3.19 PM to 4.45 PM\nKuligai: 6.48 AM to 8.13 AM\nGood time: 6.48 AM to 8.13 AM and 12.29 PM to 1.54 PM\nSun Rise: 6.48 AM\nSun Set: 6.10 PM\nChandhirashtamam: Virutchigam\nSoolam: West\nPrayatchittham: Jaggery / Vellam\nSradhdhathithi: Trayodashi\nLocation: Hyderabad\, India
SUMMARY:Thai - 16 (30.01.2026) Friday
UID:india-2026-01-30@panchangam
END:VEVENT
BEGIN:VEVENT
DTSTART;VALUE=DATE:20260119
DESCRIPTION:Thai - 05 (19.01.2026) Monday\n\nYear: Vishvavasu Varudam (Vishvavasu Nama Samvathsaram)\nAyanam: Utharayanam\nRuthu: Hemantha Ruthu\nMonth: Thai Masam (Makaram Masam)\nPaksham: Shukla Paksham\nThithi: upto 2.14 AM Prathamai\, thereafter Dwitiyai\nDay: {Soma Vasaram} Monday\nNakshatthiram: upto 12.34 PM Uthiradam\, and then Thiruvonam\nYogam: Vajra\nKaranam: Kimstughna\nAmirthathiyogam: Siddha Yogam\nSubayogam: Subayogam\nRaghu Kalam: 8.13 AM to 9.38 AM\nYemakandam: 11.02 AM to 12.26 PM\nKuligai: 12.26 PM to 1.51 PM\nGood time: 6.49 AM to 8.13 AM and 12.26 PM to 1.51 PM\nSun Rise: 6.49 AM\nSun Set: 6.03 PM\nChandhirashtamam: Mithunam\nSoolam: East\nPrayatchittham: Curd / Thayir\nSradhdhathithi: Prathamai\nLocation: Hyderabad\, India
SUMMARY:Thai - 05 (19.01.2026) Monday
UID:india-2026-01-19@panchangam
END:VEVENT
BEGIN:VEVENT
DESCRIPTION:Exact Astronomical Duration (Hyderabad\, India)
DTEND:20261220T144503Z
DTSTART:20261219T163950Z
SUMMARY:Shukla Ekadasi
UID:india-202612191639-11@tithi
END:VEVENT
BEGIN:VEVENT
DTSTART;VALUE=DATE:20260508
DESCRIPTION:Chithirai - 24 (08.05.2026) Friday\n\nYear: Parabhava Varudam (Parabhava Nama Samvathsaram)\nAyanam: Utharayanam\nRuthu: Vasantha Ruthu\nMonth: Chithirai Masam (Mesham Masam)\nPaksham: Krushna Paksham\nThithi: upto 12.22 PM Shashti\, thereafter Saptami\nDay: {Sukra Vasaram} Friday\nNakshatthiram: upto 10.03 PM Uthiradam\, and then Thiruvonam\nYogam: Shubha\nKaranam: Vanijai\nAmirthathiyogam: Siddha Yogam\nSubayogam: Subayogam\nRaghu Kalam: 10.36 AM to 12.12 PM\nYemakandam: 3.25 PM to 5.01 PM\nKuligai: 5.46 AM to 7.23 AM\nGood time: 5.46 AM to 7.23 AM and 12.12 PM to 1.49 PM\nSun Rise: 5.46 AM\nSun Set: 6.38 PM\nChandhirashtamam: Mithunam\nSoolam: West\nPrayatchittham: Jaggery / Vellam\nSradhdhathithi: Saptami\nLocation: Hyderabad\, India
SUMMARY:Chithirai - 24 (08.05.2026) Friday
UID:india-2026-05-08@panchangam
END:VEVENT
BEGIN:VEVENT
DTSTART;VALUE=DATE:20260618
DESCRIPTION:Aani - 03 (18.06.2026) Thursday\n\nYear: Parabhava Varudam (Parabhava Nama Samvathsaram)\nAyanam: Utharayanam\nRuthu: Grishma Ruthu\nMonth: Aani Masam (Mithunam Masam)\nPaksham: Shukla Paksham\nThithi: upto 6.59 PM Chathurthi\, thereafter Panchami\nDay: {Guru Vasaram} Thursday\nNakshatthiram: upto 12.09 PM Poosam\, and then Aayilyam\nYogam: Vyaghata\nKaranam: Vanijai\nAmirthathiyogam: Amirtha Yogam\nSubayogam: Subayogam\nRaghu Kalam: 1.55 PM to 3.34 PM\nYemakandam: 5.42 AM to 7.20 AM\nKuligai: 7.20 AM to 8.59 AM\nGood time: 5.42 AM to 7.20 AM and 12.17 PM to 1.55 PM\nSun Rise: 5.42 AM\nSun Set: 6.52 PM\nChandhirashtamam: Dhanus\nSoolam: South\nPrayatchittham: Oil / Thailam\nSradhdhathithi: Chathurthi\nLocation: Hyderabad\, India
SUMMARY:Aani - 03 (18.06.2026) Thursday
UID:india-2026-06-18@panchangam
END:VEVENT
BEGIN:VEVENT
DTSTART;VALUE=DATE:20260728
DESCRIPTION:Aadi - 11 (28.07.2026) Tuesday\n\nYear: Parabhava Varudam (Parabhava Nama Samvathsaram)\nAyanam: Dhatchinayanam\nRuthu: Grishma Ruthu\nMonth: Aadi Masam (Katakam Masam)\nPaksham: Shukla Paksham\nThithi: upto 6.19 PM Chadhurdasi\, thereafter Pournami\nDay: {Bhauma Vasaram} Tuesday\nNakshatthiram: upto 1.55 PM Pooradam\, and then Uthiradam\nYogam: Vishkambha\nKaranam: Vanijai\nAmirthathiyogam: Siddha Yogam\nSubayogam: Subayogam\nRaghu Kalam: 3.36 PM to 5.13 PM\nYemakandam: 9.08 AM to 10.45 AM\nKuligai: 10.45 AM to 12.22 PM\nGood time: 7.31 AM to 9.08 AM and 3.36 PM to 5.13 PM\nSun Rise: 5.54 AM\nSun Set: 6.50 PM\nChandhirashtamam: Rishabam\nSoolam: North\nPrayatchittham: Milk / Paal\nSradhdhathithi: Chadhurdasi\nLocation: Hyderabad\, India
SUMMARY:Aadi - 11 (28.07.2026) Tuesday
UID:india-2026-07-28@panchangam
END:VEVENT
BEGIN:VEVENT
DTSTART;VALUE=DATE:20261102
DESCRIPTION:Aippasi - 16 (02.11.2026) Monday\n\nYear: Parabhava Varudam (Parabhava Nama Samvathsaram)\nAyanam: Dhatchinayanam\nRuthu: Sarath Ruthu\nMonth: Aippasi Masam (Thulam Masam)\nPaksham: Krushna Paksham\nThithi: upto 1.11 PM Ashtami\, thereafter Navami\nDay: {Soma Vasaram} Monday\nNakshatthiram: upto 4.26 AM Aayilyam\, and then Magam\nYogam: Shubha\nKaranam: Kaulavai\nAmirthathiyogam: Siddha Yogam\nSubayogam: Subayogam\nRaghu Kalam: 7.41 AM to 9.07 AM\nYemakandam: 10.33 AM to 11.59 AM\nKuligai: 11.59 AM to 1.25 PM\nGood time: 6.14 AM to 7.41 AM and 4.18 PM to 5.44 PM\nSun Rise: 6.14 AM\nSun Set: 5.44 PM\nChandhirashtamam: Dhanus\nSoolam: East\nPrayatchittham: Curd / Thayir\nSradhdhathithi: Navami\nLocation: Hyderabad\, India
SUMMARY:Aippasi - 16 (02.11.2026) Monday
UID:india-2026-11-02@panchangam
END:VEVENT
BEGIN:VEVENT
DTSTART;VALUE=DATE:20261212
DESCRIPTION:Karthigai - 26 (12.12.2026) Saturday\n\nYear: Parabhava Varudam (Parabhava Nama Samvathsaram)\nAyanam: Dhatchinayanam\nRuthu: Sarath Ruthu\nMonth: Karthigai Masam (Virutchigam Masam)\nPaksham: Shukla Paksham\nThithi: upto 2.06 PM Tritiyai\, thereafter Chathurthi\nDay: {Sani Vasaram} Saturday\nNakshatthiram: Uthiradam\nYogam: Vriddhi\nKaranam: Garajai\nAmirthathiyogam: Siddha Yogam\nSubayogam: Subayogam\nRaghu Kalam: 9.22 AM to 10.46 AM\nYemakandam: 1.32 PM to 2.56 PM\nKuligai: 2.56 PM to 4.19 PM\nGood time: 9.22 AM to 10.46 AM and 1.32 PM to 2.56 PM\nSun Rise: 6.36 AM\nSun Set: 5.42 PM\nChandhirashtamam: Rishabam\nSoolam: East\nPrayatchittham: Curd / Thayir\nSradhdhathithi: Chathurthi\nLocation: Hyderabad\, India
SUMMARY:Karthigai - 26 (12.12.2026) Saturday
UID:india-2026-12-12@panchangam
END:VEVENT
BEGIN:VEVENT
DESCRIPTION:Exact Astronomical Duration (Hyderabad\, India)
DTEND:20261215T154953Z
DTSTART:20261214T134633Z
SUMMARY:Shukla Shashti
UID:india-202612141346-6@tithi
END:VEVENT
BEGIN:VEVENT
DESCRIPTION:Exact Astronomical Duration (Hyderabad\, India)
DTEND:20260107T012303Z
DTSTART:20260106T023210Z
SUMMARY:Sankatahara Chathurthi
UID:india-202601060232-19@tithi
END:VEVENT
BEGIN:VEVENT
DTSTART;VALUE=DATE:20260306
DESCRIPTION:Maasi - 21 (06.03.2026) Friday\n\nYear: Vishvavasu Varudam (Vishvavasu Nama Samvathsaram)\nAyanam: Utharayanam\nRuthu: Shishira Ruthu\nMonth: Maasi Masam (Kumbham Masam)\nPaksham: Krushna Paksham\nThithi: upto 5.53 PM Tritiyai\, thereafter Chathurthi\nDay: {Sukra Vasaram} Friday\nNakshatthiram: upto 10.11 AM Hastham\, and then Chitthirai\nYogam: Ganda\nKaranam: Vishti\nAmirthathiyogam: Siddha Yogam\nSubayogam: Subayogam\nRaghu Kalam: 10.58 AM to 12.27 PM\nYemakandam: 3.25 PM to 4.54 PM\nKuligai: 6.31 AM to 8.00 AM\nGood time: 6.31 AM to 8.00 AM and 12.27 PM to 1.56 PM\nSun Rise: 6.31 AM\nSun Set: 6.23 PM\nChandhirashtamam: Kumbham\nSoolam: West\nPrayatchittham: Jaggery / Vellam\nSradhdhathithi: Tritiyai\nLocation: Hyderabad\, India
SUMMARY:Maasi - 21 (06.03.2026) Friday
UID:india-2026-03-06@panchangam
END:VEVENT
BEGIN:VEVENT
DTSTART;VALUE=DATE:20260416
DESCRIPTION:Chithirai - 02 (16.04.2026) Thursday\n\nYear: Parabhava Varudam (Parabhava Nama Samvathsaram)\nAyanam: Utharayanam\nRuthu: Vasantha Ruthu\nMonth: Chithirai Masam (Mesham Masam)\nPaksham: Krushna Paksham\nThithi: upto 8.11 PM Chadhurdasi\, thereafter Amavasai\nDay: {Guru Vasaram} Thursday\nNakshatthiram: upto 2.35 PM Uthirattathi\, and then Revathi\nYogam: Indra\nKaranam: Vishti\nAmirthathiyogam: Siddha Yogam\nSubayogam: Subayogam\nRaghu Kalam: 1.50 PM to 3.24 PM\nYemakandam: 5.59 AM to 7.33 AM\nKuligai: 7.33 AM to 9.07 AM\nGood time: 5.59 AM to 7.33 AM and 12.15 PM to 1.50 PM\nSun Rise: 5.59 AM\nSun Set: 6.32 PM\nChandhirashtamam: Simham\nSoolam: South\nPrayatchittham: Oil / Thailam\nSradhdhathithi: Chadhurdasi\nLocation: Hyderabad\, India
SUMMARY:Chithirai - 02 (16.04.2026) Thursday
UID:india-2026-04-16@panchangam
END:VEVENT
BEGIN:VEVENT
DTSTART;VALUE=DATE:20260526
DESCRIPTION:Vaikasi - 11 (26.05.2026) Tuesday\n\nYear: Parabhava Varudam (Parabhava Nama Samvathsaram)\nAyanam: Utharayanam\nRuthu: Vasantha Ruthu\nMonth: Vaikasi Masam (Rishabam Masam)\nPaksham: Shukla Paksham\nThithi: Ekadashi\nDay: {Bhauma Vasaram} Tuesday\nNakshatthiram: Hastham\nYogam: Siddhi\nKaranam: Vanijai\nAmirthathiyogam: Siddha Yogam\nSubayogam: Subayogam\nRaghu Kalam: 3.28 PM to 5.06 PM\nYemakandam: 8.57 AM to 10.35 AM\nKuligai: 10.35 AM to 12.13 PM\nGood time: 7.19 AM to 8.57 AM and 3.28 PM to 5.06 PM\nSun Rise: 5.41 AM\nSun Set: 6.44 PM\nChandhirashtamam: Kumbham\nSoolam: North\nPrayatchittham: Milk / Paal\nSradhdhathithi: Ekadashi\nLocation: Hyderabad\, India
SUMMARY:Vaikasi - 11 (26.05.2026) Tuesday
UID:india-2026-05-26@panchangam
END:VEVENT
BEGIN:VEVENT
DESCRIPTION:Exact Astronomical Duration (Hyderabad\, India)
DTEND:20261022T091834Z
DTSTART:20261021T084222Z
SUMMARY:Shukla Ekadasi
UID:india-202610210842-11@tithi
END:VEVENT
BEGIN:VEVENT
DTSTART;VALUE=DATE:20260805
DESCRIPTION:Aadi - 19 (05.08.2026) Wednesday\n\nYear: Parabhava Varudam (Parabhava Nama Samvathsaram)\nAyanam: Dhatchinayanam\nRuthu: Grishma Ruthu\nMonth: Aadi Masam (Katakam Masam)\nPaksham: Krushna Paksham\nThithi: upto 8.42 PM Saptami\, thereafter Ashtami\nDay: {Budha Vasaram} Wednesday\nNakshatthiram: upto 9.57 PM Ashwini\, and then Bharani\nYogam: Shoola\nKaranam: Vishti\nAmirthathiyogam: Marana Yogam\nSubayogam: \nRaghu Kalam: 12.21 PM to 1.58 PM\nYemakandam: 7.32 AM to 9.09 AM\nKuligai: 9.09 AM to 10.45 AM\nGood time: 5.56 AM to 7.32 AM and 1.58 PM to 3.34 PM\nSun Rise: 5.56 AM\nSun Set: 6.47 PM\nChandhirashtamam: Kanni\nSoolam: North\nPrayatchittham: Milk / Paal\nSradhdhathithi: Saptami\nLocation: Hyderabad\, India
SUMMARY:Aadi - 19 (05.08.2026) Wednesday
UID:india-2026-08-05@panchangam
END:VEVENT
BEGIN:VEVENT
DTSTART;VALUE=DATE:20260915
DESCRIPTION:Aavani - 29 (15.09.2026) Tuesday\n\nYear: Parabhava Varudam (Parabhava Nama Samvathsaram)\nAyanam: Dhatchinayanam\nRuthu: Varsha Ruthu\nMonth: Aavani Masam (Simham Masam)\nPaksham: Shukla Paksham\nThithi: upto 7.44 AM Chathurthi\, thereafter Panchami\nDay: {Bhauma Vasaram} Tuesday\nNakshatthiram: upto 4.04 PM Swathi\, and then Visakam\nYogam: Indra\nKaranam: Vishti\nAmirthathiyogam: Siddha Yogam\nSubayogam: Subayogam\nRaghu Kalam: 3.14 PM to 4.46 PM\nYemakandam: 9.07 AM to 10.39 AM\nKuligai: 10.39 AM to 12.11 PM\nGood time: 7.35 AM to 9.07 AM and 3.14 PM to 4.46 PM\nSun Rise: 6.04 AM\nSun Set: 6.18 PM\nChandhirashtamam: Meenam\nSoolam: North\nPrayatchittham: Milk / Paal\nSradhdhathithi: Panchami\nLocation: Hyderabad\, India
SUMMARY:Aavani - 29 (15.09.2026) Tuesday
UID:india-2026-09-15@panchangam
END:VEVENT
BEGIN:VEVENT
DTSTART;VALUE=DATE:20261010
DESCRIPTION:Purattasi - 23 (10.10.2026) Saturday\n\nYear: Parabhava Varudam (Parabhava Nama Samvathsaram)\nAyanam: Dhatchinayanam\nRuthu: Varsha Ruthu\nMonth: Purattasi Masam (Kanni Masam)\nPaksham: Krushna Paksham\nThithi: upto 9.20 PM Amavasai\, thereafter Prathamai\nDay: {Sani Vasaram} Saturday\nNakshatthiram: upto 10.24 PM Hastham\, and then Chitthirai\nYogam: Indra\nKaranam: Chatushpada\nAmirthathiyogam: Marana Yogam\nSubayogam: \nRaghu Kalam: 9.05 AM to 10.34 AM\nYemakandam: 1.31 PM to 3.00 PM\nKuligai: 3.00 PM to 4.29 PM\nGood time: 9.05 AM to 10.34 AM and 1.31 PM to 3.00 PM\nSun Rise: 6.07 AM\nSun Set: 5.58 PM\nChandhirashtamam: Kumbham\nSoolam: East\nPrayatchittham: Curd / Thayir\nSradhdhathithi: Amavasai\nLocation: Hyderabad\, India
SUMMARY:Purattasi - 23 (10.10.2026) Saturday
UID:india-2026-10-10@panchangam
END:VEVENT
BEGIN:VEVENT
DTSTART;VALUE=DATE:20261120
DESCRIPTION:Karthigai - 04 (20.11.2026) Friday\n\nYear: Parabhava Varudam (Parabhava Nama Samvathsaram)\nAyanam: Dhatchinayanam\nRuthu: Sarath Ruthu\nMonth: Karthigai Masam (Virutchigam Masam)\nPaksham: Shukla Paksham\nThithi: upto 7.16 AM Dashami\, thereafter Ekadashi\nDay: {Sukra Vasaram} Friday\nNakshatthiram: upto 7.37 AM Poorattathi\, and then Uthirattathi\nYogam: Harshana\nKaranam: Garajai\nAmirthathiyogam: Siddha Yogam\nSubayogam: Subayogam\nRaghu Kalam: 10.37 AM to 12.01 PM\nYemakandam: 2.50 PM to 4.15 PM\nKuligai: 6.23 AM to 7.48 AM\nGood time: 6.23 AM to 7.48 AM and 12.01 PM to 1.26 PM\nSun Rise: 6.23 AM\nSun Set: 5.39 PM\nChandhirashtamam: Simham\nSoolam: West\nPrayatchittham: Jaggery / Vellam\nSradhdhathithi: Ekadashi\nLocation: Hyderabad\, India
SUMMARY:Karthigai - 04 (20.11.2026) Friday
UID:india-2026-11-20@panchangam
END:VEVENT
BEGIN:VEVENT
DTSTART;VALUE=DATE:20261109
DESCRIPTION:Aippasi - 23 (09.11.2026) Monday\n\nYear: Parabhava Varudam (Parabhava Nama Samvathsaram)\nAyanam: Dhatchinayanam\nRuthu: Sarath Ruthu\nMonth: Aippasi Masam (Thulam Masam)\nPaksham: Krushna Paksham\nThithi: upto 12.32 PM Amavasai\, thereafter Prathamai\nDay: {Soma Vasaram} Monday\nNakshatthiram: upto 8.07 AM Swathi\, and then Visakam\nYogam: Saubhagya\nKaranam: Nagava\nAmirthathiyogam: Siddha Yogam\nSubayogam: Subayogam\nRaghu Kalam: 7.43 AM to 9.08 AM\nYemakandam: 10.34 AM to 11.59 AM\nKuligai: 11.59 AM to 1.25 PM\nGood time: 6.17 AM to 7.43 AM and 4.16 PM to 5.41 PM\nSun Rise: 6.17 AM\nSun Set: 5.41 PM\nChandhirashtamam: Meenam\nSoolam: East\nPrayatchittham: Curd / Thayir\nSradhdhathithi: Prathamai\nLocation: Hyderabad\, India
SUMMARY:Aippasi - 23 (09.11.2026) Monday
UID:india-2026-11-09@panchangam
END:VEVENT
BEGIN:VEVENT
DTSTART;VALUE=DATE:20261219
DESCRIPTION:Margazhi - 03 (19.12.2026) Saturday\n\nYear: Parabhava Varudam (Parabhava Nama Samvathsaram)\nAyanam: Dhatchinayanam\nRuthu: Hemantha Ruthu\nMonth: Margazhi Masam (Dhanus Masam)\nPaksham: Shukla Paksham\nThithi: upto 10.09 PM Dashami\, thereafter Ekadashi\nDay: {Sani Vasaram} Saturday\nNakshatthiram: upto 4.37 PM Revathi\, and then Ashwini\nYogam: Variyana\nKaranam: Thaitilai\nAmirthathiyogam: Marana Yogam\nSubayogam: \nRaghu Kalam: 9.26 AM to 10.49 AM\nYemakandam: 1.36 PM to 2.59 PM\nKuligai: 2.59 PM to 4.22 PM\nGood time: 9.26 AM to 10.49 AM and 1.36 PM to 2.59 PM\nSun Rise: 6.40 AM\nSun Set: 5.45 PM\nChandhirashtamam: Simham\nSoolam: East\nPrayatchittham: Curd / Thayir\nSradhdhathithi: Dashami\nLocation: Hyderabad\, India
SUMMARY:Margazhi - 03 (19.12.2026) Saturday
UID:india-2026-12-19@panchangam
END:VEVENT
BEGIN:VEVENT
DTSTART;VALUE=DATE:20260104
DESCRIPTION:Margazhi - 13 (04.01.2026) Sunday\n\nYear: Vishvavasu Varudam (Vishvavasu Nama Samvathsaram)\nAyanam: Utharayanam\nRuthu: Hemantha Ruthu\nMonth: Margazhi Masam (Dhanus Masam)\nPaksham: Krushna Paksham\nThithi: upto 12.30 PM Prathamai\, thereafter Dwitiyai\nDay: {Ravi Vasaram} Sunday\nNakshatthiram: upto 3.47 PM Punarpoosam\, and then Poosam\nYogam: Vaidhriti\nKaranam: Kaulavai\nAmirthathiyogam: Siddha Yogam\nSubayogam: Subayogam\nRaghu Kalam: 4.31 PM to 5.54 PM\nYemakandam: 12.20 PM to 1.44 PM\nKuligai: 1.44 PM to 3.07 PM\nGood time: 6.47 AM to 8.10 AM and 12.20 PM to 1.44 PM\nSun Rise: 6.47 AM\nSun Set: 5.54 PM\nChandhirashtamam: Virutchigam\nSoolam: West\nPrayatchittham: Jaggery / Vellam\nSradhdhathithi: Dwitiyai\nLocation: Hyderabad\, India
SUMMARY:Margazhi - 13 (04.01.2026) Sunday
UID:india-2026-01-04@panchangam
END:VEVENT
BEGIN:VEVENT
DTSTART;VALUE=DATE:20260214
DESCRIPTION:Maasi - 01 (14.02.2026) Saturday\n\nYear: Vishvavasu Varudam (Vishvavasu Nama Samvathsaram)\nAyanam: Utharayanam\nRuthu: Shishira Ruthu\nMonth: Maasi Masam (Kumbham Masam)\nPaksham: Krushna Paksham\nThithi: upto 4.02 PM Dwadashi\, thereafter Trayodashi\nDay: {Sani Vasaram} Saturday\nNakshatthiram: upto 6.58 PM Pooradam\, and then Uthiradam\nYogam: Siddhi\nKaranam: Thaitilai\nAmirthathiyogam: Siddha Yogam\nSubayogam: Subayogam\nRaghu Kalam: 9.36 AM to 11.03 AM\nYemakandam: 1.57 PM to 3.23 PM\nKuligai: 3.23 PM to 4.50 PM\nGood time: 9.36 AM to 11.03 AM and 1.57 PM to 3.23 PM\nSun Rise: 6.43 AM\nSun Set: 6.17 PM\nChandhirashtamam: Rishabam\nSoolam: East\nPrayatchittham: Curd / Thayir\nSradhdhathithi: Dwadashi\nLocation: Hyderabad\, India
SUMMARY:Maasi - 01 (14.02.2026) Saturday
UID:india-2026-02-14@panchangam
END:VEVENT
BEGIN:VEVENT
DTSTART;VALUE=DATE:20260324
DESCRIPTION:Panguni - 09 (24.03.2026) Tuesday\n\nYear: Vishvavasu Varudam (Vishvavasu Nama Samvathsaram)\nAyanam: Utharayanam\nRuthu: Shishira Ruthu\nMonth: Panguni Masam (Meenam Masam)\nPaksham: Shukla Paksham\nThithi: upto 4.08 PM Shashti\, thereafter Saptami\nDay: {Bhauma Vasaram} Tuesday\nNakshatthiram: upto 7.41 PM Rohini\, and then Mrigashirsham\nYogam: Priti\nKaranam: Thaitilai\nAmirthathiyogam: Siddha Yogam\nSubayogam: Subayogam\nRaghu Kalam: 3.25 PM to 4.56 PM\nYemakandam: 9.19 AM to 10.51 AM\nKuligai: 10.51 AM to 12.22 PM\nGood time: 7.48 AM to 9.19 AM and 3.25 PM to 4.56 PM\nSun Rise: 6.17 AM\nSun Set: 6.27 PM\nChandhirashtamam: Thulam\nSoolam: North\nPrayatchittham: Milk / Paal\nSradhdhathithi: Shashti\nLocation: Hyderabad\, India
SUMMARY:Panguni - 09 (24.03.2026) Tuesday
UID:india-2026-03-24@panchangam
END:VEVENT
BEGIN:VEVENT
DTSTART;VALUE=DATE:20260603
DESCRIPTION:Vaikasi - 19 (03.06.2026) Wednesday\n\nYear: Parabhava Varudam (Parabhava Nama Samvathsaram)\nAyanam: Utharayanam\nRuthu: Vasantha Ruthu\nMonth: Vaikasi Masam (Rishabam Masam)\nPaksham: Krushna Paksham\nThithi: upto 9.21 PM Tritiyai\, thereafter Chathurthi\nDay: {Budha Vasaram} Wednesday\nNakshatthiram: upto 1.44 AM Pooradam\, and then Uthiradam\nYogam: Shubha\nKaranam: Vanijai\nAmirthathiyogam: Siddha Yogam\nSubayogam: Subayogam\nRaghu Kalam: 12.14 PM to 1.52 PM\nYemakandam: 7.19 AM to 8.57 AM\nKuligai: 8.57 AM to 10.35 AM\nGood time: 5.40 AM to 7.19 AM and 1.52 PM to 3.30 PM\nSun Rise: 5.40 AM\nSun Set: 6.47 PM\nChandhirashtamam: Rishabam\nSoolam: North\nPrayatchittham: Milk / Paal\nSradhdhathithi: Tritiyai\nLocation: Hyderabad\, India
SUMMARY:Vaikasi - 19 (03.06.2026) Wednesday
UID:india-2026-06-03@panchangam
END:VEVENT
BEGIN:VEVENT
DTSTART;VALUE=DATE:20260713
DESCRIPTION:Aani - 28 (13.07.2026) Monday\n\nYear: Parabhava Varudam (Parabhava Nama Samvathsaram)\nAyanam: Dhatchinayanam\nRuthu: Grishma Ruthu\nMonth: Aani Masam (Mithunam Masam)\nPaksham: Krushna Paksham\nThithi: upto 6.50 PM Chadhurdasi\, thereafter Amavasai\nDay: {Soma Vasaram} Monday\nNakshatthiram: upto 6.17 AM Mrigashirsham\, upto 3.27 AM Thiruvathirai\, and then Punarpoosam\nYogam: Dhruva\nKaranam: Vishti\nAmirthathiyogam: Amirtha Yogam\nSubayogam: Subayogam\nRaghu Kalam: 7.27 AM to 9.05 AM\nYemakandam: 10.43 AM to 12.21 PM\nKuligai: 12.21 PM to 1.59 PM\nGood time: 5.49 AM to 7.27 AM and 12.21 PM to 1.59 PM\nSun Rise: 5.49 AM\nSun Set: 6.54 PM\nChandhirashtamam: Virutchigam\nSoolam: East\nPrayatchittham: Curd / Thayir\nSradhdhathithi: Chadhurdasi\nLocation: Hyderabad\, India
SUMMARY:Aani - 28 (13.07.2026) Monday
UID:india-2026-07-13@panchangam
END:VEVENT
BEGIN:VEVENT
DTSTART;VALUE=DATE:20260823
DESCRIPTION:Aavani - 06 (23.08.2026) Sunday\n\nYear: Parabhava Varudam (Parabhava Nama Samvathsaram)\nAyanam: Dhatchinayanam\nRuthu: Varsha Ruthu\nMonth: Aavani Masam (Simham Masam)\nPaksham: Shukla Paksham\nThithi: upto 4.19 AM Ekadashi\, thereafter Dwadashi\nDay: {Ravi Vasaram} Sunday\nNakshatthiram: upto 6.29 PM Moolam\, and then Pooradam\nYogam: Vishkambha\nKaranam: Vanijai\nAmirthathiyogam: Amirtha Yogam\nSubayogam: Subayogam\nRaghu Kalam: 5.02 PM to 6.36 PM\nYemakandam: 12.18 PM to 1.53 PM\nKuligai: 1.53 PM to 3.27 PM\nGood time: 6.00 AM to 7.35 AM and 12.18 PM to 1.53 PM\nSun Rise: 6.00 AM\nSun Set: 6.36 PM\nChandhirashtamam: Rishabam\nSoolam: West\nPrayatchittham: Jaggery / Vellam\nSradhdhathithi: Ekadashi\nLocation: Hyderabad\, India
SUMMARY:Aavani - 06 (23.08.2026) Sunday
UID:india-2026-08-23@panchangam
END:VEVENT
BEGIN:VEVENT
DESCRIPTION:Exact Astronomical Duration (Hyderabad\, India)
DTEND:20260704T071029Z
DTSTART:20260703T055053Z
SUMMARY:Sankatahara Chathurthi
UID:india-202607030550-19@tithi
END:VEVENT
BEGIN:VEVENT
DTSTART;VALUE=DATE:20261017
DESCRIPTION:Purattasi - 30 (17.10.2026) Saturday\n\nYear: Parabhava Varudam (Parabhava Nama Samvathsaram)\nAyanam: Dhatchinayanam\nRuthu: Varsha Ruthu\nMonth: Purattasi Masam (Kanni Masam)\nPaksham: Shukla Paksham\nThithi: Saptami\nDay: {Sani Vasaram} Saturday\nNakshatthiram: upto 10.32 AM Moolam\, and then Pooradam\nYogam: Atiganda\nKaranam: Garajai\nAmirthathiyogam: Siddha Yogam\nSubayogam: Subayogam\nRaghu Kalam: 9.05 AM to 10.33 AM\nYemakandam: 1.29 PM to 2.57 PM\nKuligai: 2.57 PM to 4.25 PM\nGood time: 9.05 AM to 10.33 AM and 1.29 PM to 2.57 PM\nSun Rise: 6.09 AM\nSun Set: 5.53 PM\nChandhirashtamam: Rishabam\nSoolam: East\nPrayatchittham: Curd / Thayir\nSradhdhathithi: Saptami\nLocation: Hyderabad\, India
SUMMARY:Purattasi - 30 (17.10.2026) Saturday
UID:india-2026-10-17@panchangam
END:VEVENT
BEGIN:VEVENT
DTSTART;VALUE=DATE:20261127
DESCRIPTION:Karthigai - 11 (27.11.2026) Friday\n\nYear: Parabhava Varudam (Parabhava Nama Samvathsaram)\nAyanam: Dhatchinayanam\nRuthu: Sarath Ruthu\nMonth: Karthigai Masam (Virutchigam Masam)\nPaksham: Krushna Paksham\nThithi: upto 9.49 AM Tritiyai\, thereafter Chathurthi\nDay: {Sukra Vasaram} Friday\nNakshatthiram: upto 3.45 PM Thiruvathirai\, and then Punarpoosam\nYogam: Shubha\nKaranam: Vishti\nAmirthathiyogam: Siddha Yogam\nSubayogam: Subayogam\nRaghu Kalam: 10.39 AM to 12.03 PM\nYemakandam: 2.51 PM to 4.15 PM\nKuligai: 6.27 AM to 7.51 AM\nGood time: 6.27 AM to 7.51 AM and 12.03 PM to 1.27 PM\nSun Rise: 6.27 AM\nSun Set: 5.39 PM\nChandhirashtamam: Virutchigam\nSoolam: West\nPrayatchittham: Jaggery / Vellam\nSradhdhathithi: Chathurthi\nLocation: Hyderabad\, India
SUMMARY:Karthigai - 11 (27.11.2026) Friday
UID:india-2026-11-27@panchangam
END:VEVENT
BEGIN:VEVENT
DTSTART;VALUE=DATE:20260122
DESCRIPTION:Thai - 08 (22.01.2026) Thursday\n\nYear: Vishvavasu Varudam (Vishvavasu Nama Samvathsaram)\nAyanam: Utharayanam\nRuthu: Hemantha Ruthu\nMonth: Thai Masam (Makaram Masam)\nPaksham: Shukla Paksham\nThithi: upto 2.28 AM Chathurthi\, thereafter Panchami\nDay: {Guru Vasaram} Thursday\nNakshatthiram: upto 3.06 PM Sathayam\, and then Poorattathi\nYogam: Variyana\nKaranam: Vanijai\nAmirthathiyogam: Siddha Yogam\nSubayogam: Subayogam\nRaghu Kalam: 1.52 PM to 3.16 PM\nYemakandam: 6.49 AM to 8.14 AM\nKuligai: 8.14 AM to 9.38 AM\nGood time: 6.49 AM to 8.14 AM and 12.27 PM to 1.52 PM\nSun Rise: 6.49 AM\nSun Set: 6.05 PM\nChandhirashtamam: Katakam\nSoolam: South\nPrayatchittham: Oil / Thailam\nSradhdhathithi: Chathurthi\nLocation: Hyderabad\, India
SUMMARY:Thai - 08 (22.01.2026) Thursday
UID:india-2026-01-22@panchangam
END:VEVENT
BEGIN:VEVENT
DTSTART;VALUE=DATE:20260401
DESCRIPTION:Panguni - 17 (01.04.2026) Wednesday\n\nYear: Vishvavasu Varudam (Vishvavasu Nama Samvathsaram)\nAyanam: Utharayanam\nRuthu: Shishira Ruthu\nMonth: Panguni Masam (Meenam Masam)\nPaksham: Shukla Paksham\nThithi: upto 7.06 AM Chadhurdasi\, thereafter Pournami\nDay: {Budha Vasaram} Wednesday\nNakshatthiram: upto 4.59 PM Uthiram\, and then Hastham\nYogam: Vriddhi\nKaranam: Vanijai\nAmirthathiyogam: Siddha Yogam\nSubayogam: Subayogam\nRaghu Kalam: 12.20 PM to 1.52 PM\nYemakandam: 7.43 AM to 9.15 AM\nKuligai: 9.15 AM to 10.47 AM\nGood time: 6.10 AM to 7.43 AM and 1.52 PM to 3.24 PM\nSun Rise: 6.10 AM\nSun Set: 6.29 PM\nChandhirashtamam: Kumbham\nSoolam: North\nPrayatchittham: Milk / Paal\nSradhdhathithi: Pournami\nLocation: Hyderabad\, India
SUMMARY:Panguni - 17 (01.04.2026) Wednesday
UID:india-2026-04-01@panchangam
END:VEVENT
BEGIN:VEVENT
DTSTART;VALUE=DATE:20260511
DESCRIPTION:Chithirai - 27 (11.05.2026) Monday\n\nYear: Parabhava Varudam (Parabhava Nama Samvathsaram)\nAyanam: Utharayanam\nRuthu: Vasantha Ruthu\nMonth: Chithirai Masam (Mesham Masam)\nPaksham: Krushna Paksham\nThithi: upto 3.25 PM Navami\, thereafter Dashami\nDay: {Soma Vasaram} Monday\nNakshatthiram: upto 2.08 AM Sathayam\, and then Poorattathi\nYogam: Indra\nKaranam: Garajai\nAmirthathiyogam: Siddha Yogam\nSubayogam: Subayogam\nRaghu Kalam: 7.22 AM to 8.59 AM\nYemakandam: 10.35 AM to 12.12 PM\nKuligai: 12.12 PM to 1.49 PM\nGood time: 5.45 AM to 7.22 AM and 12.12 PM to 1.49 PM\nSun Rise: 5.45 AM\nSun Set: 6.39 PM\nChandhirashtamam: Katakam\nSoolam: East\nPrayatchittham: Curd / Thayir\nSradhdhathithi: Navami\nLocation: Hyderabad\, India
SUMMARY:Chithirai - 27 (11.05.2026) Monday
UID:india-2026-05-11@panchangam
END:VEVENT
BEGIN:VEVENT
DTSTART;VALUE=DATE:20260621
DESCRIPTION:Aani - 06 (21.06.2026) Sunday\n\nYear: Parabhava Varudam (Parabhava Nama Samvathsaram)\nAyanam: Utharayanam\nRuthu: Grishma Ruthu\nMonth: Aani Masam (Mithunam Masam)\nPaksham: Shukla Paksham\nThithi: upto 3.21 PM Saptami\, thereafter Ashtami\nDay: {Ravi Vasaram} Sunday\nNakshatthiram: upto 10.12 AM Pooram\, and then Uthiram\nYogam: Siddhi\nKaranam: Vanijai\nAmirthathiyogam: Siddha Yogam\nSubayogam: Subayogam\nRaghu Kalam: 5.14 PM to 6.52 PM\nYemakandam: 12.17 PM to 1.56 PM\nKuligai: 1.56 PM to 3.35 PM\nGood time: 5.42 AM to 7.21 AM and 12.17 PM to 1.56 PM\nSun Rise: 5.42 AM\nSun Set: 6.52 PM\nChandhirashtamam: Makaram\nSoolam: West\nPrayatchittham: Jaggery / Vellam\nSradhdhathithi: Saptami\nLocation: Hyderabad\, India
SUMMARY:Aani - 06 (21.06.2026) Sunday
UID:india-2026-06-21@panchangam
END:VEVENT
BEGIN:VEVENT
DTSTART;VALUE=DATE:20260731
DESCRIPTION:Aadi - 14 (31.07.2026) Friday\n\nYear: Parabhava Varudam (Parabhava Nama Samvathsaram)\nAyanam: Dhatchinayanam\nRuthu: Grishma Ruthu\nMonth: Aadi Masam (Katakam Masam)\nPaksham: Krushna Paksham\nThithi: upto 10.32 PM Dwitiyai\, thereafter Tritiyai\nDay: {Sukra Vasaram} Friday\nNakshatthiram: upto 8.09 PM Avittam\, and then Sathayam\nYogam: Saubhagya\nKaranam: Thaitilai\nAmirthathiyogam: Siddha Yogam\nSubayogam: Subayogam\nRaghu Kalam: 10.45 AM to 12.22 PM\nYemakandam: 3.36 PM to 5.12 PM\nKuligai: 5.55 AM to 7.31 AM\nGood time: 5.55 AM to 7.31 AM and 12.22 PM to 1.59 PM\nSun Rise: 5.55 AM\nSun Set: 6.49 PM\nChandhirashtamam: Mithunam\nSoolam: West\nPrayatchittham: Jaggery / Vellam\nSradhdhathithi: Dwitiyai\nLocation: Hyderabad\, India
SUMMARY:Aadi - 14 (31.07.2026) Friday
UID:india-2026-07-31@panchangam
END:VEVENT
BEGIN:VEVENT
DESCRIPTION:Exact Astronomical Duration (Hyderabad\, India)
DTEND:20261029T164038Z
DTSTART:20261028T193713Z
SUMMARY:Sankatahara Chathurthi
UID:india-202610281937-19@tithi
END:VEVENT
BEGIN:VEVENT
DTSTART;VALUE=DATE:20251227
DESCRIPTION:Margazhi - 05 (27.12.2025) Saturday\n\nYear: Vishvavasu Varudam (Vishvavasu Nama Samvathsaram)\nAyanam: Utharayanam\nRuthu: Hemantha Ruthu\nMonth: Margazhi Masam (Dhanus Masam)\nPaksham: Shukla Paksham\nThithi: upto 1.10 PM Saptami\, thereafter Ashtami\nDay: {Sani Vasaram} Saturday\nNakshatthiram: upto 9.48 AM Poorattathi\, and then Uthirattathi\nYogam: Vyatipata\nKaranam: Vanijai\nAmirthathiyogam: Siddha Yogam\nSubayogam: Subayogam\nRaghu Kalam: 9.30 AM to 10.53 AM\nYemakandam: 1.40 PM to 3.03 PM\nKuligai: 3.03 PM to 4.26 PM\nGood time: 9.30 AM to 10.53 AM and 1.40 PM to 3.03 PM\nSun Rise: 6.44 AM\nSun Set: 5.50 PM\nChandhirashtamam: Simham\nSoolam: East\nPrayatchittham: Curd / Thayir\nSradhdhathithi: Ashtami\nLocation: Hyderabad\, India
SUMMARY:Margazhi - 05 (27.12.2025) Saturday
UID:india-2025-12-27@panchangam
END:VEVENT
BEGIN:VEVENT
DESCRIPTION:Exact Astronomical Duration (Hyderabad\, India)
DTEND:20261115T203140Z
DTSTART:20261114T175429Z
SUMMARY:Shukla Shashti
UID:india-202611141754-6@tithi
END:VEVENT
BEGIN:VEVENT
DTSTART;VALUE=DATE:20261204
DESCRIPTION:Karthigai - 18 (04.12.2026) Friday\n\nYear: Parabhava Varudam (Parabhava Nama Samvathsaram)\nAyanam: Dhatchinayanam\nRuthu: Sarath Ruthu\nMonth: Karthigai Masam (Virutchigam Masam)\nPaksham: Krushna Paksham\nThithi: upto 11.45 PM Ekadashi\, thereafter Dwadashi\nDay: {Sukra Vasaram} Friday\nNakshatthiram: upto 11.05 AM Hastham\, and then Chitthirai\nYogam: Aayushman\nKaranam: Bavai\nAmirthathiyogam: Siddha Yogam\nSubayogam: Subayogam\nRaghu Kalam: 10.42 AM to 12.06 PM\nYemakandam: 2.53 PM to 4.16 PM\nKuligai: 6.31 AM to 7.55 AM\nGood time: 6.31 AM to 7.55 AM and 12.06 PM to 1.29 PM\nSun Rise: 6.31 AM\nSun Set: 5.40 PM\nChandhirashtamam: Kumbham\nSoolam: West\nPrayatchittham: Jaggery / Vellam\nSradhdhathithi: Ekadashi\nLocation: Hyderabad\, India
SUMMARY:Karthigai - 18 (04.12.2026) Friday
UID:india-2026-12-04@panchangam
END:VEVENT
BEGIN:VEVENT
DTSTART;VALUE=DATE:20260129
DESCRIPTION:Thai - 15 (29.01.2026) Thursday\n\nYear: Vishvavasu Varudam (Vishvavasu Nama Samvathsaram)\nAyanam: Utharayanam\nRuthu: Hemantha Ruthu\nMonth: Thai Masam (Makaram Masam)\nPaksham: Shukla Paksham\nThithi: upto 1.55 PM Ekadashi\, thereafter Dwadashi\nDay: {Guru Vasaram} Thursday\nNakshatthiram: upto 8.07 AM Rohini\, upto 6.05 AM Mrigashirsham\, and then Thiruvathirai\nYogam: Indra\nKaranam: Vishti\nAmirthathiyogam: Siddha Yogam\nSubayogam: Subayogam\nRaghu Kalam: 1.54 PM to 3.19 PM\nYemakandam: 6.48 AM to 8.13 AM\nKuligai: 8.13 AM to 9.38 AM\nGood time: 6.48 AM to 8.13 AM and 12.29 PM to 1.54 PM\nSun Rise: 6.48 AM\nSun Set: 6.09 PM\nChandhirashtamam: Thulam\nSoolam: South\nPrayatchittham: Oil / Thailam\nSradhdhathithi: Dwadashi\nLocation: Hyderabad\, India
SUMMARY:Thai - 15 (29.01.2026) Thursday
UID:india-2026-01-29@panchangam
END:VEVENT
BEGIN:VEVENT
DESCRIPTION:Exact Astronomical Duration (Hyderabad\, India)
DTEND:20260223T033945Z
DTSTART:20260222T054025Z
SUMMARY:Shukla Shashti
UID:india-202602220540-6@tithi
END:VEVENT
BEGIN:VEVENT
DTSTART;VALUE=DATE:20260408
DESCRIPTION:Panguni - 24 (08.04.2026) Wednesday\n\nYear: Vishvavasu Varudam (Vishvavasu Nama Samvathsaram)\nAyanam: Utharayanam\nRuthu: Shishira Ruthu\nMonth: Panguni Masam (Meenam Masam)\nPaksham: Krushna Paksham\nThithi: upto 7.02 PM Shashti\, thereafter Saptami\nDay: {Budha Vasaram} Wednesday\nNakshatthiram: upto 6.38 AM Kettai\, and then Moolam\nYogam: Variyana\nKaranam: Vanijai\nAmirthathiyogam: Siddha Yogam\nSubayogam: Subayogam\nRaghu Kalam: 12.18 PM to 1.51 PM\nYemakandam: 7.38 AM to 9.11 AM\nKuligai: 9.11 AM to 10.44 AM\nGood time: 6.05 AM to 7.38 AM and 1.51 PM to 3.24 PM\nSun Rise: 6.05 AM\nSun Set: 6.30 PM\nChandhirashtamam: Mesham\nSoolam: North\nPrayatchittham: Milk / Paal\nSradhdhathithi: Shashti\nLocation: Hyderabad\, India
SUMMARY:Panguni - 24 (08.04.2026) Wednesday
UID:india-2026-04-08@panchangam
END:VEVENT
BEGIN:VEVENT
DTSTART;VALUE=DATE:20260518
DESCRIPTION:Vaikasi - 03 (18.05.2026) Monday\n\nYear: Parabhava Varudam (Parabhava Nama Samvathsaram)\nAyanam: Utharayanam\nRuthu: Vasantha Ruthu\nMonth: Vaikasi Masam (Rishabam Masam)\nPaksham: Shukla Paksham\nThithi: upto 5.53 PM Dwitiyai\, thereafter Tritiyai\nDay: {Soma Vasaram} Monday\nNakshatthiram: upto 12.06 PM Rohini\, and then Mrigashirsham\nYogam: Sukarman\nKaranam: Balavai\nAmirthathiyogam: Siddha Yogam\nSubayogam: Subayogam\nRaghu Kalam: 7.20 AM to 8.57 AM\nYemakandam: 10.35 AM to 12.12 PM\nKuligai: 12.12 PM to 1.49 PM\nGood time: 5.43 AM to 7.20 AM and 12.12 PM to 1.49 PM\nSun Rise: 5.43 AM\nSun Set: 6.41 PM\nChandhirashtamam: Thulam\nSoolam: East\nPrayatchittham: Curd / Thayir\nSradhdhathithi: Dwitiyai\nLocation: Hyderabad\, India
SUMMARY:Vaikasi - 03 (18.05.2026) Monday
UID:india-2026-05-18@panchangam
END:VEVENT
BEGIN:VEVENT
DTSTART;VALUE=DATE:20260628
DESCRIPTION:Aani - 13 (28.06.2026) Sunday\n\nYear: Parabhava Varudam (Parabhava Nama Samvathsaram)\nAyanam: Dhatchinayanam\nRuthu: Grishma Ruthu\nMonth: Aani Masam (Mithunam Masam)\nPaksham: Shukla Paksham\nThithi: upto 3.06 AM Chadhurdasi\, thereafter Pournami\nDay: {Ravi Vasaram} Sunday\nNakshatthiram: upto 1.53 AM Kettai\, and then Moolam\nYogam: Shubha\nKaranam: Garajai\nAmirthathiyogam: Siddha Yogam\nSubayogam: Subayogam\nRaghu Kalam: 5.15 PM to 6.54 PM\nYemakandam: 12.19 PM to 1.57 PM\nKuligai: 1.57 PM to 3.36 PM\nGood time: 5.44 AM to 7.23 AM and 12.19 PM to 1.57 PM\nSun Rise: 5.44 AM\nSun Set: 6.54 PM\nChandhirashtamam: Mesham\nSoolam: West\nPrayatchittham: Jaggery / Vellam\nSradhdhathithi: Chadhurdasi\nLocation: Hyderabad\, India
SUMMARY:Aani - 13 (28.06.2026) Sunday
UID:india-2026-06-28@panchangam
END:VEVENT
BEGIN:VEVENT
DTSTART;VALUE=DATE:20260907
DESCRIPTION:Aavani - 21 (07.09.2026) Monday\n\nYear: Parabhava Varudam (Parabhava Nama Samvathsaram)\nAyanam: Dhatchinayanam\nRuthu: Varsha Ruthu\nMonth: Aavani Masam (Simham Masam)\nPaksham: Krushna Paksham\nThithi: upto 5.04 PM Ekadashi\, thereafter Dwadashi\nDay: {Soma Vasaram} Monday\nNakshatthiram: upto 6.51 PM Punarpoosam\, and then Poosam\nYogam: Vyatipata\nKaranam: Bavai\nAmirthathiyogam: Siddha Yogam\nSubayogam: Subayogam\nRaghu Kalam: 7.35 AM to 9.08 AM\nYemakandam: 10.41 AM to 12.14 PM\nKuligai: 12.14 PM to 1.46 PM\nGood time: 6.03 AM to 7.35 AM and 12.14 PM to 1.46 PM\nSun Rise: 6.03 AM\nSun Set: 6.25 PM\nChandhirashtamam: Virutchigam\nSoolam: East\nPrayatchittham: Curd / Thayir\nSradhdhathithi: Ekadashi\nLocation: Hyderabad\, India
SUMMARY:Aavani - 21 (07.09.2026) Monday
UID:india-2026-09-07@panchangam
END:VEVENT
BEGIN:VEVENT
DTSTART;VALUE=DATE:20261002
DESCRIPTION:Purattasi - 15 (02.10.2026) Friday\n\nYear: Parabhava Varudam (Parabhava Nama Samvathsaram)\nAyanam: Dhatchinayanam\nRuthu: Varsha Ruthu\nMonth: Purattasi Masam (Kanni Masam)\nPaksham: Krushna Paksham\nThithi: upto 10.15 AM Shashti\, thereafter Saptami\nDay: {Sukra Vasaram} Friday\nNakshatthiram: upto 3.33 AM Mrigashirsham\, and then Thiruvathirai\nYogam: Vyatipata\nKaranam: Vanijai\nAmirthathiyogam: Siddha Yogam\nSubayogam: Subayogam\nRaghu Kalam: 10.35 AM to 12.05 PM\nYemakandam: 3.04 PM to 4.34 PM\nKuligai: 6.06 AM to 7.36 AM\nGood time: 6.06 AM to 7.36 AM and 12.05 PM to 1.35 PM\nSun Rise: 6.06 AM\nSun Set: 6.04 PM\nChandhirashtamam: Thulam\nSoolam: West\nPrayatchittham: Jaggery / Vellam\nSradhdhathithi: Saptami\nLocation: Hyderabad\, India
SUMMARY:Purattasi - 15 (02.10.2026) Friday
UID:india-2026-10-02@panchangam
END:VEVENT
BEGIN:VEVENT
DTSTART;VALUE=DATE:20261112
DESCRIPTION:Aippasi - 26 (12.11.2026) Thursday\n\nYear: Parabhava Varudam (Parabhava Nama Samvathsaram)\nAyanam: Dhatchinayanam\nRuthu: Sarath Ruthu\nMonth: Aippasi Masam (Thulam Masam)\nPaksham: Shukla Paksham\nThithi: upto 6.09 PM Tritiyai\, thereafter Chathurthi\nDay: {Guru Vasaram} Thursday\nNakshatthiram: upto 3.04 PM Kettai\, and then Moolam\nYogam: Sukarman\nKaranam: Garajai\nAmirthathiyogam: Siddha Yogam\nSubayogam: Subayogam\nRaghu Kalam: 1.25 PM to 2.50 PM\nYemakandam: 6.19 AM to 7.44 AM\nKuligai: 7.44 AM to 9.09 AM\nGood time: 6.19 AM to 7.44 AM and 12 Noon to 1.25 PM\nSun Rise: 6.19 AM\nSun Set: 5.40 PM\nChandhirashtamam: Mesham\nSoolam: South\nPrayatchittham: Oil / Thailam\nSradhdhathithi: Tritiyai\nLocation: Hyderabad\, India
SUMMARY:Aippasi - 26 (12.11.2026) Thursday
UID:india-2026-11-12@panchangam
END:VEVENT
BEGIN:VEVENT
DTSTART;VALUE=DATE:20261222
DESCRIPTION:Margazhi - 06 (22.12.2026) Tuesday\n\nYear: Parabhava Varudam (Parabhava Nama Samvathsaram)\nAyanam: Dhatchinayanam\nRuthu: Hemantha Ruthu\nMonth: Margazhi Masam (Dhanus Masam)\nPaksham: Shukla Paksham\nThithi: upto 2.24 PM Trayodashi\, thereafter Chadhurdasi\nDay: {Bhauma Vasaram} Tuesday\nNakshatthiram: upto 11.21 AM Karthigai\, and then Rohini\nYogam: Sadhya\nKaranam: Thaitilai\nAmirthathiyogam: Siddha Yogam\nSubayogam: Subayogam\nRaghu Kalam: 3.00 PM to 4.24 PM\nYemakandam: 9.28 AM to 10.51 AM\nKuligai: 10.51 AM to 12.14 PM\nGood time: 8.04 AM to 9.28 AM and 3.00 PM to 4.24 PM\nSun Rise: 6.41 AM\nSun Set: 5.47 PM\nChandhirashtamam: Thulam\nSoolam: North\nPrayatchittham: Milk / Paal\nSradhdhathithi: Chadhurdasi\nLocation: Hyderabad\, India
SUMMARY:Margazhi - 06 (22.12.2026) Tuesday
UID:india-2026-12-22@panchangam
END:VEVENT
BEGIN:VEVENT
DTSTART;VALUE=DATE:20260206
DESCRIPTION:Thai - 23 (06.02.2026) Friday\n\nYear: Vishvavasu Varudam (Vishvavasu Nama Samvathsaram)\nAyanam: Utharayanam\nRuthu: Hemantha Ruthu\nMonth: Thai Masam (Makaram Masam)\nPaksham: Krushna Paksham\nThithi: upto 1.19 AM Panchami\, thereafter Shashti\nDay: {Sukra Vasaram} Friday\nNakshatthiram: upto 1.06 AM Hastham\, and then Chitthirai\nYogam: Dhriti\nKaranam: Kaulavai\nAmirthathiyogam: Siddha Yogam\nSubayogam: Subayogam\nRaghu Kalam: 11.04 AM to 12.30 PM\nYemakandam: 3.21 PM to 4.47 PM\nKuligai: 6.46 AM to 8.12 AM\nGood time: 6.46 AM to 8.12 AM and 12.30 PM to 1.56 PM\nSun Rise: 6.46 AM\nSun Set: 6.13 PM\nChandhirashtamam: Kumbham\nSoolam: West\nPrayatchittham: Jaggery / Vellam\nSradhdhathithi: Panchami\nLocation: Hyderabad\, India
SUMMARY:Thai - 23 (06.02.2026) Friday
UID:india-2026-02-06@panchangam
END:VEVENT
BEGIN:VEVENT
DTSTART;VALUE=DATE:20260316
DESCRIPTION:Panguni - 01 (16.03.2026) Monday\n\nYear: Vishvavasu Varudam (Vishvavasu Nama Samvathsaram)\nAyanam: Utharayanam\nRuthu: Shishira Ruthu\nMonth: Panguni Masam (Meenam Masam)\nPaksham: Krushna Paksham\nThithi: upto 9.41 AM Dwadashi\, thereafter Trayodashi\nDay: {Soma Vasaram} Monday\nNakshatthiram: upto 6.37 AM Thiruvonam\, and then Avittam\nYogam: Shiva\nKaranam: Thaitilai\nAmirthathiyogam: Siddha Yogam\nSubayogam: Subayogam\nRaghu Kalam: 7.53 AM to 9.24 AM\nYemakandam: 10.54 AM to 12.24 PM\nKuligai: 12.24 PM to 1.55 PM\nGood time: 6.23 AM to 7.53 AM and 12.24 PM to 1.55 PM\nSun Rise: 6.23 AM\nSun Set: 6.26 PM\nChandhirashtamam: Mithunam\nSoolam: East\nPrayatchittham: Curd / Thayir\nSradhdhathithi: Trayodashi\nLocation: Hyderabad\, India
SUMMARY:Panguni - 01 (16.03.2026) Monday
UID:india-2026-03-16@panchangam
END:VEVENT
BEGIN:VEVENT
DTSTART;VALUE=DATE:20260426
DESCRIPTION:Chithirai - 12 (26.04.2026) Sunday\n\nYear: Parabhava Varudam (Parabhava Nama Samvathsaram)\nAyanam: Utharayanam\nRuthu: Vasantha Ruthu\nMonth: Chithirai Masam (Mesham Masam)\nPaksham: Shukla Paksham\nThithi: upto 6.07 PM Dashami\, thereafter Ekadashi\nDay: {Ravi Vasaram} Sunday\nNakshatthiram: upto 9.08 PM Magam\, and then Pooram\nYogam: Vriddhi\nKaranam: Thaitilai\nAmirthathiyogam: Marana Yogam\nSubayogam: \nRaghu Kalam: 4.59 PM to 6.34 PM\nYemakandam: 12.13 PM to 1.49 PM\nKuligai: 1.49 PM to 3.24 PM\nGood time: 5.53 AM to 7.28 AM and 12.13 PM to 1.49 PM\nSun Rise: 5.53 AM\nSun Set: 6.34 PM\nChandhirashtamam: Makaram\nSoolam: West\nPrayatchittham: Jaggery / Vellam\nSradhdhathithi: Dashami\nLocation: Hyderabad\, India
SUMMARY:Chithirai - 12 (26.04.2026) Sunday
UID:india-2026-04-26@panchangam
END:VEVENT
BEGIN:VEVENT
DESCRIPTION:Exact Astronomical Duration (Hyderabad\, India)
DTEND:20251230T233102Z
DTSTART:20251230T022135Z
SUMMARY:Shukla Ekadasi
UID:india-202512300221-11@tithi
END:VEVENT
BEGIN:VEVENT
DTSTART;VALUE=DATE:20260705
DESCRIPTION:Aani - 20 (05.07.2026) Sunday\n\nYear: Parabhava Varudam (Parabhava Nama Samvathsaram)\nAyanam: Dhatchinayanam\nRuthu: Grishma Ruthu\nMonth: Aani Masam (Mithunam Masam)\nPaksham: Krushna Paksham\nThithi: upto 1.31 PM Panchami\, thereafter Shashti\nDay: {Ravi Vasaram} Sunday\nNakshatthiram: upto 3.54 PM Sathayam\, and then Poorattathi\nYogam: Aayushman\nKaranam: Thaitilai\nAmirthathiyogam: Siddha Yogam\nSubayogam: Subayogam\nRaghu Kalam: 5.16 PM to 6.54 PM\nYemakandam: 12.20 PM to 1.59 PM\nKuligai: 1.59 PM to 3.37 PM\nGood time: 5.46 AM to 7.25 AM and 12.20 PM to 1.59 PM\nSun Rise: 5.46 AM\nSun Set: 6.54 PM\nChandhirashtamam: Katakam\nSoolam: West\nPrayatchittham: Jaggery / Vellam\nSradhdhathithi: Shashti\nLocation: Hyderabad\, India
SUMMARY:Aani - 20 (05.07.2026) Sunday
UID:india-2026-07-05@panchangam
END:VEVENT
BEGIN:VEVENT
DTSTART;VALUE=DATE:20260815
DESCRIPTION:Aadi - 29 (15.08.2026) Saturday\n\nYear: Parabhava Varudam (Parabhava Nama Samvathsaram)\nAyanam: Dhatchinayanam\nRuthu: Grishma Ruthu\nMonth: Aadi Masam (Katakam Masam)\nPaksham: Shukla Paksham\nThithi: upto 5.29 PM Tritiyai\, thereafter Chathurthi\nDay: {Sani Vasaram} Saturday\nNakshatthiram: upto 4.05 AM Uthiram\, and then Hastham\nYogam: Shiva\nKaranam: Thaitilai\nAmirthathiyogam: Marana Yogam\nSubayogam: \nRaghu Kalam: 9.09 AM to 10.45 AM\nYemakandam: 1.55 PM to 3.31 PM\nKuligai: 3.31 PM to 5.06 PM\nGood time: 9.09 AM to 10.45 AM and 1.55 PM to 3.31 PM\nSun Rise: 5.59 AM\nSun Set: 6.41 PM\nChandhirashtamam: Makaram\nSoolam: East\nPrayatchittham: Curd / Thayir\nSradhdhathithi: Tritiyai\nLocation: Hyderabad\, India
SUMMARY:Aadi - 29 (15.08.2026) Saturday
UID:india-2026-08-15@panchangam
END:VEVENT
BEGIN:VEVENT
DTSTART;VALUE=DATE:20260925
DESCRIPTION:Purattasi - 08 (25.09.2026) Friday\n\nYear: Parabhava Varudam (Parabhava Nama Samvathsaram)\nAyanam: Dhatchinayanam\nRuthu: Varsha Ruthu\nMonth: Purattasi Masam (Kanni Masam)\nPaksham: Shukla Paksham\nThithi: upto 11.07 PM Chadhurdasi\, thereafter Pournami\nDay: {Sukra Vasaram} Friday\nNakshatthiram: upto 12.03 PM Sathayam\, and then Poorattathi\nYogam: Shoola\nKaranam: Garajai\nAmirthathiyogam: Siddha Yogam\nSubayogam: Subayogam\nRaghu Kalam: 10.37 AM to 12.07 PM\nYemakandam: 3.08 PM to 4.39 PM\nKuligai: 6.05 AM to 7.35 AM\nGood time: 6.05 AM to 7.35 AM and 12.07 PM to 1.38 PM\nSun Rise: 6.05 AM\nSun Set: 6.09 PM\nChandhirashtamam: Katakam\nSoolam: West\nPrayatchittham: Jaggery / Vellam\nSradhdhathithi: Chadhurdasi\nLocation: Hyderabad\, India
SUMMARY:Purattasi - 08 (25.09.2026) Friday
UID:india-2026-09-25@panchangam
END:VEVENT
BEGIN:VEVENT
DTSTART;VALUE=DATE:20261020
DESCRIPTION:Aippasi - 03 (20.10.2026) Tuesday\n\nYear: Parabhava Varudam (Parabhava Nama Samvathsaram)\nAyanam: Dhatchinayanam\nRuthu: Sarath Ruthu\nMonth: Aippasi Masam (Thulam Masam)\nPaksham: Shukla Paksham\nThithi: upto 12.50 PM Navami\, thereafter Dashami\nDay: {Bhauma Vasaram} Tuesday\nNakshatthiram: upto 6.46 PM Thiruvonam\, and then Avittam\nYogam: Shoola\nKaranam: Kaulavai\nAmirthathiyogam: Siddha Yogam\nSubayogam: Subayogam\nRaghu Kalam: 2.55 PM to 4.23 PM\nYemakandam: 9.05 AM to 10.33 AM\nKuligai: 10.33 AM to 12 Noon\nGood time: 7.37 AM to 9.05 AM and 2.55 PM to 4.23 PM\nSun Rise: 6.10 AM\nSun Set: 5.51 PM\nChandhirashtamam: Mithunam\nSoolam: North\nPrayatchittham: Milk / Paal\nSradhdhathithi: Dashami\nLocation: Hyderabad\, India
SUMMARY:Aippasi - 03 (20.10.2026) Tuesday
UID:india-2026-10-20@panchangam
END:VEVENT
BEGIN:VEVENT
DTSTART;VALUE=DATE:20261130
DESCRIPTION:Karthigai - 14 (30.11.2026) Monday\n\nYear: Parabhava Varudam (Parabhava Nama Samvathsaram)\nAyanam: Dhatchinayanam\nRuthu: Sarath Ruthu\nMonth: Karthigai Masam (Virutchigam Masam)\nPaksham: Krushna Paksham\nThithi: upto 12.12 AM Saptami\, thereafter Ashtami\nDay: {Soma Vasaram} Monday\nNakshatthiram: upto 10.21 AM Aayilyam\, and then Magam\nYogam: Indra\nKaranam: Vishti\nAmirthathiyogam: Siddha Yogam\nSubayogam: Subayogam\nRaghu Kalam: 7.53 AM to 9.16 AM\nYemakandam: 10.40 AM to 12.04 PM\nKuligai: 12.04 PM to 1.28 PM\nGood time: 6.29 AM to 7.53 AM and 12.04 PM to 1.28 PM\nSun Rise: 6.29 AM\nSun Set: 5.39 PM\nChandhirashtamam: Dhanus\nSoolam: East\nPrayatchittham: Curd / Thayir\nSradhdhathithi: Saptami\nLocation: Hyderabad\, India
SUMMARY:Karthigai - 14 (30.11.2026) Monday
UID:india-2026-11-30@panchangam
END:VEVENT
BEGIN:VEVENT
DTSTART;VALUE=DATE:20261009
DESCRIPTION:Purattasi - 22 (09.10.2026) Friday\n\nYear: Parabhava Varudam (Parabhava Nama Samvathsaram)\nAyanam: Dhatchinayanam\nRuthu: Varsha Ruthu\nMonth: Purattasi Masam (Kanni Masam)\nPaksham: Krushna Paksham\nThithi: upto 9.36 PM Chadhurdasi\, thereafter Amavasai\nDay: {Sukra Vasaram} Friday\nNakshatthiram: upto 10.00 PM Uthiram\, and then Hastham\nYogam: Brahma\nKaranam: Vishti\nAmirthathiyogam: Siddha Yogam\nSubayogam: Subayogam\nRaghu Kalam: 10.34 AM to 12.03 PM\nYemakandam: 3.01 PM to 4.29 PM\nKuligai: 6.07 AM to 7.36 AM\nGood time: 6.07 AM to 7.36 AM and 12.03 PM to 1.32 PM\nSun Rise: 6.07 AM\nSun Set: 5.58 PM\nChandhirashtamam: Kumbham\nSoolam: West\nPrayatchittham: Jaggery / Vellam\nSradhdhathithi: Chadhurdasi\nLocation: Hyderabad\, India
SUMMARY:Purattasi - 22 (09.10.2026) Friday
UID:india-2026-10-09@panchangam
END:VEVENT
BEGIN:VEVENT
DTSTART;VALUE=DATE:20261119
DESCRIPTION:Karthigai - 03 (19.11.2026) Thursday\n\nYear: Parabhava Varudam (Parabhava Nama Samvathsaram)\nAyanam: Dhatchinayanam\nRuthu: Sarath Ruthu\nMonth: Karthigai Masam (Virutchigam Masam)\nPaksham: Shukla Paksham\nThithi: upto 7.06 AM Navami\, thereafter Dashami\nDay: {Guru Vasaram} Thursday\nNakshatthiram: upto 6.53 AM Sathayam\, and then Poorattathi\nYogam: Vyaghata\nKaranam: Kaulavai\nAmirthathiyogam: Siddha Yogam\nSubayogam: Subayogam\nRaghu Kalam: 1.25 PM to 2.50 PM\nYemakandam: 6.22 AM to 7.47 AM\nKuligai: 7.47 AM to 9.12 AM\nGood time: 6.22 AM to 7.47 AM and 12.01 PM to 1.25 PM\nSun Rise: 6.22 AM\nSun Set: 5.39 PM\nChandhirashtamam: Katakam\nSoolam: South\nPrayatchittham: Oil / Thailam\nSradhdhathithi: Dashami\nLocation: Hyderabad\, India
SUMMARY:Karthigai - 03 (19.11.2026) Thursday
UID:india-2026-11-19@panchangam
END:VEVENT
BEGIN:VEVENT
DTSTART;VALUE=DATE:20260114
DESCRIPTION:Margazhi - 23 (14.01.2026) Wednesday\n\nYear: Vishvavasu Varudam (Vishvavasu Nama Samvathsaram)\nAyanam: Utharayanam\nRuthu: Hemantha Ruthu\nMonth: Margazhi Masam (Dhanus Masam)\nPaksham: Krushna Paksham\nThithi: upto 5.53 PM Ekadashi\, thereafter Dwadashi\nDay: {Budha Vasaram} Wednesday\nNakshatthiram: upto 3.47 AM Anusham\, and then Kettai\nYogam: Ganda\nKaranam: Balavai\nAmirthathiyogam: Amirtha Yogam\nSubayogam: Subayogam\nRaghu Kalam: 12.25 PM to 1.49 PM\nYemakandam: 8.13 AM to 9.37 AM\nKuligai: 9.37 AM to 11.01 AM\nGood time: 6.49 AM to 8.13 AM and 1.49 PM to 3.12 PM\nSun Rise: 6.49 AM\nSun Set: 6.00 PM\nChandhirashtamam: Mesham\nSoolam: North\nPrayatchittham: Milk / Paal\nSradhdhathithi: Ekadashi\nLocation: Hyderabad\, India
SUMMARY:Margazhi - 23 (14.01.2026) Wednesday
UID:india-2026-01-14@panchangam
END:VEVENT
BEGIN:VEVENT
DTSTART;VALUE=DATE:20260224
DESCRIPTION:Maasi - 11 (24.02.2026) Tuesday\n\nYear: Vishvavasu Varudam (Vishvavasu Nama Samvathsaram)\nAyanam: Utharayanam\nRuthu: Shishira Ruthu\nMonth: Maasi Masam (Kumbham Masam)\nPaksham: Shukla Paksham\nThithi: upto 7.02 AM Saptami\, upto 4.52 AM Ashtami\, thereafter Navami\nDay: {Bhauma Vasaram} Tuesday\nNakshatthiram: upto 3.44 PM Karthigai\, and then Rohini\nYogam: Indra\nKaranam: Vanijai\nAmirthathiyogam: Siddha Yogam\nSubayogam: Subayogam\nRaghu Kalam: 3.25 PM to 4.53 PM\nYemakandam: 9.33 AM to 11.01 AM\nKuligai: 11.01 AM to 12.29 PM\nGood time: 8.05 AM to 9.33 AM and 3.25 PM to 4.53 PM\nSun Rise: 6.37 AM\nSun Set: 6.20 PM\nChandhirashtamam: Thulam\nSoolam: North\nPrayatchittham: Milk / Paal\nSradhdhathithi: Ashtami\nLocation: Hyderabad\, India
SUMMARY:Maasi - 11 (24.02.2026) Tuesday
UID:india-2026-02-24@panchangam
END:VEVENT
BEGIN:VEVENT
DTSTART;VALUE=DATE:20260503
DESCRIPTION:Chithirai - 19 (03.05.2026) Sunday\n\nYear: Parabhava Varudam (Parabhava Nama Samvathsaram)\nAyanam: Utharayanam\nRuthu: Vasantha Ruthu\nMonth: Chithirai Masam (Mesham Masam)\nPaksham: Krushna Paksham\nThithi: upto 3.02 AM Dwitiyai\, thereafter Tritiyai\nDay: {Ravi Vasaram} Sunday\nNakshatthiram: upto 7.54 AM Visakam\, and then Anusham\nYogam: Variyana\nKaranam: Thaitilai\nAmirthathiyogam: Marana Yogam\nSubayogam: \nRaghu Kalam: 5.00 PM to 6.36 PM\nYemakandam: 12.13 PM to 1.48 PM\nKuligai: 1.48 PM to 3.24 PM\nGood time: 5.49 AM to 7.25 AM and 12.13 PM to 1.48 PM\nSun Rise: 5.49 AM\nSun Set: 6.36 PM\nChandhirashtamam: Mesham\nSoolam: West\nPrayatchittham: Jaggery / Vellam\nSradhdhathithi: Dwitiyai\nLocation: Hyderabad\, India
SUMMARY:Chithirai - 19 (03.05.2026) Sunday
UID:india-2026-05-03@panchangam
END:VEVENT
BEGIN:VEVENT
DTSTART;VALUE=DATE:20251230
DESCRIPTION:Margazhi - 08 (30.12.2025) Tuesday\n\nYear: Vishvavasu Varudam (Vishvavasu Nama Samvathsaram)\nAyanam: Utharayanam\nRuthu: Hemantha Ruthu\nMonth: Margazhi Masam (Dhanus Masam)\nPaksham: Shukla Paksham\nThithi: upto 7.51 AM Dashami\, upto 5.01 AM Ekadashi\, thereafter Dwadashi\nDay: {Bhauma Vasaram} Tuesday\nNakshatthiram: upto 4.33 AM Bharani\, and then Karthigai\nYogam: Siddha\nKaranam: Garajai\nAmirthathiyogam: Siddha Yogam\nSubayogam: Subayogam\nRaghu Kalam: 3.05 PM to 4.28 PM\nYemakandam: 9.32 AM to 10.55 AM\nKuligai: 10.55 AM to 12.18 PM\nGood time: 8.08 AM to 9.32 AM and 3.05 PM to 4.28 PM\nSun Rise: 6.45 AM\nSun Set: 5.51 PM\nChandhirashtamam: Kanni\nSoolam: North\nPrayatchittham: Milk / Paal\nSradhdhathithi: Ekadashi\nLocation: Hyderabad\, India
SUMMARY:Margazhi - 08 (30.12.2025) Tuesday
UID:india-2025-12-30@panchangam
END:VEVENT
BEGIN:VEVENT
DTSTART;VALUE=DATE:20260613
DESCRIPTION:Vaikasi - 29 (13.06.2026) Saturday\n\nYear: Parabhava Varudam (Parabhava Nama Samvathsaram)\nAyanam: Utharayanam\nRuthu: Vasantha Ruthu\nMonth: Vaikasi Masam (Rishabam Masam)\nPaksham: Krushna Paksham\nThithi: upto 4.08 PM Trayodashi\, thereafter Chadhurdasi\nDay: {Sani Vasaram} Saturday\nNakshatthiram: upto 1.52 AM Karthigai\, and then Rohini\nYogam: Sukarman\nKaranam: Garajai\nAmirthathiyogam: Siddha Yogam\nSubayogam: Subayogam\nRaghu Kalam: 8.58 AM to 10.37 AM\nYemakandam: 1.54 PM to 3.33 PM\nKuligai: 3.33 PM to 5.12 PM\nGood time: 8.58 AM to 10.37 AM and 1.54 PM to 3.33 PM\nSun Rise: 5.41 AM\nSun Set: 6.50 PM\nChandhirashtamam: Kanni\nSoolam: East\nPrayatchittham: Curd / Thayir\nSradhdhathithi: Trayodashi\nLocation: Hyderabad\, India
SUMMARY:Vaikasi - 29 (13.06.2026) Saturday
UID:india-2026-06-13@panchangam
END:VEVENT
BEGIN:VEVENT
DTSTART;VALUE=DATE:20260723
DESCRIPTION:Aadi - 06 (23.07.2026) Thursday\n\nYear: Parabhava Varudam (Parabhava Nama Samvathsaram)\nAyanam: Dhatchinayanam\nRuthu: Grishma Ruthu\nMonth: Aadi Masam (Katakam Masam)\nPaksham: Shukla Paksham\nThithi: upto 7.03 AM Navami\, thereafter Dashami\nDay: {Guru Vasaram} Thursday\nNakshatthiram: upto 2.27 AM Visakam\, and then Anusham\nYogam: Shubha\nKaranam: Kaulavai\nAmirthathiyogam: Marana Yogam\nSubayogam: \nRaghu Kalam: 1.59 PM to 3.37 PM\nYemakandam: 5.52 AM to 7.30 AM\nKuligai: 7.30 AM to 9.07 AM\nGood time: 5.52 AM to 7.30 AM and 12.22 PM to 1.59 PM\nSun Rise: 5.52 AM\nSun Set: 6.52 PM\nChandhirashtamam: Meenam\nSoolam: South\nPrayatchittham: Oil / Thailam\nSradhdhathithi: Dashami\nLocation: Hyderabad\, India
SUMMARY:Aadi - 06 (23.07.2026) Thursday
UID:india-2026-07-23@panchangam
END:VEVENT
BEGIN:VEVENT
DESCRIPTION:Exact Astronomical Duration (Hyderabad\, India)
DTEND:20251226T081402Z
DTSTART:20251225T081313Z
SUMMARY:Shukla Shashti
UID:india-202512250813-6@tithi
END:VEVENT
BEGIN:VEVENT
DTSTART;VALUE=DATE:20261027
DESCRIPTION:Aippasi - 10 (27.10.2026) Tuesday\n\nYear: Parabhava Varudam (Parabhava Nama Samvathsaram)\nAyanam: Dhatchinayanam\nRuthu: Sarath Ruthu\nMonth: Aippasi Masam (Thulam Masam)\nPaksham: Krushna Paksham\nThithi: upto 7.02 AM Prathamai\, upto 4.07 AM Dwitiyai\, thereafter Tritiyai\nDay: {Bhauma Vasaram} Tuesday\nNakshatthiram: upto 4.16 PM Bharani\, and then Karthigai\nYogam: Siddhi\nKaranam: Kaulavai\nAmirthathiyogam: Siddha Yogam\nSubayogam: Subayogam\nRaghu Kalam: 2.53 PM to 4.20 PM\nYemakandam: 9.06 AM to 10.33 AM\nKuligai: 10.33 AM to 11.59 AM\nGood time: 7.39 AM to 9.06 AM and 2.53 PM to 4.20 PM\nSun Rise: 6.12 AM\nSun Set: 5.47 PM\nChandhirashtamam: Kanni\nSoolam: North\nPrayatchittham: Milk / Paal\nSradhdhathithi: Dwitiyai\nLocation: Hyderabad\, India
SUMMARY:Aippasi - 10 (27.10.2026) Tuesday
UID:india-2026-10-27@panchangam
END:VEVENT
BEGIN:VEVENT
DTSTART;VALUE=DATE:20260301
DESCRIPTION:Maasi - 16 (01.03.2026) Sunday\n\nYear: Vishvavasu Varudam (Vishvavasu Nama Samvathsaram)\nAyanam: Utharayanam\nRuthu: Shishira Ruthu\nMonth: Maasi Masam (Kumbham Masam)\nPaksham: Shukla Paksham\nThithi: upto 7.09 PM Trayodashi\, thereafter Chadhurdasi\nDay: {Ravi Vasaram} Sunday\nNakshatthiram: upto 9.12 AM Poosam\, and then Aayilyam\nYogam: Shobhana\nKaranam: Kaulavai\nAmirthathiyogam: Siddha Yogam\nSubayogam: Subayogam\nRaghu Kalam: 4.53 PM to 6.22 PM\nYemakandam: 12.28 PM to 1.56 PM\nKuligai: 1.56 PM to 3.25 PM\nGood time: 6.34 AM to 8.03 AM and 12.28 PM to 1.56 PM\nSun Rise: 6.34 AM\nSun Set: 6.22 PM\nChandhirashtamam: Dhanus\nSoolam: West\nPrayatchittham: Jaggery / Vellam\nSradhdhathithi: Trayodashi\nLocation: Hyderabad\, India
SUMMARY:Maasi - 16 (01.03.2026) Sunday
UID:india-2026-03-01@panchangam
END:VEVENT
BEGIN:VEVENT
DTSTART;VALUE=DATE:20260411
DESCRIPTION:Panguni - 27 (11.04.2026) Saturday\n\nYear: Vishvavasu Varudam (Vishvavasu Nama Samvathsaram)\nAyanam: Utharayanam\nRuthu: Shishira Ruthu\nMonth: Panguni Masam (Meenam Masam)\nPaksham: Krushna Paksham\nThithi: upto 12.38 AM Navami\, thereafter Dashami\nDay: {Sani Vasaram} Saturday\nNakshatthiram: upto 2.22 PM Uthiradam\, and then Thiruvonam\nYogam: Siddha\nKaranam: Thaitilai\nAmirthathiyogam: Siddha Yogam\nSubayogam: Subayogam\nRaghu Kalam: 9.10 AM to 10.43 AM\nYemakandam: 1.50 PM to 3.24 PM\nKuligai: 3.24 PM to 4.57 PM\nGood time: 9.10 AM to 10.43 AM and 1.50 PM to 3.24 PM\nSun Rise: 6.03 AM\nSun Set: 6.31 PM\nChandhirashtamam: Mithunam\nSoolam: East\nPrayatchittham: Curd / Thayir\nSradhdhathithi: Navami\nLocation: Hyderabad\, India
SUMMARY:Panguni - 27 (11.04.2026) Saturday
UID:india-2026-04-11@panchangam
END:VEVENT
BEGIN:VEVENT
DTSTART;VALUE=DATE:20260521
DESCRIPTION:Vaikasi - 06 (21.05.2026) Thursday\n\nYear: Parabhava Varudam (Parabhava Nama Samvathsaram)\nAyanam: Utharayanam\nRuthu: Vasantha Ruthu\nMonth: Vaikasi Masam (Rishabam Masam)\nPaksham: Shukla Paksham\nThithi: upto 8.27 AM Panchami\, thereafter Shashti\nDay: {Guru Vasaram} Thursday\nNakshatthiram: upto 3.27 AM Poosam\, and then Aayilyam\nYogam: Ganda\nKaranam: Balavai\nAmirthathiyogam: Amirtha Yogam\nSubayogam: Subayogam\nRaghu Kalam: 1.50 PM to 3.27 PM\nYemakandam: 5.42 AM to 7.20 AM\nKuligai: 7.20 AM to 8.57 AM\nGood time: 5.42 AM to 7.20 AM and 12.12 PM to 1.50 PM\nSun Rise: 5.42 AM\nSun Set: 6.42 PM\nChandhirashtamam: Dhanus\nSoolam: South\nPrayatchittham: Oil / Thailam\nSradhdhathithi: Shashti\nLocation: Hyderabad\, India
SUMMARY:Vaikasi - 06 (21.05.2026) Thursday
UID:india-2026-05-21@panchangam
END:VEVENT
BEGIN:VEVENT
DESCRIPTION:Exact Astronomical Duration (Hyderabad\, India)
DTEND:20260324T103820Z
DTSTART:20260323T130850Z
SUMMARY:Shukla Shashti
UID:india-202603231308-6@tithi
END:VEVENT
BEGIN:VEVENT
DTSTART;VALUE=DATE:20260910
DESCRIPTION:Aavani - 24 (10.09.2026) Thursday\n\nYear: Parabhava Varudam (Parabhava Nama Samvathsaram)\nAyanam: Dhatchinayanam\nRuthu: Varsha Ruthu\nMonth: Aavani Masam (Simham Masam)\nPaksham: Krushna Paksham\nThithi: upto 10.33 AM Chadhurdasi\, thereafter Amavasai\nDay: {Guru Vasaram} Thursday\nNakshatthiram: upto 2.43 PM Magam\, and then Pooram\nYogam: Siddha\nKaranam: Shakuni\nAmirthathiyogam: Marana Yogam\nSubayogam: \nRaghu Kalam: 1.45 PM to 3.17 PM\nYemakandam: 6.03 AM to 7.35 AM\nKuligai: 7.35 AM to 9.08 AM\nGood time: 6.03 AM to 7.35 AM and 12.12 PM to 1.45 PM\nSun Rise: 6.03 AM\nSun Set: 6.22 PM\nChandhirashtamam: Makaram\nSoolam: South\nPrayatchittham: Oil / Thailam\nSradhdhathithi: Amavasai\nLocation: Hyderabad\, India
SUMMARY:Aavani - 24 (10.09.2026) Thursday
UID:india-2026-09-10@panchangam
END:VEVENT
BEGIN:VEVENT
DTSTART;VALUE=DATE:20261104
DESCRIPTION:Aippasi - 18 (04.11.2026) Wednesday\n\nYear: Parabhava Varudam (Parabhava Nama Samvathsaram)\nAyanam: Dhatchinayanam\nRuthu: Sarath Ruthu\nMonth: Aippasi Masam (Thulam Masam)\nPaksham: Krushna Paksham\nThithi: upto 11.03 AM Dashami\, thereafter Ekadashi\nDay: {Budha Vasaram} Wednesday\nNakshatthiram: upto 4.11 AM Pooram\, and then Uthiram\nYogam: Brahma\nKaranam: Vishti\nAmirthathiyogam: Siddha Yogam\nSubayogam: Subayogam\nRaghu Kalam: 11.59 AM to 1.25 PM\nYemakandam: 7.41 AM to 9.07 AM\nKuligai: 9.07 AM to 10.33 AM\nGood time: 6.15 AM to 7.41 AM and 1.25 PM to 2.51 PM\nSun Rise: 6.15 AM\nSun Set: 5.43 PM\nChandhirashtamam: Makaram\nSoolam: North\nPrayatchittham: Milk / Paal\nSradhdhathithi: Ekadashi\nLocation: Hyderabad\, India
SUMMARY:Aippasi - 18 (04.11.2026) Wednesday
UID:india-2026-11-04@panchangam
END:VEVENT
BEGIN:VEVENT
DTSTART;VALUE=DATE:20261214
DESCRIPTION:Karthigai - 28 (14.12.2026) Monday\n\nYear: Parabhava Varudam (Parabhava Nama Samvathsaram)\nAyanam: Dhatchinayanam\nRuthu: Sarath Ruthu\nMonth: Karthigai Masam (Virutchigam Masam)\nPaksham: Shukla Paksham\nThithi: upto 7.16 PM Panchami\, thereafter Shashti\nDay: {Soma Vasaram} Monday\nNakshatthiram: upto 9.57 AM Thiruvonam\, and then Avittam\nYogam: Vyaghata\nKaranam: Balavai\nAmirthathiyogam: Siddha Yogam\nSubayogam: Subayogam\nRaghu Kalam: 8.00 AM to 9.24 AM\nYemakandam: 10.47 AM to 12.10 PM\nKuligai: 12.10 PM to 1.33 PM\nGood time: 6.37 AM to 8.00 AM and 12.10 PM to 1.33 PM\nSun Rise: 6.37 AM\nSun Set: 5.43 PM\nChandhirashtamam: Mithunam\nSoolam: East\nPrayatchittham: Curd / Thayir\nSradhdhathithi: Panchami\nLocation: Hyderabad\, India
SUMMARY:Karthigai - 28 (14.12.2026) Monday
UID:india-2026-12-14@panchangam
END:VEVENT
BEGIN:VEVENT
DTSTART;VALUE=DATE:20260308
DESCRIPTION:Maasi - 23 (08.03.2026) Sunday\n\nYear: Vishvavasu Varudam (Vishvavasu Nama Samvathsaram)\nAyanam: Utharayanam\nRuthu: Shishira Ruthu\nMonth: Maasi Masam (Kumbham Masam)\nPaksham: Krushna Paksham\nThithi: upto 9.11 PM Panchami\, thereafter Shashti\nDay: {Ravi Vasaram} Sunday\nNakshatthiram: upto 2.15 PM Swathi\, and then Visakam\nYogam: Dhruva\nKaranam: Kaulavai\nAmirthathiyogam: Siddha Yogam\nSubayogam: Subayogam\nRaghu Kalam: 4.54 PM to 6.24 PM\nYemakandam: 12.26 PM to 1.56 PM\nKuligai: 1.56 PM to 3.25 PM\nGood time: 6.29 AM to 7.58 AM and 12.26 PM to 1.56 PM\nSun Rise: 6.29 AM\nSun Set: 6.24 PM\nChandhirashtamam: Meenam\nSoolam: West\nPrayatchittham: Jaggery / Vellam\nSradhdhathithi: Panchami\nLocation: Hyderabad\, India
SUMMARY:Maasi - 23 (08.03.2026) Sunday
UID:india-2026-03-08@panchangam
END:VEVENT
BEGIN:VEVENT
DTSTART;VALUE=DATE:20260418
DESCRIPTION:Chithirai - 04 (18.04.2026) Saturday\n\nYear: Parabhava Varudam (Parabhava Nama Samvathsaram)\nAyanam: Utharayanam\nRuthu: Vasantha Ruthu\nMonth: Chithirai Masam (Mesham Masam)\nPaksham: Shukla Paksham\nThithi: upto 2.11 PM Prathamai\, thereafter Dwitiyai\nDay: {Sani Vasaram} Saturday\nNakshatthiram: upto 10.18 AM Ashwini\, and then Bharani\nYogam: Priti\nKaranam: Bavai\nAmirthathiyogam: Siddha Yogam\nSubayogam: Subayogam\nRaghu Kalam: 9.06 AM to 10.41 AM\nYemakandam: 1.49 PM to 3.24 PM\nKuligai: 3.24 PM to 4.58 PM\nGood time: 9.06 AM to 10.41 AM and 1.49 PM to 3.24 PM\nSun Rise: 5.58 AM\nSun Set: 6.32 PM\nChandhirashtamam: Kanni\nSoolam: East\nPrayatchittham: Curd / Thayir\nSradhdhathithi: Dwitiyai\nLocation: Hyderabad\, India
SUMMARY:Chithirai - 04 (18.04.2026) Saturday
UID:india-2026-04-18@panchangam
END:VEVENT
BEGIN:VEVENT
DTSTART;VALUE=DATE:20260528
DESCRIPTION:Vaikasi - 13 (28.05.2026) Thursday\n\nYear: Parabhava Varudam (Parabhava Nama Samvathsaram)\nAyanam: Utharayanam\nRuthu: Vasantha Ruthu\nMonth: Vaikasi Masam (Rishabam Masam)\nPaksham: Shukla Paksham\nThithi: upto 7.57 AM Dwadashi\, thereafter Trayodashi\nDay: {Guru Vasaram} Thursday\nNakshatthiram: upto 8.52 AM Chitthirai\, and then Swathi\nYogam: Variyana\nKaranam: Balavai\nAmirthathiyogam: Siddha Yogam\nSubayogam: Subayogam\nRaghu Kalam: 1.51 PM to 3.29 PM\nYemakandam: 5.41 AM to 7.19 AM\nKuligai: 7.19 AM to 8.57 AM\nGood time: 5.41 AM to 7.19 AM and 12.13 PM to 1.51 PM\nSun Rise: 5.41 AM\nSun Set: 6.45 PM\nChandhirashtamam: Meenam\nSoolam: South\nPrayatchittham: Oil / Thailam\nSradhdhathithi: Trayodashi\nLocation: Hyderabad\, India
SUMMARY:Vaikasi - 13 (28.05.2026) Thursday
UID:india-2026-05-28@panchangam
END:VEVENT
BEGIN:VEVENT
DESCRIPTION:Exact Astronomical Duration (Hyderabad\, India)
DTEND:20260124T191026Z
DTSTART:20260123T201631Z
SUMMARY:Shukla Shashti
UID:india-202601232016-6@tithi
END:VEVENT
BEGIN:VEVENT
DTSTART;VALUE=DATE:20260807
DESCRIPTION:Aadi - 21 (07.08.2026) Friday\n\nYear: Parabhava Varudam (Parabhava Nama Samvathsaram)\nAyanam: Dhatchinayanam\nRuthu: Grishma Ruthu\nMonth: Aadi Masam (Katakam Masam)\nPaksham: Krushna Paksham\nThithi: upto 4.37 PM Navami\, thereafter Dashami\nDay: {Sukra Vasaram} Friday\nNakshatthiram: upto 7.20 PM Karthigai\, and then Rohini\nYogam: Vriddhi\nKaranam: Garajai\nAmirthathiyogam: Siddha Yogam\nSubayogam: Subayogam\nRaghu Kalam: 10.45 AM to 12.21 PM\nYemakandam: 3.34 PM to 5.10 PM\nKuligai: 5.57 AM to 7.33 AM\nGood time: 5.57 AM to 7.33 AM and 12.21 PM to 1.57 PM\nSun Rise: 5.57 AM\nSun Set: 6.46 PM\nChandhirashtamam: Thulam\nSoolam: West\nPrayatchittham: Jaggery / Vellam\nSradhdhathithi: Navami\nLocation: Hyderabad\, India
SUMMARY:Aadi - 21 (07.08.2026) Friday
UID:india-2026-08-07@panchangam
END:VEVENT
BEGIN:VEVENT
DTSTART;VALUE=DATE:20260917
DESCRIPTION:Aavani - 31 (17.09.2026) Thursday\n\nYear: Parabhava Varudam (Parabhava Nama Samvathsaram)\nAyanam: Dhatchinayanam\nRuthu: Varsha Ruthu\nMonth: Aavani Masam (Simham Masam)\nPaksham: Shukla Paksham\nThithi: upto 10.48 AM Shashti\, thereafter Saptami\nDay: {Guru Vasaram} Thursday\nNakshatthiram: upto 8.38 PM Anusham\, and then Kettai\nYogam: Vishkambha\nKaranam: Thaitilai\nAmirthathiyogam: Siddha Yogam\nSubayogam: Subayogam\nRaghu Kalam: 1.42 PM to 3.13 PM\nYemakandam: 6.04 AM to 7.35 AM\nKuligai: 7.35 AM to 9.07 AM\nGood time: 6.04 AM to 7.35 AM and 12.10 PM to 1.42 PM\nSun Rise: 6.04 AM\nSun Set: 6.16 PM\nChandhirashtamam: Mesham\nSoolam: South\nPrayatchittham: Oil / Thailam\nSradhdhathithi: Saptami\nLocation: Hyderabad\, India
SUMMARY:Aavani - 31 (17.09.2026) Thursday
UID:india-2026-09-17@panchangam
END:VEVENT
BEGIN:VEVENT
DTSTART;VALUE=DATE:20261012
DESCRIPTION:Purattasi - 25 (12.10.2026) Monday\n\nYear: Parabhava Varudam (Parabhava Nama Samvathsaram)\nAyanam: Dhatchinayanam\nRuthu: Varsha Ruthu\nMonth: Purattasi Masam (Kanni Masam)\nPaksham: Shukla Paksham\nThithi: upto 10.13 PM Dwitiyai\, thereafter Tritiyai\nDay: {Soma Vasaram} Monday\nNakshatthiram: upto 12.35 AM Swathi\, and then Visakam\nYogam: Vishkambha\nKaranam: Balavai\nAmirthathiyogam: Siddha Yogam\nSubayogam: Subayogam\nRaghu Kalam: 7.36 AM to 9.05 AM\nYemakandam: 10.33 AM to 12.02 PM\nKuligai: 12.02 PM to 1.31 PM\nGood time: 6.08 AM to 7.36 AM and 12.02 PM to 1.31 PM\nSun Rise: 6.08 AM\nSun Set: 5.56 PM\nChandhirashtamam: Meenam\nSoolam: East\nPrayatchittham: Curd / Thayir\nSradhdhathithi: Dwitiyai\nLocation: Hyderabad\, India
SUMMARY:Purattasi - 25 (12.10.2026) Monday
UID:india-2026-10-12@panchangam
END:VEVENT
BEGIN:VEVENT
DTSTART;VALUE=DATE:20261122
DESCRIPTION:Karthigai - 06 (22.11.2026) Sunday\n\nYear: Parabhava Varudam (Parabhava Nama Samvathsaram)\nAyanam: Dhatchinayanam\nRuthu: Sarath Ruthu\nMonth: Karthigai Masam (Virutchigam Masam)\nPaksham: Shukla Paksham\nThithi: upto 2.37 AM Trayodashi\, thereafter Chadhurdasi\nDay: {Ravi Vasaram} Sunday\nNakshatthiram: upto 6.33 AM Revathi\, upto 4.53 AM Ashwini\, and then Bharani\nYogam: Vyatipata\nKaranam: Kaulavai\nAmirthathiyogam: Siddha Yogam\nSubayogam: Subayogam\nRaghu Kalam: 4.15 PM to 5.39 PM\nYemakandam: 12.02 PM to 1.26 PM\nKuligai: 1.26 PM to 2.50 PM\nGood time: 6.24 AM to 7.48 AM and 12.02 PM to 1.26 PM\nSun Rise: 6.24 AM\nSun Set: 5.39 PM\nChandhirashtamam: Simham\nSoolam: West\nPrayatchittham: Jaggery / Vellam\nSradhdhathithi: Trayodashi\nLocation: Hyderabad\, India
SUMMARY:Karthigai - 06 (22.11.2026) Sunday
UID:india-2026-11-22@panchangam
END:VEVENT
BEGIN:VEVENT
DTSTART;VALUE=DATE:20260106
DESCRIPTION:Margazhi - 15 (06.01.2026) Tuesday\n\nYear: Vishvavasu Varudam (Vishvavasu Nama Samvathsaram)\nAyanam: Utharayanam\nRuthu: Hemantha Ruthu\nMonth: Margazhi Masam (Dhanus Masam)\nPaksham: Krushna Paksham\nThithi: upto 8.02 AM Tritiyai\, thereafter Chathurthi\nDay: {Bhauma Vasaram} Tuesday\nNakshatthiram: upto 12.55 PM Aayilyam\, and then Magam\nYogam: Priti\nKaranam: Vishti\nAmirthathiyogam: Siddha Yogam\nSubayogam: Subayogam\nRaghu Kalam: 3.08 PM to 4.32 PM\nYemakandam: 9.34 AM to 10.58 AM\nKuligai: 10.58 AM to 12.21 PM\nGood time: 8.11 AM to 9.34 AM and 3.08 PM to 4.32 PM\nSun Rise: 6.47 AM\nSun Set: 5.55 PM\nChandhirashtamam: Dhanus\nSoolam: North\nPrayatchittham: Milk / Paal\nSradhdhathithi: Chathurthi\nLocation: Hyderabad\, India
SUMMARY:Margazhi - 15 (06.01.2026) Tuesday
UID:india-2026-01-06@panchangam
END:VEVENT
BEGIN:VEVENT
DTSTART;VALUE=DATE:20260216
DESCRIPTION:Maasi - 03 (16.02.2026) Monday\n\nYear: Vishvavasu Varudam (Vishvavasu Nama Samvathsaram)\nAyanam: Utharayanam\nRuthu: Shishira Ruthu\nMonth: Maasi Masam (Kumbham Masam)\nPaksham: Krushna Paksham\nThithi: upto 5.34 PM Chadhurdasi\, thereafter Amavasai\nDay: {Soma Vasaram} Monday\nNakshatthiram: upto 9.28 PM Thiruvonam\, and then Avittam\nYogam: Variyana\nKaranam: Shakuni\nAmirthathiyogam: Siddha Yogam\nSubayogam: Subayogam\nRaghu Kalam: 8.09 AM to 9.36 AM\nYemakandam: 11.03 AM to 12.30 PM\nKuligai: 12.30 PM to 1.57 PM\nGood time: 6.42 AM to 8.09 AM and 12.30 PM to 1.57 PM\nSun Rise: 6.42 AM\nSun Set: 6.18 PM\nChandhirashtamam: Mithunam\nSoolam: East\nPrayatchittham: Curd / Thayir\nSradhdhathithi: Chadhurdasi\nLocation: Hyderabad\, India
SUMMARY:Maasi - 03 (16.02.2026) Monday
UID:india-2026-02-16@panchangam
END:VEVENT
BEGIN:VEVENT
DTSTART;VALUE=DATE:20260326
DESCRIPTION:Panguni - 11 (26.03.2026) Thursday\n\nYear: Vishvavasu Varudam (Vishvavasu Nama Samvathsaram)\nAyanam: Utharayanam\nRuthu: Shishira Ruthu\nMonth: Panguni Masam (Meenam Masam)\nPaksham: Shukla Paksham\nThithi: upto 11.49 AM Ashtami\, thereafter Navami\nDay: {Guru Vasaram} Thursday\nNakshatthiram: upto 4.57 PM Thiruvathirai\, and then Punarpoosam\nYogam: Shobhana\nKaranam: Bavai\nAmirthathiyogam: Siddha Yogam\nSubayogam: Subayogam\nRaghu Kalam: 1.53 PM to 3.24 PM\nYemakandam: 6.15 AM to 7.47 AM\nKuligai: 7.47 AM to 9.18 AM\nGood time: 6.15 AM to 7.47 AM and 12.21 PM to 1.53 PM\nSun Rise: 6.15 AM\nSun Set: 6.28 PM\nChandhirashtamam: Virutchigam\nSoolam: South\nPrayatchittham: Oil / Thailam\nSradhdhathithi: Navami\nLocation: Hyderabad\, India
SUMMARY:Panguni - 11 (26.03.2026) Thursday
UID:india-2026-03-26@panchangam
END:VEVENT
BEGIN:VEVENT
DTSTART;VALUE=DATE:20260605
DESCRIPTION:Vaikasi - 21 (05.06.2026) Friday\n\nYear: Parabhava Varudam (Parabhava Nama Samvathsaram)\nAyanam: Utharayanam\nRuthu: Vasantha Ruthu\nMonth: Vaikasi Masam (Rishabam Masam)\nPaksham: Krushna Paksham\nThithi: upto 1.20 AM Panchami\, thereafter Shashti\nDay: {Sukra Vasaram} Friday\nNakshatthiram: Thiruvonam\nYogam: Brahma\nKaranam: Kaulavai\nAmirthathiyogam: Siddha Yogam\nSubayogam: Subayogam\nRaghu Kalam: 10.36 AM to 12.14 PM\nYemakandam: 3.31 PM to 5.09 PM\nKuligai: 5.40 AM to 7.19 AM\nGood time: 5.40 AM to 7.19 AM and 12.14 PM to 1.52 PM\nSun Rise: 5.40 AM\nSun Set: 6.48 PM\nChandhirashtamam: Mithunam\nSoolam: West\nPrayatchittham: Jaggery / Vellam\nSradhdhathithi: Panchami\nLocation: Hyderabad\, India
SUMMARY:Vaikasi - 21 (05.06.2026) Friday
UID:india-2026-06-05@panchangam
END:VEVENT
END:VCALENDAR